article,article_url,date
"Obamas Rede vor der Uno Das Vermächtnis des Präsidenten Es ist schon eine Art Abschied: Zum letzten Mal spricht Barack Obama vor der Uno. Sein großer Auftritt ist auch ein Appell an die Welt, sich zusammenzureißen. Aus New York berichtet Veit Medick Stephen Voss Veit Medick Jahrgang 1980, studierte Politikwissenschaften und Internationale Beziehungen in Göttingen, Kairo und Berlin. Ab 2007 Volontariat bei der \"tageszeitung\" in Berlin, anschließend Redakteur im Ressort Innenpolitik. Ab 2009 Redakteur im Hauptstadtbüro von SPIEGEL ONLINE. Seit Juli 2015 Korrespondent in Washington. Seit August 2017 Redakteur im Hauptstadtbüro des SPIEGEL. E-Mail: Veit.Medick@spiegel.de Twitter: @vmedick folgen Mehr Artikel von Veit Medick Die Generalversammlung der Vereinten Nationen ist gemeinhin eine sehr ernste Veranstaltung, aber an diesem Dienstag gibt es einen kurzen Moment der Heiterkeit. Barack Obama steht am Podium, und der US-Präsident teilt eine Beobachtung, die er in seiner Amtszeit machte. \"Viele Menschen glauben entweder, dass Washington an allen Problemen Schuld ist, oder dass Washington alle Probleme lösen muss\", ruft er. \"Und vielleicht glauben das auch in Washington zu viele.\" Das ist eine gute Umschreibung eines Dilemmas, in dem amerikanische Außenpolitik seit jeher steckt, und ein passender Satz für eine Rede, die aus Obamas Sicht in vielerlei Hinsicht problematisch ist. Er spricht zum letzten Mal vor der Uno , in New York blicken bereits viele auf seine möglichen Nachfolger und pünktlich zum Ende seiner Amtszeit ist die Welt in großer Unruhe. Für den Präsidenten ist das deshalb unangenehm, weil er sich fragen lassen muss, welchen Anteil er und seine Regierung daran eigentlich haben. Nun sind Reden vor der Uno selten geprägt von Selbstkritik, und auch Obama macht da keine Ausnahme. Allenfalls peripher streift der US-Präsident die Tagespolitik, im Großen und Ganzen ist es eine Rede über das Große und Ganze. Mehr Demokratie wagen, die Öffnung zulassen, die Vielfalt umarmen - das ist sein Appell. Sehen Sie hier einen Ausschnitt aus Obamas Rede im Original: \"Die Welt ist zu klein, als dass wir einfach eine Mauer bauen könnten, um uns vor den Folgen auf unsere Gesellschaften zu schützen\", sagt er. Obama redet der Welt ins Gewissen, zum letzten Mal, wenn man so will, und es ist auch der Versuch, den versammelten Staatschefs zu signalisieren, dass Amerika alleine die globalen Probleme nicht lösen kann. Er dankte ausdrücklich Deutschland und Kanada für die Öffnung der Grenzen für Schutzsuchende. Diese Länder hätten in einer \"Krise epischen Ausmaßes\" Verantwortung übernommen. Namentlich dankte Obama auch Bundeskanzlerin Angela Merkel. Für eine Politik der Offenheit gegenüber Flüchtlingen müssten Politiker oft einen hohen Preis zahlen. \"Wir haben jetzt alle die Wahl\" Es ist ein feiner Auftritt, Obama kann solche Reden halten, in dem jeder seinen Platz und seine Funktion zu haben scheint. Sie passen zu ihm, jedenfalls hat es den Anschein. Hoffnung, Frieden, Dialog: Wer den Präsidenten reden hört, möchte selten widersprechen, aber natürlich wirken seine Auftritte auch ein wenig aus der Zeit gefallen, wenn man sie mit der Realität kontrastiert. Obama ahnt das. Er will deshalb auch die finsteren Kapitel dieser Zeit nicht verschweigen, den Vormarsch des Nationalismus, die Anziehungskraft fundamentalistischer Ideologien, die Kriege in Syrien und anderen Teilen der Erde. \"Das ist das Paradox, das unsere Welt heutzutage charakterisiert\", ruft er. \"Wir haben jetzt alle die Wahl. Wir können den Weg nach vorne suchen, oder uns in eine gespaltene Welt zurückziehen.\" Obama, das fällt auf, gibt sich erneut als Anwalt der jüngeren Generation. Ihr Ruf nach mehr Teilhabe und Mitsprache könne nirgends mehr ignoriert werden, sagt der US-Präsident. Donald Trump erwähnt Obama nicht, aber mit jeder Silbe wird klar, wie sehr seine Präsidentschaft das komplette Gegenteil der Vorstellungen des Republikaners verkörpert. Obama dekonstruiert das Konzept des \"starken Mannes\", sagt, dass sämtliche Politiker, die sich als solche sähen, irgendwann vor dem Dilemma stünden, entweder ihre Bevölkerung dauerhaft unterdrücken oder aber äußere Feinde zum Sündenbock machen zu müssen. Sehr offensiv wirbt er für eine Lösung der Flüchtlingskrise und mahnt zu einer Politik der \"offenen Herzen\": \"Wir müssen uns vorstellen, wie es für uns und unsere Familien wäre, wenn das Unvorstellbare passiert.\" Obama zieht außenpolitisch Bilanz Verglichen mit dem Sound des amerikanischen Wahlkampfs sind diese Sätze äußerst wohltuend. Aber natürlich ist sein Auftritt auch eine elegante Lösung, seine eigene Bilanz möglichst vorteilhaft hineinweben zu können. Obama erwähnt den Ausgleich mit Kuba, den er angestoßen hat. Er spricht über den Friedensvertrag in Kolumbien, in dem seine Regierung eine Rolle gespielt hat und erwähnt das Atom-Abkommen mit Iran, um zu belegen, wie viel Macht die Diplomatie haben kann. Tatsächlich hat der US-Präsident die amerikanische Außenpolitik auf vielen Feldern verändert. Dazu gehört auch, dass Obama das Engagement der USA im Mittleren Osten zurückgefahren hat, nur ist noch längst nicht geklärt, wie weise das wirklich war. Ein Drama nämlich wird besonders mit seiner Präsidentschaft verbunden bleiben: Der Bürgerkrieg in Syrien. Amerika, das muss sich Obama vorwerfen lassen, fehlte in dem so komplizierten Konflikt von Beginn an eine klare Strategie. Die US-Regierung ging stets von der Prämisse aus, sich nicht noch einmal so leichtfertig in einen Krieg zu begeben, wie einst im Irak, allerdings verhedderte sie sich dann in einer Mischung aus halbherzigem Engagement und diplomatischen Fehlern. Jetzt scheint der Konflikt völlig verfahren, die Aufkündigung des jüngsten Waffenstillstands und der tragische Angriff auf den Uno-Hilfskonvoi zeigen in aller Deutlichkeit, dass Obama einfach kein Fortschritt gelingen will. Sehr konkret wird Obama beim Thema Syrien nicht. Im Hintergrund versucht sein Außenminister, den Waffenstillstand und die militärische Abstimmung mit Russland noch irgendwie zu retten. Obama belässt es auch hier bei einem Appell an die Weltgemeinschaft. \"In Syrien gibt es keinen militärischen Sieg zu gewinnen\", ruft er. \"Wir müssen den harten Weg der Diplomatie weiterverfolgen.\"",http://www.spiegel.de/politik/ausland/barack-obama-vor-der-uno-das-vermaechtnis-des-praesidenten-a-1113162.html,2016-09-20T00:00:00.000Z
"Köln Flüchtling wegen Extremismus-Verdacht festgenommen Die Polizei hat einen 16-jährigen Flüchtling in Köln festgenommen, weil die Sicherheitsbehörden ihn als \"ernstzunehmende Gefahr\" einschätzten. Der Syrer soll sich innerhalb kurzer Zeit radikalisiert haben. Noch sind die genauen Details der Festnahme eines 16 Jahre alten Flüchtlings in einer Unterkunft in Köln unklar. Bekannt ist bisher nur: Von dem Syrer ging nach Angaben der Polizei eine \"ernstzunehmende Gefahr\" aus. Der Jugendliche soll sich in kurzer Zeit radikalisiert haben. Eine Spezialeinheit nahm ihn am Dienstag nach einem Bericht der \"Kölnischen Rundschau\" in einer Turnhalle in Köln-Porz fest. Dort hat die Stadt Asylbewerber untergebracht. Bei dem Einsatz wurden drei Flüchtlinge leicht verletzt, teilte die Polizei mit. Weitere Einzelheiten gaben die Behörden bisher nicht bekannt.",http://www.spiegel.de/politik/deutschland/fluechtling-in-koeln-wegen-extremismus-verdacht-festgenommen-a-1113161.html,2016-09-20T00:00:00.000Z
"CSU nach Merkels Signal zur Flüchtlingspolitik Nachricht zugestellt Herrscht bald wieder Frieden in der Union? CSU-Chef Seehofer hat die selbstkritische Botschaft der Kanzlerin vernommen, nun muss er eine Antwort finden. Die ist längst nicht klar. Von Sebastian Fischer Christian O. Bruch/ laif Sebastian Fischer Jahrgang 1978, geboren in Kassel. Studium der Politologie, Geschichte und Kommunikationswissenschaft an den Universitäten München und Göttingen. Ausbildung an der Deutschen Journalistenschule (DJS) in München. Ab Oktober 2006 München-Korrespondent von SPIEGEL ONLINE, seit Dezember 2009 im Berliner Büro. Von August 2011 bis Juli 2015 USA-Korrespondent in Washington. Seit Januar 2016 stellvertretender Ressortleiter im Politik-Ressort mit Sitz im Hauptstadtbüro, seit August 2017 Ressortleiter. E-Mail: Sebastian.Fischer@spiegel.de Twitter: @sefi99 folgen Facebook: Zum Profil google+: Zum Profil Instagram: Bilder ansehen Mehr Artikel von Sebastian Fischer Sie wollten ohnehin über Flüchtlingspolitik sprechen, die CSU-Landtagsabgeordneten und Parteichef Horst Seehofer auf ihrer gegenwärtigen Klausur im fränkischen Kloster Banz. Nun aber haben sie noch ein bisschen mehr zu beraten in Franken, aber auch in München und Berlin: das Signal der Kanzlerin. Denn der bemerkenswerte, weil selbstkritische Auftritt Angela Merkels am Montag nach der Berliner CDU-Wahlpleite - in dessen Rahmen sie einerseits ihren Wir-schaffen-das-Satz relativierte, andererseits aber den Grundlinien ihrer Flüchtlingspolitik eben nicht abschwor - harrt nun einer Antwort aus der Schwesterpartei. Was nun, CSU? Das Mea-culpa-Signal der Kanzlerin ist ja das, was Seehofer all die Monate gefordert hatte. Es bedürfe nicht nur des stillen Kurswechsels, den Merkel bereits vollzogen habe - heißt: EU-Türkei-Deal, Balkanroute dicht, Asylrechtsverschärfungen - sondern auch eines öffentlichen Auftritts, der das für alle sichtbar mache. So wurde es zumindest stets in der CSU gewünscht. Der Tenor, der sich am Dienstag durch nahezu alle CSU-Reaktionen zieht: Wichtiges Signal der Kanzlerin, das Projekt Wiederannäherung kann beginnen. Im Video: Merkels Berliner Signal CSU-Mann Stephan Mayer, innenpolitischer Sprecher der Unionsfraktion und damit einflussreiche Figur in der Flüchtlingspolitik, sagt, er habe \"ausgesprochen großen Respekt\" vor der Erklärung Merkels, sie habe \"das Signal gesendet, dass sie verstanden hat\". Dies sei eine \"ideale Voraussetzung\", um die verbleibenden \"Irritationen zu begradigen\". Ähnlich klingt das auch bei CSU-Agrarminister Christian Schmidt: \"Hochrespektabler Akt\", aber noch sei man nicht auf der Zielgeraden. Welche \"Irritation\" aber besteht jetzt noch? Natürlich die Frage einer Obergrenze für Flüchtlinge. Merkel hat dies auch am Montag wieder explizit ausgeschlossen, eine \"statische Obergrenze\" abgelehnt. Letztlich - und das ist wichtig - geht es auch bei diesem Konflikt wieder um Semantik. Denn auch wenn Merkel keine explizite Obergrenze ziehen will - aus verfassungsrechtlichen, aus ethischen Gründen - dann will sie jedoch, genau wie Seehofer, nicht noch einmal derart hohe Flüchtlingszahlen wie im Jahr 2015. Auch das hat sie sehr deutlich gemacht (Lesen Sie hier eine Analyse über den Merkel-Auftritt). Der Ball liegt nun bei der CSU. Seehofer muss nach Merkels Signal einen Weg finden, die Obergrenzenfrage semantisch so zu lösen, dass seine Partei mit an Bord ist. Und Merkel wird ihm dabei helfen müssen. Im Grunde genommen hat der CSU-Chef auch indirekt schon einen Plan skizziert, wenn man sich seine Aussagen im aktuellen SPIEGEL-Interview genau anschaut. Seehofer sagt dort nämlich einerseits: \"Wir werden auf die Obergrenze von 200.000 nicht verzichten. Da geht es schlicht und einfach um unsere Glaubwürdigkeit.\" Andererseits heißt es aber auch: \"Wir wollen ein klares Regelwerk, das nachvollziehbar und glaubwürdig die Zuwanderung auf ein vernünftiges Maß begrenzt. [...] Ja, wir wollen eine Politik, die diese Obergrenze gewährleistet.\" Wenn also Merkel eine Politik macht, die diese Obergrenze gewährleistet? Und die CSU den Begriff in ihr Nebenwahlprogramm, beim letzten Mal \"Bayernplan\" genannt, hineinschreibt? Dann wären Seehofers Forderungen doch erfüllt. Innenexperte Mayer sagt: \"Die Obergrenze ist wichtig, weil davon ein wichtiges Signal ausgeht.\" Entscheidend sei aber \"nicht die Terminologie, sondern die Botschaft, die davon ausgeht\". Noch deutlicher wird es bei CSU-Landesgruppenchefin Gerda Hasselfeldt: Ihr persönlich gehe es nicht um den Begriff, anstatt von Obergrenze könne auch von \"Richtgröße\" oder \"Orientierungsgröße\" gesprochen werden. Was fällt auf? Mayer und Hasselfeldt sind CSU-Bundespolitiker; Hasselfeldt gilt in München zudem als Merkel-Versteherin. Auf Landesebene ist die Reaktion viel zurückhaltender. Und die Landesebene ist bei der CSU wichtiger, weil sie dort ihre absoluten Mehrheiten holt, nicht im Bund. So begrüßt zwar Seehofer im Kreise seiner bayerischen Abgeordneten bei der Klausurtagung in Kloster Banz die selbstkritischen Töne Merkels, will darin aber noch keinen Kursschwenk erkennen. Manches sei bemerkenswert, manches erfreulich, es sei aber nicht die Wende. Es brauche eben keine Wende in der Erklärung der Politik, sondern in der Politik. Im Klartext: Nachricht zugestellt, Seehofer hat Merkels Botschaft verstanden. Aber er will sich eine Einigung weiter vergolden lassen, er will inhaltlich für seine Partei möglichst viel abgreifen. Denn er hat auch ein anderes Signal vernommen, das Merkel am Montag indirekt mitgesendet hat: dass sie noch einmal als Kanzlerkandidatin antreten möchte. DPA Rivalen Seehofer, Söder Seehofer wird also den Zeitpunkt seiner Zustimmung zur Kanzlerkandidatur so lange wie möglich hinauszögern, frühestens denkbar wäre das wohl vor dem CSU-Parteitag, der im November stattfindet. Im Dezember kommt dann die CDU zu ihrem Parteitag zusammen, im Vorfeld wäre eine weitere Möglichkeit zur Einigung. Seehofer könnte dann zur CDU reisen und Merkel als Kanzlerkandidatin ausrufen. Der späteste Zeitpunkt für eine inhaltliche wie personelle Einigung für die Bundestagswahl, so heißt es in der CSU, wäre wohl nach der traditionellen Kreuther Winterklausur. Danach müsse Klarheit herrschen, wolle man noch erfolgreichen Wahlkampf machen. Für Seehofer geht es allerdings bei dem Streit nicht allein um Merkel - und das macht die Sache kompliziert. Denn der CSU-Chef kämpft parallel einen Kampf in Bayern: Um sein Amt, um seine Nachfolge. Kronprinz Markus Söder macht Druck, lange warten will er nicht mehr. Kein Zufall, dass Seehofer immer wieder die Personalspekulation befeuert hat, er könne Söder nach Berlin schicken. Was der stets vehement ablehnt. Söder wiederum würde jedes Schwächezeichen Seehofers in der Flüchtlingspolitik ausnutzen. Kein Zufall, dass er bereits früh nach Merkels Signal auf Sendung ging, ihre Aussagen als \"richtigen Ansatz\" würdigte - aber gleichzeitig darauf achtete, nicht zu viel Dampf aus dem Kessel entweichen zu lassen: Die Forderung nach einer Obergrenze sei nicht verhandelbar, der Begriff sei \"ein Symbol dafür, dass das bisherige System nicht funktioniert und dass es sich ändern muss\", sagte Söder der \"Welt\". So macht er Seehofer die Räume eng. Es geht damit in den kommenden Wochen nicht allein um eine Einigung zwischen Seehofer und Merkel. Es geht vor allem auch um den Kampf zwischen Seehofer und Söder. Und der beginnt gerade erst.",http://www.spiegel.de/politik/deutschland/merkels-signal-in-der-fluechtlingspolitik-seehofer-hat-verstanden-a-1113102.html,2016-09-20T00:00:00.000Z
"Staatsverschuldung Sechs Eurostaaten könnten Defizitgrenze übersteigen Mehr Schulden als erlaubt: Sechs Euroländer könnten die verbindlichen Defizitziele im kommenden Jahr verfehlen, schätzt die EU-Kommission. Besonders heikel wird es für Italien. Die Staatshaushalte von Belgien, Finnland, Italien, Litauen, Slowenien und Zypern könnten im kommenden Jahr über der verbindlichen Defizitgrenze liegen, teilte die EU-Kommission mit. Vor allem für Italien wird es schwierig: Das Land rechnet für das Jahr 2017 mit einer Neuverschuldung von 2,3 Prozent - mit Brüssel waren Anfang des Jahres allerdings noch 1,8 Prozent vereinbart worden. Zwar gilt nach den Maastricht-Kriterien eine Neuverschuldungsobergrenze von drei Prozent des Bruttoinlandsprodukts. Doch für Italien bestehen aufgrund der hohen Gesamtverschuldung des Landes strengere Auflagen. Italiens Premierminister Matteo Renzi hatte in Brüssel wiederholt mehr Spielraum für Staatsausgaben gefordert. Der zuständige EU-Kommissar Pierre Moscovici kündigte nun an, dass Kosten für die Bewältigung der Flüchtlingskrise sowie für Schäden der verheerenden Erdbeben im Jahr 2015 bei der letztendlichen Haushaltsentscheidung im kommenden Jahr berücksichtigt werden könnten.",http://www.spiegel.de/wirtschaft/soziales/sechs-euro-staaten-koennten-2017-defizitgrenze-verfehlen-a-1121607.html,2016-11-16T00:00:00.000Z
"Messerattacke auf Freundin Prozess gegen mutmaßlichen Mörder von Reutlingen begonnen Die Anklage lautet auf Mord, versuchten Mord und gefährliche Körperverletzung: In Tübingen steht ein 21-Jähriger vor Gericht. Er soll seine Freundin mit einem Dönermesser getötet haben. Ein halbes Jahr nach der tödlichen Attacke mit einem Dönermesser in Reutlingen hat der Prozess gegen den mutmaßlichen Täter begonnen. Dem 21-Jährigen wird in dem am Dienstag vor dem Landgericht Tübingen gestarteten Verfahren vorgeworfen, im Juli zunächst seine Freundin mit dem Messer getötet und danach weitere Menschen verletzt zu haben. Der Angeklagte muss sich in Tübingen wegen Mordes, versuchten Mordes und gefährlicher Körperverletzung verantworten. Die Tat hatte im vergangenen Sommer bundesweit für Entsetzen gesorgt, auch weil sich damals innerhalb weniger Tage mehrere Gewalttaten wie etwa der Amoklauf von München ereigneten. Hinweise auf einen extremistischen Hintergrund gibt es nicht. Zum Prozessauftakt ging es noch nicht um die Tat, sondern um das Alter des Angeklagten. Davon hängt ab, ob der Fall weiter vor dem Schwurgericht oder doch vor der Jugendkammer verhandelt wird. Mutter des Verdächtigen zu Alter befragt Der Flüchtling aus Syrien gab an, am 16. November 1995 geboren zu sein. Dann wäre er noch nicht 21 Jahre alt gewesen. In den vom Gericht verlesenen offiziellen Urkunden steht als Geburtsdatum der 1. Januar 1995. Die Mutter erklärte nach Angaben von Zeugen in einem Telefongespräch mit der Polizei an, dass er am 16. November 1994 geboren und danach offiziell mit dem Datum 1. Januar 1995 registriert worden sei. Das Gericht beauftragte einen Polizeibeamten und einen Dolmetscher damit, erneut mit den Eltern zu telefonieren. Zu diesem Gespräch kam es zunächst nicht. Das Schwurgericht entschied aber aufgrund der bisherigen Erkenntnisse, das Verfahren vorerst nicht abzugeben. Das Gericht gehe davon aus, dass es zuständig bleiben sollte, sagte der Vorsitzende Richter. Nach Beziehungstat weitere Menschen verletzt Der laut Staatsanwaltschaft im Juni 2015 nach Deutschland eingereiste Mann arbeitete im Sommer 2016 in Reutlingen in einem türkischen Restaurant, wo er seine spätere Freundin, eine 45-jährige Frau aus Polen, kennenlernte. Ihm wird vorgeworfen, sie am 24. Juli mit einem 60 Zentimeter langen Dönermesser getötet zu haben. Das Messer soll er vorher aus der Restaurantküche mitgenommen haben. Direkt nach der Tat soll der Angeklagte vor dem Restaurant zwei Gäste angegriffen und dabei einen Mann schwer verletzt haben. Er schlug laut Anklage zudem am Busbahnhof die Scheiben eines Autos ein und attackierte die darin sitzende Fahrerin und ihren Beifahrer. Die Frau erlitt Schnittverletzungen am Arm, konnte aber ihren Wagen starten und wegfahren. Der Angeklagte soll in der Innenstadt noch weitere Menschen bedroht haben, bevor er beim Überqueren einer Straße von einem Auto erfasst wurde. Polizeibeamten gelang es daraufhin, ihn festzunehmen. Seither sitzt er in Untersuchungshaft. Der Prozess in Tübingen ist bislang bis April terminiert.",http://www.spiegel.de/panorama/justiz/messerattacke-von-reutlingen-prozess-gegen-mutmasslichen-moerder-beginnt-a-1131588.html,2017-01-24T00:00:00.000Z
