article,article_url,date
"Angeblicher Todesfall am Lageso in Berlin \"Alles frei erfunden\" Die Berliner Polizei hat den Helfer befragt, der vom angeblichen Tod eines Flüchtlings berichtet hatte. Der Mann gab demnach zu, dass die Geschichte erfunden ist. Es gibt den toten Syrer nicht. Die Meldung, in Berlin sei ein syrischer Flüchtling nach langem Warten vor dem Lageso gestorben, ist nach Angaben der Polizei falsch. Ein Flüchtlingshelfer hatte zunächst vom angeblichen Tod des Syrers berichtet. Doch nach der Vernehmung des Mannes teilte ein Behördensprecher am späten Mittwochabend mit: \"Er hat zugegeben, dass er alles frei erfunden hat.\" Bereits nach der ersten Befragung des Mannes hatte eine Polizeisprecherin klargestellt: \"Wir haben keinen toten Flüchtling.\" Der Helfer habe zwar \"die ganze Republik verrückt gemacht\" - aber eine Straftat sei sein folgenreicher Internet-Eintrag nicht. Der Helfer hatte bei Facebook mitgeteilt, den angeblich stark fiebernden Flüchtling zunächst zu sich nach Hause geholt zu haben . Wegen seines schlechten Zustandes sei der Syrer dann von einem Krankenwagen abgeholt worden, sei aber auf dem Weg in die Klinik gestorben. Die Flüchtlingsinitiative \"Moabit hilft\" hatte die angebliche Information über den verstorbenen Syrer verbreitet. Auch SPIEGEL ONLINE hatte nach Rücksprache mit der Initiative über den Fall berichtet. Eine Sprecherin von \"Moabit hilft\" hatte den Helfer als sehr vertrauenswürdig bezeichnet. Er habe per SMS mitgeteilt, sich zunächst nicht äußern und sich noch früh genug an die zuständigen Behörden wenden zu wollen. Den Angaben zufolge verbarrikadierte sich der Mann zwischenzeitlich in seiner Wohnung. Im Laufe des Tages verdichteten sich die Zweifel an seiner Geschichte. Vor der Polizei hatte bereits die Senatsverwaltung für Gesundheit und Soziales betont , die Behauptung habe sich nicht bestätigen lassen. \"Wir haben alle Aufnahme-Krankenhäuser abgefragt\", sagte eine Sprecherin. \"Dort gibt es keine Informationen darüber.\" Auch ein Sprecher der Feuerwehr sagte, sämtliche Einsätze des Rettungsdienstes in dem entsprechenden Zeitraum seien geprüft worden - allerdings ohne Ergebnis. Das Lageso steht seit Monaten schwer in der Kritik . Zuletzt war mit Sebastian Muschter ein Unternehmensberater an die Spitze der Behörde gerückt . Das Bündnis \"Moabit hilft\" hatte einen Rücktritt des Sozialsenators Mario Czaja ins Spiel gebracht, sollte sich der Fall bewahrheiten. Der CDU-Politiker sagte nun in der RBB-\"Abendschau\" , eine weitere enge Zusammenarbeit mit den ehrenamtlichen Flüchtlingshelfern sei sehr wichtig. Mit Blick auf den Helfer ergänzte Czaja: \"Ich bin nicht der Auffassung, dass man zu Vorverurteilungen oder Allgemeinverurteilungen kommen sollte, wenn eine Person etwas getan hat, das für uns schwer verständlich ist.\"",http://www.spiegel.de/politik/deutschland/lageso-in-berlin-den-toten-fluechtling-gibt-es-laut-polizei-nicht-a-1074309.html,2016-01-27T00:00:00.000Z
"Neue Flüchtlingsroute Angst an der Adria Italiens Geheimdienste sind besorgt: Wenn der Landweg über den Balkan versperrt ist, könnten bald Zehntausende Flüchtlinge über die Adria kommen. Lässt sich auch die Seegrenze abriegeln? Von Hans-Jürgen Schlamp , Rom Hans-Jürgen Schlamp Mehr Artikel von Hans-Jürgen Schlamp DPA Am Strand in Durres: Italien ist weit weg und doch so nah - nur 80 Kilometer übers Mittelmeer. Wenig Zeit? Am Textende gibt's eine Zusammenfassung. Vom albanischen Hafen Durres bis nach Italien sind es gerade einmal 80 Kilometer. Ein paar Stunden im Boot über die Adria, um hineinzukommen in die \"Festung Europa\". Von Montenegro aus ist es nicht viel weiter. In beiden Ländern bereitet sich ein ganzer Geschäftszweig auf die anstehenden Großaufträge vor. Als \"Schleuser\" werden sie von den einen gejagt, von den anderen als \"Fluchthelfer\" gesucht und bezahlt. Die Warnung der italienischen Geheimdienste an ihre Regierung ist deutlich: Falls die Grenzen auf dem Balkan geschlossen werden oder nur noch bestimmte Nationalitäten weiter nach Norden ziehen dürfen, werde die Seeroute über die Adria wieder geöffnet. Dann werden Männer, Frauen, Kinder auf Schlauchbooten oder auf seeuntüchtigen Kuttern zusammengepfercht übers Wasser transportiert und an Italiens Küste landen oder stranden. Die Regierung brachte das Problem am Montag dieser Woche beim Treffen der EU-Innenminister in Amsterdam zur Sprache. Rom fürchtet den Ernstfall: Was tun, wenn Hunderttausende von Osten her übers Meer kommen? Verschärft wurde die Lage am Mittwochabend: Mazedonien hat tatsächlich für einige Stunden seine Grenze zu Griechenland für Flüchtlinge geschlossen - und damit die sogenannte Balkanroute abgeriegelt. Gewiss, über die Adria reisen Flüchtlinge seit vielen Jahren ein. Mal mehr, mal weniger. Die meisten wollen gar nicht in Italien bleiben, sondern weiter nach Skandinavien, in die Niederlande, nach Frankreich und vor allem nach Deutschland. So haben die italienischen Behörden sie meist durchziehen lassen. Doch die Ausgänge nach Norden sind heute weitgehend geschlossen. Frankreich hat die Grenze dichtgemacht, um Terroristen fernzuhalten, wie Staatspräsident François Hollande erklärt. Österreich igelt sich ein, weil es sich \"überlastet\" fühlt. Und die Schweiz lässt schon gar keine \"Flüchtlingsströme\" in ihre aufgeräumte Eidgenossenschaft. Jetzt redet man auch in Deutschland über \"Begrenzungen\". Was also tun? Jedenfalls \"keine Mauern bauen\", sagt Italiens Premierminister Matteo Renzi. Europa habe Jahrzehnte daran gearbeitet, Mauern abzureißen. \"Neue bauen, heißt, uns selbst zu verraten.\" Nur ein funktionierendes Ordnungs- und Verteilungssystem könne die aktuellen Probleme lösen, davon ist Renzi überzeugt. Deshalb werden in Italien jetzt eilig große Hotspots errichtet, Zentren zur Erstaufnahme von Flüchtlingen, in denen diese registriert und katalogisiert werden: Wer hat eine Chance auf Asyl oder ein Bleiberecht, wer soll wieder weggeschickt werden? Dasselbe sollen, müssten, wollten auch die Griechen machen - aber da hapert es noch. Deshalb wird die Regierung in Athen mal wieder angegangen , aus Berlin wie aus Rom. AFP Griechisch-mazedonische Grenze: Was tun, wenn Hunderttausende vom Osten übers Meer kommen? Sind die Migranten in Griechenland oder in Italien erfasst, folgt Phase zwei des Planes, den EU-Kommissionschef Jean-Claude Juncker bis zum EU-Gipfeltreffen am 18. Februar im Detail ausarbeiten soll: Die Abschiebung der Einwanderer ohne Bleiberecht und die \"automatische\" Verteilung der anderen auf alle EU-Länder. Wer wie viele nehmen muss, richtet sich dabei nach der Wirtschaftskraft, der Bevölkerungszahl und dem Ausmaß der Arbeitslosigkeit eines jeden Landes.   Klingt gut, gerecht, machbar - Regierungschef Renzi hält deshalb auch flammende Plädoyers dafür. Aber die Chancen auf Umsetzung stehen nicht gut. Eine Reihe der 28 EU-Mitgliedstaaten ist vehement dagegen. Und bislang hat ja nicht einmal das von allen beschlossene EU-weite einmalige \"Umverteilen\" von 160.000 Flüchtlingen funktioniert, die in Italien und Griechenland gestrandet sind. Für gerade einmal 331 Menschen fand sich bislang ein Aufnahmeland. Weil die Aussichten für eine gerechtere Verteilung eher dürftig sind, fordert Italiens Innenminister Angelino Alfano deshalb beinahe täglich, \"die Kontrollen der EU-Außengrenzen zu verstärken\". Auch das klingt plausibel, ist es aber nur in der Theorie. Das haben die Entwicklungen auf der Adria-Flüchtlingsroute im vergangenen Vierteljahrhundert gezeigt. Ein kurzer Rückblick: 10.000 Menschen auf der \"Vlora\": Keiner darf bleiben Am 8. August 1991 kam der schrottreife Frachter \"Vlora\" mit 10.000 Menschen an Bord aus Albanien in Bari an: das erste Dickschiff mit Flüchtlingen, die \"Einweihung\" der Adriaroute gewissermaßen und der restriktiven Einwanderungspolitik. \"Keiner darf bleiben\", entschied damals der christdemokratische Regierungschef in Rom, Giulio Andreotti. Schließlich waren zuvor bereits nach und nach 20.000 bis 30.000 Albaner eingereist, seit das kommunistische Regime seine Bürger nicht mehr erfolgreich einsperren konnte. Mehr Albaner wollte Italien nicht. AP 1991 flohen Zigtausende auf dem Schrottdampfer \"Vlora\" aus dem Hungerland Albanien ins italienische Bari Die \"Vlora\"-Passagiere durften nicht an Land. Es gab Krawalle, Selbstmorddrohungen, der SPIEGEL beschrieb damals die apokalyptischen Szenen. Schließlich wurden die Menschen ins Fußballstadion gesperrt und am Ende in Schiffen und Flugzeugen zurücktransportiert. Dazu gab es \"Aufbauhilfe\" für Albanien. Das, was sich heute viele wünschen, wurde damals praktiziert: Härte zeigen, zurückschicken! Was kümmert uns die Uno-Flüchtlingskonvention?   Nur gebracht hat es nicht viel. Viele Albaner versuchten erneut, nach Italien zu kommen. Wenn nicht legal, dann eben illegal. Die Mafia tat sich mit den albanischen Schlepperbanden zusammen, beide machten Riesengeschäfte. Auf der anderen Seite wurde Italiens Küstenwache mit Millionenaufwand hochgerüstet. Aber es half einfach nichts: Sollte sie auf die Menschen schießen? Deren Schiffe versenken? Jeden Tag, jede Nacht kamen Boote. Bald lebten knapp 500.000 Albaner in Italien. Mehr wollten das offenbar nicht, denn die Zahl blieb seither ziemlich konstant. Dafür kamen Menschen aus anderen Elends- oder Kriegsregionen, viele aus asiatischen Ländern. Und demnächst werden es überwiegend Flüchtlinge aus Syrien und Afghanistan sein, die auf Schlauchbooten oder seeuntüchtigen Kuttern den riskanten Sprung über die Adria nach Europa wagen. Vom albanischen Durres nach Italien sind es, wie gesagt, 80 Kilometer - von der türkischen Küste zur griechischen Insel Lesbos gerade einmal acht. Vor Lesbos ertrinken mit trauriger Regelmäßigkeit Männer, Frauen und Kinder im Mittelmeer. Was auf der zehnfachen Strecke passieren könnte, mag sich wohl niemand ausmalen. Zusammengefasst : Die Balkanroute wird immer beschwerlicher, immer mehr Grenzen sind dicht. Deshalb fürchtet nun Italien eine Renaissance der Adria-Passage. Tausende Menschen könnten schon bald vom Balkan aus übersetzen. Und dann? Die Regierung in Rom lässt Hotspots einrichten, hofft auf eine faire Verteilung in Europa. Doch die dürfte am Widerstand der EU-Partner scheitern.",http://www.spiegel.de/politik/ausland/adria-route-italien-fuerchtet-zehntausende-fluechtlinge-a-1074224.html,2016-01-27T00:00:00.000Z
"OECD-Bericht So muss die Armut in Griechenland bekämpft werden - jetzt Nach sechs Jahren Krise leiden Millionen Griechen unter bitterer Armut, vor allem Kinder. Die OECD fordert: Die soziale Kluft muss dringend bekämpft werden - und macht konkrete Vorschläge. Von Florian Diekmann Jeannette Corbeau Florian Diekmann Jahrgang 1975, geboren und aufgewachsen in München, zum EDV-Kaufmann ausgebildet und sieben Jahre als Software-Entwickler angestellt. Grundstudium der Journalistik, Politik und Geografie an der Uni Hamburg, Mitgründung und mehrjährige Co-Chefredaktion der Campusmagazine \"Injektion\" und \"Halbstark\". Freie Mitarbeit und Praktika unter anderem bei NDR und \"Zeit Wissen\". Seit Dezember 2007 freie Mitarbeit für SPIEGEL ONLINE, ab November 2011 Volontariat, seit Februar 2013 Redakteur im Ressort Wirtschaft. E-Mail: Florian.Diekmann@spiegel.de Twitter: @flodiek folgen google+: Zum Profil Mehr Artikel von Florian Diekmann Wenig Zeit? Am Textende gibt's eine Zusammenfassung. Was haben mehr als sechs Jahre Krise in Griechenland angerichtet? Die Befunde der OECD sind dramatisch: Die Kinderarmut ist stark gestiegen. Weite Teile der Bevölkerung können sich die Wohnung kaum leisten. Die Jugendarbeitslosigkeit ist seit Jahren enorm hoch. Wer arbeitslos wird, der bleibt es meist für lange Zeit. Und gleichzeitig gewähren Staat und Sozialsysteme weiterhin jenen Privilegien, die nur selten darauf angewiesen sind.   In ihrem neuen Bericht zur wirtschaftlichen und sozialen Situation in Griechenland fordern die Experten der Industrieländerorganisation OECD die Regierung in Athen auf, diese sozialen Folgen der Krise besser als bislang abzufedern. Die Armut habe zugenommen, ebenso die Ungleichheit bei den Einkommen, heißt es im Bericht . Nehme man das Niveau von 2005 als Maßstab, seien inzwischen ein Drittel der Haushalte arm - sie verfügen über weniger als 50 Prozent des damaligen mittleren Einkommens. Zwar loben die Experten, dass das vormals riesige Haushaltsdefizit inzwischen deutlich reduziert wurde - allerdings seien die Strukturreformen unausgewogen gewesen: Der Staat habe entschlossen gespart und den Arbeitsmarkt liberalisiert - dafür aber Monopole und Sonderrechte in vielen Wirtschaftszweigen nicht angetastet. Schulessen, Wohngeld, Existenzsicherung An mehreren Stellen verweisen die Autoren des Berichts auf frühere Empfehlungen der OECD. Hier ist der Frust darüber erkennbar, dass diese entweder gar nicht oder nur schleppend umgesetzt wurden - insbesondere was die Schonung der Eliten und die offenbar fehlende Motivation im Verwaltungsapparat betrifft. So hätten sich Armut und Ungleichheit noch verschärft, gerade die schwachen Schichten hätten die Hauptlast getragen, resümieren die Experten. In dem 135 Seiten dicken Bericht belegt die OECD die dramatische soziale Lage mit zahlreichen Statistiken und Umfragen. Vor allem die steigende Kinderarmut müsse bekämpft werden, sagte OECD-Chef Ángel Gurría bei der Vorstellung des Berichts in Athen. Die Experten geben ganz konkrete Empfehlungen, wie das geschehen könnte: Zumindest in den ärmsten Regionen soll baldmöglichst flächendeckend kostenloses Mittagessen in Schulen angeboten werden. Später soll kostenloses Schulessen für Kinder aus bedürftigen Familien im ganzen Land eingeführt werden - sobald die Verwaltung in der Lage sei, die Bedürftigkeit verlässlich zu prüfen. Das im Jahr 2012 abgeschaffte Wohngeld für arme Familien soll wieder eingeführt werden. Die Obdachlosigkeit sei seit 2009 signifikant gestiegen. Nach der langen Krise litten die armen Haushalte nun umso mehr unter den hohen Wohnkosten und voraussichtlich stiegen diese weiter. Auf mittlere Sicht solle der Staat ein Programm für den sozialen Wohnungsbau auflegen. Das Existenzminimum müsse gesichert werden. Bislang kennt Griechenland keine Sozialhilfe , auch Arbeitslose erhalten nur ein Jahr lang Geld. Stattdessen operierte der Staat in den vergangenen Jahren mit Essensmarken oder Zuschüssen für Strom oder Miete. Die Links-rechts-Regierung hat allerdings inzwischen ein Grundsicherungssystem beschlossen, im Jahr 2017 soll es vollständig eingeführt sein. Das Rentensystem müsse dringend reformiert werden . Es sei nach wie vor teuer, ungerecht und kompliziert. (Hier finden Sie Analysen des \"Guardian\" und eines britisch-griechischen Bloggers in englischer Sprache.) Noch immer sehe es zahlreiche Sonderregelungen für privilegierte Gruppen vor - sie bezögen Renten, ohne in das System eingezahlt zu haben, oder dürften extrem früh in den Ruhestand gehen. Die Kosten für diese dringenden Maßnahmen schätzt die OECD auf 1,5 Prozent der griechischen Wirtschaftsleistung. Das stelle die Regierung vor eine Herausforderung, denn sie müsse diese Summe in anderen Bereichen sparen - die OECD plädiert also nicht für höhere Gesamtausgaben des Staats. Einsparungen sind laut OECD in folgenden Bereichen möglich: im Rentensystem durch die Abschaffung von Privilegien, im Verteidigungshaushalt, durch die Bekämpfung des verbreiteten Steuerbetrugs und durch Schuldenerleichterungen seitens der Geldgeber der Eurozone - eine Forderung, die auch der Internationale Währungsfonds (IWF) seit Langem erhebt. Diese Erleichterungen könnten in Form von Zinssenkungen und Zahlungsaufschüben erfolgen - was einem verdeckten Schuldenschnitt gleichkäme . Gleichzeitig sieht die OECD einen leichten Aufwärtstrend: Die vielen harten Reformen der vergangenen Jahre beginnen demnach langsam zu wirken. Für dieses Jahr rechnet die OECD damit, dass die Wirtschaft noch einmal insgesamt leicht um 0,1 Prozent schrumpft, im zweiten Halbjahr aber anspringt. 2017 soll sie dann um 1,9 Prozent wachsen. Eine Gefahr für die Erholung Griechenlands sieht die OECD in der aktuellen Flüchtlingskrise. Die Experten schätzen die Kosten für Griechenland im Jahr 2015 auf 0,4 Prozent der Wirtschaftsleistung - so viel, wie auch ein Programm für den sozialen Wohnungsbau kosten würde. Wenn die EU die Flüchtlingskrise nicht löse, so warnen die Experten, würde die gesamte Wirtschaft in der Region stark leiden. Zusammengefasst : Die Industrieländerorganisation OECD fordert in ihrem aktuellen Bericht zur Lage in Griechenland eine entschlossene Bekämpfung der Armut. Die Reformen der vergangenen Jahre hätten vor allem die Schwachen belastet. Besonders schlimm sei der Anstieg der Kinderarmut. Kurzfristig solle die Regierung kostenloses Schulessen und Wohngeld für Bedürftige sowie eine Grundsicherung einführen und das Rentensystem reformieren. Dafür solle bei Verteidigung und privilegierten Rentnern gespart und der Steuerbetrug bekämpft werden.",http://www.spiegel.de/wirtschaft/soziales/griechenland-oecd-fordert-kampf-gegen-armut-und-ungleichheit-a-1081580.html,2016-03-10T00:00:00.000Z
"Flüchtlingsunterkunft in Nauen Polizei geht nicht von versuchtem Brandanschlag aus Vor einer geplanten Flüchtlingsunterkunft in Nauen haben Wachleute eine verrußte Holzlatte entdeckt. Einige Medien, auch SPIEGEL ONLINE, berichteten von einem versuchten Brandanschlag. Die Polizei hat jedoch bislang keine Hinweise darauf. Der Fund einer verrußten Holzleiste vor einer Flüchtlingsunterkunft im brandenburgischen Nauen hat am Donnerstag für Aufsehen gesorgt. Die Nachrichtenagentur dpa und lokale Medien, auch SPIEGEL ONLINE, berichteten zunächst, es habe sich um einen versuchten Brandanschlag auf die Traglufthalle gehandelt. Unbekannte hätten die brennende Leiste über den Zaun geworfen, der Gegenstand habe die Halle nur knapp verfehlt, berichtete die \"Märkische Allgemeine\". Bundesweit griffen Medien die Meldung auf, auch SPIEGEL ONLINE berichtete . Die Polizei schilderte den Fall am Donnerstag jedoch anders: Wachleute hätten die Leiste auf halber Strecke zwischen Halle und Zaun gefunden - in rund zwölf Metern Entfernung zur geplanten Unterkunft. Wie lange die Leiste dort schon gelegen habe und wie sie dahin gekommen ist, sei noch nicht geklärt, sagte eine Polizeisprecherin SPIEGEL ONLINE. \"Wir gehen derzeit nicht von einem versuchten Brandanschlag aus.\" Den bisherigen Ermittlungen nach habe niemand beobachtet, dass die Leiste auf das Gelände geworfen worden sei. Die Leiste könne auch bei Bauarbeiten auf dem Gelände dort liegen geblieben sein. An der Halle gebe es keine Schäden. Am Mittwochabend stellte die Polizeidirektion dennoch Strafanzeige gegen unbekannt wegen versuchter Brandstiftung . Das sei vorsorglich geschehen damit die Polizei eine Ermittlungsgrundlage habe, sagte die Polizeisprecherin. \"Wir sind sehr vorsichtig\", sagte die Sprecherin. Versuchter Brandanschlag oder Unordnung bei Bauarbeiten? Wie es zu den unterschiedlichen Darstellungen des Vorfalls kommt, kann sich die Polizeisprecherin nicht erklären. Seitens der Polizei sei nicht offiziell mitgeteilt worden, dass es sich bei dem aktuellen Vorfall in Nauen um Brandstiftung handele. Die dpa korrigierte am Donnerstagvormittag ihre erste Meldung und übernahm stattdessen die Version der Polizei. Die Traglufthalle, um die es bei dem aktuellen Vorfall geht, wurde in den vergangenen Monaten als Ersatz für eine andere Unterkunft aufgebaut. Ursprünglich sollten Flüchtlinge in einer ehemaligen Turnhalle in Nauen untergebracht werden. Im vergangenen August zündeten Rechtsradikale die Unterkunft jedoch an, das Gebäude brannte aus . Die Ermittler gaben Anfang März bekannt, dass es sich bei den mutmaßlichen Brandstiftern um eine fünfköpfige Neonazi-Zelle um den NPD -Stadtverordneten Maik Schneider aus Nauen handeln soll.",http://www.spiegel.de/politik/deutschland/nauen-im-havelland-verwirrung-um-angeblichen-brandanschlag-a-1081640.html,2016-03-10T00:00:00.000Z
"Münchner Flughafen CSU streitet über dritte Startbahn In der CSU gibt es Ärger um den möglichen Bau einer dritten Startbahn für den Münchner Flughafen. Parteichef Seehofer will eine neue Abstimmung der Bürger - sein Vorgänger Huber droht mit Klage. Wenn Horst Seehofer Parteifreunde abkanzelt, wird es für den Betroffenen in der Regel ziemlich ungemütlich. An diesem Montag war es mal wieder so weit - der CSU-Chef empörte sich vor Beginn der Vorstandssitzung über seinen Amtsvorgänger Erwin Huber . Es sei ein weiteres Mal deutlich geworden, \"dass zwischen dem Politikverständnis von Erwin Huber und mir Welten liegen\", sagte Seehofer. Dem Vorsitzenden des Wirtschaftsausschusses im bayerischen Landtag warf Seehofer zudem vor, den Erfolg der Partei zu gefährden: \"Ich glaube, das wird Schaden auslösen.\" Es kracht mal wieder in der CSU . Monatelang war aus der Partei kaum ein kritisches Wort an Seehofer zu hören - der Streit zwischen dem CSU-Vorsitzenden und Kanzlerin Angela Merkel (CDU) über die Flüchtlingspolitik hatte zu einer Geschlossenheit geführt, die in der CSU nicht selbstverständlich ist. Aber jetzt ist ihm Huber in die Quere gekommen und hat einen alten Konflikt neu entfacht. \"Rücktritte droht man nicht an\" Es geht um den Münchner Flughafen und die Frage, ob der Airport eine dritte Startbahn braucht oder nicht. Huber hatte laut einem Bericht der \"Süddeutschen Zeitung\" eine Klage vor dem Bayerischen Verfassungsgerichtshof angedroht, sollte es in München ein neuerliches Bürgerbegehren oder einen Stadtratsbeschluss für einen Bürgerentscheid zur dritten Startbahn geben. Der Vorstoß war eine Kampfansage an Seehofer - schließlich hatte der CSU-Vorsitzende wenige Tage zuvor erklärt, dass er die Bevölkerung noch einmal entscheiden lassen wolle. Seehofer machte am Montag erneut deutlich, dass für ihn der Dialog mit den Bürgern zentral sei. \"Einen anderen Politikstil wird es mit mir nicht geben.\" Zugleich wies er Berichte zurück, er habe im Parteivorstand indirekt mit seinem Rücktritt gedroht, sollte die CSU seinem Vorgehen beim Münchner Flughafen nicht folgen: \"Rücktritte droht man nicht an, Rücktritte führt man durch\", so Seehofer, er habe keinerlei Rücktrittsabsichten. Die Mehrheit der CSU-Landtagsfraktion ist für eine dritte Startbahn, sie gilt etlichen Christsozialen als zentrales Infrastrukturprojekt Bayerns. Huber zählt zu den Befürwortern, aber auch Kabinettsmitglieder wie Finanzminister Markus Söder und Wirtschaftsministerin Ilse Aigner haben in der Vergangenheit mehrfach betont, dass sie den Bau einer dritten Startbahn für wichtig erachten. Seehofer selbst hat sich bislang nicht eindeutig geäußert, ob er eher für oder gegen einen Ausbau des Flughafens ist. Die Startbahn-Befürworter in der CSU befürchten aber seit Längerem, dass sich der Parteichef bereits gegen den Ausbau festgelegt habe. Der Grund: Seehofer hatte im vergangenen Herbst gegenüber Bewohnern im Flughafenumland gesagt, dass die derzeitige Zahl von Starts und Landungen den Bau einer dritten Startbahn nicht begründen könnte - man müsse aber die Entwicklung im Blick haben. Negatives Votum der Münchner Bürger im Jahr 2012 Schon damals war Huber alarmiert und ließ in der CSU-Fraktion Unterschriften für den Ausbau sammeln, die Mehrheit der christsozialen Abgeordneten nahm daran teil. Über den Ausbau des Münchner Flughafens wird schon lange gestritten: 2012 hatten die Münchner bei einem Bürgerentscheid gegen die dritte Startbahn gestimmt. Die juristische Bindewirkung dieses Votums ist allerdings inzwischen abgelaufen. Münchens Oberbürgermeister Dieter Reiter (SPD) hat aber betont, dass er sich dem negativen Entscheid verpflichtet fühle. Nur ein neuer und positiver Entscheid könne daran etwas ändern. Rein juristisch darf die dritte Startbahn gebaut werden, der Bayerische Verwaltungsgerichtshof hat bereits 2014 sämtliche Klagen abgewiesen, eine Revision wurde nicht zugelassen. Seehofer betonte am Montag, dass die CSU jetzt eine einheitliche Position in der Flughafenfrage erarbeiten werde. Es gebe ein \"glasklares Verfahren - und das werden wir weitermachen\".",http://www.spiegel.de/politik/deutschland/csu-streitet-ueber-dritte-startbahn-fuer-muenchner-flughafen-a-1090470.html,2016-05-02T00:00:00.000Z
"Kiel Angriff auf deutsche Muslimin - russischer Flüchtling unter Verdacht Ein 55 Jahre alter Mann soll in Kiel auf offener Straße eine Frau attackiert haben - weil sie ein Kopftuch trug. Die Polizei nannte nun Details zum Verdächtigen. Nach einem Überfall auf eine Kopftuch tragende Muslimin in Kiel hat sich der Tatverdacht gegen einen 55-jährigen Mann erhärtet. Es handele sich um einen Asylbewerber aus Russland, berichtete die Polizei. Gegen ihn wird wegen des Verdachts der Körperverletzung ermittelt. Er wurde vernommen, blieb aber auf freiem Fuß. Die Frau musste nach dem Überfall mit Prellungen und einem Nasenbeinbruch im Krankenhaus behandelt werden. Der 55-Jährige soll am Samstag auf der Straße unvermittelt auf die türkischstämmige Deutsche eingeschlagen haben, nachdem er \"Scheiß Muslima\" gebrüllt hätte. Eine Anwohnerin kümmerte sich um die Frau und alarmierte die Polizei. Die Ermittler suchen nun nach Zeugen des Vorfalls. Der Tatverdächtige ist der Polizei bereits im Zusammenhang mit einer Körperverletzung bekannt. Nach Informationen von SPIEGEL ONLINE soll er seit etwa einem Jahr in Deutschland leben.",http://www.spiegel.de/panorama/justiz/kiel-russischer-asylbewerber-soll-deutsche-muslimin-attackiert-haben-a-1101862.html,2016-07-07T00:00:00.000Z
