article,article_url,date
"EU-Krise \"Den Europäern fehlt es an Gemeinsamkeiten\" Dänemark führt wieder Grenzkontrollen ein, die EU streitet über Finanzhilfen für Griechenland, in vielen Mitgliedsländern sind Rechtspopulisten im Aufwind: Zerbricht die europäische Idee? Der Historiker Philipp Blom spricht im Interview über die Schwächen der Gemeinschaft - und über ihre Chancen. SPIEGEL ONLINE : Herr Blom, Dänemark will auf Druck der rechtspopulistischen Partei DF an seinen Grenzen wieder Kontrollen einführen . Gerät mit dem Ende der europäischen Reisefreiheit auch die europäische Idee in Gefahr? Blom: Die europäische Idee ist schon in Gefahr, aber es gibt zu ihr keine Alternative. Helmut Schmidt hat vor kurzem in einem Aufsatz vorgerechnet, dass die Europäer Anfang des 20. Jahrhunderts 25 Prozent der Weltbevölkerung gestellt haben, Ende des 21. Jahrhunderts werden es demnach nur noch fünf Prozent sein. Wenn sich diese Länder dann auch noch zersplittert um ihre eigenen Interessen kümmern wollen, haben sie keine Stimme mehr in der Welt. SPIEGEL ONLINE : Außer dem Schengen-Streit sorgen auch die Euro-Rettung und die Debatte über Finanzhilfen für Konflikte. Viele EU-Bürger sehen Europa eher als Schreckgebilde denn als Verheißung. Wie ist es dazu gekommen? Blom: Dafür trägt leider auch die Politik die Verantwortung. Man muss nur schauen, was mit den Flüchtlingen der arabischen Revolutionen geschieht: Die EU hat Italien mit diesem Problem alleingelassen. Die Franzosen wollten ihre Grenzen dichtmachen, die Österreicher auch. Da zeigt sich einerseits ein Mangel an Solidarität. Andererseits schieben Politiker gern der EU all das in die Schuhe, was in ihrem eigenen Land schiefläuft. SPIEGEL ONLINE: Hat sich die EU auch durch die Erweiterung angreifbar gemacht? Blom: Es scheint mir, dass sich die EU jenseits ihrer Handlungsfähigkeit vergrößert und sich damit noch nicht institutionell arrangiert hat. Dazu kommt ein gigantisches Demokratiedefizit: Für einfache Menschen ist es sehr schwer einsehbar, wie Entscheidungsprozesse in Brüssel zustande kommen. Oder nehmen wir das Debakel zur Europäischen Verfassung - ein Beispiel, das verdeutlicht, mit welcher Arroganz in Brüssel oftmals vorgegangen wird: Was wäre falsch daran gewesen, dass alle Europäer Mitglieder zu einer verfassunggebenden Versammlung wählen, die dann die Verfassung formulieren kann? Stattdessen wurde den Menschen einfach ein hochkomplexes Dokument vorgelegt und signalisiert: Jetzt sagt bitte schön ja dazu. SPIEGEL ONLINE: Wie ließen sich denn Konstruktionsfehler im Gebilde EU beheben? Blom: Auf der theoretischen Ebene funktioniert dies sicher. Aber in der praktischen Welt gibt es ein unendliches Geflecht von Nationalinteressen, Karrierefaktoren und Kuhhandelei. Neue Konstruktionsprinzipien bedeuten Machtverzicht für Individuen und Parteien, und dafür muss sich der Druck auf Europa enorm erhöhen. SPIEGEL ONLINE : Nicht nur in Dänemark feiern Rechtspopulisten und Euro-Skeptiker Erfolge. Kehrt in Europa der Nationalismus zurück? Blom: Er ist leider schon längst zurückgekehrt. Zum Teil ist das Ausdruck des Vakuums, das wir haben: Die großen Volksparteien haben über Jahrzehnte auch zum Teil legitime Sorgen von Wählern ignoriert, sie wollten sie nicht wahrnehmen - etwa das Thema Migration. Leider waren dann die Rechtsaußenparteien die Einzigen, die diese Fragen offensiv artikuliert haben. Europäische Länder haben wie jeder andere Staat auch das Recht, die Migration in das eigene Gebiet zu steuern - kein Mensch findet das bei Australien, Neuseeland oder Kanada bedenklich. Auch der soziale Friede innerhalb eines Landes ist wichtig, es geht aber um folgende Frage: Wollen wir eine offene, integrative Gesellschaft sein, in der sich Menschen unterschiedlicher Kulturen und unterschiedlicher Horizonte friedlich miteinander arrangieren oder wollen wir das nicht? Die Rechtsaußenparteien wollen die offene, integrative Gesellschaft nicht - aber einige der Ängste, die sie artikulieren, die sind einfach da. Das Schlimmste, was man als liberaldenkender Mensch oder liberaldenkende Partei tun könnte, wäre, davor die Augen zu verschließen und zu sagen, es handle sich um nationalistische Vorurteile. SPIEGEL ONLINE: Wie hat sich der Blick auf Europa in den vergangenen Jahrzehnten gewandelt? Blom: Er ist wesentlich ernüchterter geworden. Das Misstrauen gegenüber der weit entfernten Institution Europa ist gestiegen. Das liegt zum Teil auch daran, dass es die Politiker in Brüssel nicht geschafft haben, Kommunikationskanäle zu ihren Wählern in den Heimatländern zu schaffen. Europawahlen werden von nationalen Partien und anhand von nationalen Fragen bestritten, nicht von europäischen Parteien. Es existiert keine genuin europäische Öffentlichkeit. Es gibt zum Beispiel keine Fernsehsendung, die alle Europäer sehen können, es gibt keine Gemeinsamkeiten, die sich aus Europa ergeben - jenseits der gemeinsamen Währung. SPIEGEL ONLINE: Glauben Sie daran, dass es so etwas wie eine europäische Öffentlichkeit jemals geben wird? Blom: In einer Demokratie ist Öffentlichkeit unabdingbar. Wenn Europa eine Demokratie sein will, die mehr ist als eine mittelgroße europäische Stadt, in der sich Parlamentarier treffen, die niemand kennt, dann wird es diese Öffentlichkeit entwickeln müssen. Dann wird es den Menschen effektiver als bisher zeigen müssen, wie es das Leben der EU-Bürger positiv beeinflusst. Dass es ihnen Wohlstand, Stabilität und Frieden gebracht hat und bringt - und dass es nicht nur die Krümmung von Bananen reguliert, worüber sich die Boulevardmedien freuen. SPIEGEL ONLINE : \"Der taumelnde Kontinent\" lautet der Titel Ihres Buchs über Europa in der Zeit von 1900 bis 1914. Wie würde er lauten, wenn Sie ein Buch über das Europa unserer Tage schreiben würden? Blom: Es wäre wohl so etwas wie \"Der erstickende Kontinent\", aber durchaus mit einem Fragezeichen versehen. Ich meine das auf das kulturelle Selbstverständnis bezogen. Die Berufung auf die Werte, die Europa möglich gemacht haben, ist immer hohler geworden. Wir müssen uns mit diesen Werten und Ideen wieder offensiv beschäftigen.",http://www.spiegel.de/politik/ausland/eu-krise-den-europaeern-fehlt-es-an-gemeinsamkeiten-a-762375.html,2011-05-16T00:00:00.000Z
"Brandstifter in Berlin Die verunsicherte Stadt Was ist nur in Berlin los? Nachts werden Autos angezündet, Kinderwagen gehen in Flammen auf, Jugendbanden prügeln auf Wehrlose ein. Selbst die Kanzlerin ist alarmiert. Schon geistert der Vergleich mit Londoner Verhältnissen durch die Stadt. Von Florian Gathmann , Yassin Musharbash, Severin Weiland und Philipp Wittrock Christian O. Bruch / laif Florian Gathmann 1975 in Göppingen geboren, studierte in Konstanz Verwaltungswissenschaft und an der Rutgers University in den USA Politikwissenschaften (M.A.). Ab 2001 Volontariat bei der \"Thüringer Allgemeine\" in Erfurt, danach Pauschalist und ab 2005 Politik-Redakteur. Im Sommer 2006 Arthur F. Burns-Fellow bei der \"Chicago Tribune\" in Washington und Chicago. Seit Mai 2007 Redakteur bei SPIEGEL ONLINE im Ressort Politik, seit Januar 2009 in der Berliner Redaktionsvertretung. Teilnehmer des Journalism Program for German and American Journalists der Robert-Bosch-Stiftung. E-Mail: Florian.Gathmann@spiegel.de Twitter: @FlorianGathmann folgen Mehr Artikel von Florian Gathmann Christian O. Bruch/ laif Severin Weiland Severin Weiland, geboren 1963 in Wilhelmshaven/Niedersachsen. Verbrachte einen Teil seiner Kindheit und Jugend in Chile. Studium der Kommunikations- und Politischen Wissenschaft in München, Ausbildung an der Deutschen Journalistenschule München. Ab 1992 Redakteur im Lokalteil der \"tageszeitung\" in Berlin, später landespolitischer Korrespondent. Von 1996 bis 1999 Stellvertretender Ressortleiter Innenpolitik der taz. Sabbatjahr in Kathmandu, Nepal. Von Herbst 2000 bis Januar 2002 bundespolitischer Korrespondent der taz in Berlin. Seit Februar 2002 Parlamentskorrespondent im Berliner Büro von SPIEGEL ONLINE, seit dem 1. Mai 2004 Stellvertretender Leiter des Berliner Büros von SPIEGEL ONLINE. Ab Mitte Oktober 2014 politischer Korrespondent im Hauptstadt-Büro. E-Mail: Severin.Weiland@spiegel.de Twitter: @SeverinWeiland folgen Mehr Artikel von Severin Weiland Christian O. Bruch/ laif Philipp Wittrock 1975 in Düsseldorf geboren, studierte dort Anglistik und Politikwissenschaft. Freie Mitarbeit bei der \"Rheinischen Post\" und beim \"Express\". Von 2004 bis 2005 Ausbildung an der Deutschen Journalistenschule und Aufbaustudiengang Praktischer Journalismus an der Uni München. Stationen beim \"Tagesspiegel\", SPIEGEL ONLINE und SPIEGEL. Seit Juli 2005 Redakteur bei SPIEGEL ONLINE, seit Oktober 2014 Stellvertretender Ressortleiter im Politik-Ressort mit Sitz im Hauptstadt-Büro, seit August 2017 Ressortleiter. E-Mail: Philipp.Wittrock@spiegel.de Twitter: @philwitt folgen Mehr Artikel von Philipp Wittrock Berlin - Am Pariser Platz stehen junge Amerikaner, Spanier und Franzosen Schlange. Schon am frühen Morgen warten sie geduldig auf die Fremdenführer. Gegen einen Obolus, der am Ende der Tour gezahlt wird, geht es zum Brandenburger Tor, zum Reichstagsgebäude, zum Kanzleramt. Es ist eine Tour durch das Zentrum Deutschlands. Hier zeigt sich das neue Berlin in diesen Sommertagen von seiner besten Seite. Die andere Wirklichkeit bekommen die meisten Touristen nicht zu sehen. Nur drei Kilometer entfernt, an einem Seitenkanal der Spree, steht am Neuen Ufer ein ausgebranntes Auto. Jüngstes Relikt einer Serie von Anschlägen, allein neun waren es in der Nacht zu Donnerstag. 300 hat die Polizei in diesem Jahr bereits gezählt. Hier die Postkartenidylle, dort ein verkohlter Familienwagen - Berlin ist eine gespaltene Stadt. Und eine Stadt, in der in manchen Gegenden die Menschen verunsichert sind. Angesichts der Dauer-Zündler geistert bereits die bange Frage durch die Blätter: Kommt es in Berlin irgendwann zu Gewaltausbrüchen wie jüngst in London? Sind die Brandanschläge auf Autos und in den vergangenen Monaten fast jede Nacht auf abgestellte Kinderwagen in Mietshäusern die Vorläufer für den großen Gewaltexzess? Der Sprecher der Landesgruppe Berlin in der Unionsfraktion im Bundestag, Kai Wegner, warnte vor Krawallen wie in London: \"Wenn wir nicht energisch eingreifen, drohen uns genau solche Verhältnisse.\" Berlins Regierender Bürgermeister Klaus Wowereit (SPD) widerspricht dem CDU-Politiker: \"Das hat überhaupt nichts miteinander zu tun.\" Bei den Brandstiftern in Berlin gebe es kein klares Täterprofil, sondern eine \"bunte Mischung\", die Pyromanen und krawallorientierte Täter umfasse. Sein SPD-Parteikollege Dieter Wiefelspütz, Innenpolitiker im Bundestag, sieht es wiederum anders: Er sprach von einer \"Vorstufe zum Terrorismus\".   Selbst die Kanzlerin schaltete sich ein. \"Was ist das für ein Verhalten, Kinderwagen im Hausflur in Brand zu stecken und mutwillig Leben aufs Spiel zu setzen\", sagte Angela Merkel am Donnerstag. Sie versicherte, die Bundesregierung werde den Polizeibehörden bei ihrer Arbeit gegen solche Auswüchse den Rücken stärken. Keine Frage, die mit Abstand größte deutsche Stadt hat einige Probleme: Die Hauptstadt der Republik , Schaufenster bei internationalen Staatsempfängen, ist zugleich ihr größtes Armenhaus. Zwar steigt jährlich die Zahl der Touristen, doch wirtschaftlich kommt Berlin nicht so richtig vom Fleck. Obwohl Deutschland den stärksten Aufschwung am Arbeitsmarkt seit der Wiedervereinigung erlebt - aber an der Hauptstadt geht das Jobwunder weitgehend vorbei. Hohe Arbeitslosigkeit, sozialer Sprengstoff Bundesweit lag die Arbeitslosenquote im Juli 2011 bei sieben Prozent, in Berlin waren es 13,5 Prozent . Dazu kommt der Spitzenplatz bei den Hartz-IV-Beziehern. Und eine schleichende Verarmung: Die Zahl der Berliner, die trotz fester Jobs nicht von ihrem Einkommen leben können, steigt von Jahr zu Jahr. Fast 130.000 Menschen, die im vergangenen Jahr sozialversicherungspflichtig beschäftigt waren, mussten zusätzlich staatliche Hilfen in Anspruch nehmen. Zwar gehört die Revolte seit jeher zu Berlin. Schon zu Mauerzeiten war Berlin ein Anziehungspunkt für die linksautonome Szene, seit Mitte der achtziger Jahre feiert sie sich regelmäßig auf den 1. Mai-Krawallen in Kreuzberg. Doch das Phänomen der Autoabfackelei ist relativ neu. Die Behörden, ob Polizei oder Verfassungsschutz, tappen weitgehend im Dunkeln. Es gibt nur wenig bekannte Täter, jüngst wurde ein Mann aus der linksextremen Szene zu 22 Monaten auf Bewährung verurteilt. Die mögliche Täter-Szene ist aus Sicht der Behörden bunt: politische Aktivisten, Trittbrettfahrer, Pyromanen oder Menschen, denen es allein um Zerstörung geht - alles ist in der 3,5-Millionen-Stadt möglich. Über die Hintergründe der Taten gibt es nur wenige Erkenntnisse. In Bekennerschreiben wurden in einzelnen Fällen die Anschläge auf Firmenwagen mit der Politik bestimmter Unternehmen begründet, mit Anschlägen auf private Wagen sollte gegen die angebliche \"Vertreibung\" von weniger Betuchten aus bestimmten Stadtvierteln gekämpft werden. Angst vor der Gentrifizierung Tatsächlich ist diese sogenannte Gentrifizierung in Berlin ein neues Phänomen: Teile der Innenstadt sind \"in\". Nicht nur die Touristen kommen nach Kreuzberg und Mitte, viele Menschen, vor allem junge Kreative, zieht es hierher. So haben die Preise bei Neuvermietungen in einzelnen Stadtteilen in den vergangenen Jahren massiv angezogen. Nach Mitte und Prenzlauer Berg sind nun Teile von Kreuzberg und Friedrichshain begehrt. Wo sich Kneipen und Restaurants ansiedeln, wo die Versorgung mit Schulen und Kitas gut ist, explodieren die Preise. In anderen Stadtteilen, etwa den wenig begehrten Plattenbausiedlungen im Osten, kann man dagegen immer noch Wohnungen zum Preis von etwas mehr als vier Euro pro Quadratmeter mieten. Ein typisches Beispiel für diesen Wandel ist der Graefekiez in Berlin-Kreuzberg. Einst war er ein typischer Problemstadtteil. Mit einem hohen Anteil von Sozialhilfeempfängern, vielen Migranten mit schlechter Ausbildung - und niedrigen Mieten. Inzwischen hat sich das Bild des Kiezes vollständig gewandelt. Junge Väter und Mütter sitzen auf Spielplätzen, und man sieht ihnen an, dass sie zur besser situierten Mittelschicht gehören. Abends sitzen die Einheimischen und Touristen dann in den vielen neuen schicken Cafés und Restaurants. Das Leben pulsiert - doch viele der früheren Bewohner sind nicht mehr da. Und selbst relativ gut verdienende Vertreter der Mittelschicht können sich die Mieten kaum noch leisten. Das sorgt für Spannungen. Unpolitische Krawallkultur Auf der anderen Seite wächst in der Stadt auch eine unpolitische Krawallkultur. Die Arbeitslosigkeit unter Jugendlichen ist in Berlin überdurchschnittlich hoch, sowohl Migrantenkinder als auch deutsche Jugendliche aus Problemvierteln wie Neukölln oder Wedding sorgen immer wieder durch rohe Gewalt für Schlagzeilen. Fast jedes Wochenende kommt es auf U-Bahnhöfen zu brutalen Übergriffen auf Fahrgäste. Das macht dem Otto-Normal-Berlinern Angst. Gleichwohl glauben Sicherheitsexperten, dass Berlin von Londoner Verhältnissen noch weit entfernt ist. Dass Berliner Täter die Brandserie inszenieren, um Krawalle wie in London anzuzetteln, sei unwahrscheinlich, ist bei den Behörden zu hören. Es gebe keinen \"Aufstandsneid\", sagen die Beamten. Hinzu kommt: Selbst in linksradikalen Kreisen ist das Zündeln umstritten. Als in einem einschlägigen Internetforum anlässlich der mehrtägigen Krawalle in Großbritannien ein Posting mit der Überschrift \"London brennt! - Wann folgt endlich Berlin?!\" auftauchte, in dem offen zu Brandstiftungen auch in der deutschen Hauptstadt aufgerufen wurde, gab es in den Kommentaren nicht nur Zustimmung. Im Gegenteil: Angesichts zahlreicher Proteste entschlossen sich die Moderatoren des Forums mit einiger Verzögerung, den Eintrag zu zensieren. London, darauf setzt die Politik, wird sich in Berlin nicht wiederholen. \"Ich hoffe und bin einigermaßen zuversichtlich, dass wir in Deutschland von Ereignissen, wie wir sie jüngst in London und anderen Städten in Großbritannien gesehen haben, verschont bleiben\", sagte Merkel. Das Umfeld für ihr Statement war wohl gewählt - auf der Jubiläumsveranstaltung zum 60-jährigen Bestehen des Bundeskriminalamts in Wiesbaden.",http://www.spiegel.de/politik/deutschland/brandstifter-in-berlin-die-verunsicherte-stadt-a-780936.html,2011-08-18T00:00:00.000Z
"Erstes Treffen in Berlin Gauck lobt Engagement der Piraten Der Kandidat für das Amt des Bundespräsidenten, Joachim Gauck, lobt die Piratenpartei: Deren Bereitschaft, mitzuwirken und Verantwortung zu übernehmen, imponiere ihm, sagte er - bei einem Besuch im Berliner Abgeordnetenhaus traf er erstmals auf die Polit-Neulinge. Berlin - Der Kandidat für das Amt des Bundespräsidenten, Joachim Gauck , hat ungewohnt lobende Worte für das politische Engagement der Piratenpartei gefunden. Deren Bereitschaft, mitzuwirken und Verantwortung für das Ganze zu übernehmen, \"imponiert mir\", sagte Gauck am Mittwoch bei seiner Vorstellung im Berliner Abgeordnetenhaus. Der 72-jährige ehemalige Bürgerrechtler war einer Einladung der Fraktionen von SPD, CDU und Grünen gefolgt, die ihn auf Bundesebene nominiert hatten. An dem mehr als einstündigen Gedankenaustausch nahmen auch Abgeordnete der Linken, die mit Beate Klarsfeld eine eigene Bewerberin ins Rennen schicken, und der Piraten teil. Der neue Bundespräsident wird am Sonntag gewählt. Im Abgeordnetenhaus traf Gauck erstmals mit Piraten zusammen, wie er nach der Begegnung sagte. Er als \"älterer Mensch\" könne sich von deren Welt nicht allzu viel vorstellen, er würdigte aber die Haltung der politischen Neulinge, im Parlament mitwirken zu wollen. \"Allerdings werde ich noch manche Begegnung brauchen, um wirklich zu verstehen, was sie wollen\", sagte der Kandidat. Die Piraten waren nach der Berlin-Wahl im Herbst 2011 erstmals bundesweit in ein Landesparlament eingezogen. Bei vielen Piraten hatte sich Gauck wegen seiner kritischen Haltung zur Occupy-Bewegung, seinen Warnungen von den Gefahren des Internet und seiner öffentlichen Verteidigung der umstrittenen Vorratsdatenspeichung unbeliebt gemacht. Der Fraktionsgeschäftsführer der Piraten, Martin Delius, freute sich über das Lob von Gauck. Der Kandidat habe sich \"sehr staatsmännisch\" gegeben. Wählen werde er ihn aber dennoch nicht, kündigte der Abgeordnete an - er ist einer von zwei Piraten, die am Sonntag erstmals in der Bundesversammlung sitzen werden. Vielmehr werde er sich der Stimme enthalten, sagte Delius. Grund sei die \"Ängstlichkeit\" von Gauck vor den Auswirkungen des Internets auf Demokratie und Bürgerrechte. Linke gehen auf Distanz Sein Hauptthema blieben Freiheit und Verantwortung, betonte Gauck in Berlin. Wer mitgestalten wolle in einer offenen Gesellschaft, müsse Verantwortung übernehmen. Seine Freiheitsbotschaft sei \"nicht egoman oder egoistisch\", sondern das Thema \"verbindet uns über Partei-, Glaubens- und Kulturgrenzen hinweg\". Berlins Regierender Bürgermeister Klaus Wowereit (SPD) würdigte Gaucks Bereitschaft dazuzulernen. Aus Sicht von Innensenator Frank Henkel (CDU) kann er den Menschen in Zeiten der Unsicherheit einen \"klaren Kompass und Halt geben durch die Kraft seines Wortes\". Der Grünen-Abgeordnete Dirk Behrendt bezeichnete es als erfreulich, dass Gauck Sympathien für die umstrittenen Thesen von Thilo Sarrazin zur Zuwanderung zurückgewiesen habe. Auch dessen Ankündigung, bei der Integration den Kurs des zurückgetretenen Bundespräsidenten Christian Wulff fortzusetzen, finde er gut, sagte der Politiker. Dagegen ging Linksfraktionschef Udo Wolf die Distanzierung von Sarrazin nicht weit genug. Gauck hätte sich deutlicher abgrenzen sollen, sagte er. Der Kandidat hatte Sarrazin Mut bescheinigt und damit besonders im linken Lager und bei Migrantenverbänden Widerspruch hervorgerufen.",http://www.spiegel.de/politik/deutschland/gauck-trifft-in-berlin-das-erste-mal-auf-piraten-a-821402.html,2012-03-14T00:00:00.000Z
"Ethnische Unruhen Tausende Menschen in Burma auf der Flucht Die Rohingya in Burma gelten als eine der am stärksten verfolgten Minderheiten der Welt. Jetzt wurden Dutzende Menschen getötet, als bei Zusammenstößen zwischen Buddhisten und Muslimen im Westen des Landes ein ganzes Stadtviertel niedergebrannt wurde. Satellitenbilder zeigen das Ausmaß der Zerstörung. Sittwe - Bei gewaltsamen Zusammenstößen zwischen Buddhisten und Muslimen sind in Burma in den vergangenen Tagen mindestens 67 Menschen getötet worden. Die Uno schätzt die Zahl der Flüchtlinge auf 80.000. Vor wenigen Tagen sollen in der muslimischen Siedlung Kyaukpyu mehr als 800 Häuser niedergebrannt worden sein. Beobachter werten die Zusammenstöße als ethnische Säuberungen. Die Menschenrechtsorganisation Human Rights Watch (HRW) hat jetzt Satellitenbilder des Viertels veröffentlicht, das komplett niedergebrannt wurde, und fordert die Regierung auf, mehr zum Schutz der muslimischen Rohingya-Minderheit zu tun. Auch Amnesty International verlangt von der Regierung, den Kreislauf von Diskriminierung und Gewalt zu brechen. Die Satellitenbilder zeigen das Ausmaß der Verwüstung. Unbestätigten Berichten zufolge versuchten viele Rohingya mit Booten in Richtung der Stadt Sittwe oder ins benachbarte Bangladesch zu fliehen. Andere machten sich auf den Weg zu schon jetzt völlig überfüllten Flüchtlingslagern im Westen des Landes, teilte das Uno-Flüchtlingshilfswerk UNHCR mit. Kyaukpyu liegt im Westen des Landes, im Küstenstaat Rakhine. Dort stellt die Volksgruppe der Rohingya die Mehrheit, welche die birmanische Staatsangehörigkeit nicht besitzt und in ihren Rechten erheblich eingeschränkt ist. Mit einem Anteil von vier Prozent an der Bevölkerung sind die Muslime eine kleine Gruppe in Burma, 89 Prozent sind Buddhisten. Die Uno sieht die Rohingya als eine der am stärksten verfolgten Minderheiten der Welt an. Noch am Freitag hatte ein Regierungssprecher die Zahl der bei den Unruhen Getöteten auf 112 beziffert - Stunden später senkten die staatlich kontrollierten Medien die Zahl auf 67. Im Juni brachen Unruhen aus, nachdem Muslime angeblich eine Buddhistin vergewaltigt haben sollen. Damals wurden 90 Menschen getötet und 3000 Häuser niedergebrannt. In Burma leben rund eine Million Rohingya. Sie werden seit Jahrzehnten drangsaliert. Die Regierung verweigert ihnen die Staatsbürgerschaft und will sie abschieben . Von den etwa drei Millionen Rohingya lebt etwa die Hälfte außerhalb Burmas, in Bangladesch, Pakistan, Saudi-Arabien, Thailand, Malaysia und Indonesien, aber auch in Europa und Australien. In Burma ließen sich vor Jahrhunderten arabische Kaufleute und Einwanderer aus Bengalen nieder. Es entstand eine ganz eigene Kultur, eine eigene Sprache und damit eine eigene Identität. Mit der Entlassung Burmas aus britischer Kolonialherrschaft 1948 erhielten die Rohingya einen Status als Minderheit. Doch das Militär, das 1962 die Macht übernahm, verfolgte eine Politik der \"Burmanisierung\" des Landes: In den vergangenen Jahren berichteten Flüchtlinge immer wieder von ethnischen Säuberungen in Westburma, von Massenvergewaltigungen und der systematischen Ermordung vieler Männer . Ihnen wird die Staatsangehörigkeit Burmas verweigert, damit sind sie offiziell staatenlos. Warum den Rohingya ein solcher Hass entgegenschlägt, kann niemand begründen. Staatliche Zeitungen in Burma nennen sie offen \"kalar\", also \"Schwarze\". Sie werden als \"Araber\" und \"Bengalen\" beschimpft, was verdeutlichen soll, dass sie nicht nach Burma gehören.",http://www.spiegel.de/politik/ausland/ethnische-unruhen-tausende-menschen-in-burma-auf-der-flucht-a-863765.html,2012-10-27T00:00:00.000Z
