article,article_url,date
"500 Soldaten EU beschließt Mission für Zentralafrika Seit Monaten herrscht in der Zentralafrikanischen Republik Chaos. Auf dem Flughafen der Hauptstadt Bangui haben Hunderttausende Flüchtlinge Zuflucht gesucht. Demnächst könnten sie von EU-Soldaten geschützt werden. Die Außenminister haben dazu ein Mandat für neun Monate beschlossen. Brüssel - Die EU-Außenminister haben in Brüssel ein Mandat verabschiedet, mit dem rund 500 Soldaten in die Zentralafrikanische Republik geschickt werden können. Die Truppen der Mission mit dem Namen Eufor RCA (European Forces Republic of Central Africa) sollen helfen, die Lage rund um die Hauptstadt Bangui zu kontrollieren. Bei Massakern muslimischer und christlicher Milizen wurden in den letzten Monaten über 1000 Menschen getötet, mehr als 800.000 befinden sich landesweit auf der Flucht. Neben der Versorgung von Flüchtlingen würde die EU-Truppe die etwa 1600 französischen und 5000 afrikanischen Soldaten unterstützen, die dort bereits im Einsatz sind. Nachdem Frankreich zunächst auf eigene Faust Soldaten entsandt und die EU um Unterstützung gebeten hatte, gilt das Mandat der EU nun für neun Monate. Welche und wie viele Soldaten in Marsch gesetzt werden, ist jedoch von einem weiteren Beschluss der EU-Außenminister und der Bereitschaft der Mitgliedstaaten abhängig. Sie müssen entscheiden, ob sie Truppen oder militärische Fähigkeiten zur Verfügung stellen wollen. \"Der Schutz der Zivilbevölkerung vor Gewalt hat absolute Priorität\", sagte die EU-Außenbeauftragte Catherine Ashton. \"Eufor RCA wird so schnell wie möglich zum Einsatz kommen, um Frankreich und unsere afrikanischen Partner zu unterstützen.\" In der Zentralafrikanischen Republik herrscht seit dem Putsch der Seleka-Rebellenbewegung im März 2013 Chaos, die öffentliche Ordnung ist zusammengebrochen. Die Vereinten Nationen sprechen von einer schweren humanitären Krise, dem Land drohe ein Völkermord. GroKo debattiert über Afrika-Strategie Deutschland will sich nicht mit Soldaten an der EU-Mission beteiligen, erwägt aber, ein Sanitätsflugzeug zur Verfügung zu stellen. Die Große Koalition hat angekündigt, über die Teilnahme an Militäreinsätzen hinaus eine neue Afrika-Strategie zu entwickeln. In der kommenden Woche treffen sich dazu Verteidigungsministerin Ursula von der Leyen (CDU), Außenminister Frank-Walter Steinmeier (SPD) und Entwicklungsminister Gerd Müller (CSU) zum Gespräch. Das aktuelle Afrika-Konzept der Regierung stammt aus dem Jahr 2011. Auf Wunsch der CSU soll es nächste Woche auch beim ersten schwarz-roten Koalitionsausschuss um das Thema Auslandseinsätze gehen. Rund 100 Bundeswehr-Soldaten nehmen derzeit an einer EU-Ausbildungsmission im westafrikanischen Mali teil.",http://www.spiegel.de/politik/ausland/eu-beschliesst-mission-fuer-zentralafrika-a-952637.html,2014-02-10T00:00:00.000Z
"Kampf gegen IS Die Verstärkung für Kobane ist da Die kurdischen Kämpfer in Kobane bekommen Unterstützung im Kampf gegen die IS-Milizen. Peschmerga-Einheiten und Kämpfer der Freien Syrischen Armee sind in der türkischen Grenzstadt Sanliurfa angekommen. Wochenlang haben Politiker vor allem aus den USA auf die türkische Regierung eingeredet: Die Türkei möge im Kampf gegen die Terrormiliz \" Islamischer Staat \" (IS) und insbesondere bei der Verteidigung der überwiegend von Kurden bewohnten syrischen Grenzstadt behilflich sein. Offensichtlich haben die Bemühungen gefruchtet: Die kurdischen Kämpfer erhalten erstmals Hilfe durch Bodentruppen. Um kurz nach ein Uhr in der Nacht auf Mittwoch landete in der türkischen Stadt Sanliurfa eine Maschine aus dem kurdischen Autonomiegebiet im Nordirak mit 80 Peschmerga-Soldaten. Zusätzlich war nach Angaben der Peschmerga ein Militärkonvoi aus dem nordirakischen Arbil mit 70 Kämpfern unterwegs nach Kobane . Mehrere Transporter hätten Waffen geladen, darunter Maschinengewehre und Artillerie. Der türkische Außenminister Mevlüt Cavusoglu hatte am Dienstag gesagt, die Peschmerga könnten \"jeden Moment\" die Grenze nach Syrien überqueren und in Kobane kämpfen. Augenzeugen berichteten, es seien bereits Peschmerga-Einheiten in der Türkei. Diese Angaben ließen sich nicht unabhängig überprüfen. Zudem trafen am Mittwoch auch 150 Kämpfer der Freien Syrischen Armee (FSA) in Kobane ein. Die oppositionelle FSA kämpft seit Jahren gegen den syrischen Machthaber Baschar al-Assad , aber auch gegen den IS. Ihr Verhältnis zu den syrischen Kurden war in der Vergangenheit angespannt: Sie hatte ihnen vorgeworfen, mit Assad kooperiert zu haben. Mit IS haben sie nun einen gemeinsamen Feind. Ein türkischer Behördenvertreter sagte, die FSA-Angehörigen hätten in der Nacht auf Mittwoch die Grenze im türkischen Mürsitpinar überquert. Die Syrische Beobachtungsstelle für Menschenrechte bestätigte das, sprach aber von 50 FSA-Kämpfern. Insgesamt acht Fahrzeuge sollen die Grenze dabei überquert haben, meldete die kurdische Nachrichtenagentur Firat.   Seit Anfang September versuchen Kämpfer des IS, Kobane zu erobern. Die Dschihadisten belagern die Grenzstadt von Westen, Süden und Osten aus. Die Kurden können lediglich aus dem Norden über die Türkei Verstärkung und Nachschub erhalten. Ankara verweigerte den Zugang aber wochenlang, was zu heftigen Protesten der Kurden führte. In mehreren türkischen Städten kam es zu teilweise gewalttätigen Zusammenstößen. Die USA und ihre Partner im Kampf gegen den IS fliegen seit Wochen Luftschläge gegen IS-Stellungen in und um Kobane, können die Extremisten aber nicht zurückschlagen, da die mobilen IS-Einheiten nur schwer aus der Luft zu treffen sind. US-Außenminister John Kerry hat zudem deutlich gemacht, aus rein militärischer Sicht sei Kobane irrelevant und eine Einnahme durch den IS nicht von Bedeutung. In Kobane starben mindestens 800 Menschen Wichtiger im Kampf gegen die Dschihadisten sind Öl- und Gasfelder, die für den IS wichtige Einnahmequellen sind. Zuletzt hat es daher erneut heftige Kämpfe um solche Rohstoffreserven im Westen Syriens gegeben - dabei sollen Dutzende Wachleute und Milizionäre getötet worden sein . Doch die ganze Welt schaut von den Hügeln auf der türkischen Seite der Grenze auf Kobane, auf die Grenzstadt, die zu einem Symbol für den Kampf gegen IS geworden ist. Journalisten haben dort Position bezogen, Dutzende Fernsehkameras sind auf Kobane gerichtet und Tausende von Flüchtlingen blicken auf ihre Heimat, die vor ihren Augen zerbombt und zerschossen wird. Mal rücken IS-Kräfte vor, dann wieder schaffen es die Kämpfer der PKK sowie der kurdischen Volksschutzeinheiten (YPG), dem syrischen PKK-Ableger, die Dschihadisten zurückzudrängen. Beobachter gehen davon aus, dass bislang mehr als 800 Menschen in Kobane getötet worden sind . Weil die PKK in der Türkei sowie in der EU und in den USA nach wie vor als Terrororganisation eingestuft ist, zögerte Ankara damit, deren Kämpfern in Kobane Hilfe zukommen zu lassen. Immer wieder wurden kurdische Freiwillige, die sich den Volksschutzeinheiten anschließen wollten, von türkischen Grenzsoldaten abgewiesen. Sie gelangten zwar illegal doch nach Kobane, aber ohne Waffen und in zu geringer Zahl, um eine echte Verstärkung zu sein. Dass die Türkei nun sowohl Peschmerga-Kämpfern als auch Angehörigen der FSA erlaubt, über ihr Staatsgebiet nach Kobane zu gelangen, könnte den Kampf zugunsten der Verteidiger entscheiden. Von türkischer Seite aus stehe dem nichts entgegen, sagte Außenminister Cavusoglu. Die Türkei habe mehrfach ihre Bereitschaft gezeigt, sowohl den Peschmerga als auch der FSA zu helfen. Staatspräsident Recep Tayyip Erdogan hatte vergangene Woche mitgeteilt, insgesamt 1300 FSA-Leute sollten demnächst in Kobane kämpfen.",http://www.spiegel.de/politik/ausland/is-islamischer-staat-peschmerga-und-fsa-helfen-kurden-in-kobane-a-999948.html,2014-10-29T00:00:00.000Z
"Vergeltung für Mord an Piloten Jordanien will Militäreinsatz gegen den IS ausweiten Die jordanische Regierung beugt sich offenbar dem öffentlichen Druck: Nach der Ermordung des Piloten Muaz al-Kasaesbeh will sie sich stärker am Kampf gegen den \"Islamischen Staat\" beteiligen. Amman - Jordanien will den Kampf gegen die Terrormiliz \"Islamischer Staat\" (IS) intensivieren. In der von den USA geführten Koalition gegen die Dschihadisten werde das Königreich seinen Beitrag erhöhen, sagte ein Regierungssprecher der Nachrichtenagentur Reuters zufolge. Dabei würden \"alle Optionen diskutiert\" . König Abdullah II. plane noch am Mittwoch ein Spitzentreffen mit hochrangigen Sicherheitsexperten. Der Schritt ist offenbar eine Reaktion auf die Ermordung des jordanischen Piloten Muaz al-Kasaesbeh durch die Terrormiliz, die das Königshaus unter Zugzwang gesetzt hat . Die Geisel wurde offenbar bereits vor mehreren Wochen bei lebendigem Leib verbrannt , ein Video der Tat tauchte am Dienstag im Internet auf . \"Wir sprechen über gemeinsame Bemühungen zwischen Mitgliedern der Allianz, um unsere Bestrebungen zu intensivieren, Extremismus zu stoppen und Terrorismus zu untergraben \", sagte der Regierungssprecher demnach weiter: \"Alle staatlichen Militär- und Sicherheitsbehörden bauen ihre Möglichkeiten aus.\" Jordaniens Antwort werde von der ganzen Welt gehört werden. König Abdullah II. selbst hatte sich am Dienstagabend in einer TV-Ansprache an sein Volk gewandt: \"In diesen schwierigen Zeiten ist es die Pflicht aller Bürger, die Reihen zu schließen \", sagte er. Welche Schritte Jordanien nun konkret plant, ist noch nicht klar. Die Politik des Königshauses, sich an der US-geführten Koalition gegen den IS zu beteiligen, polarisiert bereits seit Längerem das Land: Viele Jordanier sehen die Konflikte in Nachbarländern nicht als ihr Problem an. Zudem gibt es in Jordanien IS-Sympathisanten, deren Wut auf das Königshaus wächst . Im vergangenen Jahr organisierten sie bereits kleine Pro-IS-Demonstrationen im Süden des Landes. Jordanien steht wegen der Flüchtlingszahlen aus Syrien und dem Irak unter enormem Druck: Das kleine Land mit knapp sieben Millionen Einwohnern hat rund 800.000 Flüchtlinge aufgenommen, bis Ende des Jahres werden es Uno-Schätzungen zufolge eine Million sein. In den vergangenen Wochen wurde aus diesem Grund bereits öffentlich Kritik an König Abdullah II. laut - ein in Jordanien unerhörter Vorgang.",http://www.spiegel.de/politik/ausland/jordanien-will-einsatz-gegen-islamischen-staat-is-ausweiten-a-1016720.html,2015-02-04T00:00:00.000Z
"Münchner FanRun FC Bayern und \"Bild\" irritieren mit Charity-Aktion Eigentlich eine gute Idee: Für die Flüchtlingshilfe sollen Bayern-Fans in die Münchner Arena laufen. Doch die Umsetzung wirft Fragen auf. Wie viel Geld kommt bei Charity-Organisationen an? Von Benjamin Knaack Christian O. Bruch/ laif Benjamin Knaack Jahrgang 1984. Studierte eine zeitlang Geschichte und klassische Archäologie in Köln, kam dann aber zum Journalismus. Master of Arts in Journalistik und Kommunikationswissenschaft an der Universität Hamburg. Praktika und freie Mitarbeit bei SPIEGEL ONLINE, \"taz nord\" und \"Hamburger Morgenpost\". Seit Januar 2014 Volontär bei SPIEGEL ONLINE mit Stationen beim SPIEGEL, an der Henri-Nannen-Schule und beim Schweizer Newsportal \"Watson\". Seit September 2015 Redakteur im Sportressort. E-Mail: Benjamin.Knaack@spiegel.de Twitter: @BenjaminKnaack1 folgen Mehr Artikel von Benjamin Knaack Eine gemeinsame Aktion des Bundesliga-Rekordmeisters FC Bayern München und der \"Bild\"-Zeitung verwundert die Fans. Am 10. Oktober sollen 20.000 Läufer am \"FC Bayern FanRun in der Allianz Arena\" teilnehmen. Mit dem Fünf-Kilometer-Lauf setze \"jeder Läufer ein Zeichen für Menschlichkeit\", heißt es auf der Internetseite des Klubs. \"Die größte Flüchtlingswelle seit vielen Jahrzehnten stellt auch Deutschland vor eine große Herausforderung\", sagte Bayern-Boss Karl-Heinz Rummenigge. \"Die Bundesliga hat hier die Verpflichtung, sich in verantwortungsvoller Weise zu präsentieren. Mit dem FC-Bayern-FanRun besteht für uns, für alle Fans die Möglichkeit, dieser Verantwortung mit einer schönen sportlichen Geste gerecht zu werden.\" Der Lauf findet in Kooperation mit der \"Bild\"-Zeitung statt, demnach unterstützen die Teilnehmer mit der Startgebühr von 29,99 Euro die Aktionen #refugeeswelcome - WIR HELFEN sowie \"Ein Herz für Kinder\", bei denen das Boulevardblatt federführend ist. Für weitere Informationen wird auf die Seite fan.run verwiesen. Doch dort blieben zunächst zentrale Fragen ungeklärt, hinzu kommen Ungereimtheiten, die viele Fußball-Interessierte ins Grübeln brachten. GmbH \"in Gründung\" Das bekannte Bayern-Blog \"Miasanrot\" veröffentlichte zu diesem Thema einen Eintrag, überschrieben mit \" FanRun mit Fragezeichen \". Der Twitteruser @Helmi hatte ebenfalls einige kritische Fragen - und sammelte Hinweise und Rechercheergebnisse in einem Storify . Es beginnt beim Veranstalter: Im Unternehmensregister sowie im Handelsregister wird kein Unternehmen mit dem Namen FanRun GmbH geführt. Für Aufklärung sorgt hier aber das Registergericht München. Dort sei zu dem Namen der Firma ein Vorgang im System zu finden, sagte ein Sprecher SPIEGEL ONLINE. Die FanRun GmbH habe sich demnach angemeldet. Sie ist also offiziell eine GmbH i.G., also \"in Gründung\". Auf der Internetseite fehlte ein solcher Hinweis jedoch, erst nach einer schriftlichen Anfrage wurde der Zusatz eingefügt. Eine Handelsregistereintragung werde voraussichtlich am Freitag erfolgen, teilte FanRun-Geschäftsführer Ralf Nagel mit. Vorher: FanRun GmbH Nachher: FanRun GmbH i.G. Ebenfalls merkwürdig: Für die Anmeldung zum Rennen bekommt man es mit drei unterschiedlichen Namen zu tun: Das Anmeldeformular ist auf der Fanrun-Seite zu finden, bereitgestellt wurde es jedoch von Trackmyrace.com . Die Abbuchung wiederum erfolgt zugunsten der Mandigo GmbH . Ein Blick in die Impressen der Seiten zeigt: Alle drei Angebote haben ihren Sitz in der Münchner Gollierstraße, Geschäftsführer von Mandigo ist derselbe wie bei Fanrun: Ralf Nagel. Dieser begründet das Vorgehen so: \"Wir haben kurzfristig eine Veranstaltungsgesellschaft FanRun gegründet, um einer Veranstaltung dieses Formats gerecht zu werden.\" Trackmyrace.com sei demnach keine eigene Firmierung, sondern ein Produkt der Firma Mandigo. Und wo landet das Geld? Eine zentrale Frage bleibt auch beim Blick in die Teilnahmebedingungen und AGBs ungeklärt: Wie viel Geld kommt am Ende bei den konkreten Projekten an? Die gesamte Teilnahmegebühr von 29,99 Euro, wie es die Botschaft des FC Bayern suggeriert? Oder bekommen die Münchner etwas ab? Wie viel landet bei welchem Hilfsprojekt? Und fallen bei der FanRun GmbH, die ja ein kommerzielles Unternehmen ist, wirklich keine Gebühren für Organisation und Ausrichtung an? Das deutsche Zentralinstitut für soziale Fragen, das ein Spenden-Siegel herausgibt, schreibt in seinen Leitlinien : \"Die Organisation setzt ihre Mittel ausschließlich für die in der Satzung festgelegten Zwecke ein. Sie organisiert, dokumentiert und belegt dies in angemessener Weise. Es besteht kein Missverhältnis zwischen den in der Satzung genannten Zwecken und den tatsächlich realisierten Vorhaben.\" Beim FanRun ist ein solches Spenden-Siegel nicht zu finden. Die Zwecke sind zwar vom FC Bayern genannt (#refugeeswelcome - WIR HELFEN und \"Ein Herz für Kinder\"), die FanRun GmbH gibt hingegen nur allgemeine Infos über die Charity-Aktionen, die Strecke und den Rennablauf bekannt, Hinweise zur konkreten Aufteilung des Geldes lassen sich nicht finden. Erst auf Nachfrage erklärt Nagel hierzu: \"Nach Abzug der Eventkosten werden die Einnahmen aus Spenden und Startgeldern vollständig an Flüchtlingsprojekte gegeben.\" Wie hoch die Eventkosten jedoch sind, blieb unbeantwortet. Die \"Bild\"-Zeitung ließ mitteilen, dass man an der Aktion kein Geld verdiene. Der FC Bayern hat sich trotz Anfrage noch nicht zu den offenen Fragen geäußert. Gutschein fürs \"Bildplus\"-Abo Ein weiteres Detail, das für Verwirrung in der Fan-Gemeinde sorgte: Ursprünglich gab es bei der Anmeldung offenbar einen Reiter mit der Botschaft: \"1 Jahr Bildplus Digital inkl. Bundesliga bei Bild im Wert von 59,88 Euro in der Anmeldegebühr enthalten.\" Beinhaltete die Anmeldung etwa den automatischen Abschluss eines solchen Abos? Auch hier gab es später eine Veränderung. Vorher: Abo enthalten, Quelle: Twitter Nachher: Gutschein enthalten Nun heißt es auf der Internetseite, dieses Paket sei lediglich als Gutschein enthalten. Es finde keine automatische Anmeldung statt. Laut Geschäftsführer Nagel sind die Gutscheine automatisch in die Anmeldung über Trackmyrace.com integriert, sie könnten optional genutzt werden. Alles in allem: Ziemlich viel Intransparenz für einen guten Zweck. Im Video: Wie die Bundesligisten Flüchtlingen helfen Video SPIEGEL ONLINE",http://www.spiegel.de/sport/fussball/fanrun-des-fc-bayern-und-der-bild-verwirrende-charity-aktion-a-1053452.html,2015-09-18T00:00:00.000Z
"Flüchtlingskrise Kroatiens Regierungschef schlägt Alarm Die meisten Grenzübergänge sind geschlossen, doch Tausende Flüchtlinge gelangen über die Felder nach Kroatien. Premier Milanovic warnt, er habe die Lage nicht mehr unter Kontrolle. Jetzt will er die Menschen nach Ungarn schicken. Die Lage in Kroatien wird nach Ungarns Abschottungspolitik immer chaotischer. Sollte der Andrang der Flüchtlinge nicht abreißen, sei es nur \"eine Frage der Zeit\", bis der komplette Grenzverkehr eingestellt wird, sagte Innenminister Ranko Ostojic. Bislang sind rund 14.000 Flüchtlinge in dem kleinen Balkanstaat angekommen. Das Land könne den Andrang nicht mehr kontrollieren, sagte Ministerpräsident Zoran Milanovic. Kroatien werde diese Last nicht mehr akzeptieren. \"Sie bekommen Nahrungsmittel, Wasser und medizinische Hilfe, dann können sie ihre Reise fortsetzen\", sagte der Regierungschef. \"Wir haben ein Herz, aber wir haben auch einen Kopf.\" Er habe eine Sitzung des Nationalen Sicherheitsrates einberufen, um eine Änderung der Flüchtlingspolitik zu erörtern. Die ins Land drängenden Flüchtlinge will der Regierungschef jetzt nach Ungarn umleiten lassen: Ab heute verfolgen wir eine neue Methode, wir gehen jetzt zu Plan B über. \" Die ungarische Regierung baut jedoch auch an der Grenze zu Kroatien weiterhin einen Zaun, um - wie bereits an der Grenze zu Serbien - die Ankunft weiterer Flüchtlinge zu verhindern. Der EU warf Milanovic vor, Kroatien mit dem Problem allein zu lassen und sich um eine Lösung zu drücken. Bundeskanzlerin Angela Merkel habe außerdem mit der von ihr vertretenen Grenzöffnung für Flüchtlinge der der Darstellung Deutschlands als \"Land der Herzen\" zur Krise beigetragen. \"Das war in gewisser Weise für diese Leute die Einladung\", sagte Milanovic. Flüchtlinge strömen nach Augenzeugenberichten in der Region um Sid über Felder über die Grenze von Serbien nach Kroatien. Die offiziellen Grenzübergänge in der Gegend waren zuvor geschlossen worden . Wegen des starken Andrangs der vergangenen Tage hatte die Regierung in Zagreb in der Nacht zum Freitag sieben von acht Grenzübergängen zu Serbien geschlossen. Allein in der vergangenen Nacht waren 30 Busse aus dem Nachbarland an die Grenze gekommen. Oppositionsführer Tomislav Karamarko verlangte den Einsatz der Armee, um den Andrang aus Serbien zu stoppen. Denn ein Ende ist nicht abzusehen: Rund 8000 Flüchtlinge warteten in Beli Manastir im Nordosten des Landes nahe Ungarn , um weiter in Richtung Slowenien reisen zu können. Slowenien will allerdings einige Hundert Flüchtlinge schon zurückschicken. Doch Kroatiens Regierung weigere sich strikt, diese Menschen wieder einreisen zu lassen, berichtete die Polizei. Slowenien wies die Behauptung Kroatiens zurück, beide Länder planten einen humanitären Korridor, um die Flüchtlinge in Richtung Österreich und Deutschland weiterreisen zu lassen. Die Äußerungen des kroatischen Innenministers seien gefährlich, weil sie etwas versprächen, was nicht geschehen dürfe, sagte Sloweniens Regierungschef Miro Cerar dem Fernsehsender RTV Slo. Sein Land dürfe niemanden durchlassen, der die Bedingungen für die Einreise in den Schengen -Raum nicht erfülle. Slowenien stoppte außerdem den internationalen Zugverkehr - zunächst bis 18 Uhr. Video: Balkanroute wird für viele Flüchtlinge zur Sackgasse Video Getty Images",http://www.spiegel.de/politik/ausland/kroatien-immer-mehr-fluechtlinge-a-1053654.html,2015-09-18T00:00:00.000Z
"SPD-Chef Gabriel Er will es Sigmar Gabriel versucht in seiner Parteitagsrede, sich von der Kanzlerin abzusetzen. Endlich drückt er sich nicht mehr um seine Rolle als Kanzlerkandidat der SPD. Ein Kommentar von Gordon Repinski Gordon Repinski E-Mail: gordon.repinski@spiegel.de Twitter: @GordonRepinski folgen Mehr Artikel von Gordon Repinski Kommentar Sollten Sie es nach der Rede von Sigmar Gabriel vergessen haben, hier eine kurze Erinnerung. Die aktuelle Koalition auf Bundesebene besteht aus Union und SPD. Sigmar Gabriel ist der Vizekanzler von Angela Merkel. In Koalitionen arbeitet man üblicherweise miteinander, nicht gegeneinander. Auf allzu harte, öffentliche Kritik sollten die Partner verzichten.   Die Rede von Sigmar Gabriel klang dagegen stellenweise, als wollte der SPD-Chef die Prinzipien dieser Zusammenarbeit lieber heute als morgen kündigen. Der Vorsitzende bei seinem Parteitagsauftritt kurz zusammengefasst: Die SPD ist der verantwortungsbewusste Teil der Bundesregierung. Die Union und die Bundeskanzlerin entwickeln sich zunehmend zu unsicheren Kantonisten. Insbesondere beim Thema Europa griff Gabriel die Kanzlerin an: Der \"Hochmut\" der vergangenen Jahre, die \"Bevormundung vieler anderer europäischer Mitgliedsstaaten\" räche sich in der Flüchtlingspolitik, zitierte Gabriel den verstorbenen Altkanzler Helmut Schmidt. Es sei zudem \"eine Schande, dass die Konservativen und auch die deutsche CDU\" eine Entwicklung wie in Frankreich zulassen, so Gabriel. Die Union habe also Mitschuld am Aufstieg der Rechten. Parteitagsrhetorik, einerseits. Für Merkel müssen sich die Worte aus dem Mund des Koalitionspartners dennoch wie eine Unverschämtheit angehört haben. Gabriel hat ein schweres Jahr hinter sich, in dem er auch Fehler gemacht hat. Seine anfangs zu offene Haltung gegenüber den Anhängern von Pegida und die teilweise harsche Rhetorik gegenüber Griechenland auf dem Höhepunkt der Schuldenkrise haben ihm viele Genossen übel genommen. Es schien in jenen Wochen zeitweise, als hätte er seinen Kompass verloren. Inzwischen hat er sich wieder gefangen, weil er die SPD in der Flüchtlingskrise als pragmatische Kraft positioniert hat. Zudem wissen die Genossen ohnehin, dass es in dieser Legislaturperiode keine Alternative zu Gabriel gibt. Nicht an der Spitze der Partei, nicht als Kanzlerkandidat. Dass Gabriel um die Kanzlerkandidatur nicht mehr herumkommt, scheint er mittlerweile akzeptiert zu haben. Lange genug hat er den Eindruck des Parteichefs vermittelt, der am liebsten immer eine Alternative zu sich selbst anzubieten hat, damit er sich der Verantwortung nicht selbst stellen muss. Nun hat er sich wenigstens einen Ruck gegeben, dieses Zaudern aufzugeben. In seiner Rede präsentierte er sich als Mann der Mitte - und gibt damit der SPD schon die Richtung für seinen Wahlkampf vor. Aber welche Perspektiven hat Gabriel? Seit Jahren hängt die SPD im 25-Prozent-Tief, es gibt keine Bewegungen. Selbst jetzt, da Angela Merkel ihre Unantastbarkeit durch die Flüchtlingskrise verloren hat, kann die SPD nicht von den Verlusten der Union profitieren. Gabriel steht vor einem mindestens komplizierten, wahrscheinlich nahezu aussichtslosen Wahlkampf, in dem der SPD nicht nur die Wählerstimmen fehlen werden, sondern auch die Aussicht eines Koalitionspartners. Von Rot-rot-grün ist die SPD weiter entfernt als je zuvor. In seiner Rede erwähnte Gabriel die Linkspartei nicht einmal mehr ernsthaft. Am Ende wird das Maximalziel des Wahlkampfes für die SPD sein, sich wieder in eine Große Koalition zu retten. Nur noch \"bis 2017\" werde er zu Angela Merkel nach Berlin fahren, hat Gabriel seiner Tochter versprochen. Das erzählte er in seiner Rede. Die Wahrheit ist: Nur wenn es schlecht läuft, behält Gabriel Recht. Wenn es gut läuft, geht es nach 2017 genau so weiter. Keine sehr ermutigende Perspektive für die SPD. Videoanalyse zum SPD-Parteitag Video SPIEGEL ONLINE",http://www.spiegel.de/politik/deutschland/spd-parteitag-sigmar-gabriel-naehert-sich-kanzlerkandidatur-a-1067365.html,2015-12-11T00:00:00.000Z
