article,article_url,date
"Globalisierung in Indien Die Gefährdung der Adivasis Globalisierung und Traditionsverlust: Während die indische Wirtschaft boomt, droht die Einseitigkeit des Wachstums die kulturell einzigartigen Volksgruppen der indischen Ureinwohner zu entwurzeln und zu zerreißen. Eine Reise nach Umri, einem Dorf im Bundesstaat Madhya Pradesh. Von Lars Meyer Nach gut zwölf Stunden Zugfahrt und einer weiteren Stunde im Bus endet die Reise von Neu-Delhi nach Umri mit einem Fußmarsch durch Manglias Maisfeld. Kurz hinter der Distriktshauptstadt Jhabua, mitten im zentralindischen Nirgendwo, sind wir ausgestiegen und noch einige Kilometer querfeldein gelaufen. Und als sich inmitten der steinigen Hügellandschaft die kleinen Felder und Hütten Umris abzeichnen, finden wir uns in einer Idylle wieder, in der Manglias Freund Tan Singh und einige Kinder nun völlig zu Recht mit stolzem, fast patriotischen Lächeln zur Begrüßung heraneilen. Mit dem Marsch von der Hauptstraße nach Umri endete zugleich die Reise in ein anderes Indien, das mit den pulsierenden Metropolen und ihren mehrspurigen Hochstraßen, gläsernen Bürotürmen und funkelnden Einkaufszentren nichts gemein hat. Wenn nicht schon vor einigen Jahrhunderten, so scheint die Zeit hier zumindest irgendwann vor 1991, dem Geburtsjahr des indischen Wirtschaftswunders, stehen geblieben zu sein. Manglia und Tan Singh sind Adivasis, indische Ureinwohner vom Stamm der Bhil. Zahlreiche Legenden und Überlieferungen in den großen indischen Epen ranken sich um die Bhil, von denen heute noch etwa zwei Millionen im nordwestlichen Indien leben. Die Geschichten gehen zumeist auf die etymologische Bedeutung des Stammesnamens - \"Bogen\" - zurück. Sie erzählen von der traditionellen Profession der Bhil als Jäger und Krieger von unbezwingbarem Willen, nahezu grenzenloser Opferbereitschaft und Treue und von ihrem Leben in Einheit und Austausch mit der Natur. Entsprechend der Tradition ihrer Volksgruppe bewachen Manglia und Tan Singh als Nachtwächter die nahe Umri gelegene Station einer einheimischen Entwicklungshilfeorganisation. Wachsende Spannungen Regierungsangaben zufolge ist Jhabua eines der zehn ärmsten Distrikte des Subkontinents. Große Wälder sind zu weit entfernt, als dass auch die heutigen Generationen die Lebensweise ihrer Vorfahren fortführen und als Nomaden jagen und sammeln könnten. Da sie darüber hinaus auf den jeweils unter den Söhnen aufzuteilenden kleinen Feldern mit dem Anbau von Mais und Weizen oft nicht einmal mehr die Versorgung der Familie gewährleisten oder gar Geld verdienen könnten, sind heute fast alle jungen Männer in der Region auf Arbeit in den Städten angewiesen. Gleichwohl haben die Bhil bis heute ein besonderes Verhältnis zu ihrer Umwelt bewahrt. Heilmittel für fast alle Krankheiten finden die Badwa, die Medizinmänner, in den umliegenden Wäldern. Allein aus dem in dieser Region weit verbreiteten Neem-Baum gewinnen sie vom Insektenpestizid bis zur Wundkompresse dutzende Wirksubstanzen und Produkte. Viele Häuser werden ausschließlich aus Materialien gefertigt, die Wald und Nutztiere spenden: Steine und Äste, zementiert durch ein Erde-Kuhdung-Gemisch, dazu Bambus und Blätter. Missionare oder fundamentalistische Hindus nehmen die Eigenartigkeit und kulturelle Autarkie der Bhil oftmals zum Anlass, deren Religion als altertümlichen, primitiven Aberglauben zu verurteilen. Insbesondere die \"schwarze Magie\" der Medizinmänner wird seit jeher zur Rechtfertigung für die Konvertierung der Adivasis zu Christentum oder Hinduismus bemüht. Menschenrechtler berufen sich dagegen auf die Unantastbarkeit der Traditionen und Überzeugungen eines kulturell einzigartigen Volkes und warnen vor seiner Absorption durch \"Hinduisierung\" und wachsende kulturelle und religiöse Intoleranz in einem Land, in dem die Spannungen unter den unzähligen, über Jahrhunderte weitgehend friedlich koexistierenden Glaubensrichtungen stetig zu wachsen scheinen. Unbemerkt im \"Globalen Dorf\" Als sich über dem fragilen Dach die letzten großen Monsunwolken des Jahres in die feucht-heiße Abendluft entladen, sitzen wir in Manglias Hütte. Seine Kinder schälen goldgelbe Maiskolben, die seine Frau und seine Schwiegermutter gleichmäßig über der Feuerstelle drehen, während Tan Singh von den Grundzügen der Religion der Bhil erzählt. Bhagavan steht an der Spitze einer Hierarchie zahlloser Gottheiten, in der auch hinduistische Götter wie Krishna oder Rama und sogar die Geister der Ahnen feste Plätze einnehmen. Wenig später erwähnt Tan Sing Gerüchte, nach denen ganz in der Nähe ein Kraftwerk zur Energiegewinnung gebaut werden soll. Ein Kraftwerk? Ja. Nun auch hier. Indiens Wirtschaft, seit der Outsourcing-Welle Anfang dieses Jahrtausends endgültig an die Weltmärkte angeschlossen, boomt seit Jahren mit einem Wachstum von fast 10%. Das Land wird von ausländischen Unternehmen längst nicht mehr nur als bevorzugter Standort für die Ausgliederung von Unternehmensprozessen oder zur Softwareprogrammierung, sondern vermehrt auch als chancenreicher neuer Absatzmarkt für westliche Konsumgüter wahrgenommen. \"Globalisierung\" nennt diesen Prozess in Jhabua natürlich niemand, und im aktuellen vom Entwicklungsprogramm der Vereinten Nationen (UNDP) veröffentlichten Human Development Index rangiert Indien als zehntgrößte Volkswirtschaft der Erde nur auf Platz 128 und damit noch immer weit hinter anderen aufstrebenden Staaten wie China (86) und Brasilien (63). Schwierig ist sicher auch, einem Dorfbewohner zu erklären, dass er eigentlich längst im \"Globalen Dorf\" wohnt, wo er doch noch nie in außerhalb des Distrikts Jhabua war und seine Maßeinheit für 1000 Meter nicht 1 Kilometer, sondern \"etwa 100 Häuser von hier\" ist. Fatale Folgen Doch vor allem die kulturellen Auswirkungen dieser Entwicklung auf die Adivasis sind schon jetzt unverkennbar. Denn kaum anderswo zeigt sich gerade die Ambivalenz eines rasanten Globalisierungsprozesses so deutlich wie in Indien. Einerseits knüpfen internationale Hilfsorganisationen und Unternehmen ein effizientes Netz zur Gewährleistung flächendeckender medizinischer Versorgung und Schulausbildung sowie zur Modernisierung der Infrastruktur. (Cholera, Typhus oder Lepra, einst auch in dieser Region wütende Seuchen, sind mittlerweile sehr selten, Impfkampagnen gegen Polio haben angeschlagen.) Gleichzeitig aber bieten sich für die weitgehend auf die Landwirtschaft angewiesenen Ureinwohner angesichts des durch Subventionen und Zölle in den Industriestaaten erschwerten Zugangs zu den globalen Agrarmärkten immer schlechtere Absatzmöglichkeiten. Diese zwingen die Landbevölkerung nicht nur zur Suche nach neuen Einkunftsmöglichkeiten, sondern zeichnen sich indirekt auch für den \"Import\" neuer Krankheiten verantwortlich: Bhil-Frauen, die sich an den Hauptstraßen für einige Rupien prostituieren und Arbeitsmigranten bringen HIV und Syphilis in die Dörfer; Hunger und Perspektivlosigkeit sorgen für Depression, Alkoholismus und sogar Selbstmord unter den Männern. Im Jahr 2007 begingen so mehr als 17.000 indische Bauern Selbstmord. Chancen für den Fundamentalismus Für die Versorgung und Expansion der rasant wachsenden Volkswirtschaft, die mit den großen Wirtschaftsnationen und vor allem China konkurrieren will, werden zudem vermehrt auch die abgeschiedenen Lebensräume der Ureinwohner erschlossen. Offiziellen Angaben zufolge wurden etwa weit über 40.000 Familien, das heißt etwa eine viertel Million Adivasis, zugunsten von Überschwemmungen für das Sardar Sarovar-Staudammprojekt aus ihrer gewohnten Umgebung in zumeist steinige, unfruchtbare Gebiete umgesiedelt. Schließlich verstärkt die zunehmende wirtschaftliche Ungleichheit zwischen den Menschen in den von Unternehmergeist und Modernisierung wie elektrisierten Städten und den von der Politik vernachlässigten Bauern ein weiteres Phänomen, das die Schattenseiten des rasanten Wachstums der indischen Wirtschaft offenbart: In der Konfusion und dem Frust der Landbevölkerung sehen fundamentale, zumeist hinduistische Bewegungen die Chance, vor allem die illiteraten Ureinwohner gegen Andersgläubige zu mobilisieren. Plötzlich muss sich das traditionell multireligiöse und tolerante Indien mit gewalttätigen Übergriffen auf christliche Institutionen oder mit Massakern an Muslimen in Gujarat und sogar Mumbai auseinandersetzen. Zynischerweise sind es dabei gerade der indische Demokratiepatriotismus und die staatliche Liberalität in Bekenntnisfragen, die den Nährboden für das Sendungsbewusstsein der jeweils überzähligen ethnischen, religiösen oder politischen Gruppen schaffen. Identitätsverlust in der Massengesellschaft Diese Gemengelage von Migration und Umsiedlung, HIV und genereller Unzufriedenheit führt in Regionen wie Jhabua zu einem rasanten Entfremdungsprozess, in dem sich die Bhil von ihren uralten Traditionen und Wertordnungen lösen müssen, um einen Platz im \"modernen Indien\" zu finden. Als Kastenlose werden sie zugleich jedoch nie vollwertige Teile der urbanen Gesellschaft. Stattdessen beginnen sie, zu vergleichen und zu begehren, verlieren ihre Identität, ihre Genügsamkeit und ihr Selbstwertgefühl und werden schließlich von der kulturellen Massengesellschaft absorbiert. Autarke Volksgruppen verschwinden - und mit ihnen ihre Kulturen, Sprachen, Werte und Weisheiten. Zwar verspricht die Regierung von Premierminister Manmohan Singh, die Ureinwohner bei Indiens wirtschaftlichem Aufstieg nicht zu vergessen. Ihre Maßnahmen, etwa der Rural Employment Guarantee Act, ein Gesetz welches den Menschen der 200 ärmsten Distrikte mindestens 100 Tage Arbeit im Jahr garantiert, konnten diesen Entfremdungsprozess bisher aber nicht aufhalten, sondern allenfalls erträglicher machen. Hilfe zur Wahrung von kultureller Vielfalt Umso wichtiger erscheint daher der Einsatz zahlloser Hilfsorganisationen und Aktivisten wie beispielsweise jener der vielfach ausgezeichneten Autorin Arundhati Roy für die einzigartige Kultur der Adivasis. Ihr Aktivismus fußt nicht zuletzt auf der Überzeugung, dass die Autarkie dieser Völker, ob im indischen Himalaya, in der Wüste Rajasthans oder auf den Andamanen, dem urbanen Indien ein Mahnmal für seine Verantwortung zur Wahrung von Vielfalt und Toleranz sowie der einzigartigen kulturellen Historie des Subkontinents sein kann. Geschichten wie die der Menschen in Umri machen zudem deutlich, dass das ländliche Indien bislang nicht nur nicht teilnimmt am Wirtschaftsaufschwung, sondern an dessen Rücksichtslosigkeit und Einseitigkeit zu zerbrechen droht.",http://www.spiegel.de/einestages/globalisierung-in-indien-a-949597.html,2008-09-23T00:00:00.000Z
"Prostituierten-Theater Würstchen, Brutalos und neckische Sexarbeiterinnen \"Muschis aller Länder, vereinigt euch!\" rufen die Darstellerinnen an der Berliner Schaubühne. Für \"Lulu - Die Nuttenrepublik\" hat Volker Lösch echte Sexarbeiterinnen ins Ensemble geholt. Der Regisseur fürs Plakative ist diesmal erstaunlich facettenreich - aber auch zu pointenverliebt. Nein, wir befinden uns nicht in einer Demonstration bekennender Postfeministinnen auf der Kreuzberger Oranienstraße, sondern in der Berliner Schaubühne. Hier hat Volker Lösch Frank Wedekinds 1898 uraufgeführten \"Lulu\"-Stoff mit Erfahrungen heutiger Sexarbeiterinnen verschränkt. Klassische Bühnenstücke mit Chören realer Betroffener anzureichern, gilt als Markenzeichen des Regisseurs: In Gerhart Hauptmanns \"Die Weber\" stellte er seinen Schauspielern einen Arbeitslosenchor zur Seite. Alfred Döblins \"Berlin, Alexanderplatz\" inszenierte er mit ehemaligen Strafgefangenen. Und in Euripides' \"Medea\" standen Migrantinnen auf der Bühne. In Löschs \"Lulu - Die Nuttenrepublik\" spielen neben Schauspielerinnen auch echte Prostituierte im Chor. Diesmal hat Volker Lösch bei der Auswahl der Betroffenengruppe vor allem Flexibilität bewiesen: Ursprünglich wollte er mit Profis aus der Finanzbranche Georg Kaisers Schauspiel \"Von morgens bis mitternachts\" inszenieren. In diesem expressionistischen Text von 1912 veruntreut ein Bankangestellter einer Frau zuliebe 60.000 Mark. Da sich allerdings nicht genügend Insider aus dem Bankgeschäft zur Mitarbeit meldeten, schwenkte Lösch - hübsche Pointe - kurzerhand auf Wedekinds \"Lulu\" und die Berliner Sexarbeiterinnen ein. Wie immer geht es dem Regisseur dabei nicht um Differenzierungen und Zwischentöne, sondern um plakative Zuspitzungen. Denn den Fleisch gewordenen Männertraum Lulu auf eine Prostituierte zu reduzieren, ist natürlich per se eine extreme Verkürzung des Stoffs. Dafür sind die gecasteten Sexarbeiterinnen - was Lösch durchaus nicht in jeder Inszenierung gelingt - erfreulich facettenreich: Frauen zwischen zwanzig und sechzig mit höchst unterschiedlichen biografischen und sozialen Hintergründen. Kurzum: Die Projektionsfläche Lulu trägt in der Schaubühne zunächst angemessen variantenreiche Gesichter. Wie aber passen diese vergleichsweise pragmatischen Erwerbstätigen aus der Sexbranche zur triebanarchischen Bühnenfigur Lulu, die dank einflussreicher Männer zunächst in höchste soziale Kreise aufsteigt und später - von Männern verraten und verkauft - auf dem Straßenstrich ermordet wird? \"0 heißt: poppt wie ein Schaf\" Volker Lösch und sein Dramaturg Stefan Schnabel entgehen der Gefahr, die Sexarbeiterinnen auf eindimensionale Patriarchatsopfer zu reduzieren. Die Ausstatterin Carola Reuther hat aus mehr als tausend übereinander gestapelten Kopfkissen einen steifen Vorhang gebaut, der die gesamte Bühnenbreite einnimmt. Wenn die Frauen sich durch diese Kissenburg hindurch an die schmale Bühnenfront vorgearbeitet haben, beschreiben sie den Prostituierten-Job eher selbstbewusst. \"Ich bin teilnehmende Beischlafbeobachterin\", bekennt da etwa eine hauptberufliche Geisteswissenschaftsstudentin. Und ihre Kollegin geht in jeden \"Termin\" mit dem festen Willen, \"guten Sex\" zu haben. Den Leistungsdruck delegiert sie einfach an den jeweiligen Freier: \"Bursche, du musst liefern!\" Frühe Missbrauchserfahrungen oder Demütigungen wie der \"Verkehrsbericht\", in dem Kunden via Internet die Prostituierten auf einer Skala von 0 bis 9 bewerten können (\"0 heißt: poppt wie ein Schaf\"), bleiben eher in der Minderzahl. Über Strecken gewinnt man so den Eindruck, Lösch und Schnabel seien in frauenpolitischer Korrektheit übers Ziel hinausgeschossen und einer gewissen Romantisierung des Berufs erlegen. Vor allem in den Momenten, in denen der Chor neckisch auf Pointe inszeniert ist. Einmal solidarisieren sich die Bühnenfrauen zum Beispiel unter schenkelklopfendem Publikumsapplaus mit den Sex verweigernden Freundinnen der Freier. Denn der Mann an und für sich, heißt es da, halte die Vagina nach wie vor für die einzige erogene Zone am Frauenkörper. Von dort aus ist es, mit Verlaub, nicht mehr allzu weit zu Mario Barth. Recht schlicht geht es auch in der Rahmenhandlung zu. Lulus Männer existieren sämtlich in genau zwei Varianten: Erstens als peinliches Würstchen vor und zweitens als fieser Brutalo nach dem Geschlechtsverkehr. Ob der prekäre Stiefvater Schigolch (Felix Römer), der Chefredakteur Dr. Schöning (David Ruland) oder der Kunstmaler Schwarz (Sebastian Nakajew), der bei Lösch aus Modernisierungsgründen zu einer Art Promi-Fotograf mutiert ist: Jeder kommt als triebgesteuerter Kasper auf die Bühne, lässt in Lulus Angesicht die Hosen fallen, hantiert mit Riesenspargeln aus Schaumstoff oder simuliert Samenergüsse aus großzügig freigelegten Penissen. Von dannen ziehen die Jungs nach knapp zwei Stunden kollektiv als skrupellose Ladykiller. Was Wunder, dass die Schauspieler ihren Part dann auch abendfüllend auf genau zwei Tonlagen erledigen. Die Inszenierung bekommt so etwas krachledern Komödiantisches, das in merkwürdige Schieflage sowohl zu Lulu als auch zu den Berichten der Sexarbeiterinnen gerät. Die Schaubühnen-Akteurin Laura Tratnik wirkt als Lulu folgerichtig hilflos, wenn sie ihren Hintern auf die männliche Genitalhöhe recken muss, um die Jungs im nächsten Moment schnippisch abfahren zu lassen. Das Premierenpublikum in der Schaubühne spendiert zwar großzügig Beifall und zustimmende Pfiffe. Aber was \"Lulu\", die zwischengeschlechtlichen Machtverhältnisse und entsprechende Gesellschaftsanalysen betrifft, waren Regisseure wie Michael Thalheimer schon vor sechs Jahren wesentlich weiter.",http://www.spiegel.de/kultur/gesellschaft/prostituierten-theater-wuerstchen-brutalos-und-neckische-sexarbeiterinnen-a-734222.html,2010-12-13T00:00:00.000Z
"Türkei Angelina Jolie besucht syrische Flüchtlinge Fünf Stunden hatte sie Zeit: Schauspielerin Angelina Jolie informierte sich über die Situation syrischer Flüchtlinge in der Türkei. Die Uno-Sonderbotschafterin hatte kistenweise Spielzeug dabei. In den Lagern wird die Lage immer angespannter: Einige Menschen sind in Hungerstreik getreten. Altinözü - Sie kam in einem Privatflugzeug und mit Kisten voller Spielsachen. Hollywood-Star Angelina Jolie ist am Freitag zu einem Besuch bei syrischen Flüchtlingen in der Türkei eingetroffen. Die Schauspielerin und Sonderbotschafterin des Uno -Flüchtlingshilfswerks (UNHCR) landete in der Provinz Hatay. In den türkischen Flüchtlingslagern leben fast 10.000 Syrer, die vor der blutigen Niederschlagung der Protestbewegung durch das Regime in Damaskus geflohen sind. Der Fernsehsender DHA zeigte, wie Jolie das Flugzeug verließ. Später sei die Schauspielerin dann zu einem Lager in der türkischen Stadt Altinözü aufgebrochen, berichteten türkische Medien. Bei ihrer Ankunft unter starken Sicherheitsvorkehrungen skandierten die Flüchtlinge \"Nieder mit dem syrischen Regime!\". Ein AFP-Reporter berichtete, bereits am Flughafen wurde Jolie von den Behörden mit einem 15 Meter langen Transparent willkommen geheißen. Ein Fan hielt ein Plakat mit der Aufschrift: \"Angelina, küss mich für den Weltfrieden.\" Den Behörden zufolge wird ein Team Jolies Aufnahmen von ihrem Treffen mit den Flüchtlingen bereitstellen. Im April war die US-Schauspielerin nach Tunesien gereist, als Tausende Menschen wegen des Konflikts in Libyen in das Nachbarland flüchteten. Für den Besuch des Lagers hatte Jolie eine Ausnahmegenehmigung des türkischen Außenministeriums bekommen. Die Flüchtlinge werden normalerweise weitgehend abgeschirmt. Dagegen brandete am Freitag Protest auf. Im Flüchtlingslager Yayladagi begannen einige Insassen nach dem Freitagsgebet einen Hungerstreik, sagte ein syrischer Dissident in der Türkei, der anonym bleiben wollte. Das Aufnahmelager war Ende April eingerichtet worden und beherbergt inzwischen mehrere tausend Flüchtlinge. Insgesamt stieg die Zahl der syrischen Flüchtlinge in fünf Zeltdörfern der Provinz auf rund 9700. Mit dem Hungerstreik protestierten die Flüchtlinge gegen das Ausbleiben von Besuch, das Verbot, gegen die syrische Führung zu demonstrieren, sowie gegen mangelnden Kontakt zur Außenwelt, sagte der Aktivist. Zudem hätten türkische Wachleute am Donnerstag Flüchtlinge geschlagen.",http://www.spiegel.de/politik/ausland/tuerkei-angelina-jolie-besucht-syrische-fluechtlinge-a-769116.html,2011-06-17T00:00:00.000Z
"Neue Macht in Nahost Syriens Schicksal entscheidet sich in der Türkei Europa und die USA zögern im Syrien-Konflikt - und überlassen damit der Türkei das Feld. Premier Erdogan präsentiert sich als Krisenmanager, organisiert Hilfe für die Flüchtlinge und droht mit der Nato. Ankara festigt seinen Anspruch als Führungsmacht im Nahen Osten. Von Maximilian Popp Maximilian Popp wurde 1986 in Passau geboren. Er absolvierte die Henri-Nannen-Journalistenschule in Hamburg und studierte Politikwissenschaften in Istanbul. Seit 2010 arbeitet er für den SPIEGEL, zunächst als Redakteur im Deutschlandressort in Dresden, Hamburg und Berlin, seit 2016 als Korrespondent in Istanbul. Für seine Türkei-Berichterstattung wurde er mit dem Journalistenpreis der Südosteuropa-Gesellschaft ausgezeichnet. E-Mail: Maximilian.Popp@spiegel.de Twitter: Maximilian_Popp folgen Mehr Artikel von Maximilian Popp Hamburg - Es sind grausame Szenen, die sich nun schon seit Monaten an der syrisch-türkischen Grenze abspielen: Tausende Syrer fliehen vor den Schergen des Diktators Baschar al-Assad. Viele sind verwundet, berichten von Folter, Vergewaltigungen, Hinrichtungen. Es sind aber auch Szenen der Menschlichkeit: Die Türkei nimmt die Schutzsuchenden in Zelten auf. Sie hat Krankenstationen errichtet, um Verletze zu versorgen. Nachbarn helfen mit Lebensmitteln. \"Erinnern Sie sich noch, wie die afrikanischen Flüchtlinge aus Tunesien und Libyen während des Arabischen Frühlings in Italien behandelt wurden?\", fragt nun der frühere Chefredakteur der türkischen Tageszeitung \"Hürriyet\", Ertugrul Özkök. Menschenrechtler kritisierten damals die rücksichtslose Abschottungspolitik der EU auf der Mittelmeerinsel Lampedusa. Özkök weist darauf hin, dass europäische Werte in der gegenwärtigen Notsituation ausgerechnet von der viel gescholtenen Türkei verteidigt werden. Die Regierung von Ministerpräsident Recep Tayyip Erdogan verfolgt aber auch eigene Interessen in dem Konflikt: Syrien ist ein wichtiger Handelspartner. Auf beiden Seiten der Grenze leben Kurden. Die Unruhen gefährden die Stabilität in der Region, die durch die Auseinandersetzung zwischen dem türkischen Militär und der kurdischen Terrororganisation PKK ohnehin latent bedroht ist. Erdogan setzt sich also nicht nur aus Altruismus für den Sturz des syrischen Diktators Assad ein oder aus der von staatsnahen Medien oft beschworenen \"Solidarität mit den muslimischen Brüdern in Syrien\". Die Kriegsflüchtlinge stellen das Land dazu noch vor eine humanitäre Herausforderung, die es allein zu schultern kaum mehr in der Lage ist. Aber wie die Regierung die Krise bislang managt, wie sie sich bemüht, das Chaos zu bewältigen, das nötigt selbst Kritikern des Premiers Anerkennung ab. Und mehr noch: Weil sich Europa und die USA wegducken, entscheidet sich das Schicksal der Syrer in Ankara. \"In naher Zukunft wird die Türkei wichtiger sein als Großbritannien\" \"Europa hat Syrien einem osmanischen Schicksal überlassen\", schreibt der britische Historiker Timothy Garton Ash im \"Guardian\". Der Westen hätte schon vor Wochen durch eine Militärintervention dem Morden in Syrien ein Ende setzen müssen, kritisiert Garton Ash. Doch anders als in Libyen fehlt der politische Wille. US-Präsident Barack Obama und Frankreichs Regierungschef Nicolas Sarkozy haben Wahlen vor sich, und Deutschland fällt bei Kriegseinsätzen als Führungsmacht aus gutem Grund ohnehin aus. Andere Mächte übernehmen deshalb im Nahen Osten die Regie. \"In naher Zukunft wird die Türkei wichtiger sein als Großbritannien\", prophezeit Garton Ash, \"Iran wichtiger als Deutschland, Saudi Arabien als Frankreich, Russland als Amerika.\" Am Fall Syrien zeichnen sich Konturen einer neuen Weltordnung ab, die US-Journalist Fareed Zakaria als \"Aufstieg der Anderen\" beschreibt. Nun trat der türkische Premier Erdogan ausgerechnet bei einem Besuch in China mit einer erstaunlichen Forderung an die Öffentlichkeit. \"Die Nato hat eine Verantwortung zum Schutz der türkischen Grenze zu erfüllen\", sagte Erdogan und drohte Syrien mit einem Einsatz des Verteidigungsbündnisses. Es ist ein abenteuerlicher Vorstoß. Zwar hatten syrische Truppen zuvor Schüsse auf ein Flüchtlingslager in der Türkei abgefeuert und dabei zwei Syrer getötet. Aber selbstverständlich weiß Erdogan, dass dies kaum dazu ausreichen dürfte, den Nato-Bündnisfall auszurufen, wie dies zuletzt nach den Terroranschlägen vom 11. September 2001 geschehen war. Türkei etabliert sich als globale Führungsmacht Darum geht es dem türkischen Ministerpräsidenten auch nicht. Erdogan ist nicht so naiv, wie manche westliche Berichterstatter nun mutmaßen, obwohl sie es nach zehn Jahren Regentschaft seiner muslimisch-konservativen AKP besser wissen müssten. Seine Drohung ist wohlkalkuliert. Er signalisiert Syriens Noch-Herrschern, dass mit ihren Gegnern zu rechnen ist, und er beweist dem Westen, dass es die Türkei ist, die im Moment im Nahen Osten die Spielregeln diktiert. Ankara diskutiert seit längerer Zeit die Frage, wie sich ein Militärschlag gegen Syrien völkerrechtlich legitimieren lässt. Sehr viel aussichtsreicher als deutsche und amerikanische Nato-Soldaten auf türkischem Boden erscheint dabei der Bezug auf einen Vertrag, den die Türkei mit Syrien 1998 auf dem Höhepunkt des Kurden-Konflikts geschlossen hat. Im Abkommen von Adana heißt es unter Artikel 1, Syrien billige keine Handlung, die die Sicherheit und Stabilität der Türkei unterwandert. Türkische Diplomaten erwähnten dieses Abkommen in den vergangenen Tagen wiederholt, wenn von einem Militäreinsatz in Syrien oder einer militärischen Pufferzone an der Grenze die Rede war. Die Türkei, vor einigen Jahren noch als der \"kranke Mann am Bosporus\" verspottet, etabliert sich als globale Führungsmacht. Erdogan verfolgt eine Strategie, die Beobachter als \"Neo-Osmanismus\" beschreiben. Er macht seinen Einfluss weit über die eigenen Landesgrenzen hinaus geltend. Nach seinem Wahlsieg im vergangenen Juni, dem dritten in Folge, verkündete Erdogan, dies sei nicht nur ein Erfolg für Istanbul und Ankara, sondern ebenso für Beirut und Damaskus. In der krisengeplagten Region bestimmt der Sultan zunehmend die Agenda.",http://www.spiegel.de/politik/ausland/konflikt-in-syrien-tuerkei-wird-zur-globalen-fuehrungsmacht-a-827463.html,2012-04-13T00:00:00.000Z
