article,article_url,date
"Rettungseinsatz in Japan Ungebetene Helfer Eine halbe Million Menschen sind in Japan nach den Beben obdachlos, die Lage spitzt sich zu. Andere Länder würden gern helfen - doch Japan bittet nur zurückhaltend um Unterstützung. Von Frauke Lüpke-Narberhaus Saima Altunkaya Frauke Lüpke-Narberhaus Geboren 1983. Studierte Politikwissenschaft, Kommunikationswissenschaft und Skandinavistik in Münster und Stockholm. Praktika und freie Mitarbeit u.a. beim ZDF, RÚV (Öffentlicher-rechtlicher Rundfunk Islands) und SPIEGEL ONLINE. Absolventin der Henri-Nannen-Journalistenschule in Hamburg mit Stationen bei \"Berliner Zeitung\", SPIEGEL, \"Stern View\" und \"ZEIT\". Seit September 2010 bei SPIEGEL ONLINE im Ressort UniSPIEGEL. Seit Januar 2015 Redakteurin in der Entwicklungsredaktion, seit Juli 2015 Projektleiterin. E-Mail: Frauke.Luepke-Narberhaus@spiegel.de Twitter: @FraukeLN folgen google+: Zum Profil Webseite: http://www.luepke-narberhaus.de/ Blog: http://www.zettelgold.de/ Mehr Artikel von Frauke Lüpke-Narberhaus Hamburg - Es mangelt an allem: Heizöl, Strom, Essen, Wasser, Medikamenten und Ärzten. Etwa eine halbe Million Menschen sind in Japan nach Erdbeben und Tsunami obdachlos, sie drängen sich in der Kälte in rund 2200 Notfalllagern. Mindestens 25 Flüchtlinge sind dort inzwischen gestorben, viele von ihnen seien alt und vollkommen entkräftet gewesen, berichtet der japanische TV-Sender NHK. Die japanische Regierung hat die Europäische Union um Hilfe gebeten. Am Freitag um 18 Uhr sind 15 Gesandte der EU in Brüssel in den Flieger nach Japan gestiegen. In den kommenden Tagen wollen die Experten mit lokalen Partnern und dem Internationalen Roten Kreuz einen zentralen Umschlagplatz für die Verteilung der Hilfsgüter aufbauen. Von wo genau sie arbeiten werden, konnte Raphael Brigandi, der Sprecher des Europäischen Amtes für humanitäre Hilfe (Echo), auf Anfrage noch nicht sagen. Die Japaner wollten zunächst schauen, welche Form der Hilfe sie überhaupt brauchen und nicht pauschal um Unterstützung bitten, sagte Brigandi. \"Ich glaube, für die Japaner ist es sehr wichtig, dass alles gut organisiert ist.\" Die EU wird nun vor allem mit dem aushelfen, was Japan sich wünscht: Decken, Schlafsäcke, Betten und Wasseraufbereitungsanlagen. Auf Bitte der Japaner wird die Hilfe einzelner Mitgliedstaaten von Brüssel aus koordiniert. Vergebliches Warten auf internationales Hilfeersuchen Derzeit liegen der Europäischen Union Angebote aus neun europäischen Ländern vor: aus Frankreich, Schweden, Dänemark, Irland, Österreich, Griechenland, Bulgarien, Litauen und der Slowakei. Das könne sich aber stündlich ändern, sagte Brigandi. Die Länder hätten zusammen bislang unter anderem etwa 100.000 Decken und 1300 Feldbetten angeboten. \"Das ist mehr als wir in der kurzen Zeit erwartet hätten\", sagte Brigandi. Es ist allerdings noch nicht geklärt, wie und wann die Decken und Betten Japan erreichen. Deutschland wartet - wie einige andere Länder auch - auf weitere Signale aus Japan. \"Selbstverständlich ist Deutschland bereit zu helfen\", sagte eine Sprecherin des Auswärtigen Amtes. \"Wir prüfen momentan mit Hochdruck alle Möglichkeiten.\" Das deutsche Technische Hilfswerk (THW) ist momentan noch mit drei Helfern in Japan im Einsatz: Sie unterstützen die Deutsche Botschaft sowie das Generalkonsulat bei der Ausreise von Deutschen und anderen Staatsbürgern aus Japan. Zudem berät ein Strahlenschutzexperte des Bundesumweltministeriums die Botschaft. Zuvor waren 40 Mitarbeiter des THW nach Japan gereist, ihr Einsatz endete allerdings nach nur wenigen Tagen . Es bestand keine Hoffnung mehr, noch Überlebende zu finden. Der französische Präsident Nicolas Sarkozy bot am Freitag erneut Japans Ministerpräsident Naoto Kan Hilfe für die Bevölkerung sowie bei der Krisenbewältigung im AKW Fukushima I an. Sein Land \"stehe bereit\", sagte Sarkozy. Schon vor Tagen hatte er als \"Geste der Solidarität Frankreichs und der Länder der G8 und der G20\" einen Besuch in Japan vorgeschlagen. Voraussetzung wäre aber das Einverständnis der japanischen Behörden. Und das ist bislang ausgeblieben. Deutsche Wissenschaftler unterstützen Japan Nach der Katastrophe standen viele internationale Hilfsorganisationen bereit, um Japan zu unterstützen. Fertig für die Abreise warteten sie auf den Abflug - doch sie kamen nicht zum Einsatz: Die japanische Regierung hatte kein internationales Hilfeersuchen gestellt. Auch Mark Rösen, 43, und sein Team von der deutschen Sektion der Hilfsorganisationen I.S.A.R. (\"International Search and Rescue\") spürten die Konsequenzen: \"Wir saßen in unserem Lagezentrum in Moers mit gepackten Koffern und warteten auf den Einsatzbefehl, der nicht kam\", sagte er. \"Wir sind im Stand-by-Modus.\" Er gehe aber davon aus, dass sein Team nicht mehr helfen müsse. Die US-Armee, die 50.000 Soldaten in Japan stationiert hat, unterstützt Japan, doch schwerer Schneefall hat Helikopterflüge eingeschränkt, und amerikanische Flugzeuge haben die Order, wegen einer möglichen Verstrahlung der Piloten die Zone um die Reaktoren von Fukushima zu meiden. \"Es ist frustrierend\", sagt der US-Navy-Rettungsschwimmer Jeff Pearson. \"Aber wir tun, was wir können. Ich glaube aber, wir werden bald deutlich mehr helfen können.\" In Deutschland unterstützen auch einige Wissenschaftler Japan - allerdings helfen sie am Computer: In Potsdam beispielsweise untersucht das Geoforschungszentrum den Ablauf der Erdbebenkatastrophe. Geophysiker, Geologen und Erdbebenforscher machen dazu Animationen und Computersimulationen, die sie ihren japanischen Kollegen zur Verfügung stellen. Das \"Zentrum für satellitengestützte Kriseninformation\" im bayerischen Oberpfaffenhofen lieferte anfangs vor allem hochauflösende Satellitenbilder von den Erdbeben- und Tsunamigebieten, um den Einsatzkräften die Suche nach Opfern zu erleichtern. Inzwischen machen sie detailliertere Analysen: Wie groß sind die zerstörten Gebiete? Wie viele Menschen sind betroffen? Wie stark hat sich die Insel durch das Beben verschoben? Regelmäßig sind die Wissenschaftler in Bayern in Kontakt mit ihren japanischen Kollegen. \"Die sind selbst top ausgestattet\", sagt Stefan Voigt vom Zentrum, \"aber die kommen mit der Arbeit einfach nicht nach.\"",http://www.spiegel.de/panorama/rettungseinsatz-in-japan-ungebetene-helfer-a-751826.html,2011-03-19T00:00:00.000Z
"Südkoreas Vereinigungsplan \"Niemand will den Norden einfach schlucken\" Erlebt auch Korea irgendwann seine Wiedervereinigung? Im Süden glaubt man fest daran - und fängt schon an zu sparen, um die gewaltigen Kosten zu bewältigen. Der zuständige Minister, Yu Woo Ik, erklärt im Interview, was er von Kim Jong Un hält und was sein Land von Deutschland lernen kann. SPIEGEL ONLINE: Herr Minister Yu, russische Regierungsberater glauben an eine Wiedervereinigung Koreas in den nächsten 20 Jahren, Sie auch? Yu: Natürlich haben wir das feste Ziel, wichtig ist aber nicht der Zeitpunkt. Wichtig ist jetzt, dass wir den Glauben daran nicht verlieren und dass Pjöngjang seine Zweifel an unseren ehrlichen Absichten beseitigt und mit uns ernsthaft verhandelt. Niemand bei uns setzt auf den Zusammenbruch des Regimes und will den Norden einfach nur schlucken. Wir wollen eine friedliche Wiedervereinigung und allen Flüchtlingen die freiwillige Entscheidung eröffnen, wo sie leben wollen. SPIEGEL ONLINE: Das neue Regime im Norden unter Führung von Kim Jong Un , dem jungen Sohn des im Dezember verstorben Kim Jong Il , spricht derzeit ebenfalls viel von Wiedervereinigung. Ist das glaubwürdig? Yu: Wir müssen gegenseitiges Vertrauen schaffen. Dafür brauchen wir einen neuen Dialog-Kanal zwischen beiden Ländern, der unabhängig von der jeweiligen aktuellen politischen Lage stabil bleibt. SPIEGEL ONLINE: Hat die Regierung in Pjöngjang dafür mit ihrer überraschenden Ankündigung, die Urananreicherung zu stoppen und auf Atomtests zu verzichten, jetzt die Türen geöffnet? Yu: Zumindest hat Nordkorea erkannt, dass die Atomfrage erheblichen Einfluss darauf hat, ob der gemeinsame Dialog vorankommt oder nicht, und dass ein entsprechendes Signal wichtig ist. Nun bleibt abzuwarten, wie belastbar diese Ankündigung ist. SPIEGEL ONLINE: Haben Sie Zweifel an der Ernsthaftigkeit? Yu: Das ist noch nicht abschließend zu beurteilen. Aber es ist ein gutes Signal, dass sich die Regierung im Norden bewegt. Wenn die angekündigten Schritte auch umgesetzt werden, schafft das die Voraussetzungen für neue Gespräche auch in einem erweiterten Kreis, wie wir sie immer gefordert haben. SPIEGEL ONLINE: Weil ohne eine schnelle Wiederaufnahme der Sechser-Gespräche mit China, Russland, Japan und den USA auch in der Frage der Wiedervereinigung nichts vorankommt? Yu: Unbedingt. Der innerkoreanische Dialog und die Sechs-Parteien-Gespräche über die Zukunft Koreas verhalten sich zueinander wie die Räder an einem Auto. Wenn eines davon stillsteht, kommt das Fahrzeug nicht voran. Alle Fortschritte in den Beziehungen der vergangenen 20 Jahre liefen immer parallel zu den Gesprächen. SPIEGEL ONLINE: Ist das neue Regime bereits stabil genug für ernsthafte Verhandlungen? Yu: Wir gehen davon aus, dass Nordkorea noch etwas Zeit braucht. Im Moment befindet sich das Land in einer Phase der \"Testament-Politik\" nach dem Tod von Kim Jong Il, und die außenpolitischen Aktivitäten sind etwas zurückgefahren. Wir hoffen aber, dass die neue Führung sich schnell stabilisiert und mit Selbstbewusstsein den Dialog aufnimmt, statt alte Strukturen zu zementieren. Nordkorea muss sich jetzt entscheiden, ob es sein Angebot ernst meint oder auf früheren Standpunkten inklusive seiner Nuklearpolitik beharren will und sich weiter isoliert. Dann wird die Bevölkerung weiter leiden. SPIEGEL ONLINE: Sie haben in einem Arbeitsprogramm für dieses Jahr \"substantielle Vorbereitungen\" für die Vereinigung angekündigt. Was soll das sein? Yu: Wir müssen jetzt handeln, wenn wir Wiedervereinigung ernst meinen. Dazu brauchen wir eine Wiedervereinigungsdiplomatie, die auch die Nachbarländer der Region mit einbezieht. Und wir müssen finanzielle Mittel bereitstellen. Denn wir haben von Deutschland gelernt, dass Wiedervereinigung viel Geld kostet. SPIEGEL ONLINE: Wissenschaftler und Experten in Seoul verlangen deshalb eine spezielle Steuer oder Abgabe wie den deutschen Solidaritätszuschlag. Yu: Eine Wiedervereinigung-Steuer bedeutet Zwang, aber wir setzen auf Freiwilligkeit. Deshalb plant die Regierung einen Vereinigungsfonds von umgerechnet rund 55 Milliarden Euro, der noch vor den Wahlen im Sommer vom Parlament genehmigt werden soll. Das Startkapital dafür kommt von der Regierung, den Rest sollen Koreaner im Inland und im Ausland spenden. SPIEGEL ONLINE: Die deutsche Einheit hat inklusive der Transferkosten weit über eine Billion Euro gekostet... Yu: Natürlich kann es sein, dass wir schon im ersten Jahr fünfmal mehr brauchen, als der Fonds hergibt. Aber es geht nicht nur um Geld, es geht um den Willen zur Einheit. Wenn die Bürger Schlange stehen, um Geld zu spenden, so wie sie freiwillig Gold gesammelt haben, als wir 1998 gemeinsam erfolgreich gegen die Wirtschaftskrise kämpften, ist der symbolische Wert unschätzbar, auch gegenüber den Menschen im Norden. Das zeigt, das wir es ehrlich meinen. SPIEGEL ONLINE: Die Sehnsucht nach einer Wiedervereinigung sinkt in Ihrem Land rapide. Vor allem unter den jungen Südkoreanern liegt die Zustimmungsrate weit unter 50 Prozent, weil sie Angst vor den wirtschaftlichen Folgen haben. Yu: Die Menschen haben sich an die Teilung gewöhnt. Und wir haben bisher immer nur die Kosten der Wiedervereinigung betont, aber nie die Kosten der Teilung. Das sind ja nicht nur Ausgaben für die Flüchtlinge oder humanitäre Hilfsprogramme für Pjöngjang, um zum Beispiel die Hungersnöte zu mildern. Es sind auch sicherheitspolitische und sozialpolitische Kosten. Das Geld für die Wiedervereinigung zahlen wir aber nur einmal, der Nutzen ist ewig. SPIEGEL ONLINE: Welche Hilfe erwarten Sie von Deutschland? Yu: Die Bedingungen der deutschen Einheit sind nicht eins zu eins vergleichbar, trotzdem sind die Erfahrungen ein Lehrbuch für Korea . Insbesondere, dass wir nicht unvorbereitet in diese Situation kommen und wie die Integration von Ost und West bewältigt wurde. Anmerkung der Reaktion: In einer früheren Version des Artikels wurde der Umfang des Vereinigungsfonds mit 55 Millionen Euro beziffert. Tatsächlich sind es 55 Milliarden Euro. Wir haben den Fehler korrigiert und bitten, ihn zu entschuldigen.",http://www.spiegel.de/politik/ausland/suedkoreas-vereinigungsplan-niemand-will-den-norden-einfach-schlucken-a-820295.html,2012-03-10T00:00:00.000Z
"Heute in den Feuilletons \"Das Grausame ist die emsige Produktivität\" Die \"NZZ\" schickt eine Reportage aus Mumbai, wo die Menschen an der Globalisierung arbeiten. Die \"SZ\" ist enttäuscht über Ai Weiweis Beitrag zur Biennale Venedig. Und der \"Freitag\" kommentiert die Paywall der \"Bild\". Aus den Blogs, 29.05.2013 (Via Ekkehard Knörer ) Auf Nachtkritik tobt seit einigen Tagen eine riesige Diskussion über Jérôme Bels auf dem Theatertreffen gezeigtes Spektakel \"Disabled Theater\". Ausgelöst hat sie Matthias Dell mit einem Artikel auf den Online-Seiten des Freitag . Es geht dabei um die Arbeit mit Behinderten im Theater: \"Bel stellt seine Performer mit Behinderung aus - auch wenn jede positive Rezension ihn genau dagegen in Schutz nimmt. Wie anders aber soll man die eindimensionalen Befehle eines Konzeptkunstgezeiges verstehen ('Und dann hat Jérôme die Darsteller gebeten...'), die von einem Übersetzer ungerührt vorgetragen werden und die in ihrer Überschaubarkeit jeder Reduzierung, von der Bels große Arbeiten gelebt haben, Hohn sprechen: Lasst euch eine Minute angucken . Stellt euch mit Behinderung vor. \" Die viel gefeierte Snow Fall - Geschichte auf den Onlineseiten der New York Times zieht nun doch einige Gegner auf sich, schreibt Choire Sicha im Nieman Lab . Ihre Argumente: \" Although it was an exceedingly well-reported story that lent itself well to lovely web expression, the story itself was not particularly newsworthy , or recent, or ground-breaking, or exclusive.  During the story's construction, it became a situation where it seemed-at least from the outside-like the form began to demand unreasonable length of the content.  It was a monetary sinkhole : while the coding seems spectacular (and it didn't destroy browsers, unlike recent efforts by Pitchfork), the sheer person-hours devoted to it were financially untenable.\" Die Welt, 29.05.2013 Richard Kämmerlings beschreibt im Aufmacher die jüngsten Suhrkamp -Kapriolen und stellt fest : \"was die Zukunft Suhrkamps angeht, ist lediglich sicher, dass nichts sicher ist\". Hannes Stein findet es ganz okay, dass der amerikanische Philosoph Thomas Nagel in seinem umstrittenen Buch \"Geist und Kosmos\" vielleicht \"ein bisschen zu nett zu Vertretern des 'Intelligent Design' ist\". Alan Posener amüsiert sich übers Kinderdrehen im Buggy. Dan Brown bekennt im Interview , dass sein zweiter Namen Gerhard ist. Besprochen wird die deutsche Erstaufführung von Mieczyslaw Weinbergs Oper \"Die Passagierin\" in Karlsruhe und Olivier Assayas ' Film \"Die wilde Zeit\". Eine Meldung informiert uns, dass Werner Spies und ein Galerist von einem französischen Gericht in erster Instanz zur Zahlung von 652.883 Euro Schadenersatz verurteilt wurden. Geklagt hatte ein Sammler, der das von Wolfgang Beltracchi gefälschte, vermeintlich echte Max-Ernst-Gemälde \"Erdbeben\" gekauft hatte, nachdem Spies die Echtheit bezeugt hatte. Mehr dazu in Le Monde . Neue Zürcher Zeitung, 29.05.2013 Die Schriftstellerin Friederike Kretzen schickt eine Reportage aus Mumbai , wo sie die Menschen im größten Slum der Stadt, in Dharavi, bei der Arbeit an der Globalisierung beobachtet hat: \"Warum werden die Menschen nicht auf der Stelle grün wie die Hunde blau ? Wo sind die Verformungen, Auswüchse, Verkrümmungen, die solche Arbeitsbedingungen Menschen antun? Sie leben darin, für sie ist es eine Form von Normalität. Das Schockierende dieser engen, armen und vor allem giftigen Lebensumstände - und das macht es wohl so grausam - ist ihre Geregeltheit. Kein Chaos, kein Schrei, keine Auflehnung der Kreatur , das Grausame ist vielmehr diese ungeheuer emsige, betriebsame Produktivität, mit der die Müllsortierer , die Plastikzerkleinerer , Plastik-Köche, Bäcker, Stahlköche, Töpfer und Schneider an ihren Öfen, Feuern, Tischen und Nähmaschinen arbeiten. Es scheint in Ordnung zu sein.\" Weiteres: In der Reihe zu Grundlagen der Demokratie widmet sich Felix Trautmann dem Paradox, dass ein Volk erst existieren muss, um sich selbst zu konstituieren . Besprochen werden unter anderem die Ausstellung \"Creating Camelot\" über John F. Kennedys Hoffotografen Jacques Lowe im Washingtoner Newseum, Michel Houellebecqs bisher nur auf Französisch erschienene Gedichte \"Configuration du dernier rivage\" und Walter Benjamins Kunstwerk-Aufsatz in der kritischen Gesamtausgabe (mehr ab 14 Uhr in unserer Bücherschau des Tages ). Der Freitag, 29.05.2013 \"Der Rausch des freien Netzes ist vorüber. Es ist der Morgen danach\", meint Jakob Augstein und wünscht dem Springers Bildzeitung viel Erfolg mit ihrem Paywall: \"Zyniker und Apokalyptiker mögen mit den Schultern zucken. In einer Komödie von George Bernard Shaw bedroht das Feuer die Bibliothek von Alexandria ; jemand ruft aus, das Gedächtnis der Menschheit werde verbrennen, und Julius Cäsar sagt: Lasst es brennen. Es ist ein Gedächtnis von Ruchlosigkeit . Mit der Haltung kann man auch der Zerstörung des Journalismus beiwohnen. Aber wer kann sich solch einen moralischen Luxus leisten?\" Christoph Bartmann beleuchtet die Bedeutung von Yahoos Entscheidung, seine Angestellten aus dem Home Office wieder zurück ins Büro zu holen. Süddeutsche Zeitung, 29.05.2013 Catrin Lorch ist ein bisschen sauer, dass Ai Weiwei für den deutschen Pavillon in Venedig eher Mäßiges abgeliefert hat, nebenbei aber im Auftrag einer Londoner Galerie in einer französischen Kirche die Aufsehen erregende Diorama-Installation S.A.C.R.E.D. ( mehr ) eingerichtet hat, die Ai Weiweis Haftbedingungen - inklusive einer \"hyperrealistischen Ai-Puppe\" - nachstellt: \"Der dissidente Künstler verabschiedet sich so in eine neue Existenz - die des Märtyrers . Schon das Akronym lässt sich ja rasch als 'Sacred' lesen. ... Natürlich ist man geneigt, Ai Weiwei viel zu verzeihen, nach all dem Unrecht, das er erlitten hat. Doch war es zentral für die aktivistische Kunst Ai Weiwei, dass er das westliche Kunstsystem vor allem als Plattform nutzte. Nun richtet er alle Scheinwerfer auf sich und ergeht sich in wolkigen Gemeinplätzen . Vage sind dabei auch seine künstlerischen Formulierungen.\" Weitere Artikel: Susan Vahabzadeh spricht mit Regisseur Olivier Assayas über dessen neuen, von Tobias Kniebe besprochenen Film \"Die wilde Zeit\" . Allenthalben stadtmarketingträchtige \" Reizvergröberung \" an der Berliner Volksbühne, meckert Peter Laudenbach nach einer Performance von \"Porn of Pure Reason\", die \"mit Vernunft etwa so viel zu tun [hat] wie Immanuel Kant mit youporn\". Henning Klüver meldet, dass sich der italienische Rechtsphilosoph Paolo Becchi für den in Italien weitgehend isolierten Beppe Grillo stark macht. Online amüsiert sich Bernd Graff über den Film \"The Room\", den er für \"den schlechtesten Film aller Zeiten \" hält. Wir glauben: Bernd Graff hat einfach noch nie den völlig unfassbaren \"Turkish Star Wars\" von 1982 gesehen. Unter anderem bietet diese Trashgranate wertvolle Fitness-Tipps. Besprochen werden neue Jazzveröffentlichungen und Bücher, darunter die deutsche Erstveröffentlichung von Pierre Bosts Roman \"Ein Sonntag auf dem Lande\" (mehr in unserer Bücherschau um 14 Uhr). Frankfurter Allgemeine Zeitung, 29.05.2013 Andreas Kilb empfiehlt Olivier Assayas ' Siebziger-Jahre-Drama \"Die wilde Zeit\". Das Problem der Rekonstitution, das viele Historienfilme so lächerlich erscheinen lässt, löse der Regisseur, indem er Laienspieler engagierte: \"Ein Lebensgefühl wird beschworen, aber nicht durch das routinierte Spiel von Könnern, sondern durch Anverwandlung . Die Jugend von 2012 verkörpert die Jugend von 1971. Sie gibt ihr zurück, was kein Schauspieler ihr geben könnte: Unschuld, Unmittelbarkeit, Verletzlichkeit.\" Weitere Artikel: Lena Bopp rät den Aktivistinnen von Femen , das T-Shirt anzubehalten - besonders stört sie die antireligiöse Provokation des Topless Jihad Day , durch den das Schicklichkeitsgefühl von Muslimen verletzt wird, die nun auf Facebook ihren Muslima Pride artikulieren . Swantje Karich protestiert gegen das Wetter. Wiebke Huester erinnert an den Skandal um den \" Sacre du printemps \" vor hundert Jahren, dessen in Paris mit verschiedenen Ereignissen gedacht wird. Jürg Altwegg und Patrick Bahners notieren französische und amerikanische Sorge über die Suhrkamp -Krise. Eugen Ruge , dessen Roman \"In Zeiten des abnehmenden Lichts\" gerade ins Griechische übersetzt wird, schickt Notizen von einer Riese in die Krise. Internetskeptiker Evgeny Morozov befasst sich heute mit Google Maps ( hier das Original aus Slate ). Besprochen werden eine Ausstellung über den amerikanischen Bürgerkrieg in Washington , Fank Martins \"Tristan\"-Variation \"Le Vin herbé\" an der Staatsoper in Berlin und Bücher, darunter ein Novellenband von Hartmut Lange (mehr in unserer Bücherschau ab 14 Uhr). Die Zeit, 29.05.2013 Verstoßen Künstler gegen die Ethik ihrer Kunst , wenn sie ihre Werke von \"Reichen\" kaufen lassen, wie Julia Voss kürzlich in der FAZ Georg Baselitz vorwarf? So schwere Geschütze möchte Hanno Rauterberg nicht auffahren: \"Wer allerdings meint, seine Kunst sei doch immer dieselbe , egal, wo sie gezeigt und von wem sie bestellt und bezahlt wird, erweist sich als hoffnungslos naiv. Die Kunst ist weit stärker als Literatur oder Film von dem Rahmen abhängig , in dem sie erscheint. Gerade weil alles Kunst sein kann, ein Urinoir ebenso wie eine Kartoffel, weil es also nicht auf das Objekt selbst, sondern auf dessen Wahrnehmung ankommt, ist sie auf ihre Glaubwürdigkeit angewiesen.\" Peter Kümmel hat mit Matthias Lilienthals Beiruter Stadterkundung X Wohnungen einige schöne Einblicke in eine von allen Seiten malträtierte, doch sehr lebendige Stadt erhalten: \"Wir besuchen das armenische Flüchtlingslager Camp Sanjak . Es wurde in den zwanziger Jahren errichtet, verfällt zusehends und beherbergt bis heute 80 Familien. In einer Hütte hat sich der Schuhmacher und Designer Raffi Pamboukian niedergelassen, der hier High Heels nach Kundenwunsch produziert (raffipamboukian@hotmail.com) es beginnt, mitten im Flüchtlingslager, bei gedämpftem Licht und Wodka Orange, eine kleine Modenschau: Wir werden genötigt, auf hohen Hacken ein paar Schritte zu gehen.\" Weitere Artikel: Thomas E. Schmidt und Adam Soboczynski dröseln noch einmal auf, wie es im schier ausweglosen Streit um Suhrkamp zum jüngsten Manöver des Verlags kam, Gläubigerschutz zu beantragen. Im Interview erklärt der von Suhrkamp Generalbevollmächtigte Fran Kebekus die rechtliche Lage. Katja Nicodemus schreibt melancholisch über Alter und Vergänglichkeit in Cannes, das sie nach dem Verlust ihrer Akkreditierung von seiner bürokratischen Seite erlebt hat. Ozzy Osbourne und Geezer Butler plaudern im Interview über die gute alte Zeit des finsteren Heavy Metals und die erste Black-Sabbath -CD seit 28 Jahren. Iris Radisch schreibt zum Tod von Sarah Kirsch . Besprochen werden Guillem Balagés Biografie des zukünftigen Bayern-Trainers Pep Guardiola (die Hans-Ulrich Gumbrecht allerdings schlimm hagiografisch findet), Kevin Powers ' Roman \"Die Sonne war der ganze Himmel\" und Marek Edelmans Erinnerungen an \"Die Liebe im Ghetto\" (mehr ab 14 Uhr in unserer Bücherschau des Tages ). Im Wirtschaftsteil befassen sich Götz Hamann und Marcus Rowetter mit der Allgegenwart digitaler Kameras und stellen zum Thema Datenerfassung und Überwachung klar: \"So problematisch es ist, wenn Maschinen alles über uns herausfinden - persönliche Daten sind zugleich die Währung, mit der Menschen die Wohlstandsgewinne der vergangenen Jahrzehnte bezahlt haben.\"",http://www.spiegel.de/kultur/gesellschaft/perlentaucher-heute-in-den-feuilletons-a-902501.html,2013-05-29T00:00:00.000Z
