article,article_url,date
"Wahlkampfthema Jugendgewalt Hessen will kaltgestellten Staatsanwalt In Berlin bekam Oberstaatsanwalt Roman Reusch vom rot-roten Senat einen Maulkorb. Nun will Hessens Justizminister Jürgen Banzer den Leiter der Intensivtäterabteilung für eine Arbeitsgruppe zur Jugendkriminalität gewinnen. Von Matthias Gebauer und Severin Weiland Christian O. Bruch / laif Matthias Gebauer Jahrgang 1974. Erste Journalistische Erfahrung nach dem Abitur 1994 als Polizeireporter bei \"Bild\" in Berlin. Danach 1996 Wechsel zur \"Berliner Zeitung\". Ab Mai 1998 23. Lehrgang der Henri-Nannen-Journalistenschule in Hamburg. Seit dem 1. Dezember 2000 als Korrespondent im Berliner Büro von SPIEGEL ONLINE. Nach dem 11. September 2001 Auslands- und Krisenreporter. Seit Oktober 2008 ist Gebauer Chefreporter von SPIEGEL ONLINE. E-Mail: Matthias.Gebauer@spiegel.de Twitter: @gebauerspon folgen Mehr Artikel von Matthias Gebauer Christian O. Bruch/ laif Severin Weiland Severin Weiland, geboren 1963 in Wilhelmshaven/Niedersachsen. Verbrachte einen Teil seiner Kindheit und Jugend in Chile. Studium der Kommunikations- und Politischen Wissenschaft in München, Ausbildung an der Deutschen Journalistenschule München. Ab 1992 Redakteur im Lokalteil der \"tageszeitung\" in Berlin, später landespolitischer Korrespondent. Von 1996 bis 1999 Stellvertretender Ressortleiter Innenpolitik der taz. Sabbatjahr in Kathmandu, Nepal. Von Herbst 2000 bis Januar 2002 bundespolitischer Korrespondent der taz in Berlin. Seit Februar 2002 Parlamentskorrespondent im Berliner Büro von SPIEGEL ONLINE, seit dem 1. Mai 2004 Stellvertretender Leiter des Berliner Büros von SPIEGEL ONLINE. Ab Mitte Oktober 2014 politischer Korrespondent im Hauptstadt-Büro. E-Mail: Severin.Weiland@spiegel.de Twitter: @SeverinWeiland folgen Mehr Artikel von Severin Weiland Berlin - Wer Reusch an diesem Donnerstag telefonisch erreicht, bekommt einen scheinbar gutgelaunten Oberstaatsanwalt an den Apparat. Am Morgen hat die \"Bild\"-Zeitung aus einem Brief des hessischen Justizministers Jürgen Banzer (CDU) an seine Berliner Amtskollegin berichtet. Der Inhalt: Der Noch-Abteilungsleiter für Intensivstraftäter soll in eine hessische Expertengruppe berufen werden. Ihr Ziel: die Verbesserung der rechtlichen und praktischen Instrumentarien bei der Bekämpfung der Jugendkriminalität. Reusch stehe \"persönlich für die erfolgreiche Arbeit einer staatsanwaltschaftlichen Ermittlungsgruppe\", begründet Banzer heute seine Bitte in einer Presseerklärung. Es wäre ein \"Gewinn für die Bekämpfung der Jugendkriminalität, wenn Herr Oberstaatsanwalt Reusch sein Wissen und seine Erfahrung in die hessische Expertengruppe einbringen könnte\". DDP Hessens Justizminister Banzer (CDU): Ein Brief mitten im Wahlkampf Die Anfrage des CDU-Politikers bei Berlins Justizsenatorin Gisela von der Aue (SPD) kommt nicht ganz zufällig drei Tage vor dem Urnengang in Hessen. Dort wird ein knapper Wahlausgang zwischen Ministerpräsident Roland Koch (CDU) und SPD-Herausforderin Andrea Ypsilanti erwartet. Der parteilose Jurist Reusch, dessen Intensivtäterabteilung vor allem mit Jugendlichen aus Migrantenfamilien zu tun hat, steht seit Anfang des Jahres im Zentrum einer politischen Schlammschlacht. Auslöser war Kochs Wahlkampagne gegen Jugendkriminalität - vor allem mit dem Hinweis, es gebe zu viele jugendliche ausländische Straftäter. Hintergrund für Kochs Entscheidung, das Thema hochzuziehen, war zuvor ein brutaler Überfall von zwei ausländischen Jugendlichen auf einen Rentner in der U-Bahn in München . Kurz nach Kochs Äußerungen zitierte die \"Bild\"-Zeitung einige Sätze aus einem länger zurückliegenden Vortrag Reuschs vor der CSU-nahen Hanns-Seidel-Stiftung. Dort hatte er unter anderem verlangt, dass \"besonders auffällige ausländische Kriminelle außer Landes geschafft oder sonst aus dem Verkehr\" gezogen werden sollten. Nachdem ihm schließlich von der Berliner Justizsenatorin von der Aue ein TV-Auftitt bei \"hart aber fair\" untersagt wurde, gilt er der \"Bild\"-Zeitung als \"mutigster Oberstaatsanwalt Deutschlands\". Für Reusch geht diese Woche ein ein beruflicher Abschnitt zu Ende . Am kommenden Montag wird er in einer anderen Abteilung der Berliner Generalstaatsanwaltschaft seine Arbeit aufnehmen und dort für Haftsachen und Beschwerden gegen Gerichtsentscheidungen zuständig sein. Sein Nachfolger als Leiter der Intensivtäterabteilung wird Oberstaatsanwalt Ingo Kühn, bislang für Verkehrsdelikte verantwortlich. Reusch Wechsel sei \"auf eigenen Wunsch\" erfolgt, wie die Berliner Senatsverwaltung für Justiz diese Woche erklärte. Doch gilt er in Justizkreisen als Opfer der Berliner Justizsenatorin von der Aue, die schon seit längerem mit den Äußerungen des 53-Jährigen zur ausländischen Jugendkriminalität hadert und sich kürzlich im Rechtsausschuss des Berliner Abgeordnetenhaus von seinen Forderungen distanziert hatte . Offene Fragen der Arbeitsgruppe Ob Reusch das Angebot aus Hessen überhaupt in Erwägung zieht, ist offen. Ein Sprecher der Senatsverwaltung der Justiz in Berlin erklärte heute SPIEGEL ONLINE, es sei Angelegenheit von Generalstaatsanwalt Ralf Rother, zu entscheiden, ob der \"anerkannte Sachverstand von Oberstaatsanwalt Reusch in Hessen zur Verfügung gestellt wird\". Reuschs Vorgesetzter Rother war am Donnerstag nicht mehr zu sprechen. Noch ist auch völlig unklar, was Reusch in der Arbeitsgruppe machen soll. Unter anderem soll sie \"weitere Vorschläge für die Gesetzgebung erarbeiten\". Ihre Mitarbeit zugesagt haben laut hessischem Justizministerium der Strafrechtler Professor Henning Radtke von der Universität Hannover, der hessische Generalstaatsanwalt Dieter Anders und Horst Cerny, Landeschef des Opfervereins \"Weißer Ring\" in Hessen. Dass es sich bei der Offerte, die sicher nicht ganz zufällig zeitgleich in Berlin und bei der \"Bild\"-Zeitung landete, um einen politischen Schachzug handelt, ist auch Reusch klar  gerade deshalb will er vorerst nichts dazu sagen. Neu wäre die Aufgabe für den bundesweit bekannt gewordenen Oberstaatsanwalt keineswegs. In den vergangenen Jahren war der Berliner Jurist immer wieder in Deutschland oder auch im EU-Ausland unterwegs, um sich mit Staatsanwälten und Polizisten auszutauschen oder diese zu schulen. Vielleicht aber kommt auch alles ganz anders. Sollte am kommenden Sonntag Koch die Wahl verlieren, dürfte wohl auch die Arbeitsgruppe erledigt sein.",http://www.spiegel.de/politik/deutschland/wahlkampfthema-jugendgewalt-hessen-will-kaltgestellten-staatsanwalt-a-530751.html,2008-01-24T00:00:00.000Z
"AUS DEM SPIEGEL Ausgabe 11/2008 Schule \"Ist Nagellack verboten?\" Deutschsprachiger Islamunterricht für muslimische Schüler hilft bei der Integration und beim Spracherwerb. Kultusminister wollen das Fach flächendeckend einführen. Von Beate Lakotta Beate Lakotta Jahrgang 1965, berichtete über zehn Jahre lang als Wissenschaftsredakteurin des SPIEGEL über Medizinethik, Psychologie, Psychiatrie und Neurowissenschaften, bevor sie 2010 als Kriminal- und Justizreporterin ins Deutschland-Ressort wechselte. Mehr Artikel von Beate Lakotta Zwei Wochen war die Lehrerin krank. Doch die Mädchen und Jungen stürzen auf sie zu, als wäre sie ein Jahr lang fort gewesen: \"Frau Kaddor, da sind Sie ja wieder\", rufen Umut, Ebru, Sibel und Gülçin durcheinander. \"Frau Kaddor, gucken Sie, ich war in Solarium, meine Nase hat Sonnenbrand\", \"Frau Kaddor, kommen Sie, der Mario und der Onur ...\" DPA Islamkunde (in Hannover): \"Religion ist oft das einzig Positive für die eigene Identität\" Inmitten der Mädchen, die auf dem Pausenhof den Arm um sie legen, könnte Lamya Kaddor, 29, auch als große Schwester durchgehen. Es gibt nicht viele Lehrer in der Glückauf-Hauptschule in Dinslaken-Lohberg, die so stürmisch geliebt werden, selbst von den pubertierenden Jungs mit der Baseballkappe tief im Gesicht: \"Weil sie eine von uns ist\", erklärt Hüseyin stolz.  In Dinslaken-Lohberg machte vor zwei Jahren der Schacht dicht; wer konnte, zog weg. Im Edeka kaufen fast nur Türken. Die drei Moscheen sind auch wochentags gut besucht; von den wenigen Deutschen, die hier leben, sind viele aus Russland gekommen. Kaddors Eltern wanderten einst als Gastarbeiter ein, aus Syrien: \"Wir landeten im Ghetto, aber meine Mutter hat dafür gesorgt, dass wir dort rauskamen.\" Kaddor ist mit einem Studienkollegen verheiratet, einem zum Islam konvertierten Deutschen. Sie betet und fastet genauso wie ihre Schüler, spricht Deutsch, Arabisch und Türkisch. An der Universität Münster bildet Kaddor am bundesweit ersten Lehrstuhl für die Religion des Islam angehende Lehrer aus. Deutschlands Integrationsbeauftragte träumen von Bürgern wie Lamya Kaddor. An der Glückauf-Hauptschule unterrichtet sie \"Islamkunde in deutscher Sprache\". Noch sind es sehr wenige Schulen, an denen dieses Fach gelehrt wird. Aber an diesen wenigen Orten zeigt sich, wie segensreich es auf Migrantenkinder wirkt. Endlich mal sind die muslimischen Schüler Experten, das ist gut fürs Selbstbewusstsein. Und wer auf Deutsch über das Jenseits oder den Sinn von Almosen diskutiert, übt zugleich seine Ausdrucksfähigkeit. Wo es Islamunterricht gibt, das beweist auch ein Modellversuch an niedersächsischen Grundschulen, dort kommt es auf dem Schulhof seltener zum Gerangel zwischen Arabern und Türken. Mütter und sogar Väter muslimischer Schüler kommen neuerdings zum Elterngespräch, bringen Kichererbsenbällchen für das Schulfest mit und begleiten die Klassenfahrt. Für viele muslimische Eltern in Lohberg war die neue Religionslehrerin zuerst ein Schock: eine Frau, jung, kein Kopftuch, nicht türkischstämmig. Trotzdem wurde kein einziges Kind vom Unterricht abgemeldet, und Lamya Kaddor ahnt, warum: \"Hier ist Religion oft das einzig Positive für die eigene Identität.\" Deswegen besuchen fast alle Schüler die Koranschule. Dort wird das bloße Intonieren arabischer Laute gelehrt, manchmal unter Androhung der Prügelstrafe. Kaddor vergleicht das mit der lateinischen Liturgie: \"Die hat auch jahrhundertelang keiner verstanden.\" Der Islamunterricht ergänzt nun die Koranschule. Mustafa erklärt es so: \"In der Moschee lernen wir Koran lesen, alles andere lernen wir bei ihr.\" Die erste Lektion: Frauen steht Autorität zu; unwahrscheinlich, dass sich diese Lehrerin von ihrem Mann unterdrücken ließe. Aber vor allem lernen die Kinder, Fragen zu stellen - in den meisten Koranschulen undenkbar: \"Ist Nagellack im Koran verboten?\" - \"Muss ich ein Kopftuch tragen, wenn mein Mann das will?\" - \"Stimmt es, dass Ungläubige in die Hölle kommen?\" - \"Was sagt der Koran über Ehre?\" Dann versucht Kaddor klarzumachen, dass es wichtig ist, etwas über die Zeit zu wissen, in der die heilige Schrift entstand. Und dass man als moderner Muslim manches darin anders verstehen kann, zum Beispiel den Vers über die Ungläubigen: \"Tötet sie, wo immer ihr sie findet.\" Damit, so erklärt Kaddor, meinte Allah zu Mohammeds Zeit die Bewohner eines bestimmten feindlichen Dorfs. Es war keine Kampfansage an alle Nichtmuslime, wie Hassprediger glauben machen wollen. Manchmal gelangt aber auch Kaddor an ihre Grenzen: Als sie mit ihren Schülern über den Mord an dem niederländischen Filmemacher Theo van Gogh sprach, der einen in den Augen vieler Muslime gotteslästerlichen Film gedreht hatte, fanden es einige ganz in Ordnung, dass man \"das Schwein abgestochen\" habe. Und neulich hat ein Junge gefragt, ob nicht im Koran stehe, dass jeder Muslim die Pflicht habe, Juden zu töten. \"Gut, dass du fragst\", hat Kaddor geantwortet, \"aber glaubst du, Allah hat nichts Besseres zu tun, als die Menschen gegeneinander zu hetzen?\" Inzwischen fragt sich Kaddors Schulleiter Hans-Jakob Herpers, warum man nicht früher auf dieses Fach gekommen ist, zumal der erste Antrag auf islamischen Religionsunterricht von 1978 stammt. Es muss wohl etwas damit zu tun haben, dass die Deutschen lange meinten, ihr Land sei kein Einwanderungsland - obgleich mittlerweile über drei Millionen Muslime hier leben, mit 800.000 schulpflichtigen Kindern. In den Ministerien hingegen sieht man das Versäumnis bei den Muslimen: Zwar seien nicht nur Menschen, sondern auch Religionen eingewandert - aber eben leider keine von oben nach unten durchorganisierte Glaubensgemeinschaft, wie es Katholiken und Protestanten sind. Es gibt Schiiten, Sunniten und Aleviten, sie bilden lokale und regionale Verbände, die sich untereinander nicht grün sind; einige gelten als radikal islamistisch; und die allermeisten Muslime sind überhaupt nicht organisiert, weil der Islam traditionell keine Hierarchien kennt - keinen Papst, keinen Bischof, keine Synode. Aber wenn jeder Imam in seiner Koranschule nach eigenem Gusto lehren darf, mit wem soll man da als Beamter im Schulministerium Lehrpläne für den Religionsunterricht aushandeln - oder gar Hochschul-Curricula für Religionslehrer? Doch nun bewegen sich beide Seiten: Im März 2007 gründete sich der Koordinationsrat der Muslime in Deutschland. Und die Schulminister mehrerer Bundesländer erklären mittlerweile, den Islamunterricht flächendeckend zum regulären Schulfach ausbauen zu wollen. Bildungspolitiker, die das Feld nicht länger den Moscheen überlassen möchten, stehen allerdings vor einem hausgemachten Problem: Woher sollen die Lehrer kommen, wenn zurzeit nur 2,3 Prozent aller muslimischen Schüler das Abitur schaffen, und diese wenigen oft mit einem Notenschnitt, der nicht für die Uni reicht? Heute unterrichten gerade mal rund 120 Islamlehrer auf Deutsch, 80 davon in Nordrhein-Westfalen. Und selbst dort würden achtmal so viele Lehrer gebraucht. Auch wenn sich jetzt in Münster, Erlangen und Osnabrück ein paar Dutzend Studenten eingeschrieben haben - es wird noch Jahre bis zu ihrem Abschluss dauern. Einstweilen hat Kaddor an einem Leitfaden für den Umgang mit muslimischen Schülern mitgearbeitet. Darin ist zum Beispiel zu lesen, dass aus islamischer Sicht ein Mädchen den Schwimmunterricht durchaus mitmachen kann, zur Not im Ganzkörperbadeanzug. Und dass man selbst streng religiöse Eltern davon überzeugen kann, ihre Kinder mit auf Klassenfahrten zu schicken, wenn man ihnen verspricht, dass die Kinder beten können, dass es kein Schweinefleisch und keinen Alkohol gibt, und ihnen erklärt, dass auch die deutschen Eltern kein Drunter und Drüber zwischen Jungs und Mädchen wollen. www.GREGORSCHLAEGER.de Islamunterricht (in Hannover\": \"Allah\" steht auf dem Pappschild Theoretisch könnten in solchen Fragen jene Lehrer vermitteln, die Migrantenkindern an deutschen Schulen schon seit Jahrzehnten \"muttersprachlichen Ergänzungsunterricht\" erteilen. Doch die Türkei entsendet hierfür vorzugsweise ältliche Männer, die von der Lebenswelt ihrer Schüler keinen Schimmer haben und meist kein Deutsch sprechen. Eigentlich sollen diese Lehrer auch etwas über Religion vermitteln. Doch in der Praxis bekommen die Kinder schon mal eine Türkeikarte zum Ausmalen, der Lehrer holt die \"Hürriyet\" aus der Aktentasche und liest bis zum Gong die Zeitung.  Als Kaddor hier zu unterrichten begann, glaubten manche Kinder, Mohammed sei in Istanbul geboren und Atatürk ein Prophet. Schulleiter Herpers ist inzwischen überzeugt: \"Wer Integration will, der muss auch Islamunterricht geben. Man hat das lange verschlafen, aber die Deutschen können das ja nicht ...\" \"Ich bin Deutsche\", sagt Kaddor. \"Äh, ja klar\", sagt Herpers. Die Lehrerin ordnet noch rasch ein paar Kopien: Weil bislang keine für die Schule brauchbare Übersetzung des Koran existiert, hat Kaddor kurzerhand die Verse des heiligen Buchs selbst neu sortiert, übersetzt und erläutert - eine ziemlich revolutionäre Tat in der islamischen Welt. Bisher hatte sie mit den Hodschas der Dinslakener Moscheen keine Probleme. Sie hofft, dass das so bleibt, wenn demnächst ihre Koranübersetzung erscheint. Heute steht in der zehnten Klasse ein schwieriges Thema an: das Gottesverständnis. \"Er ist der Eine Gott\", heißt es in Sure 112. \"Er zeugt nicht und ist nicht gezeugt.\" Stirnrunzeln in den Bänken: Wie ist das mit dem Zeugen zu verstehen? \"Er kann keine Kinder kriegen\", schlägt Umut vor. Aber wieso soll Gott ausgerechnet das nicht können? Lamya Kaddor liest ihre eigene Übersetzung vor: \"Gott hat weder Kinder gezeugt, noch ist er selbst gezeugt worden.\" Die Sure spiele auf die Christen an, die glauben, Gott habe einen Sohn, der zugleich Mensch ist. \"Es ist interessant, was über andere Religionen zu lernen\", findet Gülçin. Sie ist die einzige Schiitin der Klasse. Auch das war schon Thema, und am Ende haben sie keine vernünftige Antwort auf die Frage gefunden, warum sich anderswo die Muslime gegenseitig die Köpfe einschlagen. Eine andere Frage, die zurzeit die Politik bewegt, hat sich an der Glückauf-Hauptschule längst erledigt: \"Was haltet ihr davon, wenn wir Islamunterricht auf Türkisch machen?\", fragt die Lehrerin. \"Nein! Deutsch ist für uns total wichtig\", wehrt Sibel empört ab. \"Wir müssen besser reden lernen, sonst nehmen die uns nicht, später, wenn wir arbeiten wollen.\" - \"Ich kann gar kein Türkisch\", gibt Sana aus Marokko zu bedenken. - Und Hüseyin ruft: \"Ey, Mann, was soll das! Wir sind Deutschland!\"",http://www.spiegel.de/spiegel/a-541372.html,2008-03-13T00:00:00.000Z
"Islam-Gipfel Lernfortschritt auf Schäubles Krach-Konferenz Sie kamen, um zu streiten: Auf der Islamkonferenz mit Innenminister Schäuble gab es viel Zwist. Und eine erste Einigung zum Religionsunterricht an deutschen Schulen. Doch wie bringt man deutsche Werte im Alltag zum Leben - dürfen zum Beispiel muslimische Mädchen mit zu Schwimmstunden? Von Severin Weiland Christian O. Bruch/ laif Severin Weiland Severin Weiland, geboren 1963 in Wilhelmshaven/Niedersachsen. Verbrachte einen Teil seiner Kindheit und Jugend in Chile. Studium der Kommunikations- und Politischen Wissenschaft in München, Ausbildung an der Deutschen Journalistenschule München. Ab 1992 Redakteur im Lokalteil der \"tageszeitung\" in Berlin, später landespolitischer Korrespondent. Von 1996 bis 1999 Stellvertretender Ressortleiter Innenpolitik der taz. Sabbatjahr in Kathmandu, Nepal. Von Herbst 2000 bis Januar 2002 bundespolitischer Korrespondent der taz in Berlin. Seit Februar 2002 Parlamentskorrespondent im Berliner Büro von SPIEGEL ONLINE, seit dem 1. Mai 2004 Stellvertretender Leiter des Berliner Büros von SPIEGEL ONLINE. Ab Mitte Oktober 2014 politischer Korrespondent im Hauptstadt-Büro. E-Mail: Severin.Weiland@spiegel.de Twitter: @SeverinWeiland folgen Mehr Artikel von Severin Weiland Berlin - Mit mehr als einer Stunde Verspätung erschienen der Bundesinnenminister und sechs ausgewählte Teilnehmer der Konferenz im zum Pressesaal hergerichteten Logenhaus in Berlin-Wilmersdorf. Man sei \"etwas im zeitlichen Verzug\", aber das sei man von den Treffen der Deutschen Islamkonferenz schon gewohnt und zeige, wie \"intensiv unsere Beratungen sind\", fügte der CDU-Politiker entschuldigend hinzu. In der Tat. Zum dritten Mal hat sich die Runde getroffen, seit Schäuble zum ersten Mal im Herbst 2006 einlud. Die Diskussionen im 30-köpfigen Plenum dauerten jedesmal länger als geplant. Und waren, wie Schäuble auch diesmal zu verkünden hat, \"streitig\". Von der heutigen Sitzung hatte Schäuble vor allem eine Nachricht zu vermelden: An öffentlichen Schulen soll künftig islamischer Religionsunterricht auf Deutsch angeboten werden. So steht es in dem zehn Punkte umfassenden Zwischenbericht, auf den sich die Konferenz geeinigt hat . In den Bundesländern sollen die islamischen Vertretungen sich nun in Religionsgemeinschaften organisieren, damit der Staat künftig einen Ansprechpartner hat. \"Wir sind uns einig, dass dieser Weg jetzt gegangen werden soll\", sagte Schäuble. Ob die Vielzahl der muslimischen Organisationen sich einmal zu einer öffentlich-rechtlichen Körperschaft vereinigen, ist hingegen nicht abzusehen. In \"dieser Phase\" sei das noch nicht vorgesehen, so der Sprecher des Koordinierungsrats der Muslime, Bekir Alboga. Wann der Religionsunterricht eingeführt wird, ist offen. Das sei noch nicht absehbar, so die Präsidentin der Kultusministerkonferenz, Annegret Kramp-Karrenbauer (CDU). Es werde \"einige Jahre\" in Anspruch nehmen. Es sei bislang auf der Islamkonferenz schon spannend gewesen, nun werde es noch spannender: Denn jetzt gehe es darum, wie das \"Definieren der Werteordnung\" in den Alltag übersetzt werde. Die CDU-Politikerin wies in diesem Zusammenhang auf den Streit um die Teilnahme von Mädchen am Biologie- und Schwimmunterricht und an Klassenfahrten hin. Absichtserklärungen von vielen Seiten Vieles, was in den Arbeitskreisen der Islamkonferenz in den vergangenen Monaten zum Teil mühsam formuliert worden ist, sind Absichtserklärungen. Schäuble selbst räumte ein, dass nicht alle Bundesländer zur Einführung des Islamunterrichts bereit sind. Auch gebe es zu einigen Formulierungen Vorbehalte von einzelnen Migranten-Verbänden, das wolle er \"ausdrücklich sagen\", so der Minister. Doch verwahrte er sich auch indirekt gegen Kritik an den mangelnden Ergebnissen der Konferenz. Sie sei alternativlos. Und im Zusammenhang mit dem Religionsunterricht erklärte er: \"Wir gehen Schritt für Schritt voran.\" In den vergangenen Wochen hatte es intern vor allem einen Streit um ein Bekenntnis zur deutschen Werteordnung gegeben. Das war von einigen konservativen muslimischen Organisationen abgelehnt worden. Nun heißt es in dem Zwischenbericht, Integration verlange von den in Deutschland lebenden Muslimen neben der aktiven Bereitschaft zum Erwerb und Gebrauch der deutschen Sprache \"darüber hinaus die vollständige Beachtung der deutschen Rechtsordnung und der Werteordnung des Grundgesetzes\". Das Papier sei \"einmütig zur Kenntnis genommen\" worden, umschrieb Schäuble die Tatsache, dass die Haltung der konservativen muslimischen Verbände bei unabhängigen und säkularen Vertretern in der Islamkonferenz wie Necla Kelek und Seyran Ates weiter auf Kritik stößt. Gern zu deutschen Gerichten Dass die Fronten insbesondere unter den Muslimen verhärtet und von Misstrauen geprägt sind, offenbarten die Ausführungen der Soziologin und Publizistin Kelek auf der Pressekonferenz. Intern auf dem Plenum hatte sie zuvor schon die geplante Einführung des islamischen Religionsunterrichts kritisiert. Dies bräuchten muslimische Kinder nicht unbedingt. Besser sei es, ein neutraleres Fach wie Islamkunde anzubieten. Auf der Pressekonferenz mit Schäuble erklärte sie anschließend, Unabhängige und Verbandesvertreter zerfielen sowohl auf der Konferenz insgesamt wie auch in der Arbeitsgruppe, der sie angehöre, in zwei Gruppen. Mit dem Koordinierungsrat der Muslime etwa gebe es keinen Konsens darüber, wie diese sich das konkrete muslimische Leben in Deutschland eigentlich vorstellten. Zuvor hatte deren Sprecher Alboga erklärt, nicht nur seien Frauen und Männer vor dem Grundgesetz gleich, sondern auch vor dem Auge Gottes. Kelek erklärte, die von Alboga geschilderte Gleichheit der muslimischen Frauen sehe in der Realität \"ganz anders aus\". So würden schon kleine Mädchen mit Kopftuch in den Kindergarten geschickt, und es gebe Scharia-Gerichte. Sie warf den Funktionären vor, ihre eigene Werteordnung sei mit der deutschen nicht kompatibel. Es gebe daher noch \"viel, sehr viel zu tun\", die eigentliche Arbeit stehe der Konferenz noch bevor, so Kelek. Sie bekräftigte zugleich, trotz der Differenzen weiterhin an der Islamkonferenz teilzunehmen. In ihrer Arbeitsgruppe gebe es niemanden, der austreten wolle. Die Kritik Keleks wollte der Sprecher des Islamrats nicht stehen lassen. Alboga erwiderte, man sei ebenfalls dagegen, dass kleine Mädchen Kopftücher trügen und lobte zugleich das Grundgesetz als \"vorbildlich\". Jede Religion - ob Christenheit, Islam oder Judentum - habe eine \"andere Werteordnung\", das Grundgesetz aber sei die alle Religionen \"verbindende Werteordnung\". Alboga fasste es in der Formel zusammen: Man gehe schließlich auch gern zu deutschen Richtern.",http://www.spiegel.de/politik/deutschland/islam-gipfel-lernfortschritt-auf-schaeubles-krach-konferenz-a-541320.html,2008-03-13T00:00:00.000Z
