article,article_url,date
"Steinmeiers Türkei-Reise Hoffen auf Erdogans Einsicht - und einen Termin Die Türkei ist ein Schlüsselstaat im Syrien-Konflikt - doch bislang hakt die Zusammenarbeit mit der EU. Außenminister Steinmeier reist nach Ankara, um Präsident Erdogan zu überzeugen. Wenn der ihn überhaupt empfängt. Eine Analyse von Christoph Schult , Ankara Christoph Schult 1971 in Hamburg geboren. Studium der Geschichtswisssenschaft und Politologie in Hamburg und London. Ausbildung an der Henri-Nannen-Schule. Seit 2001 beim SPIEGEL, 2005 bis 2010 Korrespondent in Jerusalem, danach in Brüssel, seit 2015 wieder in Berlin. Im Hauptstadtbüro vor allem zuständig für die Außenpolitik. E-Mail: Christoph.Schult@spiegel.de Twitter: @schultchristoph folgen Mehr Artikel von Christoph Schult Wenig Zeit? Am Textende gibt's eine Zusammenfassung. Im Frühjahr, am Anfang der Krise, als im Mittelmeer Menschen ertranken, lag die Flüchtlingskrise noch größtenteils in den Händen der Außenpolitiker. Es ging hauptsächlich um die Frage, wie man den Schleppern in Libyen und anderswo das Handwerk legen könnte.   Mehr dazu im SPIEGEL Heft 38/2015 Als das Tier zum Menschen wurde Der Höhlenfund von Südafrika: Forscher entdecken unsere Vorfahren neu Digitale Ausgabe | Gedruckte Ausgabe | Apps | Abo Im Sommer dann wurde die Flüchtlingsfrage zu einem europapolitischen Thema, es ging um den Schutz der Außengrenzen und die Frage, ob EU-Außenstaaten wie Ungarn ihrer Verpflichtung nachkommen, Asylsuchende aufzunehmen und zu registrieren. Mit der Entscheidung von Bundeskanzlerin Angela Merkel , die Grenzen für Tausende Flüchtlinge aus Ungarn zu öffnen, rückte die Frage schließlich ins Zentrum der deutschen Innenpolitik. CSU-Chef Seehofer ging auf Konfrontation zur Kanzlerin, der Chef des Bundesamts für Migration und Flüchtlinge trat zurück . Doch Merkel sagt: \"Wir schaffen das.\" Je mehr allerdings daran Zweifel aufkommen, desto stärker rücken außenpolitische Fragen wieder in den Vordergrund. Am Sonntag kommt US-Außenminister John Kerry zu Gesprächen nach Berlin. Und auch die Reise von Bundesaußenminister Frank-Walter Steinmeier in die Türkei an diesem Freitag ist ein deutliches Zeichen für die Verschiebung der Blickachse. Es kommen immer mehr Hilfesuchende ins Land - und nun beschäftigt sich die deutsche Politik verstärkt mit der Frage, wie man die Fluchtursachen bekämpfen kann. DPA Steinmeier (Archivbild): Drängende Fragen zu Syrien Die Türkei sei, wie Steinmeier vor seinem Abflug sagte, \"ein Schlüsselland für den Umgang mit der großen Flüchtlingskrise\". Zum einen ist die Türkei das größte Transitland für Flüchtlinge aus dem Nahen und Mittleren Osten, aber auch von noch weiter her: aus Afghanistan und Pakistan. Bei seinen Gesprächen will sich der Außenminister der Frage widmen, wie der Türkei organisatorisch und finanziell geholfen werden kann, mit den enormen Flüchtlingszahlen fertig zu werden.   Steinmeier trifft sich dazu in Ankara auch mit örtlichen Vertretern des Uno-Flüchtlingshilfswerks UNHCR und der Hilfsorganisation Asam, die Flüchtlinge aufnehmen und registrieren. Der UNHCR klagt seit Monaten über Geldknappheit, die täglichen Rationen für die Flüchtlinge mussten um 50 Prozent gekürzt werden. Kann die Türkei im Syrien-Konflikt helfen? Bei den politischen Gesprächen, unter anderem mit Ministerpräsident Ahmet Davutoglu und Außenminister Feridun Sinirlioglu, will Steinmeier der Regierung Anerkennung dafür zollen, dass die Türkei in den letzten Jahren rund vier Millionen Flüchtlinge aus Syrien und dem Irak aufgenommen hat. Bei allen lobenden Worten: Eine der Hauptursachen der großen Flucht ist der syrische Bürgerkrieg. Steinmeier will in den Gesprächen ausloten, ob die türkische Regierung bereit ist, eine konstruktivere Rolle bei der Lösung der Syrien-Frage zu spielen. An den Luftschlägen gegen die Terrormiliz des \"Islamischen Staats\" beteiligt sich Ankara seit einiger Zeit. Gleichzeitig geht die türkische Armee jedoch gegen die Kurden im türkisch-irakisch-syrischen Grenzgebiet vor - jene Kurden, die Deutschland als Verbündete im Kampf gegen den \"Islamischen Staat\" sieht, ausbildet und mit Waffen und Munition versorgt. Ohne Iran gibt es keine Lösung Vor allem aber schließt Ankara Gespräche mit dem Regime des syrischen Herrschers Baschar al-Assad bislang kategorisch aus. In Berlin hingegen setzt sich immer mehr die Einsicht durch, dass man Assad zumindest für einen Waffenstillstand und eine Übergangslösung im syrischen Bürgerkrieg benötigt. Auch die Einbindung Irans, neben Russland stärkster Unterstützer des syrischen Diktators, sieht die türkische Regierung äußerst kritisch. Ohne Iran aber, davon ist man im Berliner Außenamt überzeugt, kann die Syrien-Frage nicht gelöst werden. Ob sich die Türkei in diesen Fragen bewegt, hängt vom Verhalten ihres Präsidenten Recep Tayyip Erdogan ab. Als Steinmeier an diesem Freitagmorgen um kurz nach sechs Uhr mit einem Airbus der Luftwaffe in Richtung Ankara aufbrach, war noch nicht klar, ob Erdogan den deutschen Außenminister empfangen würde. Zusammengefasst : Frank-Walter Steinmeier hat in der Türkei zwei wichtige Fragen zu klären. Wie geht das Land mit den Millionen Flüchtlingen aus Syrien um? Und wie kann die Regierung auf einen gemeinsamen Kurs mit dem Westen im Umgang mit dem syrischen Herrscher Assad gebracht werden? Bislang verweigert Präsident Erdogan mit diesem jeden Kontakt. Noch ist aber sogar offen, ob Steinmeier von Erdogan überhaupt empfangen wird.",http://www.spiegel.de/politik/ausland/steinmeier-in-der-tuerkei-hoffen-auf-erdogan-a-1053558.html,2015-09-18T00:00:00.000Z
"Heute in den Feuilletons \"Leicht beschmunzelbare Trottelklischees\" Die \"taz\" sucht in der feministischen Theatercollage \"thisisitgirl\" nach Erkenntnisfunken. Die \"SZ\" wird meditativ in der Münchner Ausstellung von Hanne Darboven. Der \"Standard\" besichtigt die neue Betonbadewanne des Sprengel Museums. Efeu - Die Kulturrundschau Kunst, 18.09.2015 Die konvolutartige, derzeit in Bonn und in München ausgestellte Kunst von Hanne Darboven ist \"eine [Zumutung], die sich lohnt\", freut sich Kia Vahland in der SZ, die die Münchner Ausstellung allerdings für die etwas gelungenere hält. \"Diese Künstlerin überwältigt mit Gleichmut , Stringenz , Serialität . Sie schwingt den Stift über das Papier, in immer gleichen Wellenbewegungen, nur deren Zahl variiert. ... Zeitlebens arbeitete sie sich an Kalendern ab, addierte auf eigene Weise Daten: Tageszahl plus Monatszahl, plus die letzten beiden Ziffern eines Jahres, jene aber einzeln gezählt. Mit dieser Formel summierte sie Jahrzehnte, Jahrhunderte, wollte das Universum erfassen und ein eigenes schaffen .\" Michael Kohler von der FR hat die Bonner Ausstellung besucht, wo ihm ganz melancholisch ums Herz wurde: Seine \"bittere Erkenntnis: Wer schreibt, versucht sich etwas zu vergegenwärtigen, was nicht mehr ist, und während er noch schreibt, zeigt ihm die leblose Schrift , dass er das, was er sucht, verloren hat.\" Weitere Artikel: In der Presse freut sich Almuth Spiegler über Caravaggios gar nicht so süßen \"Schlafenden Amor\" , den das Kunsthistorische Museum Wien aus Florenz ausgeliehen hat. In der NZZ schreibt Marc Zitzmann zum dreißigsten Geburtstag des Centre culturel suisse in Paris. Besprochen werden die Cranach -Ausstellung in Wittenberg ( NZZ ), das Programm der Berliner NGBK zur Art Week ( Tagesspiegel ) und die Ai - Weiwei -Retrospektive in London ( FAZ ). Architektur, 18.09.2015 Michael Wurmitzer besucht für den Standard den von Meili/Peter aus Zürich errichteten Erweiterungsbau zum Sprengel Museum in Hannover: \"Es ist ihr erster Museumsbau - und gleich ein Kraftakt! 36 Millionen Euro hat die auf einem gläsernen Sockel ruhende Betonwanne gekostet und ist eine ingenieurtechnische Meisterleistung: In einem Stück vor Ort gegossen, wurde rundherum ein Wärmezelt errichtet, um Sprünge beim Aushärten zu vermeiden. Fugenlos wie ein 'gewachsener Stein' sei das Ergebnis, so der ins Baugeschehen hinein berufene Direktor Reinhard Spieler. 75 Meter erstreckt sich die Fassade hinter dem Stammhaus, aufgelockert von einem Relief aus Horizontalen und Vertikalen.\" Bühne, 18.09.2015 Die Berliner Schaubühne startet mit Patrick Wengenroths feministischem Collage-Abend \"thisisitgirl\" in ihre Spielzeit. Bei dem Thema mit dem Schlimmsten, nämlich unfreiwilligem Humor, hatte Christine Wahl gerechnet. Im Tagesspiegel gibt sie nun jedoch Entwarnung: Die Komik sei \" hundertprozentig freiwillig . Die Klischees werden mit Grandezza ausgestellt, statt blauäugig reproduziert.\" Tatsächliche Brisanz barg der Abend ihrer Ansicht nach allerdings nicht, worin ihr auch Anne Peter in der taz recht gibt : \"Die Nummernrevue [verläuft sich] in allzu konsensfähigen, leicht beschmunzelbaren Trottelklischees . Man lacht gern und viel, die beeindruckend lange Lektüreliste des Programmzettels von Simone de Beauvoir über Alice Schwarzer bis Judith Butler lässt sich dem Abend hingegen nur bedingt anmerken. Entwaffnend ist die Selbstverlachungs - und - entlarvungsbereitschaft , mit dem Wengenroth und seine Geschlechtsgenossen zu Werke gehen. Da verzeiht man der sympathischen Unternehmung gern, dass manche Szene länglich bis verzichtbar gerät, vieles nur angetippt wird und die Erkenntnisfunken eher spärlich fliegen.\" Für die SZ war Peter Laudenbach im Publikum. Nach ihren Kollegen sinkt auch Eleonore Büning in der FAZ vor Christian Gerhahers Zürcher \"Wozzeck\"-Performance auf die Knie: \"Melierte Zwischentöne braucht es, um diesen dem wahren Leben zugehörigen Charakter darzustellen, auch Pastellfarbenes , Zartes , Feines , neben der aufbrausenden Jagd nach Glück und dem schwarzen Loch der apokalyptischen Visionen auch etwas Zweifel, eine Prise Ambivalenz. ... Die Modulationsfähigkeit dieser Stimme ist außerordentlich. Wie er in der zweiten Invention, im dritten Akt, um Marie ein letztes Mal wirbt und sie zugleich bedroht, wie er irre lächelt, tief aufseufzend und hoch skandierend im Falsett, das ist herzzerreißend .\" Friederike Gräff spricht für die taz mit Karin Beier , der Intendantin des Hamburger Schauspielhauses , das derzeit Flüchtlinge beherbergt und sich davon auch vom heutigen Beginn der Spielzeit nicht abhalten lassen will: \"Ich fände es ein ganz blödes Zeichen, wenn wir sagten: 'Jetzt spielt das Theater, dann geht es nicht mehr'. Wir machen es genauso weiter. Vielleicht legen wir die Matratzen erst um elf statt um zehn Uhr aus. Wie lange wir es schaffen, wie lange wir Freiwillige haben, die zwischen zwei Uhr nachts und acht Uhr morgens Wache schieben , das weiß ich noch nicht.\" Besprochen werden Peter Brooks ' Inszenierung \"Battlefield\", ein später Nachtrag zu seinem \"Mahabharata\" von 1985, in Paris (\"Wie bei Oblaten muss man vom entsprechenden Glauben beseelt sein, um durch diese bis hin zur Fadheit vergeistigte Kost in Verzückung versetzt zu werden\", seufzt Marc Zitzmann in der NZZ ), Choreografien von Thierry Malandain an der Wiener Volksoper ( Standard ), Matthias Lilienthals \"Shabbyshabby Apartments\" in München ( Tagesspiegel ), Kordula Hildebrandts Dokumentarfilm \"Tango Pasión\" über die Berliner Tangoszene ( FR ), Johan Simonis ' \"Rheingold\"-Inszenierung bei der Ruhrtriennale ( Tagesspiegel ) und die von John Fulljames ' inszenierte und von Hofesh Shechter choreografierte Aufführung von Christoph Willibald Glucks \"Orphée et Eurydice\" am Royal Opera House in London ( SZ ). Film, 18.09.2015 Besprochen werden Wolfgang Beckers \"Ich und Kaminski\" ( NZZ ), Raoul Pecks \"Mord in Pacot\" ( Tagesspiegel , Filmgazette , Perlentaucher ), Baltasar Komákurs \"Everest\" ( FR , SZ ) und Lorraine Lévys \"Der Sohn der Anderen\" ( Tagesspiegel ) . Literatur, 18.09.2015 Bloß keine noch populistischere Germanistik , stöhnt Magnus Klaue in der Jungle World , wo kürzlich Manuel Clemens eine entsprechende Forderung laut gemacht hatte. Er plädiert für mehr fachliches Selbstbewusstsein: Denn diese \"Klage über das Spezialistentum [bedient] kleinbürgerliche Ressentiments . Philologische Arbeiten über 'Die deutsche Aristophanes-Rezeption im 19.¿Jahrhundert' oder 'Körper als Metapher bei Juli Zeh' mögen Leuten, die etwas anderes gelernt haben, überflüssig erscheinen - ein Urteil, das in letzterem Fall vermutlich sogar zutrifft. Die Arbeitsteilung, deren Produkt sie sind, ist aber Ergebnis wissenschaftlichen Fortschritts und wird an anderen Disziplinen als den Geisteswissenschaften selten beanstandet. ... Nur Fächer wie die Philologie und die Philosophie, die mit dem Zweckfreien zu tun haben, müssen sich ständig vor einer imaginären Bürgerversammlung rechtfertigen.\" Weitere Artikel: In seiner Reihe \"Mein Jahr ohne Udo Jürgens\" im Logbuch Suhrkamp denkt Andreas Maier über Udo Jürgens und das Geschlechterverhältnis nach. Sandra Vogel war für die Berliner Zeitung bei Richard Flanagans Lesung auf dem Internationalen Literaturfestival in Berlin, das Thomas Hummitzsch in der taz resümiert . Besprochen werden Peter Härtlings Roman-Fantasie \"Verdi\" ( Standard ), Roz Chasts Comic \"Können wir nicht über etwas anderes reden?\" ( SZ ) und Bernard Maris ' \"Michel Houellebecq, Ökonom - Eine Poetik am Ende des Kapitalismus\" ( SZ ). Musik, 18.09.2015 Anders als gerade noch Klaus Walter auf Byte.FM kann Chris Bohn, Chefredakteur der britischen Musikzeitschrift The Wire und Experte für deutsche Popmusik, dem neuen Album der Goldenen Zitronen ( hier im Stream) nur wenig abgewinnen. Schorsch Kamerun hätte besser nicht versucht, die deutschen Songs auf Englisch zu singen, meint Bohn in der taz : \"In seiner Muttersprache nuanciert er Worte fast unmerklich und betont dadurch subtil die Art, wie sie sich in den Post-Punk-Techno-Rhythmus-Bässen verteilen, die seit Mitte der Neunziger Bestandteil der Musik der Goldenen Zitronen sind. Auf 'Dead Frog' aber ist Kamerun viel zu beschäftigt damit, die englischen Texte richtig zu artikulieren .\" In der Spex bespricht Christina Mohr das Album. Weitere Artikel: Ji-Hun Kim von Das Filter legt sich mit Max Richters achtstündiger Komposition \"Sleep\" (mehr dazu hier ) ins Bett. Hanspeter Künzler unterhält sich in der NZZ mit Dan Auerbach über dessen neues Projekt \"The Arcs\" - \"eine Art psychedelischer Rock-Soul für die Neuzeit\", meint Künzler. In der Zeit porträtiert Angela Köckritz den Köpenicker Rapper Romano . In der taz porträtiert Franziska Buhre die Jazzsaxofonistin Kathrin Lemke . Carsten Niemann kann es im Tagesspiegel nicht fassen, dass das Berliner Ensemble Kaleidoskop ( mehr ) nach bisherigem Stand der Dinge keine Fördermittel mehr erhalten soll. Besprochen werden Sufjan Stevens ' Auftritt in Berlin ( Berliner Zeitung ), das neue Album von Cocorosie ( Spex ), Bixiga 70s \"III\" ( taz ), das Album \"Ones and Sixes\" von Low ( Standard ) und das neue Soloalbum von Keith Richards ( Berliner Zeitung , NZZ , Standard ). 9Punkt - Die Debattenrundschau Europa, 18.09.2015 Regina Mönch begibt sich für die FAZ ins Havelland, wo die größte Flüchtlingsunterkunft von Brandenburg entstehen soll. Es wird richtig idyllisch: \"Der Bahnhof der Regionalbahn, die man in der Stille der Nacht rattern hört, wurde vor zwanzig Jahren geschlossen und später abgerissen. In der nächsten Siedlung, wo auch das kleine Rathaus der Großgemeinde steht, gibt es immerhin zwei Supermärkte , die einzigen für alle. Vom geplanten Containerdorf, dessen Insassen sich einst selbst versorgen sollen, sind sie ein paar Landstraßenkilometer entfernt.\" In der SZ denkt Thomas Steinfeld über \"Deutschlands Rolle als moralische Großmacht \" nach und stellt fest: \"Die Begriffe der wirtschaftlichen und der moralischen Großmacht sind nicht wirklich alternative Konzepte. Sie gehen mit Leichtigkeit ineinander über.\" Internet, 18.09.2015 \"It is going to be a bloodbath of independent media\", schreibt Nilay Patel bei The Verge und erklärt, wie Google , Apple und Facebook in einem Kampf der Giganten das Netz unter sich aufteilen, während unabhängige Medien im Netz kaum mehr überleben können. Grund dafür sind die Adblocker , die Apple etwa von vornherein in seine Mobil-Browser einbaut, um Google zu schaden (aber auch all jenen Medien, die ein bisschen was von der Google-Werbung abbekommen): \"Was passiert einer kleinen Firma, wenn du ihr 75 bis 85 Prozent ihrer Einnahememöglichkeiten im Namen der Nutzererfahrung wegnimmst? Wer wird all jenen Inhalt machen, den wir so lieben?\" Medien, 18.09.2015 Gérard Biard , Chefredakteur von Charlie Hebdo , war gestern in Berlin und hat Joachim Huber und Christiane Peitz vom Tagesspiegel ein Interview gegeben: \"Unsere Karikaturen mokieren sich nicht über den Glauben, sondern über dessen Missbrauch zu politischen Zwecken. Salman Rushdie sagte einmal, was wir im Westen Respekt nennen, ist in Wahrheit oft Furcht. Wir haben Angst vor den Drohungen derjenigen, die ihre totalitären Ideologien mittels Religion installieren wollen, und verschließen die Augen vor der Gefährdung der Demokratie.\" Viele wohlmeinende Menschen sagen ja, die Rushdie-Affäre sei etwas ganz anderes gewesen als der Streit um die Mohammed-Karikaturen oder um Charlie Hebdo . Rushdie selbst sieht das in der Welt anders: \"Nach dem Erscheinen meines Romans 'Die Satanischen Verse' und all dem, was daraufhin folgte, musste ich mir ähnliche Vorwürfe anhören, wie sie heute Charlie Hebdo gegenüber geäußert wurden. 'Rushdie wusste doch genau, was er machte', hieß es da oft, 'er hat vorsätzlich provoziert .' Oder: 'Er hat es nur gemacht, um berühmt und reich zu werden.' Der Großteil dieser Vorwürfe kam damals von Leuten, die politisch rechts standen. Heute sind es die Linken, die den Satirikern von Charlie Hebdo fast die gleichen Vorwürfe machen. Ich finde, das ist eine seltsame Entwicklung.\" Ausgerechnet die Hürriyet , \"das unbestrittene Leitmedium der säkularen Hälfte der türkischen Gesellschaft\", wird in der Türkei immer schärfer angegrifffen, berichtet Jürgen Gottschlich in der taz : \" Für Hürriyet ist die Kampagne gegen sie ein Schock. In den 60 Jahren, in denen die Zeitung erscheint, hat sie sich immer als staatstragendes Medium begriffen, dem nichts ferner liegt, als radikale Oppositionelle oder gar 'Terroristen' zu unterstützen.\" Gesellschaft, 18.09.2015 Guillaume Gendron und Fabien Benoit schreiben in Libération über libertäres Denken in den USA, das in seinem Freiheitsradikalismus für europäische Hirne exotisch wirkt und zitiert als Leitsatz des Libertarismus einen Ausspruch des kanadischen Politikers Tim Moen: \"Ich möchte, dass schwule Ehepaare ihre Marijuana-Pflanzen mit ihrem Gewehr verteidigen dürfen.\" Eins will Welt -Redakteur Jan Küveler in einem Brief an die Fachschaftsinitiative Gender Studies (FSI) der Humboldt-Uni über den Fall R. mal klarstellen: \"Als weiße Trans*-Person verlangte R. von der WoC spezifische Auskünfte über die Race- und Gender-Positionierungen innerhalb der Interventionsgruppe. Denn schließlich sei der weiße Raum, in dem interveniert wurde, ein Schutzraum für Trans*-Personen. Somit müsse, als Legitimation, ein_e Trans*Inter*GnC (Gender non Conforming) PoC oder Schwarze_r in die Intervention involviert sein.\"",http://www.spiegel.de/kultur/gesellschaft/perlentaucher-darboven-wozzeck-thisisitgirl-charlie-hebdo-a-1053566.html,2015-09-18T00:00:00.000Z
"IfW-Prognose Flüchtlingskrise könnte bis zu 55 Milliarden Euro kosten Was kostet die Flüchtlingskrise? Das Kieler Institut für Weltwirtschaft geht in einer neuen Studie von jährlichen Aufwendungen zwischen 25 und 55 Milliarden Euro aus. Die Herausforderung sei historisch, aber beherrschbar. Hunderttausende Flüchtlinge kommen nach Deutschland - das wird die öffentlichen Haushalte einer neuen Studie zufolge erheblich belasten. Im günstigsten Fall summierten sich die jährlichen Kosten bis 2022 auf rund 25 Milliarden Euro, im teuersten Szenario auf 55 Milliarden Euro, teilte das Kieler Institut für Weltwirtschaft (IfW) am Freitag mit. \"Insgesamt sind die Schätzungen natürlich mit großen Unsicherheiten behaftet\", räumte IfW-Experte Matthias Lücke ein. \"Insbesondere was die Anzahl der ankommenden Flüchtlinge betrifft und die Geschwindigkeit, mit der sie sich in den Arbeitsmarkt integrieren.\" Selbst im ungünstigsten Fall würden die Kosten aber weniger als zwei Prozent der jährlichen Wirtschaftsleistung ausmachen. \"Die Finanzpolitik steht angesichts der zusätzlichen Ausgaben vor der größten Herausforderung seit der Wiedervereinigung \", sagte Lücke. \"Die Kosten bleiben im Verhältnis zur Wirtschaftskraft Deutschlands aber beherrschbar.\" Zu einem ähnlichen Ergebnis waren kürzlich auch die Wirtschaftsweisen gekommen. Für den finanziell günstigsten Fall nahmen die Forscher an, dass ab 2018 nur noch 360.000 Flüchtlinge jährlich nach Deutschland kommen und 70 Prozent dauerhaft bleiben. Die Kosten würden dann rund 25 Milliarden Euro jährlich betragen. Angesichts der Situation in Syrien und den Krisenländern Irak, Afghanistan und Pakistan sei aber kaum mit einer entscheidenden Verbesserung der Lage zu rechnen. Kämen bis 2020 weiterhin eine Million Flüchtlinge pro Jahr nach Deutschland, würden die Kosten bis 2022 auf 55 Milliarden Euro steigen. \"Eine vorausschauende öffentliche Finanzplanung sollte daher mit der Möglichkeit eines dauerhaft hohen Flüchtlingszustroms rechnen\", sagte Lücke. Neben einer Straffung des Asylverfahrens raten die Forscher dazu, zusätzlich 1000 Euro pro Flüchtling für eine schnellere Integration in den Arbeitsmarkt bereitzustellen. Das zahle sich aus und könne die Kosten am Ende um Milliarden drücken.",http://www.spiegel.de/wirtschaft/soziales/fluechtlinge-koennten-laut-ifw-prognose-bis-zu-55-milliarden-euro-kosten-a-1067315.html,2015-12-11T00:00:00.000Z
