article,article_url,date
"Tipps für Lehrer \"Flüchtlingskinder wollen keine Extrabehandlung\" Hunderttausende Flüchtlingskinder besuchen deutsche Schulen. Ihre Integration sei kein Hexenwerk, sagt Sarah Inal aus der Hamburger Flüchtlingsambulanz. Das Wichtigste sind - wie überall - Freundschaften. Ein Interview von Lena Greiner Christian O. Bruch / laif Lena Greiner 1981 in Hamburg geboren. Studium der Politikwissenschaft in Hamburg; Masterstudium Internationale Beziehungen in Berlin und Washington, DC. Praktika im Auswärtigen Amt und beim SPIEGEL. Längere Auslandsaufenthalte in Italien, Asien und den USA. Ab 2010 freie Journalistin, unter anderem für SPIEGEL ONLINE und den UniSPIEGEL. Seit Juni 2013 Redakteurin bei SPIEGEL ONLINE, seit Mai 2015 Ressortleiterin im UniSPIEGEL-/SchulSPIEGEL-Ressort. Seit Januar 2016 stellvertretende Ressortleiterin Bildung. E-Mail: Lena.Greiner@spiegel.de Twitter: LenaGreiner folgen Mehr Artikel von Lena Greiner SPIEGEL ONLINE: Viele Lehrer fühlen sich überfordert, wenn Flüchtlingskinder in ihre Klassen kommen. Zu Recht?   Sarah Inal: Ja und nein. Viele Lehrer, die nicht dafür ausgebildet sind, werden von ihren Schulleitungen gezwungen, Klassen mit Flüchtlingskindern zu übernehmen und bekommen nur eine kurze Fortbildung. Sie werden also alleingelassen, und das schürt natürlich Angst. Allerdings weiß ich von meiner Arbeit an Schulen: Mehr als Empathie, Offenheit und Freude über die neuen Schüler brauchen Lehrer erst mal gar nicht. Denn sie haben genug Erfahrung, um nach der für die Kinder häufig schwierigen Anfangsphase zu merken, wenn mit einem Schüler etwas wirklich nicht stimmt. SPIEGEL ONLINE: Was macht die Anfangsphase so schwer? Inal: Die meisten Kinder, die hierher geflüchtet sind, leiden unter starken psychischen Belastungen. Grund dafür ist häufig die Flucht selbst - unabhängig davon, was in ihrem Heimatland passiert ist. So wirkt zum Beispiel die Todesangst während der Überfahrt auf einem Schlauchboot oft lange nach. Und auch das Ankommen hier ist dann meist nicht so, wie sie es sich vorgestellt hatten. SPIEGEL ONLINE: Was enttäuscht die Kinder, wenn sie hier ankommen? Inal : Viele Familien sind noch lange zerrissen, das Asylverfahren zieht sich hin, die Situation in den Unterkünften ist angespannt. Und dazu die große Unsicherheit über Monate: Werden wir hierbleiben dürfen? Bekommen wir eine Wohnung? Vielen Jugendlichen ist auch nicht klar, dass sie, um Geld verdienen zu können, erst mal zur Schule gehen müssen. Die sind alle sehr motiviert und möchten lernen, wissen aber häufig nicht, wie lange eine gute Ausbildung dauert. Solange sie in den Erstversorgungseinrichtungen wohnen, ist das Leben ein Ausnahmezustand. DPA Unterricht in einer Sprachlernklasse in Niedersachsen SPIEGEL ONLINE: Und dazu kommt dann noch der Unterricht in einer fremden Sprache und so viel Neues in der Schule.   Inal : Das ist gar nicht so problematisch, im Gegenteil: Die Schule ist meist ein enorm stabilisierender Faktor im Leben der Kinder. Deshalb ist es in dieser ersten Phase am wichtigsten, dass die Kinder die Schule als einen sicheren Ort wahrnehmen. Ein Ort, an dem es Personen gibt, denen sie vertrauen können, die ihnen zuhören, die bei Schwierigkeiten Lösungen finden. Noten sind in dieser ersten Zeit ziemlich egal. Das Schöne ist ja, dass Kinder die Sprache und alles andere extrem schnell lernen. Gerade bei syrischen Familien erlebe ich, dass die Kinder fast schon überangepasst sind und versuchen, hier alles richtig zu machen. SPIEGEL ONLINE: Woran erkennen Lehrer, dass ein Kind ernsthafte Probleme hat, die über die Anfangsschwierigkeiten hinausgehen? Inal: Typisch sind zum Beispiel Schlafschwierigkeiten. Vielleicht erzählt das Kind nicht von sich aus, dass es nicht einschlafen kann oder Alpträume hat, aber der Lehrer merkt ja, wenn ein Schüler häufig zu spät kommt oder im Unterricht müde ist. SPIEGEL ONLINE: Wie kann man bei mehr als 20 Schülern auf den ersten Blick erkennen, ob ein Kind übermüdet oder einfach lustlos ist? Inal : Eine Lehrerin aus einer Willkommensklasse hat zum Beispiel ein Barometer eingeführt: Die Kinder müssen jeden Morgen vor dem Unterricht auf einer Skala eintragen, ob sie gut geschlafen und gefrühstückt haben und wie es ihnen geht. So können Lehrer beobachten, ob ein langfristiges Problem vorliegt und wie die heutige Stimmung ist. Auch Konzentrationsschwierigkeiten sind ein Symptom und natürlich, wenn Kinder sich zurückziehen, sehr still sind - aber auch das Gegenteil: unkontrollierte Wut. In solchen Fällen sollten die Lehrer mit den Eltern oder bei unbegleiteten minderjährigen Flüchtlingen mit den Betreuern sprechen, damit durch einen Therapeuten abgeklärt werden kann, ob eine posttraumatische Belastungsstörung vorliegt. SPIEGEL ONLINE : Eine Therapie kann mehrere Jahre dauern. Wie können Lehrer im Klassenzimmer mit Aggressivität und unkontrollierter Wut umgehen?   Inal : Es kann helfen, eine Stressskala einzuführen von eins - entspannt - bis zehn - sehr wütend. Wenn der Lehrer merkt, dass es bei einem Kind anfängt zu brodeln, fragt er: Wo stehst du gerade? Ist das Kind schon bei sieben, sollte man es für einen Moment aus der Situation beziehungsweise aus der Klasse rausnehmen, es zum Beispiel einmal um den Schulhof laufen lassen. Gerade für solche Situationen sind zusätzliche Sozialpädagogen in Klassen so wichtig. Und gute Fortbildungen sowie Supervision für die Lehrkräfte. SPIEGEL ONLINE : Sollten Lehrer die Mitschüler vorbereiten, bevor Flüchtlingskinder in die Klasse kommen? Inal : Die Flüchtlingskinder wollen keine Extrabehandlung, sie wünschen sich nur ein ganz normales Leben. Und so sollten sie auch angekündigt und behandelt werden: Als neue Mitschüler, die jetzt bei uns lernen möchten. Wenn sie da sind, kann es eine Runde geben, in der sich jedes Kind aus der Klasse vorstellt und zum Beispiel erzählt, wo die eigenen Wurzeln sind. Generell gilt: Damit sich geflüchtete Kinder gut integrieren, sind Freundschaften das Wichtigste. SPIEGEL ONLINE : Was können Eltern tun, damit ihre Kinder Freundschaften schließen? Inal : Man kann nichts erzwingen, aber gut funktionieren gemeinsame Aktivitäten im Klassenverband oder Nachmittage, an denen alle Kinder und vielleicht auch die Eltern etwas unternehmen. Das muss gar nichts Großes sein, Fußballspielen zum Beispiel oder ein kleines Picknick im Park. Die Eltern der Flüchtlingskinder wünschen sich auch Augenhöhe und Normalität. Da kann es schon viel helfen, einfach zu sagen: Mein Kind geht hier und dort zum Sport oder Musikunterricht, das ist gar nicht teuer oder vielleicht sogar umsonst, will ihr Kind da nicht mal mitkommen? Gerade am Anfang braucht es nicht viel, denn da sind die Familien meist noch in großer Aufregung und müssen erst mal ankommen und schauen, wie alles hier so läuft. Auch Gutgemeintes kann da eher zu einer Überforderung führen.",http://www.spiegel.de/lebenundlernen/schule/fluechtlingskinder-an-schulen-was-lehrer-und-eltern-tun-koennen-a-1080432.html,2016-03-07T00:00:00.000Z
"Nato-Einsatz Großbritannien beteiligt sich an Mission gegen Schlepper Britische Schiffe sollen an dem Nato-Einsatz gegen Schlepper in der Ägäis beteiligt werden. Laut Premier Cameron sollen die Flüchtlinge auch von ihrer \"fruchtlosen und gefährlichen\" Reise abgehalten werden. Der Nato -Einsatz in der Ägäis soll Informationen über kriminelle Schlepper bringen. Daran sollen sich nun auch britische Schiffe und ein Hubschrauber beteiligen. \"Wir müssen das Geschäftsmodell der kriminellen Schlepper aufbrechen\", teilte Premierminister David Cameron mit. Ein weiteres Ziel des Premiers: Die Flüchtlinge müssten von ihrer \"fruchtlosen und gefährlichen\" Reise abgehalten werden. Der von Deutschland geführte Nato-Einsatz hatte am Sonntag begonnen. Die Nato will bei dem Einsatz Informationen über Schlepper sammeln und diese an Griechenland, die Türkei und die EU-Grenzschutzagentur Frontex weitergeben. So sollen Schlepper aufgegriffen werden. Am 11. Februar hatte die Nato beschlossen, die im Mittelmeer stationierte Standing Nato Maritime Group 2 für den Kampf gegen Schlepper einzusetzen. Der Start des Einsatzes hatte sich allerdings verzögert . Die Nato-Mitglieder Griechenland und Türkei waren sich zunächst über Einzelheiten bei der Nutzung der Gewässer und des Luftraums in der Ägäis uneins.",http://www.spiegel.de/politik/ausland/grossbritannien-beteiligt-sich-an-nato-mission-gegen-schlepper-a-1080969.html,2016-03-07T00:00:00.000Z
"Willkommenskultur in Italien Benvenuti, liebe Flüchtlinge! Migranten können auch ein Segen sein, findet ein kalabrischer Bürgermeister. Er heißt die Menschen willkommen - und lässt sein Dorf neu erblühen. Von Hans-Jürgen Schlamp , Rom Hans-Jürgen Schlamp Mehr Artikel von Hans-Jürgen Schlamp Wenig Zeit? Am Textende gibt's eine Zusammenfassung. Die 50 wichtigsten Menschen, \"die die Welt verändern\", präsentiert alljährlich die US-Zeitschrift \"Fortune\" . Zu denen gehören Amazon-Chef Jeff Bezos, Deutschland-Chefin Angela Merkel, Katholiken-Chef Papst Franziskus - und ein gewisser Domenico Lucano, 57 Jahre alt, genannt \"Mimmo\". Der weithin eher wenig bekannte Weltveränderer ist der Chef von Riace, einem Dorf in Kalabrien, am entlegenen Südostrand Italiens, 2000 Einwohner. Dort zeigt Bürgermeister \"Mimmo\" Lucano seinen Nachbarn und der ganzen Welt, dass Flüchtlinge nicht nur eine Last, sondern auch ein Segen sein können. Er sagt: \"Wir empfangen Flüchtlinge mit offenen Armen.\" Bis zum 1. Juli 1998 war Riace, wie fast alle Dörfer in der strukturschwachen Region, dem Untergang geweiht. Von einst 3000 Einwohnern waren gerade noch 800 übrig. Die letzte Pizzeria, die letzte Eisdiele hatten dichtgemacht. An jenem Tag aber strandete ein Schiff, das eigentlich mit Kurs auf Griechenland unterwegs war, an der nahen Küste. An Bord waren 218 halb verhungerte Kurden, die um Asyl baten. Sie wurden freundlich aufgenommen, und \"Mimmo\" hatte eine Idee. Die Umsetzung dauerte ein paar Jahre. Er musste erst einen Verein gründen, \"Città Futura\" (\"Stadt der Zukunft\"), und Bürgermeister werden. Heute blüht seine Gemeinde - dank 500 ansässiger Migranten. Sie kamen aus Tunesien, Senegal, Eritrea oder Syrien, illegal, fast keiner hatte eine Aufenthaltserlaubnis. Aber das störte niemanden. Sie bekamen eine Wohnung - Leerstand gab es genug -, Ausbildung, Betreuung. Im Gegenzug renovierten sie die verfallenen Häuser, brachten die verwilderten Weinberge und Olivenhaine wieder in Form. Viele sind seither weitergezogen. Gut gerüstet für bessere Jobs andernorts. Ihre Nachfolger arbeiten heute Seite an Seite mit Einheimischen bei der Straßenreinigung, der Müllabfuhr, in Bars und Pizzerien, oder sie töpfern, weben, häkeln. Sie wohnen mietfrei und bekommen 250 Euro im Monat fürs Essen, das Handy und den Kaffee in der Bar. Das Geld dafür kommt aus Rom. Der italienische Staat zahlt der Gemeinde für jeden Asylbewerber 35 Euro am Tag. Das ist günstig. Die Unterbringung in den großen Flüchtlingszentren kostet oft viel mehr und bringt an Integration meist gar nichts. Angst vor neuen Flüchtlingen aus Libyen Noch ist Riace, das sich schon am Ortseingang als \"Dorf des Willkommens\" präsentiert, eine Ausnahme. Zwar werden inzwischen ähnliche Ideen in anderen italienischen Gemeinden erprobt. Aber Mainstream ist das noch nicht. Im Gegenteil, bei vielen Italienern wächst, wie in Deutschland, die Angst vor einer \"Überfremdung\" durch die Migranten, wächst die Furcht vor importierter Kriminalität und neuer Konkurrenz um die ohnehin knappen Arbeitsplätze. Schon läuten die Alarmglocken wieder. Hatte sich die Lage im vorigen Jahr etwas entspannt, kommen jetzt, da die Balkanroute blockiert ist, wieder mehr Asylsuchende übers Mittelmeer nach Italien . Wenn das Wetter besser und die Überfahrt damit sicherer wird, verschärft sich die Lage vermutlich. \"2016 wird ein neues Rekordjahr werden, was Migrantenankünfte betrifft\", verkündet der Bürgermeister der sizilianischen Hafenstadt Pozallo schon vorab. In seiner Stadt befindet sich eines der großen Auffanglager, genannt \"Hotspot\". Allein in Libyen sollen 500.000 Menschen auf einen Platz an Bord eines Schiffs nach Italien warten . Zahlen und Schuldzuweisungen füllen italienische Zeitungsseiten und TV-Talkshows. Die einen reden, die anderen handeln Während die einen sich mit Zahlen überbieten, sind andere aktiv. In vielen Städten und Dörfern Italiens erproben Bürgerinitiativen Projekte für eine kreative \"Willkommenskultur\". Lokalpolitiker versuchen sich an Ansätzen für eine Flüchtlingspolitik, die Migranten wie Einheimischen Chancen und Vorteile bringen können. In den Ebenen von Gioia Tauro zum Beispiel, im westlichen Kalabrien. Da nimmt der Staat überführten Mafia -Bossen der Ndrangheta seit vielen Jahren Immobilien und Ländereien weg. Die Häuser und Grundstücke blieben bislang meist ungenutzt. Die einheimische Bevölkerung hatte zu viel Angst vor Racheakten der Clans, wenn sie sich an deren beschlagnahmten Eigentum zu schaffen machte. Und hatte doch mal einer den Mut, einen Mafia-Acker zu bewirtschaften, reichten ein paar Fischköpfe vor seiner Haustür, um die Sache zu beenden. Da kamen Mitglieder des privaten Anti-Mafia-Vereins \"Libera\" auf die Idee, Flüchtlinge zu engagieren. Die seien nicht \"so konditioniert wie wir\", sagten sie, sondern \"unbefangen und mutig\". Und nun beackern etwa im Valle del Marro Asylbewerber über Hundert Hektar beschlagnahmtes Mafia-Land, sie pflanzen Oliven, Südfrüchte und Kiwis. Abnehmer und Förderer ist eine Supermarktkette aus Florenz. \"Danke, Turin\" Andernorts tun sich Lokalpolitiker, Unternehmer, Handwerker zusammen, um Flüchtlingen die Chance zu geben, sich nützlich zu machen, dabei etwas zu lernen, ein wenig Geld zu verdienen und damit auch die Vorbehalte der Einheimischen abzubauen. So entstehen Kochschulen und Handarbeitswerkstätten, kleine Non-Profit-Betriebe, die mit neuen Ideen Produkte aus Recyclingmaterial herstellen. In Mestre bei Venedig werden in Kooperation mit einer großen Baufirma Baufacharbeiter ausgebildet. In Jesi in den Marken werden aus Asylbewerbern, wenn sie denn wollen, Reinigungskräfte, Gärtner oder auch Gepäckträger am Bahnhof. Um die 400 Euro bekommen die Flüchtlinge für solche Jobs. Und die Nachfrage ist groß. Andere arbeiten freiwillig auch ohne Geld. In Reggio Calabria etwa säubern Migranten Parks und Grünflächen. Sie wollten auf diese Weise \"ihre Dankbarkeit ausdrücken\", sagt Bürgermeister Giuseppe Falcomata. In Turin säubern seit dieser Woche 27 Flüchtlinge, die meisten aus Pakistan und Nigeria, Straßen, Parks und Plätze - jeden Samstag sechs Stunden lang, für zwölf Wochen. Dann sollen andere den Job übernehmen. \"Grazie Torino\" steht auf ihren leuchtend gelben Westen, \"Danke, Turin\". Zusammengefasst : In Italien wächst die Angst vor neuen Flüchtlingen aus Libyen. Während die einen die Furcht vor Überfremdung schüren, versuchen Lokalpolitiker, mit kreativen Initiativen in ihren Gemeinden die bereits angekommenen Migranten zu integrieren. Davon profitieren die Menschen und die Dörfer.",http://www.spiegel.de/politik/ausland/italien-fluechtlinge-kommen-und-lokalpolitiker-foerdern-sie-a-1089311.html,2016-04-28T00:00:00.000Z
"Hightech-Praxis für Flüchtlinge \"Hallo, was fehlt Ihnen?\" Viele Flüchtlinge können kein Deutsch, viele Ärzte kein Arabisch oder Farsi. Das macht Arztbesuche kompliziert. In neuen Medizincontainern testet Hamburg eine simple Lösung: Video-Dolmetscher aus dem Netz. Von Angela Gruber Miguel Ferraz Angela Gruber Jahrgang 1988, studierte in München und Washington, D.C. Absolventin der Deutschen Journalistenschule in München. Danach halbjähriger Arbeitsaufenthalt in Israel, als Stipendiatin der Quandt-Stiftung. Arbeitete als freie Journalistin unter anderem für \"Zeit Online\", \"Wired\", dpa, \"Süddeutsche Zeitung\", \"Neon\", Radio 1Live (WDR), ZDF und das englischsprachige +972mag in Tel Aviv. Lehrauftrag an der Universität Hamburg. Seit Januar 2016 Redakteurin im Netzweltressort von SPIEGEL ONLINE. E-Mail: Angela.Gruber@spiegel.de Twitter: netzkolumnistin folgen Blog: http://www.netzkolumnistin.de PGP: Öffentlichen Schlüssel herunterladen Fingerprint: 7AF9 771C 77AA 76E0 DAF4 C090 024D AF2F DA05 8B53 Mehr Artikel von Angela Gruber Albanisch, Arabisch, Bosnisch, Dari, Farsi, Koreanisch, Russisch, Türkisch, irgendwann Weißrussisch: Es ist eine lange Liste an Sprachen, durch die man auf dem großen Bildschirm scrollen kann, der in einem behelfsmäßigen Arzt-Sprechzimmer in der Flüchtlingsunterkunft am Hamburger Rugenbarg steht. Der Bildschirm soll das Gespräch zwischen Arzt und Patient nicht stören. Er soll es überhaupt erst möglich machen: per Video-Dolmetscher, der, wie bei einem Skype -Anruf, innerhalb von wenigen Minuten live in das Sprechzimmer zugeschaltet wird. Die meisten Flüchtlinge können kein Englisch, kein Deutsch. Die meisten deutschen Ärzte sprechend weder Arabisch noch Farsi. Wenn ein Flüchtling ärztliche Hilfe braucht, wird die Sprachbarriere zum Problem. \"Hallo, was fehlt Ihnen?\" kann eine komplizierte Frage sein, wenn keiner die Sprache des anderen spricht. Dolmetscher jedoch sind teuer und nicht immer gleich zur Stelle. Außerdem wohnen am Rugenbarg Menschen aus vielen unterschiedlichen Ländern, sprechen unterschiedliche Sprachen. Diese Sprachenvielfalt ist ein zusätzliches Hindernis an einem Ort wie einer Flüchtlingsunterkunft, an dem die Verständigung sowieso oft nicht leicht ist. In Hamburg hat man versucht, für diese komplexen Probleme eine einfache technische Lösung zu finden. SPIEGEL ONLINE Video-Dolmetscher-System Das Sprechzimmer mit dem Dolmetscher-System ist in einem umgebauten Baucontainer untergebracht, der mitten auf dem Gelände der Zentralen Erstaufnahme am Stadtrand Hamburgs steht. \"First Aid Medical Center\" steht darauf. Man hat mit diesem Konzept des vernetzten Medizincontainers so gute Erfahrungen gemacht, dass es nun ausgeweitet wird: Nach einem ersten Prototypen, seit November in Betrieb, werden in Hamburg bald zehn solcher Container für Flüchtlinge aufgestellt. Lange Schlangen vor dem ersten vernetzen Medizincontainer Der neue Container am Rugenbarg steht schon. Er hat ein eigenes Wartezimmer, die Patienten müssen nicht mehr im Freien anstehen. An das Sprechzimmer in der Mitte des Containers schließt das Behandlungszimmer mit Liege an. Auch dort gibt es einen Bildschirm, auf den sich der Dolmetscher zuschalten kann. Dass das Projekt mit den Video-Dolmetschern überhaupt ausprobiert werden konnte, hat Hamburg zwei Mitarbeitern der IT-Firma Cisco zu verdanken: Mirko Bass und Martin Kröger. Die Medizincontainer mit Internetanschluss waren ihre Idee, ihr Arbeitgeber übernahm die Kosten. Auch die zehn neuen Container können vom Deutschen Roten Kreuz nur dank einer 900.000-Euro-Spende der Otto-Stiftung aufgebaut werden. Muttersprachliche Betreuung durch einen Arzt ist in Deutschland ein Luxus für Flüchtlinge, kein Standard. Oft helfen Ehrenamtliche ohne Dolmetscherausbildung aus, gefährliche Missverständnisse sind nicht ausgeschlossen. SPIEGEL ONLINE Neuer Medizincontainer am Rugenbarg Das System am Rugenbarg besteht aus einem Bildschirm, einer Kamera und einer Internetverbindung, erklärt Bass. \"Das läuft hier über den Mobilfunkstandard LTE \", erklärt er. \"Am Anfang war die Mobilfunkzelle überlastet, wegen uns und den ganzen Smartphones der Flüchtlinge. Wir haben dann einen anderen Anbieter gewählt, der teurer ist, und das Problem mit dem Netz war gelöst\", ergänzt Martin Kröger bei der Vorstellung des neuen Containers am Montag. \"Die Flüchtlinge sind alle bei den Anbietern, die sehr günstige Angebote haben.\" Was sagen die Flüchtlinge selbst? Auch Maher Murad ist auserkoren worden, bei der Vorstellung des Medizincontainers dabei zu sein. Murad ist 19, kommt aus dem Irak. Seit fünf Monaten ist er mit seiner Familie in der Unterkunft am Rugenbarg untergebracht. Er steht vor dem Container, trotz Regen, die Hände in den Hosentaschen. SPIEGEL ONLINE Maher Murad Gerade eben hat er noch für die Lokalpresse auf der Behandlungsliege gesessen und sich von einem Arzt in den Mund leuchten lassen, zu Anschauungszwecken. Krank ist er gerade nicht. \"Das System ist wirklich gut. So gut\", sagt er auf Englisch. \"Wir bekommen hier schnell Hilfe, die Ärzte sind gut\", sagt er nochmal, mit Nachdruck. Viele andere können nicht so gut Englisch wie er. Sie seien auf die Übersetzer aus dem Netz angewiesen. Rettungsassistent Mario Genske betreut die Patienten des Medizincontainers mit. Sechs Menschen pro Stunde könne man hier versorgen, dazwischen noch Notfälle. Und auch Genske sagt: \"Die Bewohner nehmen das System gerne an.\" Nur zwei Minuten Wartezeit Angeboten wird der Dolmetscher-Service von der Firma SAVD, in einem Abo-Modell: Durchschnittlich 300 Euro Grundpauschale im Monat zahlen Einrichtungen, die den Service nutzen. Hinzu kommen die Gespräche: Die ersten 15 Minuten kosten 30 Euro, danach halbiert sich der Preis. Rund 750 Video-Dolmetscher aus Deutschland, Österreich und der Schweiz sind gleichzeitig online. Mit einem Klick können die Mitarbeiter über das browserbasierte Dolmetscher-System angerufen werden. Für Sprachen, die in der Liste grün unterlegt sind, erscheint innerhalb von zwei Minuten ein Übersetzer auf dem Bildschirm. Das System lebt von seiner Geschwindigkeit. Für die Städte ist es zudem günstiger, als Übersetzer vor Ort zu stellen, die dann doch nicht alle Sprachen abdecken können. Seit dem vergangenen Sommer registriert SAVD-Firmenchef Peter Merschitz vermehrt Anfragen nach seinem Dolmetscher-Netzwerk, sagt er am Montag, er ist per Videoschalte in den Container zugeschaltet. Die vielen Flüchtlinge in Deutschland sind gut für sein Geschäft. Zu Vorführungszwecken ruft man aus Hamburg bei einem Dolmetscher für Farsi an, ein Deutscher mit afghanischen Wurzeln hebt ab. Er sitzt daheim in seinem Büro, trägt ein Headset, grüßt freundlich und sagt: \"Am Anfang dachte ich, das sei unpersönlich. Mittlerweile fühle ich mich, als wäre ich mit dem Patienten direkt vor Ort.\" Ein Internetausfall wäre fatal. Das passiere aber so gut wie nie.",http://www.spiegel.de/netzwelt/web/hightech-praxis-fuer-fluechtlinge-in-hamburg-hallo-was-fehlt-ihnen-a-1089198.html,2016-04-28T00:00:00.000Z
"Krisengesetz Dänemark will Flüchtlinge an Grenze abweisen können Die dänische Regierung will ihre Politik gegenüber Flüchtlingen weiter verschärfen. Im Notfall sollen sie gar nicht erst ins Land kommen dürfen, abgelehnte Asylbewerber sollen schneller abgeschoben werden. Dänemarks Premier hat eine Idee, wie sein Land in Zukunft aussehen soll. Den sogenannten 2025-Plan stellte der Rechtsliberale Lars Løkke Rasmussen in Kopenhagen vor. Er umfasst sieben Themen, darunter Steuersenkungen für Geringverdiener, ein höheres Rentenalter, mehr Geld für Wohlfahrt und Sicherheit. Ein wichtiger Punkt des Zukunftsplans ist die Flüchtlingspolitik. Auch in diesem Bereich soll sich nach dem Willen der Regierung einiges ändern, so verlautete es aus dem zuständigen Ministerium für Einwanderung. Demnach sollen die dänischen Gesetze so geändert werden, dass die Polizei Asylsuchende in Krisenzeiten bereits an der Grenze abweisen kann. Damit solle verhindert werden, dass erneut eine Situation entstehe wie im September 2015, als viele Flüchtlinge nach Dänemark kamen, um entweder dort Asyl zu suchen oder weiter Richtung Schweden oder Norwegen zu ziehen. Die Regierung solle per Gesetz dazu ermächtigt werden, in einem Notfall Flüchtlinge gar nicht erst ins Land zu lassen, teilte das Einwanderungsministerium mit. \"Wir bekommen den Zuzug von Flüchtlingen unter Kontrolle. Aber wir können uns nicht entspannen. Der Druck auf Europa und Dänemark kann wieder stärker werden\", heißt es in einem Bericht. Bereits im Juni hatte Norwegen ähnliche Gesetzesänderungen auf den Weg gebracht. Laut der dänischen Zeitung \"Politiken\" sollen außerdem die Regelungen für einen dauerhaften Aufenthalt für Asylbewerber weiter verschärft werden, abgelehnte Asylbewerber sollen schneller abgeschoben werden können, und der Zugang zu Sozialleistungen soll weiter erschwert werden. Zuvor hatte die Regierung bekannt gegeben, dass Dänemark in diesem Jahr mit deutlich weniger Flüchtlingen rechnen müsse, als bisher angenommen . Statt bislang geschätzten 25.000 Menschen rechnet die Regierung in Kopenhagen mit nur rund 10.000, die in dem Land Asyl suchen. Dadurch sollen rund drei Milliarden Kronen (rund 400 Mio Euro) gespart werden. \"Das ist gut. Das ist Geld, das wir für etwas anderes nutzen können. Aber es sind immer noch zu viele. Die Zahl muss weiter runter\", sagte Ministerpräsident Rasmussen in einer live gesendeten Rede auf Facebook. \"Deshalb müssen wir weiter verschärfen. Und wir müssen uns schützen, damit wir nie wieder Chaos mit Völkerwanderungen auf Autobahnen erleben.\" Dänemark hatte zuletzt im Winter seine Asylgesetze massiv verschärft . Im Jahr 2015 hatten rund 21.000 Menschen in Dänemark Asyl gesucht, in den ersten sieben Monaten 2016 rund 4700. Video: Rettungsaktion vor Sizilien Video Guardia Costiera",http://www.spiegel.de/politik/ausland/daenische-regierung-will-fluechtlinge-an-grenze-abweisen-koennen-a-1110125.html,2016-08-30T00:00:00.000Z
