article,article_url,date
"Nach Vertreibung aus Mossul Bundestagsvize Singhammer fordert Aufnahme irakischer Christen Die Dschihadisten-Miliz \"Islamischer Staat\" hat Tausende Christen aus Mossul im Irak vertrieben. Der CSU-Bundestagsvize Singhammer will nun ein neues Flüchtlingskontingent für diese Menschen in Deutschland schaffen. Berlin - Der Bundestagsvize Johannes Singhammer hat sich besorgt über die Lage der Christen im Irak geäußert. Angesichts der Vertreibung aus der irakischen Großstadt Mossul sprach sich der CSU-Politiker dafür aus, ein Flüchtlingskontingent für verfolgte Christen aus dem Land aufzubauen. \"Wir müssen christliche Flüchtlinge aufnehmen. Vor allem auch deshalb, weil die Betroffenen in dem zunehmend christenfeindlichen Umfeld aus überwiegend islamischen Staaten kaum eine sichere Zuflucht finden\", sagte Singhammer der \"Saarbrücker Zeitung\". Die Ereignisse im Irak seien \" eine der schlimmsten Nachrichten der letzten Jahre \". Singhammer rief die muslimischen Organisationen in Deutschland auf, \"einmal Klartext zu reden und sich für die Christen und gegen deren Vertreibung aktiv einzusetzen\". Das solle auch Thema der nächsten Islamkonferenz sein. Die Dschihadisten-Gruppe \" Islamischer Staat \", kurz IS, hatte vergangene Woche den Christen von Mossul per Flugblatt und über Lautsprecher ein Ultimatum gestellt, zum Islam zu konvertieren oder die Stadt zu verlassen. Andernfalls drohe ihnen der Tod. Daraufhin waren Tausende Christen aus Mossul in die nahe gelegenen Kurdengebiete geflohen. Singhammer: Antisemitische Hetzer missbrauchen Gastrecht Schon seit der Frühzeit des Christentums lebt eine christliche Minderheit in Mossul, seit einigen Jahren sehen sich die Menschen dort nun Angriffen ausgesetzt. Vor der US-Invasion lebten Schätzungen zufolge rund eine Million Christen im Irak, davon 600.000 in Bagdad und 60.000 in Mossul, doch wanderten seitdem viele von ihnen aus. Die Organisation für Islamische Zusammenarbeit, der 57 muslimische Staaten angehören, nannte die Vertreibungen aus Mossul \"ein inakzeptables Verbrechen\" und sagte Hilfe zu. Auch der Uno -Sicherheitsrat verurteilte die Vertreibungen und sprach von einem \"Verbrechen gegen die Menschlichkeit\". Singhammer forderte muslimische Elternhäuser und deren Umfeld auf, mehr zu tun, damit ihre Kinder nicht in den radikalen Islamismus abdrifteten. Zudem sagte der CSU-Politiker, es solle Konsequenzen bei der Staatsbürgerschaft geben: \"Leute, die sich islamistischen Haltungen verschrieben haben und in Länder des Nahen Ostens fahren, um dort Andersgläubige zu massakrieren, oder die so etwas unterstützen, dürfen nicht Deutsche werden.\" Wer eine \"solche antijüdische Grundhaltung\" zeige wie einige Demonstranten bei propalästinensischen Demonstrationen in deutschen Städten , missbrauche sein Gastrecht.",http://www.spiegel.de/politik/deutschland/irak-bundestagsvize-singhammer-fordert-aufnahme-irakischer-christen-a-982462.html,2014-07-23T00:00:00.000Z
"Entlastung für Italien und Griechenland EU will Flüchtlinge ohne feste Quote umverteilen Die Gegner einer Umverteilungsquote für Flüchtlinge in der EU haben sich durchgesetzt: Der EU-Gipfel will zwar weiterhin Migranten aus Italien und Griechenland auf andere Mitgliedstaaten verteilen, aber ohne Zwang. Der am Donnerstag beginnende EU-Gipfel hält an seinem Ziel fest: 40.000 Migranten aus Italien und Griechenland sollen auf andere Mitgliedsländer verteilt werden. Es soll aber laut dem Entwurf für das Treffen keine Pflicht zur Teilnahme geben. Gleichzeitig wollen die Staats- und Regierungschefs schnellere Abschiebungen illegaler Einwanderer fordern. \"Die Vorstellung, dass Brüssel Quoten auferlegen könnte, funktioniert nicht\", sagte ein hochrangiger EU-Diplomat. \"Es hat niemals eine Mehrheit hinter verbindlichen Quoten gegeben.\" Der EU-Gipfel werde eine Umverteilung deshalb nur auf freiwilliger Basis fordern. Das heiße aber nicht, dass die Mitgliedstaaten nicht in der Verantwortung stünden. Die EU-Kommission hatte die Verteilung über verbindliche Quoten angesichts der dramatischen Lage in Italien und Griechenland vorgeschlagen. Dort kamen in diesem Jahr schon mehr als 100.000 Flüchtlinge über das Mittelmeer an. Die Kommissionspläne stießen jedoch bei Großbritannien und einer Reihe von Ländern in Osteuropa auf Ablehnung. Viele befürchten eine dauerhafte Aufweichung der Dublin-Regeln, wonach Flüchtlinge einen Asylantrag in dem EU-Land stellen müssen, wo sie zuerst europäischen Boden betreten haben. Die Verteilung der 40.000 Migranten solle über zwei Jahre erfolgen und nur Flüchtlinge betreffen, bei denen es \"eine klare Notwendigkeit vorübergehenden Schutzes\" gebe, heißt es nun im Entwurf für den EU-Gipfel am Donnerstag und Freitag. Wirtschaftsflüchtlinge sind damit von der Verteilung ausgeschlossen. Betont wird auch, dass es sich um einen \"vorübergehenden und außerordentlichen\" Schritt handelt. Wie verteilt wird, soll bis Ende Juli beschlossen werden. Die Kommission will dennoch weiter für die Quote kämpfen: \"Wir halten an unserem Vorschlag fest\", sagte die stellvertretende EU-Kommissionspräsidentin Kristalina Georgieva. Mehr Hilfe für Flüchtlinge in Lagern Die EU-Staats- und Regierungschefs wollen sich dem Entwurf zufolge auch zu dem Grundsatz bekennen, dass \"sich alle Mitgliedstaaten an der Umsiedlung von 20.000 Vertriebenen beteiligen, bei denen es eine klare Notwendigkeit internationalen Schutzes gibt\". Das war ebenfalls ein Vorschlag der EU-Kommission und würde anerkannte Flüchtlinge in Lagern etwa rund um Syrien betreffen. Gleichzeitig sollen Hauptankunftsländer wie Italien und Griechenland stärker unterstützt werden, um ankommende Flüchtlinge zu registrieren. Dazu sollen Experten aus anderen Mitgliedstaaten sowie der EU-Asylbehörde EASO, der Grenzagentur Frontex und von Europol abgestellt werden. Ziel sei es, in sogenannten Hotspots die schnelle Identifizierung, Registrierung und die Abnahme von Fingerabdrücken zu ermöglichen. Die EU will damit verhindern, dass Flüchtlinge aus Südeuropa illegal in nördliche Länder wie Deutschland weiterreisen und das Dublin-Prinzip unterlaufen wird. Ein weiterer Teil des Schlussfolgerungsentwurfs verlangt schnellere Abschiebungen illegaler Einwanderer und Anreize für Transit- und Herkunftsländer, Flüchtlinge wieder aufzunehmen. Dabei setzt die EU auch auf das Instrument der Entwicklungszusammenarbeit. Nach einem \"Mehr für mehr\"-Prinzip sollen die Länder etwa in Afrika belohnt werden, die mit der EU dabei zusammenarbeiten. \"Instrumente der Entwicklungspolitik sollten den örtlichen Aufbau von Fähigkeiten verstärken, darunter die Grenzkontrolle, Asyl , Vorgehen gegen Schmuggel und Reintegration\", heißt es in dem Entwurf. Die EU-Staaten ihrerseits sollen die geltende Rückführungsrichtlinie \"vollständig anwenden\". Dabei sollen Abschiebungsbeschlüsse im Computersystem des Schengenraums gespeichert werden, damit erneut zurückkehrende Flüchtlinge schnell erkannt werden.",http://www.spiegel.de/politik/ausland/eu-will-fluechtlinge-ohne-feste-quote-umverteilen-a-1040532.html,2015-06-24T00:00:00.000Z
"Mord aus Fremdenhass Obdachlose erhalten lange Haftstrafen Zwei Männer traten in einer Limburger Unterkunft einen Flüchtling zu Tode. Im Prozess sprach die Richterin von einer \"verachtenswerten Tat\" - und hat ein hartes Urteil gefällt. Weil sie aus Fremdenhass einen Afrikaner ermordet haben, sind zwei Männer in Limburg zu langjährigen Haftstrafen verurteilt worden. Die Vorsitzende Richterin der Strafkammer am Landgericht sprach von einer \"verachtenswerten Tat\". Die obdachlosen Täter hatten im Oktober 2014 in einer städtischen Unterkunft einen Flüchtling aus Ruanda geschlagen und getreten. Das Opfer starb an inneren Blutungen. Ein 43-jähriger Angeklagter wurde zu zwölf Jahren Haft verurteilt. Er entging einer lebenslangen Haftstrafe nur deshalb, weil er bei der Tat betrunken und daher nicht voll schuldfähig war. Sein 22-jähriger Mittäter wurde zu zehn Jahren Haft verurteilt und in eine Entziehungsklinik eingewiesen. Ein dritter mutmaßlicher Schläger hatte sich im Gefängnis das Leben genommen. Die Angeklagten hätten zwar zu keiner rechtsradikalen Gruppe gehört, sagte die Richterin. Sie hätten aber ständig fremdenfeindliche Reden gehalten und damit geprahlt, Ausländer geschlagen zu haben. Weil sie selbst in der Gesellschaft weit unten standen, suchten sie sich laut Richterin ein vermeintlich noch tieferstehendes Opfer.",http://www.spiegel.de/panorama/justiz/limburg-lange-haftstrafen-fuer-mord-an-fluechtling-a-1040531.html,2015-06-24T00:00:00.000Z
"Jugend und Politik Was wir ändern wollen Umweltschutz, Ehe für alle, Gleichberechtigung, faires Wirtschaften - wie genau könnte eine bessere Welt aussehen? Sechs Jugendliche aus aller Welt erklären, was ihr größter politischer Wunsch ist. Aufgezeichnet von David Zuther David Zuther Mehr Artikel von David Zuther Privat Nada, 15, Italien: \"Armut ist das größte Problem\" \"Eine gerechtere Wirtschaft ist für mich eine Wirtschaft, in der die Menschen würdig leben können: ausreichend ernährt, mit Gesundheitsvorsorge und einer Bildung, durch die sie ihre Stellung in der Gesellschaft verbessern können. Armut und die wachsende Ungleichheit sind die größten aktuellen Probleme, insbesondere in der westlichen Welt. Trotzdem finde ich, dass besonders fähige Menschen oder solche mit besonderer Qualifikation ein höheres Einkommen verdienen. Die aktuelle Krise hat ihre Ursache in einer ungenügenden Regulation der internationalen Märkte. Deshalb sollten Regierungen die Märkte stärker überwachen und kontrollieren. Ich möchte mich auch für ein besseres Bildungssystem einsetzen. Gerade durch Bildung kann Demokratie gestärkt werden. Besonders wichtig ist das im Moment, weil radikale Parteien immer mehr an Einfluss gewinnen durch die Stimmen von Menschen, die die Komplexität der Probleme selbst nicht durchschauen können.\" Privat Célia, 16, Frankreich: \"Der Klimawandel betrifft uns alle\" \"Der Klimawandel ist für mich die wichtigste Herausforderung, mit der wir uns politisch, aber auch als einzelne befassen müssen. Denn wenn wir diesen Planeten zerstören, ist niemand mehr da, um über diese Themen zu reden. Worauf warten wir also? Es gibt viele Lösungsansätze, um unsere Welt zu einem wunderbaren Ort zum Leben zu machen und trotzdem weiter zu produzieren: durch Innovation und durch die Verbreitung von Wissen. Viele umweltfreundliche Initiativen werden rund um den Globus ins Leben gerufen, aber leider nicht zentral koordiniert. Die Mehrheit der Menschen interessiert sich gar nicht dafür, weil sie nicht versteht, dass auch sie direkt betroffen sind. Deshalb wollen wir, die junge Generation, dass die Menschen als Einzelpersonen und als Gemeinschaft für Klimaschutz handeln. Es geht um unsere Zukunft.\" Privat Nombuso, 19, Südafrika: \"Krisen entstehen, weil Menschenrechte verletzt werden\" \"Transparenz in staatlichen Institutionen halte ich für besonders wichtig: Nur so können die Menschen ihrer Regierung vertrauen und über die Dinge diskutieren, die sie betreffen. Transparenz ist der beste Schutz gegen Korruption und die Basis für eine friedliche Zusammenarbeit zwischen Volk und Regierung - und damit eine der Säulen von Demokratie. Ich setze mich leidenschaftlich für Menschenrechte ein, weil ich glaube, dass Menschen vor allem respektiert und mit Ehre und Würde behandelt werden sollten. Ich denke, dass die meisten Krisen durch die Unzufriedenheit der Menschen entstehen - und weil elementare Menschenrechte nicht eingehalten werden.\" Privat Melanie, 16, Puerto Rico: \"Frauen sollen Schlüsselrollen übernehmen\" \"Wenn ich gefragt werde, welches politische Thema ich am wichtigsten finde, ist meine Antwort klar: die Gleichberechtigung der Geschlechter. Frauen spielen eine entscheidende Rolle für Nachhaltigkeit und wirtschaftliche Entwicklung. Die Gleichberechtigung voranzutreiben, ist deshalb ein großer Schritt in Richtung einer besseren Zukunft. Egal, um welches Gebiet es geht - Frauen können eine Schlüsselrolle spielen, in Unternehmen und Regierungen genauso wie beim Heranwachsen einer global denkenden Generation von Kindern und Jugendlichen.\" Privat David, 15, Deutschland: \"Wir dürfen Flüchtlinge nicht ignorieren\" \"Für mich ist der Umgang mit Flüchtlingen und Migranten ein wichtiges Thema. Viel zu lange haben wir das Leid von Hunderttausenden ignoriert und weggesehen, wenn Männer, Frauen und Kinder auf der Flucht vor Krieg, Verfolgung und Hunger im Mittelmeer ertranken. Wir Europäer sind hier moralisch in der Pflicht. Europa, das war einmal ein Kontinent der eingerissenen Mauern und überwundenen Grenzen. Aus Sorge um unseren Wohlstand ist eben dieses Europa zu einer Festung geworden, gesichert mit Stacheldraht, mit Flüchtlingslagern, die an Gefängnisse erinnern. Wir müssen legale Wege in die EU schaffen, damit niemand mehr gezwungen ist, lebensgefährliche Meeresüberfahrten auf sich zu nehmen. Ich wünsche mir auch einen fairen Welthandel, in dem jeder von seinem Lohn leben kann, denn eine der größten Fluchtursachen bleibt weiterhin Armut. Ich will in einem Europa leben, das Schutzsuchende willkommen heißt und ihnen eine Chance gibt, in einem offenen, herzlichen und menschlichen Europa.\" Privat Emma, 17 Jahre, Irland: \"Irland macht Fortschritte als moderne Gesellschaft\" \"Im Mai hat Irland als erstes Land der Welt die gleichgeschlechtliche Ehe durch einen Volksentscheid legalisiert. Es war toll, die Begeisterung der Menschen für diesen Schritt zu sehen. 18-Jährige standen um 7 Uhr morgens an den Wahllokalen, um noch vor der Schule abzustimmen. Universitäten organisierten Busse voller Studenten, die ihrer Stimme Gewicht verleihen wollten. Im Ausland lebende Iren kamen in ihre Heimat, um an der Abstimmung teilzunehmen. Die Zeit, in der Homosexualität kriminalisiert wurde, ist lange vorüber, und dieses Referendum ist ein Beweis für die Macht junger Menschen, ihre Zukunft selbst zu gestalten. Es gibt aber noch andere antiquierte Werte, die unsere Verfassung bestimmen. Ich wünsche mir, dass das strikte Abtreibungsgesetz verändert wird, besonders der achte Zusatzartikel. Abtreibung ist in Irland nur dann zulässig, wenn das Leben der Mutter in Gefahr ist. Abtreibung aus anderen Gründen kann eine 14-jährige Haftstrafe nach sich ziehen. Wir machen große Fortschritte als moderne und tolerante Gesellschaft, aber es gibt noch viel zu tun. Ich möchte, dass Irland ein sicherer und gerechter Platz für alle wird.\"",http://www.spiegel.de/lebenundlernen/schule/soziale-und-politisches-engagement-jugendliche-im-portrait-a-1042476.html,2015-07-29T00:00:00.000Z
"Ungarns Premier bei der CSU \"Orbán hatte von Anfang an recht\" Ungarns Premier wird wegen seiner Flüchtlingspolitik in Europa kritisiert, die CSU aber lädt Viktor Orbán zur Fraktionsklausur. Prominente Unionspolitiker verteidigen seine umstrittenste Maßnahme - den Bau des Grenzzauns. Von Severin Weiland Christian O. Bruch/ laif Severin Weiland Severin Weiland, geboren 1963 in Wilhelmshaven/Niedersachsen. Verbrachte einen Teil seiner Kindheit und Jugend in Chile. Studium der Kommunikations- und Politischen Wissenschaft in München, Ausbildung an der Deutschen Journalistenschule München. Ab 1992 Redakteur im Lokalteil der \"tageszeitung\" in Berlin, später landespolitischer Korrespondent. Von 1996 bis 1999 Stellvertretender Ressortleiter Innenpolitik der taz. Sabbatjahr in Kathmandu, Nepal. Von Herbst 2000 bis Januar 2002 bundespolitischer Korrespondent der taz in Berlin. Seit Februar 2002 Parlamentskorrespondent im Berliner Büro von SPIEGEL ONLINE, seit dem 1. Mai 2004 Stellvertretender Leiter des Berliner Büros von SPIEGEL ONLINE. Ab Mitte Oktober 2014 politischer Korrespondent im Hauptstadt-Büro. E-Mail: Severin.Weiland@spiegel.de Twitter: @SeverinWeiland folgen Mehr Artikel von Severin Weiland Wenig Zeit? Am Textende gibt's eine Zusammenfassung. Wenn es um Selbstbehauptung geht, setzt sich die CSU gerne von der großen Schwesterpartei ab. Mit Unmut wurde von manchem Christsozialen die aus ihrer Sicht allzu liberale Flüchtlingspolitik der Kanzlerin und CDU-Chefin Angela Merkel quittiert. An diesem Mittwoch nun empfängt CSU-Chef Horst Seehofer den ungarischen Ministerpräsidenten Viktor Orbán auf der Klausurtagung der CSU-Landtagsfraktion im fränkischen Kloster Banz. \"Verantwortung in Europa - Flüchtlingsstrom gemeinsam bewältigen\" ist der Auftritt von Orbán vor den Abgeordneten überschrieben. Am Mittag soll es eine gemeinsame Pressekonferenz mit Seehofer geben. Die Einladung an Orbán, der vor muslimischen Flüchtlingen warnt und mit seiner Abschottungspolitik für Unmut in der EU sorgt, war selbst in der CSU nicht unumstritten. Doch am Ende blieb es dabei. \"Wir sollten Orbán nicht verteufeln. Nicht alles, was er sagt, ist richtig. Aber es wäre falsch, mit pauschalen Vorurteilen über ihn herzufallen\", verteidigte jüngst CSU-Chef und Bayerns Ministerpräsident Seehofer die Einladung. Lettland will Zaun in Teilbereichen bauen Insgeheim kann Orbán durchaus auf Unterstützung bauen - vor allem für die Errichtung eines 175 Kilometer langen Zaunes entlang der serbischen Grenze, der durch einen weiteren Zaun zu Rumänien ergänzt werden soll. Offen sagen es die meisten nicht, denn wer sich für Orbáns Zaun ausspricht, sammelt keine Pluspunkte in der öffentlichen Wahrnehmung. Der sächsische CDU-Generalsekretär Michael Kretschmer ist einer der Wenigen, er hatte bereits im August, als der Bau der Grenzanlage noch im Gange war, die zum Teil massive Kritik an Ungarn als \"scheinheilig\" bezeichnet und den Bau des Zaunes verteidigt. Im Gespräch mit SPIEGEL ONLINE erneuerte der CDU-Bundestagsabgeordnete vor dem Auftritt Orbáns in Franken seine Haltung: \"Die Ungarn sind durch europäische Verträge verpflichtet, die Schengener Außengrenze zu sichern.\" Es sei ein \"unhaltbarer Zustand, dass Zehntausende die Grenzen der EU überschreiten, ohne identifiziert oder registriert zu werden\". Das gebe es \"in keinem zivilisierten Staat der Welt\", rechtfertigt Kretschmer den Zaun. Illegale Einreise sei schließlich ein Straftatbestand. \"Kritik ist vielmehr an Italien oder Griechenland angebracht, beide Länder verhalten sich so, als würde es weder die Dublin-Verträge noch das Schengenabkommen geben. So geht das nicht weiter\", kritisierte der CDU-Politiker die beiden EU-Staaten. Die gesamte EU-Flüchtlingspolitik steht derzeit in der Kritik - nach den Dublin-Verträgen soll eigentlich ein Flüchtling dort verbleiben, wo er zuerst seinen Antrag auf Asyl gestellt hat. Nach dem Schengenabkommen wird die Außengrenze gesichert, während die Mitgliedstaaten im Schengenraum nur in Ausnahmefällen Grenzkontrollen durchführen. Faktisch aber ist Dublin in der aktuellen Flüchtlingskrise längst ausgehebelt, seitdem viele Balkanstaaten die Flüchtlinge nach Österreich und Deutschland weiterleiten. Und seit gut zwei Wochen gibt es auch wieder Kontrollen an den Grenzen Deutschlands und Österreichs. In die Debatte über den Sinn und Zweck des ungarischen Grenzzaunes hat sich im Gespräch mit dem SPIEGEL auch der frühere, einst von der CDU vorgeschlagene Bundesverfassungsrichter Udo Di Fabio eingemischt. Mit Blick auf die befestigte Grenze der USA zu Mexiko sagte er: \"Trotzdem würde niemand den USA vorwerfen, dass sie kein demokratischer Staat und keine offene Gesellschaft mehr seien.\" Es zwinge jedenfalls zum Nachdenken, dass ein Staat wie Ungarn, der 1989 die Öffnung der Grenzen in Europa eingeleitet habe, jetzt im offenen Europa die Grenzen dichtmache. Di Fabio äußerte sich grundsätzlich zur Frage einer \"Festung Europa\": Freizügigkeit gelte für den Binnenraum, ein offener Staat, auch eine EU, könne aber nicht mit offenen Grenzen leben. \"Wenn der Staat keinen Einfluss auf seine Bevölkerungsstruktur mehr hätte, wäre er zwar sehr offen, aber kein Staat mehr. Wenn ein Staat die Kontrolle über sein Territorium verliert, wir sehen das in der Ukraine, dann schwankt die Staatlichkeit\", meinte der Ex-Verfassungsrichter. In der CSU sieht sich der Innenpolitiker Hans-Peter Uhl angesichts der großen Zahl der Flüchtlinge, die über den Balkan nach Norden wollen, in seiner Verteidigung des ungarischen Zaunes bestätigt. \"Orbán hatte von Anfang an recht, die Außengrenzen der EU nach Serbien unter Kontrolle zu bringen. Dazu ist ein Zaun geeignet\", sagte er SPIEGEL ONLINE. \"Es wird immer deutlicher, dass die Anarchie an den Grenzen beendet werden muss, die Zuwanderung nach Europa und Deutschland muss wieder kontrolliert werden. Wir brauchen die Rückkehr des Rechts\", so der Bundestagsabgeordnete . Scharf kritisiert er die Handhabe in Deutschland: Die Bundespolizei führe Strichlisten über ankommende Flüchtlinge an den deutschen Grenzen, \"es muss aber wieder von der Zurückweisung von Flüchtlingen Gebrauch gemacht werden\", fordert der CSU-Politiker. Orbáns Zaunbau könnte Nachahmer finden. So will etwa die lettische Regierungschefin Laimdota Straujuma von der EU mehr Geld, um an einigen Abschnitten der Grenze zu Russland und Weißrussland einen Zaun zu errichten sowie Überwachungsanlagen zu installieren. Dazu sagt CSU-Politiker Uhl lapidar: \"Die EU-Außengrenzen müssen wieder gesichert werden - mit welchen technischen Mitteln, das hängt von der jeweiligen Örtlichkeit ab.\" Zusammengefasst : Die CSU-Landtagsfraktion empfängt an diesem Mittwoch bei ihrer Klausur im Kloster Banz den ungarischen Ministerpräsidenten Viktor Orbán. CSU-Chef Horst Seehofer hat sich damit einen prominenten und in der jetzigen Flüchtlingskrise sehr umstrittenen Gast eingeladen. Ungarn hat einen Zaun zur Grenze mit Serbien bauen lassen - in CDU und CSU halten manche die Maßnahme für richtig.",http://www.spiegel.de/politik/deutschland/viktor-orban-cdu-und-csu-politiker-verteidigen-ungarns-zaun-a-1054200.html,2015-09-23T00:00:00.000Z
"Appell an Regierungschefs Sängerin Shakira fordert \"intelligente\" Lösung für Flüchtlingskrise Die kolumbianische Sängerin Shakira hat die internationale Gemeinschaft aufgerufen, die Flüchtlingskrise nachhaltig zu bekämpfen. Vor allem die Kinder bräuchten Hilfe. Es ist eine der \"größten humanitären Krisen unserer Zeit\": Die aus Kolumbien stammende Sängerin Shakira hat in New York vor den Vereinten Nationen die Regierungschefs weltweit aufgefordert, Menschen auf der Flucht zu helfen. \"Wir müssen uns zusammentun und ein faires Ende dieser Krise finden. Die Flüchtlinge verdienen es, ein Zuhause zu haben.\" Sie wisse, dass es kein \"einfach zu lösendes Problem sei\". \"Aber ich bin sicher, dass Länder zusammenkommen und eine intelligente Lösung für dieses dringende Problem finden können.\" Shakira trat gemeinsam mit Uno-Generalsekretär Ban Ki Moon sowie Unicef -Direktor Anthony Lake und Experten vor die Kameras. Für die 38-Jährige ist der Appell eine Herzensangelegenheit, denn sie engagiert sich seit Langem für Kinder in Not. Bereits 2003 wurde sie Botschafterin des Kinderhilfswerks Unicef. Sie gründete die Non-Profit-Organisation Pies Descalzos (Stiftung Barfuß), die bisher acht Schulen und Gemeindezentren in Armenvierteln in Kolumbien aufgebaut hat und etwa 5000 obdachlose und hilfsbedürftige Minderjährige betreut. Mit dem katalanischen Fußballer Gerard Piqué hat Shakira zwei Söhne, Milan, 2 Jahre, und Sasha, 6 Monate. Ihre Rede vor den Vereinten Nationen folgte auf eine internationale Konferenz zur nachhaltigen Förderung von Kleinkindern. \"Kinder sollten nicht den Preis für Kriege bezahlen\", sagte Shakira sichtlich bewegt. Egoismus, Rassismus und Grenzen könnten überwunden werden. Die Kinder und ihre Rechte sollten im Zentrum der politischen Debatte stehen. \"Mehr als hundert Millionen Kinder werden nicht beschult, und 159 Millionen Jungen und Mädchen unter fünf Jahren sind wegen Mangels an Fürsorge und angemessener Ernährung physisch und kognitiv unterentwickelt\", berichtete die Sängerin. Nur nachhaltige Hilfen schon in der frühen Kindheit könnten den Kreislauf von Armut und fehlenden Chancen durchbrechen.",http://www.spiegel.de/panorama/leute/saengerin-shakira-fordert-intelligente-loesung-fuer-fluechtlingskrise-a-1054289.html,2015-09-23T00:00:00.000Z
