article,article_url,date
"Integrationsgipfel Chef der Türkischen Gemeinde rechnet mit deutscher Bildungspolitik ab Viele Migranten scheitern in der Schule oder auf dem Arbeitsmarkt. Der Chef der Türkischen Gemeinde wirft der Bildungspolitik Versagen vor - und berichtet von verlorenem Vertrauen. Der Integrationsgipfel im Kanzleramt soll das nun ändern. Von Anna Reimann Christian O. Bruch/ laif Anna Reimann Twitter: AnnaReimann1 folgen Mehr Artikel von Anna Reimann Berlin - Junge Migranten in Deutschland verlassen die Schule häufig ohne Abschluss, auch machen sie viel seltener einen Berufsabschluss als Jugendliche aus deutschen Familien . Ein Befund, der verheerend ist - die Bundesregierung will diese Probleme unter Deutschlands Migranten deshalb jetzt mit gebündelten Kräften angehen: Bildung und Ausbildung sind zentrale Themen des Integrationsgipfels in Berlin an diesem Montag mit Kanzlerin Angela Merkel (CDU) und Staatsministerin Aydan Özoguz (SPD). Scharfe Kritik an der bisherigen Bildungspolitik in Deutschland übt vor dem Spitzentreffen von Migrantenvertretern, Politikern, Vertretern aus der Wirtschaft und anderen Fachleuten der Vorsitzende der Türkischen Gemeinde in Deutschland (TGD), Safter Cinar. Dass es gerade bei den Deutschtürken, der größten Migrantengruppe Deutschlands, so viele gescheiterte Bildungskarrieren gebe, sei \"kein ethnisches, sondern ein soziales Problem - die Bildungspolitik der vergangenen Jahrzehnte hat an dieser Stelle versagt\", so Cinar zu SPIEGEL ONLINE. Cinar fordert mehr Anstrengungen von Politik und Wirtschaft. So müssten Betriebe, die Jugendliche mit schwieriger sozialer Herkunft und geringer Qualifikation ausbilden, begleitende Hilfe etwa von Sozialarbeitern bekommen. Außerdem müssten Diskriminierungen aufgrund ausländisch klingender Namen bekämpft werden. Cinar verlangte von den Betrieben, auf anonyme Bewerbungen auch ohne Foto zu setzen. Gipfel beschäftigt sich auch mit Ausbildung für Flüchtlinge Ähnliche und zahlreiche andere Empfehlungen stehen auch in einem \"Impulspapier\", das Vertreter von Migrantenorganisationen erarbeitet haben und an diesem Montag auf dem Gipfel im Kanzleramt an die Integrationsbeauftragte Özoguz übergeben wollen. In dem Papier regen die Organisationen unter anderem an, dass besser über die Möglichkeiten der dualen Ausbildung informiert werden müsse. Vielen Migranten erscheine nur ein Studium als geeigneter Weg zum Aufstieg. Außerdem müsse es mehr Unterstützung für Jugendliche beim Übergang von der Schule auf den Arbeitsmarkt geben - etwa durch Mentoren. Auf dem Integrationsgipfel soll auch darüber geredet werden, wie es Flüchtlingen erleichtert werden kann, eine Ausbildung in Deutschland zu absolvieren. Großer Knackpunkt ist hier, dass oft ein sicherer Aufenthaltsstatus fehlt und Betriebe deshalb zögern, Flüchtlinge einzustellen. Für die Vertreter ist es das erste Mal, dass das Treffen unter der SPD-Politikerin Özoguz stattfindet. Der Integrationsgipfel tagte zum ersten Mal im Jahr 2006, genau wie die Islamkonferenz im Innenministerium. Damit wurde erstmalig eine Form des Dialogs zwischen Einwandererverbänden bzw. Muslimen und staatlichen Vertretern auf höchster Ebene gefunden - für viele Migranten ein extrem wichtiges Zeichen der Anerkennung. \"Moment des Misstrauens\" In den vergangenen Monaten sei aber auch wieder das Gefühl der Zurückweisung gewachsen, konstatiert TGD-Chef Safter Cinar. So herrsche in der deutsch-türkischen Community große Enttäuschung darüber, dass die Bundesregierung das Urteil des Europäischen Gerichtshofs, der im Sommer die verpflichtenden Sprachtests für nachziehende Ehegatten aus der Türkei für rechtswidrig erklärt hatte, nicht umsetze. Es sei ein \"Moment des Misstrauens entstanden\", weil die Bundesrepublik sich nicht an gesprochenes Recht halte, so Cinar zu SPIEGEL ONLINE. Cinar forderte die Integrationsbeauftragte Özoguz auf, in der Bundesregierung dafür zu sorgen, dass der Richterspruch befolgt werde. Nach dem EuGH-Urteil hatte die Bundesregierung angekündigt, trotzdem nur in Härtefällen auf den Sprachnachweis zu verzichten. Die Türkische Gemeinde hat deshalb Beschwerde bei der Europäischen Kommission eingelegt. Immer noch erschüttert sei nach der Aufklärung der NSU-Morde auch das Vertrauen in die Sicherheitsbehörden, sagte Cinar. \"Eine der Empfehlungen des Bundestags war, bei Gewalt gegen migrantische Organisationen oder Personen immer auch nach einem rechtsextremen Hintergrund zu forschen.\" Es gebe mehrere Fälle, wo diese einfache Prüfung nicht stattgefunden habe. Cinar verwies auf einen Moscheebrand in Berlin, bei dem die Polizei sofort eine politisch motivierte Tat ausgeschlossen hatte. Später haben Untersuchungen in dem Fall jedoch ergeben, dass Brandbeschleuniger benutzt wurde. Seitdem ermittelt die Polizei in alle Richtungen.",http://www.spiegel.de/politik/deutschland/integrationsgipfel-tgd-chef-cinar-kritisiert-bildungspolitik-a-1005392.html,2014-12-01T00:00:00.000Z
"Reaktionen auf Bürgermeister-Rücktritt \"Alle Alarmglocken müssen schrillen\" Der Bürgermeister im kleinen Tröglitz ist wegen rechtsextremer Anfeindungen zurückgetreten, die Bundespolitik zeigt sich irritiert. SPD-Generalsekretärin Fahimi wettert gegen die Behörden, Grünen-Chef Özdemir ist empört. Berlin - Führende Politiker von SPD und Grünen haben empört auf den Rücktritt eines Bürgermeisters in Sachsen-Anhalt wegen rechtsextremer Anfeindungen reagiert. SPD-Generalsekretärin Yasmin Fahimi sagte dem \"Kölner Stadt-Anzeiger\", der Fall des ehrenamtlichen Lokalpolitikers Markus Nierth in Tröglitz bewege sie. Sie verstehe die Sorge, die sich Nierth um sich und seine Familie mache, sagte sie. \"Und ich verstehe die Verzweiflung, die Nierth angesichts der Untätigkeit der Behörden verspürt hat, die offenbar zu wenig getan haben gegen die rechtsextremistischen Umtriebe in dem Ort.\" Es könne nicht angehen, dass jemand zurücktreten muss, weil er sich für Minderheiten engagiert und Neonazis in den Weg gestellt hat. Grünen-Chef Cem Özdemir sagte der \"Berliner Zeitung\": \"Wenn sich in unserer rechtsstaatlichen Demokratie ein gewählter Bürgermeister vor einem braunen Mob nicht mehr geschützt sieht, müssen alle Alarmglocken schrillen.\" Politik und Zivilgesellschaft müssten klar Position beziehen. Der parteilose Bürgermeister war zurückgetreten, weil Rechtsextreme vor seinem Wohnhaus demonstrieren wollten - und er sich vom Landkreis und der Nachbarschaft, aber auch den Parteien alleingelassen sah. Die Rechtsextremen wenden sich gegen die geplante Unterbringung von rund 40 Flüchtlingen in dem Ort. Der Kreistag bekräftigte am Montagabend aber das Vorhaben, die Asylbewerber zu beherbergen - mit breiter Mehrheit. Nierth begründete seinen Rücktritt mit Enttäuschung darüber , dass der Landkreis es nicht geschafft habe, die NPD-Demonstration vor dem Haus seiner Familie zu verhindern. \"Meine Frau und ich wurden zur persönlichen Zielscheibe.\" Der Landrat des Burgenlandkreises, Götz Ulrich (CDU), sagte hingegen, der Kreis habe zur Zeit des Rücktritts noch nicht über ein Verbot entschieden. Nach Nierths Rücktritt will Sachsen-Anhalt ehrenamtliche Politiker besser schützen. \"Das Signal ist fatal. Da muss man politisch konsequent gegensteuern\", sagte Innenminister Holger Stahlknecht (CDU). Er will bis spätestens kommende Woche anordnen, dass die Landkreise und kreisfreien Städte solche Demonstrationen vor den Häusern ehrenamtlicher Politiker verbieten. Zugleich wies Stahlknecht auf die geltende Rechtsprechung hin, nach der hauptamtliche Politiker derartige Demonstrationen in Sicht- und Hörweite zu ihrem Wohnhaus ertragen müssten.",http://www.spiegel.de/politik/deutschland/buergermeister-in-troeglitz-empoerung-bei-spd-und-gruenen-a-1022662.html,2015-03-10T00:00:00.000Z
"Migration Deutschland weist immer weniger Ausländer aus Die Zahl der aus Deutschland ausgewiesenen Ausländer ist weiter zurückgegangen. Im vergangenen Jahr verschickten die Behörden 3242 Ausweisungsverfügungen - im Vorjahr waren es noch rund 3900. Die Bundesregierung möchte straffällige Ausländer künftig schneller abschieben und plant eine Verschärfung des Bleiberechts . Gleichzeitig geht die Zahl der Ausweisungen seit Jahren zurück, auch im vergangenen Jahr: 2014 erhielten 3242 Ausländer eine sogenannte Ausweisungsverfügung von den Behörden, 2013 waren es noch rund 3900 gewesen und in den Jahren zuvor jeweils mehr als 4000. Das geht aus der Antwort der Bundesregierung auf eine Kleine Anfrage der Linksfraktion hervor, über die die Nachrichtenagentur dpa berichtet. Das bedeutet, diese Menschen wurden verpflichtet, das Land zu verlassen - etwa weil sie sich strafbar gemacht haben. 1381 der Betroffenen reisten demnach im vergangenen Jahr freiwillig aus, 457 wurden abgeschoben. In vielen anderen Fällen gingen die Betroffenen rechtlich gegen die Entscheidung vor. Solange solch ein juristisches Verfahren läuft, kann eine Ausweisung nicht vollzogen werden. Innenminister Thomas de Maizière (CDU) will die rechtlichen Vorgaben für Ausweisungen überarbeiten. Ziel ist laut Innenressort, das System zu vereinfachen. Der Gesetzentwurf stößt bei Flüchtlingsorganisationen und der Opposition auf scharfe Kritik. Er sieht vor, dass kriminelle Ausländer, aber auch andere Menschen ohne Aufenthaltsberechtigung einfacher abgeschoben und mit Wiedereinreisesperren belegt werden können. Auch können Asylbewerber künftig leichter in Haft genommen werden, damit sie sich einer Abschiebung nicht entziehen können. Das Gesetz steckt derzeit im parlamentarischen Verfahren. \"Ausweisungen spielen in der Praxis eine immer geringere Rolle\", sagte die Linke -Innenexpertin Ulla Jelpke . \"Statt auf dieses repressive Instrument des Aufenthaltsrechts zu verzichten, will die Bundesregierung eine komplizierte Neuordnung mit ungewissem Ergebnis vornehmen\", kritisiert Jelpke.",http://www.spiegel.de/politik/deutschland/auslaender-zahl-der-ausweisungen-in-deutschland-sinkt-a-1028082.html,2015-04-11T00:00:00.000Z
"Paris Polizei räumt illegale Flüchtlingslager Sie lebten in Zelten, umgeben von Dreck: Monatelang harrten Hunderte Flüchtlinge in Paris in nicht genehmigten Camps unter einer U-Bahnbrücke aus. Jetzt mussten die Menschen ihre Lager verlassen. Die französische Polizei hat mehrere ungenehmigte Flüchtlingslager geräumt. In Paris holten Beamte mehr als 350 Menschen aus ihren Zelten, die sie unter einer oberirdischen Metrolinie aufgeschlagen hatten, nahe dem bei Touristen beliebten Viertel Montmartre. Die meisten Menschen stammen nach Angaben von Hilfsorganisationen aus Eritrea und dem Sudan . Gesundheitsministerin Marisol Touraine sagte dem Radiosender France Info, die Behörden reagierten mit der Räumung auch auf sanitäre Probleme. \"Das war eine Frage der Dringlichkeit. Man kann die Leute nicht in Urin, Exkrementen und Dreck leben lassen\", sagte der Chef der Flüchtlingsorganisation France Terre d'Asile, Pierre Henry. Das Camp war zuletzt deutlich gewachsen - auch infolge der Flüchtlingswelle, die im Frühjahr über das Mittelmeer nach Italien gelangte. Henry sagte, viele Flüchtlinge könnten ihren Asylantrag stellen und bekämen ein Dach über dem Kopf. Wer auf der Durchreise sei, werde vorübergehend in Notunterkünften untergebracht. Viele Flüchtlinge versuchen, über Frankreich nach Großbritannien zu gelangen, wo sie sich bessere Bedingungen erhoffen. Auch in der Hafenstadt Calais wurden nach TV-Berichten zwei Flüchtlingslager von der Polizei geräumt. Dort hofften Hunderte Migranten aus Syrien , Eritrea und anderen Konfliktländern auf eine Weiterreise.",http://www.spiegel.de/panorama/gesellschaft/paris-polizei-raeumt-illegale-fluechtlingslager-nahe-montmartre-a-1036779.html,2015-06-02T00:00:00.000Z
"Währung in Gefahr Juncker warnt wegen des Euro vor Grenzkontrollen Scheitert Schengen, scheitert auch der Euro: Das befürchtet EU-Kommissionspräsident Juncker. Die Mitgliedstaaten sollten trotz Flüchtlingskrise von Grenzkontrollen untereinander absehen. EU-Kommissionspräsident Jean-Claude Juncker hat vor einer Gefährdung des Euro durch eine Wiedereinführung von Grenzkontrollen in Europa gewarnt. Juncker sagte vor dem Europäischen Parlament in Straßburg, wenn der passfreie Schengenraum zerfalle, werde das politische Folgen für die gesamte Europäische Union haben, einschließlich der Eurozone . \"Wenn der Geist von Schengen unsere Länder und Herzen verlässt, werden wir mehr als Schengen verlieren\", sagte der überzeugte Europapolitiker. \"Eine gemeinsame Währung macht keinen Sinn, wenn Schengen scheitert.\" Dem Abkommen zum Abbau von Personenkontrollen an den Binnengrenzen sind 22 EU-Länder und vier andere europäische Staaten ( Schweiz , Norwegen , Liechtenstein und Island ) beigetreten. Wegen der Flüchtlingskrise wird das Schengener Abkommen in einigen Mitgliedstaaten jedoch immer offener hinterfragt. Unter anderem die Schengenländer Deutschland und Schweden hatten vor wenigen Wochen wieder systematische Grenzkontrollen eingeführt . Bundeskanzlerin Angela Merkel knüpfte im Bundestag dagegen den Erhalt des Schengenraums an einen permanenten und verbindlichen Verteilungsmechanismus für Flüchtlinge in Europa. Die EU habe nötige Reformen des Asylrechts noch nicht durchgesetzt, sagte sie. Deshalb sei die Frage einer solidarischen Verteilung der Flüchtlinge und \"die Bereitschaft zu einem permanenten Verteilungsmechanismus nicht irgendeine Petitesse, sondern die Frage, ob wir Schengen noch auf Dauer aufrecht erhalten können.\"",http://www.spiegel.de/wirtschaft/soziales/eu-chef-juncker-warnt-vor-grenzkontrollen-wegen-des-euro-a-1064546.html,2015-11-25T00:00:00.000Z
"Flüchtlingskrise Große Koalition, kein Plan Die Kanzlerin bleibt dabei: Deutschland werde die Flüchtlingskrise meistern. Nur wie? Kontingente, Obergrenzen, Fluchtursachen bekämpfen - in der Koalition gehen die Vorschläge durcheinander. Von Florian Gathmann und Anna Reimann Christian O. Bruch / laif Florian Gathmann 1975 in Göppingen geboren, studierte in Konstanz Verwaltungswissenschaft und an der Rutgers University in den USA Politikwissenschaften (M.A.). Ab 2001 Volontariat bei der \"Thüringer Allgemeine\" in Erfurt, danach Pauschalist und ab 2005 Politik-Redakteur. Im Sommer 2006 Arthur F. Burns-Fellow bei der \"Chicago Tribune\" in Washington und Chicago. Seit Mai 2007 Redakteur bei SPIEGEL ONLINE im Ressort Politik, seit Januar 2009 in der Berliner Redaktionsvertretung. Teilnehmer des Journalism Program for German and American Journalists der Robert-Bosch-Stiftung. E-Mail: Florian.Gathmann@spiegel.de Twitter: @FlorianGathmann folgen Mehr Artikel von Florian Gathmann Christian O. Bruch/ laif Anna Reimann Twitter: AnnaReimann1 folgen Mehr Artikel von Anna Reimann Eigentlich müsste die Kanzlerin das Bett hüten. Ihre Stimme ist kratzig, die Konzentration deutlich unter Normalniveau. In den ersten Minuten ihrer Rede im Bundestag verspricht sie sich mehrfach . Aber dann fängt sich Angela Merkel , wirkt beinahe kämpferisch. Sie will an diesem Morgen etwas klarstellen: Einen Kurswechsel in der Flüchtlingskrise wird es mit ihr nicht geben. Das ist schön zu hören für all jene, die Merkel in der Flüchtlingspolitik nach wie vor vertrauen. Aber wer jetzt gehofft hat, einen wirklichen Plan für die Bewältigung der Krise von der Kanzlerin zu erfahren, der wird abermals enttäuscht. Die Wahrheit ist: Merkel und ihre Regierung haben diesen Plan nicht. Stattdessen sagt die CDU -Chefin, was nicht funktionieren würde: \"Die simple Abschottung wird uns nicht das Problem lösen.\" Von Obergrenzen, die in ihrer Koalition vor allem die CSU fordert , spricht sie erst gar nicht. Merkel erläutert all die komplizierten Dinge, die sie plant: EU-Verhandlungen über Flüchtlingskontingente mit der Türkei, die Einrichtung von sogenannten Hotspots - also Registrierzentren - an den Außengrenzen der Union, die Bekämpfung der Fluchtursachen. Dafür brauche man einen \"langen Atem und Geduld\", sagt die Kanzlerin. Doch wie viel Geduld haben die Deutschen - ganz zu schweigen von Merkels Koalition? Selbst in der SPD ist die Stimmung wacklig: Familienministerin Manuela Schwesig spricht in der \"Passauer Neuen Presse\" von einer \"Atempause\", die Deutschland angesichts der Flüchtlingszahlen brauche. Und mancher Genosse glaubt, Parteichef und Vizekanzler Sigmar Gabriel sei in Wahrheit näher bei CSU-Chef Horst Seehofer als bei Merkel. DPA Flüchtlinge an der österreichisch-bayerischen Grenze: Es gibt keinen Plan Eines haben die meisten Vorschläge gemeinsam, die zurzeit im Regierungslager auf dem Tisch liegen: Sie wirken, wenn man genauer hinschaut, entweder wenig durchdacht oder sind in der Umsetzung äußert ungewiss. Ein Überblick: Obergrenze: Eine solch strikte Begrenzung bei der Aufnahme von Flüchtlingen will vor allem die CSU, wollen aber auch CDU-Leute wie Reiner Haseloff, der Ministerpräsident von Sachsen-Anhalt. Obergrenze - das klingt nach: Wir haben die Kontrolle. Die Konsequenzen eines solchen Schrittes will aber auch in der CSU niemand zu Ende denken. Wie würde man denn verhindern, dass doch mehr Flüchtlinge kommen? Am Ende würden wohl nur Zäune an den Grenzen helfen. Es gibt sogar noch weitergehende Ideen. EU-Kommissar Günter Oettinger (CDU) etwa denkt über eine Änderung des Grundgesetzes nach: \"Das deutsche Asylrecht wirkt wie ein Magnet auf die Flüchtlinge\", sagte er dem \"Handelsblatt\". Kontingente: Merkel, ein Großteil ihrer Partei und die SPD lehnen feste Obergrenzen strikt ab und setzen auf sogenannte Kontingente , um den Zuzug von Flüchtlingen zu drosseln. Diese Variante könnte so aussehen: Gemeinsam mit dem Uno-Flüchtlingshilfswerk wählen die EU-Länder eine große Zahl von Flüchtlingen aus - für Deutschland kursiert die Zahl von höchstens 500.000 pro Jahr - und übernehmen diese Menschen von der Türkei. Die Flüchtlinge müssten dann nicht mit Hilfe von Schleppern nach Europa kommen, sondern könnten legal einreisen. Außerdem hätten auch die ärmsten Menschen, die keine Schlepper zahlen können, und Frauen und Kinder, die sich eine gefährliche Flucht nicht zutrauen, die Chance auf Schutz in Deutschland . Aber auch die Kontingentlösung ist noch in der Werkstattphase: Es gibt keine EU-Einigung, viele osteuropäische Staaten wollen von einer Verteilquote nichts wissen. Und die Solidarität bröckelt immer mehr. Und was passiert, wenn trotzdem noch massenhaft Flüchtlinge auf anderen Wegen in die EU gelangen, etwa wenn die Grenzsicherung in der Türkei nicht funktioniert? Der schwierige Partner Türkei: Zentral dafür, dass Kontingente wirklich den Zuzug von Flüchtlingen reduzieren können, ist die Kooperation der Türkei unter ihrem autoritär regierenden Präsidenten Recep Tayyip Erdogan. Ankara müsste sich - im Gegenzug für Milliardenhilfen durch die EU - bereit erklären, mehr Flüchtlinge unter besseren Bedingungen unterzubringen und die Grenzen zu sichern. Aber was ist man bereit dafür zu geben? Auch hier haben die Regierungsparteien keine gemeinsame Linie. Die SPD will beispielsweise neuen Schwung in die EU-Beitrittsverhandlungen bringen. Hier gibt es Bedenken seitens CDU und CSU. Fluchtursachen bekämpfen: Klingt schön. Aber was bedeutet das konkret, etwa für Deutschlands Rolle in Syrien, von wo ein großer Teil der Flüchtlinge kommt? Die Kanzlerin sicherte Frankreich nach dem Terror in Paris zwar \"jedwede Unterstützung\" zu. Doch danach reagierte Berlin in der Diskussion über erweiterte Militäroperationen sehr zurückhaltend . Gesetzesvorhaben: Große Aufmerksamkeit erregte das Vorhaben, den Familiennachzug für Flüchtlinge mit subsidiärem Schutz wieder auszusetzen . Subsidiären Schutz bekommt aber innerhalb der großen Flüchtlingsgruppen der Syrer, Afghanen und Iraker sowieso nur eine Minderheit. Auch für alle anderen findet Familiennachzug derzeit nur in begrenztem Ausmaße statt - die zuständigen Botschaften und Konsulate in der Türkei und im Libanon sind überfordert. Ein weiterer damit zusammenhängender Vorstoß von Innenminister Thomas de Maizière (CDU) zeigt die Planlosigkeit: Er forderte, für syrische Flüchtlinge zur Einzelfallprüfung zurückzukehren. Das würde den Verwaltungsaufwand extrem steigern - aber schon jetzt stauen sich ja im Bundesamt für Migration und Flüchtlinge (Bamf) mehr als 300.000 anhängige Asylverfahren. Video: Angela Merkel -\"Wir handeln gemeinsam mit unseren Freunden\"",http://www.spiegel.de/politik/deutschland/cdu-csu-spd-in-der-fluechtlingskrise-obergrenze-und-kontingente-a-1064491.html,2015-11-25T00:00:00.000Z
