article,article_url,date
"Bremen Neonazi wollte Asylbewerberheim in die Luft jagen Die Polizei in Bremen hat einen 21-Jährigen festgenommen und damit ein Bombenattentat verhindert. Mit 90 Gramm eines hochexplosiven Gemischs wollte der Rechtsextreme ein Asylbewerberheim sprengen. Bremen - Bei der Durchsuchung der Wohnung des 21-Jährigen seien eindeutige Hinweise auf den geplanten Anschlag gefunden worden, erklärten Polizei und Staatsanwaltschaft am Mittwoch in Bremen. Das Motiv sei vermutlich extreme Fremdenfeindlichkeit gewesen. Gegen den Mann wurde Haftbefehl erlassen.  Die Ermittler gehen bislang davon aus, dass es sich bei dem Mann um einen Einzelgänger handelt, der keiner Organisation angehört. Allerdings bewege er sich im rechtsextremistischen Umfeld. Hierzu gebe es noch weitere Ermittlungen, teilte die Staatsanwaltschaft mit. Zu Einzelheiten des geplanten Anschlags wollten sich die Ermittler nicht näher äußern. Art und Menge des Sprengstoffs hätten gereicht, um in einem Umkreis von 30 Metern Menschenleben zu gefährden und erhebliche Sachschäden anzurichten. Der Mann war der Bremer Polizei am Todestag des Hitler-Stellvertreters Rudolf Hess am 15. August beim Kleben von Plakaten aufgefallen und bereits einmal festgenommen worden. Seinerzeit wurde bereits rechtsradikales Propagandamaterial in seiner Wohnung sichergestellt. Er kam aber wieder auf freien Fuß.  Im Laufe weiterer Ermittlungen sei bekannt geworden, dass der 21-Jährige auch im Besitz von Bauanleitungen für Sprengsätze sei. Deshalb sei seine Wohnung am späten Dienstagabend erneut durchsucht worden. Der Sprengstoff wurde auf einem Truppenübungsplatz entsorgt. Die an die Wohnung des 21-Jährigen angrenzenden Häuser wurden in der Nacht vorübergehend evakuiert.",http://www.spiegel.de/politik/deutschland/bremen-neonazi-wollte-asylbewerberheim-in-die-luft-jagen-a-100846.html,2000-11-01T00:00:00.000Z
"Presseschau \"Der Optimismus hat sich schnell verflüchtigt\" Die Mailänder Tageszeitung \"Corriere della Sera\" über die Entwicklung in Afghanistan und die Aussichten für die Konferenz in Bonn: \"Das herrschende Chaos scheint George W. Bush Recht zu geben, der gewarnt hat, dass 'das Schlimmste noch bevorsteht'. Mit Sicherheit hat die plötzliche Beschleunigung der Ereignisse nach dem 13. November (als Kabul eingenommen wurde) die Anti-Taliban-Koalition auf dem falschen Fuß erwischt. Es nützt wenig, wenn man heute feststellt, dass nur eine starke militärische Bodenpräsenz der Alliierten den derzeit stattfindenden Kontrollverlust verhindern hätte können. [...] Die Diplomatie gibt nicht auf, aber es gibt viele und begründete pessimistische Stimmen. Ist es vernünftig, die Regeln für die Zukunft zu bestimmen, während sich auf dem zersplitterten Territorium täglich zwei Kriege überlappen, jener gegen Bin Laden und jener um die interne Macht?\" Die liberale britische Zeitung \"The Guardian\" zur Strategie der USA in Afghanistan: \"Die Entsendung von europäischen und amerikanischen Bodentruppen nach Afghanistan ist - im Endeffekt - von US-Präsident George W. Bush gestoppt worden. Großbritannien konnte nicht allein handeln. Das Zögern der USA hat Premierminister Tony Blair in Verlegenheit gebracht. Es ist potenziell eine Katastrophe für Afghanistan. Auch an der diplomatischen Front lässt die Führungsstärke von Bush zu wünschen übrig. Die USA haben ihr Versprechen an Pakistan - und andere - gebrochen, indem sie der Nordallianz einen überproportionalen Einfluss auf die Bildung einer neuen Regierung in Afghanistan erlaubt haben. Dies könnte zu Problemen führen. Die europäischen Verbündeten von Bush haben auf die jüngsten Durchhaltereden von Bush zurückhaltend reagiert. Ihr relatives Schweigen sollte Bush veranlassen, mehr auf sie zu hören.\"  Die konservative französische Tageszeitung \"Le Figaro\" (Paris) zur Entwicklung in Afghanistan: \"Schnell verflüchtigt hat sich der Optimismus, den der Fall von Kabul unter den Verbündeten in der Anti-Terrorismus-Koalition hervorgerufen hatte. Pakistan steckt zurück. Dort hatte man geglaubt, dass die USA eine feindselig gesinnte politische Kraft in Kabul nicht zulassen würden. Die alten Gegner sind also wieder in Kabul zurück. Die Franzosen, aber auch die Engländer und die Deutschen, sind alle davon ausgegangen, an diesem Krieg teilzunehmen, sehen sich jetzt aber auf Statistenrollen reduziert. Weder die Amerikaner noch die Nordallianz wollen die Truppen der Europäer dort ankommen sehen. Von einer Hand voll Royal Marines auf dem Flughafen von Bagram und vielleicht von einigen britischen Kommandos abgesehen hat bislang noch kein europäischer Soldat den Boden Afghanistans betreten.\" Die linksliberale spanische Tageszeitung \"El Pais\" zu der Entwicklung in Afghanistan und der Jagd auf den Terroristenanführer Osama Bin Laden: \"Der Verlauf des Krieges hat die Statur des saudischen Terror-Apostels kleiner werden lassen. War er nach dem 11. September für das Hirn gehalten worden, das in der Lage war, sich die Zerstörung der Werte der westlichen Welt auszudenken, hat er sich inzwischen in einen größenwahnsinnigen Flüchtling, in den Guru einer sich auflösenden Sekte verwandelt. Die von ihm aufgezeichneten apokalyptischen Botschaften sind verstummt, und Demonstrationen seiner Anhänger, vor allem in Pakistan, gibt es auch nicht mehr. Mit der Schließung ihrer Botschaft in Islamabad hat dieses Land den Taliban nun die letzte Tür zugeschlagen.\"  Das österreichische Massenblatt \"Kronenzeitung\" erwartet ohne ein Ende der Kämpfe in Afghanistan auch eine Verbesserung der internationalen Wirtschaftslage: \"Es ist grotesk, dass ein versponnener und fanatischer Milliardär, der sich jetzt in irgendwelchen Höhlenregionen verborgen hält, schuld daran ist, dass die Wirtschaft der hochentwickelten OECD-Länder zum ersten Mal seit 20 Jahren einen Schrumpfungsprozess erlebt. Die Schockwellen des 11. September haben wir alle zu spüren bekommen, und sie wirken immer noch nach. Die Weltwirtschaft war ohnehin etwas aus der Balance geraten, als sie diesen brutalen Stoß erhielt. Neben den Menschenopfern und den unmittelbaren materiellen Schäden hat der Terrorschlag eine weltweite Unsicherheit erzeugt, die jede positive Entwicklung hemmt. Denn so lange Krieg herrscht, fehlt das dringend nötige Zukunftsvertrauen.\" Die russische Tageszeitung \"Iswestija\" (Moskau) kommentiert den hartnäckigen Widerstand der Taliban in Afghanistan, die nach Meinung des Blattes auf einen harten Kern ausländischer Söldner zusammengeschmolzen sind: \"In Kundus und anderen Teilen Afghanistans ist die militärische Führung in die Hände ausländischer Söldner übergegangen - Araber, Pakistaner, Tschetschenen oder Usbeken. Diese afghanische Fremdenlegion ist jedoch die kampffähigste Einheit in der Taliban-Armee. Sie waren dem Ruf Bin Ladens nach Afghanistan gefolgt.  Dieser finanziert nicht nur den 'Heiligen' Krieg gegen die USA, den Westen oder Russland. Bin Laden vertraut lieber denen, die schon mindestens einen Krieg überstanden und ihre Hände mit Blut besudelt haben, als denen, die öffentliche Bäder schließen und Musik verbieten und eine Waffe nur im Notfall in die Hand nehmen.\"",http://www.spiegel.de/politik/ausland/presseschau-der-optimismus-hat-sich-schnell-verfluechtigt-a-169194.html,2001-11-23T00:00:00.000Z
"Nahost Gewalt setzt sich fort Trotz des angelaufenen Rückzugs aus besetzten palästinensischen Gebieten hat die Gewalt im Gazastreifen und Westjordanland am Samstag weitere Menschenleben gefordert. In Dschenin wird derweil fieberhaft nach Überlebenden gesucht - mit einem Erfolg am Samstag. Jerusalem - Im Gazastreifen erschoss ein junger Palästinenser am Kontrollpunkt Eres einen israelischen Grenzpolizisten, bevor er von israelischen Soldaten tödlich getroffen wurde. Er trug nach israelischen Angaben einen Sprengstoffgürtel um den Leib.  Nahe der Stadt Kalkilia im Westjordanland sprengte sich am Nachmittag ein junger Palästinenser an einem israelischen Kontrollpunkt in die Luft. Soldaten hatten ihn aufgefordert, stehen zu bleiben, als er die Explosion auslöste. Keiner der Soldaten sei verletzt worden, sagte ein Armeesprecher.  Überlebender in Dschenin geborgen Bei der verzweifelten Suche nach Überlebenden der schweren Kämpfe im Flüchtlingslager von Dschenin haben Helfer am Samstag einen 17-jährigen verschütteten Palästinenser nach mehr als einer Woche unter den Trümmern eines Hauses lebend geborgen. Der Jugendliche wurde sofort in Krankenhaus von Dschenin gebracht. Er sei in erstaunlich gutem Zustand, berichteten die Ärzte.  Am Abend wurde in dem stark zerstörten Lager die Leiche eines Palästinensers aus einem bei den Kämpfen von der israelischen Armee eingerissenen Haus geborgen. Die Zahl der Toten liege inzwischen über 40, hieß es in palästinensischen Berichten. Nach den blutigen Gefechten, die vor mehr als zwei Wochen in dem Lager begonnen hatten, bezichtigen die Palästinenser Israel eines Massakers mit Hunderten von Toten.  Palästinenserpräsident Jassir Arafat ernannte am Samstagabend ein zehnköpfiges Komitee, das den Vereinten Nationen bei der geplanten Untersuchung der Ereignisse im Lager von Dschenin helfen soll.  Nablus bis Sonntag geräumt? Der israelische Verteidigungsminister Benjamin Ben Elieser kündigte an, ein schrittweiser Rückzug aus den palästinensischen Städten werde fortgesetzt. Bis Sonntagmorgen werde Nablus geräumt sein und auch der größte Teil der israelischen Truppen Ramallah verlassen haben. Der Sitz des palästinensischen Präsidenten Jassir Arafat werde aber weiterhin umstellt bleiben.  Am Freitag hatten israelische Truppen Dschenin geräumt, in das der UN-Sicherheitsrat eine Untersuchungskommission zur Klärung palästinensischer Vorwürfe über Massaker entsenden wird. Israel stimmte einer entsprechenden Resolution zu, die in der Nacht zum Samstag einstimmig verabschiedet wurde. Der israelische Außenminister Schimon Peres erklärte nach einem Gespräch mit Ministerpräsident Ariel Scharon, sein Land werde UN-Vertreter im Land begrüßen, \"um die Fakten zu klären\". \"Israel hat in Bezug auf die Operation in Dschenin nichts zu verheimlichen\", sagte Peres UN-Generalsekretär Kofi Annan.  UN besorgt Die UN-Resolution äußert sich besorgt über die schlechte humanitäre Lage der palästinensischen Bevölkerung und weist auf die Notwendigkeit hin, medizinischen und humanitären Organisationen Zutritt zu den belagerten Gebieten zu gewähren. Ferner werden vorausgegangene Resolutionen bekräftigt, die einen sofortigen israelischen Rückzug aus allen palästinensischen Städten und ein Ende der Gewalt fordern.  Der US-Nahostgesandte William Burns zeigte sich am Samstag schockiert über das Ausmaß der Zerstörungen in Dschenin. Er sprach von einem \"enormen Leid für unschuldige palästinensische Zivilisten\" und rief zu schneller humanitärer Hilfe auf. Mitarbeiter des Dscheniner Krankenhauses teilten mit, in den vergangenen zwei Tagen seien elf Menschen in Sprengfallen oder von Blindgängern verletzt worden.",http://www.spiegel.de/politik/ausland/nahost-gewalt-setzt-sich-fort-a-192846.html,2002-04-20T00:00:00.000Z
"Justiz Kritik an der Freilassung von Egon Krenz Ehemalige Bürgerrechtler haben Kritik an der vorzeitigen Haftentlassung von Egon Krenz geäußert. Das Berliner Kammergericht hatte die Freilassung des letzten DDR-Staats- und Parteichefs angeordnet. DPA Krenz, hier noch hinter Gittern: \"Entscheidung längst überfällig\" Berlin - Krenz war wegen seiner Verantwortung für den Tod von vier DDR-Flüchtlingen an der innerdeutschen Grenze zu sechseinhalb Jahren Haft verurteilt worden. Im Februar hatte er die Entlassung beantragt, da hatte er etwa die Hälfte der Strafe abgesessen. Im Juni lehnte das Kammergericht eine Entlassung ab. Krenz-Rechtsanwalt Robert Unger nannte die Entscheidung \"längst überfällig\". Im Gegensatz zur Begnadigung, bei der die Reststrafe erlassen wird, bleibt bei der vorzeitigen Haftentlassung die restliche Strafe bestehen und wird zur Bewährung ausgesetzt.  Schon kurz nach Beginn der Haftstrafe, war Krenz in den offenen Vollzug verlegt worden. Tagsüber durfte Krenz als Freigänger das Gefängnis verlassen. Kritik von Ex-Bürgerrechtlern Frühere DDR-Bürgerrechtler haben mit Unverständnis auf die vorzeitige Haftentlassung von Krenz reagiert. \"Krenz hat genug auf dem Kerbholz. Er ist weder alt, schwach oder schwer krank. Es gibt nichts, was die vorzeitige Entlassung rechtfertigt\", sagte der frühere DDR-Oppositionelle Wolfgang Termplin der \"Berliner Zeitung\".  Der SPD-Bundestagsabgeordnete Stephan Hilsberg erklärt dem Blatt, mit der Entlassung würden die totalitären Verbrechen der DDR verharmlost: \"Krenz kommt jetzt unverdient in den Genuss der Freiheit, die er den DDR-Bürgern immer vorenthalten hat.\" Der frühere Chef der Stasi-Unterlagenbehörde, Joachim Gauck, wünschte Krenz \"Frohe Weihnachten und viele neue Einsichten über das alte Leben.\"",http://www.spiegel.de/panorama/justiz-kritik-an-der-freilassung-von-egon-krenz-a-278910.html,2003-12-19T00:00:00.000Z
"Jugendstudie \"Die Angst sitzt uns in den Knochen\" Jugendliche treiben Sorgen über ihre Zukunft um - das lesen Forscher aus der neuen Shell-Jugendstudie heraus. Aus Furcht vor Arbeitslosigkeit entwickeln Mädchen demnach großen Ehrgeiz, während Jungs sich möglichst lange im \"Hotel Mama\" einigeln. Berlin - Wenn es nach den Zahlen der jüngsten Shell-Jugendstudie geht, wächst in Deutschland eine Bilderbuch-Generation heran: Sie ist leistungsbereit und zielorientiert, legt Wert auf eine gute Bildung, wünscht sich eine Familie und schätzt soziales Engagement. Die Jugendlichen sind weniger politikverdrossen als vor vier Jahren und erteilen extremistischen Parteien eine Absage. Doch zugleich ist die Jugend zutiefst verunsichert. Sie hat Angst vor Arbeitslosigkeit, Wirtschaftskrisen und Armut. Und es mag auch die Sorge mitschwingen, gar nicht gebraucht zu werden, sagte der Sozialforscher und Studienkoordinator Klaus Hurrelmann bei der Präsentation der Studie am Donnerstag in Berlin. DPA Sozialwissenschaftler Hurrelmann: Unsichere Jugend Für die Studie haben Forscher 2500 Jugendliche im Alter zwischen 12 und 25 Jahren interviewt. Sie haben jedem 100 Fragen gestellt, zu ihrer Lebenssituation, ihren Glaubens- und Wertvorstellungen und ihrer Einstellung zur Politik. \"Eine pragmatische Generation unter Druck\" nennen die Forscher diese Jugend nach der Analyse der Ergebnisse. \"Die Angst sitzt uns in den Knochen. Viel mehr als in jeder Generation in der Nachkriegszeit\", hat ein 23-jähriger Student geantwortet.   Als \"neue Bildungselite\" machte Hurrelmann junge Frauen aus. Beim Besuch höherer Schulen verbuchten Mädchen deutlich stärkere Zuwächse als Jungen. Da sich dies voraussichtlich auch in besseren Berufschancen der Frauen niederschlagen werde, könne künftig eher ein \"Krieg der Geschlechter\" als ein \"Krieg der Generationen\" drohen, so Hurrelmann. Die jungen Männer nämlich tickten anders, viele Jungs stiegen beim Wettlauf um Abi und Beziehung einfach aus. Sie igelten sich laut Studie möglichst lange im \"Hotel Mama\" ein und klammerten sich an ein traditionelles Männerbild, das von der Realität längst überholt wurde. \"Die wollen nur noch Tischler mit Abi\" Das Auseinanderdriften der Generation sei auch an anderen Stellen spürbar, so Hurrelmann. Ostdeutsche Jugendliche, besonders auf dem Land , glauben demnach, dass sie bei ihren Zukunftswünschen per se benachteiligt sind. Jedes dritte Kind aus einer Migrantenfamilie fühlt sich wegen seiner Herkunft diskriminiert. Und bereits die 17-jährigen ahnen, dass sie mit einer mäßigen Schulausbildung auf der Strecke bleiben werden. \"Die wollen jetzt nur noch Tischler mit Abi\", hat ein Hauptschüler wütend beim Interview gesagt. \"Das geht doch nicht.\" Verantwortlich dafür sei vor allem die Angst, den Arbeitsplatz zu verlieren oder gar nicht erst einen angemessenen Job zu finden . Hatten 2002 noch 55 Prozent der befragten 12- bis 25-Jährigen diese Furcht geäußert, waren es in diesem Jahr 69 Prozent. Deutschland verfüge zwar über eine \"bemerkenswerte, kreative junge Generation\". Diese treffe jedoch \"auf Verhältnisse, die sie nicht zur Entfaltung bringt\", sagte Hurrelmann. Der Experte bescheinigte der Jugend eine \"erstaunlich pragmatische Grundhaltung\" sowie eine \"sehr hohe\" Leistungsbereitschaft. Zu dieser Generation könne sich das Land \"beglückwünschen\". Allerdings hingen die Bildungs- und damit Zukunftsaussichten weiterhin in erster Linie von der sozialen Herkunft ab. Der Erhebung zufolge stuften sich lediglich 38 Prozent der Hauptschüler, aber 57 Prozent der Gymnasiasten als \"eher zuversichtlich\" ein. Unzufriedenheit mit den persönlichen Perspektiven hat nach Ansicht Hurrelmanns auch Auswirkungen auf politische Entscheidungen der Jugendlichen. Zwar ordne sich der Durchschnitt leicht links der Mitte ein. Der Erfolg der rechtsextremen NPD bei den Landtagswahlen in Mecklenburg-Vorpommern bei den Erstwählern sei damit weniger Ausdruck einer grundsätzlich rechten Haltung . Vielmehr nutzten Parteien wie die NPD die soziale Unzufriedenheit der jungen Wähler aus, die sich von den etablierten Parteien nicht ernst genommen fühlten. Der Anteil der politisch Interessierten stieg leicht von 34 auf 39 Prozent. 1991 hatte er noch 57 Prozent betragen. cpa/ddp/dpa",http://www.spiegel.de/lebenundlernen/schule/jugendstudie-die-angst-sitzt-uns-in-den-knochen-a-438504.html,2006-09-21T00:00:00.000Z
"Köhler-Rede \"Wissen und Wertebewusstsein\" Die Rezepte des Bundespräsidenten zur Genesung des deutschen Bildungssystems sind nicht besonders originell - und trotzdem richtig. Stellenweise werden sie schon umgesetzt, doch Erfolge werden erst mit Verzögerung sichtbar. Von Jan Friedmann Bernhard Riedmann/ DER SPIEGEL Jan Friedmann E-Mail: jan.friedmann@spiegel.de Mehr Artikel von Jan Friedmann Berlin - \"Erst wenn Wissen und Wertebewusstsein zusammenkommen, ist der Mensch fähig, verantwortungsbewusst zu handeln.\" Das ist der Satz, der die mit Spannung erwartete Rede des Bundespräsidenten wahrscheinlich am besten zusammenfasst: Ein erfolgreiches Bildungssystem, so wie es sich Horst Köhler für Deutschland wünscht, soll wissenschaftliche Leistung ermöglichen und stabile Werte vermitteln. DPA Bundespräsident Horst Köhler: Auf der Höhe des Common Sense Damit präsentiert sich der Bundespräsident auf der Höhe dessen, was in der Bildungspolitik mittlerweile als Common Sense gelten kann - ohne selbst mit außergewöhnlichen Analysen zu überraschen.   Einige Befunde des Bundespräsidenten im Detail: \"In Deutschland erwerben vergleichsweise wenig junge Menschen die Hochschulreife, und zu wenige schließen ein Studium ab.\" Im Vergleich zu anderen Industrieländern hat Deutschland eine vergleichsweise niedrige Akademikerquote . Nach jüngst veröffentlichten Zahlen der Organisation für wirtschaftliche Zusammenarbeit und Entwicklung (OECD) erwerben in Deutschland derzeit rund 20 Prozent eines Alterslehrgangs einen Hochschulabschluss. Die OECD-Staaten weisen aber im Schnitt eine Akademikerquote von knapp 35 Prozent auf. Deutschlands Rückstand bedroht die Wirtschaftskraft: Die Akademiker fehlen als Ideengeber, Firmengründer oder als gut ausgebildete Fachkräfte. \"Wir brauchen angemessene Finanzmittel für alle Bereiche des Bildungssystems, denn unsere Bildungsausgaben sind insgesamt zu niedrig.\" Die Bundesrepublik gibt weniger Geld als andere Länder für Bildung aus - und zwar sowohl für Schulen als auch für Hochschulen . Laut OECD lag der Anteil öffentlicher und privater Bildungsausgaben am Bruttoinlandsprodukt im Jahr 2003 mit 5,3 Prozent deutlich unter dem OECD-Durchschnitt von 5,9 Prozent. An der Unterfinanzierung sind aber nicht allein die öffentlichen Haushalte schuld: Deutsche Familien zeigten sich bislang wenig bereit, Geld für die Ausbildung der eigenen Kinder zurückzulegen - ganz anders als beispielsweise Eltern in Südkorea oder den Vereinigten Staaten. \"Bildungsschancen sind Lebenschancen. Sie dürfen nicht von der Herkunft abhängen. Darum werde ich immer auf der Seite derer sein, die leidenschaftlich eintreten für eine Gesellschaft, die offen und durchlässig ist und dem Ziel gerecht wird: Bildung für alle.\" Nur in wenigen Ländern ist die Bildungskarriere so stark an die soziale Herkunft gekoppelt wie in Deutschland. Das Deutsche Studentenwerk hat erhoben , was aus 100 Kindern weniger gebildeter Eltern wird: 64 gehen gar nicht erst auf weiterführende Schulen und fallen damit für eine Karriere in Berufen mit hohem Einkommen und Sozialprestige weitgehend aus. Und an den Hochschulen bleiben Kinder aus Akademikerfamilien weitgehend unter sich. Gesamtschulfans schieben den Schwarzen Peter für die Undurchlässigkeit häufig dem dreigliedrigen Schulsystem zu - und greifen damit zu kurz: Länder mit und ohne Einheitsschule sind sozial durchlässiger als Deutschland, daran allein kann es nicht liegen. \"Unsere Gesellschaft muss Zuwanderern gute Bildungschancen bieten, und die Zuwanderer müssen sich im Klaren darüber sein, was auf ihrer Seite den Bildungserfolg fördert.\" Schulvergleichstudien wie Pisa belegen, dass Ausländerkinder in Deutschland bei ihren Schulleistungen stark zurückhängen - weitaus stärker als in anderen Ländern. Bei 15-jährigen Schülern beläuft sich beispielsweise der Rückstand von Migrantenkinder auf ihre deutschen Klassenkameraden auf satte drei Jahre . Und was noch schwerer wiegt: Einwandererkinder aus der zweiten Generation schneiden sogar schlechter ab als diejenigen, die mit ihren Eltern nach Deutschland kommen. \"Eltern hier in Deutschland, die ihren Kindern im Leben Erfolg wünschen, sprechen mit ihnen Deutsch - nicht unbedingt Deutsch allein, aber jedenfalls auch Deutsch.\" Sprachkenntnisse, das haben ebenfalls mehrere Schuluntersuchungen belegt , sind notwendige Voraussetzung dafür, dass Ausländerkinder überhaupt die Chance haben, in der Schule mitzuhalten. Immer mehr Bundesländer gehen deshalb dazu über, ausreichende Deutschkenntnisse vor der Einschulung zu prüfen und bei Bedarf Sprachkurse anzubieten. \"Wir brauchen gute Lehrer - und wir brauchen auch genug Lehrer: Genug Lehrer, um den Unterrichtsausfall zu minimieren; genug Lehrer für vernünftige Klassengrößen; genug Lehrer für alle vorgesehenen Schulfächer.\" Deutsche Lehrer, so das Ergebnis einer OECD-Studie, sind im internationalen Vergleich privilegiert : Sie verdienen 40 Prozent mehr als der Durchschnitt ihrer Kollegen in anderen Industrieländern. Außerdem genießen sie in Deutschland Beamtenstatus - eine deutsche Besonderheit. Weitgehend erfolgreich widersetzte sich die Lehrer-Lobby bislang Versuchen, Lehrer-Leistungen zu prüfen. Was hinter der Klassenzimmertür geschieht, bleibt in Deutschland weitgehend Geheimsache. Gegen den grassierenden Unterrichtsausfall geht beispielsweise das Bundesland Hessen an, indem es Laien-Lehrer einstellt . \"Wir wissen: Nicht alles ist messbar. Aber Pisa hat uns genügend Anhaltspunkte dafür gegeben, dass unser Bildungssystem sich nicht auf der Höhe der Zeit befindet.\" Die Einsicht, dass Vergleichstudien wie Pisa sinnvoll sind, setzt sich an Schulen und Hochschulen zunehmend durch. An der dritten Pisa-Studie nahmen in diesem Jahr rund 55.000 deutsche Schüler im Alter von 15 Jahren teil , die Auswertung läuft noch. Die Bundesregierung hat ein eigenes \"Institut zur Qualitätsentwicklung im Bildungswesen\" ins Leben gerufen, das Schulerhebungen koordiniert. \"Vor zwei Wochen habe ich die Goethe-Grundschule in Mainz besucht - übrigens eine Ganztagsschule. Dort gibt es an den Nachmittagsen viele Spiel-, Sport- und Lernangebote.\" Der hartnäckige Grabenkampf um Sinn und Unsinn der Ganztagsschule ist weitgehend beendet: Die CDU-Bildungsministerin Annette Schavan hat sich dazu entschlossen, das milliardenschwere Programm ihrer Vorgängerin Edelgard Bulmahn (SPD) fortzuführen. Was die Schulen mit dem Geld anfangen, bleibt ihnen aber weitgehend selbst überlassen - und allein wegen der dringend benötigten Mittel ist das Programm schon populär.",http://www.spiegel.de/lebenundlernen/uni/koehler-rede-wissen-und-wertebewusstsein-a-438436.html,2006-09-21T00:00:00.000Z
