article,article_url,date
"EuGH-Generalanwalt Türken ohne Deutschkenntnisse sollen leichter einwandern dürfen Der Nachzug türkischer Ehegatten in die Bundesrepublik soll erleichtert werden. Der Generalanwalt am EuGH hält die bisherige Regel für rechtswidrig, wonach Familienmitglieder Deutschkenntnisse vorweisen müssen. Luxemburg - Verstößt Deutschland gegen EU-Recht, weil Zuwanderer Grundkenntnisse der deutschen Sprache haben müssen? Die Auffassung vertritt der Generalanwalt des Europäischen Gerichtshofs (EuGH), Paolo Mengozzi, in seinem Schlussantrag, den er am Mittwoch vorgelegt hat. Seit 2007 müssen sich Ehegatten von in Deutschland arbeitenden Ausländern in deutscher Sprache verständigen können, um ebenfalls nach Deutschland ziehen zu dürfen. Konkret geht es um die Klage einer Türkin, die nicht bei ihrem Mann leben darf, der seit 1998 in Deutschland wohnt. Sie ist Analphabetin und verfügt nach Feststellungen der deutschen Botschaft in Ankara nicht über die nötigen Sprachkenntnisse. Mengozzi sagte, mit der Forderung nach Sprachkenntnissen vor der Einreise verstoße Deutschland unter anderem gegen eine sogenannte Stillhalteklausel aus einem Abkommen zwischen der EU und der Türkei von 1970. Darin werden neue Einreisehindernisse für Türken verboten. Laut Mengozzi ist die deutsche Regelung zudem ungeeignet, um damit Zwangsehen zu bekämpfen. Besser wäre es, die Betroffenen in Deutschland zur Teilnahme an Integrations- und Sprachkursen zu verpflichten, weil diese Personen dann \"aus ihrem familiären Umfeld heraustreten\" und ihnen \"der Kontakt mit der deutschen Gesellschaft erleichtert\" werde. Der Europäische Gerichtshof folgt in seinen Urteilen meist - aber nicht immer - den Empfehlungen seines Generalanwalts. Das Urteil wird erst in einigen Monaten erwartet. In einem anderen Verfahren bezeichnete der Generalanwalt Yves Bot die in einigen deutschen Bundesländern herrschende Praxis, Ausländer vor der Abschiebung in normalen Haftanstalten unterzubringen, als rechtswidrig. Von der EU-Rückführungsrichtlinie seien spezielle Hafteinrichtungen vorgeschrieben. Die Unterbringung in normalen Gefängnissen sei nur in besonderen \"Notlagen aufgrund eines starken Zustroms von Migranten\" erlaubt.",http://www.spiegel.de/politik/deutschland/tuerken-ohne-deutschkenntnis-eugh-anwalt-will-einwanderung-erleichtern-a-966969.html,2014-04-30T00:00:00.000Z
"Skandalheim Burbach Misshandelter Flüchtling sitzt seit Mai in U-Haft Das Video seiner Misshandlung brachte den Asylheim-Skandal ins Rollen. Der Algerier Karim M. sitzt nach SPIEGEL-Informationen seit Monaten im Gefängnis - wegen eines mutmaßlichen Einbruchs. Von Jörg Diehl und Fidelius Schmid , Düsseldorf Jörg Diehl Jahrgang 1977. Studierte Geschichte, Germanistik und Politikwissenschaft an der Universität Münster. Freie Mitarbeit und Praktika unter anderem bei der \"Rheinischen Post\", der Deutschen Presse-Agentur, dem Westdeutschen Rundfunk, \"Bild\" und SPIEGEL. Volontierte beim Norddeutschen Rundfunk und schrieb anschließend als Redakteur erst für SPIEGEL ONLINE, dann für \"Bild am Sonntag\". Seit April 2007 wieder bei SPIEGEL ONLINE, von Januar 2009 bis Februar 2011 stellvertretender Ressortleiter Panorama, anschließend Korrespondent in Düsseldorf. Seit Mai 2014 Chefreporter. Seit Juli 2017 zudem Leiter des Teams Hintergrund und Recherche. E-Mail: Joerg.Diehl@spiegel.de Twitter: @spondiehl folgen PGP: Öffentlichen Schlüssel herunterladen Fingerprint: A253 20AC 5B3A 7AA2 3DAF D82F 8712 E7D4 F034 014B Mehr Artikel von Jörg Diehl Fidelius Schmid Arbeitet im Düsseldorfer Büro des SPIEGEL. Nach dem Studium der Volks- und Betriebswirtschaftslehre in Hamburg, Sydney und Paris absolvierte er seine journalistische Ausbildung an der Henri-Nannen-Schule in Hamburg. Im Anschluss war er acht Jahre bei der \"Financial Times Deutschland\", als Redakteur in Frankfurt und Korrespondent für Außen- und Sicherheitspolitik in Brüssel. Nach einer Zwischenstation als Reporter beim \"Handelsblatt\" wechselte er 2012 zum SPIEGEL. Er schreibt dort vorrangig über Themen aus den Bereichen Innere Sicherheit, Terrorismus und Geheimdienste - aber nicht ausschließlich. Schmid ist Autor des manager-magazin-Bestsellers \"Gottes schwarze Kasse - Der Papst und die zwielichtigen Geschäfte der Vatikanbank\". E-Mail: Fidelius.Schmid@spiegel.de Twitter: FideliusSchmid folgen Mehr Artikel von Fidelius Schmid Eines der Misshandlungsopfer aus dem Asylbewerberheim im nordrhein-westfälischen Burbach wird sich demnächst wegen Diebstahls vor Gericht verantworten müssen. Der Algerier Karim M., 18, ist nach SPIEGEL-Informationen angeklagt, zusammen mit einem 32-jährigen Landsmann Ende Mai in ein Juweliergeschäft in Iserlohn eingebrochen zu sein. Die beiden Männer konnten jedoch in der Nähe des Tatorts gefasst werden, wie aus Kreisen der Justiz verlautete. Seither sitzen sie in Untersuchungshaft. Mehr dazu im SPIEGEL Heft 42/2014 Allahs gottlose Armee Hilferuf aus Kobane: \"Sie kommen zu Tausenden, es werden immer mehr!\" Digitale Ausgabe | Gedruckte Ausgabe | Apps | Abo M. ist der bislang unbekannte Flüchtling aus der Unterkunft im Siegerland, dessen Martyrium auf einem Video festgehalten worden war. In dem Film ist zu hören, wie die Wachleute Dirk O. und Henning G. den gefesselten Asylbewerber auffordern, sich in sein Erbrochenes zu legen . Zuvor soll ihr Kollege R. den Nordafrikaner geschlagen haben. Die Staatsanwaltschaft Siegen ermittelt daher gegen die Sicherheitsmänner. Die mit einem Handy gefertigten Aufnahmen entstanden nach SPIEGEL-Informationen Ende April. Gut einen Monat später stieg M. laut Anklage zusammen mit seinem Komplizen in das Iserlohner Fachgeschäft ein. Demnach brachen sie im Keller des Hauses ein Loch in die Decke, durch das sie in den Laden eindringen konnten. Jedoch lösten sie wenig später einen Alarm aus. Als die Polizei anrückte, versteckten die Täter die zusammengerafften Wertgegenstände und flüchteten. Weit kamen sie jedoch nicht. Das Verfahren vor dem Jugendschöffengericht ist noch nicht terminiert. Einer der beiden übergriffigen Wachmänner hatte im Gespräch mit SPIEGEL ONLINE die Bilder zu erklären versucht : An dem betreffenden Abend habe Karim M. randaliert, wieder einmal. Obwohl es in dem Heim ein striktes Alkoholverbot gebe, sei M. häufig sehr betrunken gewesen. Er habe sich immer wieder übergeben müssen und sie mit Glasscherben angegriffen. Schließlich, nach Stunden, habe sein Kollege R. zugeschlagen. Weil der Asylbewerber aber immer noch keine Ruhe gegeben habe, habe er ihm gedroht: \"Willst du noch eine haben? Soll ich dir in die Fresse treten, oder was?\" Seiner Darstellung zufolge nahm der Wachmann R., der den Flüchtling geohrfeigt hatte, wenig später auch das Video auf, das vor zwei Wochen einem Journalisten zugespielt worden war. Der andere beteiligte Aufpasser, der in dem Film zu hören ist, sagte dem SPIEGEL, Karim M. habe sich am Folgetag bei ihm für sein Verhalten entschuldigt, er sei eben stark alkoholisiert gewesen. In dem Burbacher Flüchtlingsheim herrscht eigentlich striktes Alkoholverbot. Sowohl Bewohner als auch frühere Angestellte schildern jedoch, dass dort regelmäßig viel getrunken worden sei. Im Gespräch mit SPIEGEL ONLINE zeichneten mehrere ehemalige Wachleute das generelle Bild einer schaurigen Anstalt, in der über lange Zeit - unbemerkt oder ignoriert von den Behörden - skandalöse Zustände geherrscht hätten . Einige Kollegen machten sich demnach einen Spaß daraus, Flüchtlinge zu schikanieren. Zeitweise hätten sich die Männer, deren Rädelsführer der Wachmann R. gewesen sei, in der WhatsApp-Gruppe \"Marokks\" gegenseitig Bilder erniedrigter Menschen zugeschickt. \"Das war widerlich\", so einer der ehemaligen Ordner.",http://www.spiegel.de/panorama/justiz/burbach-misshandelter-fluechtling-sitzt-in-u-haft-a-996576.html,2014-10-12T00:00:00.000Z
"Wiederaufbau Geberkonferenz verspricht Gaza-Streifen gut vier Milliarden Im Krieg mit Israel fielen tonnenweise Bomben auf den Gaza-Streifen. Für die Beseitigung der Schäden sagten zahlreiche Länder jetzt mehr als vier Milliarden Euro zu. Israel selbst wollte sich nicht auf einen Beitrag zum Wiederaufbau festlegen. Kairo - Die Palästinenser sollen rund 4,3 Milliarden Dollar für den Wiederaufbau des Gaza-Streifens erhalten. Das sagte der norwegische Außenminister Borge Brende am Ende einer Geberkonferenz in Kairo zu. Die Summe liegt deutlich höher als zunächst erhofft. Insgesamt 450 Millionen Euro wolle die EU bereitstellen, kündigte die Außenbeauftragte Catherine Ashton an. Die USA geben nach Angaben von Außenminister John Kerry umgerechnet rund 168 Millionen Euro. Deutschland steuert zusätzlich zu seiner Beteiligung an den EU-Geldern weitere 50 Millionen Euro bilaterale Hilfe bei. An der von Ägypten und Norwegen initiierten Konferenz nehmen rund dreißig Außenminister sowie regionale und internationale Organisationen teil. Die Gelder werden zur Beseitigung der schweren Schäden benötigt, die der jüngste Gaza-Krieg hinterlassen hat. Israel griff im Juli und August mehr als 5000 Ziele in dem Palästinensergebiet an, militante Palästinenser feuerten 4500 Raketen auf Israel ab. Mehr als 2100 Palästinenser und mehr als 70 Israelis wurden getötet. 18.000 Häuser wurden nach Angaben der Uno-Nothilfeorganisation Ocha im Gaza-Streifen zerstört oder beschädigt. Die Kosten für den Wiederaufbau beziffert die palästinensische Verwaltung auf mehr als 3,2 Milliarden Euro - rund ein Drittel des Bruttoinlandsprodukts der palästinensischen Autonomiegebiete. Nach offiziellen Angaben zerstörte das israelische Militär mit schätzungsweise 20.000 Tonnen Bomben Häuser, Straßen, Brücken, Schulen und Krankenhäuser sowie Infrastruktur zur Wasser- und Energieversorgung. 17 Prozent der landwirtschaftlichen Anbaufläche im Gaza-Streifen wurde vernichtet. Auch die Wirtschaft des Streifens am Mittelmeer wurde schwer getroffen, zahlreiche Geschäfte und Betriebe seien zerstört. Israels Außenminister Avigdor Lieberman wies darauf hin, dass die Kooperation seines Landes bei der Beseitigung der Kriegsfolgen im Gaza-Streifen unverzichtbar sei. \"Der Gaza-Streifen kann ohne das Zutun Israels nicht wiederaufgebaut werden\", sagte Lieberman dem israelischen Nachrichtenportal Ynet. Solange es ausschließlich \"um die Reparatur der zivilen Infrastruktur\" gehe, liege dies \"auch im israelischen Interesse\".   Ägypten legt Friedensplan vor Zu einer möglichen materiellen oder finanziellen Beteiligung Israels an der Reparatur der Kriegsschäden sagte ein Sprecher von Lieberman, die Frage stelle sich \"erst nach Bewertung der Konferenzergebnisse in Kairo\". Vertreter Israels waren nicht nach Kairo eingeladen worden, um die Teilnahme arabischer Staaten nicht zu gefährden. Noch im Oktober sollen in der ägyptischen Hauptstadt die indirekten Verhandlungen zwischen Israelis und Palästinensern über einen dauerhaften Waffenstillstand weitergehen. Ägypten legte bei der Konferenz einen Nahost-Friedensplan vor. Die Gelegenheit sollte genutzt werden, um zu einem Frieden zwischen Israelis und Palästinensern zu gelangen, der den \"Traum der Koexistenz\" Wirklichkeit werden lasse, sagte Präsident Abd al-Fattah al-Sisi . Er schlug vor, einen von mehreren arabischen Staaten 2002 erarbeiteten Plan zur Lösung des Konflikts neue Beachtung zu schenken. Israel hatte den Plan damals abgelehnt. Er sieht eine vollständige Anerkennung Israels vor, wenn der jüdische Staat im Gegenzug sämtliche Gebiete zurückgibt, die er im Sechstagekrieg 1967 eroberte und einer \"gerechten Lösung\" für palästinensische Flüchtlinge zustimmt. Zu Forderungen nach umfassenden Friedensverhandlungen sagte Außenminister Lieberman, vorher müsse klar sein, in welchem Rahmen und über welche Fragen da verhandelt werden solle. \"Wenn es nur um die palästinensischen Forderungen geht, ist das eine vergebliche Mühe.\" Bundesaußenminister Frank-Walter Steinmeier betonte, ein Zurück zum Status quo dürfe es nicht geben. \"Niemand will Infrastruktur aufbauen, nur damit sie kurz darauf wieder zerstört wird\", hieß es in einer Mitteilung des Außenministeriums. Gaza dürfe deshalb nicht mehr von der Hamas und anderen Extremisten als Waffenlager missbraucht werden und die Menschen müssten eine wirtschaftliche Perspektive erhalten. Auch Uno-Generalsekretär Ban Ki Moon warnte, die Geberkonferenz dürfte nicht zu einem Ritual werden, nach dem Motto: \"Aufbauen und zerstören - und dann von der internationalen Gemeinschaft erwarten, sie zahle die Rechnung.\"",http://www.spiegel.de/politik/ausland/gaza-streifen-erhaelt-von-eu-und-usa-600-millionen-fuer-wiederaufbau-a-996754.html,2014-10-12T00:00:00.000Z
"Erstmals eine Frau Filmemacherin Meerapfel übernimmt Berliner Akademie der Künste Die Berliner Akademie hat erstmals in ihrer über 300-jährigen Geschichte eine weibliche Präsidentin: Die deutsch-argentinische Filmemacherin Jeanine Meerapfel, 71, löst den streitbaren Plakatkünstler Klaus Staeck ab. Berlin - \"Nichts ist erledigt\", ließ Klaus Staeck schon im vergangenen Jahr in großen Lettern auf einem Transparent an der Glasfront seiner Akademie der Künste am Pariser Platz verkünden - gut sichtbar für Touristen, Banker, Journalisten, Botschaftsangehörige oder sonstige Dauergäste am Brandenburger Tor. Seit 2006 hatte der provokante Plakatkünstler den Vorsitz der mehr als 300 Jahre alten Institution inne, nach drei Amtszeiten darf der 77-Jährige nun nicht mehr antreten. Der aufrührerische Fassadenspruch, er war nur nebenbei programmatisch für die Agenda der Akademie, die Schauspieler (und Mitglied) Ulrich Matthes mal als \"Schnarchklub\" geschmäht hatte, eigentlich hieß so die große Retrospektive, mit der Staeck durch die Museen der Republik tourte. Am Samstag wählte das 14-köpfige Senatorengremium erstmals eine Frau in den Vorsitz, was einer Revolution gleichkommt. Staeck selbst hatte sich in seinen letzten Interviews als Amtsinhaber eine weibliche Nachfolgerin gewünscht, zumindest das dürfte nun als erledigt gelten. Was die Filmemacherin Jeanine Meerapfel, 71, bewegen wird, bleibt abzuwarten. Die deutsch-argentinische Künstlerin gehört immerhin zu den aktiveren der aktuell 404 Akademie-Mitglieder und meldet sich in letzter Zeit gern zu Wort, wenn es um die Internationalität Berlins geht, ein Thema, das auch den amtierenden Kultursenator Tim Renner und die Lokalpresse brennend interessiert, schließlich gilt es, sich ständig mit anderen Weltmetropolen abzugleichen, wer hipper, moderner, mondäner ist. Eine historisch komplexbeladene Angelegenheit, zu der man den Standpunkt der Akademie dank Meerapfels Interesse nun künftig vernehmlicher hören könnte. Vielleicht sogar mit unbequemen Meinungen, das wäre ganz im Sinne Staecks. Nur 22 Prozent Frauen Meerapfel, Tochter deutsch-jüdischer Flüchtlinge, wurde 1942 in Buenos Aires geboren und kam 1964 für ihr Filmstudium nach Deutschland. 1981 hatte die ehemalige Filmkritikerin mit dem Drama \"Malou\" ihr Spielfilmdebüt, es folgten bis 2012 ein gutes Dutzend weitere Produktionen, darunter Dokumentationen und Fiktionen für Kino und Fernsehen. 1989 gewann sie mit \"La Amiga\" den Deutschen Filmpreis. Zu Meerapfels Stellvertreterin wurde die österreichische Schriftstellerin Kathrin Röggla, 43, (\"Wir schlafen nicht\") gewählt. Zu den Mitgliedern der Akademie zählen auch Schwergewichte wie Ai Weiwei, Bob Dylan, Wim Wenders und Bruce Nauman, aber von denen hatte augenscheinlich niemand Interesse bekundet, den Vorsitz zu übernehmen. Gut für das Duo Meerapfel/Röggla, denn nur 22 Prozent der Akademie-Mitglieder sind Frauen. Die Akademie der Künste wurde 1696 nach Pariser Vorbild vom späteren Preußen-König Friedrich I. als \"Academie der Mahler-, Bildhauer- und Architectur-Kunst\" ins Leben gerufen. Heute gibt es sechs Sektionen: Bildende Kunst, Baukunst, Musik, Literatur, Darstellende Kunst sowie Film- und Medienkunst. Nach dem Fall der Mauer wurden die Akademien West und Ost 1993 wiedervereinigt. Frühere Präsidenten waren Heinrich Mann (Ost), Günter Grass (West) und Walter Jens (West und vereinigt). Laut Gesetz hat die Akademie zur Aufgabe, \"die Künste zu fördern und die Sache der Kunst in der Gesellschaft zu vertreten\", ein weites Feld. Die Akademie \"berät und unterstützt\" die Bundesrepublik außerdem in allen künstlerischen und kulturellen Angelegenheiten, dafür wird sie vom Bund mit jährlich 18 Millionen Euro subventioniert.",http://www.spiegel.de/kultur/gesellschaft/akademie-der-kuenste-jeanine-meerapfel-ist-neue-praesidentin-a-1036364.html,2015-05-30T00:00:00.000Z
"An nur einem Tag Mehr als 4200 Flüchtlinge im Mittelmeer gerettet Rettungskräfte haben Tausende Flüchtlinge aus dem Mittelmeer gerettet, 17 starben bei der Überfahrt. Papst Franziskus erneuerte seine Kritik an der EU-Einwanderungspolitik: Die Migranten sterben zu lassen, sei ein \"Attentat auf das Leben\". Die Rettungskräfte im Mittelmeer sind derzeit im Dauereinsatz. Die deutsche Fregatte \"Hessen\" sowie Einsatzkräfte aus Italien und anderen Ländern haben an nur einem Tag 4243 Flüchtlinge aus Seenot gerettet. Die Fregatte \"Hessen\" nahm am Freitag 880 Menschen an Bord, unter ihnen 118 Frauen und 27 Kinder. Die Flüchtlinge seien von Schlauchbooten gerettet worden, von denen einige bereits zu sinken drohten, teilte die Bundeswehr via Twitter mit. Die Schiffbrüchigen wurden an Bord der Fregatte genommen, wo sie medizinisch versorgt und betreut wurden. Sie sollen nun in einen italienischen Hafen gebracht und den Behörden übergeben werden. Laut italienischer Küstenwache waren neben der Bundeswehr auch Schiffe aus Irland, die italienische Küstenwache, Marine und Finanzpolizei sowie Rettungskräfte der EU-Grenzschutzmissionen \"Triton\" und einige Handelsschiffe beteiligt. Die geretteten Menschen waren auf insgesamt neun Schiffen und 13 Schlauchbooten auf dem Weg über das Mittelmeer, als sie in Seenot gerieten. Bei der Küstenwache gingen mehrere Hilferufe über Satellitentelefone ein. Bundeswehr Geretteter Bootsflüchtling wird auf der \"Hessen\" in Empfang genommen Allerdings entdeckten die Retter der italienischen Küstenwache zufolge auch die Leichen von 17 Migranten, die versucht hatten, in einem Schlauchboot die italienischen Hoheitsgewässer zu erreichen. Woran die Menschen gestorben sind, war zunächst unklar.   Es handelt sich um einen der bislang größten Rettungseinsätze in diesem Jahr. Anfang Mai hatten die italienische und griechische Küstenwache in wenigen Stunden mehr als 4200 Menschen gerettet. Papst nennt Tod von Migranten einen \"Angriff auf das Leben\" Papst Franziskus hat den Tod von Migranten im Mittelmeer angeprangert. \"Es ist ein Angriff auf das Leben, unsere Brüder auf den Booten im Kanal von Sizilien sterben zu lassen\", sagte der 78-Jährige. Er stellte dieses Vergehen in eine Reihe mit Abtreibung und Sterbehilfe. \"Eine richtige Gesellschaft erkennt das Recht auf Leben als vorrangig an, von der Empfängnis bis zu seinem natürlichen Ende\", sagte der Argentinier bei einer Audienz für Mitglieder der \"Vereinigung Wissenschaft und Leben\". Das Leben sei ein Geschenk und die Gesellschaft müsse über ihren Umgang damit nachdenken. Der Vorsitzende des kirchlichen Rates für Flüchtlinge, Kardinal Antonio Maria Vegliò, stand dem Pontifex zur Seite und kritisierte die Verteilung der Migranten nach Quoten in der EU. \"Europa hat nie einen Plan gehabt. Jetzt haben sie die Quote für Flüchtlinge eingeführt und ich finde diese Entscheidung wenig menschlich und wenig christlich.\" Die Migration sei eine Realität, die es immer gegeben habe und immer geben werde. \"Solange es Armut und Kriege gibt, wird sich nichts ändern.\" SPIEGEL ONLINE",http://www.spiegel.de/panorama/italien-mehr-als-4200-fluechtlinge-im-mittelmeer-gerettet-a-1036359.html,2015-05-30T00:00:00.000Z
