article,article_url,date
"Deutsch-österreichische Grenze 5500 Flüchtlinge erreichen Bayern Bei kühlen Temperaturen haben Tausende Flüchtlinge die Nacht an Bayerns Grenze zu Österreich verbracht. Die deutsche Polizei kritisiert die Behörden im Nachbarland. Die Situation an der deutsch-österreichischen Grenze bleibt angespannt. Etwa 5500 Menschen kamen am Dienstagabend im Raum Passau an, viele von ihnen warteten noch am Mittwochmorgen bei niedrigen Temperaturen auf ihre Weiterfahrt in andere Gemeinden. Dennoch: \"Insgesamt ist die Ankunft am Dienstag etwas geordneter abgelaufen\", sagte ein Sprecher der Bundespolizei. Gerade am Abend sei es wichtig gewesen, die Ankommenden schnell aus der Kälte zu holen. Sie wurden unter anderem in der Dreiländerhalle in Passau sowie in der Niederbayernhalle in Ruhstorf untergebracht. Die Brennpunkte seien weiterhin die Gemeinden Wegscheid, Achleiten und Simbach am Inn, sagte der Sprecher. Für den Morgen seien drei Sonderzüge geplant. \"Es kommt nach wie vor immer wieder ein Bus an\", hatte ein Polizeisprecher am Dienstagabend gesagt. \"Wir haben das Problem, dass wir hier unvorbereitet in relativ kurzer Zeit viele Ankünfte haben, deshalb tun wir uns schwer, die Menschen schnell aus der Kälte zu bringen.\" Zwar gebe es Ankündigungen der österreichischen Behörden. \"Aber die Zahl der Voranmeldungen und die realistischen Zahlen driften sehr weit auseinander, das ist weitaus mehr\", sagte der Sprecher. Selbst die österreichischen Grenzschützer würden immer wieder überrascht \"Ich habe das so mit Österreich noch nie erlebt\" Schon am Montag waren Tausende Flüchtlinge aus Österreich nach Deutschland gekommen. Unter anderem Bayerns Innenminister Joachim Herrmann kritisierte die Behörden im Nachbarland scharf. Österreich bringe Flüchtlinge ohne Vorankündigung an die bayerische Grenze und sei bisher zu keiner Zusammenarbeit bereit, sagte der CSU -Politiker dem Bayerischen Rundfunk. \"Ich habe das so mit Österreich noch nie erlebt.\" Bayerns Ministerpräsident Horst Seehofer forderte von Wien ein Ende der \"Politik des Durchwinkens\". Bundeskanzlerin Angela Merkel müsse in einem Gespräch mit ihrem österreichischen Amtskollegen Werner Faymann dafür sorgen, dass die \"Politik der offenen Grenzen\" beendet werde. Er setzte Merkel ein Ultimatum bis kommenden Sonntag. ( Mehr über die Attacken Seehofers gegen Merkel und Österreich lesen Sie hier .) Innenministerin plant Baumaßnahmen an Grenze zu Slowenien In Österreich sorgt unterdessen die Ankündigung von Innenministerin Johanna Mikl-Leitner von der konservativen ÖVP für Aufsehen: \"Ich habe Planungen für besondere bauliche Maßnahmen in Auftrag gegeben\", sagte Mikl-Leitner am Dienstag bei einem Besuch in Spielfeld nahe der slowenischen Grenze. Es gehe nicht darum, einen Zaun zu bauen, sondern um die Möglichkeit des geordneten Übertritts einer großen Anzahl von Personen. Es müsse ein kontrollierter Zutritt nach Österreich sichergestellt werden. Die Planungen würden erst beginnen, sagte Mikl-Leitner. In dem Szenario gehe es um technische Sperren mehrere Kilometer links und rechts des Grenzübergangs. Zuletzt hatten bei Spielfeld täglich einige Tausend Flüchtlinge die Grenze überquert. Zugtransport von Kroatien nach Slowenien Auf der Westbalkanroute ist die Flucht nun für die Menschen etwas erträglicher. Kroatien transportiert die Flüchtlinge nun in Zügen direkt zum slowenischen Grenzbahnhof Dobova. Kroatien und Slowenien einigten sich darauf, die Flüchtlinge teilweise mit Zügen weiterzutransportieren. Darauf hatten sich die Regierungen der beiden EU-Nachbarländer verständigt. Zwei Züge mit insgesamt 2200 Flüchtlingen seien in der Nacht zum Mittwoch in Dobova eingetroffen, meldete die slowenische Nachrichtenagentur STA. Bislang mussten die Flüchtlinge zu Fuß über die \"grüne\" Grenze nahe dem slowenischen Dorf Rigonce gehen. Der kilometerlange Marsch wurde angesichts herbstlicher Wetterverhältnisse mit Regen und Kälte zu einer wachsenden Herausforderung für die Migranten. Die Bevölkerung in den slowenischen Grenzdörfern um Rigonce empfand wiederum die frei herumwandernden Flüchtlinge als Belastung. Slowenien bringt die Menschen nach ihrer Registrierung und Erstversorgung mit dem Zug zur österreichischen Grenze bei Sentilj. ( Weitere Hintergründe zur Balkanroute lesen Sie hier .) SPIEGEL ONLINE Die wichtigsten Fluchtrouten über den Balkan",http://www.spiegel.de/politik/deutschland/fluechtlinge-5500-menschen-erreichen-grenze-in-niederbayern-a-1059890.html,2015-10-28T00:00:00.000Z
"Ex-Finanzminister über deutsche Politiker Varoufakis würde Merkel wählen - vielleicht Varoufakis lästert, Varoufakis lobt: In einem Interview hat Griechenlands Ex-Finanzminister über sein Verhältnis zu deutschen Spitzenpolitikern gesprochen. Dabei kommen Merkel und Schäuble gut weg - im Gegensatz zu Gabriel. Zur Hochzeit der Finanzkrise in Griechenland waren der deutsche Finanzminister Wolfgang Schäuble und sein damaliger griechischer Amtskollege Yanis Varoufakis nicht immer gut aufeinander zu sprechen. Mit etwas zeitlichem Abstand sieht die Sache aber offenbar anders aus. Er habe sich Schäuble damals sehr nah gefühlt, sagte Varoufakis im Interview mit dem \"Stern\". \" Wolfgang wollte mir noch nicht einmal die Hand geben\", zitiert das Magazin den im Juli zurückgetretenen Griechen. Er habe aber immer Respekt gehabt vor dem deutschen Minister. Sie seien \"wie zwei Boxer\" gewesen, \"die eine Weile Schläge ausgetauscht haben und sich dann einander näher fühlen als irgendeinem anderen Menschen\". Noch überraschender dürfte aber Varoufakis Aussage über Angela Merkel sein. Die Flüchtlingspolitik der Kanzlerin imponiere ihm. \"Vielleicht würde ich als Deutscher Merkel wählen\", sagte Varoufakis. Sigmar Gabriel dagegen sei der \"schlimmste Politiker, den ich getroffen habe\". Der SPD -Chef habe geäußert, man werde nicht die \"überzogenen Wahlversprechen einer zum Teil kommunistischen Regierung\" finanzieren. \"Auf der Grundlage der monatelangen Verhandlungen ist meine Überzeugung, dass der deutsche Finanzminister Griechenland aus der Währungsunion drängen will, um die Franzosen das Fürchten zu lehren und sie zu zwingen, sein Modell einer Zuchtmeister-Eurozone zu akzeptieren.\" (über Wolfgang Schäuble in einem Gastbeitrag für den \"Guardian\", 10. Juli 2015)  \"Ich fühle mich überragend  Ich muss nicht länger nach diesem hektischen Terminplan leben, der war absolut unmenschlich, einfach unglaublich. Ich hatte fünf Monate lang zwei Stunden Schlaf pro Nacht.\" (über die Zeit seit seinem Rücktritt im Interview mit dem \"New Statesman\", 13. Juli 2015)  \"Wir hatten die Wahl zwischen Exekution und Kapitulation. (...) Dieses Programm wird scheitern, egal wer sich um die Umsetzung kümmert. (...) Es ist bereits gescheitert.\" (über das neue Hilfsprogramm für Griechenland im BBC-Interview, 18. Juli 2015)  \"Wir haben Fehler gemacht, daran gibt es keinen Zweifel. (...) Man muss schon sehr eigensinnig sein, um zu sagen, dass man überhaupt keine Fehler gemacht hat. (...) Aber der Kern der Sache ist, dass die sehr mächtige Troika der Gläubiger nicht daran interessiert war, zu einer vernünftigen, ehrlichen und für beide Seiten nutzbringenden Übereinkunft zu kommen.\" (über die Verantwortung für die Eskalation des Schuldenstreits im CNN-Interview, 20. Juli 2015)  \"Die griechische Demokratie hat sich aufgelöst, wir haben, bezogen auf alle Auswirkungen in der vergangenen Woche, einen Staatsstreich erlitten.\" (über die Einigung im Schuldenstreit im Interview mit dem spanischen Sender Radio 4G, 21. Juli 2015)  \"Mein schlimmster Feind ist die Schuldenkrise, die unser Land zerstört und es unmöglich für uns macht, unsere Schulden zu begleichen, auch gegenüber Deutschland. Schäuble war immer sehr direkt und offen mit mir, aber wenn er mit den Medien über mich gesprochen hat, hat er kein gutes Wort über mich verloren. Das ist bestimmt etwas, das er möglicherweise bereut.\" (über das Verhältnis zu Wolfgang Schäuble im ZDF-Interview, 24. Juli 2015)  \"Ich schätze ihn, ich mag Wolfgang. Und er schätzt, glaube ich, meine Expertise.\" (über sein Verhältnis zum deutschen Finanzminister Wolfgang Schäuble (CDU) laut Vorabmeldung zur \"Stern\"-Ausgabe vom 30. Juli 2015)  \"Als ich drei Jahre alt war, fing ich an, Deutsch zu lernen. Und dann, während der Militärdiktatur habe ich heimlich unter der Decke mit meinen Eltern die Sendungen der Deutschen Welle angehört. Das war unsere Verbindung in die Freiheit.\"  (über seine Beziehung zu Deutschland laut Vorabmeldung zur \"Stern\"-Ausgabe vom 30. Juli 2015)  \"Heute brauchen Sie keine Panzer, um jemanden zu besiegen. Sie haben ihre Banken\"  (über seine Zeit als griechischer Finanzminister, zu der er sich wie inmitten eines Krieges gefühlt habe, laut Vorabmeldung zur \"Stern\"-Ausgabe vom 30. Juli 2015)  \"Die Medien haben mich von Anfang an als diesen Verrückten hingestellt, der den Deutschen ans Geld will.\"  (über sein Image in Deutschland laut Vorabmeldung zur \"Zeit Magazin\"-Ausgabe vom 30.07.2015) \"Nina Hagen war die Heldin meiner Jugend. Ich verehre Nina Hagen.\"  (über deutsche Musik laut Vorabmeldung zur \"Zeit Magazin\"-Ausgabe vom 30. Juli 2015)  \"Jemandem den Mittelfinger zu zeigen ist nicht meine Art.\"  (über die Irritationen zu dem Video, in dem er den Deutschen den Mittelfinger gezeigt haben soll, laut Vorabmeldung zur \"Zeit Magazin\"-Ausgabe vom 30. Juli 2015) \"Ich bin ein Außenseiter. Aber manchmal können nur Außenseiter wirklich erkennen, was schiefläuft, weil sie den nötigen Abstand haben.\" (über sich selbst laut Vorabmeldung zur \"Zeit Magazin\"-Ausgabe vom 30. Juli 2015)",http://www.spiegel.de/politik/ausland/yanis-varoufakis-laestert-im-interview-ueber-deutsche-politiker-a-1069024.html,2015-12-21T00:00:00.000Z
"Keine Zeit für Kontrollen Schwedische Staatsbahn stellt Zugverkehr mit Dänemark ein Schweden will den Zustrom von Flüchtlingen stoppen und verdonnert alle Verkehrsbetriebe zu Personenkontrollen. Die staatliche Bahn hat dafür keine Kapazitäten - und stellt Fahrten von und nach Dänemark ein. Die schwedische Bahngesellschaft SJ hat einen Stopp des Personenverkehrs von Dänemark in das Land angekündigt. Ab dem 4. Januar wird sie nicht mehr direkt von Stockholm nach Kopenhagen und zum dortigen Flughafen Kastrup fahren. Das Unternehmen teilte mit, die Mitarbeiter könnten es nicht leisten, alle Reisenden aus Dänemark zu kontrollieren, wie es die Regierung fordert. Betroffen seien rund fünf Verbindungen täglich in jede Richtung. Als Reaktion auf den anhaltend hohen Zustrom von Flüchtlingen nach Schweden sollen ab 2016 alle Passagiere in Zügen, Bussen und auf Fähren aus Dänemark und Deutschland kontrolliert werden. Das schwedische Parlament hatte vergangene Woche beschlossen, dass Verkehrsbetriebe gezwungen werden können, die Identität ihrer Reisenden zu überprüfen. Doch der Schnellzug, der Stockholm und Kopenhagen verbindet, ist zu schnell. \"Es ist nicht genug Zeit für Passkontrollen\", sagte SJ-Sprecherin Monica Berglund dem schwedischen Fernsehen SVT. Auch in Kopenhagen gebe es zwischen Ankunft und Abfahrt der Züge nicht genügend Zeit, um am Bahnsteig Personenkontrollen durchzuführen. Reisende in Richtung Kopenhagen sind deshalb aufgefordert, in Malmö in den Öresund-Zug zu wechseln, der von einer anderen Verkehrsgesellschaft betrieben wird. Die Fahrt dauert dann 30 Minuten länger. Das Unternehmen Øresundtåg, das den Pendlerdienst zwischen Schweden und Dänemark anbietet, erklärte, es werde ab dem 4. Januar den Verkehr im Berufsverkehr reduzieren, um ausreichend Zeit für die Personenkontrollen zu haben. Øresundtåg warnte bereits vor Verspätungen auf der Strecke.",http://www.spiegel.de/reise/aktuell/fluechtlinge-schwedens-staatsbahn-stoppt-zugverkehr-von-daenemark-a-1069018.html,2015-12-21T00:00:00.000Z
"Flüchtlinge Unionspolitiker wünschen sich Fotos von Abschiebungen Die Zahl der Abschiebungen hat in vielen Bundesländern stark zugenommen. Politiker von CDU und CSU hoffen jetzt auf mehr Bilder vom Vollzug - um Flüchtlinge abzuschrecken. Von Severin Weiland Christian O. Bruch/ laif Severin Weiland Severin Weiland, geboren 1963 in Wilhelmshaven/Niedersachsen. Verbrachte einen Teil seiner Kindheit und Jugend in Chile. Studium der Kommunikations- und Politischen Wissenschaft in München, Ausbildung an der Deutschen Journalistenschule München. Ab 1992 Redakteur im Lokalteil der \"tageszeitung\" in Berlin, später landespolitischer Korrespondent. Von 1996 bis 1999 Stellvertretender Ressortleiter Innenpolitik der taz. Sabbatjahr in Kathmandu, Nepal. Von Herbst 2000 bis Januar 2002 bundespolitischer Korrespondent der taz in Berlin. Seit Februar 2002 Parlamentskorrespondent im Berliner Büro von SPIEGEL ONLINE, seit dem 1. Mai 2004 Stellvertretender Leiter des Berliner Büros von SPIEGEL ONLINE. Ab Mitte Oktober 2014 politischer Korrespondent im Hauptstadt-Büro. E-Mail: Severin.Weiland@spiegel.de Twitter: @SeverinWeiland folgen Mehr Artikel von Severin Weiland Noch immer kommen täglich 4000 bis 5000 Flüchtlinge an die bayerische Grenze. Auch der Winter hat die Zahl nur unmerklich reduziert. Kürzlich erklärte ein hochrangiger CSU-Politiker in einer Journalistenrunde in Berlin: \"Wir brauchen in nächster Zeit auch mehr Bilder von Abschiebungen.\" Damit könnte eine \"abschreckende Wirkung\" unter jenen Flüchtlingen erzielt werden, die planten, sich auf den Weg nach Deutschland zu machen. Auch innenpolitisch wäre es ein wichtiges Signal, dass man tätig sei, so das CSU -Präsidiumsmitglied. Abschiebungen als Abschreckung - ein heikles Thema. Die Polizeibeamten, die sie durchführen müssen, kommen in der Regel in den frühen Morgenstunden, wenn die Menschen noch schlafen. Oft wehren sich die Betroffenen mit Händen und Füßen, nicht selten werden ganze Familien abgeschoben. Weinende und schreiende Kinder, verzweifelte Mütter und Väter - es ist kein Einsatz, um den sich die Beamten reißen. Doch die Abschiebung von abgelehnten Asylbewerbern gilt manchen Politikern als wichtiger Baustein einer sichtbar restriktiveren Flüchtlingspolitik. Der baden-württembergische CDU -Spitzenkandidat Guido Wolf etwa hatte jüngst auf dem Parteitag seines Landesverbandes gefordert, Wirtschaftsflüchtlinge schnell zurückzuführen, und hinzugefügt, man brauche jetzt \"Bilder von Flüchtlingen\", die abgeschoben werden. Bundesländer schieben vermehrt ab In der Tat haben die Abschiebungen zugenommen , wie jetzt aus der Statistik des Bundesinnenministeriums hervorvorgeht. Und das parteiübergreifend, selbst in Ländern, wo Grüne mitregieren: Das von der CSU regierte Bayern schickte demnach von Anfang Januar bis Ende November mehr als drei Mal so viele abgelehnte Asylbewerber (3643) zurück in die Heimat wie 2014 (1007). Auch im schwarz-grün regierten Hessen verdreifachte sich die Zahl nahezu - auf 2306, nach 829 im vergangenen Jahr. Im grün-rot regierten Baden-Württemberg verdoppelten sich die Abschiebezahlen im gleichen Zeitraum knapp: von 1080 auf 2140. Bis Ende November wurden bundesweit 18.363 Fälle gezählt, im gesamten Vorjahr gab es 10.884 Abschiebungen, meist sind es Menschen aus dem Balkan und aus Afrika. Syrer hingegen werden derzeit nicht in ihr vom Bürgerkrieg gezeichnetes Land abgeschoben. Unter Unionspolitikern werden die gestiegene Zahl der Abschiebungen mit Blick auf einen Abschreckungseffekt begrüßt. Dadurch werde \"auch gegenüber potenziellen Antragstellern signalisiert, dass es sich nicht lohnt, aus asylfremden Gründen einen Antrag zu stellen in der Hoffnung, bei einer Ablehnung dennoch bleiben zu können\", sagt der Vizechef der CDU/CSU-Bundestagsfraktion Wolfgang Bosbach . Sein Kollege Michael Kretschmer argumentiert: \"Es gibt sehr viele Bürger, die genau beobachten, ob bei abgelehnten Asylverfahren auch konsequent die Ausreise stattfindet.\" Nur wenn der Staat \"bei der Abschiebung konsequent vorgeht, können wir auf Dauer die Solidarität in der Gesellschaft erhalten\", sagt der sächsische CDU -Generalsekretär und Unionsfraktionsvize im Bundestag. Abschreckung - auch an der Außengrenze Hans-Peter Uhl , CSU-Bundestagsabgeordneter und als früherer langjähriger Kreisverwaltungsreferent der Stadt München mit Abschiebungen vertraut, sieht das anders. Seit der Öffnung der Grenzen für die Flüchtlinge im Sommer seien rund eine Million Menschen über den Balkan nach Deutschland gekommen. \"Was sind diese paar Tausend Abschiebungen von abgelehnten Asylbewerbern dagegen? Was bewirkt das? Nichts!\", sagt er. Uhl zählt seit Längerem in der Union zu den schärfsten Kritikern der Flüchtlingspolitik von Kanzlerin Angela Merkel (CDU). \"Abschiebungen sind der härteste Verwaltungsakt, den der Rechtsstaat kennt\", sagt Uhl. Die seelischen Belastungen seien für alle hoch - für Polizisten wie für Betroffene. \"Es ist humaner, den Menschen bei Grenzübertritt die Einreise zu verweigern, als sie zwei Jahre später mit Gewalt abzuschieben\", schlägt Uhl vor. Der Christsoziale setzt wie seine CDU-Kollegen auf Abschreckung - nur an einer anderen Stelle, außerhalb von Deutschland. \"Die Wanderungsbewegung auf der Balkanroute\", sagt Uhl, \"kann nur reduziert werden, wenn in einem abgestimmten Verfahren an den Grenzen der jeweiligen Staaten konsequent zurückgewiesen wird.\" Solche Bilder von Zurückweisungen an den Außengrenzen der EU, glaubt er, \"werden wirken\". Dann könnten etwa Schleuser, die mehrere Tausende Euro pro Fall verdienten, \"den Flüchtlingen nicht mehr vorgaukeln, dass sie ungehindert nach Deutschland gebracht werden\".",http://www.spiegel.de/politik/deutschland/fluechtlinge-unionspolitiker-fordern-mehr-bilder-von-abschiebungen-a-1068953.html,2015-12-21T00:00:00.000Z
"Integration von Flüchtlingen Ein langer Weg in den Job Unternehmen wie BASF, Daimler und SAP wollen Flüchtlinge einstellen. Doch fehlende Deutschkenntnisse und ein ungeklärter Aufenthaltsstatus sind oft große Hürden. Fünfzig Flüchtlinge nehmen seit sechs Monaten an dem \"Kennenlern-Programm\" des Chemiekonzerns BASF teil. Es soll ihnen eine Berufsorientierung geben, sie auf den Beruf oder auf eine Ausbildung vorbereiten. Aber bislang könne noch keiner der Flüchtlinge weder ein bezahltes Praktikum oder eine Ausbildung absolvieren, noch direkt einsteigen, sagt eine Sprecherin des Unternehmens. Der Aufenthaltsstatus der Flüchtlinge und das Arbeitsrecht seien große Hürden. Es gibt in Deutschland ein umfangreiches Regelwerk dafür, welche Flüchtlinge als Praktikanten, Leiharbeiter oder feste Mitarbeiter angestellt werden dürfen. Ob sie arbeiten können, hängt stark von ihrem Aufenthaltsstatus ab. Auch Sprachkenntnisse seien ein Problem, sagt die Sprecherin. Die neuen Mitarbeiter sollen erst in der Lage sein, die Sicherheitsvorschriften des Konzerns auch auf Deutsch zu verstehen. BASF plant derzeit noch nicht, eine weitere Gruppe von Flüchtlingen aufzunehmen. DPA Ein Flüchtling aus Syrien arbeitet beim Daimler-Konzern in Esslingen-Mettingen Beim Autobauer Daimler dagegen will man bis zum Sommer noch 300 weitere Praktikanten einstellen. Denn die Erfahrungen mit den 40 Flüchtlingen, die seit dem Herbst als \"Brückenpraktikanten\" bei dem Konzern arbeiten, sind gut. Fast alle hätten nach dem 14-wöchigen Programm einen Job angeboten bekommen, sagt ein Konzernsprecher. Manche bei Zeitarbeitsfirmen, andere bei Mittelständlern. Zwei Flüchtlinge sollen eine Ausbildung bei Daimler beginnen. Der Softwarekonzern SAP versucht seit vergangenem Jahr, hundert Flüchtlingen mit technischem Grundwissen einen Praktikumsplatz zu vermitteln. Sie sollen allerdings bereits einen Hochschulabschluss oder vergleichbare Qualifizierungen mitbringen. Bislang erhielten allerdings nur rund 40 von 150 Bewerbern eine Zusage. Auch die Deutsche Bahn setzt auf die Kompetenzen der Flüchtlinge: 15 berufserfahrene Flüchtlinge mit Erfahrung im Bereich Elektrotechnik bildet das Unternehmen seit November zu Elektronikern im Betriebsdienst aus. Das Programm dauert nur 28 statt sonst 42 Monate. Die ersten Erfahrungen seien gut, sagte ein Sprecherin. Deshalb will die Bahn das Programm für andere Berufe ausbauen, zum Beispiel Gleisbauer. \"Unterm Strich kommt dabei wenig raus\" Beim Deutschen Gewerkschaftsbund (DGB) sieht man diese Initiativen positiv. Annelie Buntenbach vom DGB-Vorstand hält Praktika für einen guten Berufseinstieg, weil Flüchtlinge und Firmen dadurch in Kontakt kämen. Allerdings dürften die Flüchtlinge beim Lohn nicht schlechter gestellt werden, mahnt die Gewerkschafterin. Die Organisation Pro Asyl reagiert skeptischer: \"Unterm Strich kommt dabei wenig raus\", sagt der stellvertretende Geschäftsführer Bernd Mesovic. Bundesagentur für Arbeit findet, es müsse noch viel getan werden, um Flüchtlinge in den Arbeitsmarkt zu integrieren. \"Die Masse kommt erst im zweiten Quartal und im zweiten Halbjahr auf uns zu\", sagt ein Sprecher. Die Behörde rechnet damit, dass Mitte des Jahres 130.000 Flüchtlinge als arbeitssuchend gemeldet sind, genaue Prognosen seien nicht möglich. Der Arbeitsmarkt könne theoretisch 350.000 Menschen aufnehmen. Den Fachkräftemangel, der vor allem in der Industrie und der IT-Branche drohe, könnten Flüchtlinge aber wohl erst langfristig lindern.",http://www.spiegel.de/karriere/erfahrungen-mit-fluechtlingen-in-der-arbeitswelt-a-1084789.html,2016-03-31T00:00:00.000Z
"Sorge vor Kriminalität Unionspolitiker warnen vor Visabefreiung für Georgier \"Asylmissbrauch und Verbrechen\": Politiker von CDU und CSU kritisieren die EU-Pläne zur Visabefreiung für Georgier. Flüchtlinge aus dem Land seien besonders in organisierte Kriminalität verstrickt. Politiker von CDU und CSU haben die von der EU-Kommission geplante Visabefreiung für Georgier in Frage gestellt. In der \"Bild\"-Zeitung begründeten die Fachpolitiker ihre Bedenken mit der Sorge vor steigender Kriminalität . \"Georgische Asylbewerber sind so stark in die organisierte Kriminalität verstrickt wie keine andere Ausländergruppe\", sagte der CDU-Bundestagsabgeordnete und Innenexperte Armin Schuster. \"Eine Visumsfreiheit würde diese Kriminalitätslage nur noch weiter verfestigen.\" Georgische Banden seien inzwischen die \"treibende Kraft bei der Wohnungseinbruchskriminalität in Deutschland \". Die EU-Kommission hatte die Visafreiheit für Georgien empfohlen. Bürger aus dem Land sollen ohne Visum in die Europäische Union reisen dürfen. Eine endgültige Entscheidung steht noch aus. Der CSU-Außenexperte Hans-Peter Uhl sagte, im Augenblick kämen für Georgien \"weder eine Visumsfreiheit noch eine Nato-Mitgliedschaft\" in Frage. \"Die Visumsfreiheit würde nur zu mehr unkontrollierter Einreise, mehr Asylmissbrauch und mehr Verbrechen führen\", warnte er. Laut Bundeskriminalamt ( BKA ) werden viele Einbrüche in Deutschland von Kriminellen aus Georgien verübt. Bei einer Nato-Mitgliedschaft Georgiens drohe Uhl zufolge zudem \"eine weitere Verschärfung des Konflikts mit Russland \". Die Bemühungen der EU, die Beziehungen zu ehemaligen Republiken der Sowjetunion zu stärken, werden von Moskau kritisch beobachtet. Anmerkung der Redaktion: In einer früheren Version dieses Artikels hieß es basierend auf einer Meldung der Nachrichtenagentur AFP, \"die meisten\" Einbruchserien in Deutschland würden von Georgiern verübt. Das ist nicht korrekt. Laut BKA handelt es sich um viele Einbrüche.",http://www.spiegel.de/politik/ausland/georgien-politiker-von-cdu-und-csu-warnen-vor-visabefreiung-a-1096000.html,2016-06-06T00:00:00.000Z
