article,article_url,date
"Hungerkatastrophe im Südsudan Im Sumpf des Todes Der Weiße Nil versorgt im Südsudan eines der größten Sumpfgebiete der Erde mit Wasser. Das Areal bietet Zehntausenden Flüchtlingen Schutz vor dem Bürgerkrieg - und ist zugleich eine tödliche Falle. Von Christoph Titz Jeannette Corbeau Christoph Titz 1981 in München geboren. Studierte Journalistik, Politik, Soziologie und Geschichte in München, im dänischen Århus und in Utrecht in den Niederlanden. Ausbildung an der Deutschen Journalistenschule in Print, Fernsehen und Hörfunk. Seit Sommer 2008 für Bildungsberichterstattung bei SPIEGEL ONLINE. Ab 2011 stellvertretender Ressortleiter, seit Mai 2014 Ressortleiter UniSPIEGEL und SchulSPIEGEL. Ab Mai 2015 stellvertretender Ressortleiter. Seit Januar 2016 Redakteur im Politik-Ressort mit Schwerpunkt Afrika. E-Mail: Christoph.Titz@spiegel.de Twitter: @chrtitz folgen Facebook: Zum Profil google+: Zum Profil Mehr Artikel von Christoph Titz Seit einem Monat herrscht wegen des Bürgerkriegs im Südsudan die schwerste humanitäre Krise Afrikas seit vielen Jahren . In der aktuellen Hungersnot sterben Menschen, weil sie nichts zu essen haben. Jeden Tag, trotz aller Bemühungen. Eine solche Katastrophe geschieht auf der Welt im 21. Jahrhundert nur, wenn Gewalt und Unterversorgung zusammenkommen . Im südsudanesischen Bundesstaat Unity sind in den vergangenen vier Wochen Dutzende Menschen verhungert, alle internationalen Appelle an die Regierung in Juba haben nichts bewirkt. \"Gräueltaten bleiben ungestraft\", kritisierte Uno-Generalsekretär António Guterres in der Sitzung des Sicherheitsrats den Südsudan. Die Regierung des nordafrikanischen Landes zeige \"keine ernste Besorgnis\" über die Krise und über die Hungersnot. Stattdessen geht es weiter wie seit drei Jahren: Krieg, Flucht und Vertreibung, Entführungen, Tod. Seit 2013 tobt ein Bürgerkrieg um die Ressourcen des erst 2011 gegründeten Südsudan. Die Hauptgegner sind die Männer des Präsidenten Salva Kiir und die Milizen seines ehemaligen Vize-Präsidenten Riek Machar. Zehntausende sind gestorben, Millionen mussten fliehen. Wenn im Mai die Regenzeit beginnt und die Kämpfe dann weitergehen, wird schon bald die Hälfte des südsudanesischen Volkes vom Hungertod bedroht sein. Betroffen seien 5,5 Millionen Menschen, warnen internationale Helfer und die Uno seit Wochen. SPIEGEL ONLINE Das Horrorszenario gilt für das ganze Land - doch die auf der Uno-Katastrophenkarte dunkelrot eingefärbten Regionen Mayendit und Leer haben mit mehreren Härten zugleich zu kämpfen: Hier toben Kämpfe, und hier sind mehr als 100.000 Menschen in ein Gebiet geflohen, in dem man eigentlich nicht leben kann. Ein Sumpfgebiet so groß wie Belgien Der Sudd ist ein riesiges Sumpfgebiet, in der Regenzeit ist eine Fläche so groß wie Belgien überschwemmt. Die Wassermassen des Weißen Nil strömen aus Uganda ins Land und ergießen sich dann in die weite Ebene im Bundesstaat Unity. AFP Sudd-Sumpfgebiet an der Grenze zwischen Unity und Jongelei im Südsudan Im Bürgerkrieg bieten die Sümpfe etwas Schutz, weil mordende Milizen und Regierungstruppen die eigentlich unbewohnten Inseln in der nassen Landschaft meiden. Aber der Sumpf ist auch eine Todesfalle, weil es dort kein Essen, kein Trinkwasser und keinerlei Versorgung gibt. An seinen Rändern marodieren Rebellen und die Horden der Regierungsarmee, nichts ist vor ihnen sicher. Krankenstationen wurden in den vergangenen Jahren mehrfach eröffnet und wenig später wieder geplündert und zerstört. Die Helfer von Ärzte ohne Grenzen sind dazu übergegangen, lokale Helfer auszubilden, die dann mit den Flüchtlingen in den Sümpfen leben. So riskieren die Mitarbeiter und Patienten nicht, auf dem Weg zur Behandlung erschossen zu werden - in Gesundheitszentren, die über kurz oder lang ohnehin wieder Milizen zum Opfer fallen. Die britische Hilfsorganisation Oxfam, die in den Sümpfen rund 5000 Menschen mit dem Nötigsten versorgt, darf nicht sagen, was genau die Menschen durch die Kämpfer erdulden müssen und wer genau am Rand der Sümpf warum auf wen schießt. Zu groß die Gefahr, selbst zum Ziel zu werden und dann nicht mehr helfen zu können. \"Die Flüchtlinge, die hier auf den eigentlich unbewohnbaren Inseln leben, erzählen uns, sie seien vor Gewehrkugeln geflohen\", sagt Oxfam-Mitarbeiterin Dorothy Sang. Wer die Kugeln auf wen und warum abgefeuert hat, will die Nothilfe-Managerin nicht sagen. Die Frontlinie verlaufe durch die Regionen, in denen die Hungersnot ausgerufen wurde. Vor einer Woche ist Sang selbst so weit in die Sümpfe gefahren, wie es sicher war. \"Die Menschen dort essen Seerosen. Einige fischen, aber die meisten haben nichts und sind in akuter Not.\" Außer mit Kanus käme man in der Gegend nicht voran, die Menschen auf der Flucht wateten bis zur Hüfte oder bis zum Hals durch das Wasser, um eine der Inseln zu erreichen. Cholera, Malaria und andere Krankheiten durch verschmutztes Wasser oder Mücken sind für die geschwächten Menschen eine ständige Gefahr. Nichts läuft - außer 130.000 Barrel Öl am Tag Dass die Kämpfe kein Ende nehmen, liegt an der Gier der Kriegsparteien. Der Sentry Report legte im vergangenen Jahr nahe, dass der Krieg auch darum weitergeht, weil er ein einträgliches Geschäft für die Warlords aller Seiten - einschließlich des Präsidenten - ist . Der Report wird vom Hollywoodschauspieler George Clooney und dem Menschenrechtsaktivisten John Prendergast finanziert. Unter der Erde des Bundesstaats Unity lagert Öl. Wer die Region an der Grenze zum Sudan beherrscht, kriegt die Quellen und die Einnahmen, denn auch wenn sonst nichts im Land funktioniert: Das Öl fließt und wird verkauft. Laut der chinesischen Agentur Xinhua verkauft der Südsudan 130.000 Barrel am Tag, 98 Prozent der Einnahmen des Landes stammten demnach aus dem Ölgeschäft. Nicht nur Helfer, auch Mitarbeiter der Ölfirmen sind in Gefahr. Denn auch wer gerade nicht die Förderstellen kontrolliert, will sich bereichern: Im März entführten Rebellen laut Regierungsangaben acht Mitarbeiter eines chinesisch-malaysischen Ölunternehmens und verlangten einen Million US-Dollar Lösegeld. Juba reagierte schnell, Präsident Salva Kiir ordnete militärischen Schutz für Ölarbeiter und Raffinerien an, meldete die chinesische Agentur Xinhua. Aus dem Versprechen von Präsident Kiir, gegen den Hunger zu helfen und Hilfsorganisationen den Zugang zu erleichtern, ist hingegen nichts geworden. Und auch international ist noch immer nicht so richtig realisiert worden, was sich im Südsudan und anderen Krisenherden im Norden Afrikas und dem arabischen Raum an Katastrophen anbahnt. Uno-Boss Guterres appellierte Mitte Februar, diese Regionen benötigten bis Ende März dringend vier Milliarden Euro Hilfe. Zugesagt wurden bislang gerade einmal zehn Prozent.",http://www.spiegel.de/politik/ausland/hunger-im-suedsudan-im-sumpf-des-todes-a-1140393.html,2017-03-25T00:00:00.000Z
"60 Jahre Römische Verträge \"Wir brauchen Europa\" Die Europäische Union feiert Geburtstag: Vor 60 Jahren wurden die Römischen Verträge unterzeichnet. Was verbinden die Menschen heute mit Europa? Eine Umfrage in Berlin. Von Sophie Krause und Hans-Christian Plambeck (Fotos) Es war die Geburtsstunde der Europäischen Union: Heute vor 60 Jahren, am 25. März 1957, unterzeichneten Vertreter der Regierungen Belgiens, der Niederlande, Luxemburgs, Deutschlands, Frankreichs und Italiens die Verträge zur Europäischen Wirtschaftsgemeinschaft (EWG) und der Europäischen Atomgemeinschaft (EAG) in Rom. Das Jubiläum der Römischen Verträge wird groß gefeiert. EU-Staats- und Regierungschefs kommen am Samstag in der italienischen Hauptstadt zu einem Sondergipfel zusammen. In Berlin findet ein Bürgerfest statt, in München ist ein Festakt in der Pinakothek der Moderne geplant. Schönwetter in Krisenzeiten: Großbritannien will die Union verlassen, in vielen Mitgliedstaaten sind Rechtspopulisten auf dem Vormarsch. Der Süden Europas ist von Arbeitslosigkeit und Wirtschaftskrise gebeutelt, außerdem erschütterte die Flüchtlingskrise die Beziehungen der Mitgliedstaaten. SPIEGEL ONLINE hat sich auf Berlins Straßen umgehört: Was verbinden die Menschen heute mit der EU? Viele der Befragten stehen Europa wohlwollend gegenüber. Aber: Einige Menschen lehnen das Gespräch strikt ab oder haben es plötzlich ganz eilig, wenn sie auf Europa angesprochen werden. So bleiben die meisten EU-Kritiker ungehört, während die EU-Enthusiasten umso überzeugter sind.",http://www.spiegel.de/politik/ausland/60-jahre-roemische-vertraege-umfrage-was-bedeutet-europa-heute-a-1140004.html,2017-03-25T00:00:00.000Z
"Billionaires Beach in Malibu Kloake der Superreichen Am Carbon Beach wohnt die schwerreiche Elite Hollywoods. Ihre Häuser haben keinen Anschluss an die Kanalisation, manchmal läuft das Schmutzwasser ins Meer - so wird eine Lagune zur Kloake de luxe. In Malibu untergetaucht sind Brigitte Steinmetz und Christine Kruttschnitt Im Cafe Habana Malibu feiern Promis wie Sting, Kate Hudson und die Kardashians gern Geburtstage und Familienfeste, aber auch an eher ruhigen Tagen sieht man den Chef des Hauses mit der glamourösen Gattin über Chips und Salsa abhängen: Nightlife-Zampano Rande Gerber, verheiratet mit Amerikas beliebtestem Schönheitsfleck Cindy Crawford. Er hat das mexikanisch-kubanische Restaurant im Einkaufszentrum von Malibu zum \"kleinen Klubhaus für die Einheimischen\" deklariert, weil es - samt Solardach und Bio-Küche - voll zum Umfeld passt. Denn wie Malibu selbst, jenem starbestückten Strandstreifen vor Los Angeles, sei seine Surfer-Bar \"high profile, but low key\", also voller Großverdiener, die auf kleine Leute machen. George Clooney hat hier im Mai 2014 seine Verlobung mit Amal gefeiert: erstens, weil er und Gerber alte Kumpel sind, und zweitens, weil der Tequila aufs Haus ging. Sorry für die Verspätung! Aber natürlich war Stau auf dem Pacific Coast Highway, zum Kotzen. Aber du siehst auch blass aus. Mir geht's nicht gut. Ah, das Schnäpschen, das du da süffelst, ist Underberg? \"Casamigo\", der Tequila, den George und Rande aus Mexiko importieren. Ich muss meine Eingeweide ausbrennen, hab zu viel Wasser geschluckt beim Surfen. Andere machen Solekuren um zu entgiften, und du kippst gleich noch Fusel hinterher. Du verstehst nicht. Es ist nicht das Salzwasser, es sind die Zusatzstoffe. Ich trank aus Barbra Streisands Toilette, ich schluckte Pamela Andersons Pipi. Verstehe ich tatsächlich nicht. Haben die keinen Pool, in den sie pinkeln können? Doch, das ist ja das Problem. Sie haben einen cesspool . Zu deutsch auch: Sickergrube. Das Klärsystem aus der Donnerbalken-Ära ist immer noch Standard in den meisten Villen hier. Auch am Billionaire's Beach, wo die richtig Reichen residieren. Wenn es so regnet wie bei uns in den letzten Wochen, laufen die Gruben unter ihren Designerhäusern über, und die ganze Soße ergießt sich in meine Welle. Oh, shit. Ich dachte, dieses unappetitliche Thema ist schon seit Jahren vom Tisch. Gab es nicht sogar Proteststürme gegen Malibus Kloakenwirtschaft an deinem Surfrider Beach? Du meinst den \" Polio Pond \" ? So heißt die Lagune bei Kennern. Aber wenn das so weiter geht, wird sie in ein paar Jahren nur noch sepiabraune Erinnerung sein. Malibu, wie wir es kennen und es uns krank macht, wird bald von einer großen Kläranlage saniert. Na sauber! Ich weiß nicht, ob ich darüber lachen oder weinen soll. Bevor du ins Detail gehst, brauche ich eine Unterlage. Kellner, se ñ or, por favor ? ( Kellner, kurz, breit, mit Nacken-Tattoos und rasierter Glatze, bringt eine Karaffe Wasser mit zwei Gläsern ): ¿Quieres un caballito? Danke, nein, keinen Kaba, ich dachte eher.... Was, wie lange lebst du in L.A. und hast immer noch keine Grundkenntnisse des Spanischen?! Caballito , einen Kurzen! No, gracias, se ñ or , wir dachten an etwas Gesünderes. (Kellner, strahlend): Ah, Vitamine! Margaritas, Chips und Guac? Hervorragende Idee. Muchas gracias ! Olé, olé. Was? Was guckst du mich so an? Bin ich dir peinlich? Ich frage mich nur, weshalb du so begierig in seiner Heimatsprache radebrechst. Weil ich ihm zeigen möchte, dass wir weltoffene Gäste sind, denen es völlig wurscht ist, ob er sich illegal in diesem Land aufhält. Das ist es, was du glaubst? Dass er ein Illegaler ist? Ich habe keine Ahnung. Ist ja nicht unwahrscheinlich - mehr als zehn Prozent der gesamten Bevölkerung im Los Angeles County haben keine Papiere. Was du alles weißt. Das ist nicht neu, das ist nur ein Thema, weil Trump die Braunen eifrig zu Sündenböcken für die Unzulänglichkeiten seiner Wähler macht. Drei Viertel aller \" Undokumentierten \" leben seit mehr als zehn Jahren hier, und keinen juckt ' s. Mein Gärtner ... ...dein Gärtner! Entschuldige, aber ich kann die Bäume nicht alleine beschneiden, neulich erst wieder bin ich von der Leiter gefallen . Schon gut, schon gut, hör auf zu stottern, ich meine ja nur. Also: DEIN Gärtner? Ich will nur sagen: Seine Kinder sind hier geboren, der Älteste will studieren - und ich habe keine Ahnung, ob Trump die Familie nicht demnächst auseinanderreißt und die Alten über die Grenze abschiebt. Malibu ist Zufluchtsstadt. Du meinst: für Barbra und andere Kanalisationsflüchtlinge? Ja, das auch. Aber kürzlich hat sich Malibu ganz offiziell zur \"Sanctuary City\" erklärt. Hast du nicht gehört? Mit halbem Ohr. Die Sheriffs hier haben beschlossen, die Anweisungen vom Rumpelstilzchen im Weißen Haus zu ignorieren. Der hat bekanntlich die Einwanderungsbehörden dazu verdonnert, \"Illegal Aliens\" samt und sonders abzuschieben. Die Bürgermeister und Polizeichefs von \"Sanctuary Citys\" aber sagen: ausweisen nur, wenn ein Haftbefehl vorliegt. Cops gegen Immigration Officers - oh weia. Ich hab gerade gehört, in L.A. wäre jeder Dritte von diesen Deportationen betroffen, direkt oder indirekt. Das wäre das Ende von La-La-Land. (Kellner platziert zwei Brausegläser Margaritas sowie Avocado-Mus im Schälchen): Verzeihung, darf ich gleich abrechnen? Ich muss den Bus kriegen. Aber ciertamente! Hier, meine tarjeta de crédita . - Hast du gehört, er nimmt den Bus. Malibu ist so grün! (schnaubt): Das ist der Nanny-Express. Hab' ich mal eine Reportage drüber gemacht. Klingt schlüpfrig. Ist dir noch nie die einsame Bushaltestelle oben am Highway 1 aufgefallen? Ich dachte, die ist ein Relikt von früher. Richtig, früher, anno L.A. Riots. Als 1992 die Hütten in South L.A. brannten, brachten Expressbusse die Nannys, Butler und Köche aus den Armenvierteln direkt nach Malibu, damit nur ja der Service während der Rassenunruhen nicht abriss. Was für eine psychologische Talfahrt das sein muss. Schlimmer als Oben und Unten in Downton Abbey. Wenigstens sind die Armen in der Strandenklave sicher! Glaub' doch nicht, dass die in Malibu sich zum Zufluchtsort erklären, weil sie so immigrantenfreundlich sind. Die haben nur Angst, ihr Personal zu verlieren. In der Zeitung klagte ein Malibunese: \"Keines unserer Häuser würde geputzt!\" Apropos schamlose Eliten, kommt dir die Blondine da drüben nicht bekannt vor? Warte, wenn gleich Paparazzi auftauchen, handelt es sich um Nicolette Sheridan von den \"Desperate Housewives\". Die ist seit Jahren sehr verzweifelt. Neulich sah ich sie oben ohne aus der Umkleidekabine bei James Perse kommen. Ist das der T-Shirt-Laden da drüben? Ja, immer, wenn sie länger nicht in den Klatschspalten auftaucht, macht sie sich dort frei. Und wird nicht wegen \" indecent exposure \" verhaftet? Iwo, Malibu hat seinen Bewohnern schon immer eine Extrawurst gebraten. Entschuldige die Vision. Wirst du schon wieder unappetitlich? Naja, der Grund, weshalb sich Malibu 1991 als eigenständige Stadt von Los Angeles absonderte, war nun mal allein die Weigerung ihrer Bewohner, sich modernen Abflussgesetzen zu unterwerfen. Sie wollten ihre Sickergruben behalten. Aber warum nur? Die reichsten der Reichen behaupten: um den dörflichen Charakter der Millionärskolonie zu wahren. Wo es keine Kläranlage gibt, ist kein Platz für Hotels und Mega-Shopping-Center. Das ist doch relativ redlich . Ich kenne drei Surfer, die dank langjährigen Bakteriengenusses aus den Abwässern der redlichen Dorfgemeinschaft am Surfrider Beach heute Herzschrittmacher tragen. Staphylokokken-Infektion! Dörflich kann ich das sowieso nicht nennen, wenn ich wegen riesiger Baustellen stundenlang im Stau sehe. Das ist leider der Preis für die Sauberkeit: In spätestens zwei Jahren muss sogar Barbra ihre Sickergrube zuschütten. Seit 2015 der Kloaken-Krieg beendet wurde, darf schamlos gebaut werden. Nobu, der Promi-Japaner hier, hat gerade ein Ryokan auf jungfräulichem Sand errichtet, und unser abgeschrabbeltes Surfer-Klubhaus wird auch zum Boutique-Hotel umgemodelt. Überall Klos! Gut für Touris, kann ich nur sagen. Du träumst. Billionaire's-Beach-Bewohner sind doch nicht wild darauf, Touristen in ihr ganz persönliches \"Sanctuary\" zu lassen. 19 der 29 sogenannten öffentlichen Zugänge zum Strand sind verbaut und unpassierbar. Dieser Oracle-Boss Larry Ellison zum Beispiel hat den halben Strand aufgekauft und dabei gleich die Treppen fürs Fußvolk abreißen lassen, angeblich, um sie zu renovieren. Seitdem traut sich keiner mehr ans Wasser. Ich bin mal vom Strand einfach durch den Sand hochmarschiert zur Villa von Bruce Willis. Teufelin. Da hast du das Gesetz gebrochen: Die Hochwasserlinie markiert nämlich die Grenze zum Privatgrundstück. David Geffen stellt gern Wachmänner vor seine Sandburg, die aufpassen, dass die verhassten Strandläufer immer nasse Füße behalten. Bruce war gar nicht zu Hause. Die meiste Zeit ist keiner zu Haus. Das sind ja nur Zweit- oder Drittvillen. Ach. Und worauf trinken wir jetzt? Auf die Große Freiheit!",http://www.spiegel.de/stil/billionaires-beach-in-malibu-kloake-der-superreichen-a-1143134.html,2017-04-23T00:00:00.000Z
"AUS DEM SPIEGEL Ausgabe 17/2017 Straftaten von Zuwanderern Angst und Zahlen Diebstähle und Schwarzfahren - die Kriminalität bei Zuwanderern ist im vergangenen Jahr gestiegen. Statistisch gesehen ist das Risiko jedes Einwohners, mit Straftaten konfrontiert zu werden, trotzdem gesunken. Wie passt das zusammen? Von Matthias Bartsch und Jörg Diehl Matthias Bartsch Jahrgang 1964. Ausbildung an der Deutschen Journalistenschule in München (1986-88), dann Magister-Abschluss in Germanistik, Geschichte und Politik. Nach kurzen Ausflügen zu Radio und TV seit 1992 Redakteur bei der \"Frankfurter Rundschau\", ab 1999 Korrespondent für Landespolitik. Seit 2005 beim SPIEGEL, Korrespondent für das Deutschland-Ressort und Büroleiter in Frankfurt am Main. E-Mail: Matthias.Bartsch@spiegel.de Mehr Artikel von Matthias Bartsch Jörg Diehl Jahrgang 1977. Studierte Geschichte, Germanistik und Politikwissenschaft an der Universität Münster. Freie Mitarbeit und Praktika unter anderem bei der \"Rheinischen Post\", der Deutschen Presse-Agentur, dem Westdeutschen Rundfunk, \"Bild\" und SPIEGEL. Volontierte beim Norddeutschen Rundfunk und schrieb anschließend als Redakteur erst für SPIEGEL ONLINE, dann für \"Bild am Sonntag\". Seit April 2007 wieder bei SPIEGEL ONLINE, von Januar 2009 bis Februar 2011 stellvertretender Ressortleiter Panorama, anschließend Korrespondent in Düsseldorf. Seit Mai 2014 Chefreporter. Seit Juli 2017 zudem Leiter des Teams Hintergrund und Recherche. E-Mail: Joerg.Diehl@spiegel.de Twitter: @spondiehl folgen PGP: Öffentlichen Schlüssel herunterladen Fingerprint: A253 20AC 5B3A 7AA2 3DAF D82F 8712 E7D4 F034 014B Mehr Artikel von Jörg Diehl Es ist ein jährliches Ritual der Bundespolitik, aber diesmal könnte die Aufmerksamkeit besonders groß sein, denn im September wird gewählt. Und wenn CDU-Innenminister Thomas de Maizière am Montag die neue Kriminalstatistik vorstellt, wird es auch um ein Thema gehen, das diese Wahl beeinflussen kann: Wie sicher ist das Land? Wie kriminell sind Zuwanderer? Dieser Artikel ist aus dem SPIEGEL Heft 17/2017 Todesspiel Donald Trump und Kim Jong Un riskieren den Atomkrieg Digitale Ausgabe | Gedruckte Ausgaben | Apps | Abo Es gibt schon Zahlen, erhoben von den 16 Bundesländern, die der SPIEGEL zusammengeführt hat: Danach ist die Zahl aller in Deutschland registrierten Straftaten leicht gestiegen - von 6,33 Millionen auf 6,37 Millionen. Andererseits leben viel mehr Menschen im Land, vor allem, weil so viele Zuwanderer kamen. Mitarbeiter des Statistischen Bundesamtes schätzen, dass Deutschland jetzt 82,8 Millionen Einwohner hat, ein historischer Höchststand. Dass mehr Menschen auch mehr Gesetzesverstöße begehen, liegt nahe. Zudem kann man aus der Gesamtzahl der Straftaten viele Zählfälle herausrechnen, etwa Zigtausende Routineanzeigen wegen illegalen Grenzübertritts von Flüchtlingen: Solche Verfahren werden fast immer eingestellt, sobald die Migranten Asylanträge stellen. Ohne ausländerrechtliche Verstöße bleiben nach den Länderzahlen noch etwa 5,88 Millionen Straftaten der sogenannten \"allgemeinen Kriminalität\" übrig. Das wären weniger als im Jahr 2015. Statistisch gesehen wäre das Risiko jedes Einwohners, mit Straftaten konfrontiert zu werden, trotz Zuwanderung gesunken. Dieser nüchterne Befund steht im Widerspruch zu dem, was viele Bürger fühlen, nämlich Angst. Tatsächlich finden sich in den Spalten der neuen Kriminalstatistiken auch viele Daten, die eine neue Debatte über Kriminalität und die Folgen der Zuwanderung auslösen können. Im vergangenen Jahr habe sich eine \"deutliche Zunahme\" der \"durch Zuwanderer begangenen Straftaten\" abgezeichnet, schrieb das Bundeskriminalamt (BKA) schon vor einigen Wochen in einem Bericht. Den Flüchtlingen wurden laut BKA größtenteils Vermögens- und Fälschungsdelikte vorgeworfen, es ging vor allem ums Schwarzfahren. Aber auch Diebstähle und Gewalt machten jeweils etwa ein Viertel der registrierten Fälle aus. Die Opfer waren häufig andere Flüchtlinge in Sammelunterkünften. Auch mehrere Bundesländer wiesen in den vergangenen Wochen und Monaten auf teilweise rasant gestiegene Kriminalitätszahlen bei Zuwanderern hin - sie interpretierten sie allerdings unterschiedlich. In den Asylbewerberunterkünften seien mehr als doppelt so viele Straftaten registriert worden wie 2015, klagte Bayerns CSU-Innenminister Joachim Herrmann . Über 500-mal wurde in seinem Land wegen Verdachts auf Sexualdelikte gegen Zuwanderer ermittelt. In Baden-Württemberg hieß es, 2016 sei etwa jeder zehnte Tatverdächtige im Ländle ein Flüchtling oder Asylbewerber gewesen. 60 Prozent der Körperverletzungen, bei denen Flüchtlinge als Tatverdächtige gelten, seien in Asylheimen begangen worden. Doch das bedeute auch, dass 40 Prozent der Taten außerhalb der Unterkünfte passiert seien, rechnete der Stuttgarter Innenstaatssekretär Martin Jäger (CDU) vor. Der niedersächsische Innenminister Boris Pistorius (SPD) verwies dagegen auch auf statistische Effekte: Im vergangenen Jahr hätten sich mehr Flüchtlinge ganzjährig im Land aufgehalten als 2015. DER SPIEGEL Polizeiliche Kriminalstatistiken sind umstritten. Ihre Aussagefähigkeit ist schon deshalb begrenzt, weil dort nur solche Taten und Tatverdächtige abgebildet werden, um die sich die Polizei gerade kümmert. Die gesammelten Daten sind verzwickt und auslegungsfähig, auch Fachleute vertun sich dabei schnell mal. So kommentierte eine Sprecherin des Bundesinnenministeriums im Juni 2016 einen Zwischenstand des BKA-Lageberichts mit den Worten: \"Zuwanderer sind nicht krimineller als Deutsche.\" Der griffige Satz schaffte es sofort in die Überschriften vieler Zeitungen. Allerdings deckten die BKA-Zahlen diese Aussage überhaupt nicht - ebenso wenig wie das Gegenteil. Die Polizeistatistiker hatten einen Vergleich zwischen einheimischer Bevölkerung und Zuwanderern gar nicht gemacht, er ist methodisch fragwürdig. Schon der Begriff \"Zuwanderer\" wird in den Ländern unterschiedlich definiert. Ausländische Profieinbrecher können schon in diese Rubrik geraten, wenn sie nur kurz zu Raubzügen nach Deutschland kommen und bei einer Kontrolle pro forma einen Asylantrag stellen. Statistisch knifflig wird die Sache auch, weil von den rund 1,2 Millionen Asylsuchenden, die in den vergangenen beiden Jahren kamen, etwa ein Drittel junge Männer unter dreißig waren - eine Gruppe, die statistisch besonders häufig kriminell wird. Zudem bringen kleine Gruppen das Bild in Schieflage. Das BKA schrieb in seinem Lagebericht, dass nur 2 Prozent der Zuwanderer aus den nordafrikanischen Staaten Tunesien , Algerien und Marokko stammten. Sie stellten aber 22 Prozent der Tatverdächtigen aus der Zuwanderergruppe. Und Georgier machten nur 0,6 Prozent der Zuwanderer aus, stellten aber 5 Prozent der Verdächtigen. Die Täter würden teils gezielt für Diebstähle angeworben und beantragten dann Asyl, heißt es in einer weiteren Analyse des Amtes. Für echte Flüchtlinge sind das keine guten Nachrichten. Die Intensivtäter verderben die Statistik.",http://www.spiegel.de/spiegel/kriminalstatistik-was-die-zahlen-ueber-straftaten-von-zuwanderern-wirklich-aussagen-a-1144321.html,2017-04-23T00:00:00.000Z
