article,article_url,date
"Nahost Peres entwirft neuen Friedensplan Der israelische Außenminister Schimon Peres hat angesichts der immer weiter eskalierenden Gewalt in den Palästinensergebieten einen eigenen Friedensplan entworfen. Der Plan könnte für den Fall in Kraft treten, dass die Koalition mit dem rechten Likud-Block von Ministerpräsident Ariel Scharon zerbricht. REUTERS Israelische Soldaten bei Hebron im Westjordanland Jerusalem - Es gilt als sicher, dass Scharon den Plan ablehnt, der unter anderem den vollständigen Abzug Israels aus dem Gazastreifen und die Räumung aller dort gebauten jüdischen Siedlungen vorsehe, erklärte ein Sprecher von Peres.  Die Palästinenser könnten nach dem Plan einen unabhängigen, aber entmilitarisierten Staat gründen, zu dessen Größe jedoch nach Angaben der israelischen Tageszeitung \"Maariv\" bislang nichts bekannt ist. Die endgültige Lösung der umstrittenen Frage des künftigen Status von Jerusalem würde jedoch um eine von beiden Seiten vereinbarte Zeit verschoben. Bis dahin sollten laut Plan beide Seiten ihre jeweiligen heiligen Stätten in der Altstadt selbst verwalten.  Kommission soll Flüchtlingsfrage klären Um die Sicherheit zwischen beiden Seiten zu gewährleisten, schlägt Peres die Einrichtung einer gemeinsamen Kommission vor. Ein Komitee unter der Teilnahme von den Vereinten Nationen, der Europäischen Union, der USA und Russlands soll die Frage der Rückkehr palästinensischer Flüchtlinge und ihrer Entschädigung klären, heißt es in dem Bericht weiter. Israel und das neu geschaffene Palästina würden darüber hinaus Verträge über wirtschaftliche Zusammenarbeit sowie zur Lösung der gravierenden Umweltprobleme der Region schließen.  AP Schimon Peres bemüht sich weiter um eine friedliche Lösung in Nahost Peres und Palästinenserpräsident Jassir Arafat werden voraussichtlich am Freitag in Madrid zusammentreffen. Die beiden Politiker hatten sich bereits am 26. September getroffen und eine Waffenruhe ausgehandelt, die bis zur Ermordung des israelischen Tourismusministers Rechawam Seewi vor zwei Wochen auch weitgehend gehalten worden war.   Die israelischen Truppen halten weiterhin mehrere große Städte im Westjordanland besetzt oder umzingelt. In der Nacht zu Dienstag drangen Soldaten vorübergehend in palästinensisch kontrolliertes Gebiet im Flüchtlingslager Dir el Balach im Gazastreifen ein. Zuvor hatten militante Palästinenser von dort Mörsergranaten auf jüdische Siedlungen abgefeuert. Ein Treffen von Sicherheitsbeamten Israels, der Palästinenser und der USA war am Montagabend in Tel Aviv ohne Vereinbarungen über einen weiteren israelischen Truppenrückzug aus den autonomen Palästinenserstädten zu Ende gegangen.",http://www.spiegel.de/politik/ausland/nahost-peres-entwirft-neuen-friedensplan-a-165301.html,2001-10-30T00:00:00.000Z
"Deserteure Wohin mit dem Gefangenen-Heer? Die Iraker desertieren in Massen, eine komplette irakische Heeresdivision mit 8000 Mann soll sich nach US-Berichten bereits ergeben haben. Die Kriegsgefangene stellen die alliierten Truppen vor neue Herausforderungen: Die Trupps werden einfach zusammengetrieben und mit Stacheldraht eingezäunt. REUTERS US-Marines haben bei Umm Qasr Gefangene gemacht New York - Noch sind die Meldungen widersprüchlich, genaue Zahlen lassen sich schwer ermitteln: Fest steht, dass irakische Truppen in Massen ihre Waffen strecken. Manche legen einfach ihre Uniformen ab und verschwinden, andere geraten in Gefangenschaft - und werden damit zu einem logistischen Problem für die voranstürmenden Alliierten. Eine dauerhafte Lösung für deren Unterbringung gibt es noch nicht. Die Angreifer behelfen sich derzeit mit Provisorien. Nach Angaben des Pentagon ergab sich im Südirak die 51. irakische Infanteriedivision mit 8000 Mann und 200 Panzern. Dies wurde von Bagdad jedoch dementiert. Die 8000 Mann, wurden nach Informationen von AP-Korrespondent Brian Bergstein einfach zusammengetrieben und mit Stacheldraht eingezäunt.  Der Oberkommandierende am Golf, General Tommy Franks, sprach auf einer Pressekonferenz von 1000 bis 2000 Gefangenen, die bisher gemacht wurden. Tausende mehr hätten ihre Waffen niedergelegt, um nach Hause zu gehen.  Nach eigenen Angaben machten sich die alliierten Truppen inzwischen daran, Zeltlager zu bauen und die uniformierten irakischen Soldaten und Kämpfer in T-Shirts mit Medikamenten, Essen und Wasser zu versorgen. Gleich nachdem die ersten hundert Iraker überliefen, hätten britische Einheiten mit dem Bau von Gefangenenlagern begonnen, hieß es in einer Mitteilung der britischen Streitkräfte.  Nach der Festnahme sollen Militärpolizisten, die den Kampfeinheiten folgen, die Gefangenen übernehmen und in sicherere Lager bringen. Eine ständige Haftanstalt soll eingerichtet werden, Kuweit und andere Nachbarstaaten wollen allerdings keine Kriegsgefangenen aufnehmen - es muss also ein sicherer Ort in Irak gefunden werden. Rechtsexperten der Streitkräfte sollen sicherstellen, dass die Gefangenen nach den Vorgaben der Genfer Konvention behandelt werden.  Im 91er Golfkrieg gab es bereits eine hohe Zahl von Deserteuren auf irakischer Seite: 69.000 Iraker liefen zum Feind über. Die Beschäftigung mit so vielen Gefangenen hielt damals mehrere amerikanische Einheiten in ihrem Vormarsch auf. Beim jetzigen Feldzug rechnen amerikanische Offiziere damit, dass 270.000 Iraker - über die Hälfte der gesamten Heeresmacht - ihre Waffen niederlegen werden.  Eine große Anzahl von Gefangenen mag nicht nur den Vormarsch der alliierten Truppen verlangsamen - Gefangene im Rücken der vorrückenden Einheiten können zur Bedrohung werden.  Die Soldaten sind für die Gefangennahme von Gegnern geschult worden. Sie tragen an der Front ein englisch-arabisches Wörterbuch mit sich, aus dem sie Befehle wie \"Stehenbleiben oder ich schieße\" und \"Ergebt euch\" entnehmen können. Nach irakischer Darstellung kann es keinen Zweifel an der Kampfbereitschaft der Streitkräfte geben. Alle bisherigen Kriegsgefangenen der USA seien Zivilisten, sagte Informationsminister Mohammed Said el Sahaf.  Nach Angaben des Chefs der Organisation Refugees International sicherten die Streitkräfte irakischen Offizieren gewisse Privilegien zu, um Unruhen unter den Gefangenen vorzubeugen: \"Offiziere dürfen ihre Handfeuerwaffen behalten, in ihren Kasernen bleiben, und die alliierten Truppen haben versprochen, sie sobald wie möglich als Sicherheitskräfte einzusetzen\", sagt der frühere Pentagon-Sprecher und heutige Flüchtlingshelfer Kenneth Bacon.",http://www.spiegel.de/politik/ausland/deserteure-wohin-mit-dem-gefangenen-heer-a-241734.html,2003-03-22T00:00:00.000Z
"Journalisten an der Front Kameramann von Bombe getötet, TV-Team vermisst Selbstmordattacke im Nordirak: Eine Bombe tötete mindestens fünf Menschen, darunter war ein australischer Journalist, der für ABC arbeitete. Der Anschlag wurde möglicherweise von der Terrorgruppe Ansar-e Islam verübt, deren Gebiet die Amerikaner in der Nacht mit Cruise Missiles beschossen hatten. Im Südirak wird ein TV-Team vermisst, das unter Beschuss geraten war. Hamburg - Nach Angaben von BBC näherte sich der Selbstmordattentäter in einem Taxi einem Kontrollpunkt nahe dem Ort Gerdigo und jagte sich dort in die Luft. Dabei wurde er, ein Journalist und drei kurdische Peschmerga-Soldaten getötet. Neun Menschen wurden verletzt und zur ärztlichen Versorgung nach Suleimanija gebracht. Nach Angaben der Organisation \"Reporter ohne Grenzen\" handelt es sich bei dem toten Journalisten um einen australischen Reporter, der für die US-Fernsehgesellschaft ABC arbeitete.  Sicherheitsoffiziere der Patriotischen Union Kurdistans (PUK) machten die islamische Extremistengruppe Ansar-e Islam für den Anschlag verantwortlich. Sehr wahrscheinlich hat Ansar enge Verbindungen mit Osama Bin Ladens al-Qaida. Der Führer von Ansar, Mullah Krekar, wurde vor zwei Tagen in seinem Osloer Exil verhaftet.  Khurmal gilt neben Biyara als einer der Hochburgen Ansar-e Islams. Die bergige Gegend nahe der iranischen Grenze war in der Nacht zum Samstag von den amerikanischen Truppen mit Cruise Missiles beschossen worden. Der Beschuss mit mehr als 40 Raketen tötete in drei umliegenden Dörfern mehr als 100 Menschen.  Kurdische Milizen und schwerbewaffnete Spezialkräfte marschierten daraufhin in die Region um die Stadt Halabdscha ein. Insgesamt werden 18 Dörfer in dieser Gegend werden von Ansar-e Islam kontrolliert. Der Selbstmordanschlag bei Khurmal ist nach Angaben der PUK ein Racheakt der Islamisten.  Mehrere Journalisten waren nach Gerdigo gekommen, um Flüchtlinge zu interviewen. Hunderte waren wegen der amerikanischen Angriffe aus Khurmal, Biyara und Sargat geflohen.  Britisches Fernsehteam beschossen und seither vermisst Das britische Fernsehunternehmen ITN teilte außerdem mit, dass drei Mitglieder eines Fernsehteams vermisst würden, die auf dem Weg in die südirakische Stadt Basra beschossen worden waren. Bei den vermissten Journalisten handele es sich um den Korrespondenten Terry Lloyd und seine Kollegen Fred Nerac und Hussein Othman die für den Nachrichtensender ITV News arbeiteten.  \"Die ITV Nachrichten-Crew wurde bei Iman Anas in der Nähe von Basra beschossen als sie in zwei Fahrzeugen auf die Stadt zufuhren\", hieß es in der Mitteilung von ITN. Ein weiteres Mitglied des Teams - Daniel Demoustier - sei verletzt worden, habe sich aber in Sicherheit bringen können. Demoustier habe nicht sehen können, was mit seinen Kollegen geschehen sei, teilte ITN weiter mit.",http://www.spiegel.de/politik/ausland/journalisten-an-der-front-kameramann-von-bombe-getoetet-tv-team-vermisst-a-241731.html,2003-03-22T00:00:00.000Z
"Indonesien Zwei Touristen bei Vulkanausbruch getötet Mindestens zwei Menschen sind bei Vulkanausbrüchen in Indonesien ums Leben gekommen. Tausende Menschen sind auf der Flucht. Jakarta - Die beiden Touristen kamen im Osten von Java beim Ausbruch des Vulkans Bromo um. Sie wurden von Geröll erschlagen, erklärte der Wissenschaftler Atje Purbawinata. Mindestens sieben weitere Wanderer wurden Behördenangaben zufolge verletzt. Die Nationalität der getöteten Wanderer ist unklar. Bei einem der Toten soll es sich um einen Malaysier handeln, berichteten Medien. Über dem Mount Bromo stieg der Rauch 3000 Meter in die Höhe. Der Vulkan ist ein beliebtes Touristenziel.  Rund 15.000 Menschen sind unterdessen auf der Insel Sangihe im Nordosten Indonesiens in Sicherheit gebracht worden. Sie fliehen vor dem Vulkan Awu, der seit Tagen Rauch und heiße Asche in die Luft spuckt. Es gab bereits mehrere kleine Eruptionen. Die Asche bedeckt Ortschaften und Strände in der Umgebung. \"Wir warten nur auf die große Explosion\", sagte ein Behördensprecher. Es gelte die höchste Alarmstufe.  Die Flüchtlinge wurden in Schulen und Kirchen untergebracht. Die Behörden stellen Decken und Lebensmittel zur Verfügung.  Bei einem Ausbruch des 1320 Meter hohen Vulkans kamen im August 1966 40 Menschen ums Leben. Im Oktober 1992 brach der Awu zum letzten Mal aus. Es kam aber niemand zu Schaden. In Indonesien gibt es etwa 500 Vulkane, von denen 128 aktiv sind.",http://www.spiegel.de/panorama/indonesien-zwei-touristen-bei-vulkanausbruch-getoetet-a-303244.html,2004-06-08T00:00:00.000Z
"Krisenregion Darfur Soldaten blockieren Hilfslieferung Sudanesische Soldaten haben Uno-Angaben zufolge Hilfslieferungen für das Flüchtlingslager Kalma in Süd-Darfur aufgehalten. Flüchtlingsorganisationen befürchten den Ausbruch der Cholera in dem Lager. DPA Flüchtlinge in Süd-Darfur Kairo - Die Soldaten blockieren seit Freitag den Zugang zum Flüchtlingslager, nachdem darin ein mutmaßliches Mitglied der arabischen Reitermiliz Dschandschawid ermordet worden sein soll.  Regierungstruppen und Dschandschawid-Kämpfer würden Nahrungsmittel, Wasser und medizinische Versorgung abhalten, erklärte Adam Ali Schogar, ein Führer der Rebellengruppe Sudanisches Befreiungsheer. \"Wir appellieren an die Völkergemeinschaft, zu intervenieren, weil sich die Lage zuspitzt. Kinder sterben an Krankheiten, Hunger und Durst\", sagte Schogar. Die sudanesische Regierung bestreitet unterdessen Berichte über eine Blockade.  Ein Uno-Gesandter werde in dieser Woche in die Provinzhauptstadt Nyala reisen, um sich bei der Regierung für ein Ende der Blockade einzusetzen, sagte eine Sprecherin der Vereinten Nationen. Der Uno-Sicherheitsrat hat der Regierung eine Frist bis Monatsende gesetzt, um die arabischen Reitermilizen zu entwaffnen und sichere Gebiete für die schwarzafrikanische Bevölkerung zu schaffen.  Am Wochenende waren in Dafur die ersten afrikanischen Soldaten einer 300 Mann starken Schutzgruppe eingetroffen, die für die Sicherheit von Militärbeobachter der Afrikanischen Union sorgen sollen.",http://www.spiegel.de/politik/ausland/krisenregion-darfur-soldaten-blockieren-hilfslieferung-a-313462.html,2004-08-16T00:00:00.000Z
"Flüchtlingsstrom Zypern verlangt mehr Evakuierungsflüge Tausende Flüchtlinge aus dem Libanon sind bereits in Zypern angekommen, etliche sind noch unterwegs - aber die Mittelmeerinsel hat schon jetzt Schwierigkeiten, den Flüchtlingsstrom aus dem Libanon zu koordinieren. Außenminister Lillikas forderte mehr Hilfe von der EU. Larnaca - Allein in der vergangenen Nacht sollten mindestens fünf Schiffe mit Europäern und US-Bürgern auf der Insel einlaufen. Zypern hat bereits mehrere tausend Ausländer aufgenommen, die vor den israelischen Angriffen aus dem Libanon flüchten. Zyperns Außenminister Georgios Lillikas forderte heute von der EU mehr Evakuierungsflüge, damit die Flüchtlinge aus dem Libanon wieder die Mittelmeerinsel verlassen könnten. Die Menschen müssten so schnell wie möglich weiter fliegen können, sagte Lillikas der Nachrichtenagentur Reuters. Ohne die zusätzlichen Flüge werde es sein Land wohl nicht schaffen, den Flüchtlingsstrom zu bewältigen, warnte Lillikas. Eine entsprechende Anfrage werde die Republik Zypern im Laufe des Tages der EU-Ratspräsidentschaft unterbreiten. Auch die Unterkünfte seien knapp. Zwar hat Zypern Hotelkapazitäten für 2,5 Millionen Touristen jährlich, aber die Zimmer sind ausgebucht. hen/Reuters",http://www.spiegel.de/politik/ausland/fluechtlingsstrom-zypern-verlangt-mehr-evakuierungsfluege-a-427616.html,2006-07-20T00:00:00.000Z
"Grimme-Jahrbuch Lesen Sie fern! Ein Jahrbuch wie der Kater am Morgen danach: Jeden Frühsommer lässt das Grimme-Institut das Fernsehjahr in Buchform Revue passieren. Weniger Trash hätte es auch getan, doch insgesamt hat sich das TV-Delirium doch gelohnt. Von Jan Freitag Unser Fernsehkonsum steigt unablässig. 212 Minuten waren es im WM-Jahr täglich, das sind fast 30 Minuten mehr als noch 1996. Bald zwei Monate sitzt der Durchschnittsdeutsche also zwischen Neujahr und Silvester vor der Glotze  sollte er da wirklich auch noch Bücher über seine Lieblingsbeschäftigung lesen? Schließlich gibt es in der Fernseh-freien Zeit sinnigere Dinge zu tun. Sport treiben etwa, mal wieder Freunde treffen, zärtlich sein, reden. Die Antwort lautet trotzdem: Man sollte! ProSieben1 Grimme-prämierte Sendung \"Extreme Activity\": Infantile Spielshow heliumhigher Promis Denn ein gutes Buch zu lesen ist immer ungemein anregend, wenn auch das Programm des Vorabends eines der wichtigsten Gesprächsthemen am Morgen danach bleibt. Wenn sich nun aber das eine so sehr mit dem anderen vereint, dass man das andere ein bisschen eher verstehen lernt  umso besser. Genau diese gelungene Verbindung schafft das \"Jahrbuch Fernsehen\", herausgegeben von fachkundigen Expertengruppen wie dem Grimme-Institut und dem Institut seines Vordenkers Lutz Hachmeister namens IfM. Jedes Jahr im Frühsommer bündelt es die treffendsten Analysen mit den kreativsten Kritiken sowie zahllosen Hintergrundinformationen zum Genre und macht Fernsehen dadurch  lesenswert. Dabei steht außer Frage, dass die Ausgabe 2007 - wie ihre 16 Vorgängerinnen - vor allem etwas für Eingeweihte ist: Medienmenschen, Branchenverantwortliche, Populärkulturschaffende, TV-Junkies. Aber es steckt eben auch mehr darin als bloße Kritik. Der 600 Seiten starke Band ist ein Kompendium des Alltäglichsten, ein öffentliches Dossier unserer Sehgewohnheiten, ein Brennglas auf jenes Medium, das auch im Zeitalter von YouTube, Video-on-demand und Weblogs noch immer vier Mal soviel Zeit verschlingt wie unser täglicher Internetkonsum. Schließlich sehen wir alle fern, wenn es die Jüngeren auch eher nebenbei tun, im Multitaskingverfahren  so behaupten jedenfalls all jene, die glauben, mit Quoten, Freizeitforschung und Demoskopie unverstellt in heimische Wohnräume blicken zu können. Das tun im Übrigen auch die Autoren, Essayisten, Analytiker des Jahrbuchs. Sie alle stimmen am Ende des Editorials darin überein, dass wir alle zwar mehr Inhalte in den neuen Technologien brauchen, aber eben auch \"Echtzeit-Ereignisse als Einschaltimpuls\" im guten alten Fernsehen  von Filmevents über Fußballübertragungen bis zu Castingshows. Was man von denen halten sollte, das zeigen wiederum die lesenswerten Rezensionen renommierter Fernsehkritiker. Der Einäugige unter Blinden 57 Fallanalysen des 2006 Gezeigten hat das Grimme-Institut aus Magazinen, Zeitungen und Online-Publikationen kompiliert und sie lassen sich im Wesentlichen auf einen Kern reduzieren: Privatsender müssen sich mächtig anstrengen, um darin gut wegzukommen, doch auch die Öffentlich-Rechtlichen sind freilich längst beliebte Prügelknaben der Presse. Verrisse machen halt mehr Spaß als Lob und was gibt es auch Freundliches zu schreiben über Aufgeblähtes wie \"Germanys Next Topmodel\" oder Blockbuster der Marke Teamworx. Schließlich liegen dem Buch hohe Grimme-Ansprüche zugrunde, wenngleich am Institutssitz Marl selbst Jürgen von der Lippes infantile Spielshow \"Extreme Activity\" ausgezeichnet wurde. Was die Jury daran preiswürdig fand, Promis mit heliumerhöhter Stimme Begriffe raten zu lassen, bleibt wohl auf ewig ihr Geheimnis. Wenn allerdings Dietrich Leder in seinem pointierten Abriss des Fernsehjahrs in zehn Bildern nicht umhin kommt, die Pro7-Show \"Schlag den Raab\", eine Art \"Spiel ohne Grenzen\" für Egozentriker, aus dem Wust armseliger Unterhaltungsformate lobend hervorzuheben, wird von der Lippe eben zum Einäugigen unter blinden Moderationskollegen. Und Leder weiß, wovon er spricht, denn als TV-Kenner sieht er mehr fern als jeder andere und nicht nur das macht seine Rubrik zum Besten, was darüber geschrieben steht. Nutzwert fürs gemeine Fernsehpublikum Ähnliches gilt zwar auch für die hervorragenden Essays zum Einstieg  Imran Ayatas umfassender Betrachtung des televisionären Umgangs mit Migranten, Alexander Kühns Verriss deutscher Serienadaptionen, Leif Kamps Ausblick ins multimediale Zeitalter oder Diemut Roethers in das der Werbung. Aber wo bleibt der Nutzwert fürs gemeine Publikum? Den bietet zum Beispiel das Branchen-Verzeichnis, von der Landesmedienanstalt übers Filmstudio bis hin zur PR-Agentur, 300 Seiten lang, nahezu lückenlos. Und wenn das schlichte Drama \"Wut\" eine publikumsübergreifende Debatte zu Selbstzensur, Xenophilie und Gettoisierung losbricht, wenn defizitäre Videoportale 1,6 Milliarden Euro Verkaufsgewinn erbringen und deutsche Fernsehsender fast 500 Millionen mehr als Reinerlös, wenn animierte Städtebombardements, Flüchtlingstrecks oder Sturmfluten realistischer werden als die Originale und Wahlkämpfe zu gesendeten Laufstegen, ist die soziokulturelle, politische, wirtschaftliche, Bedeutung des Mediums nachhaltig belegt. Egal, ob einzeln abrufbar oder formatiert, variabel oder starr, wireless oder terrestrisch, Internet oder TV. Kein Zweifel: Es wird noch viele \"Jahrbücher Fernsehen\" geben. Grimme Institut, Funkkorrespondenz, Institut für Medien und Kommunikationspolitik (IfM) u.a. (Hg.): Jahrbuch Fernsehen 2007 , Marl, 600 Seiten, 34,90 Euro",http://www.spiegel.de/kultur/gesellschaft/grimme-jahrbuch-lesen-sie-fern-a-491265.html,2007-06-28T00:00:00.000Z
