article,article_url,date
"Flüchtlingshotspot in Griechenland Bürgermeister von Kos warnt vor gewalttätigen Protesten Auf Druck der EU wird auf der griechischen Insel Kos ein Registrierzentrum für Flüchtlinge gebaut. Erste Randale gab es bereits. Nun wendet sich der Bürgermeister mit einem Appell an die Regierung in Athen. Der Bürgermeister von Kos hat an die Regierung in Athen appelliert, auf die Einrichtung eines sogenannten Hotspots zur Registrierung von Flüchtlingen auf der griechischen Insel zu verzichten. Andernfalls fürchte er gewalttätige Proteste der Bewohner, schrieb Giorgos Kiritsis in einem Brief an Ministerpräsident Alexis Tsipras . Die amtliche Nachrichtenagentur ANA veröffentlichte das Schreiben. Am Freitag war es bereits zu Auseinandersetzungen zwischen Einwohnern und der Polizei in der Nähe des Geländes gekommen , auf dem das Registrierzentrum gebaut wird. Drei Menschen wurden dabei verletzt. Die griechische Regierung entsandte daraufhin mehr Polizisten nach Kos. Das war ein Fehler, wie nun der Bürgermeister der Insel sagte. Die Sicherheitskräfte sollten wieder abberufen werden, um die Lage zu entschärfen, schrieb Kiritsis an Tsipras. Auf die Ferieninsel Kos setzen täglich Hunderte Migranten über, die türkische Küste ist nur wenige Kilometer entfernt. Unter dem Druck der EU hat Athen zugesagt, den Bau der Aufnahmezentren zur Registrierung und Verteilung Asylsuchender zügig voranzutreiben: Binnen zwei Wochen sollen die Hotspots auf den Inseln Kos, Chios, Samos und Leros fertig sein, ein weiterer auf Lesbos ist bereits in Betrieb. Zudem sind zwei große Aufnahmelager für jeweils 4000 Menschen nahe Athen und Thessaloniki geplant. Während sich die Verwaltungen auf vier Ägäisinseln einverstanden erklärten, protestierte Kos von Anfang an gegen das Vorhaben. Örtliche Behörden streiten mit der Regierung in Athen über den Standort des Registrierungszentrums; zudem fürchten viele Einwohner Nachteile für den Tourismus. Nach Angaben des Uno-Flüchtlingshilfswerks UNHCR setzten seit Jahresbeginn bis zum 6. Februar insgesamt 68.023 Menschen von der türkischen Ägäisküste zu den griechischen Inseln über. Mindestens 366 Menschen sind demnach seit Jahresbeginn im Mittelmeer gestorben. Mehr zum Thema: Neue Uno-Zahlen: In Griechenland kommen weiter Zehntausende Flüchtlinge an Interview mit Griechenlands Migrationsminister: \"Deutschland ist die Stimme der Vernunft in Europa\"",http://www.spiegel.de/politik/ausland/griechenland-buergermeister-von-kos-fuerchtet-ausschreitungen-gegen-fluechtlings-hotspot-a-1076130.html,2016-02-08T00:00:00.000Z
"Ärger in der Koalition Altmaier will Asylpaket II so lassen Die Regierung hat sich auf das Asylpaket II geeinigt, streitet aber noch immer über Details. Kanzleramtschef Peter Altmaier stellt jetzt klar: Der Gesetzentwurf werde wie vereinbart in den Bundestag eingebracht. Kanzleramtsminister Peter Altmaier geht davon aus, dass das Asylpaket II trotz des neuen Streits über den Familiennachzug unverändert in den Bundestag eingebracht wird. Das sagte er in der ARD-Sendung \" Bericht aus Berlin \". Der CDU-Politiker und Flüchtlingskoordinator der Regierung wies darauf hin, dass der Gesetzentwurf im Kabinett \"mit den Stimmen aller Minister der Sozialdemokraten, von CDU und CSU\" beschlossen worden sei. Das Bundeskabinett hat am vergangenen Mittwoch das umstrittene Asylpaket II beschlossen . Am Freitagabend hieß es dann allerdings, mehrere SPD-Abgeordnete hätten Widerstand angekündigt . Es ging vor allem um die Frage, ob minderjährige unbegleitete Flüchtlinge ihre Eltern nachholen dürfen oder nicht. Selbst SPD-Parteichef Sigmar Gabriel distanziert sich von der Regelung : Die Aussetzung des Familiennachzugs für diese Fälle sei nicht mit ihm verabredet gewesen, betonte er auf Anfrage des ARD-Hauptstadtstudios. Wenig später hieß es dann allerdings aus der SPD: \" Wir stellen das Asylpaket II nicht infrage .\" Die Verwirrung war also groß. Altmaier stellte aber nun im ARD-Bericht klar, der Familiennachzug werde \"für alle, die aus Syrien kommen\" ausgesetzt, also auch für Minderjährige. Nach Angaben der \"Frankfurter Rundschau\" stellen die meisten unbegleiteten minderjährigen Flüchtlinge allerdings gar keinen Asylantrag, sondern erwirkten eine Duldung. Im Jahr 2015 hätten nur 105 Minderjährige den sogenannten subsidiären Schutz zugesprochen bekommen, der von der aktuellen Gesetzesverschärfung betroffen wäre, hieß es laut der Zeitung in einem internen Vermerk des Bundesinnenministeriums. De Maizière und Maas sollen Streit klären In dem Streit sollen Thomas de Maizière (CDU) und Heiko Maas (SPD) eine Lösung finden. \"Zu den Fragen des Umfangs und der rechtlichen Einordnung des Familiennachzugs für unbegleitete Minderjährige mit subsidiärem Schutzstatus werden der Bundesinnenminister und der Bundesjustizminister Anfang der Woche eine Klärung herbeiführen\", teilte ein Sprecher des Justizressorts am Sonntag mit. Altmaier zeigte sich im ARD-Bericht zuversichtlich, dass die beiden Minister bei ihrem Gespräch eine Einigung erzielen werden. Die Koalition sei handlungsfähig und die neuen Maßnahmen der Regierung in der Flüchtlingskrise würden bald Wirkung zeigen. \"Ich setze darauf, dass die Menschen uns wieder vertrauen werden, wenn sie feststellen, dass das Problem in die richtigen Bahnen gekommen ist\", sagte Altmaier über die sinkenden Umfragewerte der Union. Die Große Koalition habe in den vergangenen vier Monaten im Asylrecht gesetzlich mehr reformiert, als in den 20 Jahren zuvor geändert worden sei. Die AfD bezeichnete der Kanzleramtschef als eine \"reine Protestpartei\". Deren gute Umfragewerte würden \"zusammenfallen wie ein Soufflé\", sobald die Flüchtlingssituation sich so ordne, wie das alle möchten.",http://www.spiegel.de/politik/deutschland/fluechtlinge-streit-ueber-asylpaket-ii-soll-schnell-geklaert-werden-a-1076129.html,2016-02-08T00:00:00.000Z
"Tripolis Libyens Einheitsregierung sitzt auf Marinestützpunkt fest Das Eintreffen der neuen Einheitsregierung in Libyen wird von Gewalt überschattet. Bei Schusswechseln in Tripolis soll es einen Toten gegeben haben. Wenige Stunden nach dem Eintreffen der designierten Einheitsregierung in Libyen ist es zu Zusammenstößen zwischen Unterstützern und Gegnern gekommen. Das Gremium unter Ministerpräsident Fajes al-Sarradsch will die von Milizen kontrollierte Hauptstadt zu ihrem Sitz machen. Sarradsch und seine Minister waren am Mittwoch unter hohen Sicherheitsvorkehrungen auf dem Seeweg von Tunesien nach Tripolis gelangt. Dort residieren sie zunächst in einem Marinestützpunkt. Milizen, die die Stadt kontrollieren, hatten zuvor Widerstand gegen das von den Vereinten Nationen berufene siebenköpfige Regierungsteam angekündigt. Im Stadtzentrum von Tripolis waren in der Nacht offenbar Schusswechsel zu hören. Ein Anhänger der Einheitsregierung soll bei einer Schießerei getötet worden sein, sagte ein für die Sicherheit der Mitglieder verantwortlicher General der Nachrichtenagentur Reuters. Drei weitere Personen seien bei den Kämpfen in der Hauptstadt Tripolis verletzt worden. Regierung sitzt auf Marinestützpunkt fest Mit Bezug auf das Portal \"Afrigatenews\" berichtet die Agentur dpa, Anhänger der von Islamisten dominierten Führung in Tripolis hätten die Zufahrtsstraße zum Marinestützpunkt Abu Sita abgeriegelt, auf dem sich die Einheitsregierung vorerst aufhält. In dem Bericht war auch von Schüssen die Rede, weitere Einzelheiten wurden nicht genannt. Ein bekannter Fernsehsender, der als Gegner der Einheitsregierung gilt, wurde geschlossen. Es wird erwartet, dass Sarradsch in den kommenden Tagen versuchen wird, ein Kabinett zu bilden. Der Regierungschef kündigte an, nun an einem Waffenstillstand, einer nationalen Aussöhnung und der Rückkehr von Vertriebenen sowie der Bekämpfung islamistischer Terroristen zu arbeiten. Der Westen hofft, dass die Regierung der nationalen Einheit der wachsenden Bedrohung Einhalt bieten kann, die von der Terrormiliz \"Islamischer Staat\" (IS) ausgeht. Mit der neuen Regierung soll der seit fünf Jahren andauernde Bürgerkrieg beendet werden. Seit dem Sturz des langjährigen Machthabers Muammar al-Gaddafi regiert in Libyen das Chaos. Zahlreiche bewaffnete Gruppen bekämpfen sich. DER SPIEGEL Überblickskarte der libyschen Milizen (englisch) Seit Mitte 2014 stritten sich zwei Regierungen um die Macht. Die Miliz \"Islamischer Staat\" (IS) konnte sich durch das Machtvakuum im Land festsetzen . Die Küstenstadt Sirte wird von den Islamisten kontrolliert. Libyen stellt zudem ein Einfallstor für Flüchtlinge dar, die versuchen, aus Afrika über das Mittelmeer in die EU zu gelangen. Zwei konkurrierende Regierungen beanspruchen die Führung des Landes für sich - das von Islamisten dominierte Tripolis und die international anerkannte Regierung im ostlibyschen Tobruk. Am 17. Dezember hatten Vertreter der beider Regierungen ein Abkommen für einen Ausweg aus der Staatskrise unterzeichnet. Der Vertrag sieht eine Einheitsregierung samt dem Präsidialrat für eine Übergangszeit von bis zu zwei Jahren vor. Zudem sollen eine neue Verfassung verabschiedet und Parlamentswahlen abgehalten werden. Die USA, Großbritannien und Deutschland hatte die Ankunft Sarradschs in Tripolis begrüßt. Der Uno-Sondergesandte für Libyen, Martin Kobler, würdigte Sarradschs \"beachtlichen persönlichen Mut\" und appellierte an die Milizen, die Macht friedlich an die Einheitsregierung zu übergeben.",http://www.spiegel.de/politik/ausland/libyen-schusswechsel-nach-ankunft-der-einheitsregierung-in-tripolis-a-1084755.html,2016-03-31T00:00:00.000Z
"Newsblog Das war Der Morgen @SPIEGELONLINE am 31.3.2016 Nachrichten und Themen aus Deutschland und der Welt - hier zum Nachlesen. Mit Michael Kröger Christian O. Bruch/ laif Michael Kröger Jahrgang 1962. Studierte Politik, Jura und Germanistik. Schrieb während des Studiums als freier Mitarbeiter für den \"General-Anzeiger\" in Bonn. Anschließend Praktika bei \"SAT.1\" und beim \"WDR\". Nach der Ausbildung an der Georg von Holtzbrinck-Schule für Wirtschaftsjournalisten Redakteur bei der \"Wirtschaftswoche\", der \"Woche\" und beim Internet-Portal \"Xonio.com\". Seit November 2000 bei SPIEGEL ONLINE im Ressort Wirtschaft, seit Januar 2011 Ressortleiter im Ressort Auto. Seit Januar 2012 Korrespondent in Berlin.  E-Mail: Michael.Kroeger@spiegel.de Mehr Artikel von Michael Kröger Herzlich willkommen bei Der Morgen @SPIEGELONLINE . Bis 9 Uhr begleitet Sie heute Michael Kröger beim Start in den Tag. Die wichtigsten politischen Themen des Tages finden Sie kompakt in unserem Briefing DIE LAGE .  Trotz des energischen Dementis der nigerianischen Regierung halten Einwohner von Damasak daran fest , dass Extremisten von Boko Haram aus ihrer Stadt Ende 2014 rund 500 Frauen und Kinder verschleppt haben. \"Alle Eltern haben Angst zu sprechen\", sagte der Vater einer demnach ebenfalls entführten Siebenjährigen am Mittwoch der Nachrichtenagentur AFP. Auch ein Verantwortlicher der Stadt gab an, aus Angst vor der \"Wut der Regierung\" zu schweigen. Nach der Verschleppung von 276 Mädchen im April 2014 aus Chibok , die internationale Aufmerksamkeit erregt hatte, habe die Regierung den weitaus größeren Fall von Damasak nur wenige Monate später vertuschen wollen, gaben mehrere Einwohner an, die anonym bleiben wollten. Die Regierung von Präsident Goodluck Jonathan hatte Berichte über die neuerliche Massenentführung Anfang 2015 öffentlich zurückgewiesen. In der \"Neuen Osnabrücker Zeitung\" hat Klaus Dauerstädt den Unterhändlern der öffentlichen Arbeitgeber von Bund der Kommunen einen kleinen Überblick über die Folterinstrumente gegeben, die der Deutsche Beamtenbund zur Durchsetzung seiner Forderungen anwenden will. Sollten sich die Arbeitgeber \"absolut nicht bewegen\", könnten Warnstreiks noch vor der dritten Verhandlungsrunde am 28. April noch einmal verschärft werden, sagte Dauderstädt dem Blatt - etwa bei Zulassungsstellen, Kitas, Ordnungsämtern sowie Verkehrsbetrieben wie Straßenbahnen und Bussen . Bild: dpa \"Lindenstraßen\"-Erfinder Hans W. Geißendörfer hält politische Statements in der ARD-Kultserie nach wie vor für unverzichtbar . \"Wir haben zurzeit eine politische Landschaft, in der die \"Lindenstraße\" als Unterhaltungssendung gefragt ist, kritisch Stellung zu beziehen\", erklärte er in einem Interview mit der Deutschen Presse-Agentur in Köln. \"Wenn es also zum Beispiel auf Dauer eine starke rechtslastige Gegenbewegung im Parteiengefüge gibt, werden wir daraus einen Handlungsstrang machen und zeigen, wo das hinführen kann\", sagte er mit Blick auf die jüngsten Wahlerfolge der AfD. Der bereits angekündigte groß angelegte Handlungsstrang zum Thema Flüchtlinge werde in den nächsten Wochen in der \"Lindenstraße\" starten. \" Wie in der Wirklichkeit, so wird uns das Thema auch in der Serie sehr lange beschäftigen. Es geht um die Frage: Schaffen die die Integration, und wenn ja, wie?\" Der Regisseur wird am 6. April 75 Jahre alt . An Ruhestand denkt er jedoch nicht. Geißendörfer plant gerade einen neuen Fernsehfilm , ein Kinofilm ist in Vorbereitung und er kann sich auch vorstellen, einen zweiten \"Tatort\" zu machen. Die Gesellschaft für deutsche Sprache in Wiesbaden hat wieder einmal die beliebtesten Vornamen ermittelt. The winners are: Maximilian und Sophie/Sofie . Dahinter folgen auf der Hitliste für 2015 ebenfalls wie im Jahr zuvor Alexander und Marie . Die Sprachforscher haben für das Ranking Daten von etwa 650 Standesämtern mit insgesamt knapp 940. 000 übermittelten Namenseintragungen ausgewertet. Damit wurden 90 Prozent aller im vergangenen Jahr vergebenen Vornamen erfasst . Insgesamt seien knapp 60. 000 verschiedene Namen gemeldet worden. News flash!!!⚡️ New Links activated on 8th Ave. Watch the Find A Link map for details, coming soon … Free Internet comes at its price: loss & heavy intrusion in privacy, FB's Free Basics or LinkNYC, both make u pay twitter.com/anildash/statu… @ LinkNYC is expanding rapidly with free wifi, but could the network be vulnerable down the line? gearpatrol.com/2016/03/29/lin… Foto: AFP In New York startet dieser Tage \"LinkNYC\" . Der kryptische Name ist Verheißung. Es geht um ein einen kostenlosen Online z ugang - und das sogar mit extrem großem Datendurchsatz. 10.000 Säulen sollen im Laufe der kommenden acht Jahre entstehen, und Einheimischen und Touristen das Leben etwas leichter machen. Smartphone-Nutzer können sich im Umfeld von 45 Metern zur Säule umsonst in das WLAN einloggen, teils reicht das Signal bis zu 120 Meter weit. Mit bis zu 1000 Megabit pro Sekunde ist \"LinkNYC\" den Machern zufolge hundertmal schneller als andere öffentliche Drahtlos n etzwerke in den USA. An USB-Anschlüsse zum Aufladen des Akkus wurde auch gedacht. Vor einem Strand im Südosten von Australien hat ein Hai einen Surfer angegriffen . Der 22-Jährige konnte sich mit schweren Bisswunden am Oberschenkel an den Strand retten, wie der \"Sydney Morning Herald\" berichtet. Zwei Krankenschwestern , die zufällig an Ort und Stelle waren, verhinderten , dass er verblutete , bevor die Rettungskräfte den Unglückort erreichten. Zunächst aber ein kurzer Rückblick auf den gestrigen Abend und die vergangene Nacht. In Baden-Württemberg scheint Winfried Kretschmann zu gelingen, was bislang kaum jemand für möglich gehalten hat: Die Union als Juniorpartner für eine gemeinsame Landesregierung zu gewinnen . Zumindest gibt es erstmal Verhandlungen. Den Rest werden wir sehen. Bahnreisende müssen sich auf erhebliche Behinderungen auf der wichtigsten Nord-Süd-Route einstellen. Denn die Deutsche Bahn will offensichtlich die Verbindung Hannover - Kassel für einige Wochen unterbrechen , um dort zu bauen. Und US-Präsidentschaftsbewerber Donald Trump hat wieder einmal mit radikalen Äußerungen für öffentliche Empörung gesorgt. (Dabei wäre es eher eine Schlagzeile wert, wenn er eine differenzierte Bemerkung machen würde). Er will Frauen bestrafen, die abgetrieben haben. Der Pariser Platz. Suchbild-Freunde sollten nach dem Touristen Ausschau halten... In Berlin herrscht nachösterliche Ruhe , ebenso wie wahrscheinlich in den anderen Regionen Deutschlands. Das können auch die genießen, die arbeiten müssen, denn allein schon der entspanntere Berufsverkehr ist eine Wohltat. Schauen wir, was der Morgen so bringt. Guten Morgen , sehr verehrte Leserinnen und Leser, mein Name ist Michael Kröger , ich liefere Ihnen die wichtigsten Nachrichten für den Start in den Tag .",http://www.spiegel.de/politik/deutschland/nachrichten-am-morgen-die-news-in-echtzeit-a-1084108.html,2016-03-31T00:00:00.000Z
"SPD vor Berlin-Wahl \"Wahlkampf über Hundehaufen geht nicht\" Trotz mieser Umfragen steigt die SPD offensiv in den Wahlkampf zum Berliner Abgeordnetenhaus ein - mit einer Kampagne, die auf die kulturelle Offenheit der Stadt setzt. Das ist nicht ohne Risiko. Von Horand Knaup Horand Knaup Mehr Artikel von Horand Knaup Es ist in diesen aufgeregten Tagen ohne Zweifel eine mutige Kampagne: Eine Muslima mit fein geripptem rosa Kopftuch, schützend in einen dunklen Mantel gehüllt. Auf der Rolltreppe fährt sie einem leger gekleideten Regierenden Bürgermeister entgegen. Der ist bergauf unterwegs, unscharf gezeichnet, man ahnt seinen neugierig-sympathisierenden Blick. Das Plakat ist für große Flächen gedacht und Teil einer Strategie, mit der die Berliner SPD für die Abgeordnetenhaus-Wahl am 18. September rüstet. Sie will Michael Müller , 51, im Amt halten, ihren Bürgermeister, der das Amt im Dezember 2014 von Vorgänger Klaus Wowereit übernommen hat. Keine leichte Aufgabe, es gab vor Wahlen schon kommodere Ausgangslagen für die Genossen der Hauptstadt. Seit über 25 Jahren ist die SPD Teil der Stadtregierung. Das ist inzwischen mehr Hypothek als Verpflichtung. Der sichere Vorsprung, den sie noch vor Monaten hatte, ist weg. Die letzte Umfrage von Infratest dimap sah Mitte Juli die Sozialdemokraten nur noch hauchdünn vor CDU , Grünen und Linkspartei. So nah liegen die vier Parteien beieinander, dass der Regionalsender rbb das sonst übliche TV-Duell zwischen Bürgermeister und Herausforderer ausfallen lässt. In der Sänfte wird Müller das Rote Rathaus nicht erreichen Müller hätte gerne ein Duell gehabt. Denn, so viel steht fest, in der Sänfte wird er das Rote Rathaus nicht erreichen. Auch deshalb sucht er nun offensiv die Auseinandersetzung und den Konflikt. Und er sucht den Schlagabtausch vor allem mit den Nationalisten und Rechtsaußen der Stadt oder ganz konkret - mit der AfD. \"Die müssen raus aus unseren Parlamenten\", hatte er schon beim Parteitag Ende Mai gerufen. DPA Regierender Bürgermeister Müller im Wahlkampf Eigentlich ist der \"Regierende\", wie sie den Bürgermeister in Berlin nennen, eher ein Mann der leisen Töne. Doch Kuschelkurs und Umarmung waren gestern, jetzt hat Müller die Fäustlinge übergestreift und sucht die Polarisierung. \"Wir werden möglicherweise nicht jeden erreichen\", sagt er. Aber das nimmt er nicht nur in Kauf, es ist sogar gewollt. Gerade weil die Ereignisse der vergangenen zwei Wochen neue Debatten über den Umgang mit Migranten provoziert haben, ist Müller fest entschlossen, Berlin als weltoffene, tolerante und liberale Stadt zu präsentieren. Als Stadt, die rasant wächst, in der sich serienweise Start-ups niederlassen und für die sich seit der britischen Brexit -Entscheidung sogar Musik-Labels aus London interessieren. Heikle Themen gibt es genug, befriedigende Antworten längst nicht Natürlich gäbe es eine Reihe anderer brisanter Themen, über die die Berliner im Wahlkampf gerne Auskunft hätten. Etwa über die angespannte soziale Frage, den mäßigen Zustand des Bildungswesens oder die ausbaubedürftige Infrastruktur. Vom Lästerthema Flughafen ganz zu schweigen. Heikle Themen gäbe es genug, befriedigende Antworten längst nicht auf alles. \"Die Spottdrosseln flattern durch die Stadt\", beschrieb die \"Süddeutsche Zeitung\" dieser Tage das Diskussionsklima an der Spree. Natürlich, Müller spricht im Wahlkampf auch über Schulen, Wohnungsbau, Arbeitsplätze, das klassische Portfolio einer Großkommune. Letztlich will er sich aber als Lordsiegelbewahrer einer unbekümmerten Metropole präsentieren, als Verteidiger des kosmopolitischen Geistes einer Kapitale, die, wie am vergangenen Wochenende, eine halbe Million Menschen für den CSD unfallfrei auf die Straßen lockt, die 180 Nationen und so nahezu alle Religionen beherbergt und auch ziemlich stolz darauf ist. Und deshalb soll es auch nicht bei einem überraschenden Muslima-Wahlplakat bleiben. Die Drag Queen Nina Queer wird überlebensgroß auf die Berliner hernieder schauen, und natürlich sind auch fröhlich dreinblickende, multi-ethnische Kinder im plakatierten Angebot. Berühmter Wahlkämpfer übernimmt SPD-Kampagne Frank Stauss heißt der Mann hinter der Kampagne. Stauss, Mitinhaber der Kreativagentur Butter, ist erfahrener Wahlkämpfer für die SPD. Er war schon 2005 für Gerhard Schröder im Einsatz, später für Hannelore Kraft und Olaf Scholz, im vergangenen März hat er Malu Dreyer in Rheinland-Pfalz zu ihrem Coup verholfen. Stauss ist fest davon überzeugt, dass sich für Politiker erstens Haltung auszahlt und zweitens eine SPD-Kampagne in Berlin in diesen Wochen Zuspitzung braucht. Sein Credo: \"Ein Wahlkampf über Hundehaufen geht in diesen Zeiten nicht.\" Die Stadt stehe vor einer Grundsatz-Entscheidung, welche Richtung sie einschlagen wolle. \"Wir wollen ganz bewusst die Auseinandersetzung\", sagt Stauss. Und Müller liefert. Schon vor zwei Wochen, am Tag nach dem Anschlag von Nizza , hatte der Bürgermeister gemahnt, \"dass wir uns nicht anstecken lassen dürfen von diesem Hass und dieser Intoleranz\". Berlin dürfe nicht wegschauen, \"wenn Kopftuch tragende Frauen und Mädchen angepöbelt werden\". Auch das war schon ganz im Sinne von Kampagnero Stauss, der kürzlich bei einer Tagung in Potsdam schon einmal sein Credo ausgebreitet hatte: \"Wir dürfen den Wählern nicht hinterherlaufen.\" Wahlkampf sei \"kein historisches Seminar - wir müssen wieder Orientierungspunkt sein und auch Konflikte eingehen\". Ob das der Chef der Bundespartei auch so sieht? Sigmar Gabriel wird sich die Wahlschlacht von Berlin genau anschauen. Nicht immer war er in der jüngeren Vergangenheit mit Stauss einer Meinung. \"Da ist nichts Identitätsstiftendes mehr\", hatte Stauss den Genossen Anfang des Jahres vorgeworfen. Vor allem einer durfte sich damals angesprochen fühlen: Sigmar Gabriel. Trotz der Kritik ist Stauss derzeit als Kreativ-Chef für den Wahlkampf der Bundespartei 2017 im Gespräch. Vom Ausgang der Wahl in Berlin wird so gesehen auch für ihn einiges abhängen.",http://www.spiegel.de/politik/deutschland/spd-vor-berlin-wahl-wahlkampf-ueber-hundehaufen-geht-nicht-a-1105248.html,2016-07-29T00:00:00.000Z
"Mecklenburg-Vorpommern Feuer in Flüchtlingsheim - Verdacht auf Brandstiftung In einer Unterkunft für Flüchtlinge in Mecklenburg-Vorpommern ist ein Feuer ausgebrochen. Die Polizei geht von Brandstiftung aus. In der Nacht zum Samstag ist in einer Flüchtlingseinrichtung in Nostorf-Horst in Mecklenburg-Vorpommern ein Feuer ausgebrochen. Die 63 Bewohner des Hauses im Kreis Ludwigslust-Parchim konnten unverletzt aus dem brennenden Haus gebracht werden, wie die Polizei am Morgen mitteilte. Jetzt ermittle man wegen des Verdachts der schweren Brandstiftung, hieß es. Der Brand war in der oberen, unbewohnten Etage ausgebrochen. Nach den Löscharbeiten konnten die Bewohner ihre Zimmer im unteren Stockwerk wieder beziehen. Nostorf/Horst hatte in der Vergangenheit für Schlagzeilen gesorgt, nachdem Abgeordnete der rechtsextremen NPD bei der Landesregierung beantragt hatten , die Erstaufnahmeeinrichtung in zu besichtigen. Der Besuch fand im September 2015 unter Protest der demokratischen Parteien statt. Innenminister Lorenz Caffier (CDU) hatte sich gegen den Besuch ausgesprochen - vergeblich. Das Landesverfassungsgericht hatte schließlich den Besuch gestattet.",http://www.spiegel.de/politik/deutschland/mecklenburg-vorpommern-feuer-in-fluechtlingsheim-verdacht-auf-brandstiftung-a-1113769.html,2016-09-24T00:00:00.000Z
