article,article_url,date
"Arabische TV-Sendung für Flüchtlinge Deutschland für Anfänger - ein Anfang für Deutschland \"Marhaba\" heißt das Format, \"willkommen\": Constantin Schreiber moderiert eine arabische TV-Sendung für Flüchtlinge in Deutschland. Er erntet Lob aus Nahost - aber auch Hass aus Deutschland. Nicht über Flüchtlinge reden, sondern mit ihnen. In ihrer Sprache, um etwas von unserem Land und unseren Erwartungen zu erzählen - das war das Ergebnis einer Brainstorming-Runde in meiner Redaktion. Eine Kollegin nannte die Idee \"Deutschland für Anfänger\".   Als wir vor wenigen Tagen bei meinem Sender n-tv das Pilotprojekt \"Marhaba\" an den Start brachten, hätten wir nicht gedacht, dass es so schnell Fahrt aufnehmen würde. In fünfminütigen Videos, die auf n-tv.de veröffentlicht werden, erkläre ich auf Arabisch (so gut man das in der Kürze der Zeit kann), wie wir Deutschen ticken. In den kommenden Folgen von \"Marhaba\" wird es unter anderem um Religion, Fremdenfeindlichkeit und Sex gehen. Ich spreche Arabisch, weil ich als Deutscher lange im Nahen Osten gelebt habe, in Syrien, im Libanon, in Dubai. Im ägyptischen Fernsehen moderiere ich eine Wissenschaftssendung. Das erste Video wurde inzwischen mehrere hunderttausend Mal gesehen, Tausende Kommentare erreichten uns via Facebook, Mail und Twitter, aus Deutschland, Europa, dem Nahen Osten, Kanada. Dass ich bei dem Thema Flüchtlinge heftige Reaktionen zu erwarten habe, war klar. Aber nicht so. \"Bettnässer\", \"degeneriert\" oder \"abartig\" waren noch die freundlicheren. Es wurde zum n-tv-Boykott aufgerufen. Mehr als einmal wurde in unserer Sendung \"der Untergang des Abendlands\" erkannt. Ein Leser kommentierte \"Das ist Deutschlands Ende:\" Eine Frage, die immer wieder aufkam, lautete: \"Ist es jetzt soweit? Müssen wir jetzt Arabisch lernen?\" Ganz anders die Reaktionen aus dem Nahen Osten. Flüchtlinge schrieben mir und bedankten sich. Sie lieferten Themenvorschläge oder wollen bei der Sendung mithelfen. Anwälte, die arabische Flüchtlinge vertreten, wollen von ihren Fällen erzählen. Angst, deutsche Geschichte zu vergessen Aber es war nicht nur dumpfes Bashing, das von deutschen Nutzern über uns hereinbrach. Viele Leser schrieben lange, nachdenkliche Mails, die zeigen: Die Menschen in Deutschland sorgen sich. Und das muss man ernst nehmen. Eine ältere Frau schrieb mir, sie sei als junge Frau aus Schlesien geflohen. Sie habe einfach Angst, dass ihre Geschichte vergessen wird und wir unsere Identität aufgeben. 15 Millionen Deutsche kamen nach dem Zweiten Weltkrieg als Flüchtlinge aus dem Osten im Westen Deutschlands an. Sie brachten nicht mehr mit als Flüchtlinge aus Syrien heute - die Kleidung am Leib, Dokumente, Fotos ihrer Familie. Eine dieser 15 Millionen Deutschen war meine Mutter, geboren in den alten deutschen Ostgebieten, in einer \"Stadt, deren Namen heute keiner mehr kennt\" - um es mit den Worten von Gräfin Dönhoff zu sagen, die selbst ihre ostpreußische Heimat auf der Flucht verlassen musste, und die später ein Buch mit diesem Titel schrieb. Meine Mutter und ihre Familie haben nie über das traumatische Erlebnis der Flucht gesprochen. Erst sehr spät verstand ich, warum meine Großmutter bei Gewitter panische Angst hatte - es erinnerte sie an die Bomben. Die Flüchtlinge aus dem Osten haben Deutschland mit zu dem gemacht, was es heute ist. Historiker sagen, dass erst die Verdichtung von Know-how und Bildung durch die Millionen Flüchtlinge das Wirtschaftswunder Deutschlands nach dem Zweiten Weltkrieg ermöglicht haben. Natürlich wiederholt sich die Geschichte nicht. Die Flucht nach dem Zweiten Weltkrieg und die Flucht vor Chaos und Krieg im Nahen Osten sind grundverschieden. Die religiösen und sprachlichen Unterschiede stellen eine enorme Herausforderung dar. Ich kann die Sorgen der alten Dame aus Schlesien verstehen, die mir schrieb. Aber gerade ihr Beispiel zeigt doch, was unser Land alles geschafft hat. Die Welt ist auf Wanderschaft Die Debatte, die wir führen, ist keine deutsche. Sie ist eine globale. In Dubai fragen sich die Menschen inmitten von Glitzer, nackter Haut und Shopping-Malls, wie sie ihre islamische Gesellschaft bewahren können. In den USA ordnen die Hispanics, die Einwanderer aus Lateinamerika, die Demografie neu. Die Welt ist auf Wanderschaft und vielleicht wird man eines Tages tatsächlich auf diese Zeit zurückblicken als eine Phase moderner Völkerwanderung, in der Kulturen und Gesellschaften quasi durchgewürfelt wurden. Es geht nur mit Offenheit. Was wir erleben, ist nicht Deutschlands Ende, sondern der Beginn von etwas Neuem. Deswegen werde ich diese Sendung auf Arabisch auch weitermachen. Nur indem wir Offenheit vorleben, können wir sie von anderen erwarten - und einfordern! Und das tue ich auch. Natürlich fordere ich ein, dass Menschen, die bei uns leben, unsere Sprache sprechen, unser Grundgesetz achten, unsere Kultur respektieren. Aber das sage ich Ihnen auf Arabisch - und ich bin mir sicher, sie werden es so verstehen. Video: Ausschnitt aus Constantin Schreibers Sendung für Flüchtlinge Video n-tv Hier geht es zur Langfassung der ntv-Sendung \"Marhaba\" in zwei Ausgaben, einmal mit deutschen Untertiteln , einmal mit arabischen Untertiteln .",http://www.spiegel.de/politik/ausland/marhaba-arabische-tv-sendung-fuer-fluechtlinge-in-deutschland-a-1055431.html,2015-10-02T00:00:00.000Z
"Union in der Flüchtlingskrise Ein Herz und eine Seele Familienstreit beendet und jetzt gemeinsam gegen die Sozis: CSU-Chef Seehofer demonstriert in Berlin neue Einigkeit mit der Kanzlerin. Wie lange hält der Frieden diesmal? Von Sebastian Fischer und Severin Weiland Christian O. Bruch/ laif Sebastian Fischer Jahrgang 1978, geboren in Kassel. Studium der Politologie, Geschichte und Kommunikationswissenschaft an den Universitäten München und Göttingen. Ausbildung an der Deutschen Journalistenschule (DJS) in München. Ab Oktober 2006 München-Korrespondent von SPIEGEL ONLINE, seit Dezember 2009 im Berliner Büro. Von August 2011 bis Juli 2015 USA-Korrespondent in Washington. Seit Januar 2016 stellvertretender Ressortleiter im Politik-Ressort mit Sitz im Hauptstadtbüro, seit August 2017 Ressortleiter. E-Mail: Sebastian.Fischer@spiegel.de Twitter: @sefi99 folgen Facebook: Zum Profil google+: Zum Profil Instagram: Bilder ansehen Mehr Artikel von Sebastian Fischer Christian O. Bruch/ laif Severin Weiland Severin Weiland, geboren 1963 in Wilhelmshaven/Niedersachsen. Verbrachte einen Teil seiner Kindheit und Jugend in Chile. Studium der Kommunikations- und Politischen Wissenschaft in München, Ausbildung an der Deutschen Journalistenschule München. Ab 1992 Redakteur im Lokalteil der \"tageszeitung\" in Berlin, später landespolitischer Korrespondent. Von 1996 bis 1999 Stellvertretender Ressortleiter Innenpolitik der taz. Sabbatjahr in Kathmandu, Nepal. Von Herbst 2000 bis Januar 2002 bundespolitischer Korrespondent der taz in Berlin. Seit Februar 2002 Parlamentskorrespondent im Berliner Büro von SPIEGEL ONLINE, seit dem 1. Mai 2004 Stellvertretender Leiter des Berliner Büros von SPIEGEL ONLINE. Ab Mitte Oktober 2014 politischer Korrespondent im Hauptstadt-Büro. E-Mail: Severin.Weiland@spiegel.de Twitter: @SeverinWeiland folgen Mehr Artikel von Severin Weiland Wenig Zeit? Am Textende gibt's eine Zusammenfassung. Zehneinhalb Stunden haben sie am vergangenen Wochenende verhandelt und schließlich sechs Seiten für ein gemeinsames Papier verfasst. Eine \"Formulierungsolympiade\" sei das gewesen, und, ja doch, ein \"Vergnügen\", mit der Kanzlerin die Positionen aufzuschreiben: \"Einen Spiegelstrich hier, einen Spiegelstrich da.\"   Genau so sagt das Horst Seehofer an diesem Dienstag: Olympiade, Vergnügen, Spiegelstriche. Man darf das getrost übersetzen als: Ringen um jedes Wort. Der CSU-Chef ist nach Berlin gereist, um die Einigung mit Angela Merkel in der Flüchtlingskrise zu zelebrieren. Erst vor Journalisten, später dann vor der Unionsfraktion im Bundestag. Über Wochen hat er die Kanzlerin in der Flüchtlingskrise attackiert. Er hat laut über Notwehr nachgedacht, ein Ultimatum gestellt und eine Verfassungsklage erwogen. Jetzt steht in dem gemeinsamen Positionspapier mit der CDU seine Forderung nach Transitzonen und Einschränkungen beim Familiennachzug. Ein Erfolg. Zudem soll, so heißt es da, die Zuwanderung geordnet, gesteuert und Fluchtursachen bekämpft werden, \"um so die Zahl der Flüchtlinge zu reduzieren\". Ein Erfolg? Reduzieren - das ist das entscheidende Wort. Von einer Obergrenze oder Begrenzung, wie Seehofer es ursprünglich vorschwebte, ist dort nicht die Rede. In Merkels Umfeld lassen sie es sich natürlich nicht nehmen, auf diesen Sachverhalt hinzuweisen. Seehofer dagegen sagt, er könne mit \"Reduzierung\" leben, die Debatte um Begrifflichkeiten sei ihm \"nicht noch ein Wochenende wert\". Der 66-Jährige macht Politik im Stile eines Blasebalgs: Erst entweicht mit voller Kraft die Luft und heizt die Glut an. Dann folgt eine Phase der Erholung, in der neue Luft eingesogen wird. Seehofer ist gerade in dieser Phase, er deeskaliert die Situation mit der Schwesterpartei, um gemeinsam gegen die SPD für die Transitzonen zu kämpfen (Lesen Sie hier mehr über diese Zonen). Folgerichtig spricht der CSU-Vorsitzende am Dienstag vorm Fraktionssaal gemeinsam mit Merkel unisono von Reduzierung. Ein Herz und eine Seele. Familienstress in der Union - war da was? Vor den Abgeordneten von CDU und CSU witzelt Seehofer über die Wortklauberei, spricht sowohl von Begrenzung als auch von Reduzierung der Flüchtlingszahlen. Doppelt hält besser. Und Merkel? Auch sie nutzt Teilnehmern zufolge das Wort von der Begrenzung einmal - wenn auch etwas \"verschämt\". Einer, der Merkel in der Flüchtlingspolitik kritisch sieht, sagt später, Seehofer habe einen \"bärenstarken Auftritt\" hingelegt. Freundlicher Applaus sei nicht allein vom CSU-Teil der Fraktion gekommen, sondern auch von den CDU-Abgeordneten aus dem Osten. Die Stimmung in der Fraktion ist: entspannt. Nix mit Rebellion. Beim letzten Mal, vor zwei Wochen, hatte es noch eine lebhafte Debatte über die Flüchtlingspolitik gegeben, die Kanzlerin musste sich kritische Fragen anhören. Seehofer hat sie diesmal davor bewahrt; sie macht ihm im Gegenzug Zugeständnisse. Und wie geht es nun weiter? Erst mal geht es gegen die SPD. Der gemeinsame Gegner soll die verzofften Unionsparteien zusammenführen. \"Wir sind jetzt sehr gefestigt\", sagt Seehofer . Am Donnerstag steht das nächste Spitzentreffen von Seehofer und Merkel mit SPD-Chef Sigmar Gabriel an. Die SPD solle dann bitteschön den \"Fuß von der Bremse nehmen\". So sagt das Michael Grosse-Brömer, der parlamentarische Geschäftsführer der Unionsfraktion. Und ob die Transitzone am Ende Transitzone oder Einreisezentrum heißt, wie von der SPD gefordert, das scheint für Grosse-Brömer nicht kriegsentscheidend zu sein - hier fällt ebenfalls das Wort, das auch Seehofer in anderem Zusammenhang nutzte: \"Es ist keine Zeit für Wortklaubereien.\" Die SPD habe die Chance, sich bei der konkreten Ausgestaltung einzubringen, wenn sie verbal abrüste. Gabriel derweil gab sich vor seiner Fraktion zwar kampfeslustig: \"Wir machen keine Symbolpolitik mit, nur damit Horsti wieder zufrieden ist.\" Doch SPD-Fraktionschef Thomas Oppermann zeigte sich deutlich optimistischer, als er vor der Sitzung davon sprach, \"dass wir uns aufeinander zubewegen\" - falls man auf haftähnliche Einrichtungen verzichte. Seehofer sagte, die drei Parteivorsitzenden sollten mit dem Anspruch in den Donnerstag gehen, sich zu verständigen. Ein \"Ultimatum\" übrigens sei das nicht, eher eine \"Selbstverpflichtung\". Am Ende, man ahnt das schon, ist das Ganze natürlich eine Frage der Formulierungen. Zusammengefasst: CDU und CSU haben vorerst ihren wochenlangen Streit über den Umgang mit der Flüchtlingskrise beigelegt. CSU-Chef Horst Seehofer trat mit Kanzlerin Angela Merkel am Dienstag gemeinsam vor der Unionsfraktion auf. CDU, CSU und SPD sollen laut Seehofer beim kommenden Koalitionsgipfel am Donnerstag versuchen, zueinanderzufinden. Das sei \"kein Ultimatum, sondern eine Selbstverpflichtung\".",http://www.spiegel.de/politik/deutschland/fluechtlingskrise-cdu-merkel-und-csu-seehofer-einigen-sich-a-1060856.html,2015-11-03T00:00:00.000Z
"Neue Flüchtlingsunterkünfte Hoffnung aus Holz und Pappe Weil die Wohncontainer für die Unterbringung von Flüchtlingen knapp werden, suchen Architekten und Stadtplaner nach Alternativen. Was taugen zusammensteckbare Hütten, einfache Holzhäuser und raffinierte Papierkonstruktionen? Von Jörg Römer Christian O. Bruch/ laif Jörg Römer Jahrgang 1974, aufgewachsen in der Republik Côte dIvoire und in Ostwestfalen, studierte in Hamburg Mesoamerikanistik, Lateinamerikastudien sowie Vor- und Frühgeschichte. Nebenbei Tätigkeit als freiberuflicher Altenpfleger sowie als freier Journalist. Volontariat bei der Hamburger Presseagentur Public Address, hat dort das Bewegtbildressort aufgebaut. Hospitanzen und Praktika bei \"Bild Hamburg\", SPIEGEL ONLINE. Ab 2012 Stationen als freier Redakteur in den Ressorts Sport und beim KarriereSPIEGEL. Seit Oktober 2015 Redakteur bei SPIEGEL ONLINE im Ressort Wissenschaft/Gesundheit. E-Mail: Joerg.Roemer@spiegel.de Mehr Artikel von Jörg Römer Es ist eine Bewährungsprobe für Europa und für Deutschland: So hatte es Kanzlerin Angela Merkel jüngst dem Bundestag gegenüber in einer Regierungserklärung ausgedrückt. Hunderttausende Flüchtlinge kommen nach Deutschland, Europa ist in Bewegung. Und längst sind Länder und Kommunen mit der Unterbringung überfordert. Die Container werden knapp, viele Verwaltungen berichten davon, dass sich die schnell aufbaubaren Blechbüchsen nur noch schwer auftreiben ließen. Die zuständigen Beamten in den Gemeinden greifen zu pragmatischen Lösungen. Sie bringen Flüchtlinge in einstigen Baumärkten, Turnhallen oder anderen öffentlichen Gebäuden unter. Aber Lösungen, die alle zufriedenstellen - vor allem die Flüchtlinge - sind kaum möglich. Die Stadt Hamburg hatte kürzlich bekannt gegeben, dass einige Flüchtlinge sich wohl darauf einstellen müssten, im Zelt zu überwintern. Auch Freiburg plant winterfeste und beheizbare Zeltstädte - weitere werden folgen. Aber gibt es Alternativen zum Container? Architekten und Materialforscher sind davon überzeugt. Etliche Experten haben sich mit dem Thema Flüchtlingsunterbringung auseinandergesetzt - sowohl kurz- als auch mittelfristig. In der Fotostrecke einige Vorschläge : Allerdings: Schnelle Lösungen, die dauerhaft funktionieren und vor allem dem Winter standhalten, sind bisher nicht in Sicht. Experten suchen in der aktuellen Notlage vor allem nach einfach umsetzbaren Lösungen auf regionaler Ebene. Da wirken einige architektonische Vorschläge wie utopische Versionen, die angesichts der drückenden Probleme der Unterbringung und vor dem Hintergrund einer schnellen Massenfertigung unrealistisch erscheinen. Kurzfristig wird der Iso-Container mit seiner klassischen Stahlblech-Konstruktion wohl das Mittel der Wahl bleiben. Die Kiste mit einer Blech-Außenwand, 100 Millimeter Steinwolle zur Wärmedämmung, und einer Innenwand aus Blech sind immer noch der Liebling der deutschen Beamten. Da nützt es auch nichts, dass der schwedische Möbelriese Ikea seit Jahren an einer alternativen Unterkunft arbeitet- kürzlich wurde eine überarbeitete Variante des \"Better Shelter\"-Hauses vorgestellt. Es ist leicht, steckt in einer kleinen Verpackung und kann schnell aufgebaut werden. Denn eine schnelle Lösung sind die Container längst nicht mehr. Die Stadt Köln berichtet von Wartezeiten bis zu drei Monaten bei der Containerlieferung. Im Kreis Tübingen etwa will man wegen der Engpässe mit einer Firma aus Dubai zusammenarbeiten, die noch Sanitärcontainer liefern kann. Zudem sind die Preise gestiegen - die Unterbringung von Flüchtlingen ist für Firmen auch ein profitables Geschäft geworden. Derzeit werden für recht einfache Containerlösungen etwa 1100 bis 1500 Euro brutto verlangt - pro Quadratmeter. \"Ausgrenzung von Flüchtlingen\" Langfristig fordern Architekten und Städteplaner ein Umdenken bei der Unterbringung. \"Im Moment findet im Städtebau eine Ausgrenzung von Flüchtlingen statt, indem die Menschen ständig in die Peripherie in umzäunte Lager geschickt werden\", sagt der Architekturprofessor Jörg Friedrich von der Leibniz Universität Hannover. Gemeinsam mit seinen Studenten hat er alternative Wohnformen für Flüchtlinge entwickelt. Unter anderem schlagen die Architekten und Stadtentwickler vor, Holzbauten statt Blechcontainer zu errichten sowie öffentliche Flachdach-Gebäude aufzustocken. \"Wohnen ist ein Grundbedürfnis, das wir alle haben. Es bedeutet ein Stück Heimat, der Raum zum Wohnen schafft Identität\", sagte er. \"Flüchtlinge haben ein Recht darauf, in einer menschenwürdigen Architektur zu leben.\" Derzeit testet Friedrich eines der Konzepte: Im kommenden Jahr werden Flüchtlinge auf dem Dach der Uni Hannover wohnen. In drei jeweils leicht unterschiedlichen Gebäuden aus Holzelementen, die wie Möbel vom Discounter zusammengesetzt werden. Die Pläne für die Prototypen sollen noch dieses Jahr fertig werden.",http://www.spiegel.de/wissenschaft/technik/fluechtlingsunterkuenfte-alternativen-zum-container-a-1059839.html,2015-11-03T00:00:00.000Z
"Flüchtlinge CSU fordert Integrationspflicht Angesichts der hohen Flüchtlingszahlen will die CSU nicht nur auf Freiwilligkeit setzen: Wer auf Dauer im Land leben möchte, soll sich zwingend integrieren. Sonst drohten Sanktionen. Proteste kommen nicht nur aus der Opposition. Länger bleibende Migranten sollen nach dem Willen der CSU zu Deutschkursen und einem Grundwertebekenntnis verpflichtet werden - sonst drohen notfalls Leistungskürzungen. \"Wir müssen Integrationsbereitschaft einfordern\", heißt es einem Papier für die Klausur der CSU-Landesgruppe im Bundestag Anfang Januar. Bei der Opposition, aber auch in der SPD stieß die Forderung auf Kritik. Die CDU von Kanzlerin Angela Merkel hat sich ebenfalls schon für die Einführung verbindlicher Integrationsvereinbarungen stark gemacht. Besonders mit Blick auf Flüchtlinge und Asylbewerber heißt es in dem Entwurf der CSU, jeder müsse sich \"individuell im Rahmen einer Integrationsvereinbarung zu unseren Werten, unserer Rechtsordnung und den Regeln eines friedlichen Zusammenlebens bekennen\". Bestandteil müsse zudem sein, eine Pflicht \"aller Kinder, Frauen und Männer\", Sprach- und Integrationskurse anzunehmen. Diese Vereinbarungen sollen auch \"die Grundlage für mögliche Leistungskürzungen im Falle des Nichtbefolgens sein\", heißt es in der Beschlussvorlage, über die zuerst die \"Süddeutsche Zeitung\" berichtet hatte. Auch die CDU hat sich für Integrationsvereinbarungen ausgesprochen, die Rechte und Pflichten des Staates und der Migranten festschreiben. \"Wer sich dem dauerhaft verschließt, muss mit Nachteilen, zum Beispiel Leistungskürzungen, rechnen\", hatte der CDU-Parteitag Mitte Dezember in Karlsruhe beschlossen. CDU-Vize Julia Klöckner sagte dem \"Tagesspiegel\" (Dienstag): \"Integration ist nicht die Addition von Vielfalt und wertneutralem Multikulti, sondern muss von Anfang an angeboten und eingefordert werden.\" Zur Tagung der CSU-Landesgruppe Anfang Januar in Wildbad Kreuth wird auch CDU-Chefin Merkel erwartet. Populismus-Vorwurf aus der Opposition Grünen -Fraktionschefin Katrin Göring-Eckardt warf der CSU Populismus vor. \"Natürlich müssen Menschen, die in Deutschland leben wollen, sich an unsere Werte von Toleranz, Freiheit und Demokratie halten\", sagte sie dem \"Tagesspiegel\". \"Die Köpfe und Herzen der Geflohenen erreichen wir aber nicht mit einer Unterschrift auf einem Stück Papier und noch weniger mit Sanktionen\". Linke-Fraktionsvize Jan Korte sagte: \"Was soll eine Integrationspflicht eigentlich sein? Wie wird das überprüft? Bei wie vielen Integrationsverstößen muss man zum Idiotentest?\" Die CSU solle sich lieber einreihen, Flüchtlingen bei der Integration zu helfen, statt weiter das Klima zu vergiften. Die rheinland-pfälzische Ministerpräsidentin Malu Dreyer (SPD) sagte der \"Süddeutschen Zeitung\" (Dienstag): \"Sinnloser Aktionismus à la CSU löst die Probleme nicht.\" Wie jeder müssten sich auch Flüchtlinge an das Grundgesetz halten. Man brauche daher \"keine Vereinbarung oder ein Gesetz, das feststellt, dass das Grundgesetz gilt\". Trotz riesiger Nachfrage würden nicht genügend Integrationskurse angeboten. Zudem seien solche Kurse schon jetzt für Migranten Pflicht, die rechtmäßig und auf Dauer in Deutschland lebten. Die CSU macht sich in ihrem Papier daneben auch dafür stark, den Wohnungsbau zu stärken und schulische und berufliche Erfahrungen von Flüchtlingen früh abzufragen. Für Ehrenamtliche, die sich etwa als Trainer engagieren, solle es bürokratische Erleichterungen geben.",http://www.spiegel.de/politik/deutschland/fluechtlinge-csu-fordert-integrationspflicht-fuer-migranten-a-1069762.html,2015-12-28T00:00:00.000Z
