article,article_url,date
"Chrysler-Chef Zetsche \"Die Qualität des Marktes ist miserabel\" Mit der günstigen US-Konjunktur im Rücken verbreitet Chrysler-Sanierer Dieter Zetsche Optimismus. Doch der amerikanische Automarkt zeigt keine Anzeichen der Besserung. Die Preise sind im Keller, und die Konkurrenz nimmt zu. Von Carsten Volkery , New York Carsten Volkery Mehr Artikel von Carsten Volkery AFP \"Chrysler Guy\" Zetsche: Sparen, Sparen, Streamlining - und Hoffen, dass der Preiskrieg bald nachlässt New York - Seit eineinhalb Jahren ist Dieter Zetsche der \"Chrysler Guy\". Doch erst vergangene Woche konnte er zum ersten Mal ein positives Quartal vorweisen - wenn auch nur pro forma: Auf 127 Millionen Euro belief sich der operative Gewinn des US-Autobauers in den ersten drei Monaten des Jahres. \"Nicht dramatisch, aber immerhin dreistellig\", kommentierte Zetsche das Ergebnis am Dienstag vor den Journalisten der Association of German Business Correspondents (ABC) in New York.  Der Etappensieg gab Zetsche die Gelegenheit, Optimismus zu verbreiten. \"Das erste Quartal zeigt, dass sich der Markt nicht so verschlechtert hat wie erwartet\", sagte der Topmanager. Auch beim Turnaround sei man \"in allen Bereichen voll im Plan, oder sogar über Plan\". Zetsche bekräftigte das Ziel, dieses Jahr einen Pro-Forma-Gewinn zu erwirtschaften. Den will er vor allem durch weiteres Sparen und Streamlining erreichen. Und die Konjunktur müsse mitspielen, \"das ist meine einzige Bedingung\".  Doch gleichzeitig machten seine Bemerkungen deutlich, dass die US-Sparte von DaimlerChrysler noch erhebliche Probleme hat. So kam der Quartalsgewinn allein durch radikales Sparen zustande, darunter bisher 21.000 von 26.000 geplanten Entlassungen. Der Umsatz hingegen leidet weiterhin unter den hohen Auto-Rabatten, die nach dem 11. September eingeführt wurden. Das Umsatzziel habe man deswegen klar verfehlt, sagte Zetsche.   DDP Bilanz des Gesamtkonzerns DaimlerChrysler: Chrysler ist der größte Umsatzbringer, hat aber sein Umsatzziel verfehlt Und Besserung ist nicht in Sicht: Höhere Preise seien mindestens in diesem Jahr nicht durchsetzbar, sagte Zetsche. \"Die Qualität des Marktes ist miserabel.\" Für zusätzlichen Druck sorgt die Konkurrenz, die auf den weltgrößten Automarkt drängt und immer weitere Fabriken errichtet.   Die großzügigen Rabatt-Aktionen, die von General Motors begonnen wurden, bezeichnete Zetsche verächtlich als \"Kaufen von Marktanteilen\". Zwar habe GM dadurch tatsächlich die amerikanische Wirtschaft wieder angekurbelt, aber jetzt müsse damit Schluss sein: \"Preissenkungen sind nicht der richtige Weg, um Autos zu verkaufen\". Statt des \"Push-Marktes\" müsse man einen \"Pull-Markt\" schaffen: Der Kunde muss das Auto wollen.  Chrysler setze deshalb auf Qualität. Man sei \"grimmig entschlossen\", in die \"Gruppe der Besten\" aufzuschließen, sagte der Chef-Sanierer. In maximal fünf Jahren sollen die Marken Dodge, Jeep und Chrysler so gut sein wie Mercedes und Toyota. Die 2002-Modelle sind nach internen Messungen bereits 19 Prozent besser als die Vorjahresmodelle.  Doch ob sich Zetsches Strategie auf dem US-Markt durchsetzen lässt, ist fraglich. General Motors zeigt jedenfalls keine Anzeichen, den Preiskrieg abzublasen. Und bisher hat Chrysler dabei nur verloren: 2001 sank der Marktanteil auf 13 Prozent. Im ersten Quartal erholte er sich zwar leicht auf 13,6 Prozent, aber ob das zum Trend wird, bleibt abzuwarten. Zetsche sprach von \"positivem Momentum\", gab aber gleichzeitig zu: \"Beim Marktanteil haben wir in den eineinhalb Jahren nicht erreicht, was wir uns vorgenommen hatten.\"  DDP Zetsche-Chef Schrempp: Schadet die deutsche Konzernführung dem Marken-Image in Amerika? Vielleicht liegt es daran, dass die Öffentlichkeit von der \"Qualitätsoffensive\" noch nichts mitbekommen hat. Das Chrysler-Image sei immer noch zu schlecht, räumte Zetsche ein. Marketing und PR sollen das ändern. \"Das Image näher an die Faktenlage bringen\", nennt er das.   In Zukunft soll Chrysler vom Mercedes-Image profitieren. \"Total amerikanische\" Marken und deutsche Qualität - so lautet Zetsches Zauberformel für die \"neue Chryslergruppe\". Das erste hybride Produkt ist der Roadster Chrysler Crossfire, der zu 40 Prozent aus Mercedes-Teilen besteht. Mercedes-Vorstand Hubbert stehe voll hinter dem Komponenten-Sharing.  Spekulationen, dass Chryslers Umsatzprobleme auch daher rühren könnten, dass Amerikaner lieber rein amerikanische Marken kaufen, wies Zetsche zurück. \"Der Amerikaner ist ja sehr offen gegenüber dem Neuen, insbesondere dem Immigranten.\"  Mindestens ebenso umsatzschädlich wie das Image ist Chryslers Vertriebsstruktur. Chrysler-Händler haben den geringsten monatlichen Umschlag der Branche. Gleichzeitig haben sie ihre \"Showrooms\" mit den meisten Modellen, noch dazu von verschiedenen Marken, vollgestellt. Zetsche sieht einen Zusammenhang: \"Es kann nicht angehen, dass der Kunde erst über einen Kia stolpert, bevor er zu dem Minivan kommt, den er eigentlich haben will\", sagte er.  Deshalb will er die Händler mit Sonderanreizen dazu bringen, auszumisten und nur die Bestseller anzubieten. Dann werde sich das \"Potenzial der jungen Produktpalette\" voll entfalten.  Auch zur Integration der beiden Firmenkulturen von Daimler und Chrysler äußerte Zetsche sich kurz. Interne \"Morale Surveys\" zeigten, dass man \"auf gutem Weg zu innerem Verständnis\" sei. Auf die Frage, wann die Fusion denn abgeschlossen sei, entgegnete Zetsche salopp: \"Die Fusion von Daimler und Benz liegt 82 Jahre zurück. Und die können Sie auch noch nicht als abgeschlossen betrachten.\"",http://www.spiegel.de/wirtschaft/chrysler-chef-zetsche-die-qualitaet-des-marktes-ist-miserabel-a-194364.html,2002-05-01T00:00:00.000Z
"Heute in den Feuilletons \"Raufereien auf dem Schulhof\" Die \"NZZ\" bewundert Martin Scorsese, der für 115 Millionen Dollar einen nicht kommerziellen Film von \"kaum erträglicher Härte\" drehte. Die \"FR\" übernimmt ein Habermas-Interview aus \"The Nation\". Die \"taz\" betrachtet mit Grausen das Kulturleben von Bratislava. Die \"SZ\" ist für und gegen den EU-Beitritt der Türkei. Die \"FAZ\" denkt über eine europäische Verfassung nach. Neue Zürcher Zeitung, 13.12.2002 Auf der Medienseite berichtet Marc Zitzmann ausführlich über die Krise der französischen Qualitätsblätter . Doch Liberation , Le Monde und Le Figaro haben anders als in Deutschland bisher noch nicht im großen Stil Mitarbeiter entlassen. Und Le Monde setzt weiter auf das Internet: \"Während die Werbeflaute die Socpresse (mit dem Figaro , d. R.) unter anderem zur Reduktion der Mannschaft ihrer Website auf drei Personen gezwungen hat, setzt Le Monde mit knapp fünfzig Personen , darunter gut zwanzig Journalisten, weiterhin aufs Internet. Einen Personalabbau, so die Auskunft bei der Filiale Le Monde interactif , habe es nicht gegeben, doch musste die von den Journalisten der inhaltreichen Website konzipierte wöchentliche Beilage eingestellt werden.\" Thomas Binotto schreibt auf der Filmseite über die Uraufführung von Martin Scorseses neuen Film Gangs of New York in New York. Der Film werde es schwer haben, prophezeit der Rezensent: \"Erstens, weil die Erwartungen an Scorsese und dieses Herzensprojekt inzwischen ins Unerfüllbare gestiegen sind, und zweitens, weil er tatsächlich den Mut und das Durchsetzungsvermögen aufgebracht hat, für 115 Millionen Dollar einen ganz und gar unkommerziellen Film zu drehen. Es ist eine bittere Geschichtslektion, welche Scorsese hier seinen Landsleuten, aber auch allen 'I Love New Yorkern' zumutet. Mit kaum erträglicher Härte erzählt er die Geschichte eines New York, das auf Gewalt, Rassismus und Korruption gründet, wo es keine Helden gibt und deshalb auch eine zaghafte Liebesgeschichte nichts mehr geradezubiegen vermag.\"  Sieglinde Geisel poträtiert im Feuilleton den Berliner Kleinverlag \"Das Arsenal\" , der 1977 gegründet wurde und Autoren wie Franz Hessel , Tibor Dery oder Bela Balazs wiederentdeckt hat. Geisel spricht mit dem Verleger Peter Moses-Krause, der sich zur \"Urangst der 68er vor der Staatsknete \" bekennt.  Weitere Artikel: Hildegard Elisabeth Keller schreibt einen Nachruf auf den Germanisten Kurt Ruh . \"Jdl\" meldet, dass die Schweizer Autorin Katharina Faber für ihren Roman \"Manchmal sehe ich am Himmel einen endlos weiten Strand\" den Preis der Rauriser Literaturtage bekommen hat, der jährlich für ein Prosa-Debut vergeben wird. Maja Turowskaja porträtiert in ihrer Reihe \"Russland, persönllich\" den russischen Bühnenbildner David Borowski und feiert seine Erfolgsgeschichte auf russischen und dann europäischen Bühnen.  Besprochen werden eine Ausstellung des deutschen Produktdesigners Dieter Rams im Museum für angewandte Kuns t in Frankfurt am Main, die Aufführung von Richard Strauss' Oper \"Frau ohne Schatten\" an der Pariser Opera Bastille und eine Aufführung \"Porträt Jiri Kylian\" im Bayerischen Staatsballett , wo der berühmten tschechischen Choreograph drei seiner Werke aus unterschiedlichen Stilperioden einstudieren ließ.  Auf der Filmseite werden zwei weitere Filme besprochen: Die chinesische Komödie \"Happy Times\" (mehr hier ) vom \"bedeutensten chinesischen Regisseur der Gegenwart\", nämlich Zhang Yimou , und Gaspar Noes jüngstes Werk \"Irreversible\" (mehr hier ), das beim Wettbewerb in Cannes für Hohn, Spott und Wirbel gesorgt hatte (mehr hier ). Frankfurter Rundschau, 13.12.2002 Jürgen Habermas ist während seiner Gastprofessur in den USA von der Wochenzeitung The Nation nach seiner Meinung zur amerikanischen Irak-Politik befragt worden. Die FR druckt nun das Interview mit Habermas nach, in dem er unter anderem erklärt: \"Das einschüchternde Gehabe von Bush, Rumsfeld und anderen gegenüber deutschen Regierungsmitgliedern erinnert mich ein bisschen an Raufereien auf dem Schulhof . Bundeskanzler Schröder hatte recht, Bushs stillschweigenden Schwenk in der Irakpolitik - von der Entwaffnung zum Regimewechsel - abzulehnen. Allerdings hätte er zugleich seine Bereitschaft, entsprechende UN-Beschlüsse anzuerkennen, erklären sollen.\" Hier das Original-Interview, falls die FR ihren Hausprofessor auch noch kürzen musste.  Es war einmal, als sich Armeen auf einem Feld trafen und auf ein Zeichen begannen, aufeinander loszustürmen. Jochen Stöckmann informiert uns über das Ende des Landschaftskriegs . Der technologischen Überlegenheit der USA, \"so fürchtet nicht nur General Krulak , werden anonyme Terrorgruppen und die teuflischen Kleinmeister der 'asymmetrischen' Kriegführung begegnen, indem sie den US Army-Koloss in eine 'komplexe, chaotische, ja todbringende Umgebung locken', an einen Platz, den man 'Stadt' nennt. Verglichen mit Asphalthöllen und Betonlabyrinthen , so diagnostiziert der Armeechirurg Robert Leitch, sind Steppen, Wüsten und sogar der Dschungel saubere und angenehme Orte.\"  Weiteres: Axel Veiel berichtet vom Blick der Spanier in die Abgründe der Franco-Diktatur . Unter Journalisten, Schriftstellern, Theaterregisseuren und Filmemachern habe eine Art \"kollektive Wahrheitssuche\" eingesetzt, die sich nicht aus einem Ruf nach Gerechtigkeit oder Vergeltung speise, sondern aus einem rational distanzierten Wunsch nach Wahrheit. Ralf Grötker hat Jan Philipp Reemtsma (mehr hier ) in Berlin zugehört , als der versucht hat zu erklären, was für Menschen Terroristen eigentlich sind. Times mager beschäftigt sich mit Roland Kochs gestriger verbaler Entgleisung . Gemeldet wird schließlich die erleichternde Tatsache , dass Friedrich II. doch nicht vergiftet wurde.  Auf der Medienseite erklärt Inge Günther, warum der Dokumentarfilm \"Dschenin, Dschenin\" des arabisch-israelischen Schauspielers und Regisseurs Mohammed Bakri (hier ein BBC-Interview ) von Israels Zensurbehörde verboten wurde.  Besprochen werden Bill Paxtons Horrorfilm \"Dämonisch\", Zacharias Kunuts Inuit-Film \"Atanarjuat - Die lebende Legende vom schnellen Läufer\", eine Ausstellung mit neuen Bildern des Malers Norbert Bisky in Frankfurt an der Oder, Kolja Lessings Seance mit Violinmusik von Emigranten in Stuttgart, der Band \"50 Jahre Shell Jugendstudie \" und als CD der Woche zwei Werke von Alexander Knaifel (mehr in unserer Bücherschau ab 14 Uhr). Die Tageszeitung, 13.12.2002 Auf seinem Streifzug durch das kulturelle Leben des slowakischen Bratislava kommt Dietrich Kuhlbrodt das Angebot an Festivals und Museen wie eine Sozialismus-Finissage ohne Personalwechsel vor. \"Man muss nur 40 Kilometer von Wien aus donauabwärts aufs linke Ufer wechseln. In Bratislava, dem alten Pressburg, kann man erleben, was aus der Post-DDR hätte werden können, wären die alten Kader geblieben, die Wende zu vollstrecken. Wenn die Wessis im Westen geblieben wären. Wenn für Ostalgie heute kein Bedarf wäre. Die Slowakei ist heute ein lebendiges Museum des Was-wäre-wenn .\"  Auf der Meinungsseite will Bassam Tibi der Türkei nur einen Platz in Europa einräumen, wenn die türkischen Eliten einen \"wertemäßig und alltagskulturell\" europäisierten Islam ausprägten, \"der mit säkularer Demokratie, individuellen Menschenrechten, Zivilgesellschaft, laizistischer Toleranz, Kultur- und Religionspluralismus vereinbar ist\".  Auf der Medienseite symphatisiert Reinhard Wolff mit der \"redaktionell ambitionierten\" neuen dänischen Tageszeitung \"Dagen\", der nach einem Monat schon wieder das Aus droht.  Ansonsten widmet sich die taz der Musik: Nils Michaelis sichtet eine Reihe von CD-Retrospektiven aus der Geschichte des Reggae und Stefan Müller stellt Panjabi MC und den \"ungewöhnlichsten Hit des Jahres\" vor.  Besprochen werden die Ausstellung \"Die öffentliche Tafel\" in Berlin und Alben von Richmond Fontaine , Azure Ray und The Good Life .  Schließlich TOM . Süddeutsche Zeitung, 13.12.2002 Reinhard J. Brembeck fragt , ob das Theater in Deutschland angesichts der immer lauter murrenden Nichttheatergänger, zu denen - so Brembeck - die geistigen Eliten, Politiker und die Jungen zählen, überhaupt Sinn macht: Bei Brembeck gewiss: \"Nur wer erlebt hat, dass bei Aischylos , Monteverdi , Moliere , Janacek , Claudel oder Birtwistle die eigene verzweifelte Lage in einer feindlichen Welt verhandelt wird und begreift, dass dies nichts mit dem Alter der Stücke zu tun hat, sondern dass diese sich problemlos auf das Hier und Heute beziehen lassen, ohne historische oder ästhetische Vorkenntnisse, und wer dann erlebt, dass dieser Spiegel der eigenen Situation in einer künstlerisch verfremdeten Situation Sinn stiftet und Lebenssinn vermittelt, kann den maßlosen Anspruch des angeblich so anchronistischen Theaters ermessen: Dass es wichtiger für eine Gesellschaft sein will als andere Formen der Unterhaltung wie Popmusik, Fernsehen oder Sport.\" Die Debatte um einen EU-Beitritt der Türkei geht mit großen Essays weiter: Christian Wernicke ist dagegen . Denn selbst wenn die Türkei reif sei für die EU, Brüssel sei noch lange nicht reif für Istanbul . Der israelische Historiker Dan Diner (mehr hier ) ist dafür , weil die Türkei die verborgenen Schwachstellen Europas aufdecken würde.  Weiteres: Claus Koch resigniert in seinen Noten und Notizen vor dem 20-Minuten Takt der Gesellschaft und dem \"munteren Schnodderton\" der Journalisten. Egal ob Bioethik oder Papst: Niemand könne mehr mit \"schlichtem Ernst\" schreiben. Wolf Lepenies erinnert an den großen amerikanischen Soziologen Talcott Parsons (mehr hier ), der vor einhundert Jahren geboren wurde. Andreas Wilink berichtet von den finanziellen Schwierigkeiten, in denen Gerard Mortier mit seiner Ruhr Triennale steckt. Ralf Berhorst war in Berlin, als Jan Philipp Reemtsma eine Typologie des Terroristen vorstellte. Hans Hoff macht sich Gedanken über die Zukunftsfähigkeit des Nonsense-Barden Helge Schneider . \"ijo\" findet es verdächtig, wenn der Kanzler von sich in der dritten Person spricht. Volker Breidecker macht uns mit dem neuen kühnen Museumsbau im ostwestfälischen Herford bekannt, dass sich an nichts Geringerem als dem MoMA in New York orientiert.  Auf der Medienseite berichtet Gerhard Fischer vom Ende der neuen dänischen Tageszeitung \"Dagen\" - etwas mitleidsloser als sein Kollege in der taz.  Genausowenig Mitleid hat Juan Moreno auf der Dritten Seite mit der Musikindustrie , die bei der Talentsuche völlig versage. Besprochen werden die Opera-bouffe \"Die Großherzogin von Gerolstein\" am Deutschen Theater Berlin, die französische Wiederentdeckung von Roland Barthes im Centre Pompidou sowie Bücher , darunter Pierluigi De Vecchis schwermütig schöner Raffael Bildband und der erste Teil der gesammelten Urkunden des Stauferkaisers Friedrich II. (mehr in unserer Bücherschau ab 14 Uhr). Frankfurter Allgemeine Zeitung, 13.12.2002 Juraprofessor Gerd Roellecke (mehr hier ) erklärt , \"weshalb Europa eine Verfassung erhalten soll\" und geht dabei auf die Arbeit des von Giscard d'Estaing geleiteten Europäischen Konvents ein: \" Gar nichts bewirken kann der Vor-Vorentwurf einer Verfassung für Europa schon heute nicht mehr. Selbst wenn aus ihm nicht mehr würde als eine Kodifikation, eine systematisierende Zusammenfassung des geltenden Rechtes, würde er den nicht regelbaren Kontext der geltenden Regeln angreifen, die informellen Voraussetzungen der formellen Normen, und das würden mindestens die Politiker spüren.\" Verstehe.  Weitere Artikel: Heinrich Wefing erzählt , wie Kalifornien per Gesetz (nämlich dem \"Holocaust Victim Insurance Relief Act\" ) Klarheit über den Holocaust sucht und sich damit gegen den Rest der Welt stellt. Hans-Peter Riese informiert über Schwierigkeiten der Guggenheim-Stiftung in New York, deren Stiftungsvermögen durch die Börsenkrise geschmolzen ist. Kurt Flasch (mehr hier ) schreibt zum Tod des Germanisten Kurt Ruh . Auf der letzten Seite werden Gedichte W. G. Sebalds zu hyperrealistischen Gemälden von Augenpaaren des Malers Jan Peter Tripp präsentiert - im Stuttgarter Literaturhaus ist dieser Zusammenarbeit eine Ausstellung gewidmet. Auf der Medienseite schildert Michael Hanfeld die neuesten Peripetien im Drama zwischen dem ehemaligen Schweizer Botschafter Thomas Borer , seiner Frau Shawne und den Medien.  Besprochen werden eine Ausstellung über das Lebenswerk des Fotografen Stefan Moses in München , eine Ausstellung über den Zeichner F. K. Waechter in Frankfurt, Choreografien des Kanadiers Benoit Lachambre für die Berliner Schaubühne, der Film \"Zwischenland\" der Niederländerin Eugenie Jansen und eine Ausstellung zur Exilliteratur in Solingen .",http://www.spiegel.de/kultur/gesellschaft/heute-in-den-feuilletons-raufereien-auf-dem-schulhof-a-226907.html,2002-12-13T00:00:00.000Z
"Wahlkampf in der Türkei Gül kämpft für seine Kandidatur Der türkische Präsidentschaftskandidat Abdullah Gül wehrt sich gegen Kritik an seiner Person. Er wolle kein religiöser Präsident werden, kündigt er jetzt an - und fordert im Gespräch mit deutschen Politikern die Türken in der Bundesrepublik auf, sich zu integrieren und Deutsch zu lernen. Aus Ankara berichtet Anna Reimann Christian O. Bruch/ laif Anna Reimann Twitter: AnnaReimann1 folgen Mehr Artikel von Anna Reimann Ankara - Wochen nach den Massendemos gegen eine Islamisierung der Türkei und seine Präsidentschaftskandidatur will der türkische Außenminister Abdullah Gül (AKP) eine weitere Polarisierung der türkischen Bevölkerung verhindern. Er sehe sich weiter als Präsidentschaftskandidat, aber wolle kein religiöser Präsident werden, sagte Gül der Zeitung \"Hürriyet\". DPA Abdullah Gül: \"Wir hätten fünfmal so viel Leute auf die Straße bringen können\" Den Vorwurf der Opposition, die AKP habe eine Hidden Agenda , nämlich die Errichtung eines islamischen Staates in der Türkei, wies Gül zurück. Seine Partei habe sich für die Beitrittsverhandlungen mit der EU eingesetzt. \"Warum sollten wir, wenn wir solche Absichten hätten, in die EU eintreten?\", fragte der AKP-Politiker vor Grünen-Politikern und Journalisten in Ankara. Seine Partei wolle niemandem die Religion aufzwingen.   Gleichzeitig kritisierte Gül die Organisatoren der jüngsten Massendemonstrationen in Istanbul, Izmir und Ankara scharf. Die AKP-Regierung nehme die Tatsache ernst, dass viele Menschen - darunter auffällig viele Frauen - auf die Straße gegangen seien. Die Regierung begegne den Massen mit Sympathie. Die Organisatoren der Demonstrationen, vor allem kemalistische, laizistische Nichtregierungsorganisationen, seien aber weder sozialdemokratisch noch links, sondern EU- und investitionsfeindlich. Die nationalistischen Tendenzen unter den Laizisten würden stärker. Dass überhaupt solche großen Demonstrationen möglich seien, sei auch das Verdienst der AKP, die mehr Freiheiten in der Türkei geschaffen habe. Warum große Teile der Bevölkerung dennoch gegen die AKP auf die Straße gingen und offenbar eine große Angst vor dem Erstarken des religiösen Lagers existiert, erklärte Gül nicht. Nur so viel: \"Wenn wir gewollt hätten, hätten wir innerhalb eines Tages fünfmal so viele Leute zusammengebracht, aber wir wollen keine Polarisierung des Landes.\" Gül: \"Türkische Migranten sollen Deutsch lernen\" Hunderttausende Menschen waren in den vergangenen Wochen in der Türkei und auch Berlin auf die Straße gegangen, um ihre Furcht vor einer Islamisierung der Türkei zum Ausdruck zu bringen und gegen die Kandidatur Güls als Staatspräsident zu protestieren. Das Verfassungsgericht hatte die Wahl Güls Anfang Mai für ungültig erklärt - mit der Begründung, es seien zu wenig Abgeordnete bei der Abstimmung im Parlament anwesend gewesen. Nun muss der amtierende Staatspräsident Ahmet Necdet Sezer über eine von der AKP auf den Weg gebrachte Verfassungsänderung entscheiden, nach der der Präsident direkt vom Volk statt vom Parlament gewählt werden soll. Die türkische Opposition und Teile der Bevölkerung sehen in der Kandidatur Güls ein Mittel, um die Türkei zu islamisieren. Alle drei obersten Staatsämter, Ministerpräsident, Parlamentspräsident und Staatspräsident, wären in der Hand der religiösen Partei AKP. Wann die Präsidentschaftswahlen stattfinden, ist noch unklar. In der Runde mit Journalisten und Grünen-Politikern, unter ihnen der Europaabgeordnete Cem Özdemir, äußerte Gül sich auch zu den in Deutschland lebenden Türken. In deutlichen Worten forderte der Außenminister seine Landsleute auf, sich in Deutschland zu integrieren. Es sei nicht richtig, nicht mit dem eigenen Nachbarn sprechen zu können und nur Verbindungen zur Türkei zu unterhalten, sagte Gül. \"Die türkischen Migranten in Deutschland sollen unbedingt die deutsche Sprache lernen und Deutschland als ihre neue Heimat anerkennen.\"",http://www.spiegel.de/politik/ausland/wahlkampf-in-der-tuerkei-guel-kaempft-fuer-seine-kandidatur-a-485641.html,2007-05-30T00:00:00.000Z
