article,article_url,date
"Interview mit Friedensaktivistin Deeg \"Arafat wirkt maskenhaft\" Sophia Deeg ist eine von 32 internationalen Friedensaktivisten, die sich derzeit im Hauptquartier von Palästinenserpräsident Jassir Arafat in Ramallah aufhalten. Im SPIEGEL-ONLINE-Interview schildert die 50-jährige Lehrerin aus München ihre Eindrücke aus dem umkämpften Komplex. DPA Ramallah: Friedensaktivistin hinter einem israelischen Panzer SPIEGEL ONLINE: Wie kommen Sie und ihre 21-jährige Tochter dazu, sich dieser Gefahr auszusetzen?  Sophia Deeg: Ich beschäftige mich schon seit längerem mit dem Nahostkonflikt. Unsere Gruppe besteht aus 32 Personen, überwiegend Franzosen der Organisation \"Zivile Mission zum Schutz des palästinensischen Volkes\". Wir versuchen dort, wo Regierungen kaum noch Einfluss haben, für einen gewissen Schutz vor Ort zu sorgen, sozusagen ein Netzwerk von unten aufzubauen, zumindest aber die Aufmerksamkeit der Welt auf diese Vorgänge zu lenken. Schließlich wurden ja die Medien bereits aus Ramallah verdrängt.  DPA Im Hauptquartier von Ramallah: Arafat am 31. März bei einer Pressekonferenz SPIEGEL ONLINE: Wie sieht die Situation in Jassir Arafats Hauptquartier aus? Deeg: Wir können uns innerhalb des Gebäudes frei bewegen. Draußen hingegen ist es gefährlich, selbst für uns als Ausländer. Unsere diplomatischen Vertretungen haben uns geraten, keinen Schritt mehr durch die Straßen der Stadt zu wagen. SPIEGEL ONLINE: Sind die israelischen Soldaten im Regierungskomplex?  Deeg: Wir können sie nicht sehen. Sie sollen aber einen Teil besetzt haben.  SPIEGEL ONLINE: Wie ist die Lage auf den Straßen von Ramallah?  Deeg: Im Grunde genommen kennt das israelische Militär keine Skrupel, keine Tabus mehr. Ambulanzen und Feuerwehr dürfen nicht mehr fahren, auch die Versorgung der Bevölkerung, selbst die medizinische, ist unter diesen Umständen nicht mehr möglich. Gestern sind ja auch internationale Friedensaktivisten, die allerdings zu einer anderen Gruppe gehören, angeschossen worden. Sie wollten den Einsatz von Panzern in einem Flüchtlingslager verhindern. Einige von ihnen wurden in Krankenhäuser verbracht.  SPIEGEL ONLINE: Wie versorgt sich ihre Gruppe im Hauptquartier?  Deeg: Wir zehren von dem, was wir vorgestern hier hereingebracht haben, von Brot und Wasser. Wobei langsam das Wasser zur Neige geht.  SPIEGEL ONLINE: Sind Sie mit Arafat zusammengetroffen?  Deeg: Ja, mehrmals im Verlaufe der vergangenen beiden Tage. Er hat uns gleich zum Abendessen empfangen, auch gestern waren wir seine Gäste. Vorhin ( das Gespräch wurde am frühen Nachmittag geführt, die Redaktion ) war er auch kurz hier unten, wo wir uns befinden.  SPIEGEL ONLINE: Haben Sie mit Arafat sprechen können?  Deeg: Von einem Gespräch kann man im eigentlichen Sinne nicht sprechen. Wie auf den Fernsehbildern wirkt er auch im persönlichen Zusammentreffen: sehr starr, sehr maskenhaft. Er hat uns gegenüber erklärt, dass er sich über unsere Gegenwart freue, dass wir auch einen gewissen Schutz für ihn darstellen.  SPIEGEL ONLINE: Äußert er sich über Ariel Scharon, seinen Widersacher?  Deeg: Er schimpft über ihn, wirft ihm vor, er habe nicht verstanden, welche Vorteile Israel durch seine Friedenspolitik gewonnen habe, dass erst durch das Friedensabkommen zwischen ihm und dem ermordeten Premier Jizchak Rabin Israel in vielen arabischen Ländern diplomatisch anerkannt worden sei.  SPIEGEL ONLINE: Haben Sie den Eindruck, er überblickt noch die Situation?  Deeg: Das ist schwer zu sagen. Arafat gibt uns gegenüber nur Statements ab, er erzählt Anekdoten, etwa aus seiner Armeezeit in Ägypten. Ein wirklicher Austausch mit uns findet nicht statt. Auf mich wirkt er wie ein alter Mann, der er ja auch mittlerweile schon ist.  Das Interview führte Severin Weiland",http://www.spiegel.de/politik/deutschland/interview-mit-friedensaktivistin-deeg-arafat-wirkt-maskenhaft-a-189909.html,2002-04-02T00:00:00.000Z
"Palästina Arafat stellt Bedingungen für Neuwahlen Für Tage sah es danach aus, als ob es im Nahen Osten zu einer Befriedung kommen könnte. Nun fallen die Protagonisten des Konflikts in alte Muster zurück. Israel rückte mit 20 Panzern nach Dschenin ein - und Palästinenserchef Jassir Arafat stellt die angekündigten Wahlen in Frage. In Nablus wurde ein siebenjähriges Kind erschossen. AFP Spuren israelische Zerstörung: Ausgebranntes Haus in Dschenin Ramallah/Gaza - Bei der Militäraktion in Dschenin kam es palästinensischen Augenzeugen zufolge zu Feuergefechten. Die israelischen Soldaten seien jedoch nicht unter schweren Beschuss geraten, teilte die Armee mit. In dem Flüchtlingslager umstellten Soldaten das Haus des lokalen Hamas-Anführers Dschamal Abu Alhidscha und forderten die Familie auf, das Gebäude zu verlassen. Wie der 14-jährige Sohn des Gesuchten erklärte, war sein Vater zu dem Zeitpunkt nicht zu Hause. Die Soldaten hätten daraufhin das Haus in Brand gesetzt. Auch in der Stadt suchte die Armee nach eigenen Angaben nach Extremisten.  Die Soldaten nahmen bei dem Angriff insgesamt 20 Palästinenser fest, darunter zwei gesuchte Extremisten der militanten al-Aksa-Brigaden, die sich zu zahlreichen tödlichen Anschlägen gegen Israelis bekannt haben. Israels Armee verhängte eine Ausgangssperre in Dschenin.  Tote bei Tulkarm und im Gaza-Streifen Für mehrere Stunden drang die israelische Armee auch in die autonomen palästinensischen Städte Nablus und Tulkarm im Westjordanland ein. Augenzeugen und Angehörige berichteten, dass in Nablus ein siebenjähriges Kind irrtümlich erschossen wurde. Drei weitere Kinder seien verletzt worden. Die Soldaten feuerten den Angaben zufolge von Panzern aus mit Maschinengewehren um sich, nachdem sie im Flüchtlingslager Askar mit Steinen beworfen wurden. Eine der Kugeln habe den sieben Jahre alten Amid Abu Sir in seinem Elternhaus getroffen, auch sein Vater sei von Splittern getroffen worden. Insgesamt habe es sechs Verletzte gegeben. Der Junge hatte sich seiner Familie zufolge gerade auf den Besuch der Freitagsgebete vorbereitet, als ihn die tödliche Kugel traf.  Bei einem Anschlag mutmaßlicher palästinensischer Extremisten wurde am Freitag bei Tulkarm eine arabische Israelin getötet. Sie war in einem Auto mit israelischem Kennzeichen nahe der Ortschaft Schweikeh unterwegs, als ihr Fahrzeug aus einem Hinterhalt beschossen wurde. Sie wurde nach israelischen Angaben in den Rücken getroffen und tödlich verletzt. Die Frau stammte aus einem israelisch-arabischen Ort nahe der grünen Grenze zum Westjordanland.  Einen Toten gab es auch im Norden des Gaza-Streifens. Offenbar beim Versuch einen Terroranschlag auf die jüdische Siedlung Dugit zu verüben, wurde in der Nacht zum Freitag ein militanter Palästinenser getötet. Nach israelischen Angaben hatte der 21-Jährige versucht, in die durch einen Sicherheitszaun geschützte Siedlung einzudringen. Als er von Soldaten entdeckt wurde, warf er Handgranaten auf sie und wurde erschossen. Nach palästinensischen Angaben war der Extremist Mitglied der al-Aksa-Brigaden und gehörte der Force 17 an, die auch die Leibwache von Arafat stellt.   Arafats Rückzieher Palästinenserführer Arafat hat unterdessen seine Ankündigung, noch in diesem Jahr allgemeine Wahlen in Palästina abzuhalten, stark eingeschränkt. Arafat will erst dann neu wählen lassen, wenn Israel die seit fast 20 Monaten andauernde Umzingelung der Städte und Dörfer beendet. Nach palästinensischen Berichten ordnete Arafat dennoch an, die Wahlregister für die Präsidentschafts- und Parlamentswahlen vorzubereiten. Es würden auch bereits Wahllisten für die etwa 1,6 Millionen Wahlberechtigten erstellt, hieß es aus Parlamentskreisen. Eine umfassende Kabinettsumbildung sowie eine völlig neue Kommandostruktur für die palästinensischen Sicherheitsorgane haben neben den USA und der EU auch palästinensische Abgeordnete verlangt.  Arafat hatte zunächst für Verwirrung gesorgt, als er vor Journalisten erklärte, Israel müsse sich vor palästinensischen Wahlen zunächst auf die endgültigen Grenzen zurückziehen, die nach den Verträgen von Oslo ursprünglich bis 1999 vereinbart werden sollten. Später korrigierte dies Planungsminister Nabil Schaath. Israels Truppen müssten sich auf Positionen zurückziehen, die sie vor Beginn des Konflikts im September 2000 eingenommen hätten.  Keine Beweise für Beteiligung an Terror Das US-Außenministerium hat dem Kongress in Washington einen Bericht zugeleitet, aus dem hervorgeht, dass es \"keine eindeutigen Beweise\" dafür gibt, dass Arafat oder andere führende Köpfe der Palästinensischen Befreiungsorganisation (PLO) zwischen Mitte Juni und Mitte Dezember vergangenen Jahres aktiv an Terroranschlägen gegen Israel beteiligt waren. Dies hatte die israelische Regierung behauptet. In dem Bericht wird jedoch nicht ausgeschlossen, dass führende Personen der PLO und der palästinensischen Autonomiebehörde von der Verwicklung einiger PLO-Mitglieder in Gewalttaten gegen Israel Kenntnis hatten und wenig unternahmen, um diese daran zu hindern.",http://www.spiegel.de/politik/ausland/palaestina-arafat-stellt-bedingungen-fuer-neuwahlen-a-196792.html,2002-05-17T00:00:00.000Z
"Gaza-Offensive Israel verhandelt mit Palästinensern Israel hat seine Offensive gegen militante Palästinenser im Gaza-Streifen fortgesetzt. Die Regierung verhandelt jedoch mit der Autonomiebehörde über ein Ende der Angriffe. Jerusalem - Israel sei zu einer Einstellung der Kämpfe bereit, wenn die palästinensische Seite ein Ende der Raketenangriffe auf israelische Städte zusichere, hieß es aus Militärkreisen. Der palästinensische Präsident Jassir Arafat hatte die militanten Gruppen am Montagabend indirekt aufgerufen, den Raketenbeschuss auf israelische Grenzorte einzustellen. \"Ich rufe alle Gruppen auf, die palästinensischen Interessen über alles zu stellen und der Besatzung keinen Vorwand gegen uns zu geben\", sagte Arafat in einer Rundfunkansprache. Die Militäroffensive Israels war am vergangenen Mittwoch nach dem Tod zweier israelischer Kinder bei einem Raketenangriff auf die Grenzstadt Sderot eingeleitet worden.  Auch am Dienstag ging die Offensive weiter. Bei einem israelischen Luftangriff im Flüchtlingslager Dschebalija wurden ein bewaffneter Palästinenser getötet und drei weitere verletzt. Nach palästinensischen Angaben schoss eine unbemannte Drohne eine Rakete auf die Gruppe ab. Insgesamt kostete die Militäraktion seit Mittwoch mindestens 68 Palästinenser und drei Israelis das Leben.",http://www.spiegel.de/politik/ausland/gaza-offensive-israel-verhandelt-mit-palaestinensern-a-321483.html,2004-10-05T00:00:00.000Z
