article,article_url,date
"Gewalt gegen Polizisten Bespuckt, beschimpft, bedroht Freund und Helfer war gestern - heute treffen Polizisten immer öfter auf Verachtung, Ablehnung, Aggression. In einer großen Studie soll der beunruhigende Trend jetzt untersucht werden: \"Bullen aufzumischen\" sei längst zum Hobby gewalttätiger Jugendgangs geworden, klagen Beamte. Von Jörg Diehl Jörg Diehl Jahrgang 1977. Studierte Geschichte, Germanistik und Politikwissenschaft an der Universität Münster. Freie Mitarbeit und Praktika unter anderem bei der \"Rheinischen Post\", der Deutschen Presse-Agentur, dem Westdeutschen Rundfunk, \"Bild\" und SPIEGEL. Volontierte beim Norddeutschen Rundfunk und schrieb anschließend als Redakteur erst für SPIEGEL ONLINE, dann für \"Bild am Sonntag\". Seit April 2007 wieder bei SPIEGEL ONLINE, von Januar 2009 bis Februar 2011 stellvertretender Ressortleiter Panorama, anschließend Korrespondent in Düsseldorf. Seit Mai 2014 Chefreporter. Seit Juli 2017 zudem Leiter des Teams Hintergrund und Recherche. E-Mail: Joerg.Diehl@spiegel.de Twitter: @spondiehl folgen PGP: Öffentlichen Schlüssel herunterladen Fingerprint: A253 20AC 5B3A 7AA2 3DAF D82F 8712 E7D4 F034 014B Mehr Artikel von Jörg Diehl Hamburg - \"Je später die Nacht\", schrieb der Beamte aus Nordrhein-Westfalen seinem Vorgesetzten, \"desto größer der Wahnsinn.\" Der Brief, der SPIEGEL ONLINE vorliegt, war ein Hilfeschrei eines erfahrenen Dienstgruppenleiters, ein Zeugnis der voranschreitenden gesellschaftlichen Verwahrlosung ebenso sehr wie der zunehmenden Überforderung der Polizei. Obschon das Dokument bereits vor einigen Monaten entstand, scheint es seither nichts von seiner grundsätzlichen Relevanz eingebüßt zu haben. \"Die Gewaltspirale dreht sich immer schneller\", notierte der Polizist aus Düsseldorf, das \"erträgliche Maß\" sei längst überschritten. Seine Untergebenen würden inzwischen regelmäßig \"geschlagen, getreten und mit Flaschen beworfen\", zudem bespuckt, beleidigt und mit dem Tode bedroht. Die vermeintlichen Ordnungshüter seien längst \"zu Statisten des Sauf- und Erlebnistourismus degradiert\" worden, mit denen man sich ungestraft anlegen könne. Gerade unter \"jungen Migranten\" sei es angesagt, am Wochenende \"Bullen aufzumischen\". Respekt vor Amtspersonen: Fehlanzeige. In der allgemeinen Hektik einer solchen Situation - nicht selten stünde den Beamten ein Mob von Hunderten gegenüber - könnten die meisten Angreifer sogar noch \"ungestraft das Weite suchen\". \"Widerstand gegen Vollstreckungsbeamte\" Laut polizeilicher Kriminalstatistik ist die Zahl der Fälle von \"Widerstand gegen Vollstreckungsbeamte\", wie die Rangeleien, Schlägereien und körperlichen Auseinandersetzungen im Strafgesetzbuch heißen, in den vergangenen zehn Jahren um mehr als 20 Prozent gestiegen. Wie viele Beamte in Ausübung ihres Dienstes verletzt wurden, weist die Statistik jedoch nicht aus. Polizisten werden nicht gesondert aufgeführt. Jedoch hat sich - nach langem Hickhack - die Politik nun endlich dazu aufgerafft, das Phänomen \"Gewalt gegen Polizisten\" wissenschaftlich untersuchen zu lassen. Das Kriminologische Forschungsinstitut Niedersachsen (KFN) des früheren Landesjustizministers Christian Pfeiffer bekam den Zuschlag für den etwa 100.000 Euro teuren Auftrag, allerdings fällt die Untersuchung nun wesentlich kleiner aus als zunächst geplant. Es ist ein Kompromiss, nicht der ganz große Wurf.  Denn nichts weniger als die weltgrößte Untersuchung hatte das KFN ursprünglich geplant, 260.000 Polizisten sollten dazu befragt werden, doch dann stellten sich die Deutsche Polizeigewerkschaft (DPolG) und die unionsregierten Bundesländer quer. Sie störten sich an Fragen nach dem Privatleben und der Jugend der Beamten, die schließlich Opfer seien. Das KFN lenkte ein - und speckte den Katalog ab. Trotzdem verweigerten Bayern, NRW, Sachsen, Hamburg und die Bundespolizei ihre Teilnahme. \"Sie sind die Opfer, nicht die Täter\" \"Es bestand die Besorgnis\", so begründete der Bundesinnenminister vor einigen Tagen seine ablehnende Haltung, \"dass die Ergebnisse der Studie möglicherweise in einem anderen Kontext betrachtet würden ( ) und in der öffentlichen Diskussion falsch interpretiert und dargestellt werden könnten.\" Diese Sorge hat auch DPolG-Chef Rainer Wendt, wie er SPIEGEL ONLINE sagte: \"Auch in der Endfassung finden sich Fragen, die ich für problematisch halte.\" So erbäten sich die Wissenschaftler noch immer Informationen über die Gesinnung der Beamten (\"Wie sehen Sie die Polizisten in der heutigen Gesellschaft?\"), über ihr Geschlecht und einen möglichen Migrationshintergrund. \"Am Ende sind die Polizisten noch selbst Schuld, wenn sie angegriffen werden. Sie sind die Opfer, nicht die Täter\", so Wendt. Die Gewerkschaft der Polizei (GdP) fordert, eine neue Strafrechtsnorm \"Tätlicher Angriff auf einen Vollstreckungsbeamten\" (§ 115 StGB) zu schaffen. Der aktuell gültige Paragraf 113 \"Widerstand gegen Vollstreckungsbeamte\" knüpfe die Strafbarkeit von Widerstandshandlungen an eine Vollstreckungssituation, unvermittelte Angriffe aus dem Nichts würden von der Vorschrift nicht erfasst. Sie seien allenfalls Körperverletzungsdelikte. Der designierte nordrhein-westfälische DPolG-Landesvorsitzende Erich Rettinghaus geht sogar noch einen Schritt weiter und verlangt, die Bewaffnung der Streifenpolizisten zu verbessern - mit Tasern, also Elektroschockern. \"Wenn alle Deeskalation gescheitert ist, muss gehandelt werden\", so Rettinghaus gegenüber SPIEGEL ONLINE. \"Greift man uns oder andere mit einem Messer an, dürfen wir nicht mit einer Wasserpistole reagieren.\" Taser könnten den Einsatz von Schusswaffen in solchen Situationen überflüssig machen. Gewalterfahrungen machen krank Pfeiffer und seine Mitarbeiter wollen in den nächsten vier Wochen knapp 86.000 Polizisten per Online-Fragebogen einvernehmen. Die Beamten sollen sich unter anderem dazu äußern, wie es zu den Übergriffen kam, welche Schutzausstattung sie hatten und ob später noch körperliche oder psychische Folgen auftraten. Der Fragebogen erfasst nicht nur Gewaltopfer, sondern richtet sich an alle Polizisten. Außerdem plant das KFN auch rund 30 bis 50 Einzelinterviews mit Beamten, die im Dienst verletzt wurden. Institutsleiter Pfeiffer rechnet damit, dass er im April einen ersten Überblick über die Ergebnisse der Studie haben wird. Die Zeit drängt. Viele Beamte sind schon jetzt mit ihren Kräften am Ende. Nach offiziellen Angaben war 2008 jeder fünfte Polizist in NRW mehr als sechs Wochen dienstunfähig, in besonders problematischen Dienststellen fehlte fast jeder Zweite dauerhaft und regelmäßig. Gleichzeitig mussten die verbleibenden Beamten immer mehr Aufgaben übernehmen. \"Ich weiß\", schrieb der Düsseldorfer Dienstgruppenleiter, \"dass es krank macht, sich auf der Straße bespucken, beleidigen und sonst wie angreifen zu lassen.\" Früher sei es \"da draußen\" schon manchmal rau zugegangen, doch das habe sich geändert. \"Es ist jetzt die Regel, und diese Regel muss wieder gebrochen werden.\"",http://www.spiegel.de/panorama/justiz/gewalt-gegen-polizisten-bespuckt-beschimpft-bedroht-a-677320.html,2010-02-12T00:00:00.000Z
"Neue Provokation Sarrazins Juden-Thesen empören Regierung Erst die Muslime, dann die Juden: Mit kruden Thesen zieht Thilo Sarrazin nun auch den Zorn der Minister Westerwelle und Guttenberg auf sich. Doch inzwischen findet der Bundesbank-Vorstand auch Unterstützer. Berlin - Seine eigene Partei droht ihm mit Ausschluss und will ihn loswerden - doch Thilo Sarrazin erschüttert das nicht. Nach seinen Diffamierungen gegen Muslime verbreitet der SPD-Politiker nun auch krude Thesen über Juden und zieht damit den Zorn von Spitzenpolitikern auf sich. Bundesminister versuchen nun, ihn zur Räson zu bringen. Verteidigungsminister Karl-Theodor zu Guttenberg stellte die weitere Eignung Sarrazins für seinen Führungsposten bei der Bundesbank in Frage. \"Jede Provokation hat ihre Grenzen. Diese Grenze hat der Bundesbankvorstand Sarrazin mit dieser ebenso missverständlichen wie unpassenden Äußerung eindeutig überschritten\", kritisierte der CSU-Politiker in der \"Bild am Sonntag\". Sarrazin hatte zuletzt in einem Interview über die kulturelle Eigenart der Völker schwadroniert und dabei erklärt: \"Alle Juden teilen ein bestimmtes Gen, Basken haben bestimmte Gene, die sie von anderen unterscheiden.\" Damit ist er auch nach Ansicht von Außenminister Guido Westerwelle zu weit gegangen. \"Wortmeldungen, die Rassismus oder gar Antisemitismus Vorschub leisten, haben in der politischen Diskussion nichts zu suchen\", sagte der FDP-Chef der Zeitung. In seinem am Montag erscheinenden Buch wirft Sarrazin insbesondere muslimischen Migranten vor, sich nicht in die Gesellschaft integrieren zu wollen. Der Bundesvorsitzende der Türkischen Gemeinde in Deutschland, Kenan Kolat, warf dem SPD-Politiker \"intellektuellen Rassismus\" vor und rief zu \"massenhaften Strafanzeigen wegen Volksverhetzung\" auf. Anzeigen wegen Volksverhetzung erwartet auch Berlins Innensenator Ehrhart Körting (SPD). Im SPIEGEL-ONLINE-Interview sagte Körting über seinen Parteifreund: \"Thilo driftet derzeit ab. Er hatte immer eine Vorliebe für Statistiken. Aber er nutzt in der Integrationsdebatte nur jenen, die ihm ins Feindbild passen.\" Tarek Al-Wazir, Landes- und Fraktionsvorsitzender der hessischen Grünen, nennt in einem Beitrag für den SPIEGEL Sarrazins Buch \"rassistischen Unsinn\", geschrieben von einem \"zornigen alten Mann\". Und der Chef von Sarrazins Berliner Kreisverband Charlottenburg-Wilmersdorf, Christian Gaebler, sagte dem SPIEGEL: \"Das Maß ist voll. Für den Fall, dass Herr Sarrazin nicht freiwillig aus der SPD austritt, bereiten wir ein Parteiausschlussverfahren vor.\" Schleswig-Holsteins SPD-Chef Ralf Stegner nannte Sarrazin in einem Gastkommentar auf SPIEGEL ONLINE einen \"rhetorischen Kraftmeier\", der völlig falsch argumentiere und nur provozieren wolle. Der scheidende hessische Ministerpräsident Roland Koch, der selbst oft mit provokanten Aussagen die Politik aufmischte, nannte die Äußerungen Sarrazins \"unerträglich. Damit stellt er sich völlig ins Abseits\", sagte der CDU-Politiker der \"BamS\". Koch selbst hatte im hessischen Wahlkampf 1999 mit einer Initiative gegen die doppelte Staatsbürgerschaft Erfolg. Die Grünen warfen ihm damals geistige Brandstiftung vor. Sarrazin spreche zwar Probleme an, denen die Gesellschaft nicht ausweichen dürfe, so Koch. \"Ihm selbst geht es aber offenbar nur noch um Verbalradikalismus und Tabubrüche.\" CSU-Politiker Peter Gauweiler sagte der \"BamS\" dagegen, die Kontroverse schade nicht, und Sarrazins Kritiker \"sollten nicht den Eindruck erwecken, dass sie einen Andersdenkenden am Aussprechen der Wahrheit hindern\". Auch die streitbare Autorin Necla Kelek kann Sarrazins Aussagen durchaus Positives abgewinnen. \"Thilo Sarrazin leistet einen wichtigen Beitrag, indem er uns Muslime auffordert, über unsere Rolle in Deutschland zu reflektieren. Ihm Rassismus vorzuwerfen, ist absurd, denn der Islam ist keine Rasse sondern Kultur und Religion\", sagte Kelek, die das Buch des Politikers mit vorstellen wird. \"Ich teile Sarrazins Sorge um Deutschland.\" Dagegen forderte der ehemalige Vizepräsident des Zentralrats der Juden in Deutschland, Michel Friedman, Konsequenzen für Sarrazin. \"Es kann keine Toleranz mehr für diese Intoleranz geben. Wir brauchen Brückenbauer und keine Hassprediger, schon gar nicht im Vorstand der Deutschen Bundesbank\", schrieb Friedmann in der \"BamS.\" VIP-Karte bringt Sarrazin in Erklärungsnot Indes drohen Sarrazin nicht nur zu seinem Buch weitere unbequeme Fragen und Kritik. Dem Bundesbankvorstand und erbitterten Kritiker wohlstandsferner Schichten wurde nach SPIEGEL-Informationen in der Vergangenheit ein exquisites Privileg zuteil . Offenbar war der ehemalige Berliner Finanzsenator über Jahre Inhaber eines Sonderausweises, der zur kostenlosen Nutzung eines exklusiven \"Diplomaten\"-Parkplatzes am Frankfurter Airport berechtigte. Die VIP-Karte mit einem Jahreswert von 2640 Euro hatte die örtliche Flughafengesellschaft Fraport an einen erlesenen Kreis von Spitzenfunktionären aus Politik und Verwaltung verteilt - und damit den Argwohn der Frankfurter Staatsanwaltschaft erregt. Seit Dezember 2008 ermittelt die Abteilung für Wirtschaftsstrafsachen gegen einen Fraport-Mitarbeiter wegen des Verdachts der Bestechung. Im Rahmen der umfangreichen Untersuchung überprüften die Korruptionsfahnder insgesamt 247 prominente Freiparkfälle, darunter auch den von Sarrazin. Fragen des SPIEGEL, ob er den Parkausweis tatsächlich nutzte, ob dies gegebenenfalls dienstlich oder privat geschah und in welcher Zeit er ihn besaß, ließ der sonst so eloquente Sarrazin unbeantwortet - \"aus Termingründen\", wie das Büro des 65-Jährigen mitteilte. Nach Auskunft der Fraport ist die großzügige Vergabe der VIP-Tickets inzwischen eingestellt worden. Auch die Berliner Finanzbehörde, die Sarrazin bis ins Frühjahr 2009 leitete, wollte sich nicht zu dem Vorgang äußern. Laut Vorschrift dürfen Senatoren keine derartigen Geschenke annehmen.",http://www.spiegel.de/politik/deutschland/neue-provokation-sarrazins-juden-thesen-empoeren-regierung-a-714417.html,2010-08-29T00:00:00.000Z
"Mexiko Polizei verhaftet berüchtigten \"Los Zetas\"-Boss Zwangspause für Flavio Mendez Santiago, alias \"El Amarillo\": Das Gründungsmitglied des gefürchteten Drogenkartells \"Los Zetas\" ist den mexikanischen Ermittlern ins Netz gegangen. Ein Schlag gegen das organisierte Verbrechen - die Super-Bosse allerdings sind noch flüchtig. Mexiko-Stadt - Nördlich der südmexikanischen Stadt Oaxaca wurde \"El Amarillo\", \"Der Gelbe\", zusammen mit seinem Leibwächter Carlos Alejandro Rodriguez festgenommen. Dies bestätigte der staatliche Sicherheitschef dem US-Nachrichtensender CNN zufolge. Mendez ist einer der 37 meistgesuchten Kriminellen in Mexiko. Auf seine Ergreifung war eine Summe von 15 Millionen Pesos, etwa 897.000 Euro, ausgesetzt. Gegen den 35-Jährigen wurde unter anderem wegen versuchten Mordes und organisierter Kriminalität ermittelt. Seine Karriere begann \"El Amarillo\" 1993 beim Golf-Kartell, wo er dem Anführer Osiel Cardenas Guillen als Leibwächter diente. Letzterer sitzt heute im Gefängnis. Mendez war später Leiter des informellen Spionagenetzes des Kartells in Nordmexiko, der sogenannten \"Falken\". Im Jahr 2006 soll Mendez den Behörden zufolge die Abspaltung der Zetas, einer paramilitärische Gruppe ehemaliger Elitesoldaten, vom Golf-Kartell betrieben haben. Später betraute er in drei Bundesstaaten deren Geschäfte. In letzter Zeit sei er vor allem im Süden des Landes aktiv gewesen, sagte ein Ministeriumssprecher. \"El Amarillo\" war demnach unter anderem mit der Kontrolle der aus Süd- und Mittelamerika nach Mexiko strömenden Flüchtlinge beauftragt. Die Organisation \"Los Zetas\" wird von Experten verantwortlich gemacht für das Verschwinden von mehr als 40 Migranten allein im vergangenen Monat. Die Festnahme von Flavio Mendez Santiago ist ein schwerer Schlag für die Drogenhändler. Allerdings sind die Top-Bosse Heriberto Lazcano und Miguel Trevino noch immer flüchtig.",http://www.spiegel.de/panorama/justiz/mexiko-polizei-verhaftet-beruechtigten-los-zetas-boss-a-740235.html,2011-01-18T00:00:00.000Z
"Programm komplett Viele deutsche Filme bei der Berlinale dabei Die Berlinale ist vollständig: Am Dienstag komplettierte die Festivalleitung das Wettbewerbsprogramm - unter anderem mit deutschen Produktionen von Ulrich Köhler (\"Bungalow\") und von den Schwestern Samdereli (\"Türkisch für Anfänger\") sowie einem Berlin-Action-Thriller mit Liam Neeson. Berlin/Hamburg - Die ganz große Premiere hat die diesjährige Berlinale nicht im Wettbewerbsprogramm. Aber dafür einen erstaunlich hohen Anteil deutschsprachiger Filme. Freuen darf man sich auf den neuen Film von Ulrich Köhler (\"Bungalow\"), bei dessen Drehbuch seine Frau, die Regisseurin Maren Ade, mitgeschrieben hat: In \"Schlafkrankheit\" geht es mal nicht um die Nabelschau deutscher Jungerwachsener, sondern um einen lebenskriselnden Entwicklungshelfer in Kamerun, gespielt von dem holländischen Schauspieler Pierre Bokma. Neben den neuen Filmen von Andrés Veiel (\"Wer wenn nicht wir\") und Wim Wenders (Tanzfilm \"Pina\" in 3D) zeigt die Berlinale auch den zweiten Langfilm von Yasemin und Nesrin Samdereli. Die Schwestern widmen sich nach ihrer Komödie \"Alles getürkt\" (2003) und ihrer TV-Serie \"Türkisch für Anfänger\" (2006) einem Mehrgenerationen-Film über eine türkische Gastarbeiterfamilie: In \"Almanya\" sucht der 6-jährige Cenk Yilmaz nach seiner deutsch-türkischen Identität - über die Erzählungen seiner Cousine taucht der Film in die Geschichte des Großvaters Hüseyin (Fahri Yarim / Vedat Erincin) ein, der Ende der Sechziger nach Deutschland kommt. Der Film läuft außer Konkurrenz. Auch außer Konkurrenz läuft \"Mein bester Feind\" des österreichischen Regisseurs Wolfgang Murnberger (\"Der Knochenmann\"). Moritz Bleibtreu spielt einen jüdischen KZ-Häftling, der mit seinem bei der SS gelandeten Jugendfreund (Georg Friedrich) die Rollen tauscht: Aus dem Nazi wird der KZ-Insasse und umgekehrt. Begehrter Finanzkrisen-Blockbuster Mit \"Unknown Identity\" -ebenfalls außer Konkurrenz- feiert die Berlinale einen starbesetzten Action-Knüller, dessen Handlung in Berlin stattfindet: Liam Neeson spielt vor deutscher Hauptstadtkulisse einen Mann, der nach einem Autounfall aus dem Koma erwacht und in einem Alptraum landet: Seine junge, blonde Frau (January Jones) erkennt ihn nicht mehr, ein Killer (Stipe Erceg) jagt ihn. Ausgerechnet ein Ex-Stasimitarbeiter (Bruno Ganz) und eine Taxifahrerin (Diane Kruger) sind seine einzigen Verbündeten im Kampf gegen die identitätsraubende Verschwörung. Nicht minder prominent besetzt ist das Spielfilmdebüt von J.C. Chandor: \"Margin Call\" zeigt 24 Stunden im Leben einer Gruppe von Investmentbankern in New York während des Finanzcrashs 2008 - gespielt von Kevin Spacey, Demi Moore, Paul Bettany, Stanley Tucci und anderen. Der Finanzkrisen-Blockbuster ist begehrt: \"Margin Call\" läuft bereits Ende Januar beim Sundance Film Festival. Seine Weltpremiere auf der Berlinale dagegen feiert \"The Forgiveness Of Blood\" Joshua Marston. Der in Kalifornien geborene Regisseur (\"Maria voll der Gnade\") hat sich für seinen neuen Film ins ländliche Albanien gewagt. Mit Laien besetzt, erzählt er die Geschichte von albanischen Teenagern, deren Leben durch archaische Blutfehden gefährdet ist. In der Arbeit mit ungeschulten Darstellern kennt Marston sich aus: Auch die Hauptdarstellerin in dem kolumbianischen Drogenschmuggel-Drama \"Maria voll der Gnade\" hatte vor dem Dreh nur ein paar Schauspielstunden genommen. Migrantische Putzfrauen im großbürgerlichen Paris Lateinamerika wird in diesem Jahr von der mexikanischen Regisseurin Paula Markovitch und ihrem Spielfilmdebüt \"El Premio\" repräsentiert, sowie von \"Un Mundo Misterioso\" (\"Rätselhafte Welt\") des Argentiniers Rodrigo Moreno, dessen Film \"El Custodio\" (\"Der Leibwächter\") im Jahre 2006 auf der Berlinale lief. Außerdem im Wettbewerb sind neben den bereits veröffentlichten Wettbewerbsfilmen : \"A Torinói Ló\" des ungarischen Regisseurs Béla Tarr (\"Satantango\", \"Die werckmeisterschen Harmonien\"), der iranische Film \"Jodaeiye Nader az Simin\" von Asghar Farhadi (\"About Elly\", \"Fireworks Wednesday\"), der 3D-Animationsfilm \"Les contes de la nuit\" von Michel Ocelot (Weltpremiere). Aus Südkorea kommt der Film \"Saranghanda, Saranghaji Anneunda\" (\"Kommt Regen, kommt Sonnenschein\") von Lee Yoon-ki (\"Love Talk\", \"This Charming Girl\"), der russische Regisseur Alexander Mindadze zeigt das Tschernobyl-Drama \"V Subbotu\" (\"An einem Samstag\") und der Franzose Philipe Le Guay die Komödie \"Les femmes du 6ème étage\" über eine Gruppe migrantischer Putzfrauen im großbürgerlichen Paris. Hinzu kommen zwei Sondervorführungen: Aus Solidarität mit dem verurteilten iranischen Regisseur Jafar Panahi läuft am 11. Februar, dem Jahrestag der Iranischen Revolution, dessen Film \"Offside\". Und in einer Sondervorführung ist die europäische Premiere von Werner Herzogs 3D-Dokumentarfilm \"Cave of Forgotten Dreams\" im Berlinale-Palast zu sehen.",http://www.spiegel.de/kultur/kino/programm-komplett-viele-deutsche-filme-bei-der-berlinale-dabei-a-740148.html,2011-01-18T00:00:00.000Z
