article,article_url,date
"Kurden-Konflikt Massenschlägerei in Wien, Demonstrationen in Deutschland Die Aggressivität steigt: Während sie in Deutschland noch weitgehend friedlich demonstrierten, lieferten sich Türken und Kurden am Sonntagabend in Wien eine heftige Schlägerei. Fünf Menschen wurden verletzt, zwei davon schwer. Innenminister Schäuble warnt vor einer Radikalisierung. Wien/Berlin/Brüssel - Bei der Prügelei zwischen Türken und Kurden in Wien sind am Abend mindestens fünf Menschen verletzt worden. Österreichische Medien berichteten, zwei Beteiligte hätten schwere Stichwunden erlitten. Die Polizei in Wien teilte mit, zwei der fünf Opfer seien schwer verletzt. An der Schlägerei seien demzufolge etwa 20 bis 30 Menschen beteiligt gewesen. Einige von ihnen hätten Messer dabei gehabt. Zudem gab es den Angaben zufolge viele Sympathisanten und Schaulustige. Die Polizei leitete eine Fahndung nach den Tätern ein. Zunächst hatte sie sogar von bis zu 80 Beteiligten gesprochen. Der Auslöser der Schlägerei ist bisher nicht bekannt. Hintergrund der Schlägerei waren aber offenbar die in den vergangenen Tagen gestiegenen Spannungen zwischen Türken und Kurden entlang der türkisch-irakischen Grenze. Ankara droht damit, bei der Verfolgung mutmaßlicher Rebellen der Arbeiterpartei Kurdistans (PKK) notfalls die Grenze zum Irak zu überschreiten. Wegen des sich ausweitenden Türkei-PKK-Konflikts sind in deutschen und anderen europäischen Städten am Wochenende auch mehr als 30.000 Menschen bei Demonstrationen auf die Straße gegangen. In Hamburg und Dortmund kam es zu kleinen Rangeleien. In Brüssel setzte die Polizei Wasserwerfer gegen gewaltbereite Demonstranten ein. Ansonsten verliefen die Kundgebungen friedlich. Aus Sorge vor neuen Krawallen zwischen Türken und Kurden hatte die Polizei in mehreren deutschen Städten die Sicherheitsvorkehrungen erhöht. Bei Angriffen von türkischen Nationalisten auf Kurden hatte es am vergangenen Wochenende in Berlin mehr als ein Dutzend Verletzte gegeben. Die Türkei droht im Kampf gegen die PKK mit einem Einmarsch der Armee in die Kurdengebiete im Nordirak. Die verbotene Arbeiterpartei Kurdistans PKK gilt in den USA, der EU und der Türkei als Terrororganisation. Mehrere tausend Türken seien in der Kölner Innenstadt gegen \"Terrorismus\" auf die Straße gegangen, sagte eine Sprecherin der Polizei. In Berlin versammelten sich nach Polizeiangaben rund 600 Kurden im Bezirk Neukölln. Auch dort habe es bis auf drei Festnahmen am Rande der Proteste keinerlei Zwischenfälle gegeben, sagte eine Sprecherin der Polizei, die mit rund 1000 Beamten vor Ort war. In Dortmund gab es kleinere Auseinandersetzungen am Rande des Protestzuges. Die Polizei zeigte einen Demonstranten an, weil er einen Knüppel dabei hatte und PKK-Parolen skandierte. Die Polizei in Brüssel - dort protestierten etwa 6000 Menschen - sprach von einem ernsten Zwischenfall, als sie in einem von vielen Türken bewohnten Stadtteil Wasserwerfer gegen gewaltbereite Demonstranten einsetzte. Den Angaben zufolge war die Situation aber schnell unter Kontrolle. Niemand sei verletzt worden. Die größte Demonstration des Wochenendes fand in Nürnberg statt: Laut Polizei zogen 7000 Menschen durch die Innenstadt. Der Protest, der von einem türkischen Verein organisiert worden war, blieb ohne größere Zwischenfälle. Warnung vor \"Stellvertreter-Krieg\" In Hamburg demonstrierten gestern Nachmittag nach Angaben der Polizei 1850 Menschen; sie folgten einem Aufruf kurdischer Veranstalter. Nach den Worten eines Polizeisprechers verlief der Protest recht ruhig, es seien aber Fahnen der verbotenen kurdischen Arbeiterpartei PKK beschlagnahmt worden. Bundesinnenminister Wolfgang Schäuble (CDU) hatte mit harten staatlichen Sanktionen gedroht, falls die Proteste eskalieren sollten. In der \"Bild am Sonntag\" sagte er: \"Jeder darf demonstrieren. Aber Gewalt wird unser freiheitlicher Rechtstaat nicht dulden.\" Schäuble erklärte, es sei nicht auszuschließen, dass der Konflikt im türkisch-irakischen Grenzgebiet zu einer Radikalisierung von Kurden und Türken auch in Deutschland führe. \"Deshalb müssen unsere Sicherheitsbehörden ihre Verantwortung sehr ernst nehmen.\" Auch Berlins Ex-Innensenator Eckart Werthebach warnte vor einer Radikalisierung der Kurden in Deutschland. Sollte es dazu kommen, ergebe sich \"ganz schnell neben dem Islamismus eine neue Bedrohung\", sagte der Ex-Präsident des Bundesamtes für Verfassungsschutz dem Nachrichtenmagazin \"Focus\". Aktionen des türkischen Militärs gegen Lager der Arbeiterpartei Kurdistans (PKK) im Nordirak führten zu einer raschen Mobilisierung von gewaltbereiten PKK-Sympathisanten. \"Türkei-Identität\" bei Migranten Bei einem Einmarsch der türkischen Armee in den Nordirak befürchtet der Verfassungsschutz laut \"Bild\"-Zeitung einen \"Stellvertreter-Krieg\" in Deutschland. \"Jede Zuspitzung des Konflikts in der Region findet hier immer wieder seinen auch militanten Widerhall\", zitiert das Blatt aus einem vertraulichen Papier des Verfassungsschutzes. Der Vorsitzende des Deutsch-Türkischen Forums in der nordrhein-westfälischen CDU, Bülent Arslan, sagte dem \"Kölner Stadt-Anzeiger\" vom Samstag, der Konflikt zwischen Türken und Kurden gebe Aufschluss über die mangelnde Integration beider Volksgruppen in Deutschland. \"Man kann jetzt sehen, wo das Hauptaugenmerk und die Identifikation der Leute ist. Das ist eine Türkei-Identität.\" Der Vorsitzende der Türkischen Gemeinde in Deutschland Kenan Kolat hatte türkische und kurdische Eltern in Deutschland dazu aufgerufen, gut auf ihre Kinder aufzupassen. Nirgendwo in Europa leben mehr Kurden und Türken als in Deutschland. Die Bundesregierung geht von etwa einer halben Million Kurden aus, das Bonner Zentrum für Kurdische Studien schätzt die Zahl der in Deutschland lebenden Kurden auf bis zu 800.000. Bundesweit gibt es insgesamt 2,4 Millionen Menschen türkischer Abstammung. Da die Kurden keinen eigenen Staat besitzen, werden sie statistisch als Türken, Iraker oder andere Nationalitäten geführt. anr/tno/dpa/AFP/AP",http://www.spiegel.de/politik/deutschland/kurden-konflikt-massenschlaegerei-in-wien-demonstrationen-in-deutschland-a-515323.html,2007-11-04T00:00:00.000Z
"Einwanderung in England Kulturkampf um Curryköche Sie gehören zu England wie Tee und Kekse - indische Restaurants und ihre scharfen Gerichte. Doch nun gehen ihnen die Mitarbeiter aus, weil die Politik die Einwanderung beschränkt, seit die Bürger aus den neuen EU-Staaten in Scharen kommen. Und die wollen leider kein Curry kochen. Von Stefan Marx, London Sie können richtig lästig sein. Wer abends über die berühmte Brick Lane im Londoner Osten streift, kommt kaum zwei Schritte voran, ohne von Kellnern angesprochen zu werden, die Passanten in ihr indisches Restaurant bugsieren wollen. Doch London-Besucher müssen wohl bald auf die Schar der aufdringlichen Curry-Werber verzichten. Ihnen geht wegen der Verschärfung der britischen Einwanderungsgesetze das Personal aus: \"Mitarbeiter gesucht  jeder willkommen\", verkündet ein Schild an einer Bar in der Brick Lane. Wer einige Schritte weiter in den Imbiss \"Gram Bangla\" geht, versteht schnell die Gründe für den Personalschwund in den Curryküchen. Der Begriff \"Indisches Restaurant\" führe in die Irre, erklärt \"Gram Bangla\"-Inhaber Abdul Shahid: Von den landesweit 9000 Curry Houses, schätzt er, gehörten 90 Prozent Bangladeschern. Shahid betreibt seine Snackbar zusammen mit zwei Brüdern. Seine anderen Geschwister verdienen ihr Geld lieber im Bank- und Immobiliengeschäft. \"Ich möchte auch nicht, dass meine Kinder mal hier arbeiten müssen\", sagt Shahid. So wie er denken viele: Die zweite Generation der Bangladescher in England drängt es raus aus der Küche. Bisher kam der Personalnachschub aus Südasien. Die Restaurants rekrutierten direkt in der alten Heimat. Doch nun hat die Regierung unter Premierminister Gordon Brown die Tore für Immigranten dichtgemacht. Seit Ende Februar gilt in Großbritannien ein deutlich strengeres Einwanderungsrecht. Nebeneffekt des Gesetzes: Die britische Institution \"Curry House\" - stilecht mit Hühnchen in scharfer Sauce, süßen Mangodrinks und schriller Musik - ist bedroht. Jedes achte aller asiatischen Restaurants könnte in den nächsten Jahren schließen, prophezeit der britische Gaststättenverband. Dabei ist das Curry für England wie der Döner für Deutschland. Das englische Nationalgericht heißt Chicken Tikka Masala: Weil den Briten das Curry-Hühnchen zu scharf ist, wird dazu übrigens englische Minzsauce gegeben  eine überraschend wohlschmeckende Mischung. Für die Bangladescher, die oft in den sechziger Jahren des vergangenen Jahrhunderts vor Unruhen und Naturkatastrophen ins alte koloniale Mutterland flohen, boten Restaurants eine gute Chance zum Geldverdienen in der neuen Umgebung. Um die Ostlondoner Brick Lane herum dominieren sie das Straßenbild. Deswegen ist Ali Khan, dem das Restaurant \"Curry Capital\" auf der Brick Lane gehört, auch nicht allzu bange, dass er eines Tages allein dastehen könnte. Doch auch in seiner Umgebung hätten schon drei Curry Houses dichtgemacht. Khan stöhnt: \"Jeden Tag höre ich, was für eine Katastrophe das ist. Die Regierung muss endlich etwas dagegen tun.\" England hat ein Einwanderungsproblem Aber nichts liegt der Labour-Regierung ferner. Jahrelang hat ihr die Einwanderungspolitik zu schaffen gemacht. 2006 kostete die Enthüllung, dass das Innenministerium die Abschiebung von knapp tausend kriminellen Ausländer einfach vergessen hatte, Innenminister Charles Clarke den Job. Und die aktuelle Ministerin Jacqui Smith war sprachlos, als sie im letzten Jahr erfuhr, dass illegale Einwanderer als Wachleute im eigenen Ministerium angestellt waren und in der Ausländerbehörde putzten. Die Liste der Pannen der Einwanderungsbehörden ließe sich endlos fortsetzen. Dann sind da noch die Osteuropäer. Bei der EU-Osterweiterung 2004 war Großbritannien eines der wenigen Länder, das seinen Arbeitsmarkt komplett für die Beitrittsländer öffnete. Einige wenige Zehntausende würden auf die Insel ziehen, glaubte die Regierung damals. Nun werden bis zu 600.000 Osteuropäer in Großbritannien vermutet. Sie üben Druck auf die ohnehin löchrige Infrastruktur aus, füllen Arztpraxen, Schulklassen und Busse. Seit dieser Fehlkalkulation darf der Labour-Regierung die Ausländerpolitik gar nicht mehr hart genug sein  die rechte Boulevardpresse jammert jede Woche auf den Titelseiten über die Einwanderer. 1 | 2 weiter 1. Teil: Kulturkampf um Curryköche 2. Teil: Warum Briten, Polen und Tschechen nicht mit Curry kochen können",http://www.spiegel.de/politik/ausland/einwanderung-in-england-kulturkampf-um-currykoeche-a-548975.html,2008-05-09T00:00:00.000Z
"Kosovo-Konflikt \"Ich habe so viel Hass und Wut erlebt\" Die Friedensverhandlungen waren gescheitert, da entschied sich die Nato zum Äußersten: 1999 bombardierte sie Jugoslawien, wenige Wochen später marschierten Bodentruppen ein. Kai K. war damals als Soldat dabei. Zehn Jahre später kehrte er in den Kosovo zurück. Verweste Leichen, Schüsse, Morde und Brandstiftungen: Es herrschte das schlichte Chaos - und mittendrin Feldwebel Kai K. aus dem schleswig-holsteinischen Seeth. Die Bilder, die er damals, 1999 beim Einmarsch der deutschen Bundeswehrsoldaten ins Kosovo zu sehen bekam, haben sich dem mittlerweile 34-jährigen Berufssoldaten tief ins Gedächtnis gebrannt. Am 24. März 1999 entschloss sich die Nato nach den gescheiterten Friedensverhandlungen von Rambouillet zum Äußersten: einem militärischen Angriff auf die Armee Rest-Jugoslawiens, die im Namen des Belgrader Diktators Slobodan Milosevic die nicht-serbische Bevölkerung des Kosovo terrorisierte. Angesichts der Menschenrechtsverletzungen im Kosovo schlug die Allianz sogar ohne das an sich notwendige Uno-Mandat zu. Erstmals nach dem Zweiten Weltkrieg bombardierten deutsche Kampfpiloten wieder fremdes Territorium, befand sich Deutschland faktisch im Krieg. Im benachbarten Mazedonien warteten währenddessen die Nato-Bodentruppen, darunter auch Bundeswehreinheiten, auf ihren Einmarschbefehl. Mit \"einem total flauen Gefühl im Magen\" kam Kai K. Anfang Juni 1999 im mazedonischen Tetovo unweit der Grenze zum Kosovo an. Seit über zwei Monaten dauerten die Nato-Luftschläge bereits an, und für die Infanteristen gehörte eine Bodenoffensive mit Kampfauftrag zu den möglichen Einmarsch-Szenarien. Soweit sollte es aber nicht kommen: Nach dem Waffenstillstand von Kumanovo marschierte die deutsche Brigade mit Kai K. und rund 6500 weiteren Soldaten Mitte Juni nicht als Besatzer, sondern als Friedenstruppe ins Kosovo ein. Plünderungen waren an der Tagesordnung Die Luftangriffe der Nato hatten ihre Spuren hinterlassen, Zerstörung und Blindgänger überall. Doch bei dem damals 24-jährigen Feldwebel war die Angst da schon gewichen, dafür war schlicht kein Platz: \"Ich war Teil des Ganzen und nicht länger Fernsehzuschauer\", erinnert sich K., die Bilder von Hunderttausenden Flüchtlingen in Mazedonien seien \"überwältigend\" gewesen. Über den Einmarsch selbst dagegen kann der heutige Leutnant nur noch lachen, sagt er, \"es gab so viel Verwirrung, Irrtümer und Fehlbewertungen\". Am Ziel in Prizren angekommen \"habe ich deutlich mehr graue Haare bekommen\" - in einer alten Textilfabrik untergebracht, musste K. zunächst auf einem Feldbett sein Nachtlager mit Ratten teilen. Aber zum Schlafen kam K. damals ohnehin kaum: 14 Stunden Dienst im Brigadestab, zwei Stunden Pause, sechs Stunden Streife und noch einmal zwei Stunden Schlaf - und selbst der wurde regelmäßig unterbrochen von Gewehrsalven. Auf den Patrouillengängen lauerten jede Menge Minen und Blindgänger, eine permanente, meist unsichtbare Gefahr. Und trotz der massiven Militärpräsenz der Nato geriet die Situation anfangs außer Kontrolle, wurde das Kosovo zum rechtsfreien Raum ohne Polizei, ohne Richter, ohne Gefängnisse. Nach dem Abzug der serbischen Armee plünderten, brandschatzten und mordeten nun die Albaner. Kai. K. ging im serbischen Viertel Podkalaya oberhalb Prizrens auf Streife, und friedlich waren diese Rundgänge selten. Jede Nacht brannten weitere Häuser. \"Die haben den Leuten die Kehle durchgeschnitten, alten Leuten, die keinem etwas getan haben - aus Rache für das, was andere ihnen angetan hatten.\" Diese Erinnerungen haben sich eingegraben, nicht nur bei dem deutschen Leutnant. \"Ich habe damals so viel Hass und Wut erlebt, ich kann nicht glauben, dass das alles schon vergeben, vergessen und verziehen ist\", sagt K. heute. Eine Rückkehr der vertriebenen Serben kann er sich auch für viele weitere Jahre nicht vorstellen. Rund um die Uhr im Einsatz Seit Ende Januar 2009 ist der in Husum stationierte Spezialpionier erneut mit der \"Kosovo Force\" (Kfor) in Prizren. Zehn Jahre nach seinem ersten Einmarsch steht er oberhalb der Stadt in einer Klosterruine am militärischen Beobachtungsposten \"Auge\". \"Wir waren damals Tag und Nacht im Einsatz, um dieser Region wieder auf die Beine zu helfen\", sagt er. \"Ich will wissen, ob es sich gelohnt hat.\" Eine Dekade nach dem Krieg wirkt die 170.000-Einwohner-Stadt geschäftig. Aufbruchstimmung ist zu spüren, zumindest bei der albanischen Bevölkerungsmehrheit. Links von der Sinan-Pascha-Moschee mit dem angeblich höchsten Minarett des Balkans verlaufen die schmalen Altstadtgassen mit den vielen kleinen Geschäften, in denen es mittlerweile wieder alles zu kaufen gibt. Gegenüber dem ehemaligen Hotel Theranda steht wie vielerorts eine kosovarische Verkehrspolizeistreife. Kfor-Fahrzeuge sieht man kaum noch, Panzer schon gar nicht. Im Jahr 2000 wurde die alte Stadtbrücke noch \"Fuchsbrücke\" genannt - wegen der drei Radpanzer Typ \"Fuchs\", die dort ständig wachten. Direkt unterhalb von Kai. K. liegt an diesem Märztag 2009 das ehemalige serbische Viertel, durch das er einst bewaffnet Patrouille ging. Hier oben ist, anders als im Rest der Stadt, die Zeit stehengeblieben. Ausgebrannte Ruinen zeugen noch immer stumm vom Hass der zurückgekehrten Kosovo-Albaner und ihrer Rache an den Serben vor zehn Jahren. Den Krieg hatte die Nato damals innerhalb von gut drei Monaten gewonnen - doch die dann einsetzende Verfolgung und Vertreibung der noch verbliebenen Kosovo-Serben vermochten die ausländischen Soldaten nicht wirklich zu verhindern. \"Wir haben noch immer Angst \"Wer kein Blut an den Händen hat, darf gern zurückkommen\", sagt Ramadan Haledjaha. Der 47-jährige Kosovo-Albaner sitzt bei einem türkischen Kaffee am Ufer der Bistrica. Auch heute leben Kosovo-Serben in der Stadt, und das \"gehört so\". Allerdings ist auch bei ihm die Furcht vor einer Rückkehr der serbischen Armee und der Sonderpolizei noch immer lebendig. Die Anwesenheit der Kfor-Soldaten, erst recht der Bundeswehr, ist ihm deshalb sehr wichtig: \"Wir haben noch immer Angst vor den Serben.\" Gern gesehen ist die Nato auch, weil ihre Soldaten ein echter Wirtschaftsfaktor sind im bettelarmen Kosovo, wo die Arbeitslosenquote rund 50 Prozent und das Pro-Kopf-Einkommen 1300 Euro pro Jahr beträgt. Die Frühjahrsunruhen im Jahr 2004 samt Totalblockade des deutschen Feldlagers, mutmaßen Beobachter, seien denn auch weniger auf den aufflammenden ethnischen Konflikt zurückzuführen - die Kosovo-Albaner hätten schlicht eine Verringerung des Kfor-Kontingentes verhindern wollen. Das würde manchen Unternehmer schwer treffen. Die deutschen Militärfahrzeuge zum Beispiel werden seit jeher bei Visar Gashi gewaschen, wenige hundert Meter vom Feldlager Prizren entfernt. Der Unternehmer mit Firmen-Dependancen in Bulgarien, der Schweiz und Deutschland hat gut an der Bundeswehr verdient und ist sich sicher: Die Kfor bleibt. Die Amerikaner, so will Gashi wissen, hätten ihr Kfor-Feldlager \"Bondsteel\" für 99 Jahre gepachtet. Auch die Bundeswehr werde noch mindestens 50 Jahre bleiben.",http://einestages.spiegel.de/static/topicalbumbackground/3837/_ich_habe_soviel_hass_und_wut_erlebt.html,2009-03-24T00:00:00.000Z
"Geduldet von Wilders Neue niederländische Regierung formiert sich Der Machtwechsel in den Niederlanden steht unmittelbar bevor: Königin Beatrix hat dem rechtsliberalen Mark Rutte formell den Auftrag zur Regierungsbildung erteilt. Seine Minderheitsregierung wird künftig von dem Islamgegner Geert Wilders geduldet. Den Haag - Vier Monate ist die niederländische Parlamentswahl her, damals ist der Islamgegner und Rechtspopulist Geert Wilders mit seiner Partei PVV zur drittstärksten Kraft aufgestiegen. Sein Erfolg bei der Abstimmung hat ihm eine komfortable Position verschafft: Die künftige Minderheitsregierung von Rechtsliberalen und Christdemokraten ist auf ihn angewiesen. Am Freitag ist die Bildung dieser Minderheitsregierung einen entscheidenden Schritt vorangekommen: Die niederländische Königin Beatrix betraute am Freitag den rechtsliberalen Politiker Mark Rutte mit der Bildung der Koalition. Er bot dem führenden Christdemokraten, Maxime Verhagen, daraufhin den Doppelposten des Vize-Regierungschefs und Wirtschaftsministers an. Bis zum kommenden Donnerstag soll das Kabinett stehen. Wilders ist zwar nicht direkt an der Regierung beteiligt, verfügt jedoch über erheblichen Einfluss. Gemäß dem Duldungsabkommen, das Rutte und Verhagen mit ihm aushandelten, soll ein generelles Verbot des Ganzkörperschleiers Burka sowie des Tragens von Kopftüchern in Behörden erlassen werden. \"Von oben nach unten sauber gefegt\" Wilders kündigte an, die Einwanderung von Menschen aus islamischen und anderen nichtwestlichen Ländern werde in den nächsten Jahren um 50 Prozent zurückgedrängt werden. Zudem würden die Niederlande künftig deutlich weniger Asylbewerber akzeptieren. Rutte wird der erste liberale Ministerpräsident des Königreichs seit 92 Jahren. Zudem erhalten die Niederlande erstmals seit dem Zweiten Weltkrieg wieder eine Minderheitsregierung. Rutte bekräftigte, dass das Kabinett und der Beamtenapparat verkleinert würden, wie dies im Wahlkampf von den Liberalen versprochen worden sei. Um notwendige Einsparungen in Höhe von 18 Milliarden Euro zu erreichen, werde \"von oben nach unten sauber gefegt\". Die künftige Regierung wird von bislang 27 auf 20 Mitglieder verkleinert. Ruttes Volkspartei für Freiheit und Demokratie (VVD) und der Christdemokratische Appell (CDA) sollen jeweils sechs Minister und vier Staatssekretäre stellen. Die Parität wurde vereinbart, obwohl die VVD bei den Wahlen 31 Mandate und damit zehn mehr gewann als der CDA, der von 41 auf 21 Sitze abstürzte. Mit den Stimmen der 24 Abgeordneten von Wilders' offen islamfeindlicher Freiheitspartei PVV stützt sich das künftige Kabinett auf 76 Mandate. Es verfügt damit im 150 Sitze umfassenden Parlament lediglich über eine Mehrheit von einer Stimme. Die vorgezogene Wahl war nötig geworden, nachdem im Februar die schwarz-rote Regierungskoalition am Streit um den Militäreinsatz der Niederlande in Afghanistan zerbrochen war.",http://www.spiegel.de/politik/ausland/geduldet-von-wilders-neue-niederlaendische-regierung-formiert-sich-a-722177.html,2010-10-08T00:00:00.000Z
