article,article_url,date
"Analyse Amerika zieht in den Krieg, aber in welchen? (II) Das größte Risiko des angekündigten Feldzuges gegen den Terrorismus ist die Eskalation des Terrors. Zurück zu Teil 1: DPA Zerstörung am Pentagon: Vorbereitung auf neue Anschläge Jeder Krieg hat zwei Seiten. Darum ist es extrem unwahrscheinlich, dass ein Vergeltungsschlag der USA ohne erneute Vergeltung der nun gejagten Kämpfer erfolgen kann. Folglich warnte Vize-Präsident Cheney bereits am Sonntag: \"Ich bin sicher, sie sind da draußen und denken schon über neue, kreative Wege nach, über uns herzufallen, nichts von der bisherigen Art, sondern noch etwas völlig Neues.\" Commander Ward Carroll, Ausbilder an der Marine-Akademie wurde konkreter: \"Denken Sie an Milzbrand-Bakterien, ein Massaker beim Super Bowl, die Ermordung von Prominenten während einer TV-Show.\" Die Möglichkeiten seien jenseits aller bisherigen Vorstellung. Aber, so forderte Carroll, die Nation müsse das bedenken, \"erst dann sind wir darauf vorbereitet, auch nur die erste 'Tomahawk'-Rakete abzuschießen\".  So ist eines anders als in allen früheren Kriegen: Der Gegner hat eben nicht wie einst die Vietcong und andere Guerilla-Gruppen eine abgegrenzte territoriale Basis. Und die Todesverachtung der Terroristen neuen Typs verschärft, was Strategen die \"asymmetrische Bedrohung\" nennen. Die Täter können sich symbolische Ziele suchen und auf maximale psychologische Wirkung setzen. Zumindest in der ersten Phase des angekündigten Feldzuges scheinen neue Anschläge daher kaum vermeidlich.  AFP Verteidigungsminister Rumsfeld: \"Sie sind irgendwo da draußen\" Um dennoch wenigstens mittelfristig erfolgreich zu sein, werden Außenminister Colin Powell und seine Kollegen aus den Alliierten-Staaten darum gar nicht anders können, als mit maximalem Einsatz eine wirklich arbeitsfähige globale Allianz zu schmieden, um mit möglichst dichten Polizei- und Geheimdienst-Netzen multinational und so nah wie möglich an die Wurzeln des Terrors heranzukommen. Peter Feaver, Politik-Wissenschaftler an der Duke-Universität, prophezeit daher, die Bush-Regierung werde den Konflikt als etwas Ähnliches ansehen wie die Kommunismus-Frage während des Kalten Krieges. Feaver: \"Die Vereinigten Staaten werden die Welt einteilen in ein 'Wir gegen sie'.\"  Fischer: \"Schwarze Löcher der Verzweiflung\" nicht mehr hinnehmbar Keineswegs auszuschließen ist daher, dass auch bei der Stoßrichtung der globalen Politikkoordination radikale Änderungen bevorstehen. So deutete etwa Außenminister Joschka Fischer eine grundlegende Änderung der außenpolitischen Prioritäten an. Die Wohlstandsnationen des Westens könnten die Existenz von \"schwarzen Löchern der Hoffnungslosigkeit und Verzweiflung\" nicht länger einfach hinnehmen, erklärte Fischer. \"Die Illusion, die Erste Welt könnte sich gegen die Konflikte in der Dritten Welt abschotten\", sei hinfällig. Folglich müssten die \"offenen Ordnungsfragen\" in der Nahost-Region \"nun ganz anders angegangen werden\". Was das genau bedeutet, wusste freilich auch Fischer noch nicht zu beantworten.  EPA/DPA Flüchtlinge an der afghanisch-pakistanischen Grenze: Instabile Region Nur das Ziel formulierte er klar: Repression und militärische Aktionen seien zwar nicht zu vermeiden, konstatierte der deutsche Chefdiplomat, und \"daran werden wir uns auch beteiligen\". Doch Terror-Gruppen wie die des Fanatikers Bin Laden \"wollen den Krieg der Kulturen\", warnte er, \"das müssen wir verhindern\".   Ob auch das in der Nato schon abgestimmt ist?",http://www.spiegel.de/politik/deutschland/analyse-amerika-zieht-in-den-krieg-aber-in-welchen-ii-a-157719.html,2001-09-17T00:00:00.000Z
"Penisbeschau \"Ungeheuerlicher Skandal\" Die Ausländerbehörden in Trier bestehen darauf: Der Penis-Test zur Überprüfung der Herkunft eines Asylbewerbers habe in Übereinstimmung mit dem Betroffenen stattgefunden. Das sieht die Gegenseite ganz anders. Trier/Berlin - Der Anwalt des Betroffenen erklärte am Dienstag, die \"Penisbeschau\" sei gegen den Willen seines Mandanten erfolgt. Gegenüber der \"Tageszeitung\" sprach der Jurist von einem \"ungeheuerlichen Skandal\". Er habe eine Dienstaufsichtsbeschwerde gegen den verantwortlichen Sachbearbeiter gestellt. Die Ausländerbeauftragte der Bundesregierung, Marieluise Beck (Grüne) kritisierte, der Vorgang sei \"ebenso untauglich wie unsachgemäß zur Feststellung der Staatsangehörigkeit\". Sie gehe nicht davon aus, dass ein solches Verfahren zur gängigen Praxis werde.  Die Stadtverwaltung Trier hatte zuvor bestätigt, dass ein Asylbewerber aus der ehemaligen Sowjetunion von den Ausländerbehörden am Penis untersucht worden sei, um seine Religionszugehörigkeit zu überprüfen. Nicht abgeschoben Dem Bericht zufolge hatte sich der Vorfall im vergangenen Dezember bei der Clearingstelle Rheinland-Pfalz für Passbeschaffung und Flugabschiebung ereignet. Damals sollte festgestellt werden, ob der Asylbewerber Armenier oder Aserbaidschaner sei. Nach Angaben der Ausländerbehörde hatten sich armenische Behörden geweigert, den Mann aufzunehmen, weil er gefälschte Papiere habe. Außerdem sei er muslimischen Glaubens und deshalb höchstwahrscheinlich kein Staatsbürger Armeniens: Zum Beweis hätten die armenischen Diplomaten gefordert, den Mann daraufhin zu untersuchen, ob er beschnitten sei. Wenn dies der Fall sei, sei er kein Armenier, habe ihr Argument gelautet.  Wie die Ausländerbehörde mitteilte, habe der Betroffene keine Einwände gemacht. Ein Sachbearbeiter der Stadt und zwei Polizeibeamte hätten daraufhin auf der Toilette den Penis in Augenschein genommen. Tatsächlich kamen die forschenden Beamten zu keinem klaren Ergebnis. Bei der Untersuchung stellten sie fest, dass der Mann - wie in Armenien unüblich - beschnitten war. Die Behörden gingen daher davon aus, dass er nicht aus Armenien stammt, schoben ihn aber dennoch nicht ab.",http://www.spiegel.de/politik/deutschland/penisbeschau-ungeheuerlicher-skandal-a-180948.html,2002-02-05T00:00:00.000Z
"SLUMS Gewalt als Ventil Fast eine Milliarde Menschen leben in Elendsvierteln. Bald wird es jeder Dritte sein. Vor allem in Nordafrika wächst die Bereitschaft zur Radikalisierung.  Eine achtspurige Autobahn führt am Ostrand von Kairo zum Flughafen hinaus. Geschäftsleute stehen hier jeden Morgen im Stau, Ägyptens Mittelstand auf dem Weg von der grünen Nil-Vorstadt zum Luftkreuz Nordafrikas, dazu Busse mit Urlaubern. Reiseführer weisen die Touristen gern auf den pittoresken Anblick zur Linken hin, auf die Totenstadt, Kairos legendären Ostfriedhof, dessen steinerne Grabkammern verarmte Ägypter seit dem Mittelalter als Wohnhäuser nutzen. Hässlich ist der Anblick auf der anderen Seite der Schnellstraße: eine mehr als einen Kilometer lange Mauer, von Durchlässen unterbrochen, aus denen tagaus, tagein Menschenmassen auf die Straße quellen und den Verkehr zum Stehen bringen. Die Mauer dient als Sichtblende gegen das Viertel Manschija Nasser, den derzeit größten zusammenhängenden Slum von Kairo. Gut 400 000 Menschen hausen hinter dem Wall, das entspricht etwa der Einwohnerzahl von Bochum. Doch während sich die Ruhrgebietsstadt auf 145 Quadratkilometer erstreckt, füllt Manschija Nasser eine Fläche von bloß 5 Quadratkilometern. Vorn schließt die Mauer das Viertel ab, hinten eine Felswand. Manschija Nasser hat kein Krankenhaus, nur zwei Gesundheitsstationen. Die Gassen sind eng, dunkel und ungepflastert. Auf ein paar Stichwegen quälen sich überfüllte Minibusse an den Schlaglöchern vorbei. Kniehoch hat sich an den Hauswänden der Müll angestaut, Myriaden von Mücken und Fliegen schwirren durch die Luft. Nachts kommen die Ratten. \"Am schlimmsten ist der Sommer, denn dann reicht der Wasserdruck nicht\", sagt der Schuster Rafat Schihat, 26. Im Winterhalbjahr tropft wenigstens ein Rinnsal aus dem einzigen Wasserhahn im Haus seiner Familie. Von April bis Oktober jedoch sind er und seine Brüder unterwegs, fünf junge Männer mit je zwei 20-Liter-Kanistern, zehn Minuten hinunter zum Tanklaster, eine Viertelstunde zurück. Das reicht einen Tag lang für die 16-köpfige Familie. Aber es braucht Zehntausende Wasserträger jeden Morgen, um ganz Manschija Nasser zu versorgen. Nur in unmittelbarer Autobahnnähe genügt der Druck für den Betrieb von Waschmaschinen. Zwar hat inzwischen selbst der letzte Winkel Strom, weshalb Tag und Nacht die Fernseher laufen, libanesische Musikkanäle vor allem und arabische Nachrichtensender mit Bildern aus dem Irak und Palästina. Dennoch ist die Stimmung schlecht, weil jede Perspektive fehlt. Schihat zuckt nur die Achseln: \"Du hast das Gefühl, deine Regierung hat dich verkauft.\" In Wahrheit hat sie, und das ist in der Dritten Welt die Regel, nicht genügend Mittel, um menschenwürdige Verhältnisse zu garantieren. Die jüngsten Uno-Zahlen besagen, dass weltweit bereits jeder dritte Städter in solchen oder noch schlimmeren Elendsquartieren haust. Besonders hoch ist ihr Anteil in den Metropolen südlich der Sahara; er liegt heute bei 72 Prozent, gefolgt von Süd- und Zentralasien mit 58 Prozent (Indien hat in absoluten Zahlen die meisten Slum-Bewohner) sowie Ostasien einschließlich China mit mindestens 36 Prozent. Für die übrigen Entwicklungsregionen geben die Statistiker jeweils Zahlen um die 30 Prozent an, auch für Nordafrika. Selbst jeder 4. Ozeanier verbringt seine Tage unter derart miserablen Zuständen und immerhin jeder 16. Europäer. Erst 2002 definierte eine Fachkonferenz in Nairobi überhaupt, was ein Slum sei. Sie einigte sich auf fünf wesentliche Merkmale: unsicherer Einwohnerstatus, kein ausreichender Zugang zu sauberem Wasser, gravierende sanitäre oder sonstige Infrastrukturmängel, schlechter Zustand der Unterkünfte sowie Überbevölkerung. Von einem Slum-Haushalt müsse gesprochen werden, wenn Personen, die unter einem Dach leben, von mindestens einem dieser Missstände betroffen seien. Meist treffen jedoch mehrere Parameter zu, wenn nicht alle, und Zigmillionen sind sogar obdachlos. In 30 Jahren, warnt die Uno, lebe ein Drittel der gesamten Menschheit in Slums, ein Szenario, das die Agglomerationen der Dritten Welt wie Dampfdruckkessel erscheinen lässt. Deren Ventil - das ahnt der Westen spätestens seit den Anschlägen von Casablanca im vergangenen Mai - wird immer häufiger die Gewalt sein. Und aus Europa, das sich gerade hoffnungsfroh erweitert hat, könnte auch ein Kontinent der Angst werden. Vor allem Nordafrikas Barackenquartiere gelten als Nährboden des explosiven, expansiven Islamismus. Jeder vierte Arbeitswillige im Maghreb, jenes Staatengürtels, den Marokko, Algerien, Tunesien, Libyen und Mauretanien bilden, hat keinen Job. Am schwersten betroffen sind die Jugendlichen, die 60 Prozent der Bevölkerung stellen. Alle 12 Attentäter, die sich selbst und 33 weitere Menschen umbrachten, kamen aus dem Elendsviertel Sidi Mumin im Osten der Millionenstadt Casablanca. Die Spur der Bombenleger von Madrid wies ebenfalls nach Marokko. \"Der Hass wacht\", beschreibt Marokkos bekanntester Schriftsteller Tahar Ben Jelloun die Stimmung in den Notunterkünften seiner Heimat. \"Der Zorn ist unwiderruflich ausgebrochen.\" Hier würden die \"Rattenfänger\" des Dschihad \"alles auf eine Karte\" setzen - schließlich sei das Paradies, das den Selbstmordattentäter angeblich erwartet, allemal verlockender als sein Alltag. Sidi Mumin ist ein besonders trostloses Abbild dessen, was fast überall an den Rändern der arabischen Metropolen zu beobachten ist: Flüchtlinge, beschäftigungslose Landarbeiter und von der Armut getriebene Bauern nehmen städtisches Gemeindeland in Besitz und errichten illegale Lehmbauten und Wellblechhütten. Die überforderten Stadtverwaltungen legalisieren nachträglich das Elend. Vielmehr nicht. Das Jarmuk-Viertel von Damaskus, Sabra und Schatila am Rande Beiruts, Sadr-City im Nordosten von Bagdad und die in die Wüste und ins Nil-Delta ausufernden \"informellen Gebiete\" von Kairo und Alexandria - es sind Millionen Araber, die weit unter dem Niveau, auch dem Bildungsstandard, ihrer verwestlichten Eliten leben. Und deshalb sind es nicht allein humanitäre Gründe, die westliche Hilfsorganisationen bewegen, in diesen Krisenghettos tätig zu werden. Es gilt auch, die Wagenburgen der Ersten Welt vor Flüchtlingen und Fanatikern zu bewahren. Mit einem 15-Millionen-Euro-Zuschuss unterstützt die deutsche KfW-Entwicklungsbank zum Beispiel seit zwei Jahren den Aufbau der Wasser- und Abwasserversorgung in Manschija Nasser. Auch die im hessischen Eschborn ansässige Gesellschaft für Technische Zusammenarbeit (GTZ) ist an dem Projekt beteiligt. Der Plan der Kairoer Stadtverwaltung, das Viertel kurzerhand abzureißen und seine Bewohner in die Wüste umzusiedeln, war weder zu finanzieren noch sozial vertretbar. Stattdessen graben nun ägyptische Bauarbeiter unter ausländischer Anleitung Wasser- und Kanalrohre in den felsigen Boden. Eine entscheidende Verbesserung? Seit zwei Jahren ist der 28-jährige Ridha Muneim verheiratet, fünf Fehlgeburten hat seine Frau seither hinter sich. Muneim arbeitet im Schusterladen seines Vetters in Manschija Nasser und klebt jeden Tag ein paar hundert Plastiksohlen auf billiges Schuhwerk. Über sein Einkommen klagt er nicht, es sind bis zu 20 Euro in einer guten Woche, aber er möchte endlich Kinder: \"Genau zwei, mehr könnte ich mir nicht leisten.\" Es ist nicht jene Schicksalsergebenheit, die der Kulturforscher Gerhard Schweizer in Indien vorgefunden hat (siehe Interview), sondern eher die Mühe, jede Woche erneut über die Runden zu kommen, die Leute wie Muneim von der Revolte abhält. Immerhin ist er nicht arbeitslos - und deshalb nicht so empfänglich für radikale Parolen wie viele der Jüngeren. Ehemalige Bauarbeiter des Assuan-Staudamms, Landflüchtlinge der ersten Generation, haben Manschija Nasser vor über 40 Jahren gegründet. Für die erste Zuwandererwelle Anfang der sechziger Jahre hatte der Staat kein Geld. Die Kriege von 1967 und 1973 fraßen das Budget auf. Die Boomjahre nach der Ölkrise, die Hunderttausende ägyptischer Gastarbeiter an den Golf lockten, spülten dann Devisen ins Land, die fast vollständig in den Aufbau illegaler Siedlungen wie Manschija Nasser flossen. Seither sprechen die Demografen von einer \"Konsolidierung\" der Entwicklung in Ägypten. In Zahlen heißt das: Es kommen nur mehr etwa tausend zusätzliche Einwohner pro Woche nach Kairo, was die je nach Schätzung 11 bis 17 Millionen Einwohner zählende Hauptstadt lediglich moderat wachsen lässt. Andere urbane Zentren sieht die Uno hingegen aus allen Nähten platzen. In China ist seit 1980 die Zahl der Städter von 190 Millionen auf 480 Millionen angewachsen. Schon 2010 dürften es 700 Millionen sein, und es wird 37 Millionenstädte geben. Das kolumbianische Bogotá wächst jede Woche um drei Hektar, extreme Prognosen gelten auch für die \"Megacitys\" Lagos und Kinshasa in Afrika sowie für die asiatischen Ballungsräume Mumbai (Bombay), Neu-Delhi, Dhaka, Karatschi und Jakarta. Konzepte zur Lösung der Migrationsprobleme, deren sinnfälligste Erscheinung die Slums sind, gibt es nicht. Jährlich sterben allein in Fernost etwa eine halbe Million Kinder durch Smog oder weil sie nur verdrecktes Wasser trinken konnten. In Jakarta kostet ein Kubikmeter kaum genießbaren Leitungswassers umgerechnet 5 Euro. Für die gleiche Menge Trinkwasser kassieren Händler 50 Euro. Die Kunden haben keine Wahl, als sich zu solchen Wucherpreisen zu versorgen, wenn sie zum Beispiel in der Brettersiedlung Kali Jodo wohnen, an einem zur Kloake verkommenen Kanal, wo Tag und Nacht der Unrat gen Himmel stinkt. Nur der Name Kali Jodo erinnert noch an ein besseres Leben. Er bedeutet \"Fluss der glücklichen Liebesbegegnung\". RÜDIGER FALKSOHN, BERNHARD ZAND Von Rüdiger Falksohn und Bernhard Zand",http://www.spiegel.de/spiegel/a-302216.html,2004-06-02T00:00:00.000Z
"Düsterer Ausblick REUTERS Durchlöchertes Zuhause: Ein palästinensischer Junge aus dem Flüchtlingslager Rafah im Gaza-Streifen blickt durch Einschusslöcher im Haus seiner Familie, die israelische Geschosse hinterlassen haben. Noch immer ist das israelische Kabinett uneins über einen Plan des Premiers Ariel Scharon, sämtliche israelische Siedlungen im Gaza-Streifen aufzugeben. Eine Abstimmung wurde heute für den kommenden Sonntag angekündigt. Archiv: Alle Tage, alle Bilder",http://www.spiegel.de/politik/ausland/duesterer-ausblick-a-302470.html,2004-06-02T00:00:00.000Z
"Jennifer Lopez Das Leben - ein Lifestyle-Karussell Sie war J.Lo und Jenny from the Block, Latina-Braut und HipHop-Prinzessin. Jetzt verspricht Jennifer Lopez eine Wiedergeburt: \"Rebirth\" heißt ihr neues Album, ist aber vor allem ein geschickter Relaunch im Geiste des Multitaskings. Von Daniel Haas Eine Modefirma, eine Kosmetikreihe, Schmuckollektionen, mehrere Restaurants, Filmrollen an der Seite von George Clooney und Ralph Fiennes, dazu drei Platin-prämierte Alben - Jennifer Lopez, 36, ist zum global vermarktbaren Superstar geworden. Die Folge: 300 Millionen Dollar Umsatz allein im Jahr 2004 und ein 19. Platz auf der Liste der 40 reichsten Amerikaner unter 40 im amerikanischen Wirtschaftsblatt \"Forbes\", sechs Plätze vor Julia Roberts.  Identität der Pop-Moderne \"Ich finde es schade, dass die Leute denken, ich würde zu viel Verschiedenes machen\", sagte sie unlängst der \"New York Times\". \"Ich würde mich schlecht fühlen, wenn ich das alles nicht tun könnte. Ich muss einfach ich selber sein.\" Die Vervielfältigung als Selbstermächtigung, das klingt wie eine jener schönen Paradoxien der Postmoderne. Die Rollen wechseln, sich täglich neu erfinden, die starren Konturen der einstmals aus Klasse, Ethnie und Geschlecht zusammen gesetzten Identität auflösen - das Leben ist ein Lifestyle-Karussell, das allen alle Chancen bietet. Man selber sein bei gleichzeitiger Auffächerung in diverse Images: Das ist aber vor allem Vorrecht und Pflicht des Superstars. Er ist so nah und authentisch wie der Nachbar von nebenan und dabei so fern wie ein anderer Planet. Sein Erscheinen behauptet Originalität bis in die Zehenspitzen und bietet dabei nur Fläche für Projektionen, Wünsche, Illusionen. Jennifer Lopez hat diese Ambivalenz wie kaum ein anderer Star der letzten Jahre verkörpert, und wenn ihr neues Album \"Rebirth\" - Wiedergeburt - heißt, dann vielleicht deshalb, weil hier eine Künstlerin begriffen hat, wie eng Selbst- und Wertschöpfungskette miteinander verbunden sind. Wie jedes weltweit operierende Unternehmen seine Strategien von Zeit zu Zeit überdenken muss, hat der weibliche Enterpreneur Lopez eine mediale Jungfernzeugung von eigenen Gnaden anberaumt. So jemand braucht keine große Krise, um ein Comeback zu feiern - es ist einfach Zeit für einen Relaunch, eine Geburt des Stars aus dem Geiste kapitalistischer Logik. Linie sechs zur Nummer eins Deren Dynamik hat Lopez ganz nach oben gebracht: Vom Kind puertoricanischer Einwanderer, das in der Bronx aufwächst und schon als kleines Mädchen von den großen Bühnen schwärmte, zum Hollywood-Star, der Ben Affleck den Kopf verdrehen und P. Diddy einen Korb geben kann. Dabei spiegelt sich in J.Los Karriere die geschickte Nutzung ethnischer Rollenmuster und der Zwang, sie loszuwerden. War Lopez am Anfang vor allem der Star eines aufstrebenden Latino-Kinos, der mit dem Migranten-Drama \"Meine Familie\" 1995 den Sprung auf die Leinwand schaffte, wurde sie schnell zur umfassend einsetzbaren Darstellerin, die eine indianische Femme fatale (\"U-Turn\"; 1997) ebenso verkörpern konnte wie eine hispanische Polizistin (\"Out of Sight\"; 1998) oder eine italoamerikanische Hochzeitsplanerin (\"The Wedding Planner\"; 2001). CD-Cover \"Rebirth\": R&B im Power-Yoga-Stil Auch musikalisch hat sich Lopez mehr und mehr vom Latina-Image emanzipiert. Der Salsa-Einfluss ist auf ihren Platten von Album zu Album stärker in den Hintergrund getreten, wobei schon ihr Debüt \"On the 6\" die Richtung vorgab. Der Titel spielt auf die U-Bahn-Linie sechs an, mit der der spätere Superstar aus der Bronx zum Tanzunterricht nach Manhattan fuhr. Dort, in den Hochburgen des weißen Establishments, fand J.Lo ihre Zielgruppe, auch wenn sie als Role-Model für junge hispanische Frauen ebenso brillieren konnte wie als Jenny from the Block, die die HipHop-Tugenden Authentizität und Kampfgeist verkörpert. \"Assimilation bedeutet im nordamerikanischen Kontext, sich abzusetzen von der 'schwarzen Minderheit'\", schrieb die \"taz\", und tatsächlich hat sich La Lopez vor allem musikalisch, trotz Kollaborationen mit Rappern wie Ja Rule und Puff Daddy, immer weiter vom HipHop und seinen popkulturellen Codes entfernt. Für Sportstfreunde des globalen Marktes Die Wiedergeburt findet deshalb konsequent im Zeichen von R&B statt. Auf \"Rebirth\" ist die Bronx zwar mit Star-Rapper Fat Joe vertreten, doch insgesamt dominiert der sportliche Sound des tiefer gelegten Pop-Soul. Ausdauer, Belastbarkeit und sexuelle Attraktivität, diese Kardinaltugenden des Kapitalismus, werden hier musikalisch inszeniert. Schon auf dem Cover posiert die Sängerin nicht mehr wie noch auf dem Vorgänger-Album \"J.Lo\" mit ordinärer HipHop-Grandezza inklusive Goldketten und Löwenmähne, sondern im schlichten Ganzkörperdress. Die Haltung ist konzentriert-nachdenklich, es könnte die Ruhe nach dem Sturm einer Power-Yoga-Sitzung sein, die hier zum Ausdruck kommt. Im CD-Booklet selber dann ein bisschen Nasse-Haare-Laszivität und Bikini-Mode; das Ganze verströmt jedoch mehr den Charme einer Fitness-Broschüre als das Air erotischer Verruchtheit. \"Rebirth\" beweist also vor allem den Willen zum Erfolg jenseits ethnischer Festlegung. Ghetto-Glamour und Latin-Folklore waren nur Stationen auf dem Weg der Jennifer Lopez in jene Region, in der Ikonen wie Madonna ihr eigenes Image verwalten. Dort, auf dem Olymp der Popkultur, zeugen die Mediengötter sich selbst und ihre Repräsentationen, ein Multitasking zwischen Sein und Schein. Das Album \"Rebirth\" von Jennifer Lopez ist bei Sony erschienen.",http://www.spiegel.de/kultur/musik/jennifer-lopez-das-leben-ein-lifestyle-karussell-a-345843.html,2005-03-11T00:00:00.000Z
"USA Massenproteste gegen schärfere Einwanderungsregeln Tausende Menschen haben in den vergangenen Tagen in den USA gegen ein strengeres Einwanderungsrecht demonstriert. Der Senat berät seit Anfang vergangener Woche über ein neues Gesetz. Künftig könnten illegale Einwandere als Straftäter gelten. New York/Costa Mesa - In New York zogen am Wochenende mehr als 10.000 Menschen über die Brooklyn Bridge zum örtlichen Büro der Einwanderungsbehörde im Stadtteil Manhattan. An den Protesten in New York beteiligten sich neben US-Bürgern lateinamerikanischer Herkunft auch Einwanderer aus China. Die Demonstranten trugen Transparente mit Aufschriften wie \"Wer Einwanderern schadet, schadet Amerika\" oder \"Ich habe am Ground Zero aufgeräumt\". Einige Demonstranten schwenkten die Flaggen ihrer Herkunftsländer. AP Einwanderer: Die Demonstranten versammelten sich in einem von Holländern gegründeten Stadtteil, zogen über eine von einem Deutschen entworfene Brücke und beschlossen die Kundgebung auf einem Platz in Chinatown, wo früher die Slums der Iren lagen New Yorks Bürgermeister Michael Bloomberg forderte die US-Abgeordneten auf, Augenmaß zu bewahren: \"Ihr werdet nicht zwölf Millionen Menschen abschieben\", sagte er. Vielmehr müssten die USA sich auf die Grenzkontrollen konzentrieren. Kundgebungen gegen die neuen Einwanderungsgesetze gab es zudem in Texas, Nevada, Arizona, Oklahoma und Virginia. Der US-Senat debattiert seit Dienstag über ein neues Einwanderungsgesetz. Der republikanische Mehrheitsführer im Senat, Bill Frist, möchte die derzeit gültigen Bestimmungen erheblich verschärfen. Sein Plan ähnelt einem Gesetzentwurf, den das Repräsentantenhaus im vergangenen Dezember verabschiedete. Das Gesetz erklärt illegale Einwanderer zu Straftätern und sieht für die Beschäftigung Illegaler höhere Geldstrafen vor. Zudem befürwortet es, den Grenzzaun zwischen Mexiko und den USA weiter auszubauen. US-Präsident George W. Bush macht sich dagegen für ein Gastarbeiterprogramm stark, mit dem er einem Teil der rund zwölf Millionen Illegalen im Land eine befristete Aufenthaltserlaubnis gewähren will. Auch eine Mehrheit der amerikanischen Bevölkerung ist laut einer aktuellen Umfrage dafür, illegal in den USA lebenden Einwanderern den Erwerb eines Aufenthaltstitels zu ermöglichen. 56 Prozent der Befragten sprachen sich in einer im Auftrag der Nachrichtenagentur AP vom Meinungsforschungsinstitut Ipsos durchgeführten Erhebung dafür aus. Auch in Kalifornien gingen zahlreiche Menschen auf die Straße. In der Stadt Costa Mesa demonstrierten laut Polizeiangaben 1500 Menschen gegen ein geplantes Vorhaben der Stadt: Die Behörden dort diskutieren derzeit, die Polizei die Staatsbürgerschaft Verdächtiger überprüfen zu lassen und so zur Ausweisung von illegalen Einwanderern beizutragen. \"Wir sind hier, um ein deutliches Zeichen zu setzen in der Hochburg der Anti-Immigrationsbewegung\", sagte der Organisator und Leiter der Mexikanisch-amerikanischen Politischen Vereinigung, Nativo Lopez. Der Protest gegen schärfere Regeln für Einwanderer soll im ganzen Land weitergehen. Für den 1. Mai haben Organisationen lateinamerikanischer Immigranten zu einem landesweiten Boykott aufgerufen. In Los Angeles waren vor einer Woche mehr als 500.000 Menschen für ein liberales Einwanderungsgesetz auf die Straße gegangen. ler/AFP/AP",http://www.spiegel.de/politik/ausland/usa-massenproteste-gegen-schaerfere-einwanderungsregeln-a-409368.html,2006-04-02T00:00:00.000Z
