article,article_url,date
"Jean Baudrillard \"Das ist der vierte Weltkrieg\" Der französische Philosoph Jean Baudrillard über Amerikas Feldzug gegen den Terrorismus, den Widerstand gegen die Globalisierung und die Unbesiegbarkeit des Bösen. AFP Scharfzüngiger Kritiker der Konsumgesellschaft: Der französische Philosoph Jean Baudrillard SPIEGEL: Monsieur Baudrillard, Sie haben die Attentate vom 11. September in New York und Washington als das \"absolute Ereignis\" beschrieben. Sie haben die USA beschuldigt, durch ihre unerträgliche hegemoniale Übermacht den unwiderstehlichen Wunsch nach ihrer Zerstörung zu wecken. Jetzt, wo die Herrschaft der Taliban kläglich zusammengebrochen ist, Bin Laden nichts mehr als ein gehetzter Flüchtling ist ­ müssen Sie nicht alles widerrufen? Baudrillard: Ich habe nichts verherrlicht, niemanden angeklagt und nichts gerechtfertigt. Man darf den Botschafter nicht mit seiner Kunde verwechseln. Ich bemühe mich, einen Prozess zu analysieren: den der Globalisierung, die durch ihre schrankenlose Ausdehnung die Bedingungen für ihre eigene Zerstörung schafft. SPIEGEL: Lenken Sie damit nicht einfach ab von der Tatsache, dass identifizierbare Verbrecher und Terroristen für die Anschläge verantwortlich sind? Baudrillard: Natürlich gibt es handelnde Akteure, aber der Geist des Terrorismus und der Panik reicht weit über sie hinaus. Der Krieg der Amerikaner konzentriert sich auf ein sichtbares Objekt, das sie zerschmettern möchten. Doch das Ereig-nis vom 11. September in all seiner symbolischen Bedeutung lässt sich so nicht auslöschen. Die Bomben auf Afghanistan sind eine völlig unzulängliche Ersatzhandlung. SPIEGEL: Die USA haben immerhin eine barbarische Unterdrückung beendet und dem afghanischen Volk eine Chance zum Neubeginn in Frieden gegeben. So sieht es auch Ihr Kollege Bernard-Henri Lévy. Baudrillard: Die Lage scheint mir nicht so eindeutig. Der Triumphalismus eines Lévy ist mir fremd. Er bringt ein Hoch auf die B-52-Bomber aus, als wären diese Instrumente des Weltgeistes. SPIEGEL: Es gibt keinen gerechten Krieg? Baudrillard: Nein, dafür gibt es zu viele Ambivalenzen. Kriege werden oft aus dem Drang nach Gerechtigkeit heraus begonnen, das ist sogar fast immer die offizielle Begründung. Aber selbst wenn sie gerechtfertigt sein mögen und in bester Absicht geführt werden, enden sie in der Regel nicht so, wie ihre Urheber sich das vorstellen. SPIEGEL: Die Amerikaner haben unbestreitbare Erfolge erzielt. Viele Afghanen können jetzt auf ein besseres Leben hoffen. Baudrillard: Warten Sie ab. Noch haben nicht alle afghanischen Frauen ihren Schleier abgelegt. Die Scharia soll in Kraft bleiben. Das Regime der Taliban ist zerschlagen, gewiss. Aber das internationale Netzwerk der Terroristenorganisation al-Qaida existiert immer noch. Und Bin Laden, tot oder lebendig, ist vor allem verschwunden. Das verleiht ihm eine mythische Macht, er gewinnt in gewisser Weise eine übernatürliche Dimension. SPIEGEL: Haben die Amerikaner erst gesiegt, wenn sie Bin Laden oder seine Leiche im Fernsehen präsentieren können? Baudrillard: Das wäre ein fragwürdiges Spektakel, und selbst dann bliebe ihm die Rolle des Märtyrers. Ihn zur Schau zu stellen würde ihn nicht unbedingt entzaubern. Auf dem Spiel steht mehr als die Kontrolle eines Territoriums, einer Bevölkerung oder die Ausschaltung einer subversiven Organisation. Der Einsatz ist fast schon metaphysisch geworden. SPIEGEL: Warum können Sie nicht einfach akzeptieren, dass die Zerstörung des World Trade Center die willkürliche, irrationale Tat einiger verblendeter Fanatiker war? Baudrillard: Eine gute Frage, aber selbst wenn es sich um eine bloße Katastrophe gehandelt hätte, bliebe die symbolische Bedeutung des Ereignisses erhalten. Nur so erklärt sich auch seine Faszination. Hier ist etwas geschehen, das bei weitem den Willen der Akteure übersteigt. Es gibt eine universelle Allergie gegen eine endgültige Ordnung, gegen eine endgültige Macht, und die Zwillingstürme des World Trade Center verkörperten diese endgültige Ordnung in vollkommener Weise. SPIEGEL: Demnach erklären Sie den terroristischen Wahn als unausweichliche Reaktion auf ein System, das selbst größenwahnsinnig geworden ist? Baudrillard: Das System selbst in seinem totalen Anspruch hat die objektiven Bedingungen dieses furchtbaren Gegenschlags geschaffen. Der immanente Irrsinn der Globalisierung bringt Wahnsinnige hervor, so wie eine unausgeglichene Gesellschaft Delinquenten und Psychopathen erzeugt. In Wahrheit sind diese aber nur die Symptome des Übels. Der Terrorismus ist überall, wie ein Virus. Er braucht Afghanistan nicht als Heimstatt. SPIEGEL: Sie deuten die Globalisierung und den Widerstand gegen sie wie den Verlauf einer Krankheit, sogar wie eine Selbstzerstörung. Ist das nicht das eigentlich Skandalöse an Ihrer Analyse ­ dass diese das Moralische völlig auslässt? AP Trümmer des World Trade Center in New York Baudrillard: Ich bin auf meine Weise durchaus ein Moralist. Es gibt eine Moral der Analyse, eine Pflicht zur Aufrichtigkeit. Ich will damit sagen, dass es unmoralisch ist, die Augen vor der Wahrheit zu verschließen, nach Vorwänden zu suchen, um das schwer Erträgliche zu kaschieren. Wir müssen die Dinge jenseits des Gegensatzes von Gut und Böse sehen. Ich suche die Konfrontation mit dem Ereignis, so wie es ist, ohne Zweideutigkeit. Wer das nicht kann, wird zu einer moralischen Falschschreibung der Geschichte verleitet. SPIEGEL: Aber wenn der terroristische Akt sich zwangsläufig, praktisch schicksalhaft vollzieht, wie Sie behaupten, ist er dann nicht zugleich entschuldigt? Es gibt kein verantwortliches Subjekt mehr. Baudrillard: Die Begrifflichkeit meiner Analyse ist zweischneidig, das ist mir klar. Die Worte können gegen mich gewendet werden. Aber ich lobpreise nicht Mord und Totschlag, das wäre idiotisch. Der Terrorismus ist keine zeitgenössische Form der Revolution gegen Unterdrückung und Kapitalismus. Keine Ideologie, kein Kampf für eine Sache, auch nicht der islamische Fundamentalismus, können ihn erklären. SPIEGEL: Aber warum sollte sich die Globalisierung gegen sich selbst richten, warum sollte sie Amok laufen, da sie doch Freiheit, Wohlstand und Glück für alle verheißt? Baudrillard: Das ist die utopische Sicht, die Reklame gewissermaßen. Aber es gibt kein gänzlich positives System. Im allgemeinen sind positivistische Geschichtsutopien äußerst mörderisch, wie Faschismus und Kommunismus gezeigt haben. SPIEGEL: Globalisierung können Sie doch nun wirklich nicht mit den blutigsten Systemen des 20. Jahrhunderts vergleichen. Baudrillard: Sie beruht, wie früher der Kolonialismus, auf einer ungeheuren Gewalt. Sie schafft mehr Opfer als Nutznießer, auch wenn die westliche Welt mehrheitlich davon profitiert. Natürlich können die USA im Prinzip jedes Land so befreien wie Afghanistan. Aber was wäre das für eine sonderbare Befreiung? Die derart Beglückten würden sich dagegen zur Wehr zu setzen wissen, notfalls eben mit Terror. SPIEGEL: Sie halten die Globalisierung für eine Form der Kolonisierung, getarnt als Ausbreitung der westlichen Zivilisation? Baudrillard: Sie wird angepriesen wie der Endpunkt der Aufklärung, die Auflösung aller Widersprüche. In Wirklichkeit verwandelt sie alles in einen verhandelbaren, bezahlbaren Tauschwert. Dieser Prozess ist extrem gewaltsam, denn er zielt auf eine Vereinheitlichung als Idealzustand ab, in dem alles Einzigartige, jede Singularität, mithin auch jede andere Kultur und letztlich jeder nichtmonetäre Wert aufgehoben würden. Sehen Sie: An diesem Punkt bin ich der Humanist und der Moralist. SPIEGEL: Setzen sich mit der Globalisierung nicht auch universelle Werte wie Freiheit, Demokratie und Menschenrechte durch? 1 | 2 weiter 1. Teil: \"Das ist der vierte Weltkrieg\" 2. Teil",http://www.spiegel.de/kultur/gesellschaft/jean-baudrillard-das-ist-der-vierte-weltkrieg-a-177013.html,2002-01-15T00:00:00.000Z
"Geburtskirche Betlehem Palästinenser ins Exil nach Italien? Im Nervenkrieg zwischen Israelis und Palästinensern um die seit Anfang April belagerte Geburtskirche in Betlehem zeichnet sich ein Ende ab: Einige der radikalen Palästinenser in dem Gotteshaus sollen angeblich ins Exil nach Italien gehen, andere könnten in den Gaza-Streifen geschickt werden. REUTERS Geburtskirche in Betlehem: Gibt es endliche eine Lösung? Betlehem - Zwischen sechs und zehn der von Israel gesuchten Extremisten sollen nach palästinensischen Angaben nach Italien gebracht werden. Dort müssten sie vier Jahre bleiben. Weitere 40 sollen in den Gaza-Streifen geleitet werden. Die verbleibenden etwa 80 Palästinenser kämen frei.  Die Verhandlungen seien aber noch nicht beendet, sagte eine israelische Militärsprecherin in der Nacht zum Montag. Wahrscheinlich könnten die Besetzer die Geburtskirche erst im Laufe des Tages verlassen. Nach israelischen Militärangaben befinden sich noch immer 123 Personen in der Kirche. Neben bewaffneten Palästinensern sollen auch einige Mönche und Nonnen sowie ausländische Unterstützer der Palästinenser in dem Gotteshaus sein, das an der Stelle steht, wo Jesus geboren worden sein soll. Zehn Palästinenser stünden als Gewalttäter ganz oben auf der Fahndungsliste, aber es seien auch noch andere bewaffnete Palästinenser in der Kirche, die von Israel als \"Terroristen\" bezeichnet werden, hieß es.  Arafat prüft offenbar Exil-Liste Israel sieht die Besetzer der Kirche als Geiselnehmer an. Die Palästinenser hingegen behaupten, die zum Teil aus dem Ausland angereisten Unterstützer und die Mönche und Nonnen seien freiwillig in der Geburtskirche geblieben.  Palästinenser- Präsident Jassir Arafat prüft angeblich bereits eine Liste der für das Exil vorgesehenen Personen. Die Palästinenser hatten zur Lösung des Betlehem-Konflikts ein ähnliches Vorgehen wie kürzlich zur Beendigung des Hausarrests Arafats vorgeschlagen. Dabei waren sechs von Israel als Gewalttäter gesuchte Personen nach Jericho ins Gefängnis gebracht und dort einer britisch-amerikanischen Aufsicht unterstellt worden. Seit Beginn der Belagerung sind sieben Personen in der Kirche von Soldaten erschossen worden, mehrere wurden verwundet.  AFP Scharon: Beweise gegen Arafat? Israels Ministerpräsident Ariel Scharon ist unterdessen zu Gesprächen in Washington eingetroffen. Scharon wird US-Präsident George W. Bush voraussichtlich am Dienstag treffen. Scharon will einen eigenen Friedensplan und einen hundert Seiten umfassenden Bericht präsentieren, der nach israelischen Angaben die direkte Verbindung von Arafat zu Anschlägen in Israel belegen soll.   Schon vor der Ankunft Scharons erklärte die amerikanische Regierung, sie werde Arafat weiterhin als Gesprächspartner akzeptieren. US-Außenminister Colin Powell und die nationale Sicherheitsberaterin Condoleezza Rice äußerten sich am Sonntag in mehreren TV-Interviews entsprechend.  USA wollen weiterhin mit Arafat reden Der israelische Regierungschef könne Arafat als Terroristen bezeichnen und ihn das nennen, \"was immer ihm beliebt\", sagte der Außenminister. Aber die USA seien der Überzeugung, dass es im Interesse der Israelis, der Palästinenser und anderer Nationen liege, \"wenn wir weiterhin mit allen palästinensischen Führungspersonen arbeiten und anerkennen, wen das palästinensische Volk als seine Führer betrachtet\". Arafats Popularität sei durch die Ereignisse der vergangenen Wochen noch gestiegen. \"Das ist die Situation, mit der wir es zu tun haben\", fügte Powell hinzu.  Rice erklärte, Arafat sei nicht die Führungsperson, die das palästinensische Volk benötige. Aber er sei der Mann, den die Palästinenser sich ausgesucht hätten. \"Nicht wir wählen den Führer des Volkes aus\", sagte die Sicherheitsberaterin. Sie bekräftigte zugleich, dass Arafat denselben Standards genügen müsse wie jede politische Führungspersönlichkeit auch, die respektiert werden wolle. Er habe bisher nicht genug zur Bekämpfung des Terrorismus getan, und die Autonomiebehörde müsse jene Demokratie und Transparenz gewährleisten, die für den Aufbau eines Palästinenser-Staates nötig seien.  Gespräche über israelische Siedlungspolitik Powell kündigte weiter an, dass während des Scharon-Besuches auch die Frage der israelischen Siedlungen in den Palästinenser-Gebieten angesprochen werde. Es sei klar, dass in diesem Punkt etwas geschehen müsse.  Am Sonntag hatten israelische Panzer in einem Militärlager südlich von Dschenin eine Mutter und ihre drei Kinder getötet. Ein weiterer Zwischenfall ereignete sich beim Vorstoß israelischer Truppen in das palästinensische Flüchtlingslager Tulkarm. Panzer bezogen Positionen am Eingang des Lagers, und Panzersoldaten schossen mit Maschinengewehren auf einzelne Gebäude. Dabei wurde nach Berichten von Augenzeugen ein neunjähriger Junge erschossen.",http://www.spiegel.de/politik/ausland/geburtskirche-betlehem-palaestinenser-ins-exil-nach-italien-a-194948.html,2002-05-06T00:00:00.000Z
"Autonomiebehörde in der Krise Prominenter Arafat-Kritiker bei Attentat schwer verletzt Die Lage in den Palästinensergebieten bleibt angespannt: Unbekannte haben einen Anschlag auf einen bekannten Kritiker von Palästinenserpräsident Arafat verübt, ein Mitarbeiter der Autonomiebehörde wurde von Maskierten entführt, und der Streit zwischen Parlament und Arafat über den Rücktritt von Premier Kurei schwelt weiter. AP Arafat-Kritiker Amr wird nach dem Attentat ins Krankenhaus gebracht Ramallah - Ahmed Kurei erklärte, der Angriff auf den früheren Informationsminister Nabil Amr sei ein weiterer Beleg für die Gesetzlosigkeit in der Region. Der Anschlag auf den 47-Jährigen ziele darauf ab, \"Menschen zum Schweigen zu bringen und die Meinungsfreiheit zu zerstören\". Unbekannte hatten Amr gestern am späten Abend in Ramallah angeschossen und schwer verletzt. Der Parlamentarier wurde heute mit schweren Beinverletzungen auf eine Intensivstation in Jordanien verlegt.  Zuvor hatte er ein Fernseh-Interview gegeben, in dem er Korruption und Machtmissbrauch der Autonomiebehörde kritisiert hatte. Arafat ordnete eine Untersuchung des Angriffs an. Bereits 2002 war das Haus Amrs beschossen worden, nachdem er den Führungsstil Arafats kritisiert hatte.  Nur wenige Stunden vor dem Attentat hatte der Reformpolitiker in einem anderen Interview zu einem gewaltfreien Widerstand gegen die israelische Besatzung aufgerufen. Nur mit einem Kurswechsel könnten die Palästinenser ihre politischen Ziele erreichen, sagte er am Morgen der Deutschen Presse-Agentur. \"Ich bin gegen jede Art von Gewalt. Gewalt hat zu einem Desaster für uns geführt.\"  Amr verwies auf den 1987 begonnenen ersten palästinensischen Aufstand (Intifada) gegen die Besatzung vor dem Oslo-Friedensprozess. Die Palästinenser hätten damals mit weniger Gewalt \"bedeutende politische Ergebnisse\" erzielt. Durch die zweite Intifada, die im September 2000 begann, seien sie dagegen \"zum Anfang zurückgekehrt\". Er rief zudem zu Reformen und mehr Demokratie in den palästinensischen Gebieten auf. Die Palästinenser müssten ihre internen Probleme lösen.  Das palästinensische Parlament forderte Arafat heute dazu auf, Kureis Rücktritt zu akzeptieren. Als Protest gegen die Gesetzlosigkeit in den Palästinensergebieten hatte Kurei am Samstag sein Amt niedergelegt, sich nach dreitägigen Krisengesprächen aber dazu bereit erklärt, vorübergehend Premier zu bleiben. Das Parlament forderte den Präsidenten zudem zu energischen Maßnahmen gegen die Unruhen im Gaza-Streifen auf. Dort war es aus Protest gegen die Ernennung eines Vetters von Arafat zum Sicherheitschef zu Massendemonstrationen und Straßenkämpfen gekommen.  Die Exilführung der radikalen Hamas-Bewegung in Damaskus rief die Palästinenserführung heute zur Beendigung der internen Krise auf. In einer Stellungnahme des Hamas-Führers Chaled Maschal hieß es, der Bruderzwist gefährde die \"gerechte palästinensische Sache\". In Telefongesprächen mit Arafat und dem ehemaligen Ministerpräsidenten Mahmud Abbas habe er seine große Sorge ausgedrückt und eine Rückkehr zum friedlichen Dialog gefordert, hieß es.  Erstmals seit Beginn der Krise in den Palästinensergebieten am Wochenende haben maskierte Palästinenser auch im Westjordanland einen Mitarbeiter der Autonomiebehörde entführt. Nach palästinensischen Angaben wurde Fadel Schuli, Mitarbeiter des Gouverneurs von Nablus, heute von Vermummten in das örtliche Flüchtlingslager Balata verschleppt. Seine Vorgesetzten hätten Kontakt mit den Entführern aufgenommen, um seine Freilassung zu erwirken, hieß es. Am Freitag hatten aufgebrachte Palästinenser in Gaza zwei Polizeioffiziere und vier französische Techniker vorübergehend entführt.",http://www.spiegel.de/politik/ausland/autonomiebehoerde-in-der-krise-prominenter-arafat-kritiker-bei-attentat-schwer-verletzt-a-309829.html,2004-07-21T00:00:00.000Z
"Deutsch-türkische Sitcom Wenn der Mullah-Wecker klingelt Keine Witze über Migranten? Lachhaft! Deutsche TV-Sender präsentieren mit neuen Formaten das deutsch-türkische Millieu als Ort pointierten Humors. Bestes Beispiel: die heute startende Sitcom \"Türkisch für Anfänger\". Von Christian Buß Saima Altunkaya Christian Buß Jahrgang 1968, schreibt seit 1988 über Popkultur, Film und Fernsehen. Stationen: \"Hamburger Morgenpost\", \"Tempo\", \"Rolling Stone\", \"taz\", \"Berliner Zeitung\". Seit 2004 Autor für SPIEGEL ONLINE, seit Januar 2011 Redakteur im Ressort Kultur. E-Mail: Christian.Buss@spiegel.de Twitter: @Christian_Buss folgen Mehr Artikel von Christian Buß Es gibt für Töchter in der Pubertät nur eines, was schlimmer ist als spießige Mutter: Mütter, die bemüht unspießig sind. \"Kann ich reinkommen oder masturbierst du gerade?\", flötet die freigeistige Erziehungsberechtigte Doris ins Jugendzimmer von Lena, die darauf angeekelt das Gesicht verzieht. Und vielleicht gibt es ja für manche Tochter aus türkischem Hause nichts Schlimmeres als einen liberalen Vater, der die Regeln des Korans missachtet. Die halbwüchsige Yagmur jedenfalls, die Kopftuch trägt und sich morgens von einem scheppernden Mullah-Gebetswecker wecken lässt, findet den religiösen Schlendrian ihres Vaters Metin bedenklich. Der Typ weiß ja nicht mal, was der Ramadan ist! Lena, Doris, Metin und Yagmur sind Teil jener deutschen und türkischen Rumpffamilie, die man für die ARD-Vorabendserie \"Türkisch für Anfänger\" in ein gemeinsames Eigenheim gesperrt hat. Hinzu kommt auf deutscher Seite der kleine Stoffel Nils und auf türkischer der 17-jährige Cem, der meint, darauf achten zu müssen, dass die Frauen der Patchwork-Sippe nicht immer halbnackt durch die Gegend rennen. Sechs Menschen und jede Menge Stereotypen unter einem Dach. Doch das Schöne an dieser Mixtur aus Sitcom, Soap und klassischer Vorabendserie ist, dass für jedes zementierte Klischee ein anderes gesprengt wird. \"Türkisch für Anfänger\" ist Multikulti ohne Bildungsauftrag. Spaß verstehen auf Deutschtürkisch Das klingt salopp, aber die Macher der Serie haben letztlich einen schwierigen Auftrag: mit der zeitgemäßen Ethno-Variante des öffentlich-rechtlichen Oldies \"Ich heirate eine Familie\" zum ersten Mal ein bisschen deutsch-türkische Normalität in den hiesigen Vorabend zu schmuggeln. Zwar erzählt man hierzulande im Kino regelmäßig spannende Geschichten, die vom Leben türkischer Migranten handeln, und das Fernsehpublikum lacht über Komiker wie Kaya Yanar (\"Was guckst Du!\"). Doch die konkrete Einarbeitung türkischer Lebenswelten ins deutsche TV-Milieu hat bislang nicht stattgefunden; alle zaghaften Versuche in diese Richtung scheiterten. So wurde die Sat.1-Sitcom \"Der König von Kreuzberg\" vor knapp einem Jahr wegen schwacher Quoten direkt nach ihrem Start aus dem Programm genommen. Trotz dieser Pleite setzt man hierzulande nun verstärkt auf junge Deutsch-Türken: Im April startet RTL nach einigem Zögern seine schon vor zwei Jahren als \"Halbmond über Neukirchen\" angekündigte Comedy-Serie \"Alle lieben Jimmy\", in der es um einen türkischen Großkotz und seine beiden sympathischen Schwestern geht. Und ProSieben schickt mit \"Meine verrückte türkische Hochzeit\" am 30. März eine romantische Komödie ins Rennen, in der ein Kreuzberger Plattenhändler ins Döner-Milieu einheiraten will. \"Mein Schwiegerpapa, Allah und ich\" sollte die Produktion anfänglich heißen, dieser Titel schien ProSieben allerdings wegen des Karikaturenstreits zu riskant. Dabei ist sich Bora Dagtekin, Chefautor von \"Türkisch für Anfänger\", sicher: \"Türken haben viel Humor. Das ist beim Karikaturenstreit in letzter Zeit ja leider in Vergessenheit geraten.\" Dagtekin ist erst 27, betreut mit der Vorabendserie aber schon eines der ambitioniertesten Projekte der ARD. Der Erfolg wird jedoch nicht nur vom Spaßverständnis der Migranten abhängen, sondern auch davon, ob das programmstrategische Kalkül aufgeht. Denn man hat der Serie ja einen zentralen Sendeplatz eingeräumt, sie muss also jene Programmschiene sanieren, die zuvor durch die gefloppte Historien-Soap \"Sophie - Braut wider Willen\" ins quotentechnische Hintertreffen geraten ist. Weniger altdeutscher Adel, mehr deutsch-türkischer Alltag: Das klingt dann doch ganz erfreulich. Allerdings wird man \"Türkisch für Anfänger\" auch an der Quote von \"Berlin, Berlin\" messen, der Produktion, die den ARD-Vorabend vor einigen Jahren über mehrere Staffeln für jüngere Menschen attraktiv gemacht hat. Sicherheitshalber hat man deshalb ein paar der \"Berlin, Berlin\"-Regisseure verpflichtet, die auch hier für einen flotten Pointen-Rhythmus sorgen. Doch Hauptdarstellerin Josefine Preuß, die als Lena eigentlich recht patent durchs deutsch-türkische Tohuwabohu führt, sollte in Zukunft ein bisschen aufs Augenrollen, Schnuteziehen und In-die-Kamera-Schnauben verzichten. Was bei Felicitas Woll als Lolle in \"Berlin, Berlin\" ein hübsches Markenzeichen war, wirkt hier streckenweise manieriert. Kulturkampf für die ganze Familie Man muss der Serie Zeit lassen, sich zu entwickeln - und hoffen, dass die Programmgewaltigen der ARD das ebenfalls tun. Die Schauspieler arbeiten an der Grenze zur Karikatur, überschreiten diese aber selten. Man beginnt die Figuren über die verschiedenen Folgen tatsächlich ins Herz zu schließen; die liberale Mutter (Anna Stieblich), die mit ihrer Freizügigkeit die Entfaltung ihrer Kinder eher einengt als sie zu fördern, genauso wie den überassimilierten Vater (Adnan Maral), der ungläubig mit anschaut, dass Sohn und Tochter türkischer werden als er es je war. Chefautor Bora Dagtekin, selber in einem Haushalt mit deutscher Mutter und türkischem Vater sozialisiert, platziert die Pointen ziemlich salopp und dabei öffentlich-rechtlich ausgewogen auf Kosten beider Kulturgruppen. Am Anfang wirkt der Plot allerdings überfrachtet; der fröhlich-despektierliche Umgang mit den Religionen nervt da schon mal. Dass etwa das aufmüpfige Wunderkind Lena für drei Minuten trotzig zum Judentum konvertiert, ist einfach zu viel. An anderen Stellen werden schwerwiegende Konflikte einfach von der mächtigen Erzählerhand weggewischt. So was funktioniert aber auch auf Sitcom-Ebene nicht. Was thematisch ins Spiel gebracht wird, muss auch erzählerisch weitergeführt werden. Über die ersten Folgen kommt die Serie dann schließlich aber etwas zur Ruhe, ohne an Pointendichte zu verlieren. Nett, wie sich die progressiven Alten widerwillig auf ihre Kinder einlassen, die sich nach Regelwerk und Traditionen sehnen. Die antiautoritäre deutsche Mutter, die nichts dagegen hätte, wenn ihre Tochter ein bisschen mehr mit Drogen und Sex experimentieren würde, stellt zum Zeichen ihrer Liebe ein paar eiserne Haushaltsvorschriften für das Kind auf. Der islamkritische türkische Vater lässt sich von seiner Tochter zum Fasten überreden. Der Kampf der Kulturen - hier wird er zum drolligen Scharmützel der Generationen. \"Türkisch für Anfänger\" , dienstags bis freitags, 18.50 Uhr, ARD",http://www.spiegel.de/kultur/gesellschaft/deutsch-tuerkische-sitcom-wenn-der-mullah-wecker-klingelt-a-405857.html,2006-03-14T00:00:00.000Z
