article,article_url,date
"Libanon Der Schlächter von Schatila von Autobombe zerfetzt Lange war es ruhig in Beirut. Nun explodierte eine Autobombe. Sie tötete den christlichen Milizenführer Elie Hobeika, den Mann, der mit seinen Leuten die Massaker von Sabra und Schatila anrichtete. Er hatte angekündigt, in einem möglichen Kriegsverbrecher-Prozess gegen den israelischen Ministerpräsidenten Ariel Scharon auszusagen. REUTERS Bombenexplosion in Beirut: Vier Tote, sechs Verletzte Beirut - Der Anschlag ist der folgenschwerste im Libanon seit 1994: Mit dem ehemaligen Milizenführer wurden drei seiner Leibwächter bei der Explosion seines Fahrzeugs getötet. Sechs Personen wurden verletzt, die Fassade eines vierstöckigen Gebäudes beschädigt.  Der 45-jährige Hobeika führte im libanesischen Bürgerkrieg von 1975 bis 1990 die rechtsgerichtete Miliz Forces Libanaises (FL). Er wechselte die Fronten. Zunächst war er mit Israel, später mit Syrien verbündet. Hobeika wird zusammen mit dem israelischen Ministerpräsidenten Ariel Scharon für die Massaker in den palästinensischen Flüchtlingslagern Sabra und Schatila im September 1982 verantwortlich gemacht. Dort wurden nach offiziellen Angaben rund 800 Menschen getötet. Andere Quellen sprechen von weit mehr als tausend Toten.  DPA Hobeika: \"Ich habe Befehle ausgeführt\" Seine Truppen waren nach der Ermordung des gewählten libanesischen Staatspräsidenten Baschir Gemayel in Sabra und Schatila eingefallen. Für das Attentat auf Gemajel wurden Palästinenser verantwortlich gemacht. Die Tat, die unter den Augen der israelischen Armee verübt wurde, ist trotz eines israelischen parlamentarischen Untersuchungsausschusses nach wie vor nicht aufgeklärt.   Noch ist nicht bekannt, wer hinter dem Attentat auf Hobeika steckt. Vermutungen dürften jedoch schnell die Runde machen, seine Ermordung könnte mit einem anstehenden Menschenrechtsprozess des israelischen Ministerpräsidenten Scharon in Belgien zusammenhängen. So beschuldigte bereits der libanesische Vertriebenenminister Marwan Hamadeh die Israelis, sie hätten mit der Ermordung Hobeikas zu tun. Arnon Perlman, ein Vertrauter Scharons, reagierte auf die Beschuldigung sofort: \"Das ist Müll. Es ist eine totale Lüge.\" Ein Gericht in Brüssel wird am 6. März entscheiden, ob gegen Scharon wegen seiner Mitverantwortung an den Massakern von Sabra und Schatila Anklage wegen Kriegsverbrechen erhoben wird.  Hobeika hatte im vergangenen Juli seine Bereitschaft erklärt, in dem möglicherweise bevorstehenden belgischen Menschenrechtsprozess gegen Scharon auszusagen. Er selbst erklärte, dass er kein Kriegsverbrecher sei. 1993 sagte er in einem Interview: \"Ich denke, dass ich irgendwie mit meinen Taten im Krieg meine Zukunft verbrannt habe. Ich muss diese Last noch immer tragen, und ich habe viele schlimme Dinge getan.\" Zu Sabra und Schatila sagte er: \"Ich habe Befehle ausgeführt.\"   1992 und 1996 wurde Hobeika ins Parlament gewählt, 2000 scheiterte er. Für viele Maroniten galt er als möglicher Präsidentschaftskandidat. Einer seiner ehemaligen Leibwächter, Robert Marun Hatem, warf Hobeika vor zwei Jahren in einem Interview vor, in den achtziger Jahren zahlreiche Attentate angeordnet zu haben. Hatem zeichnete 1999 in einem Buch mit dem Titel \"Von Israel nach Damaskus\" Hobeikas Lebensweg nach.",http://www.spiegel.de/politik/ausland/libanon-der-schlaechter-von-schatila-von-autobombe-zerfetzt-a-178816.html,2002-01-24T00:00:00.000Z
"Bürgerkrieg in Liberia Rebellen verkünden Waffenruhe Die wichtigste liberianische Rebellengruppe hat am Freitag eine Waffenruhe ausgerufen. Nach Angaben des britischen Senders BBC sollten die Waffen seit Mittag schweigen.  AP Zivile Opfer in Monrovia London - Rebellenkommandeur Joe Wylie sagte der BBC jedoch einschränkend, dass seine Männer im Falle eines Angriffs der Truppen von Präsident Charles Taylor zurückschlagen würden. Wylie forderte die USA zu einem Eingreifen auf, damit die Kämpfe beendet werden können.  Zuvor tobten die blutigen Kämpfe um die liberianische Hauptstadt Monrovia auch den vierten Tag in Folge. Nach Schätzung von Bewohnern sollen die Kämpfe bereits mindestens 500 Menschen das Leben gekostet haben. Nahe des Hafens der Stadt schlugen mehrere Raketen ein, die Regierungstruppen von Präsident Charles Taylor zogen von Haus zu Haus und raubten Bewohner aus. Zuvor hatten aufgebrachte Demonstranten mit Nachdruck ein Eingreifen der USA gefordert.  Die Organisation Ärzte ohne Grenzen rief alle Sanitäter in Monrovia auf, sich für die Versorgung von mehreren Zehntausend Flüchtlingen im Fußballstadion der Stadt bereit zu halten, unter denen die Cholera ausgebrochen sei. Die Lebensmittel wurden immer knapper, da große Vorräte an Reis und Mehl im nicht mehr zugänglichen Hafen lagerten.  Wütende Demonstranten legten am Donnerstag vor der schwer bewachten US-Botschaft Leichen von Kindern nieder, die in einem amerikanischen Diplomatenviertel vergeblich Zuflucht gesucht hatten.  Das von den USA evakuierte Gelände war am Mittwoch von drei Raketen getroffen worden, dabei kamen nach Augenzeugenberichten 18 Menschen ums Leben.  US-Präsident George W. Bush hatte Taylor am Donnerstag überraschend zum Rücktritt aufgerufen. In seiner Rede vor einer afrikanisch-amerikanischen Handelsgruppe äußerte Bush sich jedoch nicht zu Forderungen nach einer US-Intervention, die zuvor auch Großbritannien erhoben hatte.  Der US-Präsident will im kommenden Monat nach Afrika reisen.  Die Rebellen in Liberia kämpfen seit drei Jahren gegen Taylor. Sie brachten in den vergangenen Wochen mindestens 60 Prozent des Landes unter ihre Kontrolle. Ein in der vergangenen Woche vereinbarter Waffenstillstand endete am Dienstag mit neuen Kämpfen.",http://www.spiegel.de/politik/ausland/buergerkrieg-in-liberia-rebellen-verkuenden-waffenruhe-a-254855.html,2003-06-27T00:00:00.000Z
"Militäroffensive im Gaza-Streifen Raketen auf Flüchtlinge Internationale Proteste verhallten unbeachtet. Mit Kampfhubschraubern und Panzern ist das israelische Militär in der Nacht gegen das Flüchtlingslager Rafah im Gaza-Streifen vorgegangen. Zweimal wurde das Lager unter Raketenbeschuss genommen. Mindestens 19 Palästinenser wurden getötet, mehr als 50 verletzt. AP Helfer kümmern sich um einen bei den Raketenangriffen verletzten Palästinenser Rafah/Gaza - Kurz vor der Dämmerung schlug eine Rakete in der Nähe einer Moschee im Viertel Tel Sultan ein, wo sich Gläubige zum Morgengebet versammelt hatten. Etwa zur gleichen Zeit stießen israelische Panzer und Kampfeinheiten in das Viertel vor, das sich nicht in Grenznähe befindet.  Ziel der Operation war es, Gebäude im Grenzbereich zu Ägypten zu zerstören. Israel will dort Hunderte von Häusern einebnen und damit die Pufferzone zu Ägypten ausweiten, nachdem dort in der vergangenen Woche fünf Soldaten bei einem Angriff getötet worden waren.  Die Soldaten begannen damit, einen Graben auszuheben und Tel Sultan vom Rest Rafahs abzuschneiden, wie Augenzeugen berichteten. Haus nach Haus werde durchkämmt. Mindestens 45 Militärfahrzeuge wurden in dem Viertel gezählt.  Wenige Minuten nach dem ersten Angriff begannen die Israelis damit, Gelände am Rande des 90.000 Bewohner zählenden Lagers nahe der ägyptischen Grenze einzuebnen. Israel will die Sicherheitszone rund um das Lager vergrößern, von dem aus immer wieder Soldaten angegriffen wurden.  Nach israelischen Angaben handelt es sich bei den Toten zumeist um palästinensische Kämpfer, die bei Hubschrauberangriffen starben. Etwa 50 Menschen wurden bei den beiden Raketenangriffen verletzt.  Nach Krankenhausangaben waren mindestens zwei der Toten bewaffnete Männer. Alle Verletzten seien aber Zivilisten, darunter sei auch eine 35 Jahre alte Frau, hieß es. Die israelische Militärführung erklärte, beide Angriffe hätten sich gegen bewaffnete Gruppen gerichtet.  Israelische Panzer und Truppen hatten das Lager gestern umstellt und es vom Rest des Gaza-Streifens abgeschnitten. Mehrere Tausend Palästinenser flohen bereits aus Furcht vor einem israelischen Großangriff aus dem rund 90.000 Bewohner zählenden Lager. Die israelischen Truppen sind nach Radiomeldungen bereit für einen Häuserkampf.  Amnesty fordert Stopp der Häuserzerstörung Die Israelis sind in den vergangenen Jahren bereits mehrmals in das Lager Rafah eingedrungen. Sie haben dabei vor allem nach Tunneln gesucht, in denen Palästinenser Waffen unter der ägyptischen Grenze hindurch in den Gaza-Streifen einschmuggeln sollen. Vergangene Woche hatten militante Palästinenser ein israelisches Panzerfahrzeug in der Nähe des Lagers in die Luft gesprengt und dabei fünf Soldaten getötet. Die israelische Regierung kündigte daraufhin an, sie werde die Sicherheitszone zu dem Lager vergrößern, indem sie Häuser niederreißen lasse.  Die arabischen Staaten verlangten unterdessen wegen der Zerstörungsaktionen der Israelis eine aktuelle Stunde des Weltsicherheitsrates. Über die Einberufung solle heute Nachmittag (Ortszeit) in New York entschieden werden.  Die Menschenrechtsorganisation Amnesty International hat Israel aufgefordert, die Zerstörung von palästinensischen Häusern zu stoppen. In dreieinhalb Jahren hätten die Streitkräfte mehr als 3000 Häuser sowie große landwirtschaftlich genutzte Gebiete zerstört, erklärte die Organisation heute unter Berufung auf Uno-Angaben. Zehntausende Männer, Frauen und Kinder verlören auf diese Weise ihr Zuhause oder ihre Lebensgrundlage.",http://www.spiegel.de/politik/ausland/militaeroffensive-im-gaza-streifen-raketen-auf-fluechtlinge-a-300281.html,2004-05-18T00:00:00.000Z
"Koalitionsstreit Schily teilt aus Bundesinnenminister Otto Schily hat seinen Vorschlag zur Errichtung von Auffanglagern für Flüchtlinge in Nordafrika verteidigt - und die Grünen in diesem Zusammenhang scharf kritisiert. Der kleinere Koalitionspartner würde sich \"gewaltig aufplustern\", sagte der Sozialdemokrat in einem Interview. AP Otto Schily TEXT/AUFMACHER (thumb) / Bundesinnenminister Otto Schily: Kritik an grüner Kritik Berlin - Es solle doch die Einsicht zu vermitteln sein, dass nicht jeder, der sich Schleuserbanden anvertraue oder in seeuntüchtigen Booten aufs Mittelmeer wage, \"damit automatisch einen Anspruch erwirbt, nach Europa zu kommen\", sagte Schily der \"Welt am Sonntag\". Die Vorstellung, man könne die Probleme von Krisenregionen in Afrika lösen, \"in dem wir die Menschen nach Europa holen, ist falsch.\"  Ungewöhnlich hart ging Schily auch Außenminister Joschka Fischer (Grüne) an, der ihm im ZDF vorgeworfen hatte, seinen Vorschlag nicht zu Ende gedacht zu haben: \"Das muss ich an die Adresse des Kollegen Fischer zurückgeben: Mir scheint, er hat nicht zu Ende gedacht\". Er, Schily, habe \"erwartet, dass er sich zunächst einmal mit mir in Verbindung setzt, bevor er sich öffentlich äußert\". Niemand rege sich darüber auf, dass es auf der italienischen Insel Lampedusa ein Aufnahmelager gebe. \"Warum soll dann ein Lager, wenn es beispielsweise in Tunesien wäre, so kritikwürdig sein? Da empört sich mancher, ohne sich mit den Einzelheiten zu beschäftigen.\"  Unterstützung für seinen Vorschlag hatte Schily von Rupert Neudeck bekommen, der sich für \"pragmatische Lösungen\" im Flüchtsdrama des Mittelmeers einsetzte und Schilys Vorschlag prinzipiell begrüßte. Der Innenminister wies nun darauf hin, dass Maßnahmen zum Schutz vor illegaler Einwanderung mit Hilfe für Afrika verknüpft werden müssten: \"Wichtig ist zudem die Entwicklungshilfe zur Verbesserung der Situation in den Herkunftsländern. Für die wirtschaftliche Stabilisierung Afrikas ist auch notwendig, dass Europa auf die Abschottung seiner Märkte verzichtet\", so Schily gegenüber der \"Welt am Sonntag\".",http://www.spiegel.de/politik/deutschland/koalitionsstreit-schily-teilt-aus-a-311169.html,2004-07-31T00:00:00.000Z
"Messer-Attentat Bestürzung über Mord an Frère Roger Vertreter der christlichen Kirchen haben mit Entsetzen auf die Ermordung von Frère Roger reagiert. Der Gründer der ökumenischen Taizé-Gemeinde war gestern Abend in Frankreich erstochen worden. Die Sicherheitsvorkehrungen auf dem Weltjugendtag in Köln werden dennoch nicht verstärkt. DPA Ermordeter evangelischer Geistlicher Bruder Roger: \"Fassungslose Bestürzung\" Köln - Sicherheitschef Winrich Granitzka sagte, die Situation in Köln sei mit der in Frankreich nicht zu vergleichen. Während Frère Roger stets inmitten der Gläubigen, für jeden gut erreichbar und in einem dunklen Raum gebetet habe, werde Papst Benedikt XVI. sich in Köln in abgesperrten Sicherheitsbereichen bewegen, zu denen nur wenige überprüfte Personen Zugang hätten. Außerdem werde der Papst von Personenschützern seiner Schweizer Garde und des Bundeskriminalamtes bewacht.  Auch das Programm des Weltjugendtages wird nach dem Mord voraussichtlich nicht geändert. Eine Sprecherin sagte, es könne jedoch sein, dass es in der Kölner Kirche St. Agnes, in der die von Frère Roger gegründete ökumenische Gemeinschaft von Taizé zu Gast ist, besondere Gottesdienste geben werde. Ob es größere Gedenkgottesdienste geben werde, sei noch unklar.  Angriff beim Abendgebet Der 90-jährige Frère Roger war gestern Abend beim Gebet in der ökumenischen Gemeinde im französischen Taizé von einer Frau niedergestochen worden und seinen Verletzungen kurz darauf erlegen. Auch zwei sofort herbeigeeilte Ärzte konnten den Geistlichen nicht mehr retten. Rogers Kehle sei durchschnitten worden, sagte Rogers Mitbruder und Augenzeuge Emile. 15 Minuten später sei Roger gestorben. Die französische Polizei teilte dagegen mit, Frère Roger sei sofort tot gewesen.  2500 Gläubige wurden Zeugen des Vorfalls. Einige der Kirchenbesucher konnten die Täterin überwältigen und bis zum Eintreffen der Polizei festhalten. Nach Angaben der französischen Polizei handelt es sich um eine 36-jährige Rumänin. Berichte, wonach die Täterin psychisch krank sein soll, wurden vom zuständigen Staatsanwalt in Frage gestellt. Die Frau sei jedenfalls \"nicht so gestört, dass eine Unterbringung in der Psychiatrie gerechtfertigt wäre\", sagte Staatsanwalt Jean-Louis Coste nach der Vernehmung der Frau. Das Motiv ist noch unklar.  Der Tod Rogers löste international Bestürzung aus. Weil sich Roger für die Versöhnung der Konfessionen stark gemacht und die erste ökumenische christliche Glaubensgemeinschaft gegründet hatte, genoss er weltweit hohes Ansehen.  Rogers Brief an den Papst AFP Trauernde am Tatort: Verehrung wie für einen Heiligen Er sei \"sehr traurig\", sagte Papst Benedikt XVI. während der Generalaudienz in seiner Sommerresidenz Castelgandolfo bei Rom. Gerade gestern habe er einen \"bewegenden\" Brief von Frère Roger erhalten, in dem dieser geschrieben habe, er sei mit ganzem Herzen mit dem Papst und allen Teilnehmern des Weltjugendtages in Köln. Er werde \"im Geiste\" in Köln anwesend sein, wohin er aus gesundheitlichen Gründen nicht werde fahren können, schrieb der Taizé-Gründer.   Der Vorsitzende der Deutschen Bischofskonferenz, Kardinal Karl Lehmann, zeigte sich \"tief bestürzt\". Die Bischofskonferenz verurteile \"diese unbegreifliche Tat auf das schärfste\", erklärte Lehmann in Bonn. Frère Roger habe ein Schicksal erlitten, \"das uns an das gewaltsame Geschick Jesu und anderer Zeugen für ein gewaltfreies Leben der Menschen\" wie Martin Luther King erinnere. Lehmann zeigte sich überzeugt, dass der Weltjugendtag in Köln in allen Gottesdiensten \"für unseren großen Freund und Pionier einer geistlichen Ökumene\" beten werde.  Der Vorsitzende des Rates der Evangelischen Kirche, Wolfgang Huber, reagierte mit \"fassungsloser Bestürzung und in persönlicher Betroffenheit\" auf die Nachricht des Mordes. Roger sei \"ein Mensch der Versöhnung, des Trostes und der Zuversicht aus dem Glauben\" gewesen. Er habe unzählige insbesondere junge Menschen geprägt und sie eine geistige Heimat finden lassen. Sein Tod in den Tagen des Weltjugendtages zeichne diese Verbindung auf tragische Weise nach.  \"Tiefe Erschütterung\" Der Erzbischof von Köln, Kardinal Joachim Meisner, schrieb in einem Kondolenzschreiben an die Gemeinschaft, er habe die Nachricht mit tiefer Erschütterung aufgenommen. Die zum Weltjugendtag versammelten Jugendlichen aus 193 Ländern würden des Verstorbenen im Gebet gedenken. Der Leiter des Kommissariats der deutschen Bischöfe, Prälat Karl Jüsten, sagte im ZDF, als Katholik sei es schwierig zu sagen, dass Roger ein Heiliger gewesen sei, aber vielleicht würden es die Evangelischen verstehen, wenn die Katholiken ihn als einen solchen verehrten. Jüsten sagte, die Taizé-Bewegung habe die katholische und die evangelische Kirche wie kaum eine andere geprägt. Eine solche Spiritualität sterbe nicht mit dem Tod eines Menschen.  AP Gläubige trauern in der Kölner St.-Agnes-Kirche um Frère Roger Auch Frankreichs Ministerpräsident Dominique de Villepin erklärte, er sei über die Bluttat tief betroffen. \"Frère Roger wird uns als prägende Figur unserer Religionsgeschichte in Erinnerung bleiben\", erklärte der Premierminister in Paris. Roger habe mit Taizé eine ökumenische Bewegung geschaffen, die Menschen in aller Welt begeistere. Die französische Regierung versichere der Gemeinschaft und allen ihren Anhängern ihre Solidarität und Anteilnahme \"während dieser Prüfung\", sagte Villepin.   Roger Louis Schutz-Marsauche wurde am 12. Mai 1915 als Sohn eines protestantischen Pfarrers in der Schweiz geboren, seine französische Mutter stammte aus Burgund. Er studierte Theologie in Lausanne und Straßburg und wurde als Pastor ordiniert. 1940 gründete er die ökumenische Gemeinschaft der Taizé-Brüder im ostfranzösischen Burgund. Während des Zweiten Weltkrieges nahm er dort auch zahlreiche Flüchtlinge und verfolgte Juden auf. Die Taizé-Bewegung ist vor allem bei jungen Christen aus aller Welt sehr beliebt. Ihr Anliegen ist es, die Spaltung der Christenheit zu überwinden. Der verstorbene Papst Johannes Paul II. besuchte Taizé 1986. Zu den jährlichen Jugendtreffen der Gemeinschaft in Europa strömen Zehntausende. Das ganze Jahr über kommen Jugendgruppen nach Taizé.  Nachfolger bereits eingetroffen Der Vorsitzende des Bundes der Deutschen Katholischen Jugend, Knuth Erbe, sagte im ZDF-\"Morgenmagazin\", der Geistliche sei eine der \"sehr prägenden Persönlichkeiten\" der Kirchen in den vergangenen Jahrzehnten gewesen. \"Ich glaube, dass er fast in einer Linie steht mit Papst Johannes Paul II. und Mutter Teresa\", sagte Erbe.  Inzwischen ist Rogers designierter Nachfolger in Taizé eingetroffen. Der in Deutschland geborene Frère Alois sei am Vormittag angekommen, teilte die Glaubensgemeinschaft mit. Er hatte zuvor am Weltjugendtag in Köln teilgenommen. Roger hatte Alois schon vor acht Jahren als Nachfolger bestimmt.  Der 51-jährige Alois wurde 1954 in Stuttgart geboren und nahm schon als Jugendlicher an Treffen der ökumenischen Begegnung teil. Vor 32 Jahren trat er der Bruderschaft bei, die zu einem mönchischen Leben verpflichtet. In den vergangenen Jahren organisierte er laut einem Taizé-Sprecher zahlreiche Jugendtreffen im Ausland, die mit als Anregung für den katholischen Weltjugendtag gelten. Nach dem Fall des Eisernen Vorhangs reiste er auch viel durch Osteuropa, um für die Idee einer die Glaubensrichtungen zusammenbringenden Bewegung zu werben. In der Gemeinschaft trägt Alois den Beinamen \"der Erzengel\".",http://www.spiegel.de/panorama/justiz/messer-attentat-bestuerzung-ueber-mord-an-frere-roger-a-370106.html,2005-08-17T00:00:00.000Z
"Mohrs Deutschlandgefühl Politik ohne Ballgefühl Jetzt gibt es nur noch zwei WM-Spiele. Ist Ihnen das, in der ganzen Tragweite und Bedeutungstiefe, wirklich klar? Am kommenden Sonntag, in drei Tagen also, ist alles vorbei. Höchste Zeit, über das merkwürdige Verhältnis zwischen Fußball und Politik zu sprechen. Von Reinhard Mohr Der Alltag kehrt zurück, und mit ihm die Politik. Trotz Sommerpause. Der Besuch von Horst Köhler und Angela Merkel in der deutschen Mannschaftskabine nach der Niederlage gegen Italien war schon ein böses Omen: \"Eine Annektion\" nennt es heute Frank Schirrmacher in der \"FAZ\", \"die Rückeroberung des Spielfeldes\" durch offensichtlich Unbefugte. In den achtziger und frühen neunziger Jahren war es ein Spaß und eine Wissenschaft zugleich gewesen, die politischen Zustände und das Spiel der Nationalmannschaft \"aufm Platz\" in Zusammenhang zu bringen. Kluge Bücher wurden darüber geschrieben, die man dennoch nicht todernst nehmen musste. Das berühmteste und historisch einleuchtendste Fallbeispiel war die grandios offensive Mannschaft mit Paul Breitner und Franz Beckenbauer, Günter Netzer und Gerd Müller, die 1972 in furioser Weise  vom Steil- zum Doppelpass ins Tor!  Europameister wurde. Und wer regierte damals? Eben, Willy Brandt, jener charismatische Sozialdemokrat, der versprach, \"mehr Demokratie zu wagen\" und frische Luft ins Land zu lassen. Seine Ost- und Entspannungspolitik gegenüber der Sowjetunion schlug eine historische Bresche in die damals völlig festgefahrenen Verhältnisse, Stichwort Kalter Krieg, Berliner Mauer, Blockkonfrontation. AP Kanzlerin Merkel mit Fußball: Welche Spielweise passt? Auch Brandts Vita als antifaschistischer Emigrant, polyglotter Weltbürger und Bonvivant, der den Frauen nicht abgeneigt war, trug zu einer gesellschaftlichen Aufbruchsstimmung bei. Von den kulturellen Ausläufern der 68er-Revolte nicht zu reden.  Auf dem Platz ließen derweil die Breitners, Netzers und Overaths ihre langen Mähnen fliegen, während die Stutzen schon mal heruntergekrempelt wurden. Freche Offensive war das Motto, leichtfüßig gings über die Flügel, und ab die Kirsche. Selbst die Hosen waren damals kürzer und saßen enger am Mann. Bereits unter dem eisernen Kanzler Helmut Schmidt wurde die Sache strenger und freudloser, weniger losgelöst vom taktischen Korsett. Doch erst mit dem Gespann Helmut Kohl/Jupp Derwall, der eine Kanzler, der andere Bundestrainer, begann der langsame Niedergang der achtziger Jahre. Zwar gab es immer wieder zählbare Erfolge mit Hilfe der berüchtigten \"deutschen Tugenden\", aber sie kamen meist mühevoll und wenig attraktiv zustande. Entgegen des Kohlschen Mottos von der \"geistig-moralischen Wende\" machte sich eine zähe Kleinmütigkeit breit, eine Mischung aus Ängstlichkeit und Behäbigkeit. Es war eine Art halbaufgeklärtes Spießertum, das Gesellschaft und Spielfeld wie mit Mehltau überzog, ein ewiges Ballgeschiebe in die Breite. Die Älteren werden sich noch an Uli Stielike & Co. erinnern. Sicherheitsfußball ohne Ideen, kein Drive und kein echtes Selbstbewusstsein. Schon gar kein \"Spirit\". Es war die Zeit, als die \"Generation Golf\" nach der samstäglichen Säuberungsaktion im Bademantel vor dem Fernseher saß und \"Wetten, dass...?\" mit Frank Elstner guckte. Diese eigenartig stillgestellte, bräsige Selbstzufriedenheit brach erst 1990 auf, nach dem Mauerfall und kurz vor der Wiedervereinigung. Der \"Wind of Change\" erfasste auch den Fußball, und am Abend des WM-Sieges in Rom verbrüderten sich für einen Augenblick Fußball, Politik und Geschichte im glücklichen Jubel der Massen. Es dauerte volle 16 Jahre, bis wieder eine ähnliche Stimmung aufkam  eben das, was wir alle, zu unserer eigenen Überraschung, in den letzten vier Wochen erlebt haben. Da ist allerdings ein kleiner Unterschied: Die Politik dazu stimmt nicht. Sie macht nicht mit. Und sie kommt nicht nach. Wir merken das erst jetzt so richtig, nach dem Ende der großen Party. Die völlig vermurkste Gesundheitsreform ist nur ein Menetekel. Plötzlich wird auch den Merkel-Fans von gerade eben klar, dass ihre Rede vom konsequent reformorientierten \"Durchregieren\" Schall und Rauch ist. Die Große Koalition ähnelt der deutschen Mannschaft vom vergangenen März, als sie gegen Italien 1:4 verlor und dabei ebenso hilf- wie mutlos wirkte  ganz anders als vorgestern. Aber mal ehrlich: Welche Spielweise würde schon zu Ronald Pofalla passen? Oder zu Volker Kauder? Oder zu Kurt Beck, der sich gerade durch eine einstweilige Verfügung gegen das Satire-Magazin \"Titanic\" hervortut, auf deren Titel er, zugegeben, etwas unvorteilhaft abgebildet war  Unterzeile: \"Problembär außer Rand und Band: Knallt die Bestie ab\"? Kurz: Wenn man unseren Klinsimeter an diese Regierung anlegen würde, könnte man beim freien Fall zuschauen. Deshalb lassen wir das und genießen noch drei Tage lang die ganz andere Welt, jene Welt, in der kein \"Durchbruch\" gefeiert wird, wo nur ein schmählicher Rückpass kullert. Es gibt nur ein' Klinsimeter! Bis morgen.",http://www.spiegel.de/kultur/gesellschaft/mohrs-deutschlandgefuehl-politik-ohne-ballgefuehl-a-425343.html,2006-07-06T00:00:00.000Z
