article,article_url,date
"Schüler-Gewalt Union fordert harte Gangart In der Schuldebatte formiert sich die Law-and-order-Fraktion und fordert Härte gegen gewalttätige Jugendliche ausländischer Herkunft - ab ins Internat, in den Jugendarrest, in Abschiebehaft. Schulleiter setzen auf Pädagogik mit strengen Regeln. Der dramatische Brandbrief der Lehrerschaft von der Rütli-Hauptschule hat ein Gutes: Die Lehranstalt im Berliner Problemkiez Neukölln bekommt einen neuen Schulleiter. Kommissarisch übernimmt Helmut Hochschild, Direktor der Paul-Löbe-Schule in Reinickendorf, die Stelle. Der Polizeischutz vom Freitag blieb eine Sonderaktion; die sechs Beamten, die sich am Freitag vor der Schule postiert hatten, wurden wieder abgezogen. Es werde \"keine Dauerpräsenz\" der Polizei geben, teilte ein Sprecher mit. Für die Rütli-Lehrer herrscht seit Tagen Redeverbot. Heute meldete sich die langjährige Rektorin Brigitte Pick zu Wort. Das wahre Problem sei nicht die ethnische, sondern die soziale Herkunft der Schüler. Die Hauptschule werde \"nur von marginalisierten Gruppen gewählt - ohne jede Perspektive\", schrieb sie in einem Leserbrief an den Berliner \"Tagesspiegel\": \"Hier leistet sich eine Gesellschaft noch immer ein Schulsystem aus dem Kaiserreich und scheint einer anderen Einsicht nicht zugänglich.\" Pick, seit neun Monaten krank, geht bald in den Ruhestand. Dass die Rütli-Schule kein Einzelfall ist, zeigen weitere Hilferufe. So entwarfen Lehrer der Theodor-Plivier-Oberschule ein ähnlich drastisches Schreiben, wie der SPIEGEL in seiner Titelgeschichte zur \"Gewalt im Klassenzimmer\" berichtet. Der Ausländeranteil von 92,6 Prozent führe den Integrationsbegriff geradezu \"ad absurdum\", so die Lehrer der Schule in Berlin-Wedding. Es entwickele sich eine \"annäherungsweise anarchische Situation\". Die Quote polizeibekannter Kleinkrimineller sei \"erschreckend hoch, gewaltbereite Intensivtäter mit erheblichem Einfluss\" säßen \"kurze Zeit nach ihrer Verurteilung\" schon wieder im Unterricht\". Berlins Bildungssenator Klaus Böger (SPD) hatte den Einsatz von je zwei Sozialpädagogen und Schulpsychologen an der Rütli-Schule angekündigt. Nur mit Sozialarbeitern und neuen Lehrern könne man die Krise der Hauptschulen indes nicht lösen, meint Jens Großpietsch, Rektor der Heinrich-von-Stephan-Schule, die als Modellfall gilt: Im Problemviertel Moabit zog sie sich selbst aus dem Sumpf und hat für die Schüler strenge Regeln beschlossen, die sie \"konsequent nach außen vertritt\", wie Großpietsch SPIEGEL ONLINE sagte. \"Unterricht auf den Fidschi-Inseln ist einfacher\" In einem \"taz\"-Interview plädierte Großpietsch dafür, die Schülerschaft anders zu mischen, etwa durch Zusammenlegen der Schulformen. Die Alternative sei, die Jugendlichen aufzugeben: \"Dann braucht man Sicherheitskräfte mit Schusswesten, die diese Kids nur noch bewachen.\" Nach Auffassung von Großpietsch sind nicht alle Lehrer geeignet, Regeln durchzusetzen. \"Es ist einfacher, auf den Fidschi-Inseln zu unterrichten, als hier mit Hauptschülern\", sagte Großpietsch. \"Die Lehrer, die oft aus mittelständischen, bildungsnahen Verhältnissen kommen, verstehen die überhaupt nicht.\" An seiner Haupt- und Realschule gebe es ein Mosaik aus pädagogischen Instrumenten, \"dessen Kitt eine positive Grundhaltung\" zu den Schülern sei. Briefentwurf der Plivier-Schule Die Exzesse an Berliner Schulen haben eine hitzige Debatte über die Integration von Zuwandererkindern und den Umgang mit Gewalttätern ausgelöst. Dabei formiert sich bei der Union die Law-and-Order-Fraktion: Hessens Kultusministerin Karin Wolff (CDU) hat ausländischen Schülern, die sich nicht integrieren ließen, \"im Extremfall\" die Ausweisung angedroht. Das forderte auch Bayerns Ministerpräsident Edmund Stoiber (CSU); im ersten Schritt sei die Kürzung von Sozialleistungen für die Familien möglich.  Plivier-Schule, zweite Seite Am Dienstag will das bayerische Kabinett eine Verschärfung der Vorschriften für den Schulbesuch beschließen. \"Bei uns gilt ab September: Kinder, die nicht Deutsch können, werden nicht mehr in eine deutsche Regelschule eingeschult. Sie müssen dann zuerst einmal in spezielle Förderklassen\", sagte Stoiber. Stoibers Forderung nach Ausweisung integrationsunwilliger Ausländer nannte Sabine Leutheusser-Schnarrenberger \"populistisch und in ihrer Schlichtheit skandalös\". Die stellvertretende FDP-Fraktionsvorsitzende im Bundestag forderte \"endlich eine rationale Integrationsdebatte\", ein kostenfreies letztes Kindergartenjahr als Pflicht für alle Kinder, begleitende Sprachtests während der gesamten Schullaufbahn und verpflichtende Sprachangebote. Wie Stoiber sprach sich auch Brandenburgs Innenminister Jörg Schönbohm (CDU) für eine harte Gangart aus: \"Wir sollten darüber nachdenken, kriminelle Schüler von der Schule zu verweisen und sie dann für ein paar Tage in einem Erziehungsheim oder auch in einem Jugendgefängnis unter Arrest zu stellen.\" Der Anteil ausländischer Schüler dürfe nicht über 50 Prozent liegen. Schüler-Verschickung als Lösung? Bundesbildungsministerin Annette Schavan (CDU) denkt in besonders schwierigen Fällen daran, \"Internatsplätze zu schaffen, in denen die Erfahrung aus Schulpädagogik, Sozialpädagogik und beruflicher Ausbildung zusammenwirken\". Zugleich sollten auch Eltern stärker in die Pflicht genommen und zu Gesprächen mit den Lehrern ihrer Kinder gezwungen werden, sagte Schavan der \"Financial Times Deutschland\". Schwierige Schüler per Bus auf andere Schulen der Stadt zu verteilen, lehnte Berlins Regierender Bürgermeister Klaus Wowereit (SPD) ab. \"Wir werden im Gegenteil damit zurechtkommen müssen, dass es in manchen Schulen 80, 90 oder auch 100 Prozent Migrantenkinder gibt\", sagte Wowereit der \"Berliner Zeitung\". Die Hauptschulen bräuchten nicht mehr Geld oder mehr Lehrer, sondern Konzepte und ein neues Verständnis von Schule. Einen derartigen \"Schüler-Zwangstourismus\", der in Deutschland schon mehrfach diskutiert wurde, haben sozialdemokratische Kommunalpolitiker in Kopenhagen auf eigene Faust erprobt - zeitweise gesetzwidrig. Sie verteilten Zuwandererkinder mit schlechten Sprachkenntnissen zwangsweise in der Trabantenstadt Albertslund so auf Schulen, dass ihr Anteil nirgendwo ein Drittel überstieg. Dieses Modell wurde zunächst massiv als ausländerfeindliche Einschränkung des Rechts auf freie Schulwahl kritisiert. Inzwischen möchte aber Kopenhagens Bürgermeisterin Ritt Bjerregaard es in der ganzen dänischen Hauptstadt einführen. Es gehe nicht an, dass die 15 Schulen mit dem höchsten Anteil an Schülern aus Zuwandererfamilien nicht über das durchschnittliche Abgangsniveau in Brasilien hinauskämen, während betuchtere Dänen ihre Kinder in \"Weltmeisterschulen\" und zunehmend auch in Privatschulen ausbilden ließen\", argumentierte Bjerregaard. Anders als in Deutschland mit seinem traditionell dreigliedrigen Schulsystem ist in Dänemark die Gesamtschule von der ersten bis zur neunten Klasse obligatorisch, was dort auch niemand in Frage stellt. jol/dpa/AP/ddp",http://www.spiegel.de/lebenundlernen/schule/schueler-gewalt-union-fordert-harte-gangart-a-409542.html,2006-04-03T00:00:00.000Z
"Rückholaktion aus dem Libanon Hisbollah-Mitglieder nach Deutschland eingesickert Zahlreiche Mitglieder der radikal-islamischen Hisbollah haben die humanitäre Rückholaktion während des Libanon-Krieges ausgenutzt und sind in Deutschland eingesickert. Es handle sich dabei nicht nur um Einzelfälle, berichtet die \"Frankfurter Allgemeine Sonntagszeitung\". Berlin - Nach Informationen der Zeitung sind bei der Rückholaktion deutscher Staatsbürger aus dem Libanon eine ganze Reihe Nichtdeutscher in die Bundesrepublik eingereist, darunter auch Mitglieder der schiitischen Hisbollah. Eine eingehende Prüfung sei bei der sehr kurzfristig organisierten umfangreichen Rückholung Deutscher aus dem Kriegsgebiet nicht möglich gewesen. Bei der Aktion seien insgesamt 6200 Personen aus dem Libanon nach Deutschland gekommen. DDP Hisbollah-Demonstration in Berlin: \"Da wollten wir nicht kleinlich sein\" Innenminister Wolfgang Schäuble (CDU) erklärte gegenüber der \"Frankfurter Allgemeinen Sonntagszeitung\", die Bundesregierung habe in dieser Situation abwägen müssen. \"Natürlich muss man den Staatsbürgern helfen aus dem Krieg herauszukommen. Da kommt der eine oder andere mit, dem wir bei der Einreise Passersatzpapiere ausgestellt haben\", sagte Schäuble. Man habe nicht kleinlich sein wollen. Die Sicherheitsbehörden gehen laut Schäuble nicht davon aus, dass die Hisbollah in Deutschland Anschläge plant. \"Aber die Hisbollah soll hier auch keine Spenden sammeln\", erklärte Schäuble. Die Hisbollah hat in Deutschland rund 900 erfasste Mitglieder. Schäuble verwies darauf, dass auch deutsche Staatsbürger Mitglieder der Hisbollah sein könnten - deren Einreise könne nicht verhindert werden. Schon vor der Rückholaktion hatte in Schäubles Ministerium und in den Sicherheitsbehörden die Sorge bestanden, dass Mitglieder der radikal-islamischen Hisbollah die Möglichkeit nutzen würden, um nach Deutschland zu gelangen. In einem SPIEGEL - Interview hatte Schäuble Ende Juli erklärt, dass man ein Auge auf die Rückkehrer aus dem Libanon haben müsse. Der Innenminister hatte es abgelehnt, Flüchtlingen aus dem Libanon vorübergehend Asyl in Deutschland zu gewähren - er befürchtete der Hisbollah damit Tore zu öffnen. Grünen-Chefin Claudia Roth warf Schäuble daraufhin \"geistige Kälte\" vor. anr",http://www.spiegel.de/politik/deutschland/rueckholaktion-aus-dem-libanon-hisbollah-mitglieder-nach-deutschland-eingesickert-a-433755.html,2006-08-27T00:00:00.000Z
"Libanon Erneute Kämpfe in Flüchtlingslager Die Kämpfe zwischen islamischen Extremisten und libanesischen Soldaten um das palästinensische Flüchtlingslager Nahr al-Bared haben wieder an Schärfe gewonnen. In der Nacht zu Freitag hatte der libanesische Verteidigungsminister sie für beendet erklärt. Nahr al-Bared - Seit dem Nachmittag beschossen Kampfhubschrauber die Kämpfer der Gruppe Fatah al-Islam, die sich in dem Lager verschanzt haben. Die Extremisten antworteten mit Gewehrfeuer. Der libanesische Verteidigungsminister hatte die seit mehr als einem Monat andauernden Kämpfe gerade für beendet erklärt. Bei den schwersten inner-libanesischen Auseinandersetzungen seit dem Bürgerkrieg von 1975 bis 1990 wurden bislang 172 Menschen getötet. Viele der ursprünglich 40.000 Bewohner sind aus dem Lager geflohen. Die Armee darf auf Grund einer Vereinbarung zwischen den arabischen Staaten und dem Libanon aus dem Jahr 1969 das Palästinenser-Lager nicht betreten. esp/Reuters",http://www.spiegel.de/politik/ausland/libanon-erneute-kaempfe-in-fluechtlingslager-a-490266.html,2007-06-23T00:00:00.000Z
"Deutsche Uni-Asylanten Österreich darf Uni-Zugang weiter beschränken Gegen Studienbewerber aus Deutschland kann sich Österreich auch künftig abschotten und drei Viertel der Medizin-Studienplätze für Einheimische reservieren. Die EU-Kommission spielt für fünf Jahre mit. Begründung: Dem Land drohe ein Mangel an Fachkräften. AP Medizin-Bewerber (in Wien): Vorfahrt für Österreicher Nur für Stammbürger: Österreich hat jetzt die offizielle Erlaubnis, weiterhin 75 Prozent seiner Medizinstudienplätze für Einheimische zu reservieren. Die Quotenregelung bleibt unbeanstandet, die EU-Kommission hat ein Vertragsverletzungs-Verfahren für die nächsten fünf Jahre ausgesetzt. Die Regierung in Wien hatte die Quotierung in Human- und Zahnmedizin damit begründet, dass sonst ein Großteil der teuren Medizin-Studienplätze in Österreich von Deutschen belegt würde, die in der Bundesrepublik am Numerus clausus scheiterten. Die deutsche Bundesregierung zeigte Verständnis. Dennoch hatte die EU-Kommission das Verfahren gegen Österreich gestartet, nun aber wieder gestoppt. In den nächsten fünf Jahren soll die österreichische Regierung neue Daten über die Lage an ihren Medizin-Fakultäten sammeln - und versuchen, die EU-Kommission davon zu überzeugen, dass 75 Prozent der Studienplätze für Österreicher freigehalten werden müssen. 20 Prozent bekommen andere EU-Bürger, fünf Prozent gehen an Nicht-EU-Bürger. Die EU-Kommission hielt das System für eine Einschränkung der Freizügigkeit, lenkte jedoch schon vor dem EU-Gipfel im Oktober ein - um des lieben Friedens willen: Österreich hatte mit einem Veto gegen den neuen EU-Reformvertrag gedroht. Daraufhin sicherte die EU-Kommission Wien die Aussetzung des Verfahrens zu, damit eine langfristige Lösung gesucht werden konnte. Inzwischen habe Österreich hinreichende Belege dafür geliefert, dass es ohne die nationalen Quoten zu Engpässen bei Fachkräften für das Gesundheitswesen kommen könne, hieß es zur Begründung. Daher bekomme es fünf Jahre Zeit. Auch Belgien darf an seinen Zugangsbeschränkungen für Studienplatz-Bewerber aus anderen EU-Ländern vorerst festhalten, wie die Kommission mitteilte. Das Land sieht sich in einer ähnlichen Lage wie Österreich: Die belgische Regierung hat 70 Prozent der Studienplätze an ihren Medizin-Fakultäten für Einheimische reserviert, weil seit Jahren zahlreiche Franzosen an die belgischen Unis drängen. kat/AP",http://www.spiegel.de/lebenundlernen/uni/deutsche-uni-asylanten-oesterreich-darf-uni-zugang-weiter-beschraenken-a-520254.html,2007-11-29T00:00:00.000Z
"Essay Vorreiter der Moderne Warum sind die Vereinigten Staaten vielen Menschen so suspekt? Von Dan Diner Im Anfang war alle Welt Amerika. Diese kategorische Aussage über die Bedeutung des neuen Kontinents traf John Locke in seinem 1690 erschienenen Werk \"Zwei Abhandlungen über die Regierung\". Adam Smith, der Begründer der modernen politischen Ökonomie, glaubte 1778, während der Amerikanischen Revolution, in der Entdeckung des neuen Kontinents einen der folgenreichsten Einschnitte der Menschheitsgeschichte zu erkennen. Von da an galt es, die Welt neu zu interpretieren. Um die Mitte des vergangenen Jahrhunderts diagnostizierte Hannah Arendt in ihrem Buch \"Über die Revolution\", mit der Gründung der Vereinigten Staaten sei die Geburt der Freiheit erfolgt. Dabei pries sie die Vorzüge der Amerikanischen Revolution - im Unterschied zur nachfolgenden Französischen Revolution. Ersterer sei es gelungen, politische Institutionen auf Dauer zu etablieren. Letztere sei hingegen von der ungelösten sozialen Frage in die Abgründe des Terrors gerissen worden. Die Vereinigten Staaten von Amerika sind ein paradoxes Produkt der Aufklärung. Paradox insofern, als sie als Inkarnation der Neuen Welt zugleich das älteste Gemeinwesen der Moderne sind. In ihnen bildeten sich die universellen, dem Prinzip der Freiheit und der Gleichheit verpflichteten Institutionen zuerst aus. Und von Amerika aus traten sie ihren Siegeszug an. Das mochte John Locke gemeint haben, als er davon sprach, im Anfang sei alle Welt Amerika. Demokratische Institutionen sind in der Tat das Herzstück der Vereinigten Staaten von Amerika. Während sich in der Alten Welt Völker und Nationen in langwierigen Kämpfen ihrer Anciens Régimes zu entledigen hatten, erfanden in der Neuen Welt die im Prinzip der Freiheit verankerten demokratischen und republikanischen Institutionen das amerikanische Volk. Ihm konnte sich jeder anschließen. Von den Zugehörigkeiten der alten Welten her gesehen, handelt es sich bei Amerika um die Heimat von Fremden - um ein Land vormals Verfolgter oder vor dem Elend und dem Hunger Entronnener. Und es bleibt ein solches Land, auch wenn seine Bewohner in der Neuen Welt zu Wohlstand, gar zu Reichtum gelangt sind. Denn Amerika als Land von Einwanderern ist recht eigentlich ein Land der zweiten Wahl. Niemand verlässt grundlos seinen angestammten Ort, um in die Fremde zu ziehen. Dass Amerika über lange Zeit das ersehnte \"Asyl Europas\" gewesen war, macht den traurigen Umstand nicht ungeschehen, dass es zugleich, so der Historiker Manfred Henningsen, die \"Schlachtbank für Indianer\" und ein \"Gefängnis Afrikas\" gewesen ist. Was die Fremden zu Amerikanern macht, ist ihr Verfassungspatriotismus. Er ist zentrales Merkmal der Zugehörigkeit zum amerikanischen Volk. Bekenntnisse und Rituale zur Regulierung des Zusammenlebens in der Gegenwart sind wichtiger als alle Erinnerungen an die Vergangenheit. Dieser Verfassungspatriotismus und die Neutralisierung von Herkunft zugunsten von Zukunft bewirken, dass sich das Land ständig neu erfindet. Darauf spielte der demokratische Präsidentschaftskandidat Barack Obama im März in seiner Rede in Philadelphia an. 1787 tagte hier der Verfassungskonvent und versprach die Gleichheit aller. Das Versprechen blieb lange unerfüllt. Vor allem das Kainsmal der Sklaverei strafte das Freiheitspathos Amerikas Lügen. Aber Generationen von Amerikanern, so Obama, hätten dazu beigetragen, die Diskrepanz zwischen Verheißung und Lebenswirklichkeit zu schließen. In seiner, Obamas, Biografie verwirkliche sich die Idee Amerikas. Obama erzählte die Geschichten seiner Eltern und Großeltern als integrale Bestandteile des amerikanischen Narrativ. Der Vater afrikanischer Emigrant; der weiße Großvater mütterlicherseits marschiert in der Armee des Haudegens General Patton im Zweiten Weltkrieg in Deutschland ein, um das Regime der Nationalsozialisten zu stürzen. Die Großmutter steht am Fließband, um Bomber für den strategischen Luftkrieg zu montieren. Obamas Ehefrau ist Abkömmling von Sklaven und Sklavenhaltern. Er selbst habe Brüder, Schwestern, Nichten, Neffen, Onkel und Vettern \"jeglicher Rasse und jeglicher Hautfärbung\" über drei Kontinente verstreut - eine Lebensgeschichte also, die in keinem Land der Erde möglich sei, außer eben in Amerika. E pluribus unum - aus vielen eins, nicht von ungefähr ist dieses Motto auf dem amerikanischen Wappen und vielen Münzen zu finden. Die Vereinigten Staaten sind das Land sichtbarer Vielheit in der Einheit der Republik. Da ist zuerst die Akzeptanz der religiösen Vielfalt, später auch die der ethnischen und kulturellen Mannigfaltigkeit. Seinen Ursprung hat das Prinzip der Vielheit in der englischen Tradition des konfessionellen Pluralismus. Seine Träger waren die protestantischen Sekten, die es schon früh über den Atlantik trieb. Ein solcher Pluralismus relativiert jeden Absolutheitsanspruch von Religion. Als Konfession, als internalisierter Glaube, wird jede Religion zu einer neben anderen. Die Verwandlung von Religion in ein Bekenntnis unter vielen trug beispielsweise dazu bei, dass in Amerika das Reformjudentum zur bedeutendsten jüdischen Glaubensrichtung aufstieg. Oder dass dort mehr als irgendwo sonst auf der Welt sich der Islam zunehmend in Konfession verwandelt. Auch der Katholizismus ist in den Vereinigten Staaten eine mehr oder weniger \"protestantische\" Konfession. 1 | 2 | 3 weiter 1. Teil: Vorreiter der Moderne 2. Teil: Bürgerliche Gesellschaft ohne Staat 3. Teil: Kreuzzug für die Freiheit",http://www.spiegel.de/spiegelgeschichte/a-585317.html,2008-11-02T00:00:00.000Z
"Vertretungsstunde Bushido ruiniert sein Image Für diesen Auftritt musste er früh aufstehen: Das Jugendmagazin \"Spiesser\" schickte Bushido als Vertretungslehrer zu Berliner Realschülern. Mit Klasse 10a sprach der Rapper über die Hauptstadt, Hertha BSC, Ost und West - und outete sich als Kriegsdienstverweigerer und Streichelzoobesucher. 8 Uhr. Lehrer Bushido schlendert unter den erwartungsvollen Blicken der Schüler zum Lehrertisch. Bushido : Morgen. Klasse (im Chor): Guten Morgen. Bushido : Unglaublich. Und ich war jetzt seit 14 Jahren nicht mehr in der Schule... Na, euer Pech. Also: Wer hält das erste Referat? 8.02 Uhr. Wie, was jetzt, kein Warm-up, Mann? Auf den Bänken hängen Schlafes Kinder, kann der Typ nicht erst mal Stimmung machen? Immerhin: Zwei melden sich. Nima verpennt seinen Einsatz und muss zur Strafe sofort über Berliner Wirtschaft referieren. Nima: Die aktuelle Lage: Das Bruttoinlandsprodukt von Berlin liegt bei 80,3 Milliarden. Und 80 Prozent aller Beschäftigten sind im Dienstleistungssektor. Das heißt, die meisten hier arbeiten da, wo sie anderen behilflich sind. Also beim Frisör oder so. 8.10 Uhr. Sonst ist bei Bushido-Auftritten mehr Stimmung. Chefkollege Aushilfslehrer greift ein. Bushido : Berlin is' ja so 'ne In-Stadt geworden. Die Wirtschaft freut das vielleicht. Aber ich konnte als Kriegsdienstverweigerer keine Zivi-Stelle finden, weil unsere werten Mitbürger aus Ostdeutschland so sehr nach Berlin gezogen sind, dass sie alle Stellen weggenommen haben. 8.20 Uhr. Was denn, unser Bushido ist Kriegsdienstverweigerer? Die Klasse raunt. So viel Friedfertigkeit verlangt nach dem nächsten Referat: Issy über Jugendkriminalität. Issy : Es gibt so 'ne Regel, die lautet: Je jünger, desto kleiner das Delikt. Das heißt, mit zehn Jahren so fängt man an mit Diebstahl. Freudestrahlende Gesichter in der Klasse. Issy schleppt sich zum Finale. Issy : Tja, man merkt halt, dass die meisten Straftäter Ausländer sind. Bushido : Ausländer, das ist doch nicht richtig. Das sind Jugendliche mit einem Migrantenhintergrund. Ich bin zum Beispiel auf den ersten Blick Ausländer, ich hab aber den deutschen Pass. Würde bedeuten: Begehe ich eine Straftat, bin ich im ersten Augenblick krimineller Ausländer, für die Quote aber ein krimineller Deutscher. 8.17 Uhr. Bushido, aufgewachsen in Berlin- Tempelhof, dem Westen der Stadt, startet eine Fragerunde. Da meldet sich - klar - wieder Issy. Issy : Hast du was gegen Ostberlin? Bushido : Nein, auf keinen Fall. Wenn ich Ostberlin sage, dann ist das nichts Diskriminierendes. Aber für mich gibts Ost- und Westberlin noch, weißte? 1989 war ich elf Jahre. Meine Mutter hat am Kottbusser geputzt, und mir gab sie dann 50 Pfennig. Damit bin ich Richtung Mauer gelaufen. Direkt an der Mauer, wo die Punker ihre Wohnwagen hatten, betrieben die auch so eine Art Streichelzoo. 8.32 Uhr. Bushido ruiniert sein Image: Kriegsdienstverweigerer, Zivi, Tierstreichler. Yasmin : Bist du auch öfter bei Hertha zum Fußballspiel? Bushido : Ich muss dir ganz ehrlich sagen, dass ich sehr enttäuscht bin von Hertha. Ich wäre gerne stolz auf sie. Ich bin Berliner, und Hertha gehört zu Berlin. Aber wir sind Letzter, Mann. Naja, vielleicht kommt ja dann bald Union... Die Klasse schäumt: Moment mal, Bushido! UNION? Der Club mit dem rechten Ruf? Sollen wir dir mal das Image polieren? Markus : Union, das sind doch alles Rechte. Bushido : Das kannste doch so gar nicht sagen, Mann. Markus : Doch, ist so. Bushido : Das ist, als würdest du sagen: Bei Turkiyemspor sind nur Kanaken. Beide Vorurteile kannste dir eigentlich in die Haare schmieren. 8.47 Uhr. Na gut, was soll der Streit, denkt sich die Klasse. Die Stunde ist vorbei, die Schüler sind traurig, Bushido packt die Sachen - da fällt der Schulleiterin ein... Direktorin : Wir haben noch eine Stunde Zeit, Sie können gern noch... Nils : Du sagtest doch, du kannst deine Arbeitszeit frei bestimmen, dann kannst du doch gleich noch eine Stunde Musik bei uns unterrichten. Bushido : Da müsstest du jetzt halt einfach mal 'ne Petition starten. Sammle Unterschriften an deiner Schule, so von wegen: Wir wollen Bushido als neuen Musiklehrer haben! Wenn du dir den Arsch aufreißt, rumgehst und den Leuten sagst, gebt mir mal Unterschriften... Das ist das Gute an unserer Demokratie, dass so was möglich wird. 9.30 Uhr. Bushido ist ein lupenreiner Demokrat und muss jetzt erst mal in die Firma: Geld verdienen. Gute Stunde, danke! Von Nele Fischer, 21, für die Jugendzeitschrift \"Spiesser\".",http://www.spiegel.de/lebenundlernen/schule/vertretungsstunde-bushido-ruiniert-sein-image-a-678541.html,2010-02-22T00:00:00.000Z
