article,article_url,date
"Israel als \"jüdischer Staat\" Regierung verlangt Treueschwur von Immigranten Künftig soll jeder nicht-jüdische Neubürger einen Treueschwur auf den \"jüdischen und demokratischen Staat Israel\" leisten. Das erzürnt die arabische Welt - Israel befinde sich auf dem Weg \"vom rassistischen zum faschistischen Staat\". Viele Araber in dem Land fühlen sich diskriminiert. Beirut/Abu Dhabi - Der von Israels Regierung geforderte Treueschwur auf den \"jüdischen Staat\" ist bei den Arabern auf massive Kritik gestoßen. \"Israel wird von einem rassistischen zu einem faschistischen Staat\", schrieb die libanesische Zeitung \"Al-Safir\" am Montag. Die Zeitung \"Khaleej Times\" aus Abu Dhabi erklärte, durch das geplante Gesetz wolle man die Palästinenser zwingen, \"alle ihre Rechte auf das Land aufzugeben, das seit Tausenden von Jahren ihre Heimat ist\". Ein Kommentator der jordanischen Zeitung \"Al-Dustur\" schlug vor, die Regierung solle den Namen des Landes ändern in \"Jüdische Republik Israel\". Auch Kritiker in Israel hatten den Vorstoß als rassistisch verurteilt. Die israelische Regierung hatte am Sonntag eine Gesetzesänderung beschlossen, wonach künftig jeder nicht-jüdische Neubürger einen Treueschwur auf den \"jüdischen und demokratischen Staat Israel\" leisten muss. Im Kabinett von Premierminister Benjamin Netanjahu war der Vorschlag umstritten. Die Regierungsmitglieder billigten ihn schließlich mit 22 zu 8 Stimmen. Das Gesetz muss noch vom Parlament verabschiedet werden. Die in Israel lebenden Araber fühlen sich durch die Regelung diskriminiert, weil sie auch Nicht-Juden einen Treueschwur abverlangt. Die israelische Zeitung \"Jerusalem Post\" hatte am Sonntag geschrieben, die Gesetzesänderung dürfte vor allem Palästinenser aus den besetzten Gebieten betreffen, die israelische Araber heiraten und dann die israelische Staatsbürgerschaft beantragen. Israelische Araber, die bereits in dem Land leben, sollten von der Regelung nicht betroffen sein. Etwa 20 Prozent der 7,6 Millionen israelischen Staatsbürger sind Araber.",http://www.spiegel.de/politik/ausland/israel-als-juedischer-staat-regierung-verlangt-treueschwur-von-immigranten-a-722444.html,2010-10-11T00:00:00.000Z
"AUS DEM SPIEGEL Ausgabe 8/2011 Städte Das Leben einer Toten Venedig, der romantischste Ort der Welt, ist in Gefahr. Die Erderwärmung könnte die Stadt im Mittelmeer untergehen lassen, die Einheimischen fliehen vor Touristen und Migranten. Venedig zeigt in extremer Form, unter welchen Bedingungen Menschen in Zukunft leben. Von Fiona Ehlers Fiona Ehlers Jahrgang 1970, studierte in Berkeley, Bayern und Italien, lernte ihr Handwerk auf der Henri-Nannen-Schule und ist seit 2000 beim SPIEGEL. Sie berichtet unter anderem aus Krisen- und Kriegsgebieten wie dem Irak, Iran, Afghanistan, dem Jemen, Burma und aus Afrika und war vier Jahre lang Italien-Korrespondentin für den SPIEGEL in Rom. Zurzeit arbeitet sie für das Ressort Gesellschaft im Berliner Hauptstadtbüro. E-Mail: fiona.ehlers@spiegel.de Mehr Artikel von Fiona Ehlers Sie legen ab beim alten Fischmarkt. Sie räkeln sich in Gondeln, auf samtschwarzen Bänken, verkleidet als Mickymaus, Meerjungfrau und Pirat. Eine Rockband spielt, eine Pornodarstellerin entblößt ihre falschen Brüste, mitten auf dem Canal Grande. Es ist nicht mehr weit hin bis zum Karneval. Aber das hier ist kein Spaß, das hier ist eine bitterböse Demonstration, gegen den drohenden Untergang einer großen, alten Stadt. Dieser Artikel ist aus dem SPIEGEL Heft 8/2011 Das Märchen vom ehrlichen Karl (Dr.) zu Guttenberg und die Wahrheit Digitale Ausgabe | Gedruckte Ausgaben | Apps | Abo An Bord der Gondeln sitzen keine japanischen Reisegruppen oder verzauberten Deutschen, die, in aneinandergeketteten Booten, Gondolieri dabei knipsen, wie sie \"O sole mio\" singen oder \"Horch, was kommt von draußen rein\". Es sind junge Italiener, in Venedig geboren und erwachsen geworden in einer Stadt, die ihnen vorkommt wie Disneyland. Ein Beamter der Kulturbehörde ist verkleidet als Ratte. \"Die Flut treibt die Ratten an Land\", sagt er. Flut, das sind nicht nur Venedigs Winterhochwasser, die immer öfter den Markusplatz in eine große Pfütze verwandeln. Flut, das sind die ansteigenden Menschenströme von 20 Millionen Touristen im Jahr, sie überschwemmen seine Stadt, und die Stadt nimmt sie auf, weil mit der Flut das Geld kommt. \"Venedig ertrinkt\", sagt die Ratte, \"und wir sterben aus.\" An der Piazzale Roma geht die Flotte an Land. Der Platz ist die Durchgangsschleuse Venedigs. Wer hier ankommt, sucht sie vergebens, die hochglänzenden Bilder aus Reiseprospekten, die Orte, auf die Thomas Mann oder Donna Leon Elogen schrieben. An diesem Platz endet die Brücke zum Festland, der Kopfbahnhof entlässt Armeen mit Rollkoffern, im Minutentakt spucken Festlandbusse Pendler vor die Fähranleger. Die neue Hightech-Hochbahn \"People Mover\" holt Tagesgäste aus den Parkhaussilos, die Benetton-Gruppe hat das alte Eisenbahngebäude gekauft, es wird umgebaut zum Shopping-Center. Wer Venedigs morbiden Charme sucht, der sollte diesen Platz meiden, er wird Venedig hassen. Es wuchern Chinesenmärkte in diesem Venedig, Spielhöllen und Frittenbuden. Schiffsterminals werden ausgebaggert, eine Metro zur neuen Flughafen-City ist geplant, ein Offshore-Hafen, alles ist beschleunigt, alles dient der Massenabfertigung und dem Profit. An ihrem Tor wirkt die Stadt künstlich, ein Rummelplatz mit alten Mauern. Noch ist der Eintritt gratis. \"Welcome to Veniceland!\", brüllt der Clown, die Ratten falten Stadtpläne im Disney-Design auseinander und preisen ihre Attraktionen: \"Bei uns können Sie auf den Wellen der Kreuzfahrtschiffe im 'Tsunami-Channel' surfen und im 'St. Marks Fun Camp' per Achterbahn den Glockenturm hinaufjagen. Kaufen Sie 'Little Shanghai' leer, die ehemalige Glasbläserinsel Murano. Seien Sie live dabei, wenn Polizisten Taschenverkäufer aus Afrika verprügeln, jede Stunde beginnt eine Show. Und besuchen Sie die letzten echten Venezianer - auf der Friedhofsinsel San Michele.\" Auf jeden Venezianer kommen zwei Fremde Venedig sinkt, Venedig stirbt, diese Klagen ereilen Venedig wie die Gezeiten, die Stadt ist daran gewöhnt, Rezepte hat sie nicht. Es stimmt, der historischen Altstadt kommen die Bewohner abhanden, sie wandern ab aufs Festland, wo sie Arbeit finden und Alltag. Vor ein paar Monaten sank die Zahl der Einwohner auf unter 60.000, auf jeden Venezianer kommen zwei Fremde. Im Jahr 2030, so glauben viele, wird hier kein Venezianer mehr anzutreffen sein. Der Ort, Touristenmagnet wie Mekka und Las Vegas, lebt längst fort in seinen Klonen in Macau und anderswo. Das Original jedoch, millionenfach belagert, stumpf geknipst, zu Tode geliebt - ist das überhaupt noch eine Stadt? Braucht sie Einwohner oder Museumswärter? Venedig ist ein Labor, in dem man beobachten kann, was passiert, wenn globale Menschenströme auf kleinstem Raum aufeinanderprallen. Am Arsenale, der stillgelegten Schiffswerft am anderen Ende der Stadt, steigt an diesem Nachmittag ein Helikopter in den Himmel. Giovanni Cecconi, 52, ein nickelbebrillter Ingenieur im blauen Anorak, blickt hinunter aufs Meer. Aus der Luft betrachtet, sieht Venedig aus wie ein Fisch. Mit Kopf, Schwanz und Flossen und dem Canal Grande, der sich schlagadergleich durch die Altstadt windet und ein Geflecht aus Hunderten Kanälen speist. Zukunft als postmoderne Stadt Von oben wirkt das historische Zentrum winzig, drum herum ist sie längst da, die Zukunft als postmoderne Stadt. Das lässt sich erahnen vor der Badeinsel Lido, wo nichts zu sehen ist als Horizont und Meer. Hier soll, so erklärt es Ingenieur Cecconi, der Fisch aufs Trockene gelegt werden. Die Lagune, in der er schwimmt, groß wie der Bodensee, nur flacher, soll an ihren drei Zugängen zum Meer geschützt werden. Damit sie nicht überfließt, wenn die richtigen Fluten kommen. Der Helikopter landet auf einer aufgeschütteten künstlichen Insel. Cecconi springt heraus und jagt über die Insel wie durch die Kulisse eines durchgeknallten Zukunftsfilms. \"Think big\", sagt er oft, wer Venedig retten will, muss Großes wollen. Cecconi arbeitet für das \"Consorzio Nuova Venezia\", die mächtigste Firma der Stadt, er führt in Baugruben tief wie Bombenkrater, Flutlicht blendet, Presslufthämmer donnern, zu sehen ist nicht viel, Venedigs Rettung spielt unter Wasser. Venedigs Erlöser heißt Mose. Wie der Prophet, der das Rote Meer teilte, um das jüdische Volk aus Ägypten zu führen. Mose für \"Modulo Sperimentale Elettromeccanico\", ein Projekt von wahrhaft biblischen Ausmaßen. Erdacht nach der Jahrhundertflut 1966, im Bau seit sieben Jahren, ein viereinhalb Milliarden Euro teures Stauwehrsystem, wie es die Welt noch nicht gesehen hat. Tag und Nacht werkeln 3600 Arbeiter an 78 Stahltanks, die hier um die Insel und weiter südlich ins Wasser gelassen werden. 1 | 2 | 3 weiter 1. Teil: Das Leben einer Toten 2. Teil: Venedig - das berühmteste Opfer des Klimawandels? 3. Teil: Der Kampf zwischen Erster und Dritter Welt wird in Venedig ausgefochten",http://www.spiegel.de/spiegel/a-746568.html,2011-02-26T00:00:00.000Z
"Kämpfe in Libyen Rebellen nehmen Gaddafis Geburtsort ein Es ist ein symbolträchtiger Sieg: Die Truppen des libyschen Übergangsrats haben offenbar den Ort Kasr Abu Hadi eingenommen - hier soll Ex-Machthaber Gaddafi 1942 in einem Zelt geboren worden sein. Um die Stadt Sirt wird hingegen weiter gekämpft, Tausende Menschen sind auf der Flucht. Kairo - Kämpfer des libyschen Übergangsrats haben nach Medienberichten im Kampf um die Stadt Sirt einen wichtigen Vorort erobert. Wie der arabische Nachrichtensender al-Dschasira berichtet, rückten sie in Kasr Abu Hadi ein. Dort soll der gestürzte Diktator Muammar al-Gaddafi 1942 in einem Beduinenzelt geboren worden sein. Der größte Teil der knapp 5000 Einwohner des südlichen Vororts sei vor dem Einmarsch geflohen, hieß es. Verbliebene Bewohner berichteten, ins Kreuzfeuer zwischen Gaddafi-treuen Truppen und den Kämpfern des Übergangsrats geraten zu sein. Auch Ärzte bestätigten der Nachrichtenagentur AFP die Einnahme von Kasr Abu Hadi. \"Abu Hadi ist vollständig frei\" von Kämpfern Gaddafis, sagte der Arzt Taha Sultan, der in einem Feldlazarett in einem östlichen Vorort von Sirt Verletzte behandelt, am Montag. \"Unser Ärzteteam ist aus dem Dorf zurückgekommen und hat erzählt, dass es befreit wurde.\" Sirt ist eine der letzten Hochburgen der Anhänger Gaddafis. Sie leisten seit Wochen Widerstand gegen die vorrückenden Truppen der neuen Führung in Tripolis. Die humanitäre Lage in der Hafenstadt ist nach Angaben des Internationalen Komitees vom Roten Kreuz (IKRK) katastrophal. Menschen sterben wegen fehlender Medikamente, ein Krankenhaus steht unter Beschuss. Am Montag hatten Tausende Bewohner eine Feuerpause zur Flucht genutzt. Mehr als 10.000 Menschen sollen Sirt laut IKRK inzwischen verlassen haben. 10.000 Boden-Luft-Raketen sind verschwunden Truppen des Übergangsrats begannen laut al-Dschasira am späten Montag erneut mit dem Beschuss der Stadt. In der vergangenen Woche hatte der Nationale Übergangsrat angekündigt, zwei Tage lang einen Korridor für Zivilisten aufrecht zu erhalten, die die Stadt verlassen wollen. Am Sonntag wurden zwei Kinder und ihre Eltern bei der Flucht aus der Stadt getötet. Sie waren auf dem Weg zu einem Checkpoint der Gaddafi-Gegner. Viele Flüchtlinge berichteten von katastrophalen Zuständen in der Stadt. Nahrungsmittel würden knapp, zudem sei die Wasser- und Stromversorgung zusammengebrochen. Derweil sorgen sich Nato-Experten um den Verbleib von bis zu 10.000 Boden-Luft-Raketen aus libyschen Armeebeständen. Die Allianz fürchtet, die Waffen könnten in die Hände von Terroristen gelangen. Nach Informationen von SPIEGEL ONLINE warnt das Bündnis vor einer ernsten Gefahr für die zivile Luftfahrt. Raketen könnten in andere Länder geschmuggelt werden und dort in die Hand von Terrorgruppen wie al-Qaida geraten.",http://www.spiegel.de/politik/ausland/kaempfe-in-libyen-rebellen-nehmen-gaddafis-geburtsort-ein-a-789696.html,2011-10-04T00:00:00.000Z
"Aufruf an Rebellen Qaida-Chef fordert islamisches Syrien Der Chef von al-Qaida ruft die Aufständischen dazu auf, in Syrien einen islamischen Staat zu schaffen. Die Scharia solle nach dem Sturz Baschar al-Assads das herrschende System werden, heißt es in einer Botschaft. Hamburg - Der Chef des Terrornetzwerks al-Qaida, Aiman al-Sawahiri , hat die Aufständischen in Syrien dazu aufgefordert, einen islamischen Staat zu schaffen. \"Führt euren Kampf im Namen Allahs und mit dem Ziel der Schaffung von Allahs Scharia als herrschendes System\", heißt es in der am Sonntag auf islamistischen Websites verbreiteten Botschaft. Der \"Feind\" sei kurz vor dem Fall, sagte Sawahiri in Bezug auf Syriens Präsidenten Baschar al-Assad , dessen Truppen seit fast zwei Jahren gegen Aufständische kämpfen. Es handelt sich um die erste Audiobotschafts al-Sawahiris im Internet seit November. Darin warnt er auch Frankreich wegen dessen Vorgehen gegen Islamisten im westafrikanischen Mali . Sollten die Franzosen ihren im Januar begonnenen Einsatz dort fortsetzen, würden sie das gleiche Schicksal wie die USA im Irak und in Afghanistan erleiden, drohte Sawahiri. Nach der Tötung von Osama Bin Laden durch ein US-Spezialkommando im Mai 2011 gilt Sawahiri als neuer Chef des Terrornetzwerks. Luftangriffe auf Aleppo und Damaskus In Syrien kamen am Wochenende bei landesweiten Kämpfen nach Angaben von Aktivisten rund 200 Menschen ums Leben - in den Städten Damaskus und Aleppo schlugen Raketen und Mörsergranaten ein. Am Sonntag trafen zwei Raketen das Viertel Sukkari in der nördlichen Stadt Aleppo. Nach Angaben eines Augenzeugen wurden drei mehrstöckige Gebäude vollständig zerstört. Die Helfer bargen 20 Leichen. Zwölf Schwerverletzte seien zur Behandlung in die benachbarte Türkei gebracht worden, hieß es. Insgesamt zählten die Helfer 81 Verletzte. Am Vortag waren nach Angaben staatlicher Medien mehrere Mörsergranaten im Zentrum der Hauptstadt Damaskus eingeschlagen. Im Viertel Kafr Susa sei dabei mindestens eine Frau getötet worden. Vier italienische Journalisten verschleppt Auch Journalisten werden weiterhin Opfer von Angriffen: Rebellen verschleppten vier italienische Reporter in unmittelbarer Nähe zur syrisch-türkischen Grenze, teilten Aktivisten der Opposition mit. Italienische Medien berichteten, die Rebellen stünden al-Qaida nahe. Am Karfreitag war der deutsche ARD-Reporter Jörg Armbruster bei Dreharbeiten in Syrien beschossen und schwer verletzt worden. Nach Uno-Schätzungen sind seit Beginn des Aufstands gegen Assad im März 2011 mehr als 70.000 Menschen getötet worden. Das Uno-Flüchtlingshilfswerk hat inzwischen 1,2 Millionen syrische Flüchtlinge in Nachbarländern registriert. Nach Angaben des Internationalen Komitees vom Roten Kreuz sind 3,6 Millionen notleidende Menschen in Syrien dringend auf Hilfe angewiesen. In Syrien leben derzeit nach Schätzungen noch 20 Millionen Menschen.",http://www.spiegel.de/politik/ausland/syrien-al-qaida-chef-fordert-islamischen-staat-nach-sturz-von-assad-a-893001.html,2013-04-07T00:00:00.000Z
"Tagesvorschau Was Dienstag wichtig wird Um mehr Jobs für Migranten geht es beim sechsten Integrationsgipfel der Bundesregierung, das Großprojekt Bankenunion erläutert BaFin-Chefin König, um einen Platz in der Zweiten Fußball-Bundesliga kämpfen Dresden und Osnabrück - das sind die wichtigsten Themen am Dienstag. Integrationsgipfel bei Merkel AP Muslime beim Gebet in einer Moschee in Berlin Noch immer haben junge Migranten größere Schwierigkeiten, eine Lehrstelle oder einen Job zu finden. Um Bildung und Arbeitsplätze geht es beim sechsten Integrationsgipfel bei Kanzlerin Angela Merkel. \"Wir haben viel erreicht\", sagt die Regierungsbeauftragte Maria Böhmer zwar vor dem Treffen mit 100 Vertretern aus Bund, Ländern und Verbänden. Die Türkische Gemeinde findet, die Ausländerfeindlichkeit sei in Deutschland noch längst nicht behoben. Sie legt deshalb der Kanzlerin einen Gesetzentwurf vor: Der Anteil von Migranten im öffentlichen Dienst, in Ämtern oder Polizeiwachen zum Beispiel, soll erhöht werden. Außerdem fordert sie eine Lockerung des Beamtenrechts.   Mehr zum Thema Integration finden Sie hier... Finanzaufsicht BaFin zieht Bilanz DPA Frankfurter Banken-Skyline: Offene Fragen zur Bankenunion Was für ein Jahr für die Finanzwelt! Die Affäre um manipulierte Zinsen erschütterte das Vertrauen in viele europäische Kreditinstitute, die EU-Kommission setzte Obergrenzen für Boni , und das Großprojekt Bankenunion nimmt Konturen an. Wie weit diese gehen, könnte Elke König an diesem Dienstag erläutern. Die Chefin der mächtigen Finanzaufsicht BaFin zieht bei der Jahrespressekonferenz in Frankfurt Bilanz und gibt einen Ausblick auf kommende Projekte.   Mehr zum Thema BaFin finden Sie hier... Pfarrer König vor Gericht DPA Jugendpfarrer Lothar König im Amtsgericht Dresden Er ist wohl der streitbarste Pfarrer Deutschlands: Lothar König ist weniger bekannt für stille Gebete als für entschiedene und aufsehenerregende Auftritte. Seit Jahrzehnten setzt er sich ein gegen rechts. In Dresden muss er sich derzeit vor Gericht verantworten, wegen schweren Landfriedensbruchs. Er soll im Februar 2011 linke Demonstranten zu Gewalt gegen Polizeibeamte aufgerufen haben. Vor Gericht sagte König: \" Ich hätte mir gewünscht, wenigstens einmal zu den behaupteten Vorwürfen befragt zu werden . Vielleicht hätten wir uns den ganzen Prozess ersparen können.\" Am Dienstag wird der Prozess fortgesetzt, SPIEGEL-ONLINE-Reporterin Julia Jüttner berichtet aus dem Gerichtssaal. Kampf um die zweite Liga Getty Images Dynamo-Profi Koch (l.), Osnabrücks Neumann: Wer schafft den Sprung in die zweite Liga? Dynamo Dresden oder der VfL Osnabrück: Wer spielt kommende Saison in der Zweiten Fußball-Bundesliga? Im Rückspiel kämpfen beide Teams um den letzten freien Platz in Liga zwei - und gegen die Drittklassigkeit. Das Hinspiel hat Osnabrück zu Hause 1:0 gewonnen und erwartet in Dresden stürmende Gastgeber. Ab 20.30 Uhr im Liveticker bei SPIEGEL ONLINE. Die aktuelle Debatte: Streit in Europa - was wird aus den Solar-Strafzöllen? Die Solarindustrie in Europa hegte Vorbehalte gegen die chinesische Konkurrenz, doch jetzt umwirbt Chinas Premier Li die deutsche Wirtschaft bei einem Berlin-Besuch. Die Mitgliedstaaten der EU jedoch begehren gegen die Kommission auf: Die Mehrheit lehnt Anti-Dumping-Zölle auf chinesische Solarmodule ab . Was wird nun aus den Solar-Strafzöllen? Das beschäftigt auch das SPIEGEL-ONLINE-Forum .",http://www.spiegel.de/politik/deutschland/was-am-28-5-wichtig-wird-integrationsgipfel-bei-merkel-bafin-bilanz-a-902148.html,2013-05-27T00:00:00.000Z
"Migration in Deutschland Zuwanderung nimmt wieder stark zu Bereits jeder Fünfte deutsche Einwohner hat ausländische Wurzeln und die Zahl der Migranten nimmt weiter zu. Besonders für Südeuropäer ist Deutschland ein attraktives Einwanderungsland. Wiesbaden - Die Anzahl der Migranten in Deutschland ist in den vergangenen zwei Jahren stark angestiegen. 2012 wanderten erstmals mehr Menschen in die Bundesrepublik ein, als Migranten der zweiten Generation hierzulande geboren wurden. Insgesamt lebten 2012 mehr als 16,3 Millionen Menschen mit Migrationshintergrund in Deutschland. Wie eine Studie des Statistischen Bundesamts zum Tag der Migranten am Mittwoch mitteilte, hat jeder fünfte Einwohner ausländische Wurzeln. Besonders der Zuzug aus den südeuropäischen EU-Länder, die von der Euro-Krise betroffen sind, steigerten die Migrationszahlen in Deutschland in den zwei vergangenen Jahren massiv, so die Studie. Zwei Drittel der Migranten in Deutschland kommen aus Europa, rund 16 Prozent aus Asien und nur vier Prozent aus Afrika. Seit 2005 ist die Zahl der Migranten und deren direkten Nachkommen um 1,3 Millionen angestiegen. Die Zahl der Migranten ist gegenüber dem Vorjahr um 381.000 angestiegen. Von 2010 auf 2011 war sie um 216.000 gewachsen, von 2009 auf 2010 lediglich um 43.000. Jeder achte Einwohner Deutschlands ist laut Statistik im Ausland geboren. Insgesamt leben in Deutschland mehr als 10,7 Migranten aus mehr als 190 Staaten.",http://www.spiegel.de/politik/deutschland/zuwanderung-in-deutschland-steigt-stark-an-a-939530.html,2013-12-17T00:00:00.000Z
"Zuwanderung 2014 De Maizière erwartet 200.000 Asylanträge Bundesinnenminister Thomas de Maizière rechnet für dieses Jahr mit deutlich mehr Asylbewerbern - trotz verschärfter Regelungen für Balkanstaaten. Im Vergleich zum Vorjahr könnten 70.000 Menschen zusätzlich kommen. Berlin - 2012 stellten etwa 78.000 Menschen einen Asylantrag in Deutschland, im vergangenen Jahr waren es 127.023. Und Bundesinnenminister Thomas de Maizière sagt einen weiteren deutlichen Anstieg der Asylbewerberzahlen voraus. \"Wenn die Entwicklung so weitergeht, rechne ich für 2014 mit rund 200.000 Asylbewerbern\", sagte der CDU-Politiker der \"Welt am Sonntag\". Zugleich verteidigte de Maizière seine Pläne für eine Asylrechtsreform gegen Kritik auch von Seiten der SPD . \"Ich rate unserem Koalitionspartner, den Gesetzentwurf etwas genauer zu lesen\", sagte er. Die Abwägung, wann ein abzuschiebender Ausländer sich dem entziehen will und deshalb in Abschiebehaft zu nehmen ist, wurde nach seinen Worten bisher lediglich durch Verwaltungen und Gerichte geregelt. \"Diesen nicht haltbaren Zustand bereinigen wir jetzt, indem wir die bestehende Praxis ins Gesetz schreiben und damit gleichzeitig auch europäische Vorgaben erfüllen\", sagte de Maizière. \"Der erhobene Vorwurf der Verschärfung ist also Unsinn.\" Aber über Details \"kann man immer reden\", sagte der Minister. \"Ich rechne fest damit, dass wir mit einem Gesetzentwurf noch vor der Sommerpause im Kabinett sind.\" Laut dem Gesetzentwurf soll etwa eine Festnahme in Zukunft möglich sein, wenn jemand \"unter Umgehung einer Grenzkontrolle eingereist\" sei, Identitätspapiere wie Ausweise vernichte oder \"eindeutig unstimmige oder falsche Angaben gemacht\" habe. Diese Verhaltensweisen deutet das Innenministerium als Anhaltspunkte für \"Fluchtgefahr\". Hintergrund sei, dass immer mehr Menschen aus Balkanstaaten in Deutschland aussichtslose Asylanträge stellten. Die Bundesregierung hatte bereits Ende April verschärfte Asylbedingungen für Balkanstaaten beschlossen. Das Kabinett brachte einen Gesetzentwurf auf den Weg, um Serbien , Mazedonien und Bosnien-Herzegowina als \"sichere Herkunftsländer\" einzustufen. So können Behörden Asylanträge aus diesen Staaten einfacher abweisen. Die Opposition sprach von einer Diskriminierung der Asylbewerber, die vor allem Roma betreffe.",http://www.spiegel.de/politik/deutschland/asylbewerber-innenminister-thomas-de-maiziere-rechnet-mit-200-000-a-970050.html,2014-05-18T00:00:00.000Z
