article,article_url,date
"Auslandsreise Fischer will Sudans Regierung unter Druck setzen Heute ist Außenminister Joschka Fischer auf eine mehrtägige Reise nach Afrika und Asien gestartet. Seine erste Mission wird heikel: Im Sudan will er die Regierung dazu bewegen, das Flüchtlingsdrama in Darfur zu beenden. DDP Außenminister Joschka Fischer: Heikle Mission im Sudan Berlin - Bereits vor dem Antritt der Reise kündigte Fischer seine Mission an. Im SPIEGEL-Interview sagte er, dass im Darfur-Konflikt der internationale Druck auf die Regierung des Sudans erhöht werdem muss. \"Allein die Tatsache, dass die Scheinwerfer der Öffentlichkeit jetzt auf den Konflikt gerichtet sind, ist von erheblicher Bedeutung\", sagte Fischer dem SPIEGEL. Konkret nannte Fischer folgende Forderungen an die Regierung. Zum einen müsse sie die \"Vereinbarungen mit der Uno und den USA unverzüglich umsetzen\". Außerdem solle umgegend mit der Entwaffnung und strafrechtlichen Verfolgung der Milizen begonnen werden, forderte Fischer. Zusätzlich solle \"den Hilfsorganisationen sofortigen Zugang zu den betroffenen Menschen\" verschafft werden, so Fischer im SPIEGEL. Fischer warnte jedoch auch vor zu schnellen Erwartungen. \"Wir reden hier von einer sehr, sehr großen Herausforderung\", betonte er. Das müsse \"in den Händen der Vereinten Nationen und vor allen Dingen auch der Afrikanischen Union bleiben\", so Fischer. Bei einer anschließenden Reise nach Asien will Fischer deshalb für ein stärkeres Engagement der Vereinten Nationen in dem Konﬂikt werben. Auch in China und Pakistan werde der Darfur-Konflikt \"selbstverständlich Thema werden\", sagte Fischer.  Im Westen des ostafrikanischen Landes haben von der Regierung unterstützte arabisch-stämmige Reitermilizen mit Mord und Terror mehr als eine Million Menschen in die Flucht getrieben. In Darfur sollen Schätzungen zufolge 30 000 Menschen ums Leben gekommen sein. Angesichts der Regenzeit, die bereits begonnen hat, sehen sich die Hilfsorganisationen im Krisengebiet mit einem Wettlauf mit der Zeit konfrontiert. Mit dem deutschen Außenminister werden auch 3,5 Tonnen Medikamente in das vom Bürgerkrieg zerrüttete Sudan geflogen. Mit den Medikamenten, die dem Deutschen Roten Kreuz in El Fascher in Darfur übergeben werden, kann die medizinische Basisversorgung von tausenden Menschen für einen Monat sichergestellt werden. Als größte Probleme in Darfur gelten nach DRK-Angaben Unterernährung, Durchfallerkrankungen, Malaria und Erkältungen.  Vor Fischer hatten US-Außenminister Colin Powell und UN-Generalsekretär Kofi Annan Khartum Besuche abgestattet. Der sudanesische Präsident Omar el Baschir hat ihnen zugesagt, die arabischen Reitermilizen zu entwaffnen, die die nichtarabische Bevölkerung terrorisieren. Die Welthungerhilfe forderte Fischer auf, Druck auf die sudanesische Regierung auszuüben, damit sie ihr Versprechen auch umsetze.  Unterdessen geht die Diskussion um ein internationales Engagement mit Soldaten weiter. Der FDP-Politiker und ehemalige Innenminister Gerhart Baum hält das Krisenmanagement der Afrikanischen Union in Sudan für gescheitert. Im \"Tagesspiegel am Sonntag\" forderte er einen internationalen Militäreinsatz mit deutscher Beteiligung. Zum Schutz und zur Versorgung der Flüchtlinge müsse Deutschland Soldaten und Hubschrauber entsenden, verlangte Baum, der bis Mitte 2003 Uno-Sonderberichterstatter für Sudan war.",http://www.spiegel.de/politik/ausland/auslandsreise-fischer-will-sudans-regierung-unter-druck-setzen-a-308236.html,2004-07-11T00:00:00.000Z
"Bild des Tages Ende eines Traums REUTERS Niedergeschlagen und erschöpft sitzen diese Männer am Rande einer Straße auf der spanischen Insel Fuerteventura. Die Polizei hat sie in warme Decken gehüllt, nachdem sie auf offener See auf einem Seelenverkäufer entdeckt worden waren. Allein in den vergangenen 24 Stunden hat die Küstenwache vor Fuerteventura drei selbstgebaute Boote mit insgesamt 123 Flüchtlingen aus Afrika entdeckt. Sie alle hatten trotz eines schweren Unwetters versucht, die europäische Küste zu erreichen. Archiv: Alle Tage, alle Bilder",http://www.spiegel.de/politik/ausland/bild-des-tages-ende-eines-traums-a-332654.html,2004-12-13T00:00:00.000Z
"Abschiebung Spanien schickt Afrika-Flüchtlinge zurück nach Marokko Spanien will den Flüchtlingsansturm auf seine Exklaven Ceuta und Melilla stoppen. Madrid vereinbarte dazu eine Ausnahmeregelung mit der Regierung in Rabat. Danach sollen die illegal eingereisten Afrikaner nach Marokko zurück gebracht werden. Madrid - Wie die spanische Vizeregierungschefin Maria Teresa Fernández de la Vega am Mittwoch in Madrid mitteilte, soll möglicherweise schon an diesem Donnerstag mit der Abschiebung von illegalen Zuwanderern begonnen werden. Die Regelung betrifft afrikanische Flüchtlinge, die von marokkanischem Gebiet aus spanisches Territorium erreicht haben. REUTERS Flüchtlinge in der spanischen Exklave Melilla: jetzt droht ihnen die Ausweisung Bisher hatte Marokko sich geweigert, Flüchtlinge aus Drittstaaten wieder aufzunehmen. Die jetzt getroffene Vereinbarung zwischen Madrid und Rabat beruht auf einem Übereinkommen aus dem Jahr 1992, das zuletzt nicht mehr angewandt wurde. Dieses Übereinkommen sieht die Möglichkeit von \"Sondermaßnahmen\" vor. Am Mittwoch hatten erneut 500 Afrikaner versucht, nach Melilla zu gelangen. Dies war binnen einer Woche der vierte Massensturm von Flüchtlingen auf die spanische Stadt an der Küste Nordafrikas. 65 Afrikaner erreichten nach Angaben der Behörden spanisches Gebiet. Etwa 40 von ihnen erlitten beim Überklettern der drei Meter hohen Grenzzäune Schnittverletzungen und Prellungen. Zwei Polizisten wurden ebenfalls verletzt. Seit Ende August kamen bei den Massenanstürmen auf die Exklaven acht Afrikaner ums Leben.  In Melilla und Ceuta sind bereits Hunderte von Afrikanern in überfüllten Lagern untergebracht. Melillas Bürgermeister, Juan José Imbroda, verlangte, dass die Eindringlinge ohne jede Formalitäten sofort auf marokkanisches Gebiet zurückgeschickt werden.  Die marokkanische Polizei nahm in der Nähe von Melilla 85 illegale Zuwanderer aus West- und Zentralafrika fest. Wie die Behörden in der nordmarokkanischen Stadt Nador mitteilten, hatte die Gruppe zuvor an dem neuen Massensturm auf die spanische Grenze teilgenommen. Am Vortag waren in derselben Gegend bereits 136 \"Illegale\" von der Polizei aufgegriffen worden. Damit wurden in Marokko in einer Woche insgesamt mehr als 900 illegale Zuwanderer festgenommen. De la Vega kündigte an, dass Spanien den Marokkanern bei der Versorgung der Flüchtlinge humanitäre Hilfe leisten werde. In Kürze werde ein entsprechendes Abkommen unterzeichnet. Die Europäische Union verhandelt bereits seit längerer Zeit mit Marokko über ein Abkommen, das die Rückführung illegaler Zuwanderer regeln soll.",http://www.spiegel.de/politik/ausland/abschiebung-spanien-schickt-afrika-fluechtlinge-zurueck-nach-marokko-a-378226.html,2005-10-05T00:00:00.000Z
"Autor Zaimoglu zum Opernstreit \"Bitte nicht die Bodenhaftung verlieren\" Alle Welt geißelt die Absetzung der Mozart-Oper \"Idomeneo\". Der Schriftsteller Feridun Zaimoglu, der heute an der Islamkonferenz teilnahm, zeigt im Interview mit SPIEGEL ONLINE \"hohen Respekt\" für die Entscheidung. Die Intendantin der Deutschen Oper werde ungerechtfertigt zum Sündenbock gemacht. SPIEGEL ONLINE: Herr Zaimoglu, die Mozart-Oper \"Idomeneo\" ist in Berlin wegen einer Szene, in der die abgeschlagenen Köpfe von Jesus, Buddha, Poseidon und Mohammed gezeigt werden sollten, abgesetzt. Darf Kunst, frei nach Tucholskys Feststellung, dass Satire alles dürfe, nicht alles? Feridun Zaimoglu: Ich bin da etwas vorsichtig. Besonders in diesen Tagen, da sich jeder CDU-Politiker aus der Kreisliga als Verteidiger von Kunst, Kultur und Frauenrechten gebärdet. Ich bitte darum, die religiösen Gefühle der Menschen - und zwar aller - ein bisschen zu berücksichtigen. SPIEGEL ONLINE: Wie verträgt sich das mit der Freiheit der Kunst? DPA Der deutsch-türkische Schriftsteller Feridun Zaimoglu, 41, schreibt in seinen Büchern (\"Kanak Sprak\", \"Leyla\") über das Schicksal türkischer Migranten. Die türkische Einwanderung nach Deutschland sieht Zaimoglu als Erfolg. Zwar gebe es Konflikte, aber \"wenn wir uns das große Bild anschauen, sehen wir, dass es doch ganz gut funktioniert\", sagte Zaimoglu kürzlich im SPIEGEL-Gespräch. Dort stellte er auch folgende Frage: \"Wie kann ein Mensch so bescheuert sein, sich als Ausländer zu fühlen und zu verhalten, wenn er in Deutschland aufgewachsen ist?\" Zaimoglu wurde in der Türkei geboren und wuchs in München, Bonn und Berlin auf. Zaimoglu: Die muss berücksichtigt werden. Im Gegensatz zu diesen Aufklärungsenthusiasten erachte ich es als meine Ermessensentscheidung und auch die anderer Künstler, es vielleicht nicht zu grob zu übertreiben. SPIEGEL ONLINE: Die Kanzlerin hat im Opernstreit erklärt, sie glaube nicht, dass Selbstzensur weiterhelfe gegen Menschen, die im Namen des Islamismus Gewalt ausüben wollten. Liegt Angela Merkel da falsch? Zaimoglu: Ich halte den Ball flach. Ich schreibe mit meinem Koautor Theaterstücke und von daher weiß ich, dass der Regisseur zusammen mit dem Stückeschreiber und den Schauspielern bei besonders brisanten Aufführungen schon einmal zusammensitzt und das Provokationspotential abwägt gegen Gefährdung an Leib und Leben. SPIEGEL ONLINE: In scharfer Kritik steht nun die Intendantin der Deutschen Oper in Berlin, Kirsten Harms, die das Stück aus Angst vor Angriffen von Islamisten abgesetzt hat. Ist sie nicht zu vorsichtig gewesen? Zaimoglu: Ich finde es ungerecht, wie sie in diesem Fall angegangen wird. Sie muss jetzt den Sündenbock spielen. Irgendwie scheint die halbe Republik nur darauf gewartet zu haben, um sich endlich einmal auf eine Person zu stürzen. Frau Harms hat eine Ermessensentscheidung getroffen, vor der ich hohen Respekt habe. SPIEGEL ONLINE: Vor allem das deutsche Theater hat sich lange Zeit provokativ an christlichen Symbolen, insbesondere den katholischen wie dem Papst, abgearbeitet. Wird nun in einer weitgehend säkularisierten Welt wie der deutschen der Islam zum Ersatzspielfeld für Künstler? Zaimoglu: Genau so wie ich es für plump und billig halten würde, wenn man eine Kuh ans Kreuz schlägt, aus der die Zunge heraushängt, genau so plump und billig finde ich es, wenn man allein nur auf die Provokation der Moslems abzielte mit dieser Oper. Es scheint mittlerweile so zu sein: Gestern haben wir die Christen geärgert, heute ärgern wir die Moslems. Aber ich sage auch ganz klar: es kann und darf keine Zensur von Außen geben. Es kann aber auch nicht sein, dass eine Intendantin, die sich für die Sicherheit ihres Publikum und ihrer Schauspieler entschieden hat, als Selbstzensorin verunglimpft wird. SPIEGEL ONLINE: Aber ist das Zurückziehen des Stückes nicht ein Niederknien vor den islamistischen Kräften, die sich dadurch bestärkt fühlen können in ihrem Kampf gegen bestimmte Formen der in ihren Augen westlichen Dekadenz? Zaimoglu: Papperlapapp. Was ich in diesem Deutschland, meinem Mutterland, gelernt habe, ist: Dass man bitte, bitte, bitte die Bodenhaftung nicht verlieren darf. Ich sehe im Grunde auf der einen Seite die üblichen Verdächtigen, die nur einen Grund suchen, um schon wieder beleidigt zu sein. Und auf der anderen Seite sehe ich die Aufklärungsspießer, die es ja sehr einfach haben und nun erklären, man sei vor den Islamisten in die Knie gegangen. Das ist doch Humbug. SPIEGEL ONLINE: Aber warum? Zaimoglu: Es wird doch im Grunde genommen nicht über die Sache gestritten, über die Frage etwa, ob die Inszenierung angemessen war oder nicht. Es geht vielen darum, an der Intendantin ein Exempel zu statuieren. SPIEGEL ONLINE: Sie waren heute einer der Teilnehmer der Islamkonferenz in Berlin. Wurde da über den Opern-Fall gesprochen? Zaimoglu: Ja, natürlich. Wir haben über die Oper gesprochen, über die Rolle der Frauen, den Alltag in Deutschland. Das Gute war, dass es eine spannende Mischung war. Ich habe mich über diese Konferenz gefreut. Ich lasse sie mir auch nicht madig reden, denn es war ein historischer Schritt. Ich war angenehm überrascht, weil es kein Laberklub war. SPIEGEL ONLINE: Die Konferenz war Auftakt für ein zweijähriges Projekt. Was würden Sie sich wünschen? Zaimoglu: Selbstverständlich sind wir alle, zu Recht, skeptisch. Denn was haben wir nicht alles an Gipfeln erlebt, aus denen nichts wurde. Man soll bitte schön auf von Außen darauf achten, dass das nicht zu einer Feierabendveranstaltung wird. SPIEGEL ONLINE: Sie sind oft ein schroffer Kritiker. Heute aber sind sie sehr positiv gestimmt. Zaimoglu: Ich sehe - und das ist kein diplomatisches Gewäsch - ein großes Potential in dieser Konferenz. Da sitzen sehr viele unterschiedliche Leute, die alle etwas machen wollen. Als ich heute in die Runde geschaut habe, hatte ich den Eindruck, dass es viele noch gar nicht fassen können, dass diese Konferenz tatsächlich stattgefunden hat. Das Interview führte Severin Weiland",http://www.spiegel.de/kultur/gesellschaft/autor-zaimoglu-zum-opernstreit-bitte-nicht-die-bodenhaftung-verlieren-a-439622.html,2006-09-27T00:00:00.000Z
"Islamunterricht \"Schüler fühlen sich viel heimischer\" Bei der Berliner Islam-Konferenz geht es auch um Pädagogik: An einigen Schulen gibt es bereits Modellprojekte zum Islamunterricht. Die Auswahl der Lehrpläne aber bleibt schwierig, und meist muss auf Lehrkräfte aus der Türkei zurückgegriffen werden. Frankfurt/Main - \"Ich halte es für überfällig, dass in unseren Schulen den Kindern muslimischen Glaubens von gut ausgebildeten Lehrern und in deutscher Sprache Islamunterricht angeboten wird.\" Mit dieser Ansicht steht Bundespräsident Horst Köhler nicht allein. Und seine Forderung ist nicht neu: Parteiübergreifend fordern Politiker Islamunterricht an staatlichen Schulen, auch um damit möglichen extremistischen Einflüssen in Koranschulen vorzubeugen. In vielen Bundesländern gibt es schon Pilotprojekte, und die Beteiligten sehen solchen Unterricht als gutes Mittel zur Integration. DDP Angehende Islamlehrer an der Uni Münster: Koranexegese und Arabischunterricht. Bereits in den Achtziger Jahren boten etwa die Länder Nordrhein-Westfalen und Bayern Islamunterricht als ergänzenden Teil des Türkisch-Unterrichts an. Seit 1999 gibt es in Nordrhein-Westfalen und seit 2001 in Bayern Islamkunde als eigenständiges Fach in deutscher Sprache. In Nordrhein-Westfalen nehmen derzeit 120 Schulen mit mehr als 5.000 Schülern teil, in Bayern waren es im vergangenen Schuljahr rund 1.700 Schüler an 35 Schulen.   \"Am Anfang herrschte große Skepsis bei Eltern und Schülern\", berichtet Lamya Kaddor, die Islamkunde an einer Hauptschule in Dinslaken unterrichtet. Die Eltern seien skeptisch gewesen, weil der Unterricht auf Deutsch stattfinde und weil sie nicht türkisch-, sondern arabischstämmig sei und kein Kopftuch trage. \"Nach drei Jahren sind aber inzwischen alle zufrieden.\" Hoheitsgerangel der Religionsverbände Genau wie in anderen Fächern gibt es für Islamkunde Noten, die sich auf die Versetzung auswirken. Im Gegensatz zu einem Religionsunterricht hat das Fach aber keine Erziehungsfunktion, der Lehrer nimmt eine neutrale Rolle ein. \"Ich kann sagen: Wenn der Fastenmonat Ramadan beginnt, haben die Muslime die Pflicht zu fasten\", erklärt Kaddor. In einem islamischen Religionsunterricht würde sie sagen: \"Wir müssen fasten, weil wir jetzt Ramadan haben.\" In Erlangen wurde im Jahr 2003 erstmalig an einer Grundschule das Modellprojekt \"Islamunterricht\" eingeführt. Damit ist Bayern das erste Bundesland mit einem staatlichen islamischen Religionsunterricht, der von einer großen Mehrheit der örtlichen Muslime mitgetragen wird. Im vergangenen Schuljahr nahmen 42 Schüler an dem Projekt teil, im kommenden Schuljahr soll die fünfte Klasse einer Hauptschule in Erlangen dazukommen. Wegen der Vorgaben des Grundgesetzes und der Organisationsweise der Muslime in Deutschland ist die Einrichtung islamischen Religionsunterrichts allerdings nicht unproblematisch. Im Grundgesetz heißt es, dass der Religionsunterricht \"in Übereinstimmung mit den Grundsätzen der Religionsgemeinschaft erteilt\" wird. Dafür ist es nötig, dass der Staat eine Religionsgemeinschaft als Ansprechpartner hat, die von ihren Mitgliedern legitimiert ist, verbindliche Aussagen über Glaubensinhalte zu treffen. Die verschiedenen islamischen Organisationen in Deutschland sind aber nicht als Glaubensgemeinschaft anerkannt. Allerdings hat das Bundesverwaltungsgericht im Februar 2005 erklärt, die Voraussetzungen einer Religionsgemeinschaft könnten von Dachverbänden wie dem Zentralrat der Muslime und dem Islamrat erfüllt werden. Lehrerausbildung hinkt hinterher Der rechtliche Status und das Mitwirkungsrecht der verschiedenen islamischen Verbände und Glaubensrichtungen bei Lehrplan und Auswahl der Lehrer sind immer wieder Streitpunkte. So war es etwa in Baden-Württemberg, wo man sich inzwischen einigen konnte: Am 18. September 2006 ist ein Modellversuch an zwölf Grundschulen gestartet. An zehn Schulen wird der Islam sunnitischer Prägung vermittelt, an zwei die alevitische Glaubensrichtung. Im bayerischen Erlangen musste mit den islamischen Gruppen vor Ort und den Eltern muslimischer Kinder ein Konsens gefunden werden, was unterrichtet werden kann. Nicht in allen Bundesländern gibt es solche Konzepte, aber doch schon in einigen. So erprobt etwa Rheinland-Pfalz in einem vierjährigen Modellversuch die Einführung eines Islamunterrichts an einer Ludwigshafener Grundschule. Hessen will schrittweise Ethikunterricht mit Schwerpunkt Islam einführen. Vor einem Jahr hatte der Hessische Verwaltungsgerichtshof die Klage der Islamischen Religionsgemeinschaft Hessen (IRH) auf Einführung von Islamunterricht abgewiesen, da es sich bei der IRH nicht um eine Religionsgemeinschaft nach dem Grundgesetz handele. Wenn immer mehr Schulen solchen Unterricht anbieten, werden auch zunehmend qualifizierte Lehrer benötigt. Oft muss auf Lehrkräfte aus der Türkei zurückgegriffen werden, doch das soll sich bald ändern: Seit zwei Jahren werden am Lehrstuhl für Religion des Islam an der Universität Münster sowie an der Universität Erlangen-Nürnberg Lehrer für Islamische Religionslehre ausgebildet. Nach Kaddors Erfahrungen dient ein solcher Unterricht vor allem auch der sprachlichen Integration von Migrantenkindern, die sich sichtlich heimischer fühlten. \"Sie können sich so auch in der deutschen Sprache mit ihrer Religion und Kultur auseinandersetzen\", so die Lehrerin. Die Kollegen, die nicht nur mit den Schülern, sondern auch mit deren Eltern und den Moscheeverbänden in Kontakt stünden, würden \"zu einer Art Brückenbauer\", bilanziert Kaddor. Von Mirjam Mohr/AP",http://www.spiegel.de/lebenundlernen/schule/islamunterricht-schueler-fuehlen-sich-viel-heimischer-a-439640.html,2006-09-27T00:00:00.000Z
