article,article_url,date
"Kampf gegen Schlepper Bericht stellt EU-Mission \"Sophia\" vernichtendes Zeugnis aus Die EU-Mission \"Sophia\" im Mittelmeer verfehlt ihr Ziel. Das ist das Fazit eines britischen Ausschussberichts. Sie macht die Überfahrt der Flüchtlinge sogar noch gefährlicher. \"Die Operation 'Sophia\" erfüllt ihre Aufgabe nicht und, das ergänzen wir noch, wird es auch nicht können\": Das ist das Fazit eines Berichts , der am Freitag dem britischen Oberhaus vorgelegt wurde. Seit dem vergangenen Jahr soll die EU-Mission im Mittelmeer, an der auch rund 400 deutsche Soldaten beteiligt sind, Netzwerke von Schmugglern zerschlagen und das Geschäft mit Menschenhandel eindämmen. Dazu zerstören die Einsatzkräfte der \"Sophia\"-Mission etwa Boote, mit denen die Schlepper Flüchtlinge über das Mittelmeer schicken wollten. Jedoch kritisiert der Bericht, dass das für die Flüchtlinge nicht mehr Sicherheit bedeutet, im Gegenteil: Die Schleuser änderten einfach ihre Strategie und verfrachteten die Hilfesuchenden in Schlauch- statt in Holzboote. Bestand die Aufgabe der Soldaten zunächst nur darin, Informationen zu sammeln, sollen sie in einer zweiten Phase seit Oktober verdächtige Schiffe überprüfen und Schleuser festnehmen. Die EU setzt eine Armada aus neun Kriegsschiffen, einem U-Boot, Aufklärungsflugzeugen und sogar Drohnen ein . Seit dem Beginn der Mission habe es rund 50 Festnahmen gegeben, allerdings habe es sich eher um niedrigrangige Verdächtige und Handlanger aus Schleusernetzwerken gehandelt, heißt es in dem Report weiter. Große Herausforderungen von Anfang an Die Mission sei wegen des großen zu überwachenden Gebiets von Anfang an mit großen Herausforderungen verbunden gewesen, räumen auch die Verfasser des Papiers ein. Immerhin: Die Suche und Rettung von Flüchtlingen sei erfolgreich. Demnach konnte im Rahmen des Einsatzes rund 9000 Menschen geholfen werden. Bei Gründung der Mission, die damals offiziell \"EUNAVFOR Med\" hieß, war das eher ein Nebenaspekt. Dieser Teil der Mission müsse fortgesetzt werden, rieten die Mitglieder des Ausschusses für EU-Angelegenheiten. Ende Juni muss das Mandat für den Einsatz komplett erneuert werden. In einer dritten Phase sollen die Schiffe auch in libysche Hoheitsgewässer eindringen dürfen und Schleuser direkt vor der Küste oder an Land bekämpfen können. Dafür bedarf es aber einer Zustimmung des UN-Sicherheitsrats oder der Einladung einer anerkannten libyschen Einheitsregierung. Dass es in naher Zukunft dazu kommen wird, ist bislang nicht abzusehen. \"Sophia\" habe gleichwohl \"wenig Aussicht\" darauf, den Schleusern das Handwerk zu legen, solange es keine Unterstützung einer stabilen libyschen Regierung gebe. In dem Land herrscht Chaos : Drei Regierungen rivalisieren, zwischen West und Ost tobt ein Bürgerkrieg - und dazwischen macht sich der \"Islamische Staat\" breit. Nach Schätzung Brüsseler Diplomaten warten in Libyen rund 500.000 Menschen auf ihre Reise Richtung EU. DER SPIEGEL",http://www.spiegel.de/politik/ausland/fluechtlinge-bericht-stellt-eu-mission-sophia-vernichtendes-zeugnis-aus-a-1092305.html,2016-05-13T00:00:00.000Z
"Flüchtlingskrise Österreich verzichtet vorerst auf Brenner-Kontrollen Österreich lenkt im Flüchtlingsstreit mit Italien ein: Bis auf Weiteres wird es am Brennerpass keine Grenzkontrollen geben. Österreich verzichtet vorerst auf Grenzkontrollen am Brenner . Das teilten Innenminister Wolfgang Sobotka und sein italienischer Amtskollege Angelino Alfano am Freitag bei einem Ortstermin mit. Die Zahl der Flüchtlinge, die an dem Alpenpass ankommen, sei wegen der italienischen Kontrollmaßnahmen deutlich zurückgegangen, teilte Sobotka mit. Daher werde mit den Maßnahmen für das Grenzmanagement vorerst gewartet. Die österreichische Regierung hatte in den vergangenen Wochen erste Vorkehrungen für Kontrollen an dem Grenzübergang getroffen, um \"lageabhängig\" auf die Entwicklung reagieren zu können. Diese Schritte hatte Rom wiederholt massiv kritisiert. Die Grenzkontrollen seien \"rausgeschmissenes Geld\", sagte zum Beispiel Alfano. Österreich hatte die Planungen, die auch einen 400 Meter langen Metallzaun vorsahen, verteidigt. \"Keiner in Österreich will eine Schließung des Brenners\", sagte Außenminister Sebastian Kurz über das Vorhaben . \"Aber wenn jeden Tag Flüchtlinge und Migranten weitergewunken werden, dann haben wir keine andere Wahl, als Grenzkontrollen einzuführen, wie es andere Länder wie Deutschland schon zuvor gemacht haben\", rechtfertigte der Politiker der konservativen ÖVP die Vorbereitungen.",http://www.spiegel.de/politik/ausland/fluechtlingsandrang-oesterreich-verzichtet-vorerst-auf-brenner-kontrollen-a-1092317.html,2016-05-13T00:00:00.000Z
"Linke-Parteitag Viele Worte, eine Torte Wie die AfD bekämpfen und zugleich selbst Protestpartei bleiben? Die Linke sucht nach Antworten - und müsste eine ehrliche Debatte führen. Die kommt beim Parteitag allerdings kaum in Fahrt. Was auch mit einer Torte zu tun hat. Von Kevin Hagen , Magdeburg Christian O. Bruch/ laif Kevin Hagen Jahrgang 1986. Studierte Geschichte sowie Medien- und Kommunikationswissenschaft in Mannheim und an der University of Connecticut in den USA. Arbeitete während des Studiums unter anderem für SPIEGEL ONLINE, die \"Süddeutsche Zeitung\" und das dpa-Büro in Washington. Ab 2012 Volontariat beim \"Mannheimer Morgen\". Danach Politik-Redakteur bei der \"Rhein-Neckar-Zeitung\" in Heidelberg. Seit Juli 2015 Redakteur bei SPIEGEL ONLINE im Politik-Ressort. E-Mail: Kevin.Hagen@spiegel.de Twitter: hagenkev folgen Mehr Artikel von Kevin Hagen Nach rund drei Stunden ist sie wieder zurück: Sahra Wagenknecht betritt die Messehalle in Magdeburg . Das rote Kostüm hat sie gegen ein dunkles getauscht, ein Lächeln huscht über ihr Gesicht, Applaus brandet auf. Die Zeit hat die Linken-Fraktionschefin im Hotel genutzt, um sich zu sammeln, sich zu sortieren. Aktivisten hatten ihr vor der Bühne eine Torte mit brauner Creme ins Gesicht geworfen - aus Protest gegen Wagenknechts Flüchtlingspolitik. Da hatte der Parteitag der Linken gerade erst begonnen. Eine \"saudämliche Aktion\" , sagt die Politikerin später. Sie lasse sich davon nicht beirren. Und der Angriff spielt ihr sogar in die Karten. Denn Wagenknecht steht innerparteilich seit Monaten unter Druck. Ihre Aussagen zu Kapazitätsgrenzen und Kontingenten haben sie in der Flüchtlingspolitik regelrecht isoliert. Auch die Magdeburger Attacke richtete sich gegen den Kurs Wagenknechts. DPA Wagenknecht nach dem Tortenwurf Jetzt springen ihr all jene zur Seite, die sich nicht zu ihren besten Freunden zählen. \"Das ist nicht links, das ist auch nicht antifaschistisch. Das ist asozial, das ist hinterhältig, das ist dumm\", sagte Wagenknechts Co-Fraktionschef, Reformer Dietmar Bartsch . Parteichefin Katja Kipping , die kürzlich mit Blick auf Wagenknechts Provokationen noch vor einer \"AfD light\" gewarnt hatte, betont: Ihre Parteifreundin stehe für Antirassismus und gegen Asylrechtsverschärfungen. Natürlich. Führende Linke betrachten die Themen Wagenknecht und Flüchtlinge gerne als erledigt. Doch das sieht nicht jeder so. Ein Antrag, der gar den Rücktritt der Fraktionschefin forderte, wurde erst kurz vor dem Parteitag abgeräumt. Spätestens nach dem Tortenwurf ist klar: Scharfe Wagenknecht-Kritik ist an diesem Tag erst einmal tabu. Die Attacke hat die Debatte abgewürgt. Im Video: Wagenknecht reagiert auf Torten-Attacke Video DPA Dabei geht es eigentlich um einen zentralen Punkt des Parteitags. Hinter den Themen Wagenknecht und Flüchtlinge steht die Frage, wie die Linke darauf reagieren will, dass ihre Wähler zunehmend zur rechtspopulistischen AfD abwandern - vor allem im Osten und vor allem Stammklientel: Arbeiter und Erwerbslose. Nach den Landtagswahlen im März wollte die Linke in Sachsen-Anhalt eigentlich den neuen Regierungschef stellen. Am Ende wurde sie aber nur drittstärkste Kraft, abgeschlagen hinter CDU - und AfD. Aktuelle Umfragen sehen die Rechtspopulisten mittlerweile auch in Mecklenburg-Vorpommern und in Brandenburg vor der Linkspartei. Soziale Themen im Vordergrund Die Angst geht um bei den Linken. Das Problem: Mit der Flüchtlingsfrage kann die Linke kaum punkten. Im Gegensatz zu manchen Anhängern hält die Parteiführung zwar an einer klaren Willkommenskultur fest - alles andere wäre ideologisch auch kaum zu begründen. Doch wie soll sie damit künftig Stimmen holen? Der Kern eines Leitantrags, den die Partei in Magdeburg mit deutlicher Mehrheit verabschiedet, sieht zwei Strategien vor: Einerseits sollen Rechtspopulisten und Rassisten noch konsequenter bekämpft werden. Ein \"völkischer Mob\" sei auf dem Vormarsch, hieß es in einem Beschluss. DPA Wiedergewählte Vorsitzende Riexinger und Kipping Andererseits will die Partei soziale Themen wieder in den Vordergrund stellen. \"Es ist doch der größte Irrtum, dass die AfD irgendetwas mit sozialer Politik zu tun hat\", ruft Parteichef Bernd Riexinger in einer emotionalen Rede den knapp 600 Genossen entgegen. \"Wir brauchen Obergrenzen für Reichtum und nicht bei der Finanzierung der Renten, der Krankenhäuser, Kitas und Schulen.\" Dazu will die Linke auch ein bisschen mehr Protestpartei sein und trotzdem regierungsfähig bleiben. Ratlose Genossen Wie das am Ende aussehen soll, bleibt eine große Frage der Partei, auch in Magdeburg. Als die thüringische Landesvorsitzende Susanne Hennig-Wellsow für pragmatische Regierungsarbeit wirbt, erntet sie Applaus - und Buhrufe. Hinter den Kulissen erlebt man auch ratlose Genossen. Es heißt, all das sei ein Spagat, ein Patentrezept habe man einfach nicht. Kurz vor dem Parteitag hatte sich der frühere Fraktionschef Gregor Gysi zu Wort gemeldet - und seine Partei \"saft- und kraftlos\" genannt. Das kam natürlich nicht gut an - doch hinter vorgehaltener Hand geben viele Parteimitglieder Gysi recht. In Magdeburg will die Linke neuen Mut fassen. Riexinger verspricht ein \"Signal des Aufbruchs\", doch die Debatte bleibt emotionslos, am Würstchenstand herrscht mitunter mehr Aufregung als im Tagungssaal. Auch wenn sich die Parteivorsitzenden alle Mühe geben. Kipping greift die Regierung scharf an. CSU -Chef Horst Seehofer bezeichnet sie wegen seiner Haltung in der Flüchtlingspolitik gar als \"Grenzfetischisten\". Kipping und Riexinger werden am Ende im Amt bestätigt . Kipping landet bei 74 Prozent, drei Punkte weniger als 2014. Für Riexinger stimmen 78,5 Prozent der Stimmen (2014: 89 Prozent). Traumergebnisse sind das nicht, richtig schlechte aber auch nicht. Eine Überraschung galt sowieso als ausgeschlossen. Das Führungsduo hatte die tief zerstrittene Linke in den vergangenen Jahren beruhigt. Daran soll sich nichts ändern, keine Furcht vor der AfD - und auch kein Ärger um Wagenknecht.",http://www.spiegel.de/politik/deutschland/linke-in-magdeburg-tortenwurf-auf-parteitag-bremst-debatte-a-1094684.html,2016-05-28T00:00:00.000Z
"Vize-Sicherheitsminister Chinese übernimmt Interpol-Spitze Als Vizeminister wachte er bislang über die innere Sicherheit Chinas: Jetzt wird Meng Hongwei Präsident der internationalen Polizeibehörde Interpol. Menschenrechtsaktivisten kritisieren das. Der chinesische Vizeminister für öffentliche Sicherheit, Meng Hongwei, ist neuer Präsident der internationalen Polizeiorganisation Interpol . Er nimmt seine Aufgabe mit sofortiger Wirkung auf, wie die Organisation zum Abschluss ihrer Jahrestagung auf der indonesischen Insel Bali meldete. Die US-amerikanischen Menschenrechtsorganisationen Human Rights Watch (HRW) und Amnesty International kritisierten die Wahl Mengs. Nicholas Bequelin, Amnesty-Regionaldirektor für Ostasien, sagte, sie sei \"überaus besorgniserregend\". China versuche seit Langem, \"Interpol bei der Verhaftung von Dissidenten und Flüchtlingen im Ausland\" einzusetzen. Ein Sprecher von HRW in Hongkong sagte, die Wahl sei \"alarmierend\". Im April 2014 hatte China eine Liste mit 100 Gesuchten an Interpol weitergeleitet, die in Anti-Korruptionsverfahren gesucht werden. Etwa ein Drittel von ihnen wurde bislang gefasst und in der Volksrepublik vor Gericht gestellt. Meng löst die Französin Mireille Ballestrazzi ab. Der Interpol-Präsident steht dem Exekutivausschuss vor und ist für vier Jahre im Amt. Das Gremium berät und legt die Grundausrichtung der Organisation fest. Es überwacht die Entscheidungen des Generalsekretariats von Interpol im französischen Lyon. Leiter der Behörde dort ist seit 2014 der Deutsche Jürgen Stock. Neben der Wahl Mengs haben die gut 800 Delegierten aus 164 der 190 Mitgliedsländer sich bei der Jahrestagung auf die Aufnahme biometrischer Daten beim Austausch von Informationen über mutmaßliche Terroristen und einen besseren Informationsaustausch geeinigt. Die nächsten Jahrestagungen finden 2017 in Peking und 2018 in Kampala in Uganda statt.",http://www.spiegel.de/politik/ausland/meng-hongwei-ist-neuer-interpol-praesident-a-1120655.html,2016-11-10T00:00:00.000Z
"Experte zu Racial Profiling \"Es kam schon vor, dass sich Polizisten entschuldigten\" Ein Mann wird dreimal am Tag von Polizisten kontrolliert - aufgrund seiner Hautfarbe? Der Polizeibeauftragte Dieter Burgard will für Racial Profiling sensibilisieren und zwischen Bürgern und Beamten vermitteln. Ein Interview von Maria Christoph Die Hautfarbe eines Menschen darf in Deutschland nicht zur Grundlage einer Identitätskontrolle werden - wird sie aber immer wieder. Das sogenannte Racial Profiling liegt etwa vor, wenn Polizisten eine Person aufgrund ihres äußeren Erscheinungsbilds einer Gruppe zuordnen, die sie für besonders kriminell halten, erklärt Dieter Burgard, Landespolizeibeauftragter für Rheinland-Pfalz. Zur Häufigkeit solcher Kontrollen gibt es keine gesicherte Zahlen - auch, weil die verbotene Diskriminierung manchmal nur schwer von berechtigter Polizeiarbeit zu unterscheiden ist . Und wahrscheinlich auch, weil Betroffene oft nicht wissen, an wen sie sich überhaupt wenden können. Unabhängige parlamentarische Beschwerdestellen gibt es derzeit in drei Bundesländern: Schleswig-Holstein, Baden-Württemberg und Rheinland-Pfalz, das 2014 den Anfang machte und Dieter Burgard zum Polizeibeauftragten ernannte. Er ist seither Ansprechpartner für Beschwerden sowohl von Bürgern als auch von Beamten. Polizeiliche Fehlerkultur sei als Thema noch neu, so Burgard. Lange habe man sich in Deutschland nicht getraut, Misstrauen gegenüber der Behörde zu äußern. Im Interview mit SPIEGEL ONLINE erzählt er von den Möglichkeiten und den Grenzen seines Aufgabengebiets. SPIEGEL ONLINE: Herr Burgard, aus Ihrer Erfahrung: Wie groß ist das Problem des Racial Profilings bei der Landespolizei? Burgard: Ich denke, es war schon mal größer. Die Polizei hat gelernt, ausländische Bürger nicht mehr auf diese Weise zu diskriminieren. Ich denke aber auch, dass die Methode noch immer in der Denkweise der Beamten unterschwellig vorhanden ist. Im vergangenen Jahr meldete sich ein Mann afrikanischer Abstammung bei mir. Er lebt seit mehr als 20 Jahren in Deutschland, eines Vormittags wurde er dreimal von verschiedenen Polizeibeamten kontrolliert. Da er keine Ausweispapiere dabeihatte, begleiteten ihn die Beamten bei der dritten Kontrolle bis in seine Wohnung. Der Mann fühlte sich diskriminiert, ist verbal ausgerastet und bekam dafür eine Strafanzeige und in der Folge eine Geldstrafe. Ich frage mich, warum er so oft kontrolliert worden ist und gehe der Sache gerade nach. SPIEGEL ONLINE: Was können Sie als Polizeibeauftragter tun? Burgard: Ich bin dazu da, eine neue Kommunikationsebene herzustellen. Manchmal lade ich Beamte und Betroffene zu einem runden Tisch ein. Es kam schon vor, dass sich die Polizisten nach dem Gespräch entschuldigten oder Geld an den Weißen Ring spendeten. Das war der Fall bei einem über 80-jährigen Mann jüdischen Glaubens, der sich durch eine herablassende Behandlung an die Kontrollen in der NS-Zeit erinnert fühlte. SPIEGEL ONLINE: Und was passiert, wenn es keine Einigung gibt? Burgard: Wenn der Vorfall gravierend ist, kann ich dem Betroffenen vorschlagen, als Privatkläger vor Gericht zu ziehen. Die Staatsanwaltschaft stellt die Ermittlungsverfahren leider oft ein - etwa, weil eine Strafverfolgung ihrer Meinung nach nicht im öffentlichen Interesse liegt beziehungsweise der Vorfall als geringfügig betrachtet wird. SPIEGEL ONLINE: Wieso kommt es in Fällen von Racial Profiling so selten zu Verfahren gegen Polizeibeamte? Burgard: Irgendwann steht Aussage gegen Aussage. Das Problem besteht darin, den Vorfall zu beweisen: Polizeibeamte treten meistens zu zweit auf, als Bürger ist man häufiger allein unterwegs. Wie soll man dann das Fehlverhalten eines Beamten beweisen? SPIEGEL ONLINE: Denken Sie, dass es durch Ihre Arbeit seltener zu Racial Profiling kommt? Burgard: Ja, ich hoffe es. Das Bewusstsein der Polizei, respektvoll und fair mit Bürgern umzugehen, wurde auch durch meine Stelle geschärft. Ich bin in einer unabhängigen Position, da ich beim Landtag angesiedelt bin und nicht bei der Polizei oder dem Innenministerium. Es ist wichtig, dass sich ein Dritter die Fälle anschaut. Wenn mir eine Stellungnahme der Polizei nicht plausibel erscheint, frage ich nach. SPIEGEL ONLINE: Aber Sie haben keine rechtliche Handhabe. Auch deshalb bezweifelt mancher Kritiker, dass Ihre Stelle etwas gegen das Problem Racial Profiling ausrichten kann. Mit Recht? Burgard: Das stimmt so nicht. Ich kann das Thema beim Innenminister und im Innenausschuss des Landtags vorbringen. Die Beschwerdestellen können durchaus etwas ändern. Die Berliner Landesregierung will eine Beschwerdestelle nach Vorbild Rheinland-Pfalz einrichten. Seit es uns gibt, geht die Polizei mit Fehlern und Beschwerden anders um, sie ist sensibler geworden. Das ist ein Erfolg. SPIEGEL ONLINE: Viele Fälle von Racial Profiling werden doch wahrscheinlich gar nicht gemeldet? Burgard: Es gibt natürlich eine Dunkelziffer, aber zur Zahl der Fälle möchte ich keine Schätzung abgeben. Das ist Spekulation. Bei mir beschweren sich Fußballfans und Rocker genauso wie Migranten, die sich diskriminiert fühlen. SPIEGEL ONLINE: Können Sie sich erklären, warum das Thema Racial Profiling noch kein fester Bestandteil der Polizeiausbildung ist? Burgard: Die Polizei arbeitet daran, auch an dem Thema Fehlerkultur insgesamt. Das Problem bleibt aber, dass die meisten Ausbilder aus einer Generation stammen, in der Racial Profiling noch fast alltäglich Realität war. Ich habe die Hoffnung, dass jüngere Polizistengenerationen, die in einer vielfältigeren Gesellschaft groß geworden sind, anders mit Migranten umgehen.",http://www.spiegel.de/panorama/justiz/racial-profiling-das-problem-besteht-darin-den-vorfall-zu-beweisen-a-1130142.html,2017-01-18T00:00:00.000Z
"Familienministerin Schwesig Zu wenig Unterkünfte und Personal für junge Flüchtlinge Die Zahl der unbegleiteten minderjährigen Flüchtlinge in Deutschland sinkt, doch es mangelt weiter an Betreuung. Die Kommunen haben nicht genügend Unterkünfte und Personal. Tausende Kinder und Jugendliche sind in den vergangenen Jahren ohne ihre Eltern nach Deutschland geflohen - vor allem aus Syrien , Afghanistan und dem Irak . In Deutschland mussten die Jugendämter dadurch in kurzer Zeit mehr Kinder betreuen. Nun hat sich die Lage etwas entspannt. Die Zahl der Minderjährigen sei auf 43.840 gesunken, zeigt ein Bericht der Bundesregierung, den das Kabinett verabschiedet hat. Der Höchststand war demnach Ende Februar 2016 erreicht worden. Damals betreuten die Jugendämter 60.638 ausländische Kinder und Jugendliche. Obwohl es nun deutlich weniger sind, stellt die Betreuung die Gemeinden immer noch vor gewaltige Probleme. Viele Kommunen hätten im Zuge des Anstiegs 2015 und 2016 auch für Minderjährige Notunterkünfte und Übergangslösungen eingerichtet, heißt es im Bericht. Seit dem zweiten Halbjahr 2016 bessere sich die Lage. Trotzdem fehle es in einigen Kommunen weiter an Personal oder an geeigneten Unterkünften, sagte Familienministerin Manuela Schwesig (SPD). Zudem müsse das Personal im Bereich Ausländerrecht geschult werden. Mit dem Rückgang bei den minderjährigen Flüchtlingen ist gleichzeitig die Zahl der jungen Volljährigen gestiegen, die durch die Jugendhilfe unterstützt werden. Erhielten im November 2015 noch 6400 junge Erwachsene Hilfe, so waren es Anfang Februar dieses Jahres bundesweit 18.214. Für Ausländer, die im Alter von 17 Jahren ohne Eltern nach Deutschland kämen, sei es oftmals schwierig, sich schon kurze Zeit später als Volljährige alleine zurechtzufinden, hieß es aus den Kommunen. Etwa ein Viertel der Minderjährigen, die alleine einreisen, ist 14 oder 15 Jahre alt. Die meisten sind älter. Mehr als 90 Prozent aller unbegleiteten Minderjährigen sind männlich. Die meisten minderjährigen Flüchtlinge sind laut Bericht nicht in Gastfamilien, sondern in Einrichtungen mit Wohngruppen untergebracht. Der Gesundheitszustand der Jugendlichen sei von den Belastungen ihrer Flucht gekennzeichnet.",http://www.spiegel.de/politik/deutschland/fluechtlinge-unterkuenfte-und-personal-fuer-minderjaehrige-fehlen-a-1138854.html,2017-03-15T00:00:00.000Z
