article,article_url,date
"Kalter Krieg Hunderte starben an Grenze von Österreich und CSSR Die Grenze zwischen Österreich und der Tschechoslowakei soll weit blutiger gewesen sein als bislang bekannt: Laut einer Studie sollen an diesem Abschnitt des Eisernen Vorhangs im Kalten Krieg fast 800 Menschen gestorben sein. Die meisten Opfer waren Soldaten. Wien - Die Grenze zwischen Österreich und der damaligen CSSR im Kalten Krieg war nach Erkenntnissen von Historikern eine besonders grausame Todesfalle für Flüchtlinge und Soldaten. Fast 800 Menschen seien zwischen 1945 und 1989 an der Grenze gestorben, sagte der Leiter des Wiener Ludwig-Boltzmann-Instituts für Kriegsfolgen-Forschung, Stefan Karner. Aus bisher unter Verschluss gehaltenen Dokumenten der Geheimpolizei gehe hervor, dass 129 Menschen beim Fluchtversuch starben. Der Großteil der Toten, nämlich 648, seien aber meist tschechoslowakische Soldaten gewesen, die bei Unfällen im Minengürtel oder durch Selbstmord ihr Leben verloren. \"Diese Grenze war blutiger als die innerdeutsche\", meinte Karner. Die Zählung der Grenztoten in Deutschland ist allerdings umstritten, manche Forscher gehen von weit mehr als 1000 Toten am Grenzstreifen zwischen DDR und BRD aus. In jedem Fall kamen die Opfer auf ähnlich grausame Weise ums Leben: In einigen Fällen hätten Grenzhunde jugendliche Flüchtlinge zerfleischt, Menschen seien am Stacheldrahtzaun verblutet, Soldaten hätten sich wegen des enormen psychischen Drucks gegenseitig erschossen, sagte Karner, der mit seinen Mitarbeitern Einsicht in die Akten des tschechoslowakischen Geheimdienstes nehmen durfte. Opfer manchmal tagelang mit dem Fernglas verfolgt Entlang der 453 Kilometer langen Grenze zwischen dem neutralen Österreich und der kommunistischen CSSR patrouillierten nach diesen Angaben bis zu 8000 Soldaten. Der Sperrgürtel im Böhmerwald sei bis zu zwölf Kilometer tief gewesen. \"Das bedeutet, Grenzsoldaten haben ihre Opfer teils stunden- oder gar tagelang mit dem Fernglas verfolgt\", sagte Karner. Das sei an vielen offenbar nicht spurlos vorbeigegangen. \"Die Motiv- und Ursachenforschung für die Todesfälle unter den Soldaten steht aber noch am Anfang.\" Die eigentliche Grenze sei vergleichbar mit der deutsch-deutschen befestigt gewesen: mit Minenfeld, Flutlicht, dreifachem Stacheldrahtzaun, davon der mittlere unter tödlichen Strom. Die wenigen Jahre des politischen Tauwetters wie zu Zeiten des \"Prager Frühlings\" 1968 hätten auch unmittelbar Auswirkungen auf die Grenzsituation gehabt. \"Dann waren weniger Soldaten unterwegs, wurde der Strom am Zaun abgestellt.\" Insgesamt gehörten den Grenztruppen 20.000 Soldaten an. Die Recherchen, die nun in Buchform vorliegen, sind Teilergebnisse eines Projekts über den tschechoslowakischen Nachrichtendienst in Österreich von 1945 bis 1989. Die Anregung dazu kam nach Karners Worten von tschechischer Seite.",http://www.spiegel.de/politik/ausland/kalter-krieg-hunderte-starben-an-grenze-von-oesterreich-und-cssr-a-933101.html,2013-11-12T00:00:00.000Z
"Psychotherapie auf Türkisch Herr Doktor, bir sorunum var Bei einer Psychotherapie ist das Patientengespräch das A und O. Doch was ist, wenn der Patient kaum Deutsch spricht? Der Einsatz von Dolmetschern hat seine Tücken. In Stuttgart hilft eine interkulturelle Ambulanz. Der Diplompsychologe Mehmet Yazici hat einen Sympathiebonus bei türkischen Patienten. \"Mein Migrationshintergrund vereinfacht oftmals den Beziehungsaufbau\", erklärt er. \"Durch die kulturelle Gemeinsamkeit entsteht mehr Offenheit.\" Yazici arbeitet in der interkulturellen Psychiatrischen Institutsambulanz des Rudolf-Sophien-Stifts in Stuttgart. Die Abteilung ist seit 2006 auf türkische Patienten spezialisiert. Von den 14 Mitarbeitern haben sechs türkische Wurzeln: Drei Psychotherapeuten, eine Sozialpädagogin, eine Sekretärin und ein Dolmetscher. Institutsleiter und Facharzt Peter Birkert schätzt, dass die Hälfte der rund 600 Patienten türkischer Herkunft ist. \"Der Andrang ist groß\", sagt er. Die Ambulanz könnte doppelt so viele türkische Patienten aufnehmen. \"Dafür reichen unsere Kapazitäten aber nicht aus.\" Von 10,8 Millionen Menschen in Baden-Württemberg sind knapp drei Millionen Migranten - etwa 27 Prozent. Die türkischen Migranten bilden die größte Gruppe. Etwa eine halbe Million Menschen im Südwesten hat die Staatsangehörigkeit der Türkei. In Deutschland sind es drei Millionen, was einem Anteil von etwa vier Prozent an der Bevölkerung entspricht. Laut Bundespsychotherapeutenkammer spricht jeder Fünfte nicht ausreichend Deutsch, um eine psychotherapeutische Behandlung erfolgreich absolvieren zu können. Kliniken stellen sich zunehmend auf kulturelle Hürden ein Moritz Quiske von der Deutschen Krankenhausgesellschaft sieht eine Entwicklung im System . \"Die Krankenhäuser stellen sich zunehmend auf Patienten ein, deren erste Muttersprache nicht Deutsch ist.\" Häufig dienen Dolmetscher als Vermittler zwischen Arzt und Patient. Wichtig sei, dass der Übersetzer über fachspezifisches und kulturelles Wissen verfügt. Professionelle Sprach- und Integrationsmittler erfüllen diese Kriterien. Anders als herkömmliche Dolmetscher sind sie speziell für das Übersetzen im Gesundheitswesen ausgebildet. Die bundesweite Vermittlung der Experten erfolgt über ein Projekt der Diakonie Wuppertal. \"Unsere Sprach- und Integrationsmittler werden als Dienstleister je nach Bedarf der anfragenden Stelle gebucht. So wollen wir Lücken schließen\", sagt Heike Timmen, Leiterin des Vermittlungsservices. Auch die Psychotherapie ist ein Einsatzbereich der spezialisierten Dolmetscher. Das sehen die Psychiater im Rudolf-Sophien-Stift kritisch. \"Dolmetscher wird zum Anker für Therapeut und Patient\" Suzanne Aksümer hat selbst als Übersetzerin gearbeitet und kennt beide Seiten der Medaille. \"Der Dolmetscher wird zum Anker für Therapeut und Patient. Zu wem baut mein Patient dann eine Bindung auf? Es fehlt die nötige Intimität für eine Therapie.\" Die Sozialpädagogin Arife Bagci-Demirkol stimmt der Kollegin zu: \"Diagnostisch ist ein Sprachmittler sinnvoll, therapeutisch aus meiner Sicht schwierig. Vor allem bei langfristigen Therapien ist bei einem Dolmetscher-Pool nicht garantiert, dass immer dieselbe Person verfügbar ist.\" In der Psychiatrischen Institutsambulanz in Stuttgart leistet der Dolmetscher daher nur außerhalb der Psychotherapie Hilfe, unter anderem bei Arzt- und Pflegegesprächen. Heike Timmen vom Wuppertaler Vermittlungsservice spricht von positiven Rückmeldungen beim Einsatz von Dolmetschern in der Therapie. \"Die Psychiater erzielen nach eigenen Angaben Erfolge und sehen den \"Dritten im Raum\" nicht als Hindernis an. Für uns stellt die Bereitstellung desselben Sprach- und Integrationsmittlers auch bei langfristigen Therapien kein Problem dar.\" Zweisprachige Therapeuten sind Mangelware. \"Psychische Erkrankungen können die Integrationsfähigkeit einschränken\", sagt ein Sprecher des Sozialministeriums. Eine Lösung nach dem Prinzip des Stuttgarter Vorbildes scheint flächendeckend nicht umsetzbar zu sein. Bundesweit gibt es nur wenige Institutionen, die ähnlich aufgestellt sind. Yazici betont: \"Der Bedarf hierzulande ist nicht gedeckt, die Wartezeiten für die Patienten sind lang.\"",http://www.spiegel.de/gesundheit/psychologie/psychotherapie-auf-tuerkisch-wenn-der-patient-kein-deutsch-spricht-a-941548.html,2014-01-03T00:00:00.000Z
"Syrische Flüchtlinge in Deutschland Vertrieben aus Homs, verloren in Fuldatal Sie hat fünf Kinder, ihr Mann ist gelähmt, sie muss die Familie durchbringen: Umm Taufik gehört zu den schutzbedürftigen Syrern, die Deutschland eingeflogen hat. Seit sechs Monaten wartet sie darauf, endlich Deutsch lernen zu dürfen. Von Raniah Salloum , Fuldatal Raniah Salloum Mehr Artikel von Raniah Salloum Nur kurz hat Umm Taufik gezögert, als das Uno-Flüchtlingswerk in Beirut sie fragte, ob sie nach Deutschland wolle. Sie sei einer der härtesten Fälle - ausgebombt, Mutter von fünf Kindern, der Ehemann nach einem Unfall querschnittsgelähmt. 5000 besonders schutzbedürftige Syrer hatte Deutschland versprochen aufzunehmen. Umm Taufik wusste über Deutschland nicht viel. Drei Dinge fragte die 40-Jährige: Können wir eines Tages nach Syrien zurückkehren? Können die Deutschen meinem Mann helfen? Werden meine Kinder eine bessere Zukunft haben? Dreimal antwortete die Uno mit Ja. Also flogen die Aljaboulis im Dezember 2013 nach Kassel. Sechs Monate später weiß Umm Taufik, dass es in Deutschland kaum kleine Zucchinis und Auberginen gibt, die sie braucht, um \"Machschi\" zu machen, gefülltes Gemüse, ohne das kaum ein syrisches Essen auskommt. Dafür gibt es Schokolade, die so gut schmeckt, dass Umm Taufik sie vor den Kindern verstecken muss. Die fünf deutschen Worte, die Umm Taufik aufgeschnappt hat, probiert sie fragend aus. \"Zum Abschied sagt man 'Dschiss'? Und 'Dankeschehn' ist eine stärkere Form von Danke?\" Seit sechs Monaten ist Umm Taufik mit ihren Kindern in Deutschland. Doch bisher hatten sie noch keine Unterrichtsstunde Deutsch. \"Die Sprache ist das größte Hindernis\" \"Mein Mann kann schon besser Deutsch als wir\", sagt Umm Taufik. Der Gelähmte liegt nach einer Operation im Reha- und Pflegeheim. Die Krankenschwestern haben ihm \"Wasser\", \"Tasse\" und \"Teller\" beigebracht, damit er sich ein wenig verständlich machen kann. Umm Taufik braucht mit dem Bus mehr als eine Stunde zu ihm, sie schafft es höchstens zwei-, dreimal im Monat. Die Landkreisverwaltung Kassel, der die Familie zugewiesen wurde, hat Umm Taufik mit ihren fünf Kindern in einer Zweizimmerwohnung in Fuldatal untergebracht, am Rand der Stadt. Viel Platz haben sie in der Wohnung nicht, doch einen großen Hof gemeinsam mit den deutschen Nachbarn. Dort flitzen der siebenjährige Taufik und die neunjährige Nur einem bunten Ball hinterher. Die zwei ältesten Schwestern helfen der Mutter beim Gemüseschneiden. \"Ich weiß, wie ein Haus funktioniert. Ich weiß, wie man Essen kocht. Das ist nicht das Problem\", sagt Umm Taufik. \"Aber ich brauche die Sprache\", klagt sie, \"das ist das größte Hindernis.\" Sie versteht nicht, warum ihre Kinder nicht eingeschult werden Umm Taufik versteht nicht die Ärzte, die ihren Mann behandeln, und nicht die Briefe, die ihr die Landkreisverwaltung schreibt. Ihre Adresse trägt sie abfotografiert bei sich, denn lateinische Buchstaben hat sie nie gelernt. Sie weiß, dass ihre deutschen Nachbarn nett sind, sie winken immer. Wie soll sie sagen, dass sie zum Arzt muss, aber bisher keine Krankenkassenkarte hat? Wie soll sie sich erkundigen, warum ihre Kinder noch nicht zur Schule gehen können? Diese Frage quält sie am meisten. Das letzte Mal waren die fünf - Dua, 15, Alaa, 13, Marwa, 11, Nur, 9, und Taufik, 7 - vor dem Krieg im Unterricht, im Frühjahr 2011 in Homs. Viele syrische Flüchtlinge beschreiben Ähnliches: von Deutschland eingeflogen, untergebracht und dann weitgehend auf sich gestellt. Eine staatlich organisierte Übergangshilfe, bis die Flüchtlinge etwas Deutsch können, gibt es nicht. Manche haben Glück und lernen Arabischsprachige kennen, die ihnen freiwillig dolmetschen. Wer einem Landkreis zugeteilt wird, in dem wenige deutsche Araber leben, hat Pech. Ihre Entscheidung nach Deutschland zu kommen, bereut sie nicht Für das zweite Kontingent von 5000 Syrern, das Deutschland aufnimmt, ist das Zurechtkommen etwas leichter: Bevorzugt wurde eingeflogen, wer Verwandte in Deutschland hatte, die bereit waren zu unterstützen. Gleiches gilt für die rund 4500 syrischen Familienangehörigen, die über Länderkontingente einreisen konnten und deren Unterhalt von den Verwandten in Deutschland bezahlt wird. Doch darüber hinaus gibt es syrische Flüchtlinge außerhalb der Kontingente - rund 36.000 Menschen. Sie müssen in Deutschland vor allem erst einmal Asylverfahren durchlaufen. Umm Taufik sagt von sich, dass sie eine starke Frau sei und wer ihre Geschichte hört, zweifelt nicht daran: der Militärangriff auf ihren Vorort von Homs, die Leichen vor der Haustür, die Angst und die Wut. Die mühevolle Flucht mit ihrem Mann im Rollstuhl über Damaskus in den Libanon. Deutschland. \"Meine Entscheidung herzukommen, habe ich nicht bereut und werde es nie\", sagt Umm Taufik. Sie hat Träume für das neue Leben: eine größere Wohnung - ihren Mann will sie zu Hause pflegen, ein Auto - sie will den Führerschein machen, Arbeit - sie hofft auf eine Ausbildung zur Krankenschwester. \"Doch ohne die Sprache geht das alles nicht\", weiß sie.",http://www.spiegel.de/politik/ausland/syrische-fluechtlinge-sie-werden-weitgehend-auf-sich-gestellt-a-970215.html,2014-05-31T00:00:00.000Z
"US-Wahlkampf um Zuwanderung Grenzenlos enttäuscht von Obama Eine Multimedia-Reportage von Sebastian Fischer und Sandra Sperber , Texas Christian O. Bruch/ laif Sebastian Fischer Jahrgang 1978, geboren in Kassel. Studium der Politologie, Geschichte und Kommunikationswissenschaft an den Universitäten München und Göttingen. Ausbildung an der Deutschen Journalistenschule (DJS) in München. Ab Oktober 2006 München-Korrespondent von SPIEGEL ONLINE, seit Dezember 2009 im Berliner Büro. Von August 2011 bis Juli 2015 USA-Korrespondent in Washington. Seit Januar 2016 stellvertretender Ressortleiter im Politik-Ressort mit Sitz im Hauptstadtbüro, seit August 2017 Ressortleiter. E-Mail: Sebastian.Fischer@spiegel.de Twitter: @sefi99 folgen Facebook: Zum Profil google+: Zum Profil Instagram: Bilder ansehen Mehr Artikel von Sebastian Fischer Christian O. Bruch/ laif Sandra Sperber Geboren 1986, aufgewachsen in Nürnberg. Seit 2006 bei SPIEGEL TV in Berlin. Volontariat mit Kamera- und Schnittausbildung. Seit November 2009 Videoredakteurin bei SPIEGEL ONLINE. Ab 2011 als VJ vier Jahre lang in Washington D.C.. Seit Juli 2015 Reporterin im Hauptstadtbüro. E-Mail: Sandra.Sperber@spiegel.de Twitter: @SperberS folgen Facebook: Zum Profil google+: Zum Profil Instagram: Bilder ansehen Blog: http://www.webvideoblog.de Mehr Artikel von Sandra Sperber Obamas Grenzen Er hat die Einwanderungsreform aufgeschoben, Latinos verärgert und ein Sicherheitsproblem an der Südgrenze: Jetzt droht US-Präsident Obama und seinen Demokraten der Verlust ihrer Mehrheit im Senat. Eine Multimedia-Reportage von Sebastian Fischer und Sandra Sperber , Texas Als Barack Obama gerade wieder mal verspricht, dass er den Kampf nicht aufgeben wird, dass er das Ding durchziehen will, da kommen die Zwischenrufe: \"Wir brauchen Hilfe, jetzt!\" Ja, er verstehe ihre tiefe Frustration, sagt der US-Präsident. Er teile sie. Auch Obama braucht Hilfe. Am 4. November sind Kongresswahlen in den USA , kommenden Dienstag. Wahlen, die darüber entscheiden werden, was der 44. Präsident in den verbleibenden beiden Jahren seiner Amtszeit noch erreichen kann. Es sieht nicht gut aus. Umfragen zufolge droht den Demokraten der Verlust ihrer Mehrheit im Senat; das Repräsentantenhaus wurde schon 2010 von den Republikanern erobert, an deren Mehrheit dort wird sich wohl nichts ändern. Obama stößt an seine Grenzen. Video AFP Als der Zwischenfall mit den Zwischenrufern passiert, ist es Anfang Oktober. In einer Messehalle in der Hauptstadt Washington spricht der Präsident vor Latino-Abgeordneten der demokratischen Fraktion und einflussreichen Unterstützern. Obama betreibt an diesem Abend politische Selbstverteidigung. Nach sechs Jahren im Amt hat er eines seiner entscheidenden Versprechen noch immer nicht erfüllt: ein neues Einwanderungsgesetz. Das Versprechen, den elf Millionen illegal Eingewanderten im Land eine Perspektive auf die US-Staatsbürgerschaft zu eröffnen. Zweimal haben die Latinos Obama zur Präsidentschaft getragen: 2008 mit 67 Prozent ihrer Stimmen, 2012 gar mit 71 Prozent. Keine Wählergruppe in Amerika wächst so schnell wie die hispanische. Obama braucht sie im November, unbedingt. Es geht um 25 Millionen mögliche Wähler. Doch sie sind schwer zu mobilisieren, 2012 ging nicht mal jeder Zweite zur Wahl. \"Yes, we can!\", ruft also Obama in Washington seinen alten Wahlkampfschlager in die Messehalle und klebt hinten dran: \"...wenn wir wählen gehen!\" Er sagt das zur Sicherheit auch noch mal auf Spanisch. Wie durch ein Brennglas bündeln sich Amerikas gegenwärtige Gegensätze und Debatten im Kampf um die Einwanderungsreform und die Sicherheit der Grenze zu Mexiko: die Polarisierung der politischen Lager, der Kampf um den American Dream einer Nation von Immigranten, der demografische Wandel, der die USA voraussichtlich um das Jahr 2040 herum zum multikulturellsten aller Länder dieser Welt machen wird, wenn die Weißen ihre Mehrheit verlieren. Sechs Jahre regiert Barack Obama jetzt im Weißen Haus. Welche politischen Signale hat er gesetzt? Einerseits hat der Präsident per Exekutivanordnung mehr als einer halben Million Einwanderern ein Bleiberecht eingeräumt, die als Kinder oder Jugendliche illegal in die USA gekommen sind. Andererseits hat er bisher rund zwei Millionen illegal Eingewanderte abschieben lassen. \"Deporter-in-Chief\" nennen ihn deshalb die Enttäuschten. Einerseits hatte Obama angekündigt, der parlamentarischen Dauerblockade der Republikaner noch vor der Wahl in diesem November weitere Verordnungen entgegenzustellen. Andererseits hat er das nun auf die Zeit nach der Wahl verschoben; Ende des Jahres ist wohl mit Exekutivanordnungen zu rechnen, die illegalen Einwanderern einen besseren Status zu geben suchen. Sandra Sperber Henry Cuellar ist Demokrat, aber Obama-Kritiker. Doch Obamas Zeit läuft ab. \"Entweder der Präsident macht das\", sagt Henry Cuellar, \"oder er hat sein Versprechen gebrochen.\" Cuellar ist der Kongressabgeordnete des 28. texanischen Distrikts, an der Grenze.   Im Sommer hat er einen offenen Brief an den Präsidenten geschrieben, als täglich die \"Border Crisis\" in den Schlagzeilen war; als binnen weniger Monate mehr als 50.000 Kinder an der Grenze aufgegriffen wurden, die von ihren Eltern in Guatemala, Honduras oder El Salvador allein auf die lebensgefährliche Reise ins vermeintlich gelobte Land geschickt wurden. Cuellar bat Obama, der damals ohnehin in Texas war, um einen Abstecher an die Grenze. Als Symbol. Bush hat das gemacht, Clinton auch. Der aktuelle Präsident ist nicht gekommen. Und Henry Cuellar, der Abgeordnete aus der Grenzstadt Laredo, die in ihrer Geschichte mal zu Mexiko gehörte, mal zu den USA, hat keine Antwort erhalten. Bis heute nicht. Panorama-Foto aus Laredo: Der Rio Grande als Grenze Bewegen Sie mit der Maus den Bildausschnitt \"Die US-Öffentlichkeit bekam im Sommer den Eindruck von Chaos an der Grenze\", sagt Cuellar. Plötzlich wollten alle über Grenzsicherheit reden, aber nicht mehr über die Einwanderungsreform. Im Juli sprachen Umfragen zufolge zwei Drittel der US-Bürger Obama das Misstrauen in dieser Frage aus. Die Situation an der Südgrenze rückte in der Prioritätenliste der älteren, weißen Wähler nach oben. Und diese Gruppe ist bekannt dafür, ihr Wahlrecht zu nutzen. Obama hat seitdem das doppelte Problem: enttäuschte Latinos und mobilisierte Republikaner-Anhänger.   Die Idee einer grundlegenden Einwanderungsreform jenseits von Exekutivanordnungen scheint er ohnehin aufgegeben zu haben, seitdem ein gemeinsamer Vorstoß von republikanischen und demokratischen Senatoren gescheitert ist. Im Jahr 2013 wurde zwar ein Kompromiss geschlossen und sogar ein Reformgesetz in der oberen Kongresskammer beschlossen - doch bis heute verweigert das republikanisch dominierte Repräsentantenhaus eine Abstimmung darüber. Daran wird sich nach der Wahl nächste Woche aller Voraussicht nach nichts ändern. Der Kompromiss im Einzelnen: vorläufige Aufenthaltsgenehmigung für die elf Millionen illegalen Immigranten, die im Gegenzug eine Strafzahlung akzeptieren und Steuern nachzahlen müssen, dauerhafte Aufenthaltsgenehmigung nach zehn Jahren, wenn Sprachkenntnisse und Arbeit nachgewiesen werden können, danach möglicherweise US-Staatsbürgerschaft, die Grenztruppen sollten auf 40.000 Mann verdoppelt und mehr als tausend Kilometer zusätzlicher Zaun gebaut werden. Im Klartext: Legalität für die Illegalen einerseits; Grenze dicht andererseits, um weitere illegale Einwanderung zu minimieren. Mehr als 3000 Kilometer zieht sich die Grenze zwischen Mexiko und den USA durch Wüsten, Steppen, Städte. Mal kerzengerade, mal in Schlangenlinien. Im letzten Jahr wurden knapp 415.000 illegale Grenzübertreter festgenommen, insgesamt deutlich weniger als noch vor zehn Jahren. Ein Drittel der Grenze ist mit Zäunen gesichert, hauptsächlich im Westen der USA, im Osten fließt der Rio Grande. Viele Republikaner wollen auch hier einen Zaun bauen. Der Abgeordnete Henry Cuellar in seinem schweren braunen Ledersessel mit texanischem Wappen oben an der Lehne verdreht die Augen. Zaun? \"Das ist doch eine Lösung aus dem 14. Jahrhundert.\" In Laredo jedenfalls haben sie nur ein paar Meter Zaun gebaut. Cuellar setzt eher auf Technologie, zum Beispiel Drohnen zur Luftüberwachung. Sein Bruder Martin sieht das ähnlich. Martin Cuellar ist der Sheriff von Laredo. Video Sandra Sperber Von Laredo aus betrachtet, ist die Hauptstadt Washington weit weg. Wie jener Morgen im März 2009, an den sich der Abgeordnete Henry Cuellar jetzt erinnert. Es ist eine Erinnerung an die vertane Chance. Damals empfing Obama ihn und seine Kollegen aus dem hispanischen Club im Bankettsaal des Weißen Hauses. Weil die Demokraten damals sowohl Repräsentantenhaus als auch Senat hielten, schien die Einwanderungsreform zum Greifen nah. \"Wir haben gesagt: 'Mr. President, lassen Sie uns die Reform jetzt machen, wir kontrollieren den Kongress, wir haben die Präsidentschaft'\", erzählt Cuellar. Aber Obama habe gesagt, er sei gerade sehr beschäftigt, die Gesundheitsreform und so weiter: \"Wir machen das mit der Einwanderung später.\" Ja, so habe der Präsident das gesagt, erinnert sich Cuellar. \"Und dann haben wir die Mehrheit im Kongress verloren.\" Deshalb bleiben Obama heute ohne Kompromiss mit den Republikanern allein die Exekutivanordnungen. Die aber hätten keine Garantie, seine Präsidentschaft zu überdauern. Jeder Nachfolger kann die Regelungen mit einem Federstrich außer Kraft setzen. Obamas Grenzen Traum oder Tod Nicht Willkommen Sebastian Fischer und Sandra Sperber berichten seit 2011 für SPIEGEL ONLINE aus den USA. Beide leben als Korrespondenten in der Hauptstadt Washington D.C..",http://www.spiegel.de/politik/ausland/kongresswahl-in-usa-obama-veraergert-latinos-demokraten-in-not-a-998925.html,2014-10-29T00:00:00.000Z
