article,article_url,date
"Landtagswahlen Drei Thesen zum Super-Wahlsonntag Regiert Kretschmann in Baden-Württemberg weiter? Wer liegt in Rheinland-Pfalz vorn? Wie stark wird die AfD in Sachsen-Anhalt? Bis 18 Uhr kann gewählt werden - doch drei Erkenntnisse gibt es bereits. Von Florian Gathmann Christian O. Bruch / laif Florian Gathmann 1975 in Göppingen geboren, studierte in Konstanz Verwaltungswissenschaft und an der Rutgers University in den USA Politikwissenschaften (M.A.). Ab 2001 Volontariat bei der \"Thüringer Allgemeine\" in Erfurt, danach Pauschalist und ab 2005 Politik-Redakteur. Im Sommer 2006 Arthur F. Burns-Fellow bei der \"Chicago Tribune\" in Washington und Chicago. Seit Mai 2007 Redakteur bei SPIEGEL ONLINE im Ressort Politik, seit Januar 2009 in der Berliner Redaktionsvertretung. Teilnehmer des Journalism Program for German and American Journalists der Robert-Bosch-Stiftung. E-Mail: Florian.Gathmann@spiegel.de Twitter: @FlorianGathmann folgen Mehr Artikel von Florian Gathmann Dieser Super-Wahlsonntag ist superspannend. Völlig unklar, wie es am Ende ausgeht. \"Too close to call\", sagt man in solchen Fällen in den USA - und so ist auch die Lage bei den Landtagswahlen in Baden-Württemberg, Rheinland-Pfalz und Sachsen-Anhalt. Liegen die baden-württembergischen Grünen mit Winfried Kretschmann , wie in den letzten Umfragen prognostiziert, am Ende tatsächlich vor der CDU im einstigen schwarzen Stammland ? An Rhein und Mosel ist dagegen die Frage, ob die Aufholjagd von SPD-Ministerpräsidentin Malu Dreyer gegenüber ihrer CDU -Herausforderin Julia Klöckner erfolgreich ist. Die letzte Umfrage sah die Sozialdemokratin vorn . Die Grünen wiederum müssen sogar bangen, ob sie die Fünf-Prozent-Hürde in Mainz überspringen. Und liegt die AfD in Sachsen-Anhalt am Ende wirklich vor der SPD? Es ist auch deshalb so spannend, weil Wahlforscher in allen drei Ländern noch eine hohe Zahl von Unentschiedenen ausgemacht haben. Deshalb lohnt es sich für die Parteien diesmal besonders, bis zur letzten Minute um die Stimmen der insgesamt rund 12,7 Millionen Wahlberechtigten zu werben. Es könnte spät werden am Sonntag, bis man in allen drei Ländern Genaueres weiß. Dennoch zeichnen sich bereits jetzt drei Entwicklungen ab: 1. Merkel bleibt uns erst mal erhalten Für CDU-Chefin Angela Merkel wird es wohl kein entspannter Sonntag: Ihre Partei wäre in Baden-Württemberg inzwischen froh, wenn sie mit dem Spitzenkandidaten Guido Wolf noch 30 Prozent erreicht. Einiges spricht sogar dafür, dass die CDU zum ersten Mal in der Geschichte des Bundeslandes nicht als stärkste Partei aus einer Wahl hervorgeht - und dann auch noch hinter den Grünen liegt. In Rheinland-Pfalz wiederum sieht es so aus, als könnte Merkels Parteifreundin Klöckner scheitern, nachdem die CDU noch vor wenigen Monaten bis zu elf Prozentpunkte vor der in Mainz regierenden SPD lag. Selbst in Sachsen-Anhalt wird es für die CDU wenig Grund zum Jubeln geben: Ministerpräsident Reiner Haseloff dürfte ein ordentliches Ergebnis schaffen - allerdings könnte er angesichts der Schwäche seines bisherigen Koalitionspartners SPD Mühe haben, überhaupt ein Regierungsbündnis zustande zu bekommen. Dennoch: Merkel wird weder als Kanzlerin noch als Parteichefin wackeln. Ja, die Kritik aus der CDU an Merkels Flüchtlingspolitik dürfte lauter werden, erst recht aus der CSU . Aber gleichzeitig wird im Falle von Niederlagen in Mainz und Stuttgart der Spin der Merkelianer in Richtung Wolf und Klöckner gehen: selbst schuld. Vor allem aber ist sogar den größten Merkel-Kritikern in der CDU klar, dass die Kanzlerin nach wie vor das größte Pfund der Partei darstellt - trotz der Flüchtlingskrise. Deshalb wird man auch in Zukunft auf Merkel als Kanzlerin und CDU-Chefin setzen. 2. Die AfD ist endgültig da Mancher vergleicht die AfD ja immer noch mit der Piratenpartei. Eine Partei also, die schnell wieder verschwindet. Der Vergleich ist schon deshalb Unsinn, weil die Piraten eine urdemokratische Vorstellung von Politik haben, was man von der AfD nun wirklich nicht behaupten kann. Vor allem aber ist die AfD eine rechtspopulistische Anti-Eliten-Partei, der die Flüchtlingskrise zwar besonders zupass kommt - aber sie ist mitnichten abhängig von diesem Thema. Die AfD wird deshalb so schnell nicht wieder verschwinden. Denn sie nimmt die Unzufriedenheit eines Teils der Bevölkerung mit \"denen da oben\" geschickt auf. Nach diesem Sonntag wird die Partei in drei weiteren Länderparlamenten vertreten sein, insgesamt dann in acht. Und schon in Berlin und Mecklenburg-Vorpommern dürfte sie im Herbst weitere Sitze erobern, im Jahr darauf kann sie sich auch in Nordrhein-Westfalen und bei der Bundestagswahl gute Chancen ausrechnen. Wo immer die AfD in einem Parlament sitzt, erschwert sie das Regieren, weil die Mehrheitsbildung komplizierter wird. Und sie verschärft die Debatten. Aber wird die AfD auch zur Lösung politischer Probleme beitragen? Als reine Protestpartei dürfte sie es auf Dauer schwer haben. 3. Die Volksparteien verblassen Die SPD in Sachsen-Anhalt? Wäre froh, wenn sie 15 Prozent erreicht - wahrscheinlich liegt am Ende sogar die AfD vor den Sozialdemokraten. In Baden-Württemberg gibt es diese Sorge bei den Genossen ebenfalls, viel mehr als 15 Prozent sind angesichts der Umfragen auch hier nicht zu erwarten. Volkspartei? Davon kann angesichts solcher Zahlen keine Rede sein - selbst für den Fall, dass die SPD in Rheinland-Pfalz weiter regieren darf . Und auch für die CDU müsste ihr wahrscheinliches Ergebnis von unter 30 Prozent in Baden-Württemberg ein Warnsignal sein. CDU und SPD verlieren an Integrationskraft, das zeigen die Landtagswahlen. Und das liegt nicht nur an der Flüchtlingskrise und dem Erstarken der AfD. Was den geschrumpften Volksparteien helfen würde? Zum Beispiel auffälligere, mitunter kantigere Spitzenkandidaten. Das zeigen ihnen im Südwesten ausgerechnet die Grünen mit Kretschmann.",http://www.spiegel.de/politik/deutschland/landtagswahlen-drei-thesen-zum-supersonntag-a-1081770.html,2016-03-13T00:00:00.000Z
"Flüchtlingskrise Österreichs Außenminister fordert weitere Grenzschließungen Die Balkanroute ist dicht. Jetzt setzt sich der österreichische Außenminister Kurz für weitere Grenzschließungen ein, um Flüchtlinge aus Mitteleuropa fernzuhalten. Österreichs Außenminister Sebastian Kurz verteidigt die Schließung der Balkanroute . In einem Interview fordert er weitere Grenzschließungen in Europa , um neue Routen zu verhindern. \"Schlepperei lässt sich nicht ganz verhindern. Wir werden daher alles, was wir jetzt an der Westbalkanroute tun, auch entlang der Italien -Mittelmeer-Route tun müssen, damit klar ist, die Zeit des Durchwinkens der Flüchtlinge nach Mitteleuropa ist vorbei - egal auf welcher Route\", sagte der ÖVP -Politiker der \"Bild am Sonntag\". Der Außenminister kritisierte die bisherige Politik scharf: \"Wir mussten aufhören, jeden Flüchtling, der in Griechenland ankommt, staatlich organisiert nach Mitteleuropa zu transportieren. Damit haben wir zwar den Wünschen der Flüchtlinge entsprochen, was menschlich nachvollziehbar war. Wir haben aber auch dafür gesorgt, dass sich immer mehr Flüchtlinge auf den Weg gemacht haben. Es war richtig, das mit dem Schließen der Balkanroute zu beenden.\" Aus seiner Sicht müssen die Grenzen geschlossen bleiben. Sie könnten erst wieder aufgehen, \"wenn der Flüchtlingszustrom nach Europa abgeebbt ist\". Die EU muss nach Kurz' Worten Mazedonien bei der Grenzsicherung helfen. \"Die Mazedonier übernehmen für uns die schwierige Aufgabe, den Zustrom zu stoppen, so lange Griechenland das nicht tut. Mazedonien braucht unsere Hilfe in Form von Personal und Ausrüstung.\"",http://www.spiegel.de/politik/ausland/fluechtlinge-oesterreichs-aussenminister-fordert-weitere-grenzschliessungen-a-1082028.html,2016-03-13T00:00:00.000Z
"Computerspiel \"Inside\" Retten Sie diesen Jungen Der Tod ist ein ständiger Begleiter in \"Inside\". Mal kommt er als Wachhund, mal als Schallwelle. Er ist Warnung und Wegweiser in diesem düsteren Spiel, das ohne Worte viele Geschichten erzählt. Von Carsten Görig Carsten Görig Mehr Artikel von Carsten Görig Hinweis: In diesem Text sind Stellen, die als Spoiler aufgefasst werden können. \"Inside\" ist das zweite Spiel des kleinen dänischen Studios Playdead. Das erste Spiel \"Limbo\" war ein Überraschungserfolg, überzeugte Spieler und Kritiker und wurde mit Preisen überhäuft. \"Limbo\" war nicht nur spielerisch, sondern auch ästhetisch herausragend. Monochrom mit wenigen Details aber einer starken Stilisierung setzte es sich von anderen Spielen ab und war damit eine Art Blaupause für \"Inside\". Und der Nachfolger ist noch besser. Nicht nur, weil es bleiche Farbmomente in die Grafik bringt, die eine morbide Umgebung noch unheimlicher machen. Es ist das Werk eines Studios, das seine Werkzeuge meisterhaft beherrscht, ausgearbeitet, fehlerfrei, aus einem Guss. Das Spielprinzip ist schnell erklärt: Ein kleiner Junge wird seitwärts durch die Level gesteuert, manchmal geht es darum, Fallen und Verfolgern auszuweichen, manchmal müssen Puzzles gelöst werden, manchmal wird beides kombiniert. Wer scheitert, sieht den Jungen sterben, oft grausam. Weiter geht es beim letzten Speicherpunkt, der nie weit zurück liegt. Das Sterben gibt Hinweise auf die Lösung der Rätsel, zeigt, wie man es schaffen kann. \"Inside\" verbindet Logik mit Reaktion und dem richtigen Timing. Immer perfekt abgestimmt, immer so, dass man es schaffen kann, gerade so, im letzten Moment. Das Menschenbild von \"Inside\" ist niederschmetternd Das Sterben bringt allerdings auch immer eine wichtige, eine drängende Note ins Spiel. Wenn Hunde den Jungen verfolgen, will man es schaffen. Wenn Verfolger mit Lieferwagen ankommen und mit Taschenlampen die Gegend absuchen, will man den Jungen an ihnen vorbei lotsen. Wie kaum ein anderes Spiel lässt \"Inside\" Spieler hoffen und zittern und schließlich tief durchatmen, wenn sie eine Hürde geschafft haben. Das Spiel nimmt viele Leben und macht dabei den Tod doch bedeutsam. Von Beginn an wird das Spiel immer bizarrer, driftet in Albträume ab, die die Welt buchstäblich auf den Kopf stellen und nutzt das, um gleich noch neue Spielideen einzuführen, Puzzles sinnvoll-absurd weiterzudenken. \"Inside\" hat dabei keine Erzählung, die allgemeingültig ist, es arbeitet mit Bildern und Stimmungen, um im Kopf des Spielers zu wirken. Das Spiel verliert keine Worte, verrät keine Motive, nimmt keine Stellung zu Ideologien und Ideen. Eigentlich. Gleichzeitig aber ist es voller Andeutungen, voller Bilder, die man für sich deuten kann und die sich mit dem verbinden, was man über die Grausamkeiten der Welt gelernt hat. Schon am Anfang schafft es \"Inside\" mit einem einfachen Lastwagen, in dessen offenen Container man noch Menschen sieht, Assoziationen zwischen Flucht, Deportation und Tod im Laster zu erwecken und vor allem mit Gefühlen zu füllen. Jeder Level, jedes Bild, jeder Ton, jede Stille in \"Inside\" ist aufgeladen mit Bedeutung. Das Spiel schafft es, Bilder von Krieg, Vernichtung, Unterdrückung zu erzeugen. Man meint, Spuren von \"1984\" zu finden, von Konzentrationslagern, toten Flüchtlingskindern am Strand, Menschenversuchen. Das Menschenbild von \"Inside\" ist niederschmetternd, Grausamkeit siegt, die Flucht aus all dem Bösen scheint hoffnungslos. Bis das Spiel kurz vor Schluss in einem letzten Aufbäumen zur Groteske wird, es sich in einem bizarren Akt gegen die Unmenschlichkeit aufbäumt, um schließlich Ruhe zu finden. \"Inside\" von Playdead , für Xbox One und PC, Download für 19,99 Euro",http://www.spiegel.de/netzwelt/games/computerspiel-inside-retten-sie-diesen-jungen-a-1102061.html,2016-07-11T00:00:00.000Z
"S.P.O.N. - Der Schwarze Kanal Rückkehr des schwachen Geschlechts Das neue Sexualstrafrecht ist ein Dokument der Regression: An die Stelle der selbstbewussten Frau tritt das arme Hascherl, das den Mann grundsätzlich als Bedrohung erlebt. Eine Kolumne von Jan Fleischhauer Getty Images Die Frau als armes Hascherl - waren wir nicht schon mal weiter? Kolumne Der Bundestag hat am vergangenen Donnerstag ein Gesetz auf den Weg gebracht , das man als erste große Reform der Post-Willkommenskultur-Ära verstehen muss. Künftig macht sich nicht nur strafbar, wer einen anderen unsittlich berührt: Um belangt zu werden, reicht es, dass man einer Gruppe angehört, aus der heraus sexuelle Übergriffe geschehen. Die wichtigste Neuerung, die wir den Flüchtlingen in diesem Jahr verdanken, ist ausgerechnet eine Novellierung des Sexualstrafrechts . Mehr dazu im SPIEGEL Heft 28/2016 Urlaub in Angst Terror verändert das Reisen. Was also tun? Digitale Ausgabe | Gedruckte Ausgabe | Apps | Abo In vielen Kommentaren wird das Gesetzespaket, das die Fraktionen von CDU/CSU und SPD verabschiedet haben, als Meilenstein gefeiert. Der \"Köln-Paragraf\" ist vielen Befürwortern verständlicherweise eher unangenehm, diese Premiere fällt in der Betrachtung meist unter den Tisch. Aber es ist kein Versehen, dass zusätzlich zu der Neufassung des Vergewaltigungsparagrafen das Grabschen einzeln oder in Gruppen in den Katalog der Delikte aufgenommen wurde. Es zeigt den Willen der Koalition, Frauen besser vor Männern zu schützen. \"Nein heißt Nein\" bedeutet mehr als die Forderung, eine scheinbare Selbstverständlichkeit im Geschlechtsverkehr gesetzlich so zu regeln, dass niemand sich mehr auf ein Missverständnis herausreden kann. Der Slogan der Reformbefürworter ist als eine Art Zauberformel gemeint, mit der sich endlich der juristische Weg abkürzen lässt, der viele davon abhält, überhaupt Anzeige zu erstatten. Magie funktioniert aber unter den Bedingungen des Rechtsstaats nur schlecht, es sei denn, man misst dem Wort des oder der Geschädigten magische Beweiskraft zu. Auch in Zukunft wird das Opfer eine Strafanzeige stellen müssen, in der es den Tathergang schildert. Ihm wird weiterhin zugemutet werden, sich einer Beweissicherung zu unterziehen, der Entnahme von Samen oder anderen Körperflüssigkeiten, der Dokumentation von Schürfwunden. Das alles ist für das Opfer, das gerade eine traumatische Situation durchlitten hat, sehr belastend. Aber auch bei anderen Straftaten, einem schweren Raub oder einem versuchten Totschlag etwa, verzichten die Ermittler nicht auf die Sicherung von Spuren. Der Bundesrichter Thomas Fischer, der als ein vehementer Kritiker der Reform aufgetreten ist, hat darauf hingewiesen, dass viele Erwartungen an das neue Gesetz der Unkenntnis der geltenden Rechtslage geschuldet sind . Wenn eine Frau sich nicht wehrt, weil sie sich vor Gewalteinwirkung fürchtet, sind ihre Chancen, später vor Gericht Recht zu bekommen, nach dem geltenden Recht nicht schlechter als nach dem neuen. Sie muss auch bislang nicht schreien, um als Vergewaltigungsopfer anerkannt zu werden. Sie muss nicht kratzen oder beißen oder davon zu laufen versuchen. Es kann für eine Verurteilung völlig ausreichen, dass aus dem Verhalten des Täters erkennbar war, dass er bei Gegenwehr zu Gewalt gegriffen hätte. Kaum jemand wählt die geschlechtsneutrale Form Fischer ist ein großer Polemiker, aber das bedeutet nicht, dass er ein schlechter Jurist ist. Zu der Hoffnung, dass ein Aussprechen des Wortes \"Nein\" den quälenden Prozess der gesetzlichen Aufklärung beschleunigen oder gar ersetzen könnte, hat er eine eindeutige Meinung: \"Handelt es sich um eine 'offene', ersichtlich nicht von Nötigungshandlungen getragene Situation, wird man selbstverständlich auch weiterhin das 'Tatopfer' fragen müssen, warum es einerseits 'nein' gesagt hat, anderseits aber getan hat, was der oder die Täter(in) verlangte.\" Umgekehrt relativiert sich damit übrigens auch die Angst, die Gesetzesnovelle werde eine Flut von Falschbeschuldigungen und dementsprechenden Strafverfahren auslösen: Wer eine sexuelle Begegnung im Nachhinein als Vergewaltigung ausgibt, hat es in Zukunft nicht leichter als heute. Es ist verblüffend, mit welcher Selbstverständlichkeit Männern die Rolle des Täters und Frauen die des Opfers zugewiesen wird. Kaum ein Kommentar, der sich die Mühe machte, eine geschlechtsneutrale Form zu wählen, die deutlich machen würde, dass andere Konstellationen denkbar wären. Auch Leute, die ansonsten nicht müde werden, die flirrende Ambivalenz der Beziehungen zu betonen und bei Facebook unter 60 Geschlechtern wählen, denken offensichtlich ganz traditionell, wenn es um Sexualdelikte geht. Man muss sich nicht besonders anstrengen, um in dem Gesetzespaket das Dokument einer merkwürdigen Regression zu sehen. Die Frau, die ihre sexuellen Interessen aggressiv verfolgt, scheint aus der öffentlichen Wahrnehmung getilgt. An ihrer Stelle ist das Hascherl getreten, das sich als Objekt männlicher Triebhaftigkeit empfindet, und den aufgezwungenen Akt im Zweifel unter stillem Weinen erträgt. Dem Staat kommt in diesem Setting die Rolle der patriarchalen Instanz zu, der die Aufsicht über die Schutzbefohlenen zufällt. \"Unangenehm ist das von Feministinnen ins Feld geführte Argument, hier werde das Klischee der schwachen Frau, die das Begehren des Mannes grundsätzlich als Bedrohung empfindet, endgültig festgeschrieben. Da ist leider was dran\", hat die kluge Tanja Rest in einem Kommentar für die \"Süddeutsche Zeitung\" geschrieben . \"Weibliche Lust wurde zuletzt immer häufiger als etwas Aktives und Selbstbestimmtes wahrgenommen - nun stehen Frauen wieder als schützenswerte Wesen da, die ewig nicht wollen.\" Rest vergleicht die Verschärfung des Sexualstrafrechts mit der Quote, die nicht schön, aber leider notwendig sei. Das mag sein. Mit Blick auf das Frauenbild, das das Klischee vom schwachen Geschlecht wiederbelebt, stellt sich dennoch die Frage: Waren wir nicht schon einmal weiter?",http://www.spiegel.de/politik/deutschland/sexualstrafrecht-rueckkehr-des-schwachen-geschlechts-kolumne-a-1102387.html,2016-07-11T00:00:00.000Z
"Lead-Awards-Abstimmung Wählen Sie Ihr Foto des Jahres Eine Momentaufnahme aus der Flüchtlingskrise? Oder doch ein künstlerisches Nacktfoto? Welches Bild ist das beste der vergangenen zwölf Monate? Entscheiden Sie mit beim Lead-Awards-Publikumspreis. Es geht um das Beste, was in den letzten zwölf Monaten in Deutschland publiziert wurde: Seit 1993 prämiert die Jury der Lead Academy Fotoserien, Magazinstrecken, Zeitungsbeiträge, Werbekampagnen und Websites. Und in der Fotokategorie darf das Publikum mitentscheiden: Wählen Sie aus 50 nominierten Arbeiten das Foto des Jahres aus. Die Auswahl ist vielfältig: Ein Schwerpunkt liegt auf Reportagefotos aus den Krisengebieten der Welt. Einen Kontrapunkt dazu bilden Bilder, die sich still, aber dennoch intensiv mit privaten Momenten befassen. Alle nominierten Werke werden im Haus der Photographie in Hamburg präsentiert, in der Ausstellung \"Visual Leader 2016\", die noch bis zum 30. Oktober läuft. Die Preisträger der Lead Awards werden am 10. Oktober bekannt gegeben. Helfen Sie mit, die Sieger in der Publikumskategorie zu finden. Hier die nominierten Fotografien, vergeben Sie bis zu fünf Sterne pro Bild. Zusätzliche Informationen zu der jeweiligen Aufnahme finden Sie beim Klick auf das \"i\"-Symbol.",http://www.spiegel.de/kultur/gesellschaft/lead-awards-2016-waehlen-sie-ihr-foto-des-jahres-a-1110347.html,2016-09-06T00:00:00.000Z
"US-Wahl FBI veröffentlicht alte Untersuchung zu Bill Clinton Das FBI fährt Hillary Clinton erneut in die Parade. Es geht um einen Gnadenerlass ihres Mannes, als der noch Präsident war - und gleichzeitig um viel Geld aus dem Umfeld des Begnadigten. US-Wahl 2016 Alle Artikel Sechs Tage vor der US-Wahl hat das FBI mit einer neuen Veröffentlichung für Schlagzeilen gesorgt. Diesmal geht es allerdings nicht um E-Mails und Hillary Clinton (mehr zu dieser Affäre lesen Sie hier) - sondern um einen 17 Jahre alten Gnadenerlass, den Bill Clinton am 20. Januar 2001 unterzeichnete, an seinem letzten Tag als US-Präsident. Der 129 Seiten lange Bericht zu der 2005 abgeschlossenen Untersuchung sei online, schrieb das FBI via Twitter. Dabei ging es um den umstrittenen Gnadenerlass für den Börsenmakler Marc Rich. Der Steuerflüchtling hatte sich in die Schweiz abgesetzt und war vom FBI gesucht worden. Die Amnestie löste Argwohn aus, weil Richs Ex-Frau zuvor großzügige Spenden an die Clintons und die Demokratische Partei überwiesen hatte. Bei der Begnadigung seien \"offenbar die Standards und Verfahren für Amnestien nicht eingehalten worden\", heißt es in den FBI-Unterlagen. Marc Rich starb im Juni 2013, hier lesen Sie einen Nachruf auf den \"King of Oil\" . Der für Hillary Clinton denkbar ungünstige Zeitpunkt der Veröffentlichung des Berichts löste Kritik aus ihrem Lager aus. Sollte es sich nicht um eine Verjährungsfrist gemäß dem Gesetz zur Informationsfreiheit handeln, sei der Vorgang doch \"seltsam\", sagte ihr Sprecher Brian Fallon. Das FBI veröffentlichte eine Mitteilung zu dem Fall und schreibt darin unter anderem, die Unterlagen seien bearbeitet worden und \"gemäß der Standardprozedur automatisch und elektronisch veröffentlicht worden\", weil es dazu Anfragen unter dem Informationsfreiheitsgesetz gegeben habe. Es ist bereits das zweite Mal binnen einer Woche, dass das FBI Informationen zu den Clintons veröffentlicht. Am vergangen Freitag hatte Behördenchef James Comey dem Kongress mitgeteilt, dass seine Fahnder erneut auf E-Mails gestoßen seien, die für die Ermittlungen der Affäre rund um den privaten Server von Hillary Clinton \"relevant\" sein könnten. Diese E-Mails würden nun daraufhin untersucht, ob sie geheimes Material beinhalteten und wie bedeutend sie für den Fall von Hillary Clinton sein könnten. Für diesen Schritt wurde Comey sowohl von Clintons Team, aber auch intern kritisiert. Auch das Justizministerium zeigte sich irritiert ob des Schritts. Bevor der FBI-Chef am Freitagvormittag den Kongress über möglicherweise relevante E-Mails informierte, rieten Anwälte des Ministeriums Comey dazu, den Fall zunächst intern zu klären. Es sei langjährige Praxis, laufende Ermittlungen nicht zu kommentieren. Alle aktuellen Entwicklungen zur US-Präsidentschaftswahl finden Sie hier im Newsblog .",http://www.spiegel.de/politik/ausland/us-wahl-fbi-veroeffentlicht-alte-untersuchung-zu-bill-clinton-a-1119293.html,2016-11-02T00:00:00.000Z
