article,article_url,date
"Süd-Sieg in Schultest Wir können alles - sogar Hochdeutsch Baden-Württemberg und Bayern bekommen die besten Noten in Deutsch - und in den Fremdsprachen gleich dazu. Ein neuer Schultest unter Neuntklässlern zeigt ein riesiges Gefälle von Süd nach Nord, West nach Ost. Aber auch in den Siegerländern hapert es. SPIEGEL ONLINE nennt die vier zentralen Probleme. Von Jochen Leffers Christian O. Bruch/ laif Jochen Leffers Jahrgang 1965. Ex-Chefredakteur eines bundesweiten Hochschulmagazins, Studium der Publizistik, Geschichte, Politik in Münster und Bochum (Abbruch aus Neigung und Überzeugung). Zehn Jahre lang freier Journalist für die \"Süddeutsche Zeitung\", \"Die Woche\", \"Die Zeit\", den WDR und viele andere. Seit Januar 2001 bei SPIEGEL ONLINE, Ressortleiter UniSPIEGEL und SchulSPIEGEL, ab 2011 KarriereSPIEGEL. Seit Oktober 2015 Ressortleiter bei einestages. E-Mail: Jochen.Leffers@spiegel.de Twitter: @joleffers folgen Mehr Artikel von Jochen Leffers \"Wir können alles - außer Hochdeutsch\": Der baden-württembergische Wahlspruch wird in einem neuen nationalen Bildungstest Lügen gestraft. Wie bei den Pisa-Studien können sich das Bundesland im Südwesten und Bayern schon wieder als Gewinner fühlen. Beide haben im neuen nationalen Neuntklässler-Schultest für Deutsch und Fremdsprachen die Spitzenplätze geholt. Auch Rheinland-Pfalz und Sachsen konnten punkten. Bremen und Brandenburg schnitten durchweg schlecht ab. Dazwischen liegt das Mittelfeld. Der Test zeigt, wie groß die Bildungskluft zwischen den einzelnen Ländern ist. Die Leistungsunterschiede in den getesteten Fächern machen bis zu anderthalb Schuljahre aus. In Deutsch liegen die beiden südlichen Bundesländer klar vor dem Norden. Beim Lese- und Hörverständnis in Englisch sammeln sich alle östlichen Bundesländer in der unteren Tabellenhälfte - mit teils gewaltigem Abstand. Deutschlands Kultusminister haben die Studie \"Sprachliche Kompetenzen im Ländervergleich\" beim Berliner Institut zur Qualitätsentwicklung im Bildungswesen in Auftrag gegeben. Geprüft wurden die Leistungen von 41.000 Neuntklässlern in Deutsch und der ersten Fremdsprache. Die Untersuchung beruht erstmals auf den bundesweit entwickelten Bildungsstandards , die beschreiben, was ein Schüler am Ende einer Jahrgangsstufe können soll. Sie löst die Bundesländer-Sonderauswertungen der Pisa-Studien ab; an den Pisa-Studien an sich nimmt Deutschland aber weiter teil - Ergebnisse aus dem jüngsten internationalen Test von 2009 werden im kommenden Dezember veröffentlicht. Die Ergebnisse der neuen Bildungsstudie - der SPIEGEL-ONLINE-Überblick: 1. Sozialauslese gerade in den Siegerländern Der neue deutsche Schultest offenbart Schwächen in allen Bundesländern. Bildung hängt in Deutschland ohnehin stark von der sozialen Herkunft ab, aber in den vergangenen Jahren ist diese Abhängigkeit eher noch gewachsen. Wer aus einer akademisch geprägten Oberschichtfamilie kommt, hat im Bundesdurchschnitt eine 4,5-mal höhere Chance, aufs Gymnasium zu kommen, als ein Kind aus einer Facharbeiterfamilie. Besonders ausgeprägt ist dieses soziale Bildungsgefälle ausgerechnet in Bayern und Baden-Württemberg. Dort haben Akademikerkinder rund 6,5-mal so gute Gymnasiumschancen wie Facharbeiterkinder. Kaum besser gelingt schneiden Niedersachsen, Schleswig-Holstein und Nordrhein-Westfalen ab (zwischen 5,5 und 5,8). Den besten Wert erzielt die Metropole Berlin (1,7). Bayern und Baden-Württemberg klammern sich an das traditionell dreigliedrige Schulsystem, während andere Länder Real- und Hauptschulen zusammenfassen oder die Grundschulzeit verlängern. Bayern sieht sich nun abermals in dieser Politik bestätigt. Ministerpräsident Horst Seehofer (CSU) wertete die Studie als Beleg für die \"eindeutige Überlegenheit eines intelligent vernetzten Schulsystems\" mit Hauptschulen, Realschulen und Gymnasien. 2. Osten in Fremdsprachen schwach - wegen der Lehrer? Verblüffend groß ist auch eine andere Kluft - die zwischen westlichen und östlichen Bundesländern bei Fremdsprachen. Im Fach Englisch entsprechen die Abstände zwischen den Ländern etwa dem Unterschied eines ganzen Schuljahrs. Mehr noch als im Lesen und Textverständnis zeigt sich das im Hörverständnis. Die Studie nennt als Grund die mangelhafte Qualifikation der Lehrer. In den westlichen Bundesländern haben fast alle Lehrer, die Englisch unterrichten, auch Englisch studiert, nämlich zwischen 80 und 100 Prozent. Diese Ausbildung fehlt einem Drittel der Englischlehrer in den östlichen Ländern (mit Ausnahme von Sachsen). Einer der Gründe: Erst Anfang der neunziger Jahre wurde der Englischunterricht dort flächendeckend eingeführt. \"Möglicherweise konzentriert sich der Fremdsprachenunterricht in den neuen Ländern noch zu wenig auf die mündliche und zu sehr auf die Schriftsprache, Grammatik und Rechtschreibung\", sagt Birgitta Wolff (CDU), Kultusministerin in Sachsen-Anhalt. Besser sieht es der Kultusministerkonferenz zufolge im Fach Französisch aus - hier bekommen alle Länder bessere Noten als in Deutsch oder Englisch. Das hat allerdings einen klaren Grund. \"Schülerinnen und Schüler mit Französisch als erster Fremdsprache stellen mehrheitlich eine sozioökonomisch privilegierte Gruppe ihres Jahrgangs dar\", schreiben die Kultusminister. Sprich: Wer sich für Französisch entscheidet, zählt eh schon zu den bevorzugten Schülern. Dass es große Probleme in der Aus- und Fortbildung von Lehrern gibt, ist den Kultusministern klar. Sie geloben Besserung - aber geschehen ist bisher wenig. 3. Zu wenig Förderung für Einwandererkinder und Risikoschüler Das Gleiche gilt für die Förderung von Jugendlichen \"mit Migrationshintergrund\", also aus Einwandererfamilien. Sie hängen mitunter zwei Jahre im Fach Deutsch hinterher. Das betreffe vor allem Kinder aus türkischen Familien, sagte Schulforscher Olaf Köller bei der Vorstellung des Schulvergleichs. Es bleibt die größte Herausforderung für das deutsche Schulsystem, Schüler mit sprachlichen Schwierigkeiten auf ein höheres Niveau zu hieven und den Anteil der \"Risikoschüler\" zu senken - so heißen jene, die nach neun oder zehn Jahren nur ein minimales Wissen erreicht haben, ohne Abschluss von der Schule abgehen und kaum Chancen auf dem Arbeitsmarkt haben. Gelingen kann das nur mit Frühförderung und individueller Unterstützung. Die Pisa-Studien haben mehrfach gezeigt, dass Staaten wie Finnland, Kanada oder Schweden da viel mehr Erfolg haben. 4. Mädchen hängen die Jungs ab Verblüffend deutlich schlagen in der Untersuchung die Mädchen die Jungen - und zwar in allen Disziplinen, mit wenigen Ausnahmen auch quer durch die Länder. So haben die Mädchen in Deutsch und Englisch im Schnitt einen Wissensvorsprung von einem halben Jahr, sagt Schulforscher Olaf Köller. Bei der Rechtschreibung sind sie den Jungen sogar ein ganzes Jahr voraus. Mädchen besuchen auch häufiger Gymnasien. Jungen sollten daher in \"geschlechtersensiblen Unterrichtskonzepten\" gefördert werden, teilten die Kultusminister mit. Die Reaktionen Der deutsche Pisa-Forscher Jürgen Baumert hat angesichts der Untersuchung eine \"konsequente Frühförderung\" und individuelle Hilfen für schwache Schüler verlangt. Kinder aus Migrantenfamilien und aus bildungsfernen Schichten bräuchten mehr Unterstützung, sagte er dem \"Tagesspiegel\". Die Schultests der vergangenen zehn Jahre hätten einen \"Mentalitätswandel\" in Politik und Öffentlichkeit bewirkt: \"Die Aufmerksamkeit für Bildung ist größer und differenzierter geworden, die deutsche Überheblichkeit hat einen Dämpfer erhalten.\" Die Bildungsgewerkschaft GEW wirft den Kultusministern vor, sich zu wenig um die Lesekompetenz gekümmert zu haben. Zwar gebe es viele Projekte, Literaturhinweise und Förderkonzepte in den Bundesländern - doch kaum etwas geschehe mit System. Drei Viertel der Pädagogen würden diese Konzepte nur vom Hörensagen kennen, sagt Marianne Demmer vom GEW-Bundesvorstand: \"Es blühen tausend Blumen, aber bei Investitionen in die Lehrerfortbildung ist Fehlanzeige.\"",http://www.spiegel.de/lebenundlernen/schule/sued-sieg-in-schultest-wir-koennen-alles-sogar-hochdeutsch-a-702372.html,2010-06-23T00:00:00.000Z
"Heute in den Feuilletons Wo sind die Putzfrauen? Der \"Tagesspiegel\" trifft den algerischen Friedenspreisträger Boualem Sansal. Die \"taz\" kritisiert an der großen Ausstellung zu Polen und Deutschland das Staatstragende. Die \"Welt\" lobt das Kino, in der Wirtschaftskrise exzellente Analysearbeit zu betreiben. Der Tagesspiegel, 28.09.2011 Piet de Moor porträtiert den algerischen Schriftsteller Boualem Sansal , der im Oktober den Friedenspreis des Deutschen Buchhandels erhalten wird: \"Sansal zögert nicht, Algerien ein Freiluftgefängnis zu nennen. Das Land, sagt er, sei isoliert und beherberge eine verlorene Generation junger Leute, von denen es heißt, dass ihre Rücken nur dazu dienen, die alten Mauern zu stützen. Ihre Hoffnung schöpfen sie allein aus dem Blick nach Europa. Diese Sehnsucht hat Boualem Sansal in seinem Roman ' Harraga ' (2005) behandelt. Harragas sind illegale Migranten, die ihre Papiere verbrannt haben. Sie müssten, sagt Sansal, in Europa empfangen werden wie Menschen, die aus einem Lager geflohen sind, nicht wie halbe Verbrecher, die man mit einem Retourticket bestraft.\" Die Tageszeitung, 28.09.2011 Philipp Goll besucht die große \" Polen - Deutschland \"-Ausstellung im Berliner Gropius-Bau. Vieles daran findet er gelungen, ein gewisses Unbehagen empfindet er dennoch: \"Dass diese Ausstellung eben auch eine staatstragende Leistungsschau ist, zeigt sich an zwei weiteren Leerstellen. Warum finden die Händler vom ' Polenmarkt ' keine Erwähnung, der Ende der 1980er Jahre auf dem Potsdamer Platz in Berlin zum Ort der intensiven Alltagsbegegnung wurde? Wo sind die sich in Deutschland unter widrigen Bedingungen verdingenden Polinnen und Polen? Sie sind moderne Helden der Arbeit an der Basis dieser Nachbarschaft.\" Weitere Artikel: Rene Hamann liest in seiner Kolumne zum Buchmessen-Gastland Island diesmal - freilich nicht unbedingt literarisch bedeutende - Romane isländischer Autorinnen . In Mexiko wurde, wie Wolf-Dieter Vogel berichtet , eine kritische Bloggerin von den Drogenkartellen ermordet, die jede öffentliche Berichterstattung über ihre Verbrechen verhindern wollen. Besprochen werden das neue Album \"Monkeytown\" der Berliner Band Modeselektor und Rolf Lamprechts Geschichte des Bundesverfassungsgerichts \"Ich gehe bis nach Karlsruhe\". Lest Ayn Rand , ruft Kerstin Decker im Schlagloch, und ihr versteht das neue Amerika. Rand sei \"Gewährsfrau des amerikanischen Selbstverständnisses\" und \"Schutzheilige der Tea-Party-Bewegung\": \"Die Gesellschaft zerfällt für Ayn Rand in die ' Prime Mover ' und die ' Second Hander ', in die Macher und die Schmarotzer.\" Und Tom . Neue Zürcher Zeitung, 28.09.2011 Aldo Keel erzählt , wie sich Island , das als Finanzplatz nicht wirklich überzeugen konnte, bei der Frankfurter Buchmesse als Kulturnation empfehlen will: \"Endlich biete sich die Gelegenheit, dem Publikum 'erhobenen Hauptes' echte Werte zu bieten. Um die Erinnerung an die Ära windiger Finanz-Wikinger zu verscheuchen und Island als traditionsbewusste Literaturnation zu zelebrieren, sollen Fotos von Hausbibliotheken dem isländischen Pavillon eine besondere Aura verleihen. 1500 Titel werden Jahr für Jahr auf den Markt gebracht. Die Durchschnittsauflage literarischer Werke beträgt 1000 Exemplare , was - gemessen an der Bevölkerungszahl - einer Million Exemplaren in den USA entspräche.\" Weiteres: Roman Hollenstein inspiziert gewohnt kundig die Bauten internationaler Organisationen an der Place des Nations in Genf, bei dem am Montag eingeweihten neuen Gebäude der Weltorganisation für geistiges Eigentum ( Wipo ) von Stefan Behnisch vermisst er allerdings die \"konstruktive Eleganz\". Besprochen werden eine Ausstellung im Münchner Literaturhaus zur Malerin und Schriftstellerin Franziska zu Reventlow , die Uraufführung von Josef Mysliveceks Oper \"Antigona\" am Theater Biel Solothurn, Volker Reinhardts Geschichte der Schweiz und Marlene Streeruwitz ' Roman \"Die Schmerzmacherin\". Frankfurter Rundschau / Berliner Zeitung, 28.09.2011 Piotr Buras unterhält sich mit dem Kulturwissenschaftler Joseph Vogl über die Vergangenheit und die Zukunft des Kapitalismus, den er für eine insgesamt so problematische wie erfolgreiche Veranstaltung hält: \"Der Kapitalismus ist ein System, das sehr effizient darin ist, Widersprüche zu verwalten , Oppositionen zu absorbieren, sich an den eigenen Krisen zu optimieren. Es funktioniert, auch wenn dieses System überall knirscht oder leckt oder Elend produziert. Weder der Konflikt zwischen Arm und Reich , noch der zwischen Kapital und Arbeit führen zu seinem Untergang.\" Weitere Artikel: In einer Times Mager kommentiert Sylvia Staude eine Studie, die zum Ergebnis kommt, dass Jugendliche Risiken sehr wohl richtig einschätzen, sich um diese Einschätzungen jedoch, sobald sie in Gesellschaft Gleichaltriger sind, kaum noch kümmern. Besprochen werden Thomas Bockelmanns Kasseler \"Leonce und Lena\"-Inszenierung, Ry Cooders neues Album \"Pull Up Some Dust and Sit Down\", der neue Robert-Redford - Film \"Die Lincoln-Verschwörung\" und Bücher, darunter Felix zu Löwensteins Analyse des \"Food Crash\" sowie Jan Brandts großer Debütroman \"Gegen die Welt\". Die Welt, 28.09.2011 Nicht so schlecht wie das Wiener Publikum fand Ulrich Weinzierl Alvis Hermanis ' Inszenierung von Schnitzlers \"Weitem Land\" an der Burg: \"Das Atout der Inszenierung ist Peter Simonischek , ein grandioser Hofreiter. Er als Einziger darf den weichen Schnitzler-Ton sprechen, der Härte, Kälte und Gemeinheit in Watte packt.\" Weiteres: Alexander Kluge und Joseph Vogl unterhalten sich über Herman Melvilles \"Moby Dick\", über das Ungeheure , den Wal als Senkblei in der Zeitgeschichte und die Literatur als Alchimistenküche. Hanns George Rodek attestiert dem Kino, von Erwin Wagenhofers \"Let's Make Money\" bis jetzt zu J.C. Chanders \"Der große Crash\" in Sachen Wirtschaftskrise \"exzellente Analysearbeit\". In der Randglosse vermerkt Sascha Lehnartz mit Erleichterung, dass Albert Uderzo aufhören will, weitere \"Asterix\"-Bände zu produzieren, komme. Süddeutsche Zeitung, 28.09.2011 Antje Weber stellt die ecuadorianischen Forschungen an den archäologischen Überresten der Yumbo-Kultur vor. Catrin Lorch berichtet vom Stand der Dinge im Streit um die Lagerung von Beuys-Arbeiten im Museum Schloss Moyland zwischen dem Land Nordrhein-Westfalen und dem Kuratorium der Museumsstiftung. Alexander Menden annonciert das Londoner Festival \"Globe to Globe\", das im kommenden Jahr alle 37 Stücke von Shakespeare in internationalen Inszenierungen zeigen wird. Besprochen werden eine Ausstellung mit Werken von Daniel Richter in der Hannoveraner Kestnergesellschaft , der Film \"Whore's Glory\" ( mehr ), die vom Film Noir inspirierte Interpretation von Schnitzlers \"Das weite Land\" am Burgtheater Wien , Henrik Ibsens \"Volksfeind\" am Theater Bonn , Museumsausstellungen zur Rhein-Romantik in Königswinter , Remagen und Koblenz , kurz und bündig neue Pop-CDs und Bücher, darunter Jan Kalman Stefanssons Roman \"Der Schmerz der Engel\" (mehr in unserer Bücherschau ab 14 Uhr). Frankfurter Allgemeine Zeitung, 28.09.2011 Von einer kuriosen Kontroverse aus China berichtet Mark Siemons: Der Dalai Lama nämlich spielt öffentlich mit dem Gedanken, für eine Wiedergeburt nicht mehr zur Verfügung zu stehen. Der chinesischen Obrigkeit passt dies indessen gar nicht, sie insistiert, \"dass noch nie ein Dalai Lama seinen Nachfolger bestimmt habe und dass im Übrigen alle Fragen der Wiedergeburt in der Volksrepublik gesetzlich bestens geregelt seien.\" Ernster Hintergrund der Sache ist eine Verordnung aus dem Jahr 2007, die es den chinesischen Behörden gestattet, nicht genehme Wiedergeburten für illegal zu erklären, wodurch eine direkte Einflussnahme auf den Nachfolger des jetzigen Dalai Lamas möglich wäre. Weitere Artikel: Mit ihrem Auftritt in der Titelrolle von Gaetoano Donizettos \"Anna Bolena\" an der Metropolitan Opera hat Anna Netrebko New York im Sturm erobert, schreibt ein entzückter Jordan Mejias. Dieter Bartetzko erläutert den Begriff \" Gentrifzierung \" anhand der momentanen Bevölkerungsbewegungen in Frankfurt. Kerstin Holm berichtet vom Unbehagen im russischen Bürgertum nach der Medjedew/Putin-Rochade der vergangenen Tage. Walter Haubrich gratuliert Gaston Salvatore zum 70. Geburtstag. Besprochen werden neue DVDs, darunter eine Box zur \"Geschichte des deutschen Animationsfilms\" ( mehr ), die Oper \"Street Scene\" von Kurt Weill an der Theater an der Wien , der vom Zusammenbruch der Lehman Brothers inspirierte Film \"Der große Crash\" ( mehr ) und Bücher, darunter Jörg Dünnes Habilitationsschrift über Kartografien in der frühen Neuzeit (mehr in unserer Bücherschau ab 14 Uhr).",http://www.spiegel.de/kultur/gesellschaft/heute-in-den-feuilletons-wo-sind-die-putzfrauen-a-788768.html,2011-09-28T00:00:00.000Z
"Studie Tausende Migrantinnen werden zur Ehe gezwungen Die Zahlen sind alarmierend. Auf mehr als 3000 Mädchen und Frauen - meist aus muslimischen Familien - wurde in Deutschland innerhalb eines Jahres Zwang ausgeübt, eine Ehe einzugehen. Oft ist ihr Leben bedroht. Das ist das Ergebnis eines neuen umfangreichen Berichts. Unter den Betroffenen sind viele Minderjährige. Berlin - Jeden Tag werden in Deutschland mehrere Frauen und Mädchen unter Androhung von Gewalt in eine Ehe gedrängt. Diese Zahlen gehen aus einer neuen Studie hervor, die Familienministerin Kristina Schröder (CDU) und die Integrationsbeauftragte Maria Böhmer (CDU) am Mittwoch vorstellen werden. Danach haben im Jahr 2008 3443 Frauen und Mädchen Hilfe bei Beratungsstellen gesucht, weil sie zwangsverheiratet wurden oder ihnen eine Zwangsehe drohte. Familienministerin Schröder gab Ergebnisse der Untersuchung bereits vorab in einem Gastbeitrag für die \"Frankfurter Allgemeine Zeitung\" bekannt. Die Opferzahlen liegen weit über bisherigen Schätzungen: Die Hilfsorganisation Terre des Femmes ging bislang davon aus, dass sich in Deutschland jährlich mehr als tausend Frauen und Mädchen aus Migrantenfamilien wegen Zwangsheiraten an Beratungsstellen wenden. Für die neue umfangreiche Studie wurden 1445 Beratungsstellen angeschrieben. 830 davon meldeten sich zurück. Die Ergebnisse geben auch Aufschluss über Herkunft, Alter und Vorgeschichte der Opfer. So wird jede dritte Betroffene im Zusammenhang mit der Zwangsverheiratung mit dem Tod bedroht. Die allermeisten Zwangsehen-Opfer stammen aus muslimischen Elternhäusern - 83,4 Prozent. Laut \"Süddeutscher Zeitung\" stammen fast zwei Drittel der erfassten Fälle aus stark religiös geprägten Familien. Viele haben extreme Brutalität erlebt Insgesamt kommen nahezu alle Betroffenen aus Migrantenfamilien, aber ein Drittel der Mädchen und Frauen, die in eine Ehe gezwungen wurden, ist der Befragung zufolge in Deutschland geboren, 23 Prozent kamen in der Türkei zur Welt. Bei den Herkunftsländern der Familie war die Türkei am stärksten vertreten, gefolgt von Serbien, dem Kosovo, Montenegro sowie dem Irak. Viele Opfer haben extreme Brutalität erlebt - mehr als die Hälfte war bei der Zwangsverheiratung selbst körperlicher Gewalt ausgesetzt, 27 Prozent wurden laut Ministerin Schröder mit Waffen oder Mord bedroht. Nach Angaben der \"Welt\" ist fast ein Drittel der von Zwangsheirat Betroffenen in Deutschland 17 Jahre oder jünger. 40 Prozent sind zwischen 18 und 21 Jahren alt. Familienministerin Schröder forderte, dass das Thema Zwangsehen schon in den Schulen stärker zur Sprache gebracht werden müsse. Außerdem seien deutsche Sprachkenntnisse oft der Schlüssel zu einem \"selbstbestimmten, im wahrsten Sinne des Wortes ungezwungenen Leben jenseits elterlicher Bevormundung\", so Schröder am Dienstag in der \"FAZ\". Zum ersten Juli dieses Jahres trat eine gesetzliche Neuregelung in Kraft. Seitdem ist die unfreiwillige Eheschließung ein eigener Straftatbestand, der mit bis zu fünf Jahren Haft geahndet werden kann. An dem möglichen Strafmaß hat sich mit der Neuregelung aber nichts geändert. Auch schon vorher war es möglich, Zwangsheiraten zu verfolgen - nämlich als besonders schwere Nötigung.",http://www.spiegel.de/politik/deutschland/studie-tausende-migrantinnen-werden-zur-ehe-gezwungen-a-796673.html,2011-11-09T00:00:00.000Z
