article,article_url,date
"Berlin Eine Million Menschen feiern am Tor Bei der größten Silvesterparty Deutschlands haben eine Million Menschen rund um das Brandenburger Tor das neue Jahr begrüßt. Für die Stadtreinigung hat inzwischen das große Aufräumen begonnen. Berlin - Höhepunkt des acht Millionen Mark teuren Berliner Silvester- Spektakels war kurz vor Mitternacht eine eindrucksvolle Show aus Feuer, Licht und Musik an der Siegessäule. Unter dem Motto \"Welcome 2001 - Berlin Open End\" verfolgten Zehntausende, wie Flammenbälle und Vulkane in den klaren Nachthimmel aufstiegen. Rote bengalische Feuer tauchten die 69 Meter hohe Säule in ein magisches Licht. DPA Silvesterparty vor dem Brandenburger Tor Die Silvester in Berlin GmbH hatte ursprünglich 1,5 Millionen Besucher erwartet, zeigte sich aber zufrieden mit dem Besucheransturm. Zur Millenniumsparty im Vorjahr waren über zwei Millionen Besucher nach Berlin gekommen. Hotels und Pensionen waren diesmal nicht ausgebucht.    Für Polizei und Feuerwehr verlief die Silvesternacht in der Hauptstadt ohne größere Probleme. \"Es gab wieder viel Arbeit, aber insgesamt war die Nacht der Nächte friedlich und reibungslos\", sagte Polizeisprecher Jörg Seeger. Im Stadtteil Neukölln kam es allerdings zu einer Bluttat . Hier wurden drei afghanische Asylbewerber von Unbekannten ermordet.  An der Partymeile waren rund 1500 Polizisten, 500 Ordner und mehr als 500 Rettungskräfte unterwegs. Internationale Stars, Videowände, Musik und Glühweinstände sorgten für Rummel-Atmosphäre. Als Publikumsmagnet erwies sich die \"Eisbar\" am Luxushotel Adlon. Auch am Neujahrstag herrschte noch reger Betrieb an dem Tresen aus Eisblöcken. Bis abends sollten etwa 1 000 Liter Glühwein ausgeschenkt sein. Zeitgleich arbeiteten 200 Beschäftigte der Stadtreinigungsbetriebe daran, den Müll der Neujahrsnacht auf der Partymeile zu beseitigen.",http://www.spiegel.de/panorama/berlin-eine-million-menschen-feiern-am-tor-a-110197.html,2001-01-01T00:00:00.000Z
"Analyse EU-Osterweiterung - Angstmache aus dem Kanzleramt Bundeskanzler Gerhard Schröder behauptet, mit der Osterweiterung der EU drohe Deutschland ein Zuzug billiger Arbeitskräfte, der \"nicht verkraftbar\" sei. Doch das Angst-Szenario geht an der Realität vorbei. Von Harald Schumann AP Gerhard Schröder: Spiel auf dem Klavier der Rechtspopulisten Jörg Haider, Österreichs Möchtegern-Führer, dürfte sich freuen. Endlich sei auch im Ausland die Position seiner \"Freiheitlichen Partei\" verständlich geworden, frohlockte der Provinznationalist aus Kärnten in seiner Neujahrsbilanz. Nun fordere sogar der deutsche Bundeskanzler, wofür die Haider-Partei schon immer kämpfe: Langjährige Zuzugsperren für Osteuropäer nach der EU-Osterweiterung. Haider: \"Damit ist die freiheitliche Kritik auch inhaltlich gerechtfertigt worden.\"  Das Kanzlerlob aus dem Munde des europäisch geächteten Rechtspopulisten ist verdient, Schröder spielt neuerdings wieder auf der gleichen Klaviatur: Mit der Integration der osteuropäischen Staaten in die EU drohe ein \"riesiges Wohlstandsgefälle\", das werde erheblichen \"Migrationsdruck erzeugen\", kündete er unlängst in der Oberpfalz nahe der tschechischen Grenze. Ungezügelt sei dies für Deutschland \"nicht verkraftbar\". Sieben Jahre lang solle daher den Polen, Tschechen, Slowaken, Ungarn und Slowenen auch nach dem EU-Beitritt der Zugang zum deutschen Arbeitsmarkt versperrt bleiben. Diesen Vorschlag werde er bei den Beitrittsverhandlungen in Brüssel einbringen, versprach der Kanzler mit betonter Fürsorge.  Die Adressaten des Kanzlerwortes waren begeistert. Die Regierungschefs der ostdeutschen Länder sicherten ihre volle Unterstützung zu, ebenso Handwerksverbände und Gewerkschaften. Getrost konnte Schröder so für den kommenden Wahlkampf verbuchen, die Deutschen einmal mehr in ihrer Angst vor drohenden Einwandererfluten geeint zu haben.  Zentrale Reformaufgabe torpediert Doch mit seinem populistischen Vorstoß schadet der Amtsinhaber am Berliner Schlossplatz seinem eigenen Regierungserfolg. Denn das Ansinnen, Deutschland gegen den Osten abzuschotten, torpediert eine der zentralen Reformaufgaben der rot-grünen Koalition: die dringend benötigte Öffnung des Landes für mehr und möglichst qualifizierte Einwanderer, auch und gerade aus Osteuropa.  DER SPIEGEL Grafik: Einwanderungsbedarf in Deutschland Längst ist absehbar, dass wegen des anhaltenden Geburtendefizits die Schrumpfung der erwerbstätigen Bevölkerung bald zur größten Belastung für die deutsche Wirtschaft wird. Bleibt es bei der verbreiteten Kinderlosigkeit, wird die Zahl der Menschen in Deutschland bis 2050 um 28 Prozent abnehmen (siehe Grafik). Bereits heute leiden zahlreiche Branchen unter Nachwuchsmangel, weil die Zahl der Abgänger aus Schulen und Hochschulen von Jahr zu Jahr abnimmt. Den schon heute programmierten Einbruch bei den Arbeitskräften könnte zwar auch die Zuwanderung aus dem Ausland nicht ausgleichen, wohl aber mildern - vorausgesetzt Deutschland bleibt für Einwanderer überhaupt attraktiv. Genau das steht aber zunehmend in Frage. Wegen der Neonazi-Umtriebe und des oft schikanösen Umgangs der Behörden mit Migranten, stehe die Bundesrepublik bei potentiellen Einwanderern ohnehin nicht hoch im Kurs, warnt der Migrationsexperte Rainer Münz, Bevölkerungswissenschaftler an der Berliner Humboldt-Universität. Daher sei es unsinnig, mit der aus dem Kanzleramt geforderten neuen Barriere \"gerade die Menschen abzuschrecken, die Deutschland am dringendsten benötigt\", mahnt er im SPIEGEL-ONLINE-Interview . Das Land stehe in einem weltweiten Wettbewerb um die besten Köpfe, insbesondere mit den USA, Großbritannien und Frankreich. Wer da pauschale Ausschlussregeln schaffe, \"kann nur verlieren\", mahnt Münz, der damit auch seine eigenen Auftraggeber kritisiert: Die Bundesregierung berief ihn jüngst in die Zuwanderungskommission, die unter Leitung von Rita Süßmuth bis zum kommenden Sommer einen Vorschlag für das benötigte neue Einwanderungsrecht vorlegen soll.  Kanzler im argumentativen Niemandsland Spätestens dann wird Schröder nachlesen müssen, dass seine Angstmache nicht nur kontraproduktiv, sondern auch unbegründet ist. Einheitlich kommen bislang alle Gutachten über die Ost-West-Wanderung zu dem Schluss, dass sich mit der ersten Stufe der EU-Erweiterung gegenüber dem heutigen Zustand relativ wenig ändert. Längst ist die wirtschaftliche Lage in Polen oder Tschechien nicht mehr so schlecht, dass die Bewohner in Massen ihr Land verlassen wollen. Daher rechnet das Deutsche Institut für Wirtschaftsforschung (DIW) mit lediglich rund 220.000 zusätzlichen Einwandern jährlich, Tendenz stark fallend. Das Institut für Arbeitmarkt- und Berufsforschung (IAB) der Bundesanstalt für Arbeit kalkuliert sogar mit gerade mal 100.000 jährlichen Migranten mehr.  Darum werde die mögliche Arbeitnehmer-Freizügigkeit nach dem EU-Beitritt allenfalls im Gastgewerbe oder der Bauindustrie spürbar, meint IAB-Experte Elmar Hönekopp. Gerade für diese Branchen würde aber ohnehin schon bisher der größte Teil der 300.000 Arbeitsgenehmigungen ausgestellt, die Deutschland jährlich an Nicht-EU-Ausländer vergibt.  DPA Deutsch-polnischer Grenzübergang in Frankfurt/Oder: Angst vor Lohn-Dumping Mangels inhaltlicher Substanz geriet der Kanzler mit den Begründungen für seinen Abschottungsvorschlag denn auch prompt ins argumentative Niemandsland. So versuchte Schröder, seine Zuhörer in der Oberpfalz Glauben zu machen, die geplante Zuzugsperre könne Handwerk und Kleinindustrie in den Grenzregionen vor Lohn- und Sozialdumping schützen. Doch käme es dazu, tritt vermutlich genau das Gegenteil ein. Denn wenn keine Arbeitskräfte von Osten über die Grenze pendeln dürfen, warnt nicht nur Humboldt-Experte Münz, \"werden deutsche Unternehmen und solche aus anderen EU-Staaten dorthin ausweichen und dann von Polen oder Tschechien aus preisgünstige Produkte und Dienste anbieten\". Die Betriebe auf der deutschen Seite hätten in diesem Fall sogar Nachteile im Wettbewerb, weil sie keine Arbeitspendler aus dem Osten beschäftigen dürften.   Nicht minder fadenscheinig fiel Schröders Argumentation gegenüber den betroffenen Staaten aus. Die siebenjährige Sperrfrist, behauptete der Kanzler, sei ja auch in deren Interesse, weil verhindert werden müsse, \"dass die besten Leute aus Polen und Tschechien weggehen, obwohl sie dort gebraucht werden\". Im Fall der so dringend benötigten Computerexperten war Schröder das noch ein halbes Jahr zuvor ganz egal gewesen. Als er nach dem Aufschrei der IT-Branche über Fachkräfte-Mangel die Experten-Green-Card einführen ließ, argumentierten die verschiedenen Regierungssprecher noch genau andersherum. Indien, so erklärten Schröders Büchsenspanner in Hintergrundgesprächen damals, habe mit dem Export seiner Fachleute ja gewonnen, weil diese mit ihrem im Ausland erworbenen Know-how in der Heimat erfolgreiche Unternehmen gründen könnten.  Angesichts solcher Irrungen mochten sich die Regierungen der betroffenen Beitrittsstaaten auf eine inhaltliche Debatte über den Schröder-Vorschlag erst gar nicht erst einlassen. Tschechiens Regierungschef Milos Zeman kanzelte ihn als bloße \"Einzelmeinung\" ab, da müsse erst mal ein gemeinsamer EU-Standpunkt gefunden werden. Abwarten will auch Ungarns Außenminister Janos Martonyi, und sein polnischer Amtskollege Wladyslaw Bartoszewski beruhigte die einheimische Presse mit der für jedermann verständlichen Formel: Der Kanzlerplan, so befand der polnische Chefdiplomat, sei nichts weiter als \"Wahlkampfvorbereitung\".",http://www.spiegel.de/politik/ausland/analyse-eu-osterweiterung-angstmache-aus-dem-kanzleramt-a-110361.html,2001-01-02T00:00:00.000Z
"Zuwanderung Otto Schilys beinharte Linie Beim Gerangel um Einwanderung und Integration stellt sich Innenminister Otto Schily stur ­ gegen die Grünen und die eigene Partei. Vor allem beim Asylrecht will er hart bleiben. DPA Otto Schily Der Minister gab die Rolle, die ihm die liebste ist ­ die des harten Kerls. In scharfem Ton kanzelte Otto Schily, 68, all jene \"Wohlmeinenden\" ab, die einen besseren Schutz für alle Flüchtlinge fordern. Dem Uno-Flüchtlingskommissar Ruud Lubbers, einst Ministerpräsident der Niederlande, gab er forsch mit auf den Weg: \"So Leid es mir tut ­ die Behauptung, es gebe Schutzlücken im deutschen Flüchtlingsrecht, wird durch ständige Wiederholung nicht richtiger.\" Das war am vergangenen Montag in Berlin. Der UNHCR, das Flüchtlingskommissariat der Vereinten Nationen, feierte das 50-jährige Bestehen der Genfer Flüchtlingskonvention. Schily nutzte die Gelegenheit, um wenige Tage vor der Präsentation des Süssmuth-Berichts über Zuwanderung und Integration noch einmal klarzustellen: Mit ihm sind allenfalls kosmetische Korrekturen am deutschen Flüchtlingsrecht denkbar ­ mehr nicht. Dabei hätte, was die 21-köpfige Zuwanderungskommission der Regierung unter der Leitung von Rita Süssmuth (CDU) und Hans-Jochen Vogel (SPD) auf knapp 300 Seiten zusammengetragen hat, Grundlage für eine Zeitenwende sein können: Zum ersten Mal nach dem Krieg besteht Konsens unter allen Parteien, dass Deutschland Einwanderungsland ist. Zum ersten Mal sind sich die Fachleute einig, dass der Wohlstand in Deutschland nur über vermehrte Zuwanderung zu halten ist. Und unbestritten ist auch, dass die Integration von Ausländern und Zuwanderern erheblich intensiviert werden muss. Doch schon bevor der Bericht an diesem Mittwoch vorgestellt wird, droht das Jahrhundertprojekt Zuwanderung geschreddert zu werden: Noch haben sich CDU und CSU nicht entschieden, ob sie das Thema zum Wahlkampfschlager machen wollen. In der zentralen Frage der Integration ist völlig ungewiss, wer für die Finanzierung aufkommen soll. Auch darüber, ob die nichtstaatliche Verfolgung von Flüchtlingen ein Asylgrund sein soll, schwelt der Zank weiter. Insbesondere um den letzten Punkt, eigentlich ein Nebenaspekt der Zuwanderung, kreist der Streit. Schily hält an seiner Überzeugung fest, dass politisch Verfolgte aus Somalia, Sri Lanka oder Algerien in Deutschland kein Asylrecht genießen sollten. Denn dort verfolge sie nicht der Staat, er sei lediglich nicht in der Lage, sie vor Gewalt bis hin zum Totschlag zu schützen. Solche Flüchtlinge erhalten in Deutschland meist nur eine Duldung, aber keinen rechtlichen Status, der vor Abschiebung schützt. Hartnäckig beharrt Schily ­ gegen den erbitterten Widerstand von Joschka Fischers grünen Parteifreunden ­ seit Monaten auf seiner Position, auch wenn er sich und die Bundesrepublik damit international weitgehend isoliert. Nicht nur EU-Justizkommissar Antonio Vitorino spricht von einer \"Schutzlücke\" in Deutschland. Kaum ein Land in Europa, so wurde dem Innenminister bei der UNHCR-Feier von nahezu allen Experten attestiert, gebärde sich bei der nichtstaatlichen Verfolgung ähnlich restriktiv wie die Deutschen. Die unerbittliche Linie Schilys hinterließ beim niederländischen Sozialdemokraten Lubbers deutliche Wirkung. Die auf Abschottung zielende europäische Flüchtlingspolitik, vor allem die deutsche, entrüstete sich der Hochkommissar, sei \"eine Schande für Europa\". Selbst Peter Müller, Vorsitzender der CDU-Zuwanderungskommission, bekannte vergangene Woche, \"dass sowohl die geschlechtsspezifische als auch die nichtstaatliche Verfolgung schutzbedürftig sind\". Auch für den Unionspolitiker ist das Ausländerrecht in seiner aktuellen Fassung \"unzureichend\". Allenfalls ein bisschen Entgegenkommen mag Schily zeigen: Er will bei nichtstaatlicher Verfolgung künftig mehr Ermessensspielraum für Duldungen lassen. Die Süssmuth-Kommission hingegen empfiehlt einen verbrieften Anspruch auf Asyl. Bis zum vergangenen Freitagmittag feilte die SPD-Bundestagsfraktion an einem eigenen Einwanderungskonzept. Ergebnis: Die SPD will ganz allgemein \"die Opfer nichtstaatlicher und geschlechtsspezifischer Verfolgung besser schützen\". Falls Schily auch diese vage Formulierung noch zu viel sein sollte, drohen Bundestagsabgeordnete schon mal: \"Gegebenenfalls haben wir ja einen Parteitag im November.\" Die beinharte Linie des Innenministers entspringt vor allem der Furcht vor dem Wähler. Trotz des Mangels an Fachkräften, trotz der Bedrohung der Sozialsysteme hat die Zurückhaltung der Deutschen gegenüber Zuwanderern zugenommen. Sprachen sich vor einem halben Jahr bei einer Allensbach-Umfrage noch 47 Prozent für ein restriktives Einwanderungsgesetz aus, so sind es heute 53 Prozent. Und gegen Ressentiments der Wähler, so hat Schily beim Staatsangehörigkeitsrecht leidvoll erfahren, sind beim Thema Ausländer keine Punkte zu machen. Wie ernst die Politiker ihre Ankündigungen für eine neue Zuwanderungspolitik wirklich nehmen, wird sich spätestens bei den Kosten für die Integration erweisen. Bisher erhalten zwar jährlich 75 000 Russlanddeutsche Sprachunterricht, aber nur 21 000 Ausländer, gerade mal zehn Prozent der Neuzuwanderer. Wenn ­ wie die Süssmuth-Kommission empfiehlt ­ jährlich 220 000 Zuwanderer gefördert werden, rechnen Fachleute mit zusätzlichen Kosten von rund 700 Millionen Mark. Und das ist niedrig kalkuliert. 600 Stunden Sprachförderung pro Zuwanderer, rechnet die Kommission vor, verursachen jährlich Kosten in Höhe von rund 2 200 Mark. Die Niederlande stellen für ein umfassendes Integrationsprogramm 10 600 Mark pro Person bereit, Schweden sogar bis zu 15 000 Mark. Vor allem aber: Wie viel Geld steht bereit für die bessere Integration derjenigen Ausländer, die bereits in Deutschland leben? \"Alles was an neuen Dingen kommt, muss vom Bund bezahlt werden\", verkündet bereits der Düsseldorfer Sozialminister Harald Schartau (SPD). Auch die Kommunen wappnen sich schon mal gegen allfällige Zusatzforderungen. \"Die finanzielle Hauptbelastung muss bei Bund und Ländern liegen\", verlangt Gerd Landsberg vom Deutschen Städte- und Gemeindebund, zugleich Mitglied der Süssmuth-Kommission. Lediglich Peter Müller, Regierungschef im hoch verschuldeten Saarland, bekennt: \"Wir sind bereit, ein Stück Verantwortung zu übernehmen.\" Noch aber sperrt sich jeder auf seine Art. Im Bundesrat wollen SPD-regierte Länder, gegen den Widerstand von CDU und CSU, ein Gesetz durchbringen, das die Eingliederung von Ausländerkindern fördert: Die Frist für die erleichterte Einbürgerung ausländischer Kinder, die in den letzten zehn Jahren in Deutschland geboren wurden, soll bis ins Jahr 2002 verlängert werden. Nach Schätzungen des nordrhein-westfälischen Innenministers Fritz Behrens (SPD) betrifft das mehr als 200 000 Kinder. Der Innenminister setzt erst einmal auf Zeit. In der Sommerpause will er getrennt mit CDU und Grünen verhandeln. Seinen Gesetzentwurf will er erst nach den heiklen Hamburg-Wahlen am 23. September vorlegen, obwohl er bereits nahezu fertig ist. Für den Fall kündigt Christdemokrat Müller schon mal vorsorglich den Konsens auf: \"Dann sage ich Gute Nacht, einen gemeinsamen Gesetzentwurf wird es dann vor der Bundestagswahl kaum geben können.\" HORAND KNAUP, CHRISTOPH MESTMACHER",http://www.spiegel.de/politik/deutschland/zuwanderung-otto-schilys-beinharte-linie-a-142953.html,2001-07-03T00:00:00.000Z
"Menschenrechte Uno wirft Israel Massentötungen vor Die Uno-Menschenrechtskommission hat Israel Massentötungen von Palästinensern vorgeworfen und ein sofortiges Ende der Militäroffensive in den besetzten Palästinenser-Gebieten verlangt. Deutschland schloss sich der Verurteilung Israels nicht an. AP Gefangen und gefesselt: Palästinenser am 8. März in einem Flüchtlingslager nahe Tulkarem Genf - Die Resolution wurde mit breiter Mehrheit von 40 Stimmen bei fünf Gegenstimmen und sieben Enthaltungen angenommen. Während auch Großbritannien gegen die Resolution votierte, stimmten sechs andere EU-Länder, darunter Frankreich, Schweden und Österreich, dafür.  Der deutsche Uno-Botschafter Walter Lewalter sagte zur Begründung für die ablehnende deutsche Haltung, dass in der Resolution eine Verurteilung des Terrorismus gefehlt habe. Außerdem könne Deutschland keine Formulierungen mittragen, in denen von Verbrechen gegen die Menschlichkeit oder Kriegsverbrechen Israels die Rede sei. Trotz des Neins zu der Resolution unterstütze Deutschland andere Passagen, in denen Israel Menschenrechtsverstöße vorgeworfen würden.  Die Kommission, in der 53 Staaten vertreten sind, unterstützte mit der Resolution einen von arabischen und muslimischen Staaten eingebrachten Entwurf. Darin wurden Israel unter anderen Verstöße gegen die Menschenrechte in großem Umfang vorgeworfen und das \"legitime Recht des palästinensischen Volkes auf Widerstand\" bekräftigt. Gewalt ohne Ende Unterdessen gehen die Gewalttaten im Nahen Osten weiter: Israelische Soldaten töteten am Montag insgesamt vier Palästinenser. Nach palästinensischen Angaben wurde in der Ortschaft Doha bei Betlehem eine palästinensische Frau in ihrem Haus von israelischen Geschossen tödlich verletzt. Eine Armeesprecherin sagte, in der Gegend sei es zuvor zu Schusswechseln gekommen. Bei einem anderen Zwischenfall sei ein Palästinenser, der in einem Auto von Betlehem in das Dorf Abedia unterwegs war, erschossen worden. Er habe nicht gewusst, dass die Armee die Ortschaft in der Nacht besetzt hatte.  In der Nacht zum Montag wurden von israelischen Soldaten zwei Palästinenser im Gaza-Streifen getötet. Nach israelischen Medienberichten wollten die Männer in die jüdische Siedlung Kfar Darom eindringen und einen Anschlag verüben. Ein dritter Palästinenser habe fliehen können, als die Armee die Männer am Sicherheitszaun der Siedlung stellte. Die sehr isoliert gelegene Siedlung Kfar Darom war bereits häufig Ziel von Anschlägen.  Aus Furcht vor möglichen neuen palästinensischen Terroranschlägen am israelischen Unabhängigkeitstag an diesem Mittwoch wurde die Polizei in Israel in höchste Alarmbereitschaft versetzt. Rotes Kreuz darf nach Dschenin Das Internationale Komitee vom Roten Kreuz (IKRK) erhielt nach tagelangen Appellen von der israelischen Regierung die Genehmigung, das palästinensische Flüchtlingslager von Dschenin zu besuchen. Das bestätigte Sprecher Vincent Lusser am Montag in Genf. Drei Teams, darunter eines des palästinensischen Roten Halbmondes, seien seit den frühen Morgenstunden im Lager. Da er keinen telefonischen Kontakt zu ihnen habe, könne er keine Informationen zur Lage geben, sagte Lusser.  Die Palästinenser werfen Israel vor, in dem Lager ein Massaker unter der Zivilbevölkerung verübt zu haben. Israel bestreitet dies. Unabhängige Quellen gab es bislang nicht.",http://www.spiegel.de/politik/ausland/menschenrechte-uno-wirft-israel-massentoetungen-vor-a-191923.html,2002-04-15T00:00:00.000Z
