article,article_url,date
"+++ Roskilde-Festival +++ Macklemore & Ryan Lewis, Stormzy und Highasakite im Livestream Wir streamen live vom Roskilde Open Air! An Tag drei u.a. mit Young Thug, Tenacious D und Biffy Clyro. Unser Autor fährt schon seit Jahren auf das legendäre dänische Festival. Hier erklärt er, warum. Von Eberhard Spohd Der Überblick für Freitag: Channel 1 07:05 pm - Macklemore & Ryan Lewis (Encore) 08:35 pm - Mac DeMarco 09:50 pm - Biffy Clyro 10:10 pm - Stormzy 11:10 pm - Tal National 00:25 am - Highasakite 01:50 am - Young Thugh Channel 2 07:15 pm - Tenacious D (Encore) 08:35 pm - Jacob Bellens 09:50 pm - Calypso Rose 11:05 pm - BadBadNotGood 00:05 am - Young Thug 01:05 am - Blaue Blume 02:20 am - Stormzy (Encore) Alle Zeitangaben nach mitteleuropäischer Sommerzeit. Wenn man morgens über das Gelände geht, freut man sich über die Ruhe. Ein paar Freiwillige räumen den Müll der Nacht weg. Schwer vorstellbar, dass wir und Zehntausende andere noch wenige Stunden zuvor genau hier allen Arten von populärer Musik gelauscht haben. Aber um halb neun Uhr morgens wirken die Zeltreihen für die rund 110.000 Besucher unbelebt, und auch am eigens angelegten Teich haben sich nur ein paar Angler versammelt. Seit 1971 pilgern jeden Sommer die Fans in die Stadt 35 Kilometer westlich von Kopenhagen, um mindestens vier Tage lang Livemusik zu hören. Das verdreifacht schlankweg die Einwohnerzahl und macht das Roskilde Festival wahrscheinlich zum am längsten bestehenden Open-Air-Event der Welt. Auch wenn damals der Begriff Event für solche Veranstaltungen noch nicht Usus war und Kommerz noch nicht im Mittelpunkt stand. Wenigstens das hat sich bis heute nicht geändert: Nirgendwo sieht man die üblichen riesigen Werbetafeln für Koffeinbrause, kein Turnschuh-Megastore buhlt auf dem Gelände um Kundschaft, dafür bekommt der Hungrige die fettesten Schweinebratensandwiches, zubereitet von den Mitgliedern eines ortsansässigen Sportvereins. Nur Tuborg darf dezent damit werben, dass sie ganz schön viele Menschen mit ganz schön viel Bier versorgen. Die besondere Roskilde-Atmosphäre Bier ist übrigens ein Grund, warum ich diese Art von Festivals eigentlich nicht ausstehen kann. Zu viele Klischees, zu wenig Originalität. Zu viele klischeemäßig Betrunkene. Zu wenige gute Bands, zu viele zweitklassige Musiker, die in irgendwelche Timeslots gepresst werden, damit wenigstens immer Lärm herrscht. Das ist reiz- und herzlos, dafür muss ich mir dieses Massencamping mit Aggressionspotenzial wirklich nicht antun. Denn wenn quasi über Nacht eine kleine Großstadt entsteht, deren Bevölkerungsdichte 50.000 Menschen pro Quadratkilometer, also etwa dem Doppelten von Kalkutta, entspricht, ist das immer abschreckend. Aber in Roskilde machen sie irgendwas anders. Sind entspannter. Dänischer wahrscheinlich. Das ist zwar genauso ein Klischee, aber natürlich ein viel sympathischeres. Aber es ist schon erstaunlich, wie friedlich, freundlich und hilfsbereit es hier zugeht. Das liegt unter anderem an den vielen Freiwilligen. Denn was immer wieder in Vergessenheit gerät: Die Einnahmen des Festivals werden komplett an gemeinnützige und kulturelle Institutionen gespendet. Bis zum heutigen Tag wurden umgerechnet gut 35 Millionen Euro unter einer Vielzahl engagierter Menschen wie den Ärzten ohne Grenzen, Amnesty International, dem Flüchtlingsrat Schleswig Holstein oder - wie in diesem Jahr - für den Wiederaufbau des Golden Pudel Club in Hamburg verteilt. Mit dabei: Red Hot Chili Peppers, Neil Young, PJ Harvey Das ermöglichen die gut 30.000 Volunteers, die für ein Freiticket alle Arbeiten erledigen. Täglich werden viele Tonnen Müll und Exkremente bewegt und Dinge auf-, um- und abgebaut, angeliefert, verarbeitet und weggebracht. An den Eingangstoren auf das Gelände erwarten einen keine hünenhaften Anzuggorillas mit Knopf im Ohr, sondern lächeln einen freundlich junge Frauen an, während sie die Zugangsberechtigung prüfen. Sogar der Stage Manager der Orange Stage, der größten Bühne, vor der 90.000 Menschen Platz finden, der Mann also, der alles und jeden Star im Griff haben muss, kommt jedes Jahr wieder und arbeitet kostenlos für das Vergnügen, Bruce Springsteen , Elvis Costello , Prince , Radiohead oder Slayer hautnah bei der Arbeit beobachtet zu haben. Auch das macht die besondere Atmosphäre aus. Und natürlich die Kleinigkeit mit der Musik. Rund 180 Acts treten hier auf. Darunter sind große Nummern wie dieses Jahr zum Beispiel die Red Hot Chili Peppers , Neil Young oder PJ Harvey oder Damon Albarn, der zusammen mit dem Syrian National Orchestra for Arabic Music auftritt. Die nimmt man gerne mit und schaut sich ihre Shows an. Und wenn die dann einfach nichts taugen - ich sage nur The Cure ! Grauenhaft und langweilig, ehrlich! -, dann geht man einfach weg und findet auf einer anderen Bühne bessere Sounds. Denn das Roskilde Festival bietet mir die großartige Möglichkeit, einen Haufen mir komplett unbekannter Musiker aus der ganzen Welt kennen und schätzen zu lernen und ein paar, die ich mag, wiederzusehen. Hier haben wirklich alle mal gespielt Beim Frühstück am nächsten Tag erklärt man dann Fremden und Freunden, dass The Cure wirklich schlecht waren, dann wird einem vorgeworfen, dass der zweite Konzertteil, den habe man ja leider verpasst habe, viel besser gewesen sei, und dann geht es weiter mit Musik. Erinnerungen häufen sich im Lauf der Jahre an, Töne werden mit flirrender Hitze und strömendem Regen und vertrauten Menschen und seltsamen Erlebnissen verbunden, kinästhetische Erfahrungen ohne Drogeneinsatz. Ein populärmusikalischer Schirm spannt sich auf, denn hier haben wirklich alle mal gespielt. Hier hört man schwere Beats und Bratzgitarrren und Weltmusik und Elektroexperimente und Folkgeklampfe und Soulröhren und unglaublich seltsame Töne, und über die Jahre vermischt sich dieser Klang zur eigenen Musikgeschichte. Und wenn einem alles zu viel und laut wird, macht man einen Spaziergang. Roskilde ist ein wirklich entzückendes und typisch dänisches Städtchen. Imposant erhebt sich der Dom über dem Roskilde-Fjord. Die wuchtige Kirche mit ihren unzähligen dänischen Königsgräbern wurde 1995 zum Unesco-Weltkulturerbe erklärt. Ihr Antwerpener Schnitzaltar ist ebenso sehenswert wie das Wikingermuseum und der dazugehörige Museumshafen mit seinen nachgebauten Wikingerschiffen an den Ufern des Fjords. Hier weht meist eine leichte Brise und die Luft ist etwas frischer als auf dem Festivalgelände. Wir werden aufs Wasser schauen, über Pölser zum Mittagessen nachdenken - aus dem selbst gefangenen Fisch wird erwartungsgemäß nie was - und bereiten uns innerlich auf die abendlichen Auftritte von Wiz Khalifa oder Cattle Decapitation. vor. Wir sind ja schließlich zu unserem Vergnügen hier. Falls Sie an diesem Wochenende keine Zeit für einen Kurztrip nach Dänemark haben: In Kooperation mit Red Bull TV streamt SPIEGEL ONLINE an dieser Stelle bis zum 1. Juli jeden Abend ausgewählte Auftritte vom Festival. Eberhard Spohd erlebte seine Festival-Taufe 1988 beim Werner-Rennen in Hartenholm, seitdem fährt er nicht immer, aber regelmäßig nach Roskilde. Der Hobby-Imker liebt seinen Garten und lebt als freier Journalist in Berlin.",http://www.spiegel.de/kultur/musik/livestream-roskilde-festival-damon-albarn-red-hot-chili-peppers-a-1099374.html,2016-06-29T00:00:00.000Z
"Münchner Filmfest Wo bleibt die deutsche Easiness? Auf dem Münchner Filmfest erinnert eine Doku an deutsche Regiehelden der Siebzigerjahre. Das aktuelle deutsche Kino kann sich in Sachen Stilwillen und Rigorosität von ihnen einiges abschauen. Von Wolfgang Höbel Wolfgang Höbel Mehr Artikel von Wolfgang Höbel München kann eine echte Provinzhölle sein, wenn es seinen Hinterwäldlerstolz spazieren trägt. Zur Eröffnungsgala des diesjährigen Münchner Filmfests stolperte ein im bayerischen Dialekt schwadronierender junger Komiker namens Harry G auf die Bühne des Mathäser Filmpalasts. Der Kerl ist ein YouTube-Held, der im Netz mit seinen Mundartscherzen eine Menge halbwüchsiger Fans begeistert. Hier sollte er den Moderator geben. Harry G fummelte eifrig am Mini-Hut auf seinem Schädel herum, beleidigte in extrem unlustigen und extrem ahnungslosen Sätzen diverse Filmemacher und Darsteller und sabberte sich dann untertänigst den Münchner Oberbürgermeister heran. Diesem Oberbürgermeister, er heißt Dieter Reiter und ist ein SPD-Mann, fiel leider auch nichts Besseres ein, als ausführlich herumzujammern, dass er den Kinofilm \" Toni Erdmann \", der das Filmfest in diesem Jahr eröffnete, mit 160 Minuten schon brutal lang finde. Filmfest München \"Zeigen, was man liebt\" München kann ein Paradies sein, wenn es sich für die große Welt begeistert. In dem Dokumentarfilm \"Zeigen was man liebt\" , der einer der Höhepunkte in der Reihe \"Neues deutsches Kino\" beim diesjährigen Filmfest war, wird in Interviews und supereleganten Filmausschnitten eine kurze goldene Zeit des deutschen Films beschworen: Das Münchner Hipsterkino der Sechziger- und frühen Siebzigerjahre, in dem Regisseurinnen und Regisseure wie May Spils (\"Zur Sache, Schätzchen\", 1967), Rudolf Thome (\"Rote Sonne\", 1970) und Klaus Lemke (\"Rocker\", 1972) Filme drehten, die von den cooleren, wilderen Seiten des Lebens erzählen wollten. Es waren Filme, die jung und sorglos, eher amerikanisch als französisch und bloß nicht deutsch und nicht politisch sein wollten. Das arbeiten die Dokumentaristen Frank Göhre, Borwin Richter und Torsten Stegmann in \"Zeigen was man liebt\" sehr schön heraus. Es waren Filme, denen Stil und Styling und ein guter Popmusik-Geschmack wichtiger waren als eine ausgeklügelte Dramaturgie. Filme, die \"eine südstaatenmäßige Easiness hatten\", wie der Regisseur Dominik Graf aus der Sicht des Nachgeborenen in der Dokumentation schwärmt, wogegen der 75-Jähige Klaus Lemke aus der Sicht des Zeitzeugen sagt: \"Wir konnten uns damals gar keine Welt vorstellen, in der wir nicht die Größten waren.\" Vielleicht gibt Maren Ades \"Toni Erdmann\" , mit dem das Münchner Filmfest begann, dem deutschen Kino diese Art von Selbstvertrauen zurück. Gegen Ades listigen Eigensinn mussten die meisten Beiträge, die diesmal in der Filmfestreihe \"Neues Deutsches Kino\" liefen, fast zwangsläufig ein bisschen bieder wirken. Und doch gab es in der Auswahl ein paar Werke, die durch formale Kraft und tolle Darsteller überraschten, aber auch durch einen gewissen Mut, dem Kinozuschauer das Denken selbst zu überlassen. Filmfest München \"Die Habenichtse\" In Florian Hoffmeisters Literaturverfilmung \"Die Habenichtse\" zum Beispiel prägt ein strenges Schwarzweiß die Bilder eines Liebes- und Schulddramas, das während und nach den New Yorker Terroranschlägen des Jahres 2001 in Berlin und London spielt. Julia Jentsch und Sebastian Zimmler spielen den Anwalt Jakob und die Designerin Isabelle, zwei erfolgreiche Menschen in den Dreißigern, die scheinbar ihr Glück finden. Nur leider wird Jakob nicht damit fertig, dass er eigentlich im World Trade Center hätte sein sollen am Tag, als er seine Jugendfreundin Isabelle wieder traf - er hatte im letzten Moment einen Kollegen nach New York geschickt, der quasi an seiner Stelle in den Hochhaustürmen starb. Der Film hält sich erst ziemlich brav an die Story des Bestsellerromans von Katharina Hacker und gewinnt, während er sich fast unmerklich verdüstert, dann mehr und mehr Zutrauen in die Macht seiner Bilder. Sommerliche Gute-Laune-Party Das Münchner Filmfest versteht sich im Prinzip als sommerliche Gute-Laune-Party unter den Festivals, bei dem man keinen größeren Bohei um die Unterschiede zwischen Kinowerken und Fernsehfilmen, internationalem Kunstkino und netter Unterhaltung macht. Sehr viele Filmmenschen sind hier praktisch immerzu demonstrativ gut drauf, die seit 2011 amtierende Festivalchefin Diana Iljine gehört dazu. Zu dieser betont sonnigen, aber ein bisschen aussageschwachen Superstimmung passte das diesjährige Festivalmotto \"Leidenschaft\" - und auch die immergleiche Floskel, mit der viele Regisseure ihre Arbeiten in der deutschen Kinoreihe präsentierten: Ständig dankten die Filmemacher ihren Helfern und Geldgebern \"dafür, dass ihr an dieses Projekt geglaubt habt\". Als ob die Wahrheit über die Kunst im Kinogeschäft vom Glauben, Hoffen und Beten abhinge und nicht von der Entschlossenheit zum Denken und zum Eigensinn; als ob Qualität wirklich schon im Finanzplan, in der Besetzungsliste oder in der achtzehnten Drehbuchfassung zu erkennen wäre und sich nicht erst auf der Leinwand präsentiert. Filmfest München \"Die Reise mit Vater\" Ohne irgendwelche Darstellerstars kommt die Regisseurin Anca M. Lazarescu in \"Die Reise mit Vater\" aus. Sehr heiter, aber imponierend stilbewusst schildert sie, wie zwei junge Rumänen im Jahr 1968 mit ihrem kranken Vater zu einer Reise in die DDR aufbrechen und dann, es sind die Zeiten des sowjetischen Einmarschs in Prag, auf abenteuerliche Weise nach Westdeutschland gelangen. Die ausgebleichten Bilder und der Humor, in denen hier die Welt des Kalten Kriegs eingefangen wird, erinnern an Heldentaten des osteuropäischen Kinos wie die legendäre Milan-Kundera-Verfilmung \"Der Scherz\" von Jaromil Jires aus dem Jahr 1969. Von den kleinen Siegen junger Liebender über realsozialistische Spießigkeit und Securitate-Terror, aber auch von den Schrecken und Verheißungen der Flucht auf die andere Seite des Eisernen Vorhangs erzählt Lazarescu eindringlich und mit leiser Komik. Deutsches Kummerkino und Altersgeilheit Als grober Unterhaltungsschrott und trotzdem in München freundlich bejubelter \"Hangover\"-Abklatsch erwies sich dagegen Oliver Rihs' Komödie \"Affenkönig\" . Bekannte und eigentlich hochgeschätzte Schauspielkräfte wie Jule Böwe, Samuel Finzi, Hans-Jochen Wagner und Oliver Korritke treiben bei einem Wochenendausflug von Pärchen und Rumpffamilien auf ein südfranzösisches Landgut trüben Schabernack mit Popo-Humor und Edelhuren - erstaunlicherweise hat Arte diesen Gruselfilm mitfinanziert. Wunderschön fotografiertes, aber doch artig gediegenes Kunsthandwerk bot Sven Taddickens Hochglanzproduktion \"Gleissendes Glück\" nach einem berühmten Liebesunglücksroman von A.L. Kennedy, in dem Martina Gedeck neben Ulrich Tukur sehr viele Leidensmienen ziehen muss. Im Stil einer Sachbuchverfilmung präsentiert der Regisseur Florian Eichinger im Problemstück \"Die Hände meiner Mutter\" den großartigen Schauspieler Andreas Döhler viele quälende Minuten lang einfach in Psychotherapiesitzungen; dort muss der Held Auskunft geben über das Drama eines von seiner Mutter sexuell missbrauchten Mannes. Filmfest München \"Unterwäschelügen\" Erschöpft von derartigem deutschem Kummerkino hoffte man auf den alten Münchner Spaßguerilla-Haudegen Klaus Lemke und seinen wie stets ohne Fördergelder gedrehten neuen Film \"Unterwäschelügen\" . Die Komödie zeigt einen hübschen, weitgehend talentfreien Laiendarsteller auf den Straßen und Dächern Münchens, der sich zu grässlicher Dudelmusik als Fotograf, Kunstszenekenner und Möchtegernzuhälter aufspielt. Eine seiner Künstlerinnenfreundinnen redet ungelogen davon, am liebsten \"halb tot, gefickt und glücklich\" zu sein. Leider zeugt dieser wie auf besonders öden Drogen herumtaumelnde Film auch sonst eher von Altersgeilheit und Gedankenarmut als von ungebremstem Rebellentum. Filmfest München \"Volt\" \"Nicht die Kameraeinstellung ist entscheidend, sondern die Einstellung zur Kunst\", so sprach im \"Zeigen was man liebt\"-Dokumentarfilm der Regisseur Rudolf Thome über die goldenen Münchner Tage der Siebziger. An diese Sorte Rigorosität knüpfte beim Filmfest des Jahres 2016 am eindrucksvollsten der 35-jährige Regisseur und Kampfsportler Tarek Ehlail an. Sein neuer Film heißt \"Volt\" und ist ein Adrenalinknaller, der entschieden auf die Ästhetik, aber auch die coolen Sprüche des amerikanischen und französischen Cop-Kinos setzt. Benno Fürmann spielt in der nah an der Gegenwart angesiedelten Science-Fiction-Story des Films einen taffen SEK-Bullen, den sein Kumpane Volt nennen. Bei einem Routineeinsatz der Polizisten in einem umzäunten Flüchtlingslager an der deutschen Außengrenze kommt es zu einem Kampf auf Leben und Tod. Vordergründig spielt Ehlails Film unter menschlichen Kampfmaschinen, die sich von den Krawattenträgern aus den Chefetagen der Gesellschaft benutzt und verachtet fühlen; unter weiblichen und männlichen Supercops, die dicke Muskeln, grobe Sprüche und kalte Bierflaschen kreisen lassen. Natürlich gibt es auch eine Lovestory, die zu dreistem Kitsch hochgepumpt wird. Trotzdem handelt \"Volt\" nicht bloß von Gewalt, Liebe und Mord, sondern - entschiedener als fast alle anderen deutschen Kinofilme auf dem diesjährigen Filmfest - auch vom Zustand unserer Gesellschaft.",http://www.spiegel.de/kultur/kino/filmfest-muenchen-wo-bleibt-die-deutsche-easiness-a-1100471.html,2016-06-29T00:00:00.000Z
"Newsblog Das war Der Morgen @SPIEGELONLINE am 23.8.2016 Die Nachrichten, Themen und die Presseschau aus Deutschland und der Welt - hier zum Nachlesen. Mit Janko Tietz Raphael Raue Janko Tietz Geboren am 2. November 1972 im sächsischen Freiberg, siedelte Janko Tietz 1984 nach Baden-Württemberg über. 1994 schloss er seine Berufsausbildung als Kommunikationselektroniker bei der Deutschen Bundespost/Telekom ab, danach studierte er Volkswirtschaftslehre in Hamburg. Nach Abschluss volontierte Tietz an der Evangelischen Journalistenschule in Berlin. 2001 startete er als Redakteur bei der Wochenzeitung \"Die Woche\" im Wirtschaftsressort. Im Sommer 2002 folgte ein Gastspiel bei der Transatlantikzeitung \"Aufbau\" in New York. Danach wechselte Tietz ins Wirtschaftsressort beim SPIEGEL. Seit Juli 2014 ist er Chef vom Dienst bei SPIEGEL ONLINE. E-Mail: Janko.Tietz@spiegel.de Twitter: @JankoTietz folgen Mehr Artikel von Janko Tietz Herzlich willkommen bei Der Morgen @SPIEGELONLINE . Bis 9 Uhr begleitet Sie heute Janko Tietz  beim Start in den Tag - hier finden Sie den Autor bei Twitter . Die wichtigsten politischen Themen des Tages finden Sie kompakt in unserem Briefing DIE LAGE .  Noch ein Geburtstag heute: Der US-Basketballstar Kobe Bryant wird heute 38 Jahre alt. Ihm zu Ehren hat die Stadt Los Angeles beschlossen, ihm einen eigenen Tag zu widmen, berichtet bleacherreport.com . Lena-Sophia Nobbe wurde als \"Zugbegleiterin des Jahres\" ausgezeichnet. Wie der Kölner Stadtanzeiger berichtet, hatte sie im vergangenen Jahr eine brenzlige Situation zu meistern. Auf der Stecke zwischen Siegen und Essen stieg eine Flüchtlingsfamilie zu, die von anderen Fahrgästen als \"Pack\" bepöbelt wurde. Nobbe entschied kurzerhand, die Familie in der Ersten Klasse fahren zu lassen, um sie nicht länger den Beschimpfungen anderer Fahrgäste auszusetzen. – Quelle: http://www.ksta.de/24622324 ©2016 Und hier der Nachrichtenüberblick seit gestern Abend: Bei einem Dreiergipfel haben Bundeskanzlerin Merkel , Italiens Regierungschef Renzi und Frankreichs Staatschef Hollande über Impulse für eine Erneuerung der EU beraten . Gastgeber Renzi warb vor der italienischen Insel Ventotene dafür, \"eine bessere Seite in der EU-Geschichte\" aufzuschlagen. Merkel sprach sich für ein größeres gemeinsames Engagement beim Thema Sicherheit aus. \"Wir spüren angesichts des islamistischen Terrors, angesichts des Bürgerkriegs in Syrien, dass wir mehr für unsere innere und äußere Sicherheit tun müssen\", sagte die Kanzlerin. Nach einem Streit über eine Zeitungsschlagzeile rief die Türkei nun den türkischen Botschafter in Wien zu Konsultationen in die Heimat zurück, wie Außenminister Cavusoglu gestern in Ankara mitteilte. Zuvor hatten türkische Medien berichtet, die österreichischen Behörden hätten eine Demonstration von Unterstützern der verbotenen Arbeiterpartei Kurdistans (PKK) bewilligt. Die türkische Artillerie hat gestern Fernsehberichten zufolge Stellungen von Dschihadisten und Kurden in Nordsyrien angegriffen . Im Visier der Armee waren demnach Ziele der Miliz Islamischer Staat (IS) in Dscharablus sowie der Kurdentruppe PYD nahe Manbidsch. Außenminister Cavusoglu hatte zuvor gesagt, die Grenzregion müsse vollständig vom IS \"gesäubert\" werden. Der langjährige CDU-Bundestagsabgeordnete und beliebte Talkshowgast Wolfgang Bosbach tritt bei der Bundestagswahl 2017 nicht mehr an . Für diese Entscheidung gebe es nicht nur einen Grund, sondern ein ganzes Bündel - \"sowohl politische als auch sehr persönliche\", so Bosbach . \"In einigen wichtigen politischen Fragen kann ich die Haltung meiner Partei nicht mehr mit der Überzeugung vertreten, wie ich sie gerne vertreten würde.\"",http://www.spiegel.de/politik/deutschland/nachrichten-am-morgen-die-news-in-echtzeit-a-1108292.html,2016-08-23T00:00:00.000Z
"Integration Merkel ruft türkischstämmige Deutsche zu Loyalität auf Wer aus der Türkei stammt und schon lange in Deutschland lebt, soll nach Ansicht von Kanzlerin Merkel \"ein hohes Maß an Loyalität zu unserem Land\" entwickeln. Im Gegenzug bemühe sich die Regierung um Verständnis. Bundeskanzlerin Angela Merkel (CDU) hat von türkischstämmigen Bürgern Loyalität eingefordert. \"Von den Türkischstämmigen, die schon lange in Deutschland leben, erwarten wir, dass sie ein hohes Maß an Loyalität zu unserem Land entwickeln\", sagte Merkel den \"Ruhr Nachrichten\". \"Dafür versuchen wir, für ihre Anliegen ein offenes Ohr zu haben, und sie zu verstehen.\" Die Regierung halte engen Kontakt mit den Migrantenverbänden. Angesichts der innenpolitischen Konflikte in der Türkei mahnte Merkel zur Besonnenheit bei Türkischstämmigen in Deutschland: \"Die Meinungs- und Demonstrationsfreiheit gilt in Deutschland für alle, die hier leben, aber natürlich müssen alle ihre Meinungsverschiedenheiten friedlich austragen.\" Zuletzt hatten Kundgebungen von Anhängern des türkischen Präsidenten Recep Tayyip Erdogan in Deutschland - etwa bei einer Großveranstaltung in Köln - für politische Diskussionen gesorgt. Aus der CDU kamen Forderungen, die doppelte Staatsbürgerschaft wieder abzuschaffen. Begründet wurde dies auch mit möglichen Loyalitätskonflikten ( hier lesen Sie die Fakten zur Debatte über den Doppelpass für Deutschtürken ). Gegenüber der Zeitung sprach Merkel auch über die Terrorabwehr in Europa. Die Länder müssten sich beim Datenaustausch über mögliche Gefährdungen noch besser vernetzen, sagte sie. In Deutschland müssten die Sicherheitskräfte zur Terrorabwehr neue Befugnisse bekommen. \"Da geht es unter anderem um bessere Überwachungsmöglichkeiten im Internet und in den sozialen Netzwerken\", sagte Merkel. Am Mittwoch soll im Kabinett der Entwurf für ein neues Zivilschutzkonzept der Bundesregierung beraten werden. Es soll die Bürger unter anderem dazu animieren, für den Ernstfall Lebensmittel zu horten. Hier lesen Sie die Fakten zu dem Konzept im Überblick und hier einen Kommentar zum Thema .",http://www.spiegel.de/politik/deutschland/angela-merkel-ruft-tuerkischstaemmige-deutsche-zu-loyalitaet-auf-a-1108989.html,2016-08-23T00:00:00.000Z
