article,article_url,date
"Übergriffe in Köln Vorsicht vor der Angst Nach den Straftaten vor dem Kölner Hauptbahnhof sind viele Menschen beherrscht von Wut und Vorurteilen. Diese Emotionen helfen weder den Opfern noch der Polizei, sie vermehren nur die Angst. Unsere Aufgabe ist jetzt eine andere. Ein Kommentar von Benjamin Maack Christian O. Bruch/ laif Benjamin Maack Jahrgang 1978, absolvierte nach einigen Praktika ein Volontariat bei \"blond\". Danach Report-Redakteur beim \"Prinz\", freier Autor für Magazine wie \"FHM\", \"Petra\" und \"Fit For Fun\", Studium der Kunstgeschichte, Philosophie und Volkskunde. Ab 2003 Mitglied der Entwicklungsredaktion und Textchef des Videospiele-Magazins \"GEE\", Buchautor, Entwicklung des E-Papers \"GEE Display\", Moderation von Podcasts. Seit Januar 2008 Redakteur bei einestages, ab November 2012 stellvertretender Ressortleiter, ab Januar 2013 Ressortleiter. Seit Oktober 2015 Redakteur im Ressort Panorama. E-Mail: Benjamin.Maack@spiegel.de Mehr Artikel von Benjamin Maack Kommentar Wenn jemand Opfer einer Straftat wird, ist es nicht wichtig, aus welchem Land der Täter kommt. Wichtig ist, dass die Gesellschaft den Betroffenen hilft. Nach den Übergriffen in der Silvesternacht in Köln wird zu viel über die Täter spekuliert und zu wenig an die Opfer gedacht. Wenn jemand eine Straftat begeht, muss diese Person dafür zur Verantwortung gezogen werden - egal aus welchem Land sie kommt. Damit der Rechtsstaat dafür sorgen kann, müssen diese Menschen so gut es geht beschrieben werden. Dabei können auch Hautfarbe oder Akzent helfen. Verschiedene Zeugen beschreiben die Täter der Silvesternacht als \"keine mitteleuropäischen Leute\", als \"nordafrikanischer Herkunft\". Der Kölner Polizeipräsident Wolfgang Albers spricht von Tätern, die \"überwiegend aus dem nordafrikanischen beziehungsweise arabischen Raum\" stammen. Diese Informationen sind wichtig für die Polizei. Doch in der Bevölkerung scheinen diese Angaben hauptsächlich Angst, Wut und Vorurteile zu schüren. In E-Mails an SPIEGEL ONLINE fragen Leser, warum nicht offensiver darüber gesprochen wird, wie die Täter aussahen. In sozialen Netzwerken wird sogar von \"Flüchtlingstätern\" gesprochen. Das hilft keinem. Nicht den Opfern, nicht der Polizei, nicht den Menschen in diesem Land. Niemand, der nicht Zeuge oder Opfer dieser Taten war, kann zur Klärung dieser Vorfälle beitragen. Vorverurteilungen instrumentalisieren lediglich die Erlebnisse der Opfer. Ein Albtraum für die Betroffenen In der Silvesternacht auf dem Platz vor dem Kölner Dom wurden etliche Frauen angegangen, beschimpft, sexuell belästigt, bestohlen. Von wem sie angegriffen wurden, ist bis dato nicht klar. \"Mir wurde unter mein Kleid und an mein Gesäß gegriffen\", berichtete eine 22-Jährige im \"Kölner Stadt-Anzeiger\". Ein Vater erzählt, dass er in der Menge von seiner Partnerin, seinem kleinen Sohn und seiner 15-jährigen Tochter getrennt wurde: \"Die Angreifer hatten ihr und meiner Lebensgefährtin an die Brust und zwischen die Beine gegriffen. Sie hatten versucht, in Jeans und den Slip zu kommen.\" Keine Frage: Was sich in dieser Nacht abgespielt hat, ist für die Betroffenen ein Albtraum. Auf Facebook und in E-Mails bezeichnen Leser uns als \"widerliche Beschwichtiger und Realitätsverdreher\" oder \"linksverseuchtes Gutmenschenpack\" und regen sich darüber auf, dass über \"mutmaßlich rechtsextreme\" Verbrechen geschrieben wird, jetzt aber wieder niemand aufsteht und sagt: \"Die Ausländer waren's.\" Diesen Menschen kann man ganz leicht erklären, warum dies nicht geschieht: weil es Unsinn ist. Weil Deutschland seit Generationen ein multikultureller Ort ist, weil es nichts über Nationalität oder Herkunft verrät, wenn ein Mensch \"nordafrikanisch\" aussieht oder \"nicht mitteleuropäisch\". Es gibt in Deutschland Zehntausende, die nicht aussehen wie das Klischee vom Deutschen und die doch seit Generationen hier leben, hier aufgewachsen sind, unsere Sprache sprechen, hier arbeiten, einen deutschen Pass haben. Ja, es gibt auch Flüchtlinge. Aber wer diese Menschen pauschal verdächtigt, hilft nicht bei der Aufklärung dieser Fälle, er spielt Rechten in die Hände. Hinweise mit Vorsicht behandeln Dabei geht es nicht darum, unbequeme Informationen unter den Tisch zu kehren, sondern die wenigen vorhandenen Hinweise mit Vorsicht zu behandeln. Das Vorgehen der Täter etwa, die sexuelle Belästigung und Herabwürdigung der Frauen auf offener Straße, könnte Hinweise auf den kulturellen Hintergrund geben. Diese Form des Übergriffs ist laut einer Studie der Vereinten Nationen in einigen Ländern des arabischen Raums verbreitet. Das Anmachen, Beleidigen oder auch das Grabschen an Hintern, Brust oder in den Schritt gehört dort mitunter zum traurigen Alltag. Sind jetzt deshalb alle nordafrikanisch aussehenden Männer verdächtig? Rechtfertigt dieser pauschale Verdacht die geifernde Hetze im Netz? Nein. Die einzige Folge dieses Pauschalverdachts ist eine Vermehrung der Angst. Die Angst von Frauen, die an einer Gruppe von \"nicht mitteleuropäisch\" aussehenden Männern vorbeigehen. Aber auch die Angst von \"nicht mitteleuropäisch\" aussehenden Menschen in Deutschland, die fürchten, von anderen vorverurteilt und in Sippenhaft genommen, vielleicht angegriffen zu werden. Aber hier geht es um die Aufklärung geschehener Verbrechen, nicht um fadenscheinige Rechtfertigungen für neue Anschläge. Deshalb lautet die wichtigste Frage: Wie gelingt es, in einer so schwierigen Situation gemeinsam dafür zu sorgen, dass es etwas weniger Angst gibt? Vielleicht können wir damit anfangen, aufzuhören, ohne Beweise ganze Menschengruppen zu verurteilen.",http://www.spiegel.de/panorama/gesellschaft/koeln-und-die-silvester-uebergriffe-vorsicht-vor-der-angst-kommentar-a-1070688.html,2016-01-07T00:00:00.000Z
"Pöbelnacht von Clausnitz De Maizière verteidigt Polizeieinsatz Draußen lauert eine fremdenfeindliche Meute, doch Polizisten ziehen Flüchtlinge aus dem Bus: Dieses Vorgehen hat Innenminister de Maizière nun verteidigt - als Zeichen gegen die Pöbler. Ein pöbelnder Mob empfängt in Sachsen eine Gruppe von Flüchtlingen . Die Polizei greift durch - gegen die Ankommenden. Zu Recht, sagt nun Bundesinnenminister Thomas de Maizière . Die Polizei habe \"meines Erachtens auch richtig gehandelt, die Menschen aus dem Bus zu bringen\", sagte der CDU -Politiker am Sonntag in der ARD-Sendung \"Bericht aus Berlin\" . \"In der Unterkunft waren sie sicher untergebracht. Ich kann Kritik an diesem Polizeieinsatz nicht erkennen\", sagte de Maizière. In Clausnitz hatte sich eine aufgebrachte Gruppe am Donnerstagabend einem Bus mit ankommenden Flüchtlingen in den Weg gestellt und \"Wir sind das Volk\" gegrölt. Die Blockade war einem Bericht des MDR zufolge vom Bruder des Leiters der Unterkunft mitorganisiert worden. Letzterer gehört selbst der rechtspopulistischen AfD an (lesen Sie hier unsere Reportage von vor Ort ). Zwei Videos zeigen die pöbelnden Anwohner und die verängstigten Menschen in dem Bus. Die Polizei hat die Flüchtlinge teils mit körperlicher Gewalt zum Aussteigen gezwungen, wie aus dem Einsatzbericht hervorgeht, den SPIEGEL ONLINE dokumentiert . \"Das war offenbar nicht vorhersehbar für die Polizei\", sagt nun de Maizière. Es sei darum gegangen, die Menschen zu schützen. Die Flüchtlinge dürften nicht mit Gewalt, mit Hass oder mit Hetze empfangen werden, erklärte der Innenminister im Gespräch mit Moderatorin Tina Hassel. \"Das ist inakzeptabel.\" Sachsens Innenminister nimmt Polizeipräsidenten in Schutz Ob es de Maizière nach den Vorfällen von Clausnitz aber richtig findet, dass die Polizei nun außer gegen die Blockierer auch gegen Flüchtlinge aus dem Bus ermitteln will , dazu wollte er sich nicht äußern. \"Das kann ich jetzt aus der Ferne nicht beurteilen\", sagte er. \"Ob es da jetzt Provokationen der Asylbewerber gab oder nicht, das kann ich nicht im Einzelnen beurteilen.\" Stattdessen betonte der Politiker, wie wichtig es gewesen sei, die Menschen trotz der Blockade in dem Heim in Clausnitz unterzubringen: \"Stellen Sie sich mal vor, der Bus wäre zurückgefahren. Dann hätten ja diese grölenden Leute noch Recht bekommen. Nein, das war in Ordnung.\" Zuvor hatte bereits Sachsens Innenminister Markus Ulbig (CDU) den Polizeieinsatz bei den fremdenfeindlichen Vorfällen in Clausnitz verteidigt. \"Die Polizei musste konsequent handeln und hat das getan\", sagte Ulbig. Die Ursache für den Einsatz sei ein \"Mob mit menschenverachtenden Äußerungen\" gewesen. Auch er hält den Einsatz für verhältnismäßig. Gut zwei Tage nach den fremdenfeindlichen Vorfällen in Clausnitz hatten Unbekannte zudem einen Brandanschlag auf eine geplante Flüchtlingsunterkunft in Bautzen verübt - Betrunkene schauten den Löscharbeiten johlend zu und behinderten Feuerwehrleute. Auch gegen diese Fremdenfeinde will die sächsische Polizei nun vorgehen. Video: Flüchtlinge beschreiben Ankunft in Clausnitz Video SPIEGEL ONLINE",http://www.spiegel.de/politik/deutschland/clausnitz-thomas-de-maiziere-verteidigt-polizei-einsatz-a-1078564.html,2016-02-21T00:00:00.000Z
"Reaktionen auf Clausnitz und Bautzen \"Die Integration mancher Deutscher ist gescheitert\" Einige sind schlicht entsetzt, andere schlagen verbal zurück. Politiker von CDU und SPD verurteilen die Attacken auf Flüchtlinge in Sachsen scharf. Zum Teil fallen drastische Worte.",http://www.spiegel.de/politik/deutschland/clausnitz-und-bautzen-abscheulich-und-widerlich-a-1078542.html,2016-02-21T00:00:00.000Z
"Bundesweite Solidaritätsaktion Zehntausende Deutsche bilden Menschenketten gegen Rassismus Berlin, München, Leipzig, Hamburg: In diesen und vielen andere Städten haben am Sonntag Zehntausende Menschen ein Zeichen gegen Rassismus gesetzt - kilometerlang. Zehntausende Demonstranten haben sich am Sonntag in mehreren deutschen Städten bei den Händen gefasst und kilometerlange Menschenketten gebildet. Unter dem Motto \"Hand in Hand gegen Rassismus - für Menschenrechte und Vielfalt\" gingen bundesweit rund 40.000 Menschen auf die Straße, um zum morgigen Weltflüchtlingstag ein Zeichen für Zusammenhalt zu setzen. In Berlin, München, Leipzig, Hamburg und anderen Städten verbanden die Menschen durch ihre Ketten symbolisch kirchliche und soziale Einrichtungen, Flüchtlingsunterkünfte und Rathäuser. Organisiert wurde die Aktion von einem Bündnis, dem unter anderem Sozialverbände, der Deutsche Gewerkschaftsbund, die evangelische Kirche, der Zentralrat der Muslime und \" Amnesty International \" angehören. Bei der Auftaktkundgebung in München erklärte Bundestagsvizepräsidentin Claudia Roth (Grüne): \"Wir werden niemals akzeptieren, dass etwa Muslime, Sinti und Roma oder Geflüchtete weniger Wert sein sollen als andere. Wir wenden uns gegen den Hass und jede Ausgrenzung.\" In Leipzig verband eine drei Kilometer lange Menschenkette Moscheen, das Gewandhaus, Oper, Universität, Nikolaikirche und das Synagogenmahnmal. Für den Abend wurden in Hamburg Tausende zu einer Menschenkette erwartet, die die Hauptkirche St. Petri mit der Al Nour Moschee und der jüdischen Gemeinde verbinden sollte. Eine der größten Demonstrationen fand in Berlin statt, wo nach Angaben der Organisatoren etwa 9000 Menschen eine knapp sieben Kilometer lange Menschenkette zwischen dem Roten Rathaus und einem Flüchtlingsheim in Kreuzberg bildeten. In München verbanden die Demonstranten symbolisch mehrere Glaubensgemeinden wie die Sankt-Michaels-Kirche, die israelitische Kultusgemeinde und das Münchner Forum für Islam. Auch in Bochum , Leipzig und anderen Städten gab es am Wochenende ähnliche Aktionen. Günter Burkhardt, Geschäftsführer der Organisation Pro Asyl, verurteilte die europäische Flüchtlingspolitik: \"Europa macht die Grenzen dicht und verrät die Menschenrechte von Flüchtlingen\", kritisierte er in Berlin. \"Man handelt in der irrigen Annahme, dadurch Rassisten im Zaum zu halten. Der Versuch der Abriegelung Europas gegen Flüchtlinge, ein Europa der Zäune, ist aber Wasser auf die Mühlen der Rassisten.\" Neben den Großstädten demonstrierten auch in sechzehn weiteren Städten - darunter Bonn, Karlsruhe, Münster und Osnabrück - mehrere Tausend Menschen. Am Samstag hatten 8500 Menschen in Bochum eine Menschenkette gebildet.",http://www.spiegel.de/politik/deutschland/hand-in-hand-gegen-rassismus-bundesweite-solidaritaetsaktion-zum-weltfluechtlingstag-a-1098510.html,2016-06-19T00:00:00.000Z
"EU in der Existenzkrise Künftig ganz anders - aber nicht besser Nicht der Brexit zerlegt die EU, sondern ihre vielen ungelösten Krisen. Die Bürger haben den Glauben an eine gute Zukunft verloren. Das rächt sich jetzt. Eine Kolumne von Henrik Müller Roland Bäge Henrik Müller ist Professor für wirtschaftspolitischen Journalismus an der Technischen Universität Dortmund. Zuvor arbeitete der promovierte Volkswirt als Vizechefredakteur des manager magazin. Außerdem ist Müller Autor zahlreicher Bücher zu wirtschafts- und währungspolitischen Themen. Für SPIEGEL ONLINE gibt er jede Woche einen pointierten Ausblick auf die wichtigsten Wirtschaftsereignisse der Woche. Mehr Artikel von Henrik Müller Kolumne Es war wie ein fernes Gewittergrollen: Zunächst donnerte es bedrohlich, aber in sicherer Distanz. Allmählich kam es näher, um sich jetzt plötzlich mit voller Wucht zu entladen. Dass vieles schiefläuft in Europa, ist seit Jahren offensichtlich: zig Millionen Arbeitslose, bröckelnde Lebensstandards, verbreitete Perspektivlosigkeit, Überfremdungsängste. Nun drohen sich die aufgestauten Spannungen mit Wucht zu entladen. Europa könnte sich bald in einem Großunwetter wiederfinden - gravierende Hagelschäden inklusive. Nie seit dem Zweiten Weltkrieg war die europäische Idee von so vielen Seiten unter Druck. Wahlen lassen sich mit der EU derzeit kaum noch gewinnen. Nicht in England, wo das Volk am Donnerstag über den Verbleib in der EU abstimmt und die Umfragen auf einen Sieg der Brexit -Befürworter deuten. Nicht in Italien, wo am heutigen Sonntag Virginia Raggi, die Kandidatin der Frust-Bewegung Fünf Sterne, zur Bürgermeisterin Roms gewählt werden dürfte . Nicht in Frankreich, wo die erklärte EU-Gegnerin Marine Le Pen Chancen hat, kommendes Jahr Staatspräsidentin zu werden. Nicht in Polen, wo die regierende PiS-Partei versucht, das Land und die Wirtschaft auf stramm nationalen Kurs zu trimmen. Nicht in den Niederlanden , wo kürzlich eine Frustkoalition per Referendum gegen das Assoziierungsabkommen mit der Ukraine gestimmt hat. Nicht in Österreich, wo der Fast-Sieg der FPÖ bei den Präsidentschaftswahlen die Stärke der Rechten gezeigt hat. Nicht in Deutschland, wo die AfD sich im Parteienspektrum etabliert und Finanzminister Wolfgang Schäuble , eigentlich ein Gesinnungseuropäer, inzwischen vor einer tieferen Integration der EU warnt . (Lesen Sie hier das ganze Gespräch mit Wolfgang Schäuble im SPIEGEL .) Künftig ganz anders - aber nicht besser Europa, das ist die Lage, verliert dramatisch an Rückhalt. Auch wirtschaftlich ist die Situation instabil. So scheuen Konzernchefs inzwischen davor zurück, ihren Unternehmen dezidiert europäische Strategien zu verpassen. Kein Wunder: Wer investiert schon in einen stagnierenden Markt, der sich in Kürze selbst zerlegen könnte? Taumelnde Börsenkurse und ein schwächlicher Euro in der abgelaufenen Woche belegen die Angst vor dem Brexit und seinen Folgen . Was sich über Jahre aufgestaut hat, könnte sich jetzt in einem großen Knall entladen. Selbst wenn die Briten sich fürs Bleiben entscheiden, werden sich die Risse zwischen den Lagern und den Nationen weiten, wird das Misstrauen gegen die Institutionen bleiben, werden Gefühle die reine Vernunft übertönen. So viel lässt sich sagen: Europa wird künftig ganz anders - aber mit Sicherheit nicht besser - aussehen, als es die Nachkriegsgenerationen gewohnt sind. Zwei Entwicklungen überlagern sich derzeit: eine Komplexitätskrise und eine Legitimationskrise. Die Komplexitätskrise ist nicht nur ein europäisches Problem, sondern ein westliches. Sie spielt den großen Vereinfachern in die Hände. Populistische Politiker scheuen sich nicht, simple Lösungen für komplexe Probleme zu versprechen - von Donald Trump über Boris Johnson bis Viktor Orbán . Ihr Appeal besteht darin, dass sie in einer globalisierten, hochtechnisierten Welt, die schwer zu durchschauen und manchmal schlicht unberechenbar ist, all die komplizierten und gelegentlich widersprüchlichen Fakten ausblenden und einfache, allgemein verständliche Geschichten erzählen. Die Vereinfacher haben die bessere Geschichte In diesen Geschichten gibt es Gute und Böse, Opfer und Schuldige. Es gibt das große Wir, das sich behaupten muss, wahlweise gegen die da oben oder die Fremden. Der Glaube an die Stärke der eigenen Nation ersetzt die vernünftige Nutzenabwägung. In Großbritannien war das gut zu beobachten. Da versuchten die EU-Befürworter mit allerlei harten Fakten zu überzeugen. Das Finanzministerium rechnete vor, wie viele Tausend Pfund eine durchschnittliche Familie durch einen Brexit verlieren würde. Der Internationale Währungsfonds ( IWF ) und der Industrieländerklub OECD - sie alle bemühten sich, mit Zahlen zu argumentieren. Doch die Appelle ans rationale Eigeninteresse verfingen nicht. Im Gegenteil: Je mehr Brexit-Szenarien auf die Bürger einprasselten, desto mehr Zulauf bekamen die Ausstiegsbefürworter. Sie haben einfach die bessere Geschichte: Das große Britannien, Mutterland der parlamentarischen Demokratie und vormalige Weltmacht, wäre besser dran, wenn es nur wieder allein über sich bestimmen könnte - wenn es souverän wäre und nicht mehr von Brüssel und Berlin gegängelt würde. Die Antwort auf eine zentrale Frage allerdings bleiben die Populisten schuldig: Wie kann eigentlich auf Dauer eine Demokratie funktionieren, wenn die Vernunft in der politischen Auseinandersetzung keine Chance mehr hat? Hinzu kommt die Legitimationskrise der EU. Europa ist seit den Fünfzigerjahren ein technokratisches Projekt, vorangetrieben und gesteuert von Fachleuten. Auf nationalstaatlicher Ebene gibt es kein EU-Staatsvolk, keinen gemeinsamen Kommunikationsraum, keine europäische ARD, keinen europäischen SPIEGEL. Grenzüberschreitende Debatten, in denen sich ein gemeinsamer Volkswille herausbilden könnte, finden nicht statt. Potenzial, Europa zu zerlegen Die fehlende demokratische Basis war solange kein Problem, wie die EU gute Ergebnisse erzielte. Europa legitimierte sich durch seine Taten - es löste Probleme und verbesserte das Leben der Bürger. Noch im vorigen Jahrzehnt funktionierte das prächtig: Die Lebensstandards stiegen, die Bürger erwarteten eine gute, sichere Zukunft. Die EU lieferte. Entsprechend groß war die Zustimmung. Das ist Geschichte. Die EU steckt einer ganzen Kette von Krisen fest. Die Eurokrise wird immer wieder aufs Neue vertagt. In der latenten Auseinandersetzung mit Russland ist die EU auf die Präsenz von US-Militär angewiesen. Angesichts des Flüchtlingszustroms im vorigen Jahr zogen die Mitgliedstaaten plötzlich wieder nationale Grenzzäune. Von gemeinsamen europäischen Werten war nicht mehr viel zu sehen. Europa liefert nicht mehr. Jedenfalls nicht genug, um seine Existenz zu legitimieren. Die Komplexitätskrise und die Legitimationskrise verbinden sich nun zu einem gefährlichen Gemisch. Es hat das Potenzial, Europa zu zerlegen. Jene technokratischen Eliten, die das EU-Projekt vorangetrieben haben, genießen kaum noch Vertrauen. Ihre komplizierten Argumentationen wollen immer weniger Leute hören, und wer es dennoch tut, glaubt ihnen nicht. Einfache Erzählungen ersetzen Fakten. Viele Briten glauben, Brüssel sei schuld an allem Übel. Die Deutschen finden, die Griechen und Mario Draghi seien schuld an der Misere. Die Italiener glauben, die Deutschen mit ihrem exzessiven Sparfimmel seien die Übeltäter. Und so weiter. Das populistische blame game vertieft die existierenden Risse zu Gräben. In den vergangenen Jahrzehnten konnte man sich in Europa darauf verlassen, dass Populisten sich irgendwann selbst entzaubern würden. Ob Silvio Berlusconi oder Jörg Haider - am Ende würden sich ihre Versprechen als irreal erweisen und ihre überbordenden Egos als untragbar. So einfach ist die Sache nicht mehr. Leider. Die wichtigsten Wirtschaftsereignisse der kommenden Woche MONTAG BERLIN - Das Thema der Woche: Brexit - In Berlin stellt der Bundesverband Groß- und Außenhandel die Frage \"Was wird aus Großbritannien?\". Die SPD-nahe Friedrich-Ebert-Stiftung lädt zum Thema \"Europe Calling\" mit Europaparlamentschef Schulz, Währungskommissar Moscovici und der deutschen Migrationsbeauftragten Özoguz. Gegen Abend schaut Schulz noch bei Merkel vorbei. BRÜSSEL - Gefährliche Zeiten - Treffen der EU-Außenminister DIENSTAG KARLSRUHE - Draghi und die Richter - Das Bundesverfassungsgericht urteilt über das EZB-Programm OMT, mit dem Draghi 2012 seine Ankündigung untermauert hat, man werde die Eurozone zusammenhalten \"whatever it takes\". BERLIN - Egal, was auf dem Programm steht - der drohende Ausstieg Großbritanniens aus der EU wird das Thema beim Wirtschaftstag des CDU-Wirtschaftsrats sein. Mit allerlei Prominenz: Merkel, Eurogruppen-Chef Dijsselbloem , Finanzminister Schäuble, Ex-Präsident Sarkozy , die Vorstandschefs Zetsche (Daimler), Cryan (Deutsche Bank), Engel ( Evonik ), EU-Kommissar Oettinger, Kanzleramtschef Altmaier , Verkehrsminister Dobrindt , Bahn-Vorstand Pofalla . HANNOVER - Wechselstrom - Zwischen Dieselgate und Elektrostrategie lädt Volkswagen zur Hauptversammlung. DONNERSTAG LONDON - Stay (just a little bit longer) - Referendum über den Verbleib Großbritanniens in der EU. MESEBERG - Korporatismus @work - Kanzlerin Merkel und Vize Gabriel treffen sich mit Vertretern von Gewerkschaften, Kammern, Arbeitgeber- und Industrieverbänden. FREITAG POTSDAM - Die Angie-und-Horst-Show - Klausurtagung der Spitzen von CDU und CSU (bis Samstag). MÜNCHEN - Stimmungstest - Ifo-Geschäftsklimaindex für Deutschland. SONNTAG MADRID- Versuch eines Neustarts - Nach den fehlgeschlagenen Bemühungen einer Regierungsbildung wird in Spanien ein neues Parlament gewählt.",http://www.spiegel.de/wirtschaft/soziales/die-eu-steckt-in-der-existenzkrise-unabhaengig-vom-brexit-a-1098425.html,2016-06-19T00:00:00.000Z
"Sommerinterview Gauck pflichtet Merkel beim Thema Flüchtlinge bei Joachim Gauck sieht Deutschland in einem guten Zustand - trotz Problemen bei der Integration von Flüchtlingen. Im ZDF-Sommerinterview stellt sich der Bundespräsident demonstrativ hinter Angela Merkel. Bundespräsident Joachim Gauck gibt Kanzlerin Angela Merkel in der Flüchtlingspolitik Rückendeckung. \"Ich mag mir eine Regierungschefin nicht vorstellen, die vor das Volk tritt und sagt, wir schaffen das nicht. Also, warum sollte man eine solche Person wählen\", sagte Gauck im ZDF-Sommerinterview mit Blick auf das von Merkel geprägte Motto \"Wir schaffen das\". Die Bundeskanzlerin und er verfolgten dieselbe Linie beim Thema Flüchtlinge, sie verwendeten nur \"unterschiedliche Ausdrücke\". Laut Gauck befindet sich Deutschland trotz der Probleme bei der Integration der Flüchtlinge nicht in einer bedenklichen Lage. \"Das Land ist nicht in einem Zustand wie ein sinkendes Schiff, es ist noch nicht mal in einem Zustand eines schweren Orkans, sondern es sind Böen, die uns schütteln, und es sind Böen, die die Gesellschaft auch durcheinanderbringen ein wenig.\" Gauck unterstützte in dem Interview auch den sicherheitspolitischen Kurs von Bundesinnenminister Thomas de Maizière (CDU). Der Minister habe \"ganz nüchtern\" klargestellt, ein Burka-Verbot und die Abschaffung der doppelten Staatsbürgerschaft seien mit ihm nicht zu machen, sagte Gauck. \"Also da kann ich doch gut mit leben.\" De Maizière hatte ein umfangreiches Sicherheitspaket vorgelegt , um die die Gefahr weiterer Terroranschläge in Deutschland einzudämmen. Forderungen aus der Union, die Ganzkörperverschleierung muslimischer Frauen etwa mit Burkas zu verbieten und die doppelte Staatsbürgerschaft abzuschaffen, erteilte er eine Absage.",http://www.spiegel.de/politik/deutschland/angela-merkel-joachim-gauck-stellt-sich-hinter-die-bundeskanzlerin-a-1107564.html,2016-08-13T00:00:00.000Z
