article,article_url,date
"Mindestens 40 Tote Erneut Flugzeugabsturz in Angola Zum zweiten Mal innerhalb von gut zwei Wochen ist ein Flugzeug des russischen Typs Antonow in Angola abgestürzt. Dabei starben mindestens 40 Menschen. Luanda - Die Antonow 26 war kurz nach dem Start vom Flughafen der Hauptstadt Luanda verunglückt und auf eine Flüchtlingssiedlung im Süden der Stadt gestürzt.  DPA Die Maschine stürzte auf ein Flüchtlingslager Über die Ursache des Absturzes war zunächst noch nichts bekannt. Der Pilot gab vor dem Unglück die Zahl der Passagiere mit 44 an, die Chartergesellschaft \"Asa Pesada\" ging von 37 Fluggästen aus. Nach Behördenangaben überlebte keiner der Insassen.   Erst am 31. Oktober war im Nordosten Angolas eine Antonow 26 abgestürzt, wobei alle 48 Insassen getötet wurden.  Angola hatte sich im Juli in Moskau über den schlechten Zustand der russischen Flugzeuge beschwert, die in Angola operieren. So beklagten sich die Angolaner darüber, dass die Maschinen schlecht gewartet würden und die Betreiber teils gefälschte russische Lizenzen vorwiesen.",http://www.spiegel.de/panorama/mindestens-40-tote-erneut-flugzeugabsturz-in-angola-a-102953.html,2000-11-16T00:00:00.000Z
"Kundus Dostams tödlicher Kessel Von drei Seiten stürmen die Kämpfer der Nordallianz jetzt auf Kundus vor. Ihr General, Abdul Raschid Dostam, hat den Taliban ein Ultimatum gestellt: Bis Sonntag sollen sie aufgeben, sonst würden sie eliminiert. In der letzten nordafghanischen Taliban-Hochburg sind Tausende Getreue von Mullah Omar eingekesselt. AP Explosion nach einem Luftschlag der Amerikaner gegen Kundus Kabul - Die Nordallianz griff trotz einer angeblich zuvor erzielten Vereinbarung über eine Kapitulation der Taliban Kundus mit Artillerie, Panzern und Granatwerfern an. Zeitweise wurde sie von amerikanischen B-52-Bombern unterstützt, berichtete der US-Sender CNN. Mehrere hundert Taliban-Milizionäre seien übergelaufen, andere leisteten erbitterten Widerstand. Verzweifelte Flüchtlinge versuchten, aus dem umkämpften Gebiet zu fliehen. In Kundus sind seit einer Woche nach Schätzungen Tausende von Taliban sowie ausländische Mitkämpfer aus arabischen Staaten, aus Pakistan und Tschetschenien eingeschlossen. Dostam behauptet, der Taliban-Kommandeur Mullah Feisal habe am Donnerstag bei Verhandlungen die Kapitulation bis Sonntag zugesagt. Den Taliban-Milizen sei freies Geleit in ihre Heimatregionen versprochen worden, ihre ausländischen Helfer würden aber wie Kriegsverbrecher behandelt. Man werde sie vor afghanische Gerichte stellen, sagte Dostam. Die meisten kommen aus arabischen Ländern und aus Pakistan. Die USA wollen nicht, dass diese Milizionäre freikommen, da viele vermutlich zum Terrornetzwerk al-Qaida gehörten. Unbestätigten Berichten zufolge lehnen die \"arabischen Afghanen\" eine Kapitulation ab.  Saudi-Arabien will seine mit den Taliban verbündeten \"Gotteskrieger\" Zeitungsberichten zufolge aus Afghanistan zurückholen. Die arabische Zeitung \"al-Hayat\" berichtete, Riad habe bereits erste Schritte dazu unternommen.  Der britische Außenminister Jack Straw rief die Nordallianz zur Zurückhaltung in Kundus auf. Für Kabul forderte er mit Blick auf die Nordallianz, die in Kabul derzeit faktisch allein herrscht, eine zivile Verwaltung bereits vor der Bildung einer Übergangsregierung. Die am Montag in Bonn beginnende Afghanistan-Konferenz sei eine Chance, Schritte zur Befriedung Afghanistans zu unternehmen.  Dagegen äußerte der pakistanische Außenminister Abdul Sattar die Sorge, dass die Nordallianz bei den Gesprächen zu großes Gewicht erhalten könnte. Ein Taliban-Sprecher wies Berichte zurück, wonach ihr Führer Mullah Mohammed Omar sich abgesetzt und einen Stellvertreter ernannt habe. Solche Behauptungen entbehrten jeder Grundlage.   Sollte Kundus an die Nordallianz fallen, würde den Taliban als einzige größere Stadt noch Kandahar im Süden des Landes bleiben. Vor dem Beginn der US-geführten Angriffe am 7. Oktober hatten die Taliban etwa 90 Prozent Afghanistans kontrolliert.",http://www.spiegel.de/politik/ausland/kundus-dostams-toedlicher-kessel-a-169261.html,2001-11-23T00:00:00.000Z
"Los Feliz/Silver Lake Wo IQ vor Körbchengröße kommt Die heruntergekommenen Stadtteile Los Feliz und Silver Lake mausern sich zum East Village von Los Angeles: Künstler, Drehbuchautoren, Fotografen und Schauspieler flüchten aus dem bourgeoisen Beverly Hills in die alternative Atmosphäre der ehemaligen Elendsviertel. Von Helmut Sorge Christine Harrasser \"In\"-Diner \"Fred 62\" in Los Feliz: So en vogue wie die East-Village-Bewohner Ein Blumenladen mit duftenden Rosen. Echte Tulpen, die ihre Blätter verlieren. Kein Plastik made in China. Daneben ein Hochzeitsfotograf, dessen überdimensionale Farbfotos die weiß und schwarz abgesetzten Paare in Fröhlichkeit dokumentieren, so wie's eben ist, wenn die Hochzeitsnacht bevorsteht und der Traum vom lustigen Leben in der Zweisamkeit amtlich abgestempelt wurde.  Gegenüber das \"Dresden\", ein Restaurant, das in den fünfziger Jahren eingerichtet wurde, wonach offenbar keinen Stuhl mehr verrückt wurde - folglich wird dieses Speiselokal häufig als Filmkulisse gebucht. Die Bücherei \"Skylight Books\" nebenan (in der so mancher Käufer Birkenstock-Sandalen trägt und Frauen schätzt, die naturverbunden auf BHs und die Entwachsung der Achselhaare verzichten), wurde von den \"Dresden\"-Eignern und einigen Anrainern vor dem Konkurs bewahrt. Die Kellner des \"Le Figaro\", stellen morgens rötlich gefärbte Korbstühle vor die Tür, die Decken auf den Tischen vorm \"Vermont\" sind weiß. Die Wände von \"Fred 62\", zwei Ecken weiter, sind knallgrün gestrichen, die Stühle davor blau. Farben, bunte Flecken Farben also, bunte Flecken im Viertel, Wandmalerei hier und dort, Gelassenheit, ein joint, das \"Zen\"-Cafe, in dem Bands aufspielen, und die Bedienung - hauptsächlich arbeitslose Schauspieler oder Trapez-Artisten - Sushi serviert. Los Feliz, Silver Lake und - allmählich - Echo Park, sind \"neighborhoods\", die sich in einer anderen Welt bewegen. Die Szene. In Sunset-nähe. Nicht Hollywood und auch nicht Bussi-bussi - auch wenn schon mal Rod Stewart und Robbie Williams in den Restaurants feiern. Bezopfte Männer sind \"in\", wie auch Lesben, die sich Glatzen schneiden, Intelligenz-Quotienten sind hier wichtiger als Busenmaße. Christine Harrasser Programmkino \"Los Feliz\": IQ zählt mehr als Busenmaße Die Bürger von Los Feliz und Silver Lake glauben sich so en vogue wie die East-Village-Bewohner auf Manhattan vor dem 11. September: Drehbuchschreiber, denen Beverly Hills zu bourgois ist, Fotografen, Kameraleute, Kunstmaler, Schauspieler, Autoren wie Janet Finch, deren Roman \"White Oleander\" demnächst Premiere hat, oder Marissa Silver, deren \"Babe in Paradise\" zu den \"Skylight\"-Bestsellern zählt. Hoffnungsvolle Produktionsgesellschaften haben sich in der Gegend niedergelassen, wie \"Capture\", drei filmschaffende deutsche Frauen, die notfalls sogar wissen, wo jene Unterwäsche zu kaufen ist, die Marlene Dietrich während des Zweiten Weltkriegs trug. Auch \"Graft\" zählt zu den Bewohnern, eine Art Architektur-Kollektiv: Fünf, an der TH von Braunschweig ausgebildete Deutsche. Sie sind in der Stadt bereits derart anerkannt, dass nicht nur die \"L.A. Times\" ihnen unendliche Spalten widmete, sondern sogar Hollywood-Star Brad Pitt sie für ein Bauprojekt engagierte.   Das Image des nahe Silver Lake gelegenen Echo Park, so glaubt Klaus Messner, sei allerdings noch \"äußerst mies\". Feuergefechte um Mitternacht, Verrückte nicht nur in einer örtlichen psychiatrischen Klinik, sondern oft genug auch draußen auf den Strassen. Messner, einer der Manager im feinen \"Sunset Marquis\"-Hotel am Sunset, hat sich in Echo Park gleichwohl eine Immobilie zugelegt. Statt verchromter BMWs stehen verbeulte Pick-up-Trucks vor der Tür, das passt eher zu seinem Lebensstil: \"Real\", sagt er, \"greifbar\". So denkt auch Udo Kier, der auf Bösewichte abonnierte Hollywood-Deutsche. Ihm gefällt die Multi-Kulti-Kultur. Die \"Short-Stop\" Bar, \"The Echo\", wie auch die Galerien, die sich an der Echo Park Avenue etablierten und die Waschautomaten, in denen die illegalen Latinos ihre zwei Hemden und Socken schleudern. Die Aufgeklärten der Hollywood-Society Christine Harrasser \"Vista\"-Kino auf dem Sunset Boulevard in Los Feliz: Nicht Hollywood und auch nicht Bussi-bussi Nachts knattern zwar die Polizisten mit ihren Hubschraubern über den Bezirk und leuchten mit ihren Suchscheinwerfern die Straßen aus, weil irgendwo Banden ihre Rivalen von der Avenue schießen. \"Ist nicht lustig\", meint Kier und tröstet sich mit der Gewissheit, dass Polizei-Scheinwerfer auch am anderen Ende des Sunset die Vorgärten der Geld- und Glamour-Society erhellen, sobald ein Fußgänger morgens um drei vor den Wimbledon-ähnlich kurzgeschnittenen Rasen gemeldet wird. Und wehe, der Passant ist schwarz oder Latino. Also sind die Yuppies ihren Vierteln, die irgendwo zwischen Trauma und Traum angesiedelt sind, verbunden, zumal es selbst Madonna einmal wagte, in Los Feliz einzuziehen, wie auch Lenny Kravitz, Nicolas Cage oder Bridget Fonda - die Aufgeklärten der Hollywood-Society, die nachvollziehen können, warum sich auch Charles Bukowski oder Raymond Chandler einst in dieser Gegend betteten.   Flea alias Michael Balzary, Bassist der Red Hot Chili Peppers, hat in Silver Lake ein von ihm finanziertes \"Conservatory\" entwickelt, in dem sowohl seine Chili-Kameraden, wie auch auf klassische Komponisten ausgerichtete Lehrer unterrichten. In diesem \"East Village\" von L.A., das tatsächlich im Norden von downtown liegt, sind im letzten Dezember sogar Musik-Größen wie Sting, Elton John und eben die Chili Peppers aufgetreten - zugunsten der \"Hollywood Sunset Free Clinic\". Zwölf Kilometer von den zehn Millionen Dollar teuren Villen entfernt, werden jene - kostenlos - behandelt, die sich eine Krankenversicherung nicht leisten können. Einige Tausend der 60 Millionen insgesamt krankenversicherungslosen Amerikaner. Die Stars spielten, um die Existenz der Klinik zu sichern.  Die Sanftheit von Mittelmeervillen Helmut Sorge \"Skylight Books\": Autorenlesungen und Birkenstocksandalen Vor nahezu 100 Jahren bereits haben sich in der Gegend in und um Los Feliz und Silver Lake die ersten Filmemacher angesiedelt, Walt Disney etwa, zwei Häuserblocks vom \"Skylight\" entfernt. Nirgendwo in L.A. haben die Modernen, Rudolph Schindler, Richard Neutra, John Lautner, Gregory Ain so viel in die Zukunft gebaut wie in Silver Lake, etwa an der Micheltorrena Street. Oder oben in den Hügeln von Los Feliz, das 1924 von Frank Lloyd Wright erbaute Ennis-Brown House, das Ridley Scott in seinen \"Blade Runner\" einbaute. Die Hügel, die verschlungenen Straßen, die am \"Lake\" selbst, einem Reservoir, die Sanftheit von Mittelmeer-Villen verbreiten, hatten es nicht nur den Architekten sondern auch Regisseuren angetan. Ein Beispiel aus der Filmgeschichte: Zwei hilflose Lieferanten versuchen ein Piano die endlos lange Treppe hinaufzuwuchten, zu tragen, zu schieben. Zuerst der Dünne vorn, der Dicke hinten. Dann umgekehrt. Sie lassen nichts unversucht. Letztlich scheitern sie - Dick und Doof. Für ihren Film \"The Music Box\" plagten sich Stan Laurel und Oliver Hardy, die tatsächlich in dem Viertel auch wohnten, die unendliche Treppe an der Vendome Street hinauf.  Sushi statt Hot Dogs im Dodgers-Stadion Volker Corell Straßenszene in Los Feliz: Bunte Flecken im Viertel Irgendwann verschwanden die Studios, wurden aufgekauft, meldeten Konkurs, oder siedelten um, hinüber nach Hollywood. Und mit ihnen packten die Filmschaffenden ihre Koffer - Cary Grant, Gloria Swanson und Mary Pickford. Zurück blieb die Hoffnungslosigkeit. Der Jubel aus dem nahen Baseball-Stadion der Dodgers vermischte sich mit dem dumpfen, rhythmischen Knall der automatischen Pistolen der Gangs. Der amerikanische Traum von den unbegrenzten Möglichkeiten verschwand. Beinahe jedenfalls: Jenseits der südlichen Grenze der USA glaubten und glauben die Menschen noch daran. Eine Hand voll Dollar bedeutet für die Latinos bereits Aufstieg, Hoffnung ist der Lohn, mit dem sie die Angst dämpfen, die sie erfasst, sobald sie den Stacheldraht durchkriechen, die Flüsse an der Grenze durchqueren, obgleich sie nicht schwimmen können.   In den verlassenen Häusern von Echo Park, Silver Lake, Los Feliz, erleben die Emigranten ihr Amerika aus Elend, Einsamkeit und Rassismus. Aber sie finden auch einen Job, eine Zukunft und eine Bleibe. Unweit dieser tristen Welt wuchs Leonardo di Caprio auf, seit seinem Untergang mit der \"Titanic\" ein Teenie-Star. Er besuchte die \"John Marshall High School\", die vom Baustil an eine ehrwürdiges Universitäts-Gebäude in Oxford oder Cambridge erinnert - folglich wird die Schule für so manchen Hollywood-Film als Kulisse gepachtet. Gelegentlich, so behaupten seine Freunde, käme Leonardo zurück, um wie früher mit ihnen Basketball zu spielen. Verbürgt ist nur: Er unterstützt die örtliche Leihbücherei gelegentlich mit einem Scheck.  Volker Corell Wandmalerei in Los Feliz: Wo Leo einst zur Schule ging... Im \"Skylight\"-Buchladen drängen sich inzwischen Hunderte, wenn beispielsweise James Elliott aus seinen Bestsellern liest. Clubs wie die \"Bigfoot Lodge\" und \"Spaceland\", Lokale, wie \"Millie's\", \"Eat Well\" oder auch beliebte Plätzchen wie der \"Coffeetable\" (wo Brad Pitt gerne mit Journalisten redet) oder \"Cafe Stella\" sind \"in\", wie auch das Art Deco Kino \"Vista\" unten am Sunset. Inzwischen mehren sich die Indikatoren für die Renaissance der verlorenen Viertel: \"Starbucks\", die Avantgarde der mechanisierten Kaffee-Kultur in Plastikbechern, sichert sich bereits verlassene Lokale für die Kaffeeküche. Und die Baseball-Fans, die sich bislang mit \"Dodger dogs\", Würstchen also, begnügen mussten, können jetzt im Stadion auch Sushi genießen.",http://www.spiegel.de/kultur/gesellschaft/los-feliz-silver-lake-wo-iq-vor-koerbchengroesse-kommt-a-185510.html,2002-03-05T00:00:00.000Z
"Anschlag in Israel verhindert 600-Kilo-Bombe im Auto Israelische Sicherheitskräfte haben offenbar einen neuen schweren Anschlag vereitelt. Sie fingen in der Nähe der Stadt Hadera im Norden Israels einen Wagen mit 600 Kilogramm Sprengstoff ab. Jerusalem - Die Bombe wurde in einem Auto sichergestellt, das der Fahrer nach einer Verfolgungsjagd mit Sicherheitskräften verlassen hatte. Offenbar sollte der Sprengstoff aus dem Westjordanland nach Israel geschmuggelt werden. Die Polizei war auf den Wagen, der gemeinsam mit einem weiteren Auto unterwegs war, aufmerksam geworden, weil er mit hoher Geschwindigkeit auf einer unbefestigten Straße fuhr. Die beiden Fahrer flüchteten zu Fuß. Experten brachten den Sprengsatz zur kontrollierten Explosion. Die Polizei geht davon aus, dass der Sprengstoff vor oder während des am Freitag beginnenden zweitägigen jüdischen Neujahrfestes gezündet werden sollte. \"Ich glaube, dass heute Morgen eine sehr große Tragödie abgewendet wurde\", sagte Polizeichef Jacob Borowski im israelischen Rundfunk.  Im Flüchtlingslager Balata bei Nablus im Westjordanland wurden unterdessen in der Nacht drei Palästinenser festgenommen. Nach einem Bericht von Radio Israel sollen sie während des Neujahrsfests einen Anschlag in Israel geplant haben.",http://www.spiegel.de/politik/ausland/anschlag-in-israel-verhindert-600-kilo-bombe-im-auto-a-212517.html,2002-09-05T00:00:00.000Z
"Nahostkrise Warten auf die Rache Angespannte Atmosphäre in Nahost. Nach der Exekution des Hamas-Gründers Scheich Jassin kam es in der vergangenen Nacht zu zahlreichen Zusammenstößen zwischen israelischem Militär und Palästinensern. Im Gaza-Streifen fuhren Panzer auf. AP Trauerzug in Gaza: Maskierte Hama-Aktivisten geben dem getöteten Scheich Jassin das letzte Geleit Gaza/Jerusalem - Überall in den Palästinensergebieten kam es zu Trauerkundgebungen und Protesten gegen Israel. Bei Zusammenstößen mit israelischen Soldaten wurden mindestens fünf weitere Palästinenser getötet.  Wie die israelische Tageszeitung \"Haaretz\" in der Nacht zum Dienstag in ihrer Onlineausgabe berichtete, wurden Dutzende Palästinenser bei Unruhen im Gazastreifen und dem Westjordanland verletzt. Mehrere jüdische Siedlungen und Armeeposten in den Palästinensergebieten seien mit Granaten oder Raketen beschossen worden. Verletzte habe es dabei auf israelischer Seite nicht gegeben. Am Abend rückten Panzer in den Norden des Gazastreifens vor. Zuvor waren von dort aus mehrere Raketen auf israelisches Gebiet abgefeuert worden.  AP Scheich Jassin: Den Einsatz von Kindern als Selbstmordattentätern gut geheißen Zuvor hatten Hunderttausende Palästinenser den Leichnam Scheich Jassins in einem gigantischen Trauerzug in Gaza-Stadt zu seiner letzten Ruhestätte geleitet. Die Hamas und andere radikale Palästinenser-Organisationen kündigten umgehend Vergeltung an. Vielerorts in den Palästinensergebieten schlugen Trauerkundgebungen in gewaltsame Proteste gegen Israel um.   Im Flüchtlingscamp Khan Junis im Süden des Gazastreifens schossen israelische Soldaten nach palästinensischen Angaben in die aufgebrachte Menge und töteten drei Palästinenser, darunter einen 13-Jährigen. Im Flüchtlingslager Batala in Nablus im Westjordanland erschossen israelische Soldaten nach Angaben von Ärzten einen palästinensischen Journalisten. Nach Angaben der Armee handelte es sich um einen Hamas-Aktivsten, der zuvor auf die Truppen geschossen habe. In Hebron im Westjordanland wurde nach Angaben von Augenzeugen ein 34-Jähriger Mann erschossen, der Steine auf die Soldaten geworfen hatte.  Israel ist wegen der gezielten Tötung des Gründers und geistigen Führers der radikalislamischen Hamas-Bewegung, Scheich Ahmed Jassin, international kritisiert worden. Uno-Generalsekretär Kofi Annan forderte Israel auf, solche Tötungen umgehend einzustellen. \"Außergerichtliche Tötungen sind ein Verstoß gegen das internationale Recht\", hieß es in der Erklärung Annans. \"Israel hat kein Recht zu außergesetzlichen Tötungen\", betonten auch die EU-Außenminister in einer gemeinsamen Erklärung. Verhaltener reagierte die US-Regierung: Man sei tief beunruhigt, hieß es im Außenministerium in Washington. US-Außenamtssprecher Richard Boucher zeigte sich besorgt, dass die Aktion die Spannungen im Nahen Osten erhöhen werde und dem Friedensprozess nicht dienlich sei. Es gebe allerdings auch \"keinen Zweifel am Recht Israels, sich gegen den brutalen Gebrauch von Terror der Hamas und anderer Organisationen zu verteidigen\", sagte Boucher.  Jassin war am frühen Montagmorgen beim Verlassen einer Moschee in Gaza-Stadt von einem israelischen Kampfhubschrauber mit Raketen beschossen und getötet worden. Mit dem 67-Jährigen Hamas-Gründer starben acht seiner Begleiter.",http://www.spiegel.de/politik/ausland/nahostkrise-warten-auf-die-rache-a-291895.html,2004-03-23T00:00:00.000Z
"Darfur USA schlagen neue UN-Resolution vor Die USA haben einen neuen Uno-Resolutionsentwurf zur Flüchtlingskrise in Darfur vorgelegt. Demnach soll eine stärkere Beobachtertruppe in die westsudanesische Provinz entsandt werden. Der Regierung in Khartum wollen die USA mit einem Boykott der Erdölexporte drohten, falls sie die arabischen Reitermilizen nicht entwaffnet. New York/Khartum - Der Resolutionsentwurf, der von der Nachrichtenagentur AP verbreitet wurde, wirft dem Sudan vor, seine Verpflichtungen aus einer früheren Entschließung des Weltsicherheitsrats nicht erfüllt zu haben. Gefordert wird unter anderem, dass die Regierung alle Flüge von Militärmaschinen über Darfur einstellen müsse, wie dies Teil des Friedensabkommens für die Provinz sei. UN-Generalsekretär Kofi Annan wird aufgerufen, eine internationale Untersuchung der Menschenrechtsverletzungen in Darfur einzuleiten. Etwaige Strafmaßnahmen werden eindeutig in Aussicht gestellt, doch wird das Wort \"Sanktion\" nicht explizit erwähnt.  Die sudanesische Regierung appellierte derweil an die Afrikanische Union (AU) und an die die Europäische Union (EU), bei der Umsetzung des Friedensabkommens für Darfur vom April zu helfen. Insbesondere der EU warf die Regierung in Khartum mangelnde Unterstützung für die Zivilbevölkerung vor.  Die AU hat zurzeit 80 Beobachter in Darfur stationiert, die von etwa 300 Soldaten aus Ruanda und Nigeria beschützt werden. Eine gut 3.000 Mann starke internationale Friedenstruppe, wie sie die Vereinten Nationen wünschen, hat der Sudan bislang abgelehnt.",http://www.spiegel.de/politik/ausland/darfur-usa-schlagen-neue-un-resolution-vor-a-317281.html,2004-09-09T00:00:00.000Z
"Raubzug Sudanesische Reiter greifen Dorf im Tschad an - 30 Tote Sudanesische Reitermilizen aus der Provinz Darfur haben die Grenze zum Tschad überschritten und in einem Dorf ein Massaker angerichtet. Anschließend kam es zu einem Gefecht mit der tschadischen Armee. N'Djamena - Insgesamt kamen bei dem Überfall der Reiter aus dem Sudan mindestens 36 Menschen ums Leben. Nach Angaben der tschadischen Regierung in N'Djamena fielen die Angreifer gestern Morgen im Osten des Tschad ein.  Die uniformierten Milizen hätten in einem kleinen Dorf in der Region Ouaddai ein Massaker verübt und zahlreiche Tiere gestohlen. Sieben Angreifer wurden den Angaben zufolge festgenommen. Bei einem anschließenden Gefecht mit der tschadischen Armee starben mindestens acht Angreifer und zwei Soldaten, hieß es.  Der Tschad grenzt im Osten an die sudanesische Krisenregion Darfur, die seit Februar 2003 von einem Bürgerkrieg erschüttert wird, in dem sich Rebellengruppen, Regierungstruppen und arabische Reitermilizen erbarmungslose Kämpfe liefern. Wiederholt griffen bewaffnete Gruppen aus dem Sudan auch tschadische Regierungstruppen an. Im Tschad halten sich 200.000 Flüchtlinge aus dem Sudan auf. Nach Uno-Schätzungen starben bislang bis zu 300.000 Menschen in dem Konflikt, insgesamt 2,6 Millionen Menschen wurden in die Flucht getrieben.",http://www.spiegel.de/politik/ausland/raubzug-sudanesische-reiter-greifen-dorf-im-tschad-an-30-tote-a-376959.html,2005-09-27T00:00:00.000Z
"Somalia-Krieg Bootsflüchtlinge vermutlich tot Keine Hoffnung mehr für Flüchtlinge aus Somalia: Die Uno geht von mehr als 150 Toten aus. Die Boote, mit denen die Menschen vor dem Krieg in ihrer Heimat flüchten wollten, waren vor zwei Tagen vor der jemenitischen Küste gekentert. Genf - Der Tod von 34 Menschen sei bereits bestätigt, 123 Flüchtlinge würden noch vermisst. Man gehe aber davon aus, dass alle Vermissten tot seien, teilte das Flüchtlingshilfswerk der Vereinten Nationen, UNHCR, heute mit. Zwei Boote mit somalischen Flüchtlingen waren am Mittwochabend vor der Küste Jemens gekentert. Nach Angaben des UNHCR hatte die jemenitische Küstenwache die Boote am Mittwochabend im Golf von Aden beschossen. 357 Überlebende seien in ein Flüchtlingszentrum im Jemen gebracht worden. anr/Reuters",http://www.spiegel.de/politik/ausland/somalia-krieg-bootsfluechtlinge-vermutlich-tot-a-457085.html,2006-12-29T00:00:00.000Z
"Ausländer Kabinett beschließt neues Zuwanderungs- und Bleiberecht Nach langem Streit zwischen Union und SPD hat die Bundesregierung eine Reform des Zuwanderungsrechts auf den Weg gebracht. Mehrere zehntausend abgelehnte Asylbewerber sollen die Chance auf einen gesicherten Aufenthaltsstatus in Deutschland erhalten. Berlin - Das Kabinett billigte den knapp 500 Seiten starken Gesetzentwurf. Im Zentrum stehen neue Bleiberechtsregeln für langjährig geduldete Ausländer sowie neue Vorschriften für den Ehegattennachzug. AP Ausländerbehörde (in Stuttgart): Bleiberecht für geduldete Ausländer Geduldete Ausländer sollen unter bestimmten Voraussetzungen ein Bleiberecht erhalten. Sie müssen allerdings bis Ende 2009 eine Arbeit finden und erhalten in dieser Zeit keine höheren Sozialleistungen.   Mit der Regelung werden elf EU-Richtlinien umgesetzt, teilte Bundesinnenminister Wolfgang Schäuble (CDU) mit. Sie diene somit auch der Harmonisierung des Asylrechts in Europa. Der Nachzug von Ehegatten soll künftig erst ab einem Alter von 18 Jahren möglich sein. Damit will die Regierung gegen Zwangsehen vorgehen und Integration fördern. Die Verweigerung der Teilnahme an Integrationskursen soll mit Sanktionen geahndet werden. Ausländerorganisationen haben in einem offenen Brief an Bundeskanzlerin Angela Merkel gegen den Gesetzentwurf protestiert. Von der neuen Bleiberechtsregelung könnten nach Ansicht der Integrationsbeauftragten Maria Böhmer (CDU) schätzungsweise \"etwas mehr als 60.000\" Menschen profitieren. Dies sei \"ein deutlicher Fortschritt\", sagte die Staatsministerin im Bundeskanzleramt im Deutschlandfunk. Offen ließ die CDU-Politikerin, was mit den Ausländern passiert, die bis Ende 2009 keinen Job gefunden haben. Der Vorsitzende des Bundestagsinnenausschusses, Sebastian Edathy (SPD), sagte im RBB, er gehe davon aus, dass die Regelung zunächst für 100.000 von 180.000 Geduldeten gelten werde. \"Wie viele davon Ende 2009 übrig bleiben werden, wenn sie einen Arbeitsplatz nachweisen müssen, ist schwer abzuschätzen\", so Edathy. Spitzenpolitiker von Union und SPD hatten sich vor gut zwei Wochen auf letzte Details beim Bleiberecht verständigt und damit den Weg für den Gesetzentwurf freigemacht. Die Entscheidung liegt nun bei Bundestag und Bundesrat. In Kraft treten sollen die Neuregelungen nach dem Willen der Koalition zum 15. Juli dieses Jahres. jaf/dpa/AP/ddp",http://www.spiegel.de/politik/deutschland/auslaender-kabinett-beschliesst-neues-zuwanderungs-und-bleiberecht-a-474369.html,2007-03-28T00:00:00.000Z
