article,article_url,date
"Comic-Reporter Joe Sacco Ein schwarz-weißes Bild vom Krieg Was kann ein Comic vom Nahost-Konflikt erzählen? Wenn der Autor Joe Sacco heißt: sehr viel. Der US-Amerikaner recherchiert vor Ort wie ein Reporter und zeichnet dann auf, was er erfahren hat. So entsteht eindringliche Geschichtsschreibung in Strichform - aber mit großer Schlagseite. Von Jan-Frederik Bandel Comics als journalistische Form? Naheliegend ist das nicht. Stolze sieben Jahre hat Joe Sacco an seinem neuen Buch gearbeitet. Menschen mit Aktualitätsanspruch, die schon in Tageszeitungen nur alte News finden, dürfte das kaum genügen. Trotzdem gilt der US-amerikanische Zeichner seit dem Überraschungserfolg seines Comics \"Palestine\" (1993-1995) als Beweis für die These: Comics haben eine Zukunft als journalistisches Genre. Aktualität ist nicht die einzige journalistische Devise, der Sacco eine Absage erteilt. Schon während seines Journalismusstudiums, so erzählt er gern, habe ihn die Vorstellung der \"Objektivität\" abgestoßen. Seine Arbeit hat andere Vorbilder: den sogenannten \"New Journalism\" mit seiner stark subjektiven Färbung und die \"Alternativmedien\" mit ihrem Anspruch, unterdrückte Fakten, verschwiegene Stimmen hörbar zu machen, ohne sich nennenswert um Ausgeglichenheit zu kümmern - die offizielle Version kenne man doch eh zur Genüge. Beide Haltungen übernahm Sacco in \"Palestine\", seinem Buch über Palästina während der ersten Intifada. Sie trugen zum großen Erfolg des Comics genauso bei, wie sie Kern der Kritik daran waren: Sacco, so monierten Kritiker, spare nicht nur die israelische Sicht auf den Nahost-Konflikt fast vollständig aus, er hänge auch einer naiven Romantisierung der Palästinenser nach, deren Erzählungen er grundsätzlich für bare Münze nehme. Auch Saccos Reportageprinzip, die Recherche selbst in den Mittelpunkt zu rücken, diene nur bedingt dem erklärten Ziel, Transparenz zu erzeugen. Schließlich verwische der Zeichner in seiner Grafik die Spuren wieder: Die Augenzeugenberichte würden genauso bebildert wie die Beobachtungen des Reporters, alles scheine unmittelbar real. Kein Haufen von \"einerseits, andererseits\" Auch Saccos neuem Buch ließe sich das vorwerfen - aber \"Footnotes in Gaza\" ist keineswegs einfach eine Fortsetzung von \"Palestine\", auch wenn die Rahmenhandlung ein beeindruckendes Panorama palästinensischen Lebens in den Wochen vor und während des beginnenden Irakkriegs im Jahr 2003 gibt: vom Saddam-Kult bis zum Alltag in den Flüchtlingsstädten, von Selbstmordattentaten bis zu den fast alltäglichen Haus-Demolagen durch die Israelis. Doch der Zeichner treibt die Langsamkeit hier auf die Spitze. Im eigentlichen Zentrum seiner Erzählung stehen zwei Tage in Gaza während der sogenannten Suezkrise: der 3. und der 12. November 1956. Im Zuge des Kriegs mit Ägypten stieß die israelische Armee in den Gaza-Streifen vor, um die Angriffe der palästinensischen Fedajin und die Präsenz ägyptischer Soldaten zu unterbinden. Am 3. November wurden in Chan Yunis, am 12. November in Rafah zahlreiche Palästinenser getötet. Die große Geschichtsschreibung verzeichnet diese Ereignisse als Fußnoten zur Suezkrise, in der auch Briten, Franzosen und Amerikaner ihren geopolitischen Interessen nachgingen. Die israelische Geschichtsschreibung leugnet nicht die unkontrollierte Tötung von Zivilisten, verweist aber auf eine unübersichtliche Situation, da viele bewaffnete Rebellen in den Städten präsent gewesen seien. Die palästinensische schließlich erinnert an diese Tage als willkürliche Massaker an wehrlosen Flüchtlingen. Aber das Abwägen der Positionen ist Saccos Sache nicht: \"Im Innersten bin ich ein Zeitungsmann\", schreibt er: \"Und ein Zeitungsmann will die Fakten, die definitive Fassung, nicht einen Haufen von 'einerseits, andererseits', 'vielleichts' oder 'wahrscheinlichs'.\" Ein Scherz mit dem seltsamen Amerikaner? Seine Zuflucht nimmt Sacco zur \"Oral History\", die sich einst - mit ähnlichem Aplomb wie die Alternativmedien gegen die großen Zeitungen und Sender - als \"Geschichte von unten\" gegen die herkömmliche Geschichtsschreibung gestemmt hat. Was Sacco sucht, nennt er dann auch die \"essentielle Wahrheit\". Er hat zahlreiche Männer und Frauen interviewt, die die Militäroperationen erlebt und überlebt haben, die Verwandte und Freunde verloren haben oder selbst schwer verwundet wurden. Er zeigt auch die Schwierigkeiten und Irrwege seiner Recherche: Aussagen widersprechen einander, gehen in Legenden auf oder werden zur Sache der Interpretation: Ein Überlebender versichert wiederholt, dass er 36 Kugeln in den Kopf bekommen habe - Übertreibung, Fehlerinnerung oder ein Scherz mit dem seltsamen Amerikaner, der alles über einen lang vergangenen Krieg wissen will? Sacco lässt die Frage offen - wenn auch nicht ganz: \"Übertreibung oder nicht, ich zweifele nicht daran, dass auf ihn geschossen wurde.\" In diesem Spielraum bewegt sich Saccos Buch: Er thematisiert die Probleme der Erinnerung, aber er vertraut der Wiederholung und langweilt den Leser gelegentlich mit der Reihung einander bestätigender Aussagen. Er setzt auf die subjektiven Erinnerungen seiner Interviewpartner, aber zwischendrin meldet er sich doch im Tonfall des allwissenden Geschichtserzählers zu Wort. Insgesamt wirkt der Comic so reflektierter und präziser als \"Palestine\", allerdings auch starrer. Das zieht sich bis in die Grafik, in der die karikierenden, verzerrenden Elemente gegenüber dem Vorgänger deutlich zurücktreten. Dadurch wird noch augenfälliger, dass sich Sacco zwar in die Tradition amerikanischer Underground-Comics stellt (vor allem von Robert Crumb hat er viel gelernt), auf deren ironisch-reflexiven Umgang mit dem Bild aber fast völlig verzichtet: Das gezeichnete Bild ist für Sacco Abbild einer Wirklichkeit - und der Mehrwert der Zeichnung liegt in ihrer Möglichkeit, den Leser emotional zu packen. Damit beschneidet er den Comic um sein charakteristisches Potential: Comic-Bilder pochen gerade nicht auf ihre Authentizität, sie sind immer bereits Klischee, sie übertreiben, laden ein, den Blick auf die Wirklichkeit neu zu justieren und dem, was offensichtlich scheint, zu misstrauen. Selbst wo Sacco auf genuine Comic-Effekte setzt, indem er etwa auf einer Seite Bilder verschiedener Zeiten konfrontiert, tut er das zur Bestätigung: So sah es damals aus, so sieht es jetzt aus. Die Frage, ob Comics sich als journalistisches Medium eignen, ist auch mit diesem Buch also nicht beantwortet. Ein bemerkenswertes Stück Geschichtsschreibung hat Sacco - bei aller Parteilichkeit - dennoch geliefert. Joe Sacco, \"Footnotes in Gaza\", Jonathan Cape 2009 (432 Seiten, ca. 24 Euro). Joe Sacco, \"Palästina\" (Neuausgabe), Edition Moderne 2009 (287 Seiten, 25 Euro).",http://www.spiegel.de/kultur/literatur/comic-reporter-joe-sacco-ein-schwarz-weisses-bild-vom-krieg-a-669286.html,2010-01-11T00:00:00.000Z
"Anti-Islam-Kampagnen Das doppelte Skandalplakat Minarette wie Raketen: Damit hatte die Schweizer Volkspartei im Referendum über Gebetstürme Stimmung gemacht. Die französischen Rechtsradikalen vom Front National versuchen es nun mit einem ähnlichen Plakatmotiv - und das passt den eidgenössischen Gesinnungsgenossen gar nicht. Von Stefan Simons , Paris SPIEGEL ONLINE Stefan Simons Ist Autor für SPIEGEL ONLINE in Paris. E-Mail: stefan.simons@spiegel.de Mehr Artikel von Stefan Simons Minarette wie Raketen, dazu eine tiefverschleierte Muslimin - das Polit-Plakat, mit dem die Schweizer Volkspartei (SVP) beim Referendum im vergangenen November gegen den Bau von Moscheen Emotionen weckte, steht seitdem für Fremdenhass und plumpen Rassismus - und weckt damit offensichtlich Begehrlichkeiten bei Rechtsradikalen im westlichen Nachbarland.  Die Kommunikationsstrategen des französischen Front National haben das Skandalposter offenbar für ihre eigene Werbekampagne bei den Regionalwahlen abgekupfert: Unter der Überschrift \"Nein zum Islamismus\" steht auch hier eine Burka-Trägerin vor einer Karte Frankreichs , auf der die Nationalsymbole Algeriens prangen, umgeben von Minaretten. \"Die Jugend mit Le Pen\" ist das Plakat unterschrieben, mit dem der alternde Vorsitzende der Rechtsextremen in Südfrankreich auf Stimmenfang geht - und nach bewährter Manier dafür gegen Immigranten und Muslime mobilmachen will. Die grafische Selbstbedienung hat freilich die Urheber der plumpen Propaganda auf den Plan gerufen. Nach Angaben der Schweizer Tageszeitung \"La Liberté\" hat der Direktor der Werbefirma Goal, Alexander Segert, \"rechtliche Schritte\" gegen die französischen Gesinnungsgenossen angestrengt, weil sie das inkriminierte Motiv ohne Genehmigung übernommen hätten. \"Wir sind völlig verblüfft durch dieses Plagiat und die Tatsache, dass unser Plakat in Frankreich reproduziert wurde\", schimpfte Segert: \"Das ist Diebstahl.\" Hinter dem Ideenklau steckt anscheinend die Nachwuchsorganisation des Front National, die freilich jede Verantwortung weit von sich weist. \"Das Plakat wurde von A bis Z von einem professionellen Grafiker, einem unserer gewohnten Zuarbeiter, entworfen\", zitiert Liberation.fr den Sprecher der Parteijugend, David Rachline. Zugleich verweist der Politiker, der selbst im Departement Var kandidiert, auf die Unterschiede bei der Darstellung. \"Die Burka ist nicht dieselbe, und die Minarette sind auch nicht gleich gezeichnet. Und nur weil auch auf unserem Plakat welche sind, bedeutet das ja nicht, dass es sich um eine Kopie handelt.\" Und außerdem, verteidigt der FN-Mann die gehässige Hetze, gebe es sowieso nicht sehr viele bildliche Möglichkeiten, die angebliche \"kriechende Islamisierung\" Frankreichs zu geißeln. Obendrein habe sich nicht der Front National für die bevorstehenden Regionalwahlen bei den Vorgaben des Schweizer Antiislamismus bedient. In Wirklichkeit sei es doch eher andersherum gewesen, ergänzt auch Stéphane Durbec, ein Mitstreiter von FN-Chef Le Pen: \"Es ist eher die Volkspartei, die sich den Kampf des Front National zu eigen gemacht hat.\"",http://www.spiegel.de/politik/deutschland/anti-islam-kampagnen-das-doppelte-skandalplakat-a-680624.html,2010-02-26T00:00:00.000Z
"Deutsche Spezialitäten in São Paulo Marlene Dietrich mit Soße Zum Beckenbauer-Sandwich einen Claudia-Schiffer-Salat: Deutsche Speisen mit absurden Namen liegen in der brasilianischen Mega-Metropole São Paulo hoch im Kurs. Eine Fastfood-Kette feiert Erfolge mit Bratwurst und Eisbein - danach ist man reif für einen \"Brasilberg\"-Magenbitter. Von René Wildangel \"Darf es ein Steinhäger-Caipirinha sein?\", fragt Valfrido, der Wirt. Wie bitte? Es gibt ja jede Menge abstruse Mixgetränke. Aber Caipirinha, der brasilianische Gute-Laune-Cocktail, gemixt mit Steinhäger, dem ostwestfälischen Altherren-Absacker? Da ist man als Kunde erst mal skeptisch. \"Probier mal\", sagt Valfrido. \"Muito bom.\" Zum Wacholderschnaps-Caipi serviert er ein Paprikaschnitzel und eine riesige Schlachtplatte. Valfrido ist Inhaber eines deutschen Restaurants mit dem seltsamen Namen \"Windhuk\". Mitten in der lateinamerikanischen Megametropole São Paulo serviert er deutsche Küche, Karo-Tischdecken und Holzvertäfelung inklusive. Und der Steinhäger wird lokal produziert. Dabei strahlt São Paulo alles andere aus als deutsche Gemütlichkeit. Elf Millionen Menschen wohnen hier, die gesamte Metropolregion kommt auf 20 Millionen. Vor allem zu den Stoßzeiten ist der Verkehr unerträglich, lange Autoschlangen schleppen sich mühsam durch die ewig verstopften Straßen. Die Hochhäuser ragen überall so hoch in den Himmel, als wollten sie dem Chaos am Boden entfliehen. São Paulo ist geballte Urbanität voller Dynamik, hier existieren bittere Armut und verschwenderischer Reichtum nebeneinander. Das Restaurant \"Windhuk\" liegt im Stadteil Brooklin. Es wirkt wie eine zu groß geratene Skihütte inmitten der Betonberge. Seine Geschichte ist ebenso skurril wie der kolonialistische Name. Der geht zurück auf ein deutsches Kreuzfahrtschiff, das hier im Dezember 1939 in den Wirren des Kriegsausbruches mit 250 Besatzungsmitgliedern strandete. Als Brasilien 1942 auf Seiten der Alliierten gegen Deutschland in den Krieg eintrat, wurden sie inhaftiert. Mitglieder der Crew blieben später in Brasilien und gründeten 1948 ein Restaurant. Seit den sechziger Jahren wird es von den beiden deutschstämmigen Brasilianern Valfrido und Francisco geführt. Supermodel und Fußballgott Deutsch-Brasilianer sind alles andere als eine Seltenheit im Land. Anders als das immer wieder bemühte Klischee vermuten lässt, waren jedoch die wenigsten deutschen Einwanderer Nazis auf der Flucht. Sie kamen viel früher. 1827 landeten die ersten Deutschen nach langer Schiffsreise in der Hafenstadt Santos, im Gepäck die Hoffnung auf ein besseres Leben. In den folgenden Jahrzehnten wuchs die Zahl auf fast 300.000 Einwanderer. Der ganze Süden Brasiliens ist von den Einwanderern aus Alemanha geprägt. In Blumenau wird jedes Jahr das zweitgrößte Oktoberfest der Welt gefeiert. Geschätzte zehn Prozent der 180 Millionen Brasilianer haben heute deutschsprachige Vorfahren im Stammbaum. Nationaltrainer Dunga und Supermodel Gisele Bündchen gehören zu den prominentesten Vertretern der Deutsch-Brasilianer. In São Paulo ließen sich die Einwanderer traditionell in Brooklin nieder. Noch heute befinden sich dort ein deutscher Buchladen, eine deutsche Bäckerei und ein CD-Geschäft, das deutsche Volksmusik vertreibt. Das moderne Deutschland hat dabei wenig Platz in der nostalgisch-kitschigen Welt der Auswanderer und ihrer Nachkommen. Einmal im Jahr findet das Brooklin-Fest statt, bei dem die Folkloregruppe Edelweiß und die Waldorfschule São Paulo auftreten. Dazu Trachtenhüte aus Filz, die obligatorische Schweinshaxe und vor allem immer: viel Bier. Ein Brasilberg für den Magen Apropos: Das beste Frischgezapfte von São Paulo gibt es laut Gastro-Beilage der Zeitschrift Veja in der \"Alten Mühle\". Serviert wird dort die nationale Biermarke Brahma, die im Jahr 1888 erstmals von deutschen Einwanderern gebraut wurde. Heute gehört Brahma dem Monopolisten Inbev, Symbol für die brasilianische Boomwirtschaft. Inbev schluckte 2008 die US-amerikanische Traditionsbrauerei Anheuser-Busch und wurde so zum größten Brauereikonzern der Welt. Im Sommer tritt der Konzern als erster brasilianischer Sponsor bei einer Fußball-WM auf. Nach dem Bier kann man in der \"alten Mühle\" noch einen \"Brasilberg\" zu sich nehmen - die brasilianische Variante des Magenbitters Underberg. Denn auch Paul Underberg, Enkel des Firmengründers, wanderte 1932 nach Brasilien aus. Die Brüder Werner, 51, und Karl-Heinz, 43, haben die \"Alte Mühle\" von ihrem Vater übernommen. Sie sind in Brasilien geboren und sprechen besser Portugiesisch als Deutsch. \"Wir sind auch über die Jahre immer brasilianischer geworden\", sagen sie. Während früher die Gäste deutsche Geschäftsleute waren, kommen heute überwiegend Brasilianer. \"Die lieben deftiges Essen. Kassler, Eisbein, solche Sachen\", sagt Werner. Aber die Konkurrenz für die Eisbein-Fraktion ist groß. Denn die Geschäftsmetropole São Paulo ist ein multikulturelles Mekka für Gourmets, auf 500 Seiten listet die Veja-Sonderbeilage Restaurants und Bars auf. Darin vertreten ist nur ein Bruchteil der mehr als 12.000 Restaurants der Stadt, die brasilianische und internationale Speisen anbieten. Die vielen Migranten haben in São Paulo kulturell und kulinarisch ihre Spuren hinterlassen: die Italiener im Stadtteil \"Bela Vista\", die größte japanische Gemeinde weltweit mit ihren Geschäften und Restaurants im Stadtteil \"Liberdade\". Araber aus dem Libanon, Portugiesen aus dem alten Mutterland, Afro-Brasilianer aus dem Nordosten. Trotz solcher Konkurrenz bleibt das Essen \"beim Deutschen\" populär. Sogar eine Fastfoodkette hat sich etabliert: \"Braugarten\" ist mit seinen sieben Filialen überwiegend in den schicken Einkaufszentren der Stadt vertreten. Hier ist die Holzvertäfelung aus Kunststoff. Neben Bauernbratwurst und Paprika-Schnitzel bietet die Karte Salate à la \"Claudia Schiffer\" und \"Marlene Dietrich\"; beim Sandwich hat man die Wahl zwischen \"Beckenbauer\" und \"Beethoven\". Wer ein Eisbein bestellt, muss einen riesigen Fleischberg mit zu süßem Sauerkraut und halbgaren Kartoffeln bewältigen. Die Preise sind gesalzen, aber die Restaurants sind voll. Der Besitzer der \"Bierquelle\", der Schweizer Diethelm Maidlinger, hat einen anderen Qualitätsanspruch. Er beklagt die mangelnde Wertschätzung deutscher Küche. In seinem Lokal gibt es deshalb mittlerweile auch argentinisches Steak. Gefragt sei Rustikales, aber meist fehle die Qualität. Er sagt Sätze wie: \"Den Brasilianern fehlt die Senfkultur\". Den Senf macht er deshalb lieber selbst, genauso wie Bockwürste, Nürnberger, Thüringer, Weißwurst oder Leberkäs. Noch besser kommt typisch Schweizerisches an. \"Die Brasilianer sind verrückt nach Fondue\", sagt Maidlinger. \"Aber nur im Winter - und der dauert ja hier leider nur drei Monate.\"",http://www.spiegel.de/reise/staedte/deutsche-spezialitaeten-in-sao-paulo-marlene-dietrich-mit-sosse-a-690923.html,2010-04-26T00:00:00.000Z
"S.P.O.N. - Im Zweifel links Der Kampf der Bösen Zehn Jahre nach dem 11. September 2001 gibt es nur Verlierer: Der Islam wurde von verblendeten Ideologen als Geisel genommen. Der Westen hat im Kampf gegen den Terror seine Werte verraten. Und jetzt haben wir auch noch die Islamophoben an der Backe. Von Jakob Augstein Franziska Sinn Jakob Augstein Facebook: Zum Profil Webseite: http://www.freitag.de/ Mehr Artikel von Jakob Augstein Was bleibt, zehn Jahre danach? Zwei Bilder, in denen die ganze Geschichte erzählt ist: Hier die brennenden Türme. Dort der Gefolterte von Abu Ghuraib . Das ist die Ikonografie des menschlichen Irrsinns. Das schreckliche Verbrechen von New York und das schreckliche Verbrechen des Kriegs gegen den Terror. Gewalt wurde mit Gewalt bekämpft und hat nur noch mehr Gewalt gezeugt. Wer geglaubt haben sollte, dass die Menschen aus den Kriegen des 20. Jahrhunderts etwas gelernt hätten, der wurde gleich zu Beginn des neuen Jahrtausends eines Besseren belehrt. Nein, wir haben nichts gelernt. Wir sind immer noch allzeit bereit uns gegenseitig auszulöschen, notfalls mit den bloßen Händen. Und wir haben dafür immer einen guten Grund. Wir sind immer im Recht. Was bleibt, zehn Jahre danach? Die Erkenntnis, dass sich selbst verurteilt, wer dem Gesetz der Rache folgt. Und dass eine Bilanz des Schreckens am Ende niemals aufgehen kann. Die Politik der USA nach dem 11. September war nicht nur unmoralisch. Sie hat sich selbst geschadet. Den knapp 3000 Toten des 11. Septembers folgten mehr als 6000 getötete US-Soldaten in Afghanistan und im Irak, ungezählte Opfer in der Zivilbevölkerung, fünf Millionen Flüchtlinge und Kosten, die zurzeit auf über drei Billionen Dollar geschätzt werden. Was der Westen hätte tun sollen, nach den Angriffen auf Amerika? Mit der Vertreibung al-Qaidas aus Afghanistan hätte der \"Krieg gegen den Terror\" beendet werden müssen. Statt dessen haben die USA daraus einen ideologischen Weltkrieg werden lassen. Aber sie haben sich in diesem Kampf so über jedes vernünftige Maß hinaus erschöpft, dass es zu Verschiebungen in der globalen Machttektonik gekommen ist. Der Aufstieg Chinas, vielleicht ohnehin unaufhaltbar, wurde beschleunigt. Und die USA haben sich überschätzt, die Allmachtsphantasien der Neocons sind gescheitert. Demokratie, wenn es darum jemals ging, lässt sich nicht von außen herbeibomben. Sie muss von innen wachsen. Lebensgefährliche und unsinnige Spaltung der Welt Was bleibt, zehn Jahre danach? Es bleibt, dass viele Muslime und Westler sich gegenseitig für fanatisch und gefährlich halten (die Muslime halten die Menschen im Westen überdies noch für korrupt und gierig). Es bleibt eine zugleich lebensgefährliche und unsinnige Spaltung der Welt in Muslime und Westler, die tiefer geht und irreparabler erscheint, als man sich das vor der Erfindung des Begriffs vom Kampf der Kulturen vorstellen konnte. Eine Spaltung, die Staaten und Kontinente trennt, die aber auch die westlichen Gesellschaften im Inneren zerreißt: Die pathologische Islamophobie , die sich in weiten Teilen Europas ausbreitet und rechtspopulistischen Parteien und Bewegungen Zulauf verschafft, ist ohne 9/11 nicht denkbar. Die Taten des Massenmörders Anders Behring Breivik sind ohne 9/11 nicht denkbar. Wenn man sich ansieht, was bleibt, zehn Jahre danach, dann spielt es schon keine Rolle mehr, dass Osama bin Laden , dieser Revolutionär des Bösen, sein eigentliches Ziel nicht erreicht hat. Das große, alle Muslime einigende Kalifat ist nicht errichtet worden. Im Gegenteil: Den einzigen Staat, in dem seine Heilsideen bereits weitgehend verwirklicht waren - vom Tonbandverbot über die Säureattacken bis zum Bildersturm - stürzte der Qaida-Chef durch seinen Angriff auf die Amerikaner ins Verderben: Afghanistan. Als Revolutionär ist bin Laden gescheitert. Als Terrorist war er über jedes Maß hinaus erfolgreich. Zehn Jahre danach also nur Grund zur Verzweiflung? Nein. Es ist richtig, dass nicht einmal die Sintflut das Böse von der Erde waschen konnte. Gott hat am Ende resigniert: \"Ich will hinfort nicht mehr die Erde verfluchen um der Menschen willen; denn das Dichten des menschlichen Herzens ist böse von Jugend auf\", heißt es im 1. Buch Moses. Aber, das was Franz Kafka im Prozess als das vollkommen Entsetzliche beschreibt: \"Die Lüge wird zur Weltordnung gemacht\", setzt sich auf Dauer nicht durch. Osama bin Laden liegt tot auf dem Meeresgrund, George W. Bush sitzt als Rentner auf irgendeiner Farm in Texas, und in Nordafrika hat der arabische Frühling begonnen. Ein Aufbruch.",http://www.spiegel.de/politik/ausland/s-p-o-n-im-zweifel-links-der-kampf-der-boesen-a-785049.html,2011-09-08T00:00:00.000Z
