article,article_url,date
"Auftritt in Köln Erdogans Gegenschlag Der türkische Regierungschef Erdogan kommt nach Köln, Tausende Anhänger feiern ihn wie einen Popstar. Seine Rede ist eine Mischung aus neuer Stärke und verletztem Stolz. Das kommt gut an, weil viele türkische Migranten sich darin wiedererkennen. Von Özlem Gezer und Hasnain Kazim , Köln Özlem Gezer wurde 1981 in Hamburg geboren, studierte Jura, arbeitete für den \"Stern\" und das ZDF in Istanbul, besuchte die Henri-Nannen-Schule und ist seit Januar 2012 beim Neben der Zuwanderung aus Südosteuropa beschäftigte Gezer sich in den vergangenen Jahren vor allem mit dem Thema Islamismus in Deutschland. E-Mail: oezlem.gezer@spiegel.de Mehr Artikel von Özlem Gezer Jens Ressing Hasnain Kazim wurde 1974 im niedersächsischen Oldenburg als Sohn indisch-pakistanischer Einwanderer geboren. Er wuchs im Alten Land auf, vor den Toren Hamburgs, und machte in Stade Abitur. Studium der Politikwissenschaft in Hamburg, Laufbahn als Marineoffizier. Erste journalistische Erfahrungen sammelte er als Student unter anderem beim \"Stader Tageblatt\" und bei der Deutschen Presse-Agentur dpa im Südasienbüro in Neu-Delhi, Indien. Volontariat bei der \"Heilbronner Stimme\", anschließend dort Politikredakteur. Seit 2004 schreibt er für SPIEGEL ONLINE und den SPIEGEL, seit 2009 als Auslandskorrespondent mit Stationen in Islamabad, Pakistan, Istanbul, Türkei und derzeit Wien, Österreich. Er ist Verfasser von vier Büchern: \"Grünkohl und Curry. Die Geschichte einer Einwanderung\" (2009), \"Plötzlich Pakistan. Mein Leben im gefährlichsten Land der Welt\" (2015), \"Krisenstaat Türkei. Erdogan und das Ende der Demokratie am Bosporus\" (2017) und \"Post von Karlheinz. Wütende Mails von richtigen Deutschen - und was ich ihnen antworte\" (2018). E-Mail: Hasnain.Kazim@spiegel.de Twitter: @HasnainKazim folgen Facebook: Zum Profil Mehr Artikel von Hasnain Kazim Gut eineinhalb Stunden hat Recep Tayyip Erdogan geredet, ohne Manuskript, mit Mikrofon in der Hand. Das Rednerpult verlässt er immer wieder, tritt an den Bühnenrand. Die Sätze werden unterbrochen von Jubel. Manchmal singen die knapp 20.000 Zuhörer \"Reeeceeep Erdoogaan, Recep Tayyip Erdogaaan!\" und schwenken die Nationalflagge oder ihre leuchtenden Handy-Displays. Wenn er etwas kritisiert, zum Beispiel das Ausland, die Feinde im Inneren, die Medien, folgen sogleich Buhrufe. Der türkische Premierminister war zu Besuch in Köln , offiziell zum zehnten Geburtstag der Union Europäisch-Türkischer Demokraten (UETD), eine Lobbyorganisation der türkischen Regierungspartei AKP. Tatsächlich war es aber eine Rede zur bevorstehenden Präsidentenwahl am 10. August. Erdogan selbst hat zwar noch nicht seine Kandidatur bekannt gegeben, doch er gilt als gesetzt. Nach parteiinternen Regeln darf er kein viertes Mal für das Amt des Regierungschefs antreten. Da sein Machtwille aber ungebrochen ist, wäre das Präsidentenamt mit erweiterten Befugnissen die Alternative. Die Wahl als Wendepunkt \"Wir werden unseren Kandidaten zu gegebener Zeit bekannt geben\", sagt Erdogan in Köln. \"Ich hoffe, dass ihr alle wählen geht! Prüft, ob ihr in den Wählerlisten steht. Und nehmt unbedingt eure Personalausweise mit\", rät er seinen Zuhörern noch. Die Wahl, bei der die Türken erstmals den Präsidenten direkt bestimmen und auch mehr als eine Million Türken in Deutschland wahlberechtigt sind, werde \"ein Wendepunkt\" sein. \"Die Türkei wird stärker werden. Und unsere Wirtschaft wird noch schneller wachsen.\" Seine wichtigste Botschaft lautet mit einem Satz: Wir sind wieder wer, und wir lassen uns von niemandem mehr etwas sagen! Es ist eine Mischung aus neuer Stärke und verletztem Stolz. Denn stark ist die Türkei geworden: Mit süffisantem Unterton merkt Erdogan an, Deutschland sei \"mit 0,8 Prozent Wachstum\" die Nummer eins in Europa \"Ich kann es noch nicht genau sagen, aber unsere Wirtschaft wird voraussichtlich um vier Prozent wachsen.\" Die Menge feiert ihn und sich. \"Wir arbeiten! Und es wird weiter aufwärts gehen!\", verspricht Erdogan. Außerdem lobt er die Leistung der Deutschtürken. Sie würden heute mehr als 80.000 Betriebe führen, etwa 400.000 Arbeitsplätze schaffen und damit viel zur deutschen Wirtschaft beitragen.   Solche Aussagen kommen gut an bei Menschen, die sich oft nicht willkommen fühlen in Deutschland. Da muss der Regierungschef der Türkei kommen und ihnen sagen: Ihr seid toll! Das ist Balsam für die Seele. Gerade auch für die konservativeren Türken. Erdogan hat durchgesetzt, dass Frauen mit Kopftuch wieder an die Universitäten und in Behörden oder als Abgeordnete arbeiten dürfen, was in der laizistischen Republik Türkei bis vor Kurzem verboten war. Auch Sätze wie \"Die neue Türkei ist nicht mehr die alte Türkei\" und \"Die Türkei muss von jedem respektiert werden, denn wir bestimmen das 21. Jahrhundert mit\" stoßen auf Begeisterung bei seinen Zuhörern. Erdogans Medienschelte Er wiederholt auch seine umstrittene Losung \"Integration ja, Assimilation nein\", fügt aber an, dass die Türken \"nicht wie Fremde\" in Deutschland leben sollten. \"Lernt Deutsch und sorgt dafür, dass eure Kinder Deutsch lernen!\", fordert er die hier lebenden Türken auf. Kritik lässt er nicht gelten. Mehrmals greift er die ausländischen Medien an, zweimal SPIEGEL ONLINE, \"dieses Magazin\", wie er es nennt, weil es ihn mit einer Überschrift - dem Zitat eines Überlebenden der Bergwerkskatastrophe in Soma vor knapp zwei Wochen - beleidigt habe. Medien hätten dieses Unglück \"ausgeschlachtet\". Die Opposition habe zudem versucht, daraus politisches Kapital zu schlagen. Über seine als unsensibel wahrgenommene Rede vor den Bergleuten verliert er kein Wort. Auch Kritik am Umgang der Polizei mit Demonstranten lässt er nicht gelten, denn schließlich würden die Molotowcocktails werfen, es handele sich also um Terrorakte, die bekämpft würden. Eine Einschränkung von Bürgerrechten und von Pressefreiheit gebe es in der Türkei nicht. Seine Gegner im Inneren wie im Ausland würden immer \"dieselben Lügen und Verleumdungen\" wiederholen, sagt er und spielt damit auf den Besuch von Bundespräsident Joachim Gauck vor wenigen Wochen an, der die Einschränkung von Grundrechten kritisierte. Das Ziel dieser Mächte sei klar: den weiteren Aufstieg der Türkei zu verhindern. Erdogan betont, er halte am Ziel einer Mitgliedschaft der Türkei in der EU fest. Europäischen Kritikern schleudert er entgegen: \"Wie kann man einen Premierminister nach so vielen demokratischen Reformen als Diktator beschimpfen?\" Die Türkei sei vielmehr ein \"Gegengift\" gegen den wachsenden Rassismus in Europa, sagt er und erwähnt in einem Halbsatz die NSU-Morde in Deutschland. \"Wir müssen ihn schützen vor den Feinden\" Der Ton ist nicht so aggressiv wie von deutschen Politikern befürchtet, aber er ist auch nicht versöhnlich. Das wäre vermutlich auch nicht, was seine Anhänger wollen. Mehrere Tausend sind nicht mehr hineingekommen in die voll besetzte Lanxess Arena. Eine Gruppe steht hinter einem Gitterzaun, davor eine Reihe von Ordnern. Die Wartenden wollen rein, einer schreit einen Polizisten an: \"Wer bist du, dass du verhinderst, dass wir unseren Premier sehen, du Deutscher?\" Jemand von den Organisatoren nimmt ein Megafon und sagt: \"Der Premier wird euch grüßen kommen, versprochen. Wenn er nicht kommt, trefft ihr euch im Himmel.\" Ein anderer entgegnet den aufgebrachten Besuchern ohne Ticket: \"Ihr müsst euch benehmen, damit die Deutschen nicht sagen, dass wir kriegerisch sind oder dass wir keine Ordnung beherrschen. Wenn ihr hier laut werdet, schadet ihr nur unserem Führer. Wir dürfen seinen Ansehen nicht schaden, wir müssen ihn schützen vor den Feinden.\" Alle klatschen. Und jubeln.",http://www.spiegel.de/politik/ausland/erdogan-in-koeln-auftritt-vor-deutschtuerken-kritik-an-medien-a-971530.html,2014-05-24T00:00:00.000Z
"Tod von Asylbewerber BGH bestätigt Urteil im Fall Ouri Jallow Er war an Händen und Füßen gefesselt und starb unter mysteriösen Umständen in Polizeigewahrsam: Jetzt hat der BGH das Urteil im Fall des Asylbewerbers Ouri Jallow bestätigt. Ein Polizist ist der fahrlässigen Tötung schuldig. Karlsruhe - Eine Woche lang nahm sich der Bundesgerichtshof (BGH) Zeit, um das Landgerichtsurteil im Fall Ouri Jallow auf juristische Fehler zu prüfen . Jetzt hat der 4. Strafsenat seine Entscheidung bekanntgegeben: Der Prozess, wohl einer der umstrittensten der vergangenen Jahrzehnte, wird nicht neu aufgerollt. Stattdessen bestätigt der BGH das Urteil des Magdeburger Landgerichts: Ein ehemaliger Dienstgruppenleiter der Polizei ist demnach der fahrlässigen Tötung schuldig und muss eine Geldstrafe von 10.800 Euro zahlen. Jallow war vor fast zehn Jahren unter mysteriösen Umständen ums Leben gekommen. An Händen und Füßen gefesselt verbrannte der damals 36-jährige Asylbewerber in einer Dessauer Polizeizelle, rücklings fixiert auf einer Matratze mit schwer entflammbarem Überzug aus Kunstleder. Zweimal versuchten Gerichte bereits, den Fall aufzuklären; bis zuletzt gab es dabei diverse Widersprüche und Unklarheiten . Freunde Jallows zweifeln vor allem an der These, wonach der Sierra Leoner seine Matratze selbst angezündet haben soll - stark alkoholisiert und mit einem Billigfeuerzeug, das erst Tage nach dem Vorfall bei den Asservaten auftauchte. Fall bereits zweimal verhandelt Vom Vorwurf der Körperverletzung mit Todesfolge wurde ein ehemaliger Dienstgruppenleiter der Polizei im Dezember 2008 freigesprochen. Dieses Urteil kippte der BGH im Jahr 2010; vor dem Landgericht Magdeburg wurde der Fall erneut verhandelt. Ergebnis diesmal: Aufgrund von Versäumnissen bei seinen Überwachungspflichten sprachen die Richter den Beamten der fahrlässigen Tötung schuldig und verhängten eine Geldstrafe von 10.800 Euro . Sowohl die Verteidiger als auch Staatsanwaltschaft und Nebenkläger legten dagegen Revision ein. Es gebe keinen Zweifel daran, dass 2005 in Dessau \"eine Riesenschlamperei passiert ist, die nicht sein kann und nicht sein darf\", sagte Bundesanwalt Johann Schmid vor der Urteilsverkündung. Vor dem BGH gehe es aber allein um die Frage, ob das Magdeburger Urteil fehlerhaft zustande gekommen sei. Ähnlich äußerte sich nun auch die Vorsitzende Richterin Beate Sost-Scheible. \"Der tragische Tod bewegt die Öffentlichkeit ganz zu Recht und hinterlässt Fassungslosigkeit und Ratlosigkeit\", sagte sie zu Beginn der Urteilsbegründung. Doch die Erwartungshaltungen der Öffentlichkeit dürften \"nicht Maßstab für die Entscheidungsfindung eines Gerichts sein\". \"Umfassende Beweisaufnahme\" an 67 Verhandlungstagen Das Landgericht Magdeburg habe nach der Aufhebung des ersten Freispruchs durch das Landgericht Dessau an 67 Verhandlungstagen eine umfassende Beweisaufnahme vorgenommen. Bei der Würdigung der Beweise habe es keine Rechtsfehler gegeben. Dies gelte auch für die Feststellung der Brandursache, sagte Sost-Scheible. Jallow war am 7. Januar 2005 in Polizeigewahrsam genommen worden, nachdem sich zwei weibliche Reinigungskräfte in einem Dessauer Park von ihm belästigt gefühlt hatten. Als sich der 36-Jährige weigerte, den herbeigerufenen Beamten seinen Ausweis zu zeigen, nahm man ihn mit auf die Polizeistation. Angeblich auf Anraten eines Arztes sperrten die Polizisten Jallow in eine Zelle und fixierten ihn dort an Händen und Füßen. Als der Brand ausbrach, soll der damalige Dienstgruppenleiter den Feueralarm zweimal ausgeschaltet haben, ohne der Sache auf den Grund zu gehen. Als er schließlich doch die Zelle öffnete, sei Jallow bereits tot gewesen. Nachdem es bereits mehrere Untersuchungen zu dem Feuer gegeben hatte, stellte ein Zusammenschluss von Unterstützern Jallows im vergangenen November ein eigenes Brandgutachten vor . Dabei wurde der Verdacht nahegelegt, ein unbekannter Täter habe sich Zugang zur Zelle verschafft und dort die Matratze angezündet.",http://www.spiegel.de/panorama/justiz/ouri-jallow-bgh-bestaetigt-urteil-wegen-fahrlaessiger-toetung-a-989799.html,2014-09-04T00:00:00.000Z
"Schleswig-Holstein Minister fordert vom Bund ehrliche Flüchtlingszahlen Nach Deutschland kommen mehr Flüchtlinge - nur wie viele sind es? Schleswig-Holsteins Innenminister wirft dem Bund vor, viel zu niedrige Zahlen vorzulegen. Kiel - Schleswig-Holsteins Landesregierung hält die vom Bund vorhergesagten Flüchtlingszahlen für deutlich zu niedrig. \"Ich bin derzeit weit entfernt von den Zahlen des Bundesamtes für Migration und Flüchtlinge\", sagte Innenminister Stefan Studt (SPD) der Nachrichtenagentur dpa. \"Wenn wir unsere Zahlen hochrechnen, müssen wir 2015 in Deutschland mit 500.000 bis 550.000 neuen Asylbewerbern rechnen und nicht nur mit 300.000, wie vom Bundesamt angegeben.\" Studt forderte den Bund auf, bei den Prognosen ehrlich zu sein. \"Wir dürfen nicht die Augen vor der Realität verschließen - eine Vogel-Strauß-Politik hilft uns nicht weiter.\" Er erwarte vom Bund eine Prognose, an denen sich Länder und Kommunen in ihren Planungen tatsächlich orientieren könnten. Nach Schleswig-Holstein sind im vergangenen Jahr 7620 Asylbewerber gekommen. Nach dem Vergleich der Zugangszahlen seit Jahresbeginn erwartet das Land im laufenden Jahr bis zu 20.000 - doppelt so viele wie nach der Prognose des Bundesamtes auf den Norden entfallen würden. Trotz Personalaufstockung reiche die Kapazität im Bundesamt bei weitem nicht, um die angestrebte Fallbearbeitungszeit von 14 Tagen für die sicheren Zustimmungs- und Ablehnungsfälle zu erreichen, sagte Studt. Im Durchschnitt dauere es viereinhalb bis fünf Monate. Deshalb und wegen zu geringer Erstaufnahmekapazitäten sei es momentan unmöglich, sichere Abschiebefälle gar nicht erst auf die Kommunen zu verteilen, wie vom Bund erwünscht. Bund und Länder hatten sich zuletzt auf eine Beschleunigung der Asylverfahren verständigt. Dazu erhält das Bundesamt für Migration und Flüchtlinge mehr Personal.",http://www.spiegel.de/politik/deutschland/fluechtlinge-schleswig-holstein-fordert-vom-bund-ehrliche-zahlen-a-1024101.html,2015-03-18T00:00:00.000Z
"Ukip-Chef Farage im Wahlkampf Der Mann, der England aufstachelt Ausländer nehmen einem die Wohnungen weg, Jobs sowieso - und blockieren beim Arzt das Wartezimmer: Im britischen Wahlkampf macht es sich Nigel Farage mit solchen Parolen leicht. Doch der Chef der rechten Ukip kommt damit an. Von Christoph Scheuermann , London Christoph Scheuermann SPIEGEL-Korrespondent in Washington. E-Mail: christoph.scheuermann@spiegel.de Twitter: @chrischeuermann folgen Mehr Artikel von Christoph Scheuermann Wenig Zeit? Am Textende gibt's eine Zusammenfassung. Nigel Farage hat im Wahlkampf mit vielem gerechnet, aber nicht mit der Sonne. Er kandidiert in England, da ist gutes Wetter selten ein Problem. Doch jetzt sticht das Licht von schräg oben durch ein Fenster auf das Podium, blendet ihn, wohin er sich auch bewegt. Er greift zum Mikrofon und für einen Moment rechnet man damit, dass er nun eine Wutrede auf die Sonne halten wird. Schließlich ist sie ja auch Ausländerin, irgendwie.   Stattdessen ruft er ins Publikum: \"Ich heiße Nigel Farage und bin 51 Jahre alt. Bevor ich in die Politik ging, hatte ich einen Job. Was sagt ihr jetzt?\" Farage stellt sich als Geschäftsmann vor, der ein Leben außerhalb der Politik hatte - im Gegensatz zum Establishment aus Westminster. Er sei Rohstoffhändler in der City gewesen, später habe er sein eigenes Business aufgebaut. Er tritt zwei Schritte nach rechts. Die verdammte Sonne ist immer noch da. Farage ist Vorsitzender der \"United Kingdom Independence Party\" und Europa-Abgeordneter für Ukip . Seine Partei hat an diesem Sonntagnachmittag die Bürger von Ramsgate im Süden Englands zum \"public meeting\" eingeladen, in einen Mehrzwecksaal am Rand der Innenstadt. Etwa 100 Männer und Frauen sind gekommen, Familienväter, Hausfrauen, Rentner, einige tragen Hörgeräte. Farage hat sich eine Krawatte umgebunden, auf die bunte Fliegenfischer-Angelhaken gedruckt sind, dazu trägt er ein gestreiftes Hemd mit Manschettenknöpfen und einen dunklen, weit geschnittenen Anzug. Er versprüht die Jovialität eines Gebrauchtwagenhändlers, der seine Garderobe seit 1987 nicht verändert hat. Die Menschen im Saal mögen das. Es erinnert sie an die glorreiche Zeit, als Großbritannien seine eigenen Geschicke lenken konnte und noch nicht, wie Farage es darstellt, von einem Kraken aus Brüssel ferngesteuert wurde. Es sind nicht einmal mehr drei Wochen bis zur Parlamentswahl , Farages Einsatz ist hoch. Er hat angekündigt, als Ukip-Chef zurückzutreten, wenn er kein Mandat bekommt. Gut möglich, dass er von der politischen Bühne verschwindet. Ramsgate ist der größte Ort in seinem Wahlkreis Thanet South, einen klaren Favoriten gibt es nicht. Landesweit liegt die Ukip in Umfragen derzeit bei 13 Prozent, Demoskopen dämpfen die Erwartung. Wenn Farage Ramsgate überzeugen kann, für ihn zu stimmen, ist er dem Parlament einen großen Schritt näher. Migranten strapazieren Gesundheitssystem und Wohnungsmarkt Er wedelt mit einer violetten Broschüre über seinem Kopf. \"Das ist unser Wahlprogramm, es wurde von einem unabhängigen Institut geprüft\", ruft er. REUTERS Farage mit Wahlprogramm: Wilde Versprechungen In der Broschüre steht, dass Großbritannien die Europäische Union verlassen soll, unqualifizierte Einwanderer fünf Jahre lang nicht ins Land kommen dürfen und ein Punkte-System für potenzielle Immigranten eingeführt werden soll, ähnlich wie in Australien . Außerdem will Farage die Ausgaben für das Militär erhöhen und die geplante Hochgeschwindigkeits-Trasse HS2 streichen. Alles unter der Bedingung, dass Ukip an die Macht kommt.   Das ist so wahrscheinlich wie der Rücktritt der Queen, Farage weiß das. Aber auch so hat er viel bewirkt. Seit Jahren treiben er und seine Anhänger die Konservativen und Labour vor sich her. Ohne die Gefahr durch Ukip und den Druck von Hinterbänklern hätte Premierminister David Cameron kaum ein EU-Referendum für 2017 versprochen. Ohne Ukip würde nicht das halbe Land über Ausländer diskutieren. Gerade überbieten sich die beiden großen Parteien mit Vorschlägen, wie man die Einwanderung reduzieren kann. Das ist zum großen Teil Farages Verdienst. Wenn man sich die Themen des Wahlkampfs ansieht, gibt es schon jetzt einen heimlichen Gewinner. REUTERS Ukip-Wähler (in Essex): Farages Populismus kommt an Migranten hätten die Wohnungskrise in Großbritannien ausgelöst, sagt Farage auf dem Podium. \"Das ist eine einfache Rechnung von Angebot und Nachfrage.\" Einwanderer strapazierten auch das Gesundheitssystem. Dazu zählten HIV-Kranke, die auf die Insel kommen und jedes Jahr für je 20.000 Pfund Medikamente erhielten, ohne bezahlen zu müssen. Migranten seien zudem dafür verantwortlich, dass Engländer zu lange auf Arzttermine warten müssten.   Merkel und die anderen Idealisten auf dem Kontinent Farage ist in zweiter Ehe mit einer Frau aus Hamburg verheiratet, die er zeitweise als Sekretärin beschäftigte und aus EU-Geldern bezahlte. Sie haben zwei Kinder. Die Ironie ging auch an ihm nicht vorüber, dass ausgerechnet er sich über Immigranten aufregt. Seine Frau erwähnt er mehrfach, wenn auch nicht namentlich. Er sagt: \"Ich bin mit jemandem aus Europa verheiratet.\" Farage wippt auf Zehenspitzen. In Europa gebe es 458 Millionen Menschen mit einem europäischen Pass, sagt er, 458 Millionen, die problemlos nach Großbritannien einreisen und hier arbeiten können. \"Wir wollen aber die Hochqualifizierten.\" Er lächelt sein breites Froschlächeln. Außerdem ärgert er sich über die Schotten, die vom englischen Steuerzahler gefüttert würden, sowie über Juncker , Tusk , Merkel und die anderen Idealisten auf dem Kontinent. Laut Farage planten sie gerade, die EU in einen riesigen, alles verschlingenden Staat mit einer eigenen Armee zu verwandeln. \"Das sind gefährliche Fanatiker\", ruft er. Putin nennt er den \"russischen Bären\". Später gibt er Autogramme. Es sieht aus, als hätte ihm das Publikum die Rolle als Anwalt des gesunden Menschenverstands abgekauft, als Rächer der englischen Minderheit. Die Stimmung ist gelöst. An einem Merchandising-Stand verkaufen drei weißhaarige Damen Kuchen und Farages neues Buch \"Revolution\", für zehn Pfund pro Exemplar. Wer in die Partei eintritt, bekommt es gratis. Zusammengefasst : Nigel Farage führt Ukip mit ausländerfeindlichen Parolen in den Wahlkampf der Briten. Damit hat er Erfolg: Für einen Wahlsieg wird es nicht reichen, doch er setzt Themen, treibt die etablierten Partein vor sich her. Am 7. Mai wird gewählt, Ukip liegt derzeit bei bis zu 13 Prozent.",http://www.spiegel.de/politik/ausland/nigel-farage-ukip-chef-der-mann-der-england-aufstachelt-a-1029472.html,2015-04-20T00:00:00.000Z
"Böhlen in Sachsen Unbekannte schießen mehrfach auf Flüchtlingsheim Die Täter griffen an zwei Tagen in Folge an: Auf ein Asylbewerberheim im sächsischen Böhlen wurden Schüsse abgegeben. Landtagspolitiker gaben sich entsetzt - auch Abgeordnete der AfD. Auf ein Flüchtlingsheim im sächsischen Böhlen haben Unbekannte am Wochenende geschossen - gleich in zwei Nächten hintereinander. Eine Fensterscheibe und Teile der Fassadenverglasung gingen dabei zu Bruch. Verletzt wurde niemand, wie ein Sprecher der Polizei am Mittwoch sagte. Das Heim in der Nähe von Leipzig ist in einem Hotel untergebracht, das von einem früheren Parteifunktionär der Republikaner betrieben wird. In dem Objekt sind dem MDR zufolge rund 150 Asylsuchende untergebracht. Die Betreiber des Heims wollten sich am Mittwoch zu dem Vorfall nicht äußern. Die Polizeizentrale für Extremismusbekämpfung hat die Ermittlungen wegen Sachbeschädigung übernommen. Die beiden Übergriffe ereigneten sich in der Nacht zum Samstag und zum Sonntag, jeweils kurz nach Mitternacht. Womit auf das Flüchtlingsheim geschossen wurde, wollte die Polizei aus ermittlungstaktischen Gründen nicht sagen. Die AfD verurteilt \"Gewalt gegen Asylbewerber\" \"Wieder wird in Sachsen eine neue, erschreckende Stufe der Gewalt gegen Geflüchtete erreicht\", sagte die migrationspolitische Sprecherin der Linken im Landtag, Juliane Nagel. Mit dem Angriff auf das Hotel sei bewusst in Kauf genommen worden, dass Menschen verletzt oder gar getötet werden. Der Geschäftsführer der sächsischen AfD -Fraktion, Uwe Wurlitzer, sagte: \"Wir verurteilen ausdrücklich jede Art von Gewalt gegen Asylbewerber und Asylbewerberheime.\" Seine Fraktion hoffe, \"dass die Täter bald gefasst und zur Verantwortung gezogen werden\". In den vergangenen Monaten waren bundesweit wiederholt Flüchtlingsheime beschmiert, beschädigt oder angezündet worden - unter anderem in Meißen, Tröglitz, Hoyerswerda und Solingen.",http://www.spiegel.de/politik/deutschland/sachsen-schuesse-auf-fluechtlingsheim-boehlen-bei-leipzig-a-1043832.html,2015-07-15T00:00:00.000Z
"Bundespräsident Gauck in Irland \"Die Menschenrechte sind nicht verhandelbar\" Bundespräsident Joachim Gauck hat eine Grundsatzrede zu Europa gehalten. In Irland rief er zu einem stärkeren Einsatz für Menschenrechte auf. Wie ernst es die EU damit meine, zeige sich am Umgang mit den Flüchtlingen. Bundespräsident Joachim Gauck hat an die Menschen in Europa appelliert, die Errungenschaften der europäischen Integration gegen Populisten von links und rechts zu verteidigen. Gleichzeitig müsse Europa sich daran messen lassen, wie es angesichts immer größerer Flüchtlingszahlen das Bekenntnis zu den Menschenrechten umsetze. \"Wie glaubwürdig die Europäische Union in Fragen der Menschenrechte ist, das hängt in der aktuellen Situation davon ab, wie wir in Europa mit jenen Menschen umgehen, die bei uns Zuflucht suchen\", sagte Gauck im irischen Galway. Dort erhielt er an der National University of Ireland die Ehrendoktorwürde. Gauck kritisierte in seiner Dankesrede, dass es beliebt geworden sei, ein verzerrtes Bild der EU zu zeichnen: \"Intransparent, ungerecht, undemokratisch\" - so werde das \"Feindbild Brüssel \" beschrieben. \"Erfahrungen voller Gewalt, Schmerz und Leid\" Dagegen müsse man klarmachen, dass das ehemalige \"Schlachthaus Europa\" mit seiner langen Geschichte verheerender Kriege am Anfang dieses Integrationsprozesses stehe. \"Blicken wir zurück: Es waren existenzielle Momente und Erfahrungen voller Gewalt, Schmerz und Leid, die der Gründung der Europäischen Gemeinschaft vorausgingen.\" Die internationale Ordnung, die sich nach 1990 herausgebildet hat, sei unter Druck geraten, sagte Gauck. Die Hoffnung, dass sich die liberale Idee von der freiheitlichen Demokratie an immer mehr Orten der Welt durchsetzen würde, habe sich nicht erfüllt. Dies zeige sich am südlichen Rand des Mittelmeers ebenso wie an der östlichen Peripherie der Union. Damit bezog sich Gauck auch auf den Konflikt mit Russland und die Ukrainekrise . \"Weltweit ist die Akzeptanz der Demokratie als Regierungsform so niedrig wie nie seit 1989\", sagte er. \"Es haben sich jene Regierungsmodelle gefestigt, die ohne allzu viel Demokratie auskommen. Die Autokratien, die lange Zeit in der Defensive waren, bewerben nun nach innen ganz offensiv ihre eigenen Stärken.\" \"Die Menschenrechte sind nicht verhandelbar\", sagte Gauck. Sie dürften keinen \"machtpolitischen Interessen geopfert werden und auch nicht dem Anspruch auf kulturelle Besonderheit\". Nationalistische Überlegenheitsgefühle, Antisemitismus, Islamophobie oder sonstige Fremdenfeindlichkeit müssten deshalb entschlossen bekämpft werden.",http://www.spiegel.de/politik/ausland/irland-joachim-gauck-haelt-grundsatzrede-zu-europa-a-1043732.html,2015-07-15T00:00:00.000Z
