article,article_url,date
"Aufsteigerroman \"Die Gierigen\" Das System ist böse? Ich bin böser! Zwischen Pariser Banlieue und New Yorker Geldadel: Karine Tuil zeichnet in \"Die Gierigen\" das Porträt eines gnadenlosen Aufsteigers aus dem Migrantenmilieu. Von Christian Buß Saima Altunkaya Christian Buß Jahrgang 1968, schreibt seit 1988 über Popkultur, Film und Fernsehen. Stationen: \"Hamburger Morgenpost\", \"Tempo\", \"Rolling Stone\", \"taz\", \"Berliner Zeitung\". Seit 2004 Autor für SPIEGEL ONLINE, seit Januar 2011 Redakteur im Ressort Kultur. E-Mail: Christian.Buss@spiegel.de Twitter: @Christian_Buss folgen Mehr Artikel von Christian Buß Wer ohne soziales Bewusstsein und ohne moralische Instanzen aufwächst, kann alles werden - Heiratsschwindler, Gangster oder, noch schlimmer: Anwalt. Oder noch mal schlimmer: alles zusammen. Das ist die grausame Pointe in Karine Tuils knapp 500-seitigem Roman \"Die Gierigen\" über einen Aufsteiger aus der Pariser Banlieue, der in der vergangenen literarischen Saison in Frankreich als kleine Sensation gefeiert wurde und jetzt auf Deutsch erscheint. Der tunesischstämmige Samir, die Hauptfigur, wächst in unterschiedlichen Elendszonen des Einwanderungslandes Frankreichs heran. Auf dem engen Dachboden eines reichen Politikers etwa, der gleichzeitig der Liebhaber seiner Mutter ist. Aber auch in der Sozialbausiedlung am Rande von Paris, wo er später in einer heruntergekommenen Wohnung mit seinem Halbbruder zusammenlebt, der aus der Dachbodenaffäre hervorgegangen ist, während die Mutter in der engen Küche verhasste maghrebinische Hühnchengerichte kocht. Was für eine Genugtuung muss es sein, dass der wütende, entwurzelte, dadurch aber auch extrem bewegliche junge Mann die Gesellschaft, die ihn immer ausgegrenzt hat, durch eine Art Überassimilation zu schlagen vermag. Oder dass er sich zumindest der Illusion hingeben kann, dass er sie schlägt. Das System ist böse? Ich bin böser! Samir wird in Frankreich zum hochgehandelten Nachwuchsanwalt, und mehr noch: Der Sohn muslimischer Eltern nimmt eine jüdische Scheinidentität an, lässt sich nach New York versetzen und heiratet dort in eine der reichsten jüdischen Familien des Landes ein. Gier, Lust und Rachedurst sind sein Treibstoff. Identität in Trümmern Mit furioser Fabulierlust bringt Autorin Tuil die Handlung zwischen penthouse and pavement voran. Dass das gewagte Rollenspiel des Protagonisten aufgeht und (zumindest über weite Strecken des Romans) plausibel erscheint, liegt auch daran, dass Samirs Identität in Trümmern vor ihm liegt. Wenn er sich schon eine neue zusammenzimmern muss, kann es doch eigentlich auch gleich die eines Gewinners sein. Doch wo es Gewinner gibt, muss es auch Verlierer geben. Im Falle von Samir sind das seine alten Studienfreunde Nina und Samuel; in ihren frühen Zwanzigern bildeten sie ein inniges Trio, dann kam die Liebe dazwischen, später auch noch der Neid, die Einheit zerbrach. Samir klaute Teile aus der Biografie seines jüdischen Freundes Samuel und lügt und betrügt sich so in die New Yorker High Society, die beiden anderen aber bleiben zurück mit ihren unerfüllten Ambitionen: er als verhinderter Schriftsteller, sie als leicht verlotterte Version einer Frau von Welt. Die Selbsterfindung als Kriegserklärung an die Welt - auch dem Roman einer anderen Schriftstellerin, der in der letzten Saison in Frankreich gefeiert wurde und der im Sommer auf Deutsch erschienen ist, grenzt sich die Hauptfigur denkbar radikal von ihrer Herkunft ab: In \"Ladivine\" erzählt Marie NDiaye von einer jungen Frau, die ihre dunkelhäutige Mutter verleugnet und sich eine Scheinexistenz konstruiert. Auf über 400 Seiten wird ein komplexes Ineinander aus Selbstbetrug und Fremdbestimmung aufgezeigt. Filigran in der Beschreibung, energisch in der psychologischen Beweisführung. So ist in Frankreich das Thema Migration längst dem Fach der wohlmeinenden Problemliteratur entwachsen und zum Stoff für den großen psychologischen Roman geworden. Ein Thema, zwei Herangehensweisen: Während NDiaye die Unbehaustheit ihrer Hauptfigur konsequent aus der Binnenperspektive zeigt, weitet Tuil den Blick ins gesellschaftliche Panorama. Gerade zum Ende springt sie, inzwischen ein wenig atemlos, die gesellschaftlichen Ebenen zwischen der Pariser Banlieue und dem alten Geldadel der US-Ostküste ab - stets aber nutzt sie für dieses Hierarchie-Hopping geschickt den Resonanzraum, den reale Figuren und reale Ereignisse geschaffen haben. Mal denkt man beim Lesen an Rachida Dati , die schillernde ehemalige französische Justizministerin mit Wurzeln im Maghreb, mal an Dominique Strauss-Kahn und die sexuellen Ausschweifungen, die ihn zum Fall brachten. Am Ende droht auch Tuils Aufsteiger durch sein gefährliches Antriebsgemisch aus Gier, Lust und Rachedurst vor die Hunde zu gehen. Da zeigt sich dann doch Karine Tuils abgründige Erzählkunst: Der Gierlappen Samir ist einem da längst ans Herz gewachsen.",http://www.spiegel.de/kultur/literatur/karine-tuil-roman-die-gierigen-ueber-yuppies-und-loser-a-983721.html,2014-08-20T00:00:00.000Z
"Mittelmeer Europäische Marineschiffe retten mehr als 700 Flüchtlinge Die Flüchtlinge waren in Schlauchbooten unterwegs und drohten unterzugehen: Marineschiffe der EU haben Hunderte Menschen aus Seenot im Mittelmeer gerettet. Auch die Bundeswehr war an dem Einsatz beteiligt. Innerhalb weniger Stunden haben europäische Marineschiffe am Donnerstag mehr als 700 Flüchtlinge aus dem Mittelmeer gerettet. Wie ein Sprecher der italienischen Küstenwache mitteilte, wurden bei sechs Einsätzen deutscher, britischer und irischer Schiffe insgesamt 741 Menschen an Bord genommen. Die Flüchtlinge befanden sich demnach in fünf Schlauchbooten und einem weiteren Boot und waren in Libyen in See gestochen. Die deutsche Fregatte \"Hessen\" war an zwei Rettungseinsätzen beteiligt. Insgesamt rettete die Besatzung nach Angaben der Bundeswehr 166 Menschen aus Seenot. Eines der Boote, auf dem die Flüchtlinge unterwegs waren, trieb führerlos im Meer, das andere drohte bereits zu sinken. Nach der Rettung übergab die \"Hessen\" die Geretteten an das britische Schiff \"HMS Bulwark\". Seit dem Jahresbeginn erreichten bereits etwa 40.000 Flüchtlinge aus Nordafrika über das Mittelmeer die Europäische Union, die meisten von ihnen Italien oder Griechenland. Nach Angaben der Internationalen Organisation für Migration kamen bis Mitte Mai fast 1800 Menschen auf der gefährlichen Überfahrt ums Leben. Nach Informationen von SPIEGEL ONLINE wurden im Mittelmeer zwischen November 2014 und Ende April 2015 fast 19.000 Flüchtlinge von Handelsschiffen geborgen und nur etwa 1700 von Schiffen der europäischen Grenzschutzagentur Frontex. SPIEGEL ONLINE",http://www.spiegel.de/politik/ausland/bundeswehr-rettet-fluechtlinge-aus-seenot-im-mittelmeer-a-1036111.html,2015-05-29T00:00:00.000Z
"Berlin Turnhallenbrand offenbar von Kindern verursacht Der Brand in der Nähe von zwei Berliner Flüchtlingsunterkünften ist wahrscheinlich von Kindern ausgelöst worden, die selbst dort wohnten. Ein acht Jahre alter Junge hat laut Polizei zugegeben, gekokelt zu haben. Hunderte Asylbewerber mussten sich in Sicherheit bringen, sofort hatte sich der Rauch überall hin verbreitet: Am vergangenen Mittwoch war direkt neben zwei Flüchtlingsunterkünften in Berlin eine Turnhalle abgebrannt . Zunächst war unklar, ob es sich um einen Anschlag auf Flüchtlinge handelte. Nun gab die Polizei bekannt, dass der Brand wahrscheinlich von Kindern ausgelöst worden ist. Durch Zeugenaussagen seien die Ermittler auf einen Achtjährigen gestoßen. Dieser habe zugegeben, dass er mit anderen Kindern in der Halle gekokelt habe. Dabei sei der Brand entstanden. Laut Polizei konnten auch die anderen Jungen ermittelt werden. Zwei von ihnen hätten nach Anhörung durch Polizeibeamte auch zugegeben, beteiligt gewesen zu sein, wie die \"Berliner Morgenpost\" berichtet. Da die Kinder strafunmündig sind, bleiben sie den Angaben zufolge bei ihren Eltern. Laut Polizei wohnen die Flüchtlingskinder in den Unterkünften auf dem einstigen Klinikgelände.",http://www.spiegel.de/politik/deutschland/brand-in-turnhalle-berlin-reinickendorf-von-kindern-verursacht-a-1050543.html,2015-08-29T00:00:00.000Z
"Rechtsextremismus Fallsammlung soll Bedrohlichkeit der NPD belegen Brandstiftungen, Anfeindungen, Demonstrationen gegen Asylbewerber: Verfassungsschützer wollen mit neuen Fakten die Bedrohlichkeit der NPD beweisen. Eine Fallsammlung zeigt laut einem Zeitungsbericht, wie die Partei Druck ausübt. Das mecklenburgische Dorf Jamel gilt als Hochburg von Nazis. Es gibt Wegweiser zu Hitlers Geburtsort Braunau, Wandgemälde im NS-Stil und Drohungen gegen NPD-Gegner. Nun wollen Verfassungsschützer von Bund und Ländern mit einer bislang unveröffentlichten Fallsammlung belegen, wie bedrohlich die NPD für das friedliche Zusammenleben in Orten wie Jamel ist. Das berichtet die \"Frankfurter Allgemeine Sonntagszeitung\". Die Fallsammlung, die der \"FAS\" vorliegt, will an Beispielen belegen, wie die rechtsextreme Partei physischen und psychischen Druck entfaltet. Die NPD behindere \"aktiv-kämpferisch\" politische Gegner und Minderheiten. So werde Jamel \"gesellschaftlich fast vollständig von Rechtsextremen beherrscht\", wie die Rechtsvertreter des Bundesrats an das Verfassungsgericht zum aktuellen Verbotsverfahren schreiben. Dorfbewohnern zufolge sorgen NPD-Funktionäre für ein Klima der Angst. Davon überzeugte sich ein Verfahrensbevollmächtigter als er Ende Juli mit einer Familie in Jamel sprach. Zwei Wochen später, in der Nacht vom 12. auf den 13. August, wurde deren Scheune vermutlich durch Brandstiftung zerstört. In der Fallsammlung werden auch die Ereignisse im sächsischen Heidenau bei Dresden genannt. Dort habe die NPD nicht nur Demonstrationen gegen Asylbewerber organisiert, sondern \"gleichzeitig mit rechtsextremistischen bzw. neonazistischen Gewalttätern kooperiert und aktiv und zielgerichtet eine Eskalation der Auseinandersetzung herbeizuführen\" versucht, heißt es in der Schrift an das Verfassungsgericht. Erst in der vergangenen Nacht versammelten sich wieder rund hundert rechte Aktivisten in Heidenau, um gegen die Flüchtlinge zu demonstrieren. Allerdings scheinen es Verfassungsschutz und Staatsanwaltschaft nicht eilig zu haben, die Vorfälle in Heidenau aufzuklären: Die Auswertung Krawalle in dem sächsischen Dorf habe kaum begonnen, wie die \"FAS\" aus dem sächsischen Verfassungsschutz erfuhr. Es lägen nicht einmal Namenslisten der polizeilich kontrollierten Teilnehmer vor.",http://www.spiegel.de/politik/deutschland/npd-verbotsverfahren-rechte-partei-uebt-druck-aus-a-1050533.html,2015-08-29T00:00:00.000Z
"Flüchtlingsmisere Europas Schuld Europa hält sich von Kriegen lieber fern, beutet arme Länder aus, spart an Entwicklungshilfe - und trägt dadurch eine Mitverantwortung für das Flüchtlingsdrama. Ein Kommentar von Markus Becker , Brüssel Jeannette Corbeau Markus Becker Jahrgang 1973, stammt aus dem Ruhrgebiet. Studium der Anglistik, Geschichte und Germanistik in Bochum und Newcastle upon Tyne, Magister-Abschluss 1999. Neben dem Studium freie Mitarbeit für Zeitung und Rundfunk, Volontariat bei der \"Westdeutschen Allgemeinen Zeitung\" und der Journalistenschule Ruhr. Ab August 2002 Politik-Redakteur bei SPIEGEL ONLINE, seit September 2003 Ressortleiter Wissenschaft. Seit Juli 2015 Korrespondent in der Redaktionsvertretung Brüssel. E-Mail: Markus.Becker@spiegel.de Twitter: @MarkusBecker folgen PGP: Öffentlichen Schlüssel herunterladen Fingerprint: C92E BEE0 801E B474 4D5E D3C9 2B8D E5FC 590D 80AA Mehr Artikel von Markus Becker Kommentar Stellen Sie sich vor, sie lebten in einer Stadt mit 50.000 Einwohnern. Deren Verwaltung hat sich bereit erklärt, vier Flüchtlinge aufzunehmen. Prompt bricht ein erbitterter Streit darüber aus, wie die vier auf die Stadtteile verteilt werden sollen. Selbst nach Monaten des Verhandelns hat man sich nur auf die Unterbringung von dreien geeinigt. Über den vierten wird zunächst bis Jahresende weiterverhandelt. Mehr dazu im SPIEGEL Heft 36/2015 Helles Deutschland, dunkles Deutschland Es liegt an uns, wie wir leben werden. Ein Manifest. Digitale Ausgabe | Gedruckte Ausgabe | Apps | Abo Klingt absurd? Nichts anderes passiert derzeit in der EU. Deren 28 Mitgliedstaaten haben sich im Juni bereit erklärt, 40.000 Flüchtlinge, die nach mitunter gefährlichen und qualvollen Reisen in Griechenland und Italien angelandet waren, unter sich aufzuteilen. 40.000 - das ist weniger als ein Zehntausendstel der rund 507 Millionen EU-Bürger. Und nicht einmal über sie kann Europa sich einigen: Bisher hat sich nur für etwa 32.000 eine neue Bleibe gefunden. Das Verteilungs-Geschacher bietet nicht nur ein unwürdiges Schauspiel. Es zeigt auch, wie hoffnungslos überfordert Europa ist. 107.000 Flüchtlinge sind laut der EU-Grenzschutzagentur Frontex allein im Juli angekommen, davon 50.000 in Griechenland . Und die EU-Staaten streiten noch bis Jahresende über die Verteilung von 8000. Wenn es nur die Zahlen wären. Doch das Flüchtlingsdrama hat eine Seite von Europa enthüllt, die viele schon für überwunden hielten - und die nun feststellen müssen, wie sehr sie sich geirrt haben. Es sind nicht nur Ressentiments, die sich Bahn brechen. Flüchtlingen schlagen Rassismus und blanker Hass in einem Ausmaß entgegen, das fassungslos macht. Versagen in der Entwicklungshilfe Europas Politiker müssen ein Signal entgegensetzen, das über die bloße Behandlung der Symptome hinausgeht. Der Kampf gegen kriminelle Schleuser oder die Aufnahme von Flüchtlingen, selbst wenn sie in großzügigem Umfang geschähe, sind aber nicht viel mehr als das. Die Bekämpfung der Ursachen verlangt nach einer konzertierten Außen-, Sicherheits- und Entwicklungspolitik, die Überzeugungskraft, einen langen Atem und Geld kostet. Darin aber haben die reichen Staaten bisher versagt. Die EU etwa hatte 2005 verkündet, die Ausgaben für Entwicklungshilfe bis 2015 auf 0,7 Prozent der Wirtschaftsleistung anzuheben. Doch selbst dieses bescheidene Ziel hat sie krachend verfehlt: Der Anteil dümpelt seit Jahren bei rund 0,4 Prozent. Für die afrikanischen Staaten südlich der Sahara, aus denen viele Flüchtlinge stammen, haben die EU-Länder ihre Entwicklungshilfe sogar zurückgefahren. Nach Angaben der OECD sank sie zwischen 2005 und 2013 inflationsbereinigt von 18 auf 12 Milliarden Dollar pro Jahr - ein Rückgang um ein volles Drittel. Nun will die EU nach Informationen des SPIEGEL beim EU-Afrika-Gipfel im November auf Malta mehr als eine Milliarde Euro an zusätzlichem Geld für einen EU-Afrika-Treuhandfonds anbieten. Eine überschaubare Summe, deren Auszahlung darüber hinaus stärker als bislang davon abhängen soll, dass afrikanische Staaten Flüchtlinge ohne Asylanspruch zurücknehmen. Schizophrenes statt nachhaltiges Handeln So verkommt Entwicklungshilfe zum Ablasshandel - wie so oft. Dabei kann intelligent eingesetzte, langfristig wirkende Unterstützung ein probates Mittel gegen Fluchtbewegungen sein. Allerdings muss sie dafür von der Umwelt-, der Außen-, der Wirtschafts- und der Sicherheitspolitik flankiert werden. Und nicht zuletzt auch vom Verhalten der Verbraucher. Doch meist geschieht das genaue Gegenteil. Die Europäer überweisen Hilfsgelder, wenn Stürme oder Fluten Tausende töten - blasen aber weiter fröhlich Treibhausgase in die Luft, was solche Wetterkatastrophen wahrscheinlicher macht. Sie bauen Märkte in armen Ländern auf, um sie dann mit subventionierten Produkten zu überschwemmen. Sie kaufen gern billige Kleidung, die für Hungerlöhne hergestellt wird. Sie lieben günstige Smartphones, für die Minerale unter katastrophalen Umständen aus der Erde gekratzt werden. Sie kaufen Früchte aus Ländern, die für den Anbau ihre letzten Wasserreserven verschleudern. Konflikten vor der eigenen Haustür sehen sie oft nur zu (wie in Syrien) oder verlieren sie nach einem kurzen Eingreifen aus den Augen (wie in Libyen). Die Folgen dieses Tuns treffen genau jene Länder, deren Menschen jetzt an Europas Grenzen stehen. Natürlich kann Europa nicht jeden Krieg verhindern und jeden gescheiterten Staat aufbauen. Doch Europa muss für instabile und Not leidende Staaten bei Weitem mehr tun als bisher. Ansonsten darf es sich nicht wundern, wenn deren verzweifelte Bewohner in Richtung Hoffnung aufbrechen - und sich weder von Meeren noch von Zäunen aufhalten lassen.",http://www.spiegel.de/politik/ausland/fluechtlings-drama-europa-traegt-mitschuld-kommentar-a-1050220.html,2015-08-29T00:00:00.000Z
"Fragen und Antworten Wann Flüchtlingskinder zur Schule müssen Erfurts Oberbürgermeister wollte die Schulpflicht für Flüchtlingskinder einschränken. Doch wo gilt sie überhaupt? Nicht überall sofort und auch nicht für jedes Kind. Der Überblick. Von Heike Klovert Christian O. Bruch/ laif Heike Klovert Jahrgang 1981. Aufgewachsen in der Pfalz, Abitur in Yokohama. Studierte Geschichte und Japanisch in England und Kyoto. Hospitierte bei \"Kölner StadtAnzeiger\", ZDF, WDR, \"Rheinpfalz\", Reuters, Stern.de, SPIEGEL ONLINE. 2007 bis 2009 Volontariat bei dpa im Landesbüro Stuttgart, in Hamburg, Brüssel und Berlin. Danach zwei Jahre Redakteurin im Team dpa-Nachrichten für Kinder. Seit September 2011 bei SPIEGEL ONLINE in den Ressorts Schule und Uni, seit Januar 2016 im Bildungsressort. E-Mail: Heike.Klovert@spiegel.de Twitter: heisonne folgen Mehr Artikel von Heike Klovert Sollen alle Flüchtlingskinder in Deutschland eingeschult werden? Über diese Frage ist eine politische Debatte entbrannt. Der Oberbürgermeister Erfurts, Andreas Bausewein (SPD), hatte am Mittwoch in einem offenen Brief an Bundeskanzlerin Angela Merkel (CDU) und Thüringens Ministerpräsident Bodo Ramelow (Linke) gefordert, die Schulpflicht für Asylbewerber unter 16 Jahren auszusetzen - jedenfalls für jene aus sicheren Herkunftsländern und so lange, bis ihr Aufenthaltsstatus geklärt sei. Damit zog Bausewein viel Kritik auf sich . SPD-Chef Sigmar Gabriel teilte mit, er halte diesen Vorschlag für falsch: Bildung sei ein Menschenrecht, vor allem aber ein Kinderrecht. Ministerpräsident Ramelow sagte, in Deutschland unterliege jedes Kind der Schulpflicht. Auch der Deutsche Städte- und Gemeindebund sowie Politiker von FDP und Grünen lehnten den Vorschlag ab. \"Wer Flüchtlingskindern heute den Schulbesuch verwehrt, darf sich morgen nicht über Integrationsprobleme wundern\", sagte Grünen-Chefin Simone Peter dem \"Handelsblatt\". Bausewein selbst hat seine Aussage mittlerweile relativiert. Er habe sich missverständlich ausgedrückt . Doch wie ist die Situation für Flüchtlingskinder eigentlich? Müssen alle zur Schule gehen? Und wenn ja, ab wann? Wie werden sie dort aufgenommen? Die wichtigsten Fragen und Antworten: Wie weit geht die Schulpflicht für Flüchtlingskinder? In allen Bundesländern haben Flüchtlingskinder generell das Recht, eine Schule zu besuchen. Fast überall besteht für sie inzwischen auch eine Schulpflicht, selbst wenn sie einen unsicheren Aufenthaltsstatus haben. Baden-Württemberg, Hessen, das Saarland und mehrere andere Länder haben da in den vergangenen Jahren nachgebessert. Aber es gibt noch Ausnahmen: In Berlin zum Beispiel unterliegen ausländische Kinder nicht der Schulpflicht, solange sie kein Aufenthaltsrecht und auch keine sogenannte Duldung besitzen. Ab wann gehen Flüchtlingskinder zur Schule? Das ist in den Ländern verschieden geregelt. In Thüringen müssen Kinder zwischen 6 und 16 Jahren spätestens nach drei Monaten in die Schule, in Baden-Württemberg gilt die Pflicht nach sechs Monaten. Damit soll vermieden werden, traumatisierte Kinder sofort nach ihrer Ankunft zum Schulbesuch zu verdonnern. Außerdem ist dann noch nicht klar, in welcher Gemeinde die Familien unterkommen werden. Hamburg setzt mit dem Unterricht bereits in der Erstaufnahme-Einrichtung an. Meistens verteilen die Behörden die Kinder jedoch erst auf die Schulen, wenn diese die Erstaufnahme verlassen haben und einer Kommune zugewiesen wurden. Wie gehen die Schulen mit den Neuankömmlingen um? Viele Schulen sind schon gut vorbereitet auf ausländische Kinder: mit Vorbereitungsklassen oder Sprachlernklassen, mal schulintern, mal schulübergreifend. Manche nehmen seit vielen Jahren Flüchtlinge auf. Hauptschulen in größeren Städten haben oft eine Menge Erfahrung mit ausländischen Schülern. Doch es gibt auch Schulen, die Kinder ohne Deutschkenntnisse von Anfang an in den normalen Unterricht einbinden müssen und damit heillos überfordert sind. Besonders schwer ist es, wenn die Neuankömmlinge in ihrer Heimat noch nie eine Schule besucht haben und noch nicht einmal lesen und schreiben können. Wie viele Flüchtlinge sind minderjährig? In den ersten sechs Monaten dieses Jahres beantragten knapp 160.000 Menschen in Deutschland Asyl. Darunter waren fast 55.000 minderjährige Flüchtlinge. Für das ganze Jahr 2015 rechnet das Innenministerium mit rund 800.000 Flüchtlingen. Legt man die aktuellen Asylbewerberzahlen zugrunde, könnten darunter geschätzt 270.000 minderjährige Kinder und Jugendliche sein.",http://www.spiegel.de/lebenundlernen/schule/schulpflicht-fuer-fluechtlingskinder-die-wichtigsten-antworten-a-1050093.html,2015-08-29T00:00:00.000Z
