article,article_url,date
"Kanzler Kurz bei \"Maischberger\" Ein Auftritt für Fans und Gegner gleichermaßen Österreichs neuer Kanzler wird als \"Wunderkind\" gefeiert und als Wegbereiter des Rechtspopulismus kritisiert. Was Sebastian Kurz wirklich ist, wollte Sandra Maischberger nun herausfinden. Von Hasnain Kazim Jens Ressing Hasnain Kazim wurde 1974 im niedersächsischen Oldenburg als Sohn indisch-pakistanischer Einwanderer geboren. Er wuchs im Alten Land auf, vor den Toren Hamburgs, und machte in Stade Abitur. Studium der Politikwissenschaft in Hamburg, Laufbahn als Marineoffizier. Erste journalistische Erfahrungen sammelte er als Student unter anderem beim \"Stader Tageblatt\" und bei der Deutschen Presse-Agentur dpa im Südasienbüro in Neu-Delhi, Indien. Volontariat bei der \"Heilbronner Stimme\", anschließend dort Politikredakteur. Seit 2004 schreibt er für SPIEGEL ONLINE und den SPIEGEL, seit 2009 als Auslandskorrespondent mit Stationen in Islamabad, Pakistan, Istanbul, Türkei und derzeit Wien, Österreich. Er ist Verfasser von vier Büchern: \"Grünkohl und Curry. Die Geschichte einer Einwanderung\" (2009), \"Plötzlich Pakistan. Mein Leben im gefährlichsten Land der Welt\" (2015), \"Krisenstaat Türkei. Erdogan und das Ende der Demokratie am Bosporus\" (2017) und \"Post von Karlheinz. Wütende Mails von richtigen Deutschen - und was ich ihnen antworte\" (2018). E-Mail: Hasnain.Kazim@spiegel.de Twitter: @HasnainKazim folgen Facebook: Zum Profil Mehr Artikel von Hasnain Kazim Es ist nicht einfach, wenn man jung einen hohen Posten erreicht. Sebastian Kurz , seit dem 18. Dezember 2017 Bundeskanzler von Österreich und nur 31 Jahre alt, hat dieses Problem schon seit Jahren. Mit 24 wurde er Staatssekretär für Integration, mit 27 Außenminister und jetzt eben Regierungschef. Dafür hat er viel Kritik einstecken müssen. Aber er kokettiert auch gerne mit seiner Jugend. Zum Beispiel sagt er bei einer Pressekonferenz mit Angela Merkel , das Gute an dem Problem sei, dass es \"von Tag zu Tag besser\" werde. Auch in der Talkshow von Sandra Maischberger , in der Kurz zunächst ein Einzelinterview gibt, ist sein \"junges Alter\" Thema. \"Wunderknabe oder politischer Scharfmacher?\" betitelte die Moderatorin ihre Sendung und stellt ihren Gast vor als \"zarteste Versuchung, seit es Populismus gibt\". Ob er sein Jurastudium noch beenden wolle? Kurz hatte es zwei Prüfungen vor Ende sausen lassen - zugunsten der Chance, Staatssekretär zu werden. Seine wenig verwunderliche Antwort: Er habe schon als Staatssekretär kaum Zeit gehabt, noch weniger als Außenminister und nun, als Kanzler, erst recht nicht. Und was er denn mit so viel Geld mache, das er verdiene? Er gebe ja kaum etwas aus, antwortet Kurz. Und, interessanter: Ob er in einem konservativen Elternhaus groß geworden sei? Nein, in einem liberalen, antwortet er. \"Ich würde mich nicht als konservativ bezeichnen, sondern als christlich-sozial und liberal.\" Und ja, er fliege, wie schon seit Jahren vielfach berichtet, noch immer \"Holzklasse\", wie am Mittwoch von Wien nach Berlin - wie bodenständig, wie volksnah! (Ein Passagier, der zufällig in der Sitzreihe vor Kurz saß, twittert, dass Kurz, wie viele Menschen im Flugzeug, mit offenem Mund schlafe. How interesting! ) Und ja, er wohne immer noch im \"Arbeiterbezirk\" Wien-Meidling, aber nicht mehr in der alten 65-Quadratmeter-Wohnung. Wie groß die neue ist, sagte er nicht. Video DPA Maischberger stellt in der ihr eigenen charmanten Art harte Fragen - anders als die meisten österreichischen Medien, die Kurz derzeit immer noch bewundern. Mit denen, die ihn härter anfassen, redet er nicht. Vor allem was Kurz' Koalition mit der rechtspopulistischen FPÖ angeht, schont Maischberger ihn nicht. Von einer Liste ablesend, zählt sie rechtsradikale bis neonazistische Fehltritte von FPÖ-Politikern auf. Was er denn dazu sage? Kurz antwortet, wie so oft, ausweichend. \"Jede Partei hat eine Vergangenheit\", erklärt er. Wichtig sei doch, wie ein Parteichef mit solchen Dingen umgehe. Da habe er einen guten Eindruck von FPÖ-Chef Heinz-Christian Strache . Dass dem Verbindungen zu Neonazis nachgesagt werden, tut Kurz ebenfalls ab: Es sei zwar \"richtig, kritisch hinzusehen\", aber man müsse \"Jugendsünden\" eben auch als solche anerkennen. Klar, Strache ist ja auch sein Vizekanzler. Strache hat kürzlich noch von \"Ausgangssperren\" für Flüchtlinge geredet . Herbert Kickl, einst Redenschreiber des Rechtspopulisten Jörg Haider , bislang FPÖ-Generalsekretär und neuerdings österreichischer Innenminister, sprach davon, Flüchtlinge an einem Ort zu \"konzentrieren\" . Kurz sagt im Gespräch mit Maischberger, bei Kontakten zu Neonazis würde er als Bundeskanzler \"sofort reagieren\". \"Aber man muss jedem eine Chance geben.\" Zu den verbalen Entgleisungen seiner Regierungsmitglieder hat Kurz sich bisher nicht öffentlich geäußert. \"Für mich ist der Blick nach vorn relevant.\" In den Koalitionsgesprächen habe er den Eindruck gewonnen, dass Strache und die FPÖ sich \"für Österreich und die EU\" einsetzen wollten. Für ihn zähle das Regierungsprogramm. Dass das oft nicht zusammenpasst mit der FPÖ-Linie - darüber geht Kurz einfach hinweg. Zu der Koalition mit der FPÖ habe es \"keine andere Alternative\" gegeben, \"nachdem die Sozialdemokratie nicht bereit war zu regieren\". Überhaupt, eine Mehrheit der Österreicher habe den Wunsch nach Veränderung gehabt, sagt Kurz. \"Schaun mer mal\", sagt Maischberger, und Kurz findet das gut und greift das sofort auf. Ja, man solle seine Regierung an den Taten messen und nicht vorverurteilen. \"Schaun mer mal\", wiederholt er. Zu Deutschland mag er nichts sagen. Nichts zu den ewigen Koalitionsverhandlungen in Berlin, nichts auf die Frage, ob er eine Regierungsbeteiligung der AfD in Zukunft für möglich halte. Immerhin das sagt er: Die AfD sei nicht vergleichbar mit der FPÖ, die ja schon Regierungserfahrung habe. Vieles lächelt Kurz freundlich weg, manches beantwortet er inhaltlich. Weshalb er zum Beispiel als Staatssekretär noch gegen ein Burkaverbot war und jetzt das kürzlich in Österreich eingeführte Verhüllungsverbot doch befürwortet? Weil die Lage sich in den vergangenen sieben Jahren verändert habe, sagt er. Es seien viele Flüchtlinge gekommen, vor allem aus islamischen Ländern. Zudem habe der IS-Terror auch Europa erfasst. Man muss seine Argumentation nicht nachvollziehen können, aber immerhin argumentiert er hier inhaltlich. Und so bietet Kurz wieder mal eine Projektionsfläche für Fans und Gegner gleichermaßen: Für die einen bleibt er der opportunistische, inhaltsleere, überzeugungsfreie und prinzipienlose Politikverkäufer, dessen einziger Antrieb das Streben nach Macht ist und der dafür sogar Rechtspopulisten den Weg ebnet. Für die anderen ist er der kluge, begabte, charmante, vielleicht wandlungsfähige, aber immerhin lernfähige Politiker, der wie schon oft unterschätzt wird und es am Ende doch wuppt. Kurz jedenfalls gibt sich bei Maischberger selbstbewusst wie immer: \"Jetzt bin ich froh, dass es in Deutschland einen Schwenk gegeben hat\", sagt er über die deutsche Flüchtlingspolitik. Wofür er 2015 kritisiert worden sei, seien heute mehrheitsfähige Positionen. Zum Ende der Sendung kommt Grünen-Politiker Jürgen Trittin hinzu. Gott sei Dank, denkt man und hofft, dass er Kurz noch ein bisschen Feuer macht. Aber Trittin widerspricht Kurz nur hier und da und gibt unterm Strich eher den väterlich-gutmütigen Altpolitiker, der den Jungspund zwar ein wenig belächelt, aber ja gar nicht so weit entfernt ist in vielen Dingen. Was also ist Sebastian Kurz - Phänomen oder Schaumschläger? Schaun mer mal.",http://www.spiegel.de/kultur/tv/sandra-maischberger-mit-sebastian-kurz-und-juergen-trittin-schaun-mer-mal-a-1188470.html,2018-01-18T00:00:00.000Z
"Bericht von Menschenrechtlern US-Grenzwächter sollen systematisch Hilfen für Flüchtlinge zerstören Mitarbeiter des US-Grenzschutzes zerstören in der Wüste von Arizona offenbar regelmäßig Proviant und andere Hilfsleistungen für Menschen, die aus Mexiko fliehen. Einem Bericht zufolge nehmen sie den Tod der Flüchtlinge in Kauf. Zwei Menschenrechtsgruppen haben am Mittwoch einen Bericht zur Situation an der Grenze zwischen den USA und Mexiko vorgestellt. Darin werfen sie amerikanischen Grenzschützern vor, regelmäßig Hilfslieferungen wie Wasserkanister und Decken zu zerstören, die dort von Organisationen und anderen Helfern für Flüchtlinge deponiert wurden. Damit würden die Mitarbeiter der United States Border Patrol mutwillig den Tod der Menschen in Kauf nehmen. Der 23-Seiten-Bericht trägt den Titel \"Eingriffe in die humanitäre Hilfe\" und ist Teil zwei eines längeren Projektes über das \"Sterben und Verschwinden an der amerikanisch-mexikanischen Grenze\". Dahinter stehen die Organisationen \"No More Deaths\" (\"Keine weiteren Todesfälle\") und \"La Coalición de Derechos Humanos\" (\"Koalition der Menschenrechte\"), die beide in der Stadt Tucson im US-Bundesstaat Arizona ansässig sind. Videoreportage: Die \"Obamas\" von der Grenze Video SPIEGEL ONLINE Ihren Untersuchungen zufolge wurden von März 2012 bis Dezember 2015 in der Sonora-Wüste im Grenzgebiet südwestlich von Tucson 415-mal zerstörte Wasserkanister gefunden, das mache im Durchschnitt rund zwei Mal pro Woche. Insgesamt seien 3586 Kanister gefunden worden, die von Menschen zerstört wurden. Die Organisationen veröffentlichten dazu Videomaterial , das Grenzschützer bei den Taten zeigen soll. Es handle sich um \"eine verstörende Realität\", heißt es im Bericht: \"In der Mehrzahl der Fälle sind Mitarbeiter des US-Grenzschutzes in großem Stil für die Eingriffe in grundlegende humanitäre Bemühungen verantwortlich.\" Auch Tiere, Jäger oder Wanderer würden die Hilfslieferungen für Flüchtlinge beschädigen. Der Großteil der Schäden gehe aber auf die Mitarbeiter des Grenzschutzes zurück. Die US Border Patrol gehört zum Ministerium für Innere Sicherheit. \"Bei dem Zerstören der Hilfsleistungen handelt es sich nicht um das abseitige Verhalten von ein paar Grenzschützern\", heißt es in dem Bericht. Es handle sich vielmehr um ein systematisches Vorgehen im Grenzgebiet. Die Behörde für Grenzschutz hat sich gegenüber \"The Intercept\" zu den Vorwürfen geäußert. Man sei verpflichtet, Gesetze zum Grenzschutz umzusetzen und dabei die Sicherheit aller Menschen zu gewährleisten. \"Weder dulden noch unterstützen wir die Zerstörung oder Manipulation von Hilfsproviant.\" Wie der \"Guardian\" berichtet, sollten Menschen, die in dem Gebiet die Grenze überqueren wollen, zwischen fünf und zwölf Litern Wasser pro Tag trinken. Aber nur die wenigsten würden mehr als sieben Liter mit sich tragen - auf einer Reise, die mehrere Tage oder gar Wochen dauern könnte. Die Flaschen und Kanister würden zerstört, \"damit man sie nicht wieder auffüllen kann\", wird in dem Bericht der 37-jährige Mexikaner Miguel zitiert, der die Grenze zu den USA überquert hat. \"Ich brauchte Wasser, auch andere in der Gruppe brauchten Wasser, aber wir haben nur zerstörte Flaschen gefunden.\" Er habe sich hilflos gefühlt, sei wütend gewesen. Über die Grenzschützer sagte er demnach: \"Sie müssen uns hassen.\" Der Zeitraum, für den die Organisationen ihre Daten erhoben haben, fällt in die Amtszeit von US-Präsident Barack Obama . Sein Nachfolger Donald Trump hat eine deutliche Verschärfung der Grenzpolitik angekündigt, um Migranten von den USA fernzuhalten. Zu einem seiner wichtigsten Anliegen hat er den Bau einer Mauer an der Grenze zu Mexiko erklärt. Erste Prototypen gibt es bereits . Gestritten wird noch um die Finanzierung des Projekts: Trump hat mehrfach betont, Mexiko werde für die Kosten aufkommen. Die Regierung in dem Land lehnt das entschieden ab. SPIEGEL TV Magazin über private Grenzmiliz  Video SPIEGEL TV",http://www.spiegel.de/politik/ausland/grenze-zwischen-mexiko-und-usa-us-border-patrol-soll-fluechtlingshilfen-zerstoeren-a-1188469.html,2018-01-18T00:00:00.000Z
"Laut Verfassungsschutz Zahl der Salafisten in Berlin steigt auf 950 Nach Angaben des Verfassungsschutzes leben in Berlin derzeit 950 Salafisten - rund doppelt so viele wie noch 2011. Darunter sind den Angaben zufolge nur wenige Flüchtlinge. Der islamistisch-salafistischen Szene in Berlin gehören nach Erkenntnissen des Verfassungsschutzes derzeit 950 Personen an, mehr als doppelt so viele wie noch 2011. Dabei sei der Anteil der gewaltorientierten unter ihnen noch stärker gewachsen, berichtete der \"Tagesspiegel\" unter Berufung auf eine Lageanalyse des Berliner Verfassungsschutzes. Vor sechs Jahren seien es etwa hundert Personen gewesen; bis heute habe sich die Zahl mehr als vervierfacht. Für die Broschüre mit dem Titel \"Hintergründe zu den Angehörigen des salafistischen Spektrums\" wurden dem Bericht zufolge die Daten zu 748 Salafisten ausgewertet. In der Gesamtschau dränge sich der Eindruck auf, \"dass die Angehörigen des salafistischen Spektrums in Berlin überdurchschnittlich alt sind\". Demnach dominieren Männer mit fast 90 Prozent. Sie sind im Schnitt 33,9 Jahre alt und damit ein Jahr älter als die Frauen. Die Hälfte der Szeneangehörigen seien Deutsche, von diesen habe knapp ein Drittel eine doppelte Staatsangehörigkeit. Dem Bericht zufolge dominieren die Pässe arabischer Länder und der Türkei. \"Auffällig\" sei laut Verfassungsschutz, dass bei den rein ausländischen Salafisten russische Staatsangehörige die größte Gruppe bildeten. Meist handele es sich um Personen aus dem Nordkaukasus - Tschetschenen, Inguschen, Dagestaner und Osseten. Die Zahl der Flüchtlinge in der Berliner Salafistenszene sei gering. Der Verfassungsschutz spreche von aktuell 27 Personen, die von 2014 an in Deutschland ankamen und nach Berlin gelangten. Sie stammten vor allem aus Syrien , dem Irak , Afghanistan und Russland . Die Salafisten sind eine islamistische Strömung, die sich streng an der Frühzeit des Islam orientiert. Sie verteufeln die Sitten der Ungläubigen und der unfrommen Muslime. Ganz unterschiedliche Gruppen bezeichnen sich heute als salafistisch.",http://www.spiegel.de/politik/deutschland/zahl-der-salafisten-in-berlin-steigt-laut-verfassungsschutz-auf-950-a-1188466.html,2018-01-18T00:00:00.000Z
"\"Maybrit Illner\" zu Tafeln \"Wir brauchen eine Atempause\" Maybrit Illner wollte zum Tafel-Streit diskutieren - und lenkte die Debatte fast unwidersprochen zurück zur Flüchtlingsfrage. Der Gast, der eventuell für einen sinnvolleren Drall hätte sorgen können, sagte kurzfristig ab. Von Arno Frank Bernd Hartung Arno Frank Mehr Artikel von Arno Frank \"Das Verhalten der Leute, dieses Geschiebe und Geschubse, hat zum Unwohlsein der anderen geführt, die jetzt nicht mehr kommen.\" Das sagte Jörg Sartor über die Tafel in Essen - er könnte damit aber auch die SPD gemeint haben. Angekündigt und eingeladen zu \" Maybrit Illner \" war Franziska Giffey von der SPD, wo derzeit großes Geschiebe und Geschubse um Ministerien und Posten herrscht. Weshalb die designierte Familienministerin , wie Illner sagt, \"heute Abend was anderes zu tun\" hat und nicht komme. An ihrer Stelle und mit Verspätung aus Stuttgart eingeflogen wird Leni Breymaier , um die Position der Sozialdemokratie zu vertreten: Der \"eigentliche Konflikt, den wir in dieser Gesellschaft haben, ist der zwischen Reich und Arm\". Illner: \"Da spricht die SPD-Politikerin.\" Gags darüber, dass SPD-Kanzler \"Gerhartz IV Schröder\" im Grunde als Vater der Tafel gefeiert werden müsste, kommen nicht so gut an. Hübsch auch, dass in letzter Zeit so viele vierschrötige Anpacker im Fernsehen zu sehen sind, mit unmöglichen Stachelfrisuren, Kassengestellen und Dialekt, die eigentlichen Macher der Tafeln - sozialdemokratische Urgesteine der Kieselklasse sozusagen. Diesmal ist es Rudi Löffelsend von der Flüchtlingshilfe der Caritas, der pragmatisch aus seiner Praxis berichtet. Darum aber geht es Illner an diesem Abend nicht. Anders als bei \"Hart aber fair\" am Montag dreht die Moderatorin ihre Sendung zunächst konsequent weg von der Armuts- und hin zur Flüchtlingsfrage. Da kann Annalena Baerbock , \"frisch bestallte Parteivorsitzende bei den Grünen\" (Illner), noch so gerne \"das grundsätzliche Problem\" thematisieren wollen: \"Warum kommen so viele Menschen an die Tafel?\" Illner bleibt hart: \"Verdienen junge Männer, die sich im Zweifel etwas dazuverdienen können, die gleiche Fürsorge wie ein älterer Mensch oder eine Mutter mit zwei Kindern?\" Baerbock: \"Wenn Sie mit 'junge Männer' Flüchtlinge meinen\", tja, ja, klar. Grundgesetz. Kann man nichts machen. Aber, insistiert Illner: \"Gibt der Staat den Flüchtlingen zu viel Geld?\" Das sieht nicht einmal Paul Ziemiak von der Jungen Union so: \"Das ist ganz, ganz knapp zum Leben.\" Nicht gefällt ihm allerdings, dass von dem Knappen bisweilen noch deutsches Geld in die Heimat überwiesen werde, weshalb er bisweilen Sachleistungen für geboten hält. Solange das Asylverfahren noch geprüft werde und Flüchtlinge in den Aufnahmezentren lebten, \"finde ich Sachleistungen richtig, um nicht zusätzliche Anreize zu schaffen\". Breymaier hat neulich im Schaufenster ein Handtäschchen für 500 Euro gesehen und dann um die Ecke den Verkäufer der Obdachlosenzeitung, \"das ist das Problem\". Ziemiak hält dagegen: \"Das ist ein bisschen zu einfach, das ist Populismus.\" Der Anstieg von Tafeln sei \"kein Anstieg von Armut\" in Deutschland. Sondern ein Zeichen dafür, dass \"wir nicht vernünftig mit Lebensmitteln umgehen\". Video aus Essen: \"Viele sind überrascht, dass sie weggeschickt werden\" Video DPA Ruhe in die Runde bringt die Theologin und Journalistin Friederike Sittler von der Initiative \"Laib und Seele\" aus Berlin. Sie räumt ein: \"Ich habe in dieser Sache meine gesamte Sozialromantik verloren\", stellt aber klar: \"Es gibt keine Hilfe erster und zweiter Klasse\". Auch sie meint, was Ziemiak sagt, nämlich dass es keinen Hunger gebe in Deutschland: \"Menschen, die zu uns kommen, machen sich das Leben ein bisschen leichter\", weil dann noch Geld übrig bleibe - sei's für die Enkelin, sei's für die Familie in Aleppo. Den Vorwurf, sie entlaste damit die Regierung, sieht sie nicht: \"Wir machen damit die Armut auch sichtbar.\" Einen Logenplatz mit Blick auf die Armut in seiner Stadt hat auch Bernhard Matheis . Wenn schon Franziska Giffey, bis dato Bezirksbürgermeisterin von Neukölln, nichts beitragen mag zur Debatte, dann tut das eben der CDU-Bürgermeister vom anderen Ende der Republik. Denn nach Freiberg, Cottbus, Salzgitter, Delmenhorst und Wilhelmshaven gibt es nun auch in Pirmasens einen Zuzugsstopp für Geflüchtete. 42.000 Einwohner, Arbeitslosenquote von mehr als zwölf Prozent, rund 1300 Flüchtlinge. Illner will ein wenig Empörung hervorkitzeln und wissen, ob Angela Merkel ihre \"Jahrhundertaufgabe\" nun den Kommunen in den Schoß gelegt hätte. Matheis bejaht, sieht es aber sachlich: \"Die Flüchtlinge sind jetzt dort angekommen, wo Integration stattfinden muss.\" Es sei auch nicht wahr, \"dass wir keine weiteren Flüchtlinge aufnehmen wollen\". Wer die Integration stemmen wolle, müsse mit seinen Sorgen aber auch gehört werden. So gebe es in Pirmasens - und sicher nicht nur dort - Kindergartengruppen mit 15 Kindern, in denen acht verschiedene Sprachen gesprochen werden. Eine vernünftige Arbeit sei unter solchen Bedingungen nicht mehr zu leisten, sagte Matheis, Königssteiner Schlüssel hin oder her: \"Wir brauchen eine Atempause.\" Es wäre interessant gewesen zu sehen, ob es der künftigen Bundesfamilienministerin von der SPD gelungen wäre, dieser Sendung einen sinnvolleren Drall zu geben. So aber hat Maybrit Illner eine Diskussion, die andernorts längst schon wesentlich weiter ist, weitgehend unwidersprochen wieder auf die Flüchtlingsfrage zurückbiegen können. Bravo.",http://www.spiegel.de/kultur/tv/maybrit-illner-zu-tafeln-wir-brauchen-eine-atempause-a-1197206.html,2018-03-09T00:00:00.000Z
"Brisanter Migrationsroman Bloß nicht so eine Hochhausfrau werden In \"Beschreibung einer Krabbenwanderung\" erzählt Karosh Taha vom Wunsch einer jungen Kurdin, der eigenen Familie zu entkommen. Ein aufregendes Debüt - leider in mehrfacher Hinsicht. Von Jérôme Jaminet Krebstiere haben die schlechte Angewohnheit, sich gegenseitig das Leben schwerzumachen. Eine Krabbe könnte viel leichter aus einem Krabbenkorb entkommen, wenn da nicht die anderen wären, die sie zurückhielten. Sanaa, die 22-jährige Ich-Erzählerin in Karosh Tahas aufwühlendem Debütroman \"Beschreibung einer Krabbenwanderung\", will genau das: dem Korb entfliehen, in dem sie mit ihren kurdischen Verwandten lebt. Wie viele andere sind sie einst aufgebrochen, um im vermeintlichen Eldorado Europa ein besseres Leben zu führen. Jetzt hausen sie in einer westdeutschen Stadt in klaustrophobischen Wohnungen voller geplatzter Träume, gefangen in einem Panoptikum-Hochhaus der wechselseitigen Kontrolle und Sanktion. Nachts steht die Mutter im Negligé auf dem Balkon und betet den Mond an. Ihr Körper ist in Deutschland angekommen, ihr Geist schwebt noch irgendwo im Nordirak. Asija, so heißt sie, vergisst zu essen, zu kochen, ist - wie es an einer Stelle in biblischer Anspielung auf die Frau von Lot heißt - \"zu einer Salzsäule erstarrt, weil sie zurücklaufen wollte\". Chai schlürfende Lästermäuler Auch die Männer der älteren Migrantengeneration scheinen wie paralysiert, führen ein prekäres, sinnentleertes Dasein in Dauerschleife. Onkel Agid empfindet nur noch beim Schauen selbstgedrehter Hochzeitsvideos aus der irakischen Zeit so etwas wie Glück. Der mürbe gewordene Vater Nasser mit seinen blutig gekratzten, krabbenrot gepanzerten Armen ist meist abwesend. Die resolutesten Sittenwächter der Hochhaussiedlung sind die bornierte Tante Khalida und ihre froschgesichtige Freundin Baqqe. Chai schlürfende Lästermäuler, die nur bekifft zu ertragen sind. Wenn sie nicht gerade in Asijas Wohnzimmer vor dem Fernseher lungern und über neue Nachbarn schwatzen, spinnt die eine Intrigen und die andere liest in Kaffeesätzen. Havin Al-Sindy/ DuMont Autorin Taha Keine Frage, auf sie ist kein Verlass. Weil zudem die Eltern als Ernährer und Erzieher ein Totalausfall sind, hat sich Sanaa die ganze Verantwortung aufgebürdet - vor allem für die schwermütige Mutter und die pubertierende Schwester Helin. Am liebsten würde sie beide dem Krabbenkorb entreißen: \"Schließlich können wir uns nicht den Rollen fügen, die Tante Khalida für uns schneidert, obwohl sie uns nicht passen, die um die Brust zu eng geschnitten sind, uns die Luft nehmen, uns das Laufen erschweren und uns zu Hochhausfrauen formen, zum Warten und Wachen verdammen.\" Als \"Hochhausfrau\" möchte die Studentin Sanaa auf keinen Fall enden. Sie will sich von den als einengend empfundenen Denkstrukturen, Werten und Bräuchen ihrer Herkunftskultur befreien, von ihren archaischen Rollenbildern: Liebe macht krank, Sex vor der arrangierten Ehe ist tabu, die Highlights eines Frauenlebens sind \"Geburt, Heirat, Tod\". Kurden-Karikaturen von kurdischer Autorin Sanaas geheime Antwort auf das Keuschheitsgebot: eine Dreiecksbeziehung. Der Sex ist ein verzweifelter Zerstreuungsversuch, die Polygamie ein Akt der kulturellen Revolte. Die Bettszenen werden dabei so explizit ausgemalt, dass Marcel Reich-Ranicki seine helle Freude daran gehabt hätte. Das Aufbegehren von Migrantenkindern gegen den Traditionalismus der älteren Generation ist kein neues literarisches Motiv. Deutschtürkische Schriftsteller wie Feridun Zaimoglu und Emine Sevgi Özdamar haben schon in den Neunzigerjahren eindrücklich davon erzählt. Aber Karosh Taha hat ihre eigene Sprache gefunden, die zwischen opulenter Bildhaftigkeit, lässigem Humor und ungehobelter Direktheit changiert. Und sie ist eine Meisterin der Rückblende. Das Problem sind die Figuren. Bei aller Empathie, die Taha ihnen angedeihen lässt, bleiben sie doch im Klischee verhaftet. Eine kurdische Autorin zeichnet Kurden-Karikaturen. Kurden machen falsche Versprechungen, folgen einer verqueren Logik, die Frauen sind gehässig, die Männer lügen und betrügen - und sind behaart wie \"Affen\". Der AfD-Stammtisch bedankt sich! Klar: Die 1987 im Nordirak geborene Schriftstellerin, die selbst als 9-Jährige mit ihren Eltern nach Deutschland emigrierte, hat ein sprachlich und erzählerisch reifes Debüt vorgelegt. In einem Interview hat sie verraten, dass sie das Milieu und die Anerkennungskonflikte aus eigener Anschauung kennt. Gerade deswegen ist ihr eine glaubhafte, postmigrantische Geschichte über den Schmerz der Entwurzelung, die Kollision zweier Kulturen und die Sehnsucht nach Selbstverortung gelungen. Leider leistet Taha aber eben auch xenophoben Klischees Vorschub. Deshalb ist \"Beschreibung einer Krabbenwanderung\" nicht nur im besten Sinne ein aufregender Roman.",http://www.spiegel.de/kultur/literatur/karosh-taha-beschreibung-einer-krabbenwanderung-rezensiert-a-1205556.html,2018-05-02T00:00:00.000Z
