article,article_url,date
"Spekulationen Floh Pérec vor Cathy Freeman? Nach Marie-José Pérecs bizarrem Abgang von der olympischen Bühne spekuliert man in Sydney über die Motive der französischen Medaillenkandidatin. Als Gründe werden Angst vor Dopingkontrollen, Formschwäche und eine angebliche Attacke im Hotelzimmer gehandelt. AFP \"Das australische Territorium verlassen\": Leichtathletin Pérec Sydney - Die Aufsehen erregende Flucht von Marie-José Pérec hat ihrer Konkurrentin Cathy Freeman endgültig den Weg zur australischen Nationalheldin geebnet. 36 Stunden vor Beginn der Vorläufe über 400 Meter verließ die dreifache Olympiasiegerin aus Frankreich unter mysteriösen Umständen Hals über Kopf Sydney. Nach tagelangem Versteckspiel in der Olympiastadt flog die 32-Jährige am Mittwoch über Melbourne nach Singapur und besiegelte damit ihr Olympia-Aus.  \"Marie-José Pérec hat am Mittwoch, dem 20. September, australisches Territorium verlassen. Das bedeutet, dass sie von den Olympischen Spielen zurückgetreten ist\", bestätigten Frankreichs NOK-Präsident Henri Serandour und Sportministerin Marie-George Buffet in einer gemeinsamen Erklärung. Gleichzeitig traten sie Gerüchten entgegen, Pérec habe sich mit dem überhasteten Aufbruch Dopingkontrollen entziehen wollen. \"Die französische Delegation kennt keine Gründe, aber sie möchte klarstellen, dass es keineswegs mit Dopingtests zusammenhängt\", hieß es.  REUTERS Angriff auf den Kameramann: Pérec (m.) mit Lebensgefährten Maybank auf dem Flughafen in Singapur Von Singapur aus wollten Pérec, ihr Lebensgefährte Anthuan Maybank und ihr Rostocker Trainer Wolfgang Meier weiter nach London reisen. Doch so weit kamen sie gar nicht, weil der amerikanische Staffel-Olympiasieger Maybank die Nerven verlor. Der frühere 400-Meter-Sprinter hatte bei der Zwischenlandung auf dem Flughafen Changi den Kameramann Kyme Hallion vom australischen Fernsehsender Channel 9 tätlich angegriffen und leicht verletzt. Der TV-Mann, der die \"Flüchtlinge\" filmen wollte, musste zur ärztlichen Behandlung in ein Krankenhaus gebracht werden, wo er auf Kopfverletzungen untersucht wurde. Anschließend wurden Pérec und Maybank neun Stunden lang in einem Polizeirevier von Singapur vernommen.   Am späten Abend stellten die Behörden in Singapur ihre Ermittlungen ein und erlaubten dem Paar die Weiterreise nach Paris. \"In Anbetracht der Tatsache, dass Herr Maybank und Frau Pérec die Absicht hatten, Singapur schnell zu verlassen, hat die Polizei die Nachforschungen beschleunigt\", sagte Polizeisprecher Phillip Mah, \"keine der Parteien wurde unter Arrest gestellt.\" Nach seinen Angaben hat das Büro des Generalanwaltes die Polizei angewiesen, nichts weiter zu unternehmen.  Das Drama um die eigenwillige Doppel-Olympiasiegerin von Atlanta, die sich seit ihrer Ankunft in Sydney im Grand Mercure Hotel verschanzt hatte, spitzte sich am Mittwoch zu. Nach Auskunft ihres Managers Annick Avierinos hatte ein Fremder versucht, in ihr Zimmer einzudringen, und sie bedroht. \"Deswegen hat sie entschieden, die Spiele in Sydney zu verlassen\", sagte er. Doch weder die Sicherheitskräfte des Hotels noch die Polizei in Sydney wissen etwas über einen derartigen Vorfall.  Allerdings scheint es, als sei der dramatische Abgang lange vorbereitet gewesen. Pérec weigerte sich, mit ihren Teamkollegen im Athletendorf zu wohnen, dort zu trainieren und zur offiziellen Pressekonferenz zu erscheinen. Stattdessen zog sie sich mit ihrem Trainer Wolfgang Meier für 70 Australische Dollar (rund 87 Mark) Grundgebühr und 65 Australische Dollar Miete pro Stunde ins abgeschirmte Sydney Athletic Field in Kensington zurück.  Noch am Mittwochvormittag hatte sie ihre Teilnahme offiziell bestätigt und fand sich auch noch in den Startlisten vom Donnerstag - auf Bahn drei im fünften Vorlauf ausgelost - wieder. Vor allem von Seiten der Australier wird nun spekuliert, dass sie wegen fehlender Form ein Theater inszeniert hatte, um einen Vorwand für die vorzeitige Abreise zu haben. \"Ich denke, wenn sie nicht hier ist, war sie offensichtlich nicht in guter Verfassung. Deswegen wäre es ohnehin kein großes Rennen gewesen\", meinte Australiens Cheftrainer Chris Wardlaw mit Blick auf das avisierte Duell mit Cathy Freeman. Pérec galt als einzig ernst zu nehmende Rivalin der Doppel-Weltmeisterin im Kampf um Olympia-Gold.  Von Martin Kloth, dpa",http://www.spiegel.de/sport/sonst/spekulationen-floh-perec-vor-cathy-freeman-a-94645.html,2000-09-21T00:00:00.000Z
"Reisebericht aus Pakistan PDS-Abgeordneter sieht den Westen \"in der Falle der Taliban\" Während der Bundestag am Donnerstag über Afghanistan diskutierte, beendete ein PDS-Abgeordneter eine eigenmächtige Reise nach Pakistan. Statt nur hypothetisch über Flüchtlinge zu reden, suchte er vor Ort praktischen Rat - ohne eine einfache Lösung zu finden. Von Holger Kulick Pakistan-Reisender aus eigenem Antrieb: PDS-Bundestagsabgeordneter Hübner Berlin/Islamabad - Nachdem die Grünen-Vorsitzende Claudia Roth bereits in der vergangenen Woche für einen Tag nach Pakistan reiste, flog am Sonntag der PDS-Obmann im Menschenrechtsausschuss, der 32-jährige Carsten Hübner, auf eigene Faust hinterher, um Informationen \"aufzusaugen\". Das vielfach vorgetragene \"Allwissen ohne Augenschein\" einiger Bundestags-Kollegen mache ihn misstrauisch, begründete Hübner seine Kurz-Expedition. Aber auch vor Ort sei er \"auf viele Wahrheiten\" gestoßen, die nicht einfach zu bewerten seien.  Kurz vor seinem Rückflug aus Islamabad schilderte er am Donnerstag SPIEGEL ONLINE seine Sicht über das, was er vor Ort von Uno-Vertretern, Hilfsorganisationen und Afghanen erfuhr.  Stützen die Bomben die Taliban? DPA Das Dilemma des Krieges: Wen treffen die Bomben und Flugabwehrraketen wirklich? Bei seinen Gesprächen habe er den Eindruck gewonnen, das fortgesetzte Bombardement stärke dem Taliban-Regime den Rücken, meint Hübner. Mit jedem Bombenabwurf steige das Risiko für die Zivilbevölkerung. Selbst für Einheimische sei oft schwer auszumachen, welche Truppen ein Lager oder eine Ortschaft beherberge. Zudem seien Kämpfer der Taliban äußerlich kaum zu erkennen, auch die Lager von Minenräumern seien aus der Distanz von denen der Kämpfer nicht zu unterscheiden. Dass am Mittwoch ein Flüchtlings-Lkw mit bis zu 21 Mitfahrern möglicherweise einem US-Geschoss zum Opfer fiel, sei auf einen solchen \"Irrtum\" zurückzuführen, vermutet der PDS-Abgeordnete. Dadurch wachse aber die Verbitterung auch unter Nicht-Taliban-Angehörigen. Und auf diesen Zorn würden die Taliban setzen. Somit seien die USA in eine Solidarisierungs-Falle getappt, fürchtet er.  DPA Die Taliban der al-Qaida - vergleichbar mit den Nazis? Die Flucht vieler Familien aus den Städten käme den Taliban-Truppen zugute, glaubt Hübner. Diese würden anschließend in die leeren Häuser eindringen, um sich dort zu verschanzen, will er erfahren haben. Erfolgversprechender als der von Präsident Bush angekündigte Bodenkampf sei es daher, gegen die Hintermänner der Taliban in Pakistan vorzugehen, die dem Regime in Kabul immer neue Kämpfer zuführen. \"Diese Taliban-Ideologen\", so Hübner, seien \"so reaktionär und teils auch so geachtet, wie es die Nazis in Deutschland waren\". Darum bedürfe es einer intensiven Kampagne zur Aufklärung der Bevölkerung, mit der die geistlichen Brandstifter demaskiert und isoliert werden können.   Kontensperrungen weitgehend wirkungslos Pakistanische Bankexperten, so berichtet Hübner, halten die von den Amerikanern und ihren Verbündeten verfügte Sperrung der Konten von talibannahen Unternehmen und Organisationen für weitgehend wirkungslos. Das \"Spendensammeln\" der Islamisten erfolge in der Regel aus Bargeldvorräten reicher Araber, ohne dass es dabei zu Überweisungen komme, warnen die örtlichen Kenner des Regimes. Zu diesem Finanzierungssystem gehöre die Arbeit mit Codewörtern. So erhalte ein Taliban-Angehöriger nur eine Parole mitgeteilt, wenn er im Ausland bei Geschäftsleuten um Spenden bitte, die den Taliban verbunden sind. Bei Übermittlung dieses Codes erhielte er dann bei Verbindungsleuten des Spenders Gelder ausgezahlt -ohne dass es eine nachvollziehbare Kontobewegung gab, berichtet der PDS-Bundestagsabgeordnete.  Flüchtlinge durch 1,7 Millionen Minen und Sprengkörper bedroht Insbesondere Flüchtlingshilfeorganisationen suchte der Erfurter auf. Nahezu alle hätten wegen der amerikanischen Bombardements bis auf weiteres ihre Arbeit in Afghanistan eingestellt, erfuhr Hübner. Gleichzeitig rechne die Uno mit mindestens einer Million unversorgter neuer Binnenflüchtlinge, die auf dem Weg wären, um in den Bergen Zuflucht zu suchen. Diese Regionen seien aber in der Regel noch nicht minenfrei. DPA Minenfeld Afghanistan: Mehr als 1,7 Millionen Sprengsätze in der Erde Nach Angaben der Uno-Minensuchorganisation Mapa, die Hübner aufsuchte, seien in Afghanistan noch rund 230.000 Anti-Personen-Minen, 10.000 Anti-Panzer-Minen und rund 1,5 Millionen weitere, nicht identifizierte Sprengkörper ungeräumt. Ihre Lage sei großteils bekannt, aber die Amerikaner, so klagten die Helfer gegenüber Hübner, hätten angeblich \"nicht ein einziges Mal\" bei den Experten in Afghanistan nachgefragt, welches die besten Zielgebiete ohne Minenfelder seien, um Lebensmittel abzuwerfen. Auch die benötigten Inhalte habe \"niemand erfragt\". Westen zahlt Hilfsprogramme nicht Anfang der Woche hatte bereits eine Sprecherin des Uno-Welternährungsprogramms (WPF) in Genf darauf aufmerksam gemacht, dass viele Länder ihre Hilfszusagen für Afghanistan nicht einhielten. Für den Winter seien ursprünglich 600 Millionen Dollar zugesagt worden. Von dem im vergangenen Monat vom WFP angeforderten 257 Millionen Dollar seien aber gerade einmal ein Drittel eingetroffen. Auch das trage nicht dazu bei, den Westen in der Region glaubwürdiger zu machen, meint Hübner.  Zum Abschluss seines Gesprächs mit SPIEGEL ONLINE geht der PDS-Mann in sich. Vieles klinge ja, als ob er nun die Weisheit mit Löffeln gefressen habe, aber das sehe er nicht. Er habe nur dazugelernt - und kehre nun mit tausend neuen Fragen zurück.",http://www.spiegel.de/politik/deutschland/reisebericht-aus-pakistan-pds-abgeordneter-sieht-den-westen-in-der-falle-der-taliban-a-163027.html,2001-10-18T00:00:00.000Z
"Krieg der Worte Wer steckt hinter der afghanischen Nachrichtenagentur AIP? Die Nachrichtenagentur AIP versorgt die Welt mit Neuigkeiten aus Afghanistan. Hinter dem Kürzel verbirgt sich ein Mann, sein Fax und ein Telefon. Peschawar - Die Taliban in Afghanistan rufen zum Krieg auf, aus einem Dorf melden sie 160 tote Zivilisten nach einem US-Angriff: Wenn  westliche Medien diese Nachrichten aus dem Kriegsland verbreiten, greifen sie  häufig auf Berichte der Afghan Islamic Press (AIP) zurück. Hinter dem Namen der Agentur im pakistanischen Peschawar unweit der  afghanischen Grenze verbirgt sich ein einziger Mann: Mohammed Jakub Scharafat.  Sein Kürzel AIP kennen die Leser mittlerweile weltweit, denn die Agentur zählt die  großen internationalen Nachrichtenagenturen wie Reuters und Associated Press zu ihren Kunden. Scharafat, 1958 geboren, war knapp 20, als er vor den Kommunisten nach  Pakistan floh. Als 1979 sowjetische Truppen nach Afghanistan einmarschierten,  gründete Scharafats Onkel eine Miliz, wurde zu einem Mudschahid, einem  heiligen Krieger gegen die Besatzer. Scharafat selbst ärgerte sich über die Nachrichten,  die er hörte. Die sowjetische Perspektive sei das gewesen, meint er, nicht die der  Mudschahidin. \"Deshalb habe ich AIP gegründet\", sagt er heute. \"Ich wollte, dass  die Welt die Wahrheit über den Widerstand gegen die sowjetischen Truppen  erfährt.\"  Das war 1982. Dieser Tage, zur Zeit eines weiteren Angriffs der USA und  Großbritanniens auf vermutete Stellungen der Taliban und ihres Gastes, dem  Terroristenchef Osama Bin Laden, sitzt Scharafat in seinem Büro in Peshawar in  Pakistan, das eher einer Garage mit einem Teppich und ein paar Möbeln gleicht.  Das Telefon klingelt, ein Sprecher der Taliban-Gegner ruft von seinem  Satellitentelefon im Norden Afghanistan aus an. Er behauptet, die Nordallianz sei  gegen die Taliban vormarschiert.   Scharafat macht sich ein paar Notizen, dann telefoniert er mit einem Sprecher der  Taliban, schließlich mit einem seiner Informanten in Afghanistan. Das dauert, es gibt  kaum Telefonverbindungen dorthin. Als Scharafat meint, genug zu wissen, schreibt  er in schwungvollen Buchstaben auf Urdu, der Sprache Pakistans, seine Nachricht  auf ein Blatt mit AIP-Briefkopf. Computer sind Scharafat suspekt. Seine handschriftlichen Berichte steckt er in sein Fax-Gerät, und schon geht die  Meldung an seine Kunden. Diese Technik benutzt er seit zehn Jahren.  Die internationalen Agenturen verbreiten seine Berichte meist mit dem Zusatz, \"wie die Taliban-nahe Agentur AIP meldete\". Scharafat selbst hält seinen Nachrichtendienst für \"neutral\", wie er einem Korrespondenten der \"tageszeitung\" sagte. Scharafat hat drei Mitarbeiter in Afghanistan und drei in Pakistan, schreibt aber alles selbst. \"Nachrichten zu sammeln und zu verbreiten ist nicht das Problem\", sagt Scharafat,  \"das Problem ist, sich immer der Wahrheit sicher zu sein und glaubwürdig zu  bleiben.\" Natürlich habe er aber gewisse Sympathien für die Taliban: Die Koranschüler seien gute Muslime mit ein paar Fehlern. Frauen zu schlagen und ihnen die Ausbildung zu verweigern widerspräche den islamischen Prinzipien. Osama Bin Laden hält er aber offenbar für unschuldig: \"Der hat gar nicht die Mittel für einen großen Terrorakt\", sagte er der \"taz\". Er glaube eher an eine Verschwörung des israelischen Mossad. Trotz dieser Ansichten ist Scharafat wohl kein Sprachrohr der Taliban. Der AIP-Chef sei immer auf der Suche nach der Wahrheit, sagen pakistanische Journalisten. Er versuche immer Angaben der Taliban auch unabhängig nachzuprüfen. Mit seiner Frau, drei Söhnen und vier Töchtern lebt er in einer  Flüchtlingskolonie außerhalb Peschawars. Dort finanziert er eine Schule für  Mädchen. In Afghanistan unter den Taliban wäre das nicht möglich.",http://www.spiegel.de/politik/ausland/krieg-der-worte-wer-steckt-hinter-der-afghanischen-nachrichtenagentur-aip-a-163069.html,2001-10-18T00:00:00.000Z
"Nahost Attentäterin träumte vom Tod als \"Märtyrerin\" Die palästinensische Bombenattentäterin, die am Sonntag im Zentrum Jerusalems sich selbst und einen Israeli tötete, ist identifiziert. Sie wollte offenbar als \"Märtyrerin\" sterben. Ramallah - Die palästinensische Polizei erklärte, bei der Frau handelt es sich um die 28-jährige Wafa Idris. Entgegen anderslautender Annahmen stammt sie aus einem Flüchtlingslager bei Ramallah im Westjordanland. Idris gehörte den Angaben zufolge den Al-Aksa-Brigaden an, dem militanten Arm der Fatah-Organisation von Palästinenserpräsident Jassir Arafat, die in den vergangenen Wochen eine Reihe blutiger Anschläge in Israel verübt haben. Keine der bekannten Gruppen hatte sich jedoch nach dem Anschlag zu der Tat bekannt, bei der 150 Menschen verletzt wurden.  Familienangehörige sagten am Mittwoch, Idris sei selbst kein Fatah-Mitglied gewesen, habe aber Freunde gehabt, die in den Al-Aksa- Brigaden aktiv gewesen seien. Sie habe häufig an palästinensischen Protestmärschen und Demonstrationen teilgenommen. Die Attentäterin war etwa zehn Jahre verheiratet, habe sich aber vor drei Jahren scheiden lassen, weil sie keine Kinder bekommen konnte. Danach habe sie freiwillig für den palästinensischen Roten Halbmond, das islamische Gegenstück zum Roten Kreuz, gearbeitet.  \"Ich hätte nie geglaubt, dass sie so etwas tun könnte Die junge Frau war nach Angaben ihrer Familie nicht religiös. Sie habe jedoch in den vergangenen zwei Wochen ihres Lebens plötzlich eine Kopfbedeckung getragen und nicht mehr am Familientisch gegessen. Häufig habe sie den Wunsch geäußert, eine \"Märtyrerin\" zu werden, die arabische Bezeichnung für Selbstmordattentäter. Ihre Mutter, eine 62 Jahre alte Witwe, habe jedoch niemals geglaubt, dass sie diesen Wunsch in die Tat umsetzen würde. \"Ich hätte nie gedacht, dass sie so etwas tun würde\", sagte die Mutter. \"Ich hoffe, sie ist im Himmel, weil sie das wollte.\"",http://www.spiegel.de/politik/ausland/nahost-attentaeterin-traeumte-vom-tod-als-maertyrerin-a-179865.html,2002-01-30T00:00:00.000Z
"Überläufer packt aus Nordkorea soll schon Atombomben besitzen Schon seit Jahren ist Nordkorea angeblich im Besitz von Atomwaffen. Das will der bislang ranghöchste übergelaufene nordkoreanische Funktionär von Diktator Kim Jong Il erfahren haben. AP Diktator Kim Jong Il Seoul - Er selbst habe jedoch diese Waffen nie zu Gesicht bekommen, wurde der frühere nordkoreanische Spitzenfunktionär Hwang Jang Yop von südkoreanischen Medien zitiert. Der 78-Jährige trat zum ersten Mal seit seiner Flucht 1997 öffentlich auf einem Seminar über Flüchtlinge aus Nordkorea auf.  Hwang äußerte sich vor dem Hintergrund des neuen Konfliktes zwischen den USA und Nordkorea über dessen mutmaßliches Atomwaffenprogramm. Erst im vergangenen Monat hatte Nordkorea öffentlich mit dem Ausbau seiner atomaren Abschreckung gedroht.  Außer Kim Jong Il hätten ihm auch andere hohe Funktionäre in Pjöngjang gesagt, dass das Land Atomwaffen entwickelt habe, erklärte Hwang nach Angaben der Nachrichtenagentur Yonhap. \"Das Thema wurde mehrfach bei Treffen über internationale Angelegenheiten diskutiert\", sagte der prominente Überläufer. Nordkorea habe mit Pakistan ein Abkommen über die Entwicklung der Technologie zur Anreicherung von atomwaffentauglichem Uran geschlossen, erklärte Hwang weiter.  Hwang, der früher Sekretär der nordkoreanischen Arbeiterpartei war und als Mitbegründer der Staatsideologie der \"Selbstbestimmung\" gilt, hatte während einer offiziellen Reise im Februar 1997 in der südkoreanischen Botschaft in Peking um politisches Asyl nachgesucht.  Zwei Nordkoreaner fliehen übers Gelbe Meer Zwei Nordkoreanern ist unterdessen mit einem kleinen Boot die Flucht über das Gelbe Meer nach Südkorea gelungen. Nach Angaben des Generalstabs in Seoul hatten Soldaten auf einer Insel vor der Westküste das Boot am frühen Morgen an der innerkoreanischen Seegrenze entdeckt und beiden etwa 40-jährigen Männern dann auf die Insel gebracht. Kurz darauf teilte der Staatliche Aufklärungsdienst (Geheimdienst) in Seoul mit, dass erneut mehr als ein Dutzend nordkoreanische Botschaftsflüchtlinge aus China kommend in Südkorea eingetroffen seien.  Die beiden Nordkoreaner in dem Boot seien erschöpft gewesen, hieß es. Bei Befragungen gaben sie an, sie hätten sich nach dem Hören südkoreanischer Radioprogramme zur Flucht entschieden. Zahlreiche Nordkoreaner fliehen jedes Jahr wegen Hunger oder Unzufriedenheit mit dem Regime aus ihrer Heimat. Die meisten setzen sich nach China ab, wo nach Schätzungen mehr als 150.000 nordkoreanische Flüchtlinge im Untergrund leben. Fluchtversuche über die stark bewachte innerkoreanische Grenze oder über das Meer nach Südkorea sind selten.  Die 19 Nordkoreaner, die in einer Gruppe per Flugzeug aus China über Manila nach Seoul kamen, hatten nach ihrer Flucht aus ihrer Heimat in diplomatischen Vertretungen Südkoreas in Peking und Shanghai um Aufnahme gebeten. Wie in ähnlichen Fällen zuvor hatte China den Nordkoreanern die Erlaubnis zur Ausreise erteilt. In diesem Jahr erreichten bisher mehr als 500 nordkoreanische Flüchtlinge Südkorea.",http://www.spiegel.de/politik/ausland/ueberlaeufer-packt-aus-nordkorea-soll-schon-atombomben-besitzen-a-255800.html,2003-07-04T00:00:00.000Z
